Accident_Index,Location_Easting_OSGR,Location_Northing_OSGR,Longitude,Latitude,Police_Force,Accident_Severity,Number_of_Vehicles,Number_of_Casualties,Date,Day_of_Week,Time,Local_Authority_District,Local_Authority_Highway,1st_Road_Class,1st_Road_Number,Road_Type,Speed_limit,Junction_Detail,Junction_Control,2nd_Road_Class,2nd_Road_Number,Pedestrian_Crossing-Human_Control,Pedestrian_Crossing-Physical_Facilities,Light_Conditions,Weather_Conditions,Road_Surface_Conditions,Special_Conditions_at_Site,Carriageway_Hazards,Urban_or_Rural_Area,Did_Police_Officer_Attend_Scene_of_Accident,LSOA_of_Accident_Location,Time_parsed,Hour,Date_parsed,Weekday,Month
200501JI40887,550080,189210,0.164701,51.581719,1,3,2,1,09/12/2005,6,16:00,15,E09000016,3,12,3,30,6,2,5,0,0,5,1,1,2,0,0,1,2,E01002329,2025-12-09 16:00:00,16,2005-09-12,Monday,9.0
200501KD00005,551030,189060,0.178337,51.580117,1,3,1,1,13/01/2005,5,23:37,15,E09000016,3,125,1,30,1,4,3,118,0,0,4,1,2,0,0,1,1,E01002243,2025-12-09 23:37:00,23,,,
200501KD00007,554800,188530,0.232471,51.574333,1,3,1,1,22/01/2005,7,05:54,15,E09000016,6,0,6,30,0,-1,-1,0,0,0,4,1,2,0,0,1,1,E01002271,2025-12-09 05:54:00,5,,,
200501KD00009,552150,183990,0.192297,51.534262,1,2,1,1,22/01/2005,7,09:14,15,E09000016,6,0,6,30,3,4,6,0,0,0,1,1,1,0,0,1,1,E01002372,2025-12-09 09:14:00,9,,,
200501KD00010,555900,191850,0.249805,51.603859,1,3,3,5,16/01/2005,1,00:38,15,E09000016,3,12,3,50,0,-1,-1,0,0,0,4,1,2,0,0,2,1,E01002296,2025-12-09 00:38:00,0,,,
200501KD00011,555710,191740,0.247015,51.602923,1,3,2,1,29/01/2005,7,21:19,15,E09000016,3,12,3,50,3,2,5,0,0,0,4,1,1,0,0,1,1,E01002296,2025-12-09 21:19:00,21,,,
200501KD50001,551170,184060,0.178208,51.535155,1,3,1,1,01/01/2005,7,11:05,15,E09000016,4,178,6,40,0,-1,-1,0,0,0,1,1,1,0,0,1,1,E01002375,2025-12-09 11:05:00,11,2005-01-01,Saturday,1.0
200501KD50003,551330,188540,0.18244,51.575365,1,3,1,1,01/01/2005,7,13:30,15,E09000016,6,0,6,30,1,4,6,0,0,0,1,1,1,0,0,1,1,E01002356,2025-12-09 13:30:00,13,2005-01-01,Saturday,1.0
200501KD50006,551440,188200,0.18388,51.57228,1,3,2,1,04/01/2005,3,13:15,15,E09000016,5,0,6,30,0,-1,-1,0,0,0,1,1,1,0,0,1,1,E01002356,2025-12-09 13:15:00,13,2005-04-01,Friday,4.0
200501KD50007,553370,190490,0.212707,51.592334,1,3,2,1,02/01/2005,1,16:21,15,E09000016,3,12,1,30,1,4,3,118,0,0,4,1,1,0,0,1,1,E01002383,2025-12-09 16:21:00,16,2005-02-01,Tuesday,2.0
200501KD50008,551160,189080,0.180221,51.580262,1,3,1,1,03/01/2005,2,10:45,15,E09000016,3,118,3,30,3,4,6,0,0,0,1,1,1,0,0,1,1,E01002353,2025-12-09 10:45:00,10,2005-03-01,Tuesday,3.0
200501KD50009,551200,188100,0.180376,51.571446,1,3,2,1,05/01/2005,4,21:00,15,E09000016,3,125,1,30,1,4,5,0,0,0,4,1,1,0,0,1,1,E01002249,2025-12-09 21:00:00,21,2005-05-01,Sunday,5.0
200501KD50011,552970,187350,0.20557,51.56423,1,3,2,1,08/01/2005,7,19:48,15,E09000016,3,124,6,30,3,4,6,0,0,0,4,1,1,0,0,1,1,E01002321,2025-12-09 19:48:00,19,2005-08-01,Monday,8.0
200501KD50012,551270,191640,0.18291,51.603234,1,3,2,2,06/01/2005,5,16:48,15,E09000016,5,0,6,30,0,-1,-1,0,0,0,4,1,1,0,0,1,1,E01002341,2025-12-09 16:48:00,16,2005-06-01,Wednesday,6.0
200501KD50014,549950,189110,0.162783,51.580855,1,3,1,1,05/01/2005,4,16:15,15,E09000016,3,12,3,50,0,-1,-1,0,0,0,4,1,2,0,0,1,1,E01002244,2025-12-09 16:15:00,16,2005-05-01,Sunday,5.0
200501KD50015,553440,182230,0.210115,51.5181,1,3,2,1,10/01/2005,2,08:35,15,E09000016,3,1306,6,30,6,4,6,0,0,5,1,1,1,0,0,1,1,E01002344,2025-12-09 08:35:00,8,2005-10-01,Saturday,10.0
200501KD50017,558160,189100,0.281174,51.578522,1,3,4,1,05/01/2005,4,11:59,15,E09000016,1,25,3,70,0,-1,-1,0,0,0,1,1,1,0,0,2,1,E01002259,2025-12-09 11:59:00,11,2005-05-01,Sunday,5.0
200501KD50018,550970,188610,0.177279,51.57609,1,3,2,3,12/01/2005,4,20:00,15,E09000016,3,118,1,30,1,4,3,125,0,0,4,1,1,0,0,1,1,E01002356,2025-12-09 20:00:00,20,2005-12-01,Thursday,12.0
200501KD50019,553530,189390,0.214534,51.582407,1,3,3,1,14/01/2005,6,09:07,15,E09000016,5,0,6,30,3,4,6,0,0,0,1,1,2,0,0,1,1,E01002380,2025-12-09 09:07:00,9,,,
200501KD50020,557220,186940,0.266653,51.559379,1,3,2,1,14/01/2005,6,14:35,15,E09000016,5,0,6,30,3,4,6,0,0,0,1,1,1,0,0,1,1,E01002384,2025-12-09 14:35:00,14,,,
200501KD50021,553420,190540,0.21345,51.59277,1,3,2,2,08/01/2005,7,16:35,15,E09000016,5,0,1,30,1,4,3,127,0,0,1,1,1,0,0,1,1,E01002310,2025-12-09 16:35:00,16,2005-08-01,Monday,8.0
200501KD50022,550010,191400,0.164627,51.601415,1,3,2,1,15/01/2005,7,11:00,15,E09000016,6,0,6,30,3,4,6,0,0,0,1,1,1,0,0,1,1,E01002302,2025-12-09 11:00:00,11,,,
200501KD50024,549410,190680,0.155664,51.595105,1,3,2,2,10/01/2005,2,23:40,15,E09000016,5,0,6,30,3,4,6,0,0,0,4,2,2,0,0,1,1,E01002325,2025-12-09 23:40:00,23,2005-10-01,Saturday,10.0
200501KD50025,550960,188670,0.17716,51.576632,1,3,2,2,12/01/2005,4,19:36,15,E09000016,3,118,1,30,1,4,3,125,0,7,4,1,1,0,0,1,1,E01002356,2025-12-09 19:36:00,19,2005-12-01,Thursday,12.0
200501KD50026,555170,187940,0.237545,51.568931,1,3,1,1,16/01/2005,1,14:50,15,E09000016,6,0,6,30,0,-1,-1,0,0,0,1,1,1,0,0,1,2,E01002273,2025-12-09 14:50:00,14,,,
200501KD50027,557140,187880,0.26592,51.567846,1,3,2,1,10/01/2005,2,09:45,15,E09000016,6,0,6,30,0,-1,-1,0,0,0,1,1,1,0,0,1,2,E01002258,2025-12-09 09:45:00,9,2005-10-01,Saturday,10.0
200501KD50028,551340,182720,0.180082,51.523069,1,3,2,1,14/01/2005,6,16:41,15,E09000016,3,1306,6,30,0,-1,-1,0,0,0,4,1,1,0,0,1,1,E01002368,2025-12-09 16:41:00,16,,,
200501KD50029,551350,181220,0.179582,51.509589,1,3,1,1,13/01/2005,5,00:38,15,E09000016,6,0,6,30,0,-1,-1,0,0,0,4,1,2,0,0,2,1,E01002344,2025-12-09 00:38:00,0,,,
200501KD50030,551510,188170,0.184876,51.571992,1,3,1,2,15/01/2005,7,01:22,15,E09000016,5,0,3,30,0,-1,-1,0,0,0,4,1,1,0,0,1,1,E01002350,2025-12-09 01:22:00,1,,,
200501KD50031,552810,187400,0.203285,51.564723,1,3,2,1,01/01/2005,7,18:18,15,E09000016,3,124,6,30,0,-1,-1,0,0,0,4,1,1,0,0,1,1,E01002321,2025-12-09 18:18:00,18,2005-01-01,Saturday,1.0
200501KD50032,551230,190380,0.18179,51.591924,1,3,1,1,13/01/2005,5,07:25,15,E09000016,5,0,3,50,6,2,3,12,0,0,1,1,1,0,0,1,1,E01002334,2025-12-09 07:25:00,7,,,
200501KD50033,553010,190090,0.20734,51.588838,1,3,2,1,14/01/2005,6,08:45,15,E09000016,3,118,6,30,0,-1,-1,0,0,0,1,1,1,0,0,1,1,E01002337,2025-12-09 08:45:00,8,,,
200501KD50034,551680,188520,0.187478,51.575091,1,3,2,1,17/01/2005,2,09:30,15,E09000016,5,0,3,50,6,2,5,0,0,5,1,1,2,0,0,1,3,E01002358,2025-12-09 09:30:00,9,,,
200501KD50035,551290,190240,0.182595,51.59065,1,3,1,1,17/01/2005,2,15:26,15,E09000016,5,0,6,30,3,4,6,0,0,0,1,1,2,0,0,1,1,E01002339,2025-12-09 15:26:00,15,,,
200501KD50036,554970,186860,0.234186,51.559282,1,3,1,1,18/01/2005,3,16:31,15,E09000016,3,124,6,30,0,-1,-1,0,0,0,5,1,1,0,0,1,1,E01002362,2025-12-09 16:31:00,16,,,
200501KD50037,551980,187420,0.191329,51.565127,1,3,2,1,17/01/2005,2,14:15,15,E09000016,3,124,6,30,8,2,6,0,0,0,1,1,1,0,0,1,1,E01002319,2025-12-09 14:15:00,14,,,
200501KD50038,551360,191610,0.184195,51.60294,1,3,4,2,18/01/2005,3,10:00,15,E09000016,5,0,6,30,3,4,6,0,0,0,1,1,1,0,0,1,1,E01002341,2025-12-09 10:00:00,10,,,
200501KD50039,551990,182310,0.189267,51.519211,1,3,1,1,17/01/2005,2,08:55,15,E09000016,4,1335,6,30,0,-1,-1,0,0,0,1,1,2,0,0,1,1,E01002345,2025-12-09 08:55:00,8,,,
200501KD50040,552000,182280,0.189398,51.518938,1,3,1,1,21/01/2005,6,18:05,15,E09000016,4,1335,6,30,0,-1,-1,0,0,0,4,1,2,0,0,1,1,E01002345,2025-12-09 18:05:00,18,,,
200501KD50041,550390,188370,0.168812,51.574089,1,3,2,1,17/01/2005,2,16:01,15,E09000016,3,118,6,30,3,4,6,0,0,4,1,2,2,0,0,1,1,E01002247,2025-12-09 16:01:00,16,,,
200501KD50042,551270,190430,0.182388,51.592362,1,3,2,1,23/01/2005,1,10:33,15,E09000016,3,12,3,50,3,2,6,0,0,0,1,1,1,0,0,1,1,E01002334,2025-12-09 10:33:00,10,,,
200501KD50043,553250,192780,0.211976,51.612942,1,3,2,2,24/01/2005,2,21:15,15,E09000016,5,0,6,50,0,-1,-1,0,0,0,4,2,2,0,0,1,1,E01002312,2025-12-09 21:15:00,21,,,
200501KD50044,551730,189340,0.188553,51.582445,1,3,2,1,28/01/2005,6,15:45,15,E09000016,5,0,6,30,6,4,3,118,0,1,1,2,2,4,0,1,1,E01002354,2025-12-09 15:45:00,15,,,
200501KD50045,551530,187460,0.184858,51.565607,1,2,3,1,26/01/2005,4,18:39,15,E09000016,3,124,6,30,7,4,6,0,0,0,4,1,1,0,0,1,1,E01002249,2025-12-09 18:39:00,18,,,
200501KD50047,550020,189410,0.163921,51.583532,1,3,1,1,25/01/2005,3,15:30,15,E09000016,5,0,6,30,0,-1,-1,0,0,0,1,1,1,0,0,1,1,E01002329,2025-12-09 15:30:00,15,,,
200501KD50048,556940,184810,0.261668,51.54032,1,3,2,1,24/01/2005,2,14:09,15,E09000016,4,1421,6,30,3,4,6,0,0,0,1,1,1,0,0,2,1,E01002385,2025-12-09 14:09:00,14,,,
200501KD50049,552890,181900,0.202051,51.515284,1,3,2,1,24/01/2005,2,21:00,15,E09000016,4,1335,6,30,3,4,4,1335,0,0,4,2,2,0,2,1,1,E01002347,2025-12-09 21:00:00,21,,,
200501KD50050,555330,192050,0.24167,51.605814,1,3,1,1,26/01/2005,4,07:45,15,E09000016,6,0,6,30,3,4,6,0,0,0,1,1,1,0,0,1,1,E01002277,2025-12-09 07:45:00,7,,,
200501KD50051,556980,184700,0.262195,51.53932,1,2,2,3,03/02/2005,5,14:40,15,E09000016,6,0,6,30,0,-1,-1,0,0,0,1,1,1,0,0,2,1,E01002385,2025-12-09 14:40:00,14,2005-03-02,Wednesday,3.0
200501KD50053,552230,187420,0.194933,51.565059,1,3,3,1,22/01/2005,7,14:41,15,E09000016,3,124,6,30,3,2,5,0,0,0,1,1,1,0,0,1,1,E01002319,2025-12-09 14:41:00,14,,,
200501KD50055,552240,183820,0.19352,51.532711,1,3,2,1,28/01/2005,6,15:44,15,E09000016,6,0,6,30,0,-1,-1,0,0,0,4,2,2,0,0,1,1,E01002374,2025-12-09 15:44:00,15,,,
200501KD50056,549820,188080,0.16047,51.571635,1,3,2,1,02/01/2005,1,15:20,15,E09000016,6,0,6,30,0,-1,-1,0,0,0,1,1,1,0,0,1,1,E01002250,2025-12-09 15:20:00,15,2005-02-01,Tuesday,2.0
200501KD50057,553980,191420,0.221914,51.600524,1,3,2,1,26/01/2005,4,11:00,15,E09000016,6,0,6,30,0,-1,-1,0,0,0,1,1,1,0,0,1,2,E01002297,2025-12-09 11:00:00,11,,,
200501KD50058,550880,189270,0.176264,51.582044,1,3,1,1,31/01/2005,2,17:30,15,E09000016,3,125,6,30,3,4,6,0,0,0,4,1,1,0,0,1,3,E01002243,2025-12-09 17:30:00,17,,,
200501KD50059,551250,188100,0.181097,51.571433,1,3,2,1,31/01/2005,2,16:15,15,E09000016,3,125,1,30,1,4,3,125,0,0,1,1,1,0,0,1,1,E01002350,2025-12-09 16:15:00,16,,,
200501KD50061,550460,191350,0.171098,51.600845,1,3,2,1,25/01/2005,3,15:55,15,E09000016,6,0,6,30,3,4,4,1459,0,0,1,1,1,0,0,1,1,E01002301,2025-12-09 15:55:00,15,,,
200501KD50062,551100,191680,0.180474,51.603639,1,3,2,1,19/01/2005,4,17:51,15,E09000016,4,175,6,30,6,2,4,1459,0,0,5,1,2,0,0,1,1,E01002303,2025-12-09 17:51:00,17,,,
200501KD50063,551800,183600,0.187086,51.530852,1,3,1,1,19/01/2005,4,15:39,15,E09000016,3,125,6,30,3,4,6,0,0,1,1,1,1,0,0,1,1,E01002373,2025-12-09 15:39:00,15,,,
200501KD50065,553800,188500,0.218038,51.574337,1,3,3,1,31/01/2005,2,11:40,15,E09000016,5,0,6,30,0,-1,-1,0,0,0,1,1,1,0,0,1,2,E01002274,2025-12-09 11:40:00,11,,,
200501KD50066,553270,189300,0.210745,51.581669,1,3,2,1,27/01/2005,5,13:40,15,E09000016,5,0,3,30,0,-1,-1,0,0,0,1,1,1,0,0,1,2,E01002380,2025-12-09 13:40:00,13,,,
200501KD50068,554000,190840,0.221948,51.595307,1,3,2,1,31/01/2005,2,22:12,15,E09000016,6,0,3,50,3,4,3,12,0,0,4,1,1,0,0,1,1,E01002293,2025-12-09 22:12:00,22,,,
200501KD50069,551010,189030,0.178036,51.579853,1,3,1,1,25/01/2005,3,22:35,15,E09000016,3,118,1,30,1,4,3,125,0,0,4,8,4,0,0,1,1,E01002243,2025-12-09 22:35:00,22,,,
200501KD50071,552980,192460,0.20794,51.61014,1,3,1,1,02/02/2005,4,12:10,15,E09000016,5,0,6,30,0,-1,-1,0,0,0,1,1,1,0,0,1,1,E01002312,2025-12-09 12:10:00,12,2005-02-02,Wednesday,2.0
200501KD50072,555910,185500,0.247133,51.546804,1,3,3,3,04/02/2005,6,16:44,15,E09000016,4,1421,6,30,3,4,6,0,0,0,1,1,1,0,0,1,1,E01002388,2025-12-09 16:44:00,16,2005-04-02,Saturday,4.0
200501KD50073,552560,185790,0.198983,51.550325,1,3,1,1,17/01/2005,2,09:20,15,E09000016,5,0,6,30,7,4,6,0,0,0,1,1,1,0,0,1,1,E01002261,2025-12-09 09:20:00,9,,,
200501KD50074,549560,189340,0.157257,51.583025,1,3,2,1,29/01/2005,7,20:30,15,E09000016,6,0,6,30,3,4,6,0,0,0,4,2,2,0,0,1,1,E01002330,2025-12-09 20:30:00,20,,,
200501KD50075,553930,187910,0.219655,51.569001,1,3,2,2,08/02/2005,3,01:30,15,E09000016,5,0,6,30,3,4,6,0,0,0,4,1,1,0,0,1,2,E01002274,2025-12-09 01:30:00,1,2005-08-02,Tuesday,8.0
200501KD50076,552390,187430,0.197244,51.565106,1,3,2,1,05/02/2005,7,12:30,15,E09000016,3,124,6,30,3,4,6,0,0,0,1,1,1,0,0,1,1,E01002320,2025-12-09 12:30:00,12,2005-05-02,Monday,5.0
200501KD50078,550450,188910,0.169909,51.578925,1,3,2,1,08/02/2005,3,11:02,15,E09000016,5,0,6,30,0,-1,-1,0,0,0,1,1,2,0,0,1,1,E01002243,2025-12-09 11:02:00,11,2005-08-02,Tuesday,8.0
200501KD50079,553120,182480,0.205615,51.520433,1,3,2,1,09/02/2005,4,09:54,15,E09000016,3,1306,6,30,6,2,3,1306,0,5,1,1,2,0,0,1,1,E01002344,2025-12-09 09:54:00,9,2005-09-02,Friday,9.0
200501KD50080,557220,191330,0.268617,51.598821,1,3,3,1,01/02/2005,3,08:16,15,E09000016,1,25,3,70,0,-1,-1,0,0,0,4,1,1,0,0,2,3,E01002296,2025-12-09 08:16:00,8,2005-01-02,Sunday,1.0
200501KD50081,550660,189800,0.173319,51.586865,1,3,1,1,01/02/2005,3,08:25,15,E09000016,3,12,3,50,0,-1,-1,0,0,0,1,1,2,0,0,1,1,E01002340,2025-12-09 08:25:00,8,2005-01-02,Sunday,1.0
200501KD50082,558380,188520,0.284085,51.57325,1,3,1,1,06/02/2005,1,20:19,15,E09000016,1,25,3,70,5,4,3,127,0,0,4,1,1,0,7,2,1,E01002259,2025-12-09 20:19:00,20,2005-06-02,Thursday,6.0
200501KD50083,556670,192390,0.261156,51.608497,1,3,2,1,07/02/2005,2,06:30,15,E09000016,1,25,1,30,1,4,3,12,0,0,4,1,1,0,0,2,1,E01002277,2025-12-09 06:30:00,6,2005-07-02,Saturday,7.0
200501KD50084,551760,188980,0.18883,51.579203,1,3,2,2,08/02/2005,3,16:19,15,E09000016,6,0,6,30,3,4,6,0,0,0,1,1,1,0,0,1,1,E01002357,2025-12-09 16:19:00,16,2005-08-02,Tuesday,8.0
200501KD50085,550970,189150,0.177511,51.580942,1,3,1,1,09/02/2005,4,14:50,15,E09000016,6,0,6,30,3,4,3,125,0,0,1,1,1,0,0,1,1,E01002243,2025-12-09 14:50:00,14,2005-09-02,Friday,9.0
200501KD50086,553460,187190,0.212564,51.56266,1,3,1,1,11/02/2005,6,17:45,15,E09000016,5,0,6,30,3,4,3,124,0,0,1,1,1,0,0,1,1,E01002361,2025-12-09 17:45:00,17,2005-11-02,Wednesday,11.0
200501KD50087,555180,192340,0.239633,51.60846,1,3,2,1,11/02/2005,6,13:50,15,E09000016,5,0,6,30,8,4,5,0,0,0,1,2,2,0,0,1,1,E01002279,2025-12-09 13:50:00,13,2005-11-02,Wednesday,11.0
200501KD50088,553910,190560,0.220527,51.592816,1,3,2,1,11/02/2005,6,08:59,15,E09000016,6,0,6,30,3,4,6,0,0,0,1,1,1,0,0,1,1,E01002293,2025-12-09 08:59:00,8,2005-11-02,Wednesday,11.0
200501KD50089,552140,183950,0.192136,51.533906,1,3,1,1,12/02/2005,7,19:06,15,E09000016,5,0,6,30,0,-1,-1,0,0,1,4,1,2,0,0,1,1,E01002373,2025-12-09 19:06:00,19,2005-12-02,Friday,12.0
200501KD50090,554690,191170,0.232047,51.598083,1,3,2,1,13/02/2005,1,01:27,15,E09000016,5,0,3,50,6,2,3,12,0,0,4,1,1,0,0,1,1,E01002300,2025-12-09 01:27:00,1,,,
200501KD50091,553120,189260,0.208565,51.581351,1,3,2,1,15/02/2005,3,14:15,15,E09000016,5,0,1,30,1,4,5,0,0,1,1,1,1,0,0,1,1,E01002379,2025-12-09 14:15:00,14,,,
200501KD50092,558350,188620,0.283697,51.574157,1,3,4,2,30/01/2005,1,12:15,15,E09000016,1,25,3,70,0,-1,-1,0,0,0,1,1,1,0,0,2,1,E01002259,2025-12-09 12:15:00,12,,,
200501KD50093,551850,189430,0.190323,51.583222,1,3,2,1,12/02/2005,7,11:04,15,E09000016,3,118,6,30,3,4,6,0,0,0,1,1,1,0,0,1,1,E01002354,2025-12-09 11:04:00,11,2005-12-02,Friday,12.0
200501KD50094,551460,182770,0.181832,51.523486,1,3,2,1,11/02/2005,6,07:37,15,E09000016,6,0,6,30,3,4,6,0,0,0,1,1,1,0,0,1,1,E01002369,2025-12-09 07:37:00,7,2005-11-02,Wednesday,11.0
200501KD50095,556600,186690,0.257605,51.557305,1,3,1,1,11/02/2005,6,12:40,15,E09000016,4,187,6,30,0,-1,-1,0,0,0,1,1,1,0,0,1,1,E01002384,2025-12-09 12:40:00,12,2005-11-02,Wednesday,11.0
200501KD50096,555540,191680,0.244536,51.602431,1,3,2,1,01/02/2005,3,08:49,15,E09000016,5,0,3,50,5,2,3,12,0,0,1,1,1,0,0,1,1,E01002283,2025-12-09 08:49:00,8,2005-01-02,Sunday,1.0
200501KD50100,550250,182450,0.164267,51.520934,1,3,2,1,07/02/2005,2,17:30,15,E09000016,3,13,3,30,0,-1,-1,0,0,0,4,1,1,0,0,1,3,E01002368,2025-12-09 17:30:00,17,2005-07-02,Saturday,7.0
200501KD50101,553940,181000,0.216779,51.506913,1,2,1,1,12/02/2005,7,12:30,15,E09000016,6,0,9,30,0,-1,-1,0,0,0,1,1,1,0,0,2,1,E01002344,2025-12-09 12:30:00,12,2005-12-02,Friday,12.0
200501KD50102,556440,188910,0.256287,51.577295,1,3,2,2,14/02/2005,2,15:01,15,E09000016,5,0,7,40,7,4,6,0,0,0,1,1,1,0,0,2,1,E01002253,2025-12-09 15:01:00,15,,,
200501KD50103,558330,188680,0.283436,51.574701,1,3,2,1,15/02/2005,3,10:33,15,E09000016,1,25,3,70,0,-1,-1,0,0,0,1,1,1,0,0,2,1,E01002259,2025-12-09 10:33:00,10,,,
200501KD50104,553340,191090,0.212536,51.597733,1,3,2,1,15/02/2005,3,13:25,15,E09000016,6,0,6,30,3,4,6,0,0,0,1,1,1,0,0,1,1,E01002316,2025-12-09 13:25:00,13,,,
200501KD50105,553810,188590,0.218222,51.575143,1,3,1,1,19/02/2005,7,19:52,15,E09000016,5,0,6,30,3,4,6,0,0,0,4,1,1,0,0,1,1,E01002381,2025-12-09 19:52:00,19,,,
200501KD50106,553280,186820,0.209808,51.559384,1,3,2,2,20/02/2005,1,01:44,15,E09000016,5,0,6,30,3,4,6,0,0,1,4,1,1,0,0,1,1,E01002363,2025-12-09 01:44:00,1,,,
200501KD50107,555030,191560,0.237124,51.601494,1,2,1,3,20/02/2005,1,20:44,15,E09000016,6,0,6,30,0,-1,-1,0,0,0,4,1,1,0,0,1,1,E01002283,2025-12-09 20:44:00,20,,,
200501KD50108,550940,187460,0.176352,51.565765,1,3,2,1,20/02/2005,1,13:30,15,E09000016,3,124,6,30,3,4,3,124,0,0,1,1,1,0,0,1,1,E01002248,2025-12-09 13:30:00,13,,,
200501KD50109,550630,189710,0.172847,51.586065,1,3,2,1,21/02/2005,2,13:15,15,E09000016,3,125,3,30,0,-1,-1,0,0,4,1,1,1,0,0,1,1,E01002340,2025-12-09 13:15:00,13,,,
200501KD50110,553670,186410,0.215251,51.555594,1,3,2,2,23/02/2005,4,17:32,15,E09000016,5,0,6,30,3,4,6,0,0,0,4,2,2,0,0,1,1,E01002291,2025-12-09 17:32:00,17,,,
200501KD50111,550070,191760,0.165647,51.604633,1,3,1,1,23/02/2005,4,08:53,15,E09000016,6,0,6,30,0,-1,-1,0,0,0,1,3,3,0,0,1,1,E01002301,2025-12-09 08:53:00,8,,,
200501KD50112,553420,189350,0.21293,51.582078,1,3,2,1,24/02/2005,5,19:45,15,E09000016,5,0,6,30,3,4,6,0,0,0,4,8,2,0,0,1,1,E01002380,2025-12-09 19:45:00,19,,,
200501KD50113,552620,190690,0.201975,51.594335,1,3,3,1,18/02/2005,6,07:55,15,E09000016,3,12,3,30,0,-1,-1,0,0,0,1,1,2,0,0,2,1,E01002337,2025-12-09 07:55:00,7,,,
200501KD50115,553880,187730,0.218855,51.567397,1,3,2,1,25/01/2005,3,07:52,15,E09000016,6,0,6,30,3,2,6,0,0,0,1,8,2,0,0,1,1,E01002367,2025-12-09 07:52:00,7,,,
200501KD50116,551420,182700,0.181226,51.522868,1,3,2,1,04/02/2005,6,02:35,15,E09000016,3,1306,6,30,3,2,3,1306,0,0,4,1,1,0,0,1,1,E01002370,2025-12-09 02:35:00,2,2005-04-02,Saturday,4.0
200501KD50117,551610,187450,0.186007,51.565496,1,3,2,1,28/01/2005,6,19:15,15,E09000016,3,125,6,30,3,4,3,124,0,5,1,2,2,0,0,1,2,E01002249,2025-12-09 19:15:00,19,,,
200501KD50118,552600,189690,0.201252,51.585355,1,3,2,1,04/02/2005,6,12:45,15,E09000016,6,0,6,30,0,-1,-1,0,0,0,1,1,1,0,0,1,2,E01002379,2025-12-09 12:45:00,12,2005-04-02,Saturday,4.0
200501KD50119,551640,188650,0.186957,51.57627,1,3,2,2,03/02/2005,5,18:55,15,E09000016,5,0,3,30,3,2,6,0,0,5,4,1,1,0,0,1,1,E01002358,2025-12-09 18:55:00,18,2005-03-02,Wednesday,3.0
200501KD50121,553470,188540,0.213298,51.574787,1,3,1,1,09/02/2005,4,21:15,15,E09000016,5,0,6,30,3,4,6,0,0,0,4,1,2,0,0,1,1,E01002381,2025-12-09 21:15:00,21,2005-09-02,Friday,9.0
200501KD50122,551660,189280,0.187518,51.581925,1,3,3,1,14/02/2005,2,11:13,15,E09000016,3,118,6,30,6,4,6,0,0,0,1,1,1,0,0,1,1,E01002357,2025-12-09 11:13:00,11,,,
200501KD50123,549830,189950,0.161411,51.588434,1,3,2,1,05/02/2005,7,15:00,15,E09000016,5,0,6,30,3,4,6,0,0,0,1,1,1,0,0,1,2,E01002329,2025-12-09 15:00:00,15,2005-05-02,Monday,5.0
200501KD50124,550390,189240,0.169185,51.581906,1,3,2,1,20/02/2005,1,18:25,15,E09000016,6,0,6,30,6,4,6,0,0,0,4,1,1,0,0,1,1,E01002245,2025-12-09 18:25:00,18,,,
200501KD50125,552050,182200,0.190084,51.518206,1,3,2,1,25/02/2005,6,15:53,15,E09000016,4,1335,6,30,3,4,4,1335,0,0,1,1,1,0,0,1,1,E01002345,2025-12-09 15:53:00,15,,,
200501KD50126,551440,182700,0.181514,51.522862,1,3,2,1,25/02/2005,6,21:45,15,E09000016,3,1306,6,60,6,4,3,1306,0,0,4,1,1,0,0,1,1,E01002370,2025-12-09 21:45:00,21,,,
200501KD50127,553110,182000,0.205263,51.516123,1,3,2,1,26/02/2005,7,06:57,15,E09000016,6,0,6,30,0,-1,-1,0,0,0,1,1,2,0,0,1,1,E01002344,2025-12-09 06:57:00,6,,,
200501KD50128,550480,182990,0.16781,51.525725,1,3,2,1,27/02/2005,1,01:16,15,E09000016,3,1306,3,50,0,-1,-1,0,0,0,4,3,3,0,0,1,1,E01002368,2025-12-09 01:16:00,1,,,
200501KD50129,554790,190180,0.233053,51.589161,1,3,1,1,03/03/2005,5,20:07,15,E09000016,5,0,6,30,3,4,5,0,0,1,4,1,2,0,0,1,1,E01002294,2025-12-09 20:07:00,20,2005-03-03,Thursday,3.0
200501KD50130,556090,186850,0.250325,51.558884,1,3,1,2,02/02/2005,4,00:01,15,E09000016,5,0,6,30,0,-1,-1,0,0,0,4,1,1,0,0,1,2,E01002257,2025-12-09 00:01:00,0,2005-02-02,Wednesday,2.0
200501KD50131,552370,187430,0.196955,51.565111,1,3,1,1,17/02/2005,5,05:00,15,E09000016,3,124,6,30,0,-1,-1,0,0,0,4,2,2,0,0,1,1,E01002320,2025-12-09 05:00:00,5,,,
200501KD50133,549200,190960,0.152753,51.597676,1,3,2,1,18/02/2005,6,07:55,15,E09000016,4,174,6,50,0,-1,-1,0,0,0,1,1,1,0,0,1,1,E01002331,2025-12-09 07:55:00,7,,,
200501KD50134,552040,187410,0.192189,51.565021,1,3,2,1,25/02/2005,6,13:15,15,E09000016,3,124,3,30,3,4,6,0,0,0,1,1,1,0,0,1,2,E01002319,2025-12-09 13:15:00,13,,,
200501KD50135,557190,186690,0.266109,51.557141,1,3,2,1,02/03/2005,4,19:11,15,E09000016,5,0,1,30,2,4,4,187,0,0,4,3,3,0,0,1,1,E01002391,2025-12-09 19:11:00,19,2005-02-03,Thursday,2.0
200501KD50136,556220,183510,0.250717,51.528839,1,3,2,1,27/02/2005,1,09:28,15,E09000016,5,0,6,30,7,4,5,0,0,0,1,1,2,0,0,2,1,E01002385,2025-12-09 09:28:00,9,,,
200501KD50137,551790,187320,0.188546,51.564279,1,3,2,1,21/02/2005,2,13:30,15,E09000016,3,125,6,30,3,4,6,0,0,0,1,1,1,0,0,1,1,E01002319,2025-12-09 13:30:00,13,,,
200501KD50138,552980,192440,0.207931,51.60996,1,3,2,2,28/02/2005,2,09:00,15,E09000016,5,0,6,30,3,4,5,0,0,0,1,2,4,0,0,1,1,E01002313,2025-12-09 09:00:00,9,,,
200501KD50139,551240,188050,0.180931,51.570986,1,3,2,1,01/03/2005,3,07:36,15,E09000016,5,0,1,30,1,4,3,125,0,0,1,3,2,0,0,1,1,E01002249,2025-12-09 07:36:00,7,2005-01-03,Monday,1.0
200501KD50140,552620,187400,0.200546,51.564774,1,3,4,1,01/03/2005,3,10:38,15,E09000016,3,124,6,30,0,-1,-1,0,0,0,1,1,2,0,0,1,1,E01002321,2025-12-09 10:38:00,10,2005-01-03,Monday,1.0
200501KD50147,550970,188610,0.177279,51.57609,1,3,2,2,08/01/2005,7,14:25,15,E09000016,3,125,6,30,7,4,3,118,0,0,1,1,1,0,0,1,2,E01002356,2025-12-09 14:25:00,14,2005-08-01,Monday,8.0
200501KD50148,549510,191010,0.157247,51.598043,1,3,2,1,02/03/2005,4,19:44,15,E09000016,4,174,6,30,3,4,6,0,0,0,4,1,2,0,0,1,1,E01002326,2025-12-09 19:44:00,19,2005-02-03,Thursday,2.0
200501KD50149,556070,186780,0.250006,51.55826,1,3,1,1,06/03/2005,1,19:45,15,E09000016,5,0,6,30,3,4,6,0,0,4,4,1,1,0,0,1,1,E01002386,2025-12-09 19:45:00,19,2005-06-03,Friday,6.0
200501KD50150,551610,183120,0.184143,51.526591,1,3,2,1,03/03/2005,5,09:30,15,E09000016,6,0,6,30,6,4,6,0,0,0,1,8,4,0,0,1,1,E01002371,2025-12-09 09:30:00,9,2005-03-03,Thursday,3.0
200501KD50151,553430,189360,0.213079,51.582165,1,3,2,1,06/03/2005,1,11:15,15,E09000016,5,0,6,30,8,4,6,0,0,0,1,1,1,0,0,1,1,E01002380,2025-12-09 11:15:00,11,2005-06-03,Friday,6.0
200501KD50152,551210,190410,0.181514,51.592199,1,3,2,1,14/03/2005,2,12:20,15,E09000016,3,12,3,30,6,2,5,0,0,5,1,1,1,0,0,1,2,E01002334,2025-12-09 12:20:00,12,,,
200501KD50154,554410,188670,0.226909,51.575698,1,3,1,1,04/03/2005,6,10:55,15,E09000016,6,0,6,30,3,4,6,0,0,0,1,3,4,0,0,1,1,E01002271,2025-12-09 10:55:00,10,2005-04-03,Sunday,4.0
200501KD50155,551750,189350,0.188846,51.58253,1,3,2,1,05/03/2005,7,19:13,15,E09000016,3,118,6,30,6,4,5,0,0,1,4,1,1,0,0,1,1,E01002354,2025-12-09 19:13:00,19,2005-05-03,Tuesday,5.0
200501KD50156,555820,191800,0.248629,51.603432,1,2,1,1,03/03/2005,5,16:20,15,E09000016,6,0,6,30,8,4,3,12,0,0,1,1,1,0,0,1,1,E01002296,2025-12-09 16:20:00,16,2005-03-03,Thursday,3.0
200501KD50157,550620,188430,0.172155,51.574566,1,3,3,1,07/03/2005,2,12:15,15,E09000016,3,118,6,30,0,-1,-1,0,0,0,1,1,1,0,0,1,1,E01002356,2025-12-09 12:15:00,12,2005-07-03,Sunday,7.0
200501KD50158,552770,182390,0.200536,51.519719,1,3,1,1,08/03/2005,3,08:27,15,E09000016,5,0,6,30,3,4,6,0,0,0,1,1,2,0,0,1,1,E01002342,2025-12-09 08:27:00,8,2005-08-03,Wednesday,8.0
200501KD50159,553880,190460,0.22005,51.591926,1,3,2,3,08/03/2005,3,22:22,15,E09000016,6,0,6,30,8,4,6,0,0,0,4,2,2,0,0,1,1,E01002293,2025-12-09 22:22:00,22,2005-08-03,Wednesday,8.0
200501KD50160,551560,183800,0.183715,51.532714,1,3,2,1,10/03/2005,5,17:25,15,E09000016,3,125,6,30,0,-1,-1,0,0,0,4,1,1,0,0,1,1,E01002375,2025-12-09 17:25:00,17,2005-10-03,Monday,10.0
200501KD50161,549440,188310,0.155088,51.573802,1,3,2,2,11/03/2005,6,09:30,15,E09000016,6,0,3,50,3,4,3,118,0,0,1,1,1,0,0,1,2,E01002250,2025-12-09 09:30:00,9,2005-11-03,Thursday,11.0
200501KD50162,550900,188560,0.176248,51.57566,1,3,2,1,10/03/2005,5,15:05,15,E09000016,3,118,6,30,0,-1,-1,0,0,0,1,1,1,0,0,1,1,E01002356,2025-12-09 15:05:00,15,2005-10-03,Monday,10.0
200501KD50163,553850,188930,0.218948,51.578187,1,3,3,1,07/03/2005,2,17:50,15,E09000016,5,0,6,30,3,4,6,0,0,0,4,2,2,0,0,1,1,E01002381,2025-12-09 17:50:00,17,2005-07-03,Sunday,7.0
200501KD50164,551750,189360,0.18885,51.582619,1,3,2,1,12/03/2005,7,15:36,15,E09000016,5,0,6,30,6,4,3,118,0,0,1,1,1,0,0,1,1,E01002354,2025-12-09 15:36:00,15,2005-12-03,Saturday,12.0
200501KD50165,551020,182090,0.175203,51.517494,1,3,2,2,12/03/2005,7,02:05,15,E09000016,3,13,3,70,0,-1,-1,0,0,0,4,2,2,0,0,2,1,E01002370,2025-12-09 02:05:00,2,2005-12-03,Saturday,12.0
200501KD50166,556440,188910,0.256287,51.577295,1,3,2,1,07/03/2005,2,17:58,15,E09000016,5,0,6,30,5,4,6,0,0,0,4,2,2,0,0,2,1,E01002253,2025-12-09 17:58:00,17,2005-07-03,Sunday,7.0
200501KD50167,554350,191850,0.227441,51.604286,1,3,2,3,11/03/2005,6,19:15,15,E09000016,5,0,6,30,3,4,5,0,0,0,4,1,1,0,0,1,2,E01002284,2025-12-09 19:15:00,19,2005-11-03,Thursday,11.0
200501KD50168,551920,183330,0.188699,51.528394,1,3,1,1,12/03/2005,7,13:10,15,E09000016,6,0,6,30,0,-1,-1,0,0,0,1,1,1,0,0,1,1,E01002371,2025-12-09 13:10:00,13,2005-12-03,Saturday,12.0
200501KD50170,553290,187400,0.210205,51.564593,1,2,3,1,26/03/2005,7,12:21,15,E09000016,6,0,6,30,0,-1,-1,0,0,0,1,1,1,0,0,1,1,E01002318,2025-12-09 12:21:00,12,,,
200501KD50171,551790,186650,0.188257,51.558259,1,3,3,1,13/03/2005,1,10:30,15,E09000016,3,125,6,30,3,4,6,0,0,0,1,1,1,0,0,1,1,E01002322,2025-12-09 10:30:00,10,,,
200501KD50173,552820,185870,0.202765,51.550973,1,3,3,1,15/03/2005,3,13:29,15,E09000016,6,0,6,30,0,-1,-1,0,0,0,1,1,1,0,0,1,2,E01002366,2025-12-09 13:29:00,13,,,
200501KD50174,552030,182350,0.189861,51.519559,1,3,2,1,14/03/2005,2,06:50,15,E09000016,4,1335,6,30,1,4,6,0,0,0,1,1,1,0,0,1,1,E01002345,2025-12-09 06:50:00,6,,,
200501KD50175,554670,191180,0.231763,51.598178,1,3,2,1,18/03/2005,6,22:20,15,E09000016,5,0,3,40,6,2,3,12,0,5,4,1,1,0,0,1,1,E01002300,2025-12-09 22:20:00,22,,,
200501KD50176,553390,190550,0.213022,51.592868,1,3,2,1,15/03/2005,3,07:19,15,E09000016,6,0,1,30,1,4,3,12,0,4,1,1,1,0,0,1,1,E01002310,2025-12-09 07:19:00,7,,,
200501KD50177,551590,188010,0.18596,51.570533,1,3,2,1,13/03/2005,1,20:30,15,E09000016,5,0,1,30,1,4,5,0,0,0,4,1,1,0,0,1,2,E01002350,2025-12-09 20:30:00,20,,,
200501KD50178,551240,188050,0.180931,51.570986,1,3,3,1,15/03/2005,3,13:00,15,E09000016,3,125,6,30,1,4,6,0,0,0,1,1,1,0,0,1,1,E01002249,2025-12-09 13:00:00,13,,,
200501KD50179,553400,190520,0.213153,51.592595,1,3,2,1,16/03/2005,4,05:00,15,E09000016,3,12,1,30,1,4,3,127,0,0,4,1,1,0,0,1,1,E01002293,2025-12-09 05:00:00,5,,,
200501KD50180,550390,183070,0.166548,51.526467,1,3,1,1,17/03/2005,5,16:15,15,E09000016,6,0,6,30,8,4,6,0,0,0,1,1,1,0,0,1,2,E01002368,2025-12-09 16:15:00,16,,,
200501KD50181,550980,188610,0.177423,51.576087,1,2,1,2,13/03/2005,1,04:00,15,E09000016,3,125,1,30,1,4,3,118,0,0,4,1,1,0,0,1,1,E01002356,2025-12-09 04:00:00,4,,,
200501KD50182,553880,191260,0.220401,51.599113,1,3,2,1,04/03/2005,6,09:00,15,E09000016,6,0,6,30,3,4,6,0,0,0,1,3,3,0,0,1,2,E01002316,2025-12-09 09:00:00,9,2005-04-03,Sunday,4.0
200501KD50183,553670,190660,0.217109,51.59378,1,2,4,2,14/03/2005,2,15:40,15,E09000016,3,12,3,50,3,4,6,0,0,0,1,1,1,0,0,1,1,E01002293,2025-12-09 15:40:00,15,,,
200501KD50184,552200,187510,0.194539,51.565876,1,3,3,1,14/03/2005,2,12:00,15,E09000016,5,0,6,30,3,4,6,0,0,0,1,1,1,0,0,1,1,E01002319,2025-12-09 12:00:00,12,,,
200501KD50185,556300,186970,0.253406,51.559904,1,3,2,1,17/03/2005,5,15:36,15,E09000016,6,0,6,30,3,4,6,0,0,0,1,1,1,0,0,1,1,E01002257,2025-12-09 15:36:00,15,,,
200501KD50186,552020,183430,0.190182,51.529266,1,2,1,1,18/03/2005,6,12:55,15,E09000016,5,0,6,30,0,-1,-1,0,0,0,1,1,1,0,0,1,1,E01002374,2025-12-09 12:55:00,12,,,
200501KD50187,550990,191360,0.178749,51.600793,1,3,3,1,19/03/2005,7,16:10,15,E09000016,6,0,6,30,3,4,4,175,0,0,1,1,1,0,0,1,2,E01002303,2025-12-09 16:10:00,16,,,
200501KD50188,554670,180610,0.227119,51.50321,1,3,2,2,19/03/2005,7,13:33,15,E09000016,3,1306,6,60,6,4,6,0,0,0,1,1,1,0,0,2,1,E01002344,2025-12-09 13:33:00,13,,,
200501KD50189,550370,188960,0.168776,51.579395,1,3,2,1,20/03/2005,1,18:37,15,E09000016,5,0,6,30,3,4,6,0,0,0,1,1,1,0,0,1,1,E01002245,2025-12-09 18:37:00,18,,,
200501KD50190,551950,188200,0.191233,51.572143,1,3,2,1,21/03/2005,2,09:05,15,E09000016,5,0,6,30,2,4,5,0,0,0,1,1,1,0,0,1,1,E01002351,2025-12-09 09:05:00,9,,,
200501KD50191,553770,190420,0.218446,51.591596,1,3,2,1,05/03/2005,7,16:00,15,E09000016,6,0,6,30,3,4,6,0,0,0,1,2,2,0,0,1,1,E01002293,2025-12-09 16:00:00,16,2005-05-03,Tuesday,5.0
200501KD50192,551550,181590,0.182621,51.51286,1,3,2,2,16/03/2005,4,00:10,15,E09000016,3,13,3,70,5,4,5,0,0,0,4,1,1,0,0,2,1,E01002344,2025-12-09 00:10:00,0,,,
200501KD50193,554750,190590,0.232657,51.592855,1,3,2,1,18/03/2005,6,15:30,15,E09000016,5,0,6,30,8,4,5,0,0,0,1,1,1,0,0,1,2,E01002293,2025-12-09 15:30:00,15,,,
200501KD50194,552490,183930,0.197169,51.533632,1,3,1,1,21/03/2005,2,19:59,15,E09000016,6,0,6,30,3,4,6,0,0,0,4,1,1,0,0,1,1,E01002372,2025-12-09 19:59:00,19,,,
200501KD50195,550120,188390,0.164928,51.57434,1,2,2,1,17/03/2005,5,17:31,15,E09000016,6,0,6,30,3,4,3,118,0,4,1,1,1,0,0,1,1,E01002246,2025-12-09 17:31:00,17,,,
200501KD50196,551550,189710,0.186117,51.585818,1,3,3,1,22/03/2005,3,09:08,15,E09000016,5,0,6,30,3,4,6,0,0,0,1,2,2,0,0,1,1,E01002339,2025-12-09 09:08:00,9,,,
200501KD50197,550630,189740,0.17286,51.586334,1,3,2,1,30/03/2005,4,19:20,15,E09000016,3,12,3,50,6,2,3,125,0,5,4,1,1,0,0,1,1,E01002340,2025-12-09 19:20:00,19,,,
200501KD50198,553900,185760,0.218282,51.549692,1,3,1,1,25/03/2005,6,12:00,15,E09000016,5,0,6,30,3,4,6,0,0,0,1,1,1,0,0,1,1,E01002285,2025-12-09 12:00:00,12,,,
200501KD50200,552540,184240,0.198024,51.536404,1,3,2,1,03/04/2005,1,10:20,15,E09000016,5,0,6,30,3,4,6,0,0,0,1,1,1,0,0,1,1,E01002372,2025-12-09 10:20:00,10,2005-03-04,Friday,3.0
200501KD50201,554350,191840,0.227437,51.604196,1,3,2,1,31/03/2005,5,08:05,15,E09000016,5,0,6,30,3,4,5,0,0,0,1,1,1,0,0,1,2,E01002284,2025-12-09 08:05:00,8,,,
200501KD50202,552970,192440,0.207787,51.609963,1,3,2,2,30/03/2005,4,17:15,15,E09000016,5,0,3,30,3,2,5,0,0,5,4,1,1,0,0,2,2,E01002313,2025-12-09 17:15:00,17,,,
200501KD50204,556720,192490,0.261922,51.609382,1,3,2,2,27/03/2005,1,13:00,15,E09000016,1,25,1,70,1,2,3,12,0,0,1,1,1,0,0,2,1,E01002277,2025-12-09 13:00:00,13,,,
200501KD50205,551350,188370,0.182655,51.573832,1,3,2,1,29/03/2005,3,23:28,15,E09000016,6,0,6,30,8,4,6,0,0,1,4,2,2,0,0,1,1,E01002356,2025-12-09 23:28:00,23,,,
200501KD50206,553880,191250,0.220397,51.599024,1,3,2,2,29/03/2005,3,11:51,15,E09000016,6,0,6,30,3,4,6,0,0,0,1,1,1,0,0,1,1,E01002293,2025-12-09 11:51:00,11,,,
200501KD50207,550610,189740,0.172572,51.586339,1,3,2,1,01/04/2005,6,11:22,15,E09000016,3,12,3,50,6,2,4,174,0,0,1,1,1,0,0,1,1,E01002338,2025-12-09 11:22:00,11,2005-01-04,Tuesday,1.0
200501KD50208,551940,185860,0.190078,51.551121,1,3,2,1,04/04/2005,2,10:45,15,E09000016,3,125,2,30,0,-1,-1,0,0,0,1,1,1,0,0,1,1,E01002260,2025-12-09 10:45:00,10,2005-04-04,Monday,4.0
200501KD50209,552120,182100,0.191049,51.517289,1,3,1,1,29/03/2005,3,00:01,15,E09000016,4,1335,1,30,2,4,4,1335,0,0,4,1,1,0,0,1,2,E01002345,2025-12-09 00:01:00,0,,,
200501KD50210,550620,189760,0.172725,51.586516,1,2,2,2,09/04/2005,7,00:31,15,E09000016,3,12,3,50,6,4,4,174,0,0,4,1,1,0,0,1,1,E01002338,2025-12-09 00:31:00,0,2005-09-04,Sunday,9.0
200501KD50211,556220,183490,0.250709,51.528659,1,3,3,2,30/03/2005,4,07:16,15,E09000016,5,0,6,30,3,4,5,0,0,0,1,2,2,0,0,2,1,E01015924,2025-12-09 07:16:00,7,,,
200501KD50212,551560,188820,0.185877,51.577819,1,3,2,2,02/04/2005,7,02:55,15,E09000016,5,0,1,30,1,4,5,0,0,1,4,1,1,0,0,1,1,E01002357,2025-12-09 02:55:00,2,2005-02-04,Friday,2.0
200501KD50213,552800,181930,0.200768,51.515578,1,3,2,3,26/03/2005,7,11:35,15,E09000016,4,1335,6,30,0,-1,-1,0,0,0,1,1,1,0,0,1,1,E01002346,2025-12-09 11:35:00,11,,,
200501KD50214,558440,188320,0.28486,51.571436,1,3,2,2,05/04/2005,3,14:30,15,E09000016,1,25,3,30,1,4,3,127,0,0,1,1,1,0,0,2,1,E01002252,2025-12-09 14:30:00,14,2005-05-04,Wednesday,5.0
200501KD50215,552780,187400,0.202853,51.564731,1,3,2,1,03/04/2005,1,15:08,15,E09000016,3,124,6,30,3,4,6,0,0,0,1,1,1,0,0,1,1,E01002321,2025-12-09 15:08:00,15,2005-03-04,Friday,3.0
200501KD50216,554130,186040,0.221719,51.552145,1,3,2,1,07/04/2005,5,18:32,15,E09000016,6,0,6,30,6,4,6,0,0,0,1,2,2,0,0,1,1,E01002290,2025-12-09 18:32:00,18,2005-07-04,Monday,7.0
200501KD50217,552020,182360,0.189721,51.519652,1,3,1,1,01/04/2005,6,15:00,15,E09000016,6,0,1,30,1,4,4,1335,0,0,1,1,1,0,0,1,1,E01002345,2025-12-09 15:00:00,15,2005-01-04,Tuesday,1.0
200501KD50220,550860,189310,0.175993,51.582409,1,3,2,1,01/04/2005,6,20:05,15,E09000016,3,125,6,30,0,-1,-1,0,0,0,4,1,1,0,0,1,1,E01002243,2025-12-09 20:05:00,20,2005-01-04,Tuesday,1.0
200501KD50221,554660,186950,0.229757,51.560176,1,3,3,3,05/04/2005,3,16:25,15,E09000016,5,0,6,30,6,2,3,124,0,5,1,1,1,0,0,1,1,E01002362,2025-12-09 16:25:00,16,2005-05-04,Wednesday,5.0
200501KD50222,552140,184630,0.192429,51.540016,1,3,2,1,06/04/2005,4,12:50,15,E09000016,6,0,6,30,3,4,6,0,0,0,1,1,1,0,0,1,1,E01002266,2025-12-09 12:50:00,12,2005-06-04,Saturday,6.0
200501KD50223,553960,190850,0.221375,51.595408,1,3,1,1,06/04/2005,4,16:50,15,E09000016,6,0,6,30,3,4,3,12,0,0,1,1,1,0,0,1,1,E01002310,2025-12-09 16:50:00,16,2005-06-04,Saturday,6.0
200501KD50224,553070,191900,0.208994,51.605084,1,3,1,1,06/04/2005,4,15:30,15,E09000016,5,0,6,30,3,2,5,0,0,5,1,1,1,0,0,1,1,E01002311,2025-12-09 15:30:00,15,2005-06-04,Saturday,6.0
200501KD50225,556320,186600,0.253529,51.556574,1,3,2,1,07/04/2005,5,12:57,15,E09000016,4,187,6,30,0,-1,-1,0,0,0,1,1,1,0,0,1,1,E01002384,2025-12-09 12:57:00,12,2005-07-04,Monday,7.0
200501KD50226,553870,190770,0.220042,51.594714,1,3,2,1,08/04/2005,6,08:47,15,E09000016,3,12,3,50,0,-1,-1,0,0,0,1,2,2,0,0,1,1,E01002293,2025-12-09 08:47:00,8,2005-08-04,Thursday,8.0
200501KD50227,550110,188380,0.164779,51.574253,1,3,2,1,08/04/2005,6,08:10,15,E09000016,6,0,6,30,3,4,3,118,0,0,1,2,2,0,0,1,1,E01002246,2025-12-09 08:10:00,8,2005-08-04,Thursday,8.0
200501KD50228,552110,188740,0.193774,51.576952,1,3,2,1,08/04/2005,6,08:45,15,E09000016,5,0,6,30,3,4,6,0,0,0,1,2,2,0,0,1,1,E01002357,2025-12-09 08:45:00,8,2005-08-04,Thursday,8.0
200501KD50229,551650,189210,0.187343,51.581299,1,3,1,1,11/04/2005,2,15:35,15,E09000016,3,118,6,30,3,4,6,0,0,0,1,1,1,0,0,1,1,E01002357,2025-12-09 15:35:00,15,2005-11-04,Friday,11.0
200501KD50230,551300,181290,0.178892,51.510231,1,3,2,1,25/02/2005,6,06:10,15,E09000016,6,0,6,30,3,4,6,0,0,0,1,3,3,0,0,2,1,E01002344,2025-12-09 06:10:00,6,,,
200501KD50231,558530,188400,0.286193,51.57213,1,3,2,1,11/04/2005,2,10:14,15,E09000016,3,127,1,30,1,4,1,25,0,0,1,1,1,0,0,2,1,E01002252,2025-12-09 10:14:00,10,2005-11-04,Friday,11.0
200501KD50232,553330,190930,0.212322,51.596298,1,3,2,1,23/03/2005,4,12:30,15,E09000016,5,0,6,30,3,4,5,0,0,0,1,1,1,0,0,1,1,E01002309,2025-12-09 12:30:00,12,,,
200501KD50234,554680,191170,0.231903,51.598086,1,3,2,1,11/04/2005,2,18:00,15,E09000016,5,0,3,50,6,2,3,12,0,5,1,1,1,0,0,1,1,E01002300,2025-12-09 18:00:00,18,2005-11-04,Friday,11.0
200501KD50235,554170,189900,0.223988,51.586815,1,3,2,1,15/04/2005,6,16:38,15,E09000016,3,127,3,50,6,2,3,127,0,0,1,2,2,0,0,1,1,E01002377,2025-12-09 16:38:00,16,,,
200501KD50236,552780,187500,0.202896,51.56563,1,3,3,2,26/02/2005,7,16:25,15,E09000016,6,0,6,30,3,4,6,0,0,0,1,1,2,0,0,1,1,E01002321,2025-12-09 16:25:00,16,,,
200501KD50237,551930,191630,0.192428,51.602967,1,3,4,1,17/04/2005,1,12:20,15,E09000016,5,0,6,30,0,-1,-1,0,0,0,1,1,1,0,0,1,1,E01002334,2025-12-09 12:20:00,12,,,
200501KD50238,551990,183400,0.189737,51.529004,1,3,2,1,13/04/2005,4,09:35,15,E09000016,3,125,6,30,6,2,5,0,0,5,1,2,2,0,0,1,1,E01002374,2025-12-09 09:35:00,9,,,
200501KD50239,550930,187420,0.176191,51.565409,1,3,2,1,12/04/2005,3,19:15,15,E09000016,3,124,6,30,6,2,3,124,0,5,1,1,1,0,0,1,1,E01002248,2025-12-09 19:15:00,19,2005-12-04,Sunday,12.0
200501KD50240,551420,188420,0.183686,51.574262,1,3,1,1,16/04/2005,7,19:15,15,E09000016,5,0,6,30,0,-1,-1,0,0,0,1,1,1,0,0,1,1,E01002356,2025-12-09 19:15:00,19,,,
200501KD50241,552050,183500,0.190645,51.529887,1,3,1,1,16/04/2005,7,23:58,15,E09000016,5,0,6,30,3,4,6,0,0,0,4,2,2,0,0,1,1,E01002374,2025-12-09 23:58:00,23,,,
200501KD50242,555620,185830,0.2431,51.549849,1,3,1,1,16/04/2005,7,14:25,15,E09000016,6,0,6,30,3,4,6,0,0,0,1,1,1,0,0,1,1,E01002390,2025-12-09 14:25:00,14,,,
200501KD50244,550080,190520,0.165261,51.593489,1,3,2,1,22/04/2005,6,19:45,15,E09000016,4,174,6,30,3,4,6,0,0,0,1,1,1,0,0,1,2,E01002327,2025-12-09 19:45:00,19,,,
200501KD50246,554810,190200,0.233351,51.589335,1,3,2,1,13/04/2005,4,20:15,15,E09000016,5,0,1,30,1,4,5,0,0,0,4,1,2,0,0,1,2,E01002295,2025-12-09 20:15:00,20,,,
200501KD50247,550620,189750,0.17272,51.586427,1,3,2,1,16/04/2005,7,17:40,15,E09000016,3,12,3,50,7,2,3,125,0,5,1,1,1,0,0,1,1,E01002338,2025-12-09 17:40:00,17,,,
200501KD50248,553040,190120,0.207785,51.589099,1,3,2,1,20/04/2005,4,12:50,15,E09000016,3,118,6,30,0,-1,-1,0,0,0,1,1,1,0,0,1,1,E01002376,2025-12-09 12:50:00,12,,,
200501KD50249,553960,191350,0.221595,51.5999,1,3,2,1,16/04/2005,7,12:10,15,E09000016,6,0,6,30,3,4,6,0,0,0,1,1,1,0,0,1,1,E01002297,2025-12-09 12:10:00,12,,,
200501KD50250,552970,190050,0.206745,51.588489,1,3,2,1,23/04/2005,7,18:30,15,E09000016,3,118,6,30,0,-1,-1,0,0,0,1,1,1,0,0,1,1,E01002376,2025-12-09 18:30:00,18,,,
200501KD50251,550860,189320,0.175997,51.582499,1,3,1,1,16/04/2005,7,15:58,15,E09000016,3,125,6,30,0,-1,-1,0,0,0,1,1,1,0,0,1,1,E01002243,2025-12-09 15:58:00,15,,,
200501KD50252,551250,188950,0.181463,51.57907,1,3,1,1,16/04/2005,7,07:35,15,E09000016,6,0,6,30,3,4,6,0,0,0,1,1,1,0,0,1,1,E01002353,2025-12-09 07:35:00,7,,,
200501KD50254,558440,188310,0.284855,51.571346,1,3,2,1,25/04/2005,2,05:40,15,E09000016,1,25,3,30,5,4,3,127,0,0,1,1,1,0,0,2,2,E01002252,2025-12-09 05:40:00,5,,,
200501KD50255,551160,188030,0.179769,51.570828,1,3,1,1,18/04/2005,2,10:45,15,E09000016,5,0,6,30,0,-1,-1,0,0,0,1,1,1,0,0,1,1,E01002249,2025-12-09 10:45:00,10,,,
200501KD50256,556100,186920,0.250501,51.55951,1,3,2,1,25/04/2005,2,08:20,15,E09000016,5,0,6,30,0,-1,-1,0,0,0,1,1,1,0,0,1,1,E01002257,2025-12-09 08:20:00,8,,,
200501KD50257,551810,185620,0.188101,51.549,1,3,1,2,26/04/2005,3,16:25,15,E09000016,3,125,6,30,0,-1,-1,0,0,0,1,1,1,0,0,1,1,E01002260,2025-12-09 16:25:00,16,,,
200501KD50258,552080,182560,0.190671,51.521433,1,3,2,1,27/04/2005,4,13:30,15,E09000016,3,1306,1,40,1,4,4,1335,0,8,1,1,1,0,0,2,1,E01002370,2025-12-09 13:30:00,13,,,
200501KD50259,550630,189750,0.172865,51.586424,1,3,2,1,07/04/2005,5,15:10,15,E09000016,3,12,3,50,6,2,3,125,0,5,1,1,1,0,0,1,1,E01002340,2025-12-09 15:10:00,15,2005-07-04,Monday,7.0
200501KD50260,554030,192800,0.223241,51.612909,1,3,2,2,25/04/2005,2,21:00,15,E09000016,6,0,6,30,3,4,6,0,0,0,4,1,1,0,0,1,2,E01002276,2025-12-09 21:00:00,21,,,
200501KD50263,550610,191450,0.173305,51.601704,1,3,2,1,27/04/2005,4,06:26,15,E09000016,4,1459,6,30,3,4,6,0,0,1,1,1,2,0,0,1,1,E01002304,2025-12-09 06:26:00,6,,,
200501KD50265,552000,183400,0.189881,51.529002,1,3,2,1,29/04/2005,6,13:45,15,E09000016,5,0,6,30,0,-1,-1,0,0,0,1,1,1,0,0,1,1,E01002374,2025-12-09 13:45:00,13,,,
200501KD50266,551720,183040,0.185693,51.525842,1,3,2,1,23/03/2005,4,13:05,15,E09000016,6,0,6,30,3,4,6,0,0,0,1,1,1,0,0,1,3,E01002370,2025-12-09 13:05:00,13,,,
200501KD50267,552650,189880,0.202056,51.587049,1,3,2,1,06/05/2005,6,18:28,15,E09000016,6,0,6,30,3,4,3,118,0,0,1,1,1,0,0,1,1,E01002379,2025-12-09 18:28:00,18,2005-06-05,Sunday,6.0
200501KD50268,552610,185540,0.199596,51.548065,1,3,2,1,04/05/2005,4,15:15,15,E09000016,6,0,6,30,3,4,6,0,0,0,1,1,1,0,0,1,2,E01002262,2025-12-09 15:15:00,15,2005-04-05,Tuesday,4.0
200501KD50269,554000,190030,0.221593,51.588029,1,3,3,2,30/04/2005,7,17:03,15,E09000016,3,127,3,40,0,-1,-1,0,0,0,1,1,1,0,0,1,1,E01002377,2025-12-09 17:03:00,17,,,
200501KD50270,551730,183660,0.186104,51.53141,1,3,2,1,04/05/2005,4,10:00,15,E09000016,6,0,6,30,3,4,3,125,0,0,1,1,1,0,0,1,1,E01002373,2025-12-09 10:00:00,10,2005-04-05,Tuesday,4.0
200501KD50271,553880,192400,0.220901,51.609356,1,3,2,1,27/04/2005,4,19:51,15,E09000016,5,0,6,30,3,4,6,0,0,0,1,1,1,0,0,1,1,E01002278,2025-12-09 19:51:00,19,,,
200501KD50272,552910,187390,0.204723,51.564606,1,2,1,1,01/05/2005,1,03:40,15,E09000016,6,0,6,30,3,4,3,124,0,0,4,1,1,0,0,1,1,E01002321,2025-12-09 03:40:00,3,2005-01-05,Wednesday,1.0
200501KD50274,553340,190870,0.21244,51.595756,1,3,2,2,01/05/2005,1,18:50,15,E09000016,5,0,6,30,0,-1,-1,0,0,0,1,1,1,0,0,1,1,E01002309,2025-12-09 18:50:00,18,2005-01-05,Wednesday,1.0
200501KD50276,554160,186530,0.222366,51.556539,1,3,1,1,01/05/2005,1,18:42,15,E09000016,6,0,6,30,0,-1,-1,0,0,0,1,1,1,0,0,1,1,E01002290,2025-12-09 18:42:00,18,2005-01-05,Wednesday,1.0
200501KD50277,556940,186680,0.262501,51.557121,1,3,1,1,04/05/2005,4,15:50,15,E09000016,4,187,6,30,0,-1,-1,0,0,0,1,1,1,0,0,1,1,E01002384,2025-12-09 15:50:00,15,2005-04-05,Tuesday,4.0
200501KD50279,552480,189810,0.199573,51.586466,1,3,2,1,09/05/2005,2,06:45,15,E09000016,3,118,6,30,3,2,5,0,0,5,1,1,1,0,0,1,1,E01002337,2025-12-09 06:45:00,6,2005-09-05,Monday,9.0
200501KD50280,553930,189310,0.220268,51.581579,1,3,3,1,12/05/2005,5,16:35,15,E09000016,5,0,6,30,0,-1,-1,0,0,0,1,1,1,0,0,1,1,E01002377,2025-12-09 16:35:00,16,2005-12-05,Monday,12.0
200501KD50281,549820,187080,0.160044,51.562649,1,3,3,2,16/05/2005,2,23:30,15,E09000016,3,124,6,30,3,4,3,124,0,0,4,1,2,0,0,1,1,E01000061,2025-12-09 23:30:00,23,,,
200501KD50282,551200,190400,0.181366,51.592112,1,3,2,1,13/05/2005,6,16:07,15,E09000016,3,12,3,50,6,2,5,0,0,5,1,1,1,0,0,1,1,E01002334,2025-12-09 16:07:00,16,,,
200501KD50283,551470,188120,0.184278,51.571553,1,3,1,1,13/05/2005,6,10:58,15,E09000016,5,0,6,30,6,2,5,0,0,5,1,1,1,0,0,1,1,E01002350,2025-12-09 10:58:00,10,,,
200501KD50284,552290,188830,0.196408,51.577712,1,3,2,3,15/05/2005,1,05:45,15,E09000016,5,0,6,30,0,-1,-1,0,0,0,1,1,1,0,0,1,1,E01002382,2025-12-09 05:45:00,5,,,
200501KD50285,555720,191750,0.247164,51.603011,1,3,1,1,15/05/2005,1,22:40,15,E09000016,3,12,6,30,3,4,5,0,0,0,4,1,1,0,0,1,1,E01002296,2025-12-09 22:40:00,22,,,
200501KD50286,555590,191700,0.245266,51.602597,1,3,2,1,20/05/2005,6,18:00,15,E09000016,3,12,3,50,3,2,5,0,0,0,1,1,1,0,0,1,1,E01002283,2025-12-09 18:00:00,18,,,
200501KD50287,549600,187720,0.157144,51.568458,1,3,3,1,18/05/2005,4,17:10,15,E09000016,6,0,6,30,8,4,6,0,0,0,1,1,1,0,0,1,1,E01002250,2025-12-09 17:10:00,17,,,
200501KD50288,551230,190420,0.181807,51.592283,1,3,2,3,19/05/2005,5,22:11,15,E09000016,3,12,3,30,6,2,5,0,0,5,4,2,2,0,0,1,1,E01002334,2025-12-09 22:11:00,22,,,
200501KD50289,554180,189910,0.224136,51.586902,1,3,1,1,18/05/2005,4,08:09,15,E09000016,3,127,6,30,6,2,5,0,0,0,1,1,1,0,0,1,1,E01002295,2025-12-09 08:09:00,8,,,
200501KD50291,556270,185070,0.25213,51.542841,1,2,2,1,20/05/2005,6,18:28,15,E09000016,4,1421,6,40,0,-1,-1,0,0,0,1,1,1,0,0,1,1,E01002385,2025-12-09 18:28:00,18,,,
200501KD50292,552780,181160,0.200147,51.508665,1,2,1,3,21/05/2005,7,12:58,15,E09000016,3,13,3,70,0,-1,-1,0,0,0,1,4,1,0,0,2,1,E01002344,2025-12-09 12:58:00,12,,,
200501KD50294,551130,187450,0.179087,51.565625,1,3,1,1,19/05/2005,5,10:30,15,E09000016,3,124,6,30,3,2,6,0,0,5,1,1,1,0,0,1,1,E01002249,2025-12-09 10:30:00,10,,,
200501KD50295,559010,187040,0.292499,51.559776,1,3,2,1,20/05/2005,6,11:30,15,E09000016,4,187,6,30,0,-1,-1,0,0,0,1,2,2,0,0,2,1,E01002391,2025-12-09 11:30:00,11,,,
200501KD50296,550640,189550,0.172923,51.584624,1,3,1,1,25/05/2005,4,13:40,15,E09000016,6,0,6,30,3,4,6,0,0,0,1,1,1,0,0,1,1,E01002245,2025-12-09 13:40:00,13,,,
200501KD50297,550830,191110,0.176333,51.59859,1,3,1,1,20/05/2005,6,15:45,15,E09000016,4,175,6,30,3,4,6,0,0,8,1,1,1,0,0,1,1,E01002303,2025-12-09 15:45:00,15,,,
200501KD50298,555600,191700,0.24541,51.602594,1,3,2,1,20/05/2005,6,18:00,15,E09000016,5,0,6,30,3,4,3,12,0,0,1,1,1,0,0,1,1,E01002283,2025-12-09 18:00:00,18,,,
200501KD50299,554150,189890,0.223695,51.586731,1,3,3,1,13/02/2005,1,16:00,15,E09000016,3,127,6,30,6,2,3,127,0,0,1,1,1,0,0,1,2,E01002377,2025-12-09 16:00:00,16,,,
200501KD50301,553730,187220,0.21647,51.562856,1,3,1,1,03/05/2005,3,12:00,15,E09000016,3,124,6,30,0,-1,-1,0,0,0,1,1,1,0,0,1,1,E01002361,2025-12-09 12:00:00,12,2005-03-05,Saturday,3.0
200501KD50302,554670,191190,0.231767,51.598268,1,3,2,1,07/05/2005,7,08:00,15,E09000016,5,0,3,50,6,2,3,12,0,0,1,1,1,1,0,1,2,E01002300,2025-12-09 08:00:00,8,2005-07-05,Tuesday,7.0
200501KD50303,553580,192100,0.216441,51.606742,1,3,2,1,17/05/2005,3,20:40,15,E09000016,5,0,6,30,3,4,6,0,0,0,4,1,1,0,0,1,1,E01002284,2025-12-09 20:40:00,20,,,
200501KD50304,557920,186780,0.276671,51.557746,1,3,2,1,17/05/2005,3,16:45,15,E09000016,6,0,6,30,3,4,4,187,0,0,1,1,1,0,0,2,1,E01002391,2025-12-09 16:45:00,16,,,
200501KD50305,553780,185450,0.216417,51.546939,1,3,2,2,13/05/2005,6,11:10,15,E09000016,5,0,6,30,3,4,6,0,0,0,1,1,1,0,0,1,1,E01002288,2025-12-09 11:10:00,11,,,
200501KD50306,553810,193300,0.220285,51.617461,1,3,2,1,15/05/2005,1,07:45,15,E09000016,5,0,1,30,2,4,6,0,0,0,1,1,1,0,0,1,2,E01002312,2025-12-09 07:45:00,7,,,
200501KD50307,554530,191370,0.229827,51.599924,1,3,3,1,25/04/2005,2,18:30,15,E09000016,6,0,6,30,0,-1,-1,0,0,0,1,1,1,0,0,1,1,E01002299,2025-12-09 18:30:00,18,,,
200501KD50309,556260,189100,0.253776,51.579052,1,3,2,2,24/05/2005,3,23:30,15,E09000016,5,0,7,30,5,4,6,0,0,0,4,1,1,0,0,2,1,E01002296,2025-12-09 23:30:00,23,,,
200501KD50310,552580,189570,0.200912,51.584282,1,3,2,1,20/05/2005,6,11:45,15,E09000016,5,0,6,30,3,4,6,0,0,0,1,1,1,0,0,1,1,E01002379,2025-12-09 11:45:00,11,,,
200501KD50312,553370,190490,0.212707,51.592334,1,3,2,1,25/05/2005,4,06:30,15,E09000016,3,127,3,40,1,4,3,118,0,0,1,1,1,0,0,1,1,E01002383,2025-12-09 06:30:00,6,,,
200501KD50313,555050,186830,0.235326,51.558991,1,3,2,1,24/05/2005,3,19:40,15,E09000016,6,0,6,30,3,4,3,124,0,4,1,1,1,0,0,1,1,E01002362,2025-12-09 19:40:00,19,,,
200501KD50314,554570,194340,0.231713,51.626597,1,3,3,2,30/01/2005,1,17:28,15,E09000016,1,25,3,70,0,-1,-1,0,0,0,4,9,1,0,0,2,1,E01002276,2025-12-09 17:28:00,17,,,
200501KD50315,552070,182670,0.190575,51.522424,1,3,3,1,27/05/2005,6,08:51,15,E09000016,3,125,6,30,3,4,3,1306,0,0,1,1,1,0,0,1,1,E01002370,2025-12-09 08:51:00,8,,,
200501KD50316,550230,190090,0.167241,51.589586,1,3,1,1,26/05/2005,5,14:16,15,E09000016,6,0,6,30,3,4,4,174,0,4,1,1,1,0,0,1,1,E01002328,2025-12-09 14:16:00,14,,,
200501KD50317,553090,191850,0.209261,51.60463,1,3,2,1,26/05/2005,5,09:08,15,E09000016,5,0,6,30,3,4,5,0,0,1,1,1,1,0,0,1,1,E01002311,2025-12-09 09:08:00,9,,,
200501KD50319,551450,191600,0.18549,51.602826,1,3,2,1,23/05/2005,2,08:50,15,E09000016,5,0,6,30,0,-1,-1,0,0,0,1,1,1,0,0,1,1,E01002341,2025-12-09 08:50:00,8,,,
200501KD50321,553830,190730,0.219447,51.594365,1,3,2,2,16/05/2005,2,22:50,15,E09000016,6,0,3,50,3,2,3,12,0,5,4,1,1,0,0,1,2,E01002293,2025-12-09 22:50:00,22,,,
200501KD50322,551670,188510,0.18733,51.575004,1,3,2,1,21/05/2005,7,13:05,15,E09000016,5,0,3,30,7,2,5,0,0,5,1,1,1,0,0,1,1,E01002358,2025-12-09 13:05:00,13,,,
200501KD50323,554120,192040,0.224206,51.606056,1,3,2,2,23/05/2005,2,20:12,15,E09000016,5,0,6,30,3,4,6,0,0,0,1,1,1,0,0,1,1,E01002284,2025-12-09 20:12:00,20,,,
200501KD50324,553160,187270,0.208274,51.56346,1,3,2,1,23/05/2005,2,14:27,15,E09000016,6,0,6,30,3,4,3,124,0,0,1,1,1,0,0,1,1,E01002318,2025-12-09 14:27:00,14,,,
200501KD50325,556870,192370,0.264033,51.608262,1,3,2,1,26/05/2005,5,17:25,15,E09000016,1,25,1,30,1,2,3,12,0,0,1,1,1,0,0,2,2,E01002296,2025-12-09 17:25:00,17,,,
200501KD50327,551310,181290,0.179036,51.510228,1,3,1,1,26/05/2005,5,11:30,15,E09000016,6,0,6,30,3,4,6,0,0,0,1,1,1,0,0,2,1,E01002344,2025-12-09 11:30:00,11,,,
200501KD50328,553940,189320,0.220416,51.581667,1,3,1,1,27/05/2005,6,16:20,15,E09000016,5,0,6,30,0,-1,-1,0,0,0,1,1,1,0,0,1,1,E01002377,2025-12-09 16:20:00,16,,,
200501KD50329,554660,186950,0.229757,51.560176,1,3,2,3,30/05/2005,2,20:00,15,E09000016,5,0,6,30,6,2,3,124,0,0,1,1,1,0,0,1,2,E01002362,2025-12-09 20:00:00,20,,,
200501KD50330,552860,185250,0.203072,51.545392,1,3,2,3,27/05/2005,6,17:05,15,E09000016,5,0,6,30,6,4,5,0,0,0,1,1,1,0,0,1,1,E01002265,2025-12-09 17:05:00,17,,,
200501KD50331,550740,191760,0.175314,51.604454,1,2,1,1,11/06/2005,7,10:30,15,E09000016,6,0,6,30,3,4,6,0,0,0,1,1,1,0,0,1,2,E01002304,2025-12-09 10:30:00,10,2005-11-06,Sunday,11.0
200501KD50333,553350,190500,0.212423,51.592429,1,3,2,1,04/06/2005,7,02:00,15,E09000016,3,118,1,30,1,2,3,12,0,5,4,1,1,0,0,1,2,E01002337,2025-12-09 02:00:00,2,2005-04-06,Wednesday,4.0
200501KD50334,551990,188100,0.191767,51.571234,1,2,2,1,05/06/2005,1,20:00,15,E09000016,5,0,6,30,3,4,6,0,0,0,1,1,1,0,0,1,1,E01002351,2025-12-09 20:00:00,20,2005-05-06,Friday,5.0
200501KD50335,558670,187920,0.287995,51.567778,1,3,1,2,05/06/2005,1,02:30,15,E09000016,1,25,3,70,0,-1,-1,0,0,0,4,1,1,0,0,2,1,E01002252,2025-12-09 02:30:00,2,2005-05-06,Friday,5.0
200501KD50336,558230,188920,0.282102,51.576886,1,3,8,7,07/06/2005,3,06:26,15,E09000016,1,25,3,70,0,-1,-1,0,0,0,1,1,1,0,0,2,1,E01002259,2025-12-09 06:26:00,6,2005-07-06,Wednesday,7.0
200501KD50337,551630,188690,0.18683,51.576632,1,3,1,1,06/06/2005,2,08:14,15,E09000016,6,0,3,30,3,2,5,0,0,5,1,1,1,0,0,1,1,E01002357,2025-12-09 08:14:00,8,2005-06-06,Monday,6.0
200501KD50338,558840,187350,0.290188,51.562609,1,2,3,2,02/06/2005,5,20:25,15,E09000016,1,25,3,70,0,-1,-1,0,0,0,1,1,1,0,0,2,1,E01002391,2025-12-09 20:25:00,20,2005-02-06,Sunday,2.0
200501KD50339,551520,184220,0.183319,51.536498,1,3,4,2,07/06/2005,3,15:00,15,E09000016,6,0,6,30,3,4,3,125,0,0,1,1,1,0,0,1,1,E01002375,2025-12-09 15:00:00,15,2005-07-06,Wednesday,7.0
200501KD50340,556770,192280,0.26255,51.607481,1,3,2,2,01/06/2005,4,13:54,15,E09000016,1,25,1,50,1,2,3,12,0,0,1,1,1,0,0,2,1,E01002296,2025-12-09 13:54:00,13,2005-01-06,Thursday,1.0
200501KD50341,553190,190320,0.210036,51.590856,1,3,3,1,28/04/2005,5,12:32,15,E09000016,3,118,6,30,3,4,5,0,0,0,1,1,1,0,0,1,1,E01002383,2025-12-09 12:32:00,12,,,
200501KD50342,553400,190500,0.213144,51.592416,1,3,2,1,28/05/2005,7,06:15,15,E09000016,3,127,3,30,1,4,3,12,0,0,1,1,1,0,0,1,1,E01002383,2025-12-09 06:15:00,6,,,
200501KD50343,550510,189620,0.171078,51.585288,1,3,2,1,28/05/2005,7,15:30,15,E09000016,3,12,3,30,0,-1,-1,0,0,0,1,1,1,0,0,1,2,E01002245,2025-12-09 15:30:00,15,,,
200501KD50344,549980,190850,0.163959,51.596481,1,3,2,1,29/05/2005,1,11:20,15,E09000016,4,174,6,30,6,4,6,0,0,0,1,1,1,0,0,1,1,E01002326,2025-12-09 11:20:00,11,,,
200501KD50345,549630,191550,0.159208,51.602863,1,3,2,1,05/06/2005,1,20:50,15,E09000016,6,0,6,30,3,4,6,0,0,0,4,1,1,0,0,1,1,E01002302,2025-12-09 20:50:00,20,2005-05-06,Friday,5.0
200501KD50346,551980,187420,0.191329,51.565127,1,3,2,1,29/05/2005,1,15:05,15,E09000016,3,124,6,30,8,2,6,0,0,0,1,1,1,0,0,1,1,E01002319,2025-12-09 15:05:00,15,,,
200501KD50347,550880,183310,0.173709,51.528493,1,3,2,1,09/06/2005,5,08:52,15,E09000016,6,0,6,30,0,-1,-1,0,0,0,1,1,1,0,0,1,2,E01002369,2025-12-09 08:52:00,8,2005-09-06,Tuesday,9.0
200501KD50348,553960,191390,0.221612,51.60026,1,3,2,2,28/05/2005,7,15:33,15,E09000016,6,0,6,30,3,4,6,0,0,0,1,1,1,0,0,1,1,E01002316,2025-12-09 15:33:00,15,,,
200501KD50349,550150,190350,0.166198,51.591943,1,3,2,1,28/05/2005,7,06:15,15,E09000016,4,174,6,30,0,-1,-1,0,0,0,1,1,1,0,0,1,1,E01002335,2025-12-09 06:15:00,6,,,
200501KD50350,554500,192470,0.229878,51.609815,1,3,1,1,08/06/2005,4,08:36,15,E09000016,6,0,6,30,3,4,6,0,0,0,1,1,1,0,0,1,1,E01002281,2025-12-09 08:36:00,8,2005-08-06,Saturday,8.0
200501KD50351,556870,192350,0.264024,51.608082,1,3,2,1,23/05/2005,2,09:50,15,E09000016,1,25,3,30,5,2,3,12,0,0,1,1,1,0,0,2,2,E01002296,2025-12-09 09:50:00,9,,,
200501KD50352,555430,186730,0.240759,51.557988,1,3,2,2,30/05/2005,2,13:20,15,E09000016,3,124,6,30,3,4,6,0,0,0,1,2,2,0,0,1,1,E01002386,2025-12-09 13:20:00,13,,,
200501KD50353,556140,190340,0.252596,51.590226,1,3,2,2,15/06/2005,4,18:15,15,E09000016,5,0,6,30,3,4,5,0,0,0,1,2,2,0,0,2,1,E01002296,2025-12-09 18:15:00,18,,,
200501KD50354,553100,186170,0.206931,51.553593,1,3,2,1,29/05/2005,1,18:25,15,E09000016,5,0,6,30,3,4,5,0,0,0,1,1,1,0,0,1,1,E01002366,2025-12-09 18:25:00,18,,,
200501KD50355,550080,190520,0.165261,51.593489,1,3,2,1,29/05/2005,1,21:27,15,E09000016,4,174,6,30,3,4,6,0,0,0,4,1,1,0,0,1,1,E01002327,2025-12-09 21:27:00,21,,,
200501KD50356,552540,184250,0.198028,51.536493,1,2,1,1,07/06/2005,3,07:49,15,E09000016,5,0,6,30,3,4,6,0,0,0,1,1,1,0,0,1,1,E01002372,2025-12-09 07:49:00,7,2005-07-06,Wednesday,7.0
200501KD50357,556220,183490,0.250709,51.528659,1,2,2,1,08/06/2005,4,16:08,15,E09000016,5,0,6,30,6,4,5,0,0,0,1,1,1,0,0,2,1,E01015924,2025-12-09 16:08:00,16,2005-08-06,Saturday,8.0
200501KD50359,551920,187410,0.190459,51.565053,1,3,1,1,09/06/2005,5,16:35,15,E09000016,3,124,6,30,3,2,3,124,0,5,1,1,1,0,0,1,1,E01002319,2025-12-09 16:35:00,16,2005-09-06,Tuesday,9.0
200501KD50360,553800,190180,0.218774,51.589432,1,3,2,1,23/05/2005,2,09:10,15,E09000016,3,127,3,40,0,-1,-1,0,0,0,1,1,1,0,0,1,1,E01002383,2025-12-09 09:10:00,9,,,
200501KD50363,553370,190510,0.212716,51.592514,1,3,3,2,23/06/2005,5,08:14,15,E09000016,3,12,3,30,0,-1,-1,0,0,0,1,1,1,0,0,1,1,E01002337,2025-12-09 08:14:00,8,,,
200501KD50364,558190,189040,0.281579,51.577975,1,3,3,1,10/06/2005,6,18:15,15,E09000016,1,25,3,70,0,-1,-1,0,0,0,1,1,1,0,0,2,1,E01002259,2025-12-09 18:15:00,18,2005-10-06,Thursday,10.0
200501KD50365,551340,190130,0.183269,51.589648,1,3,2,2,15/06/2005,4,17:30,15,E09000016,5,0,6,30,0,-1,-1,0,0,5,1,1,1,0,0,1,2,E01002339,2025-12-09 17:30:00,17,,,
200501KD50366,558390,188530,0.284233,51.573337,1,3,2,1,18/06/2005,7,17:30,15,E09000016,3,127,3,30,1,2,1,25,0,0,1,1,1,0,0,2,2,E01002259,2025-12-09 17:30:00,17,,,
200501KD50368,550660,188440,0.172736,51.574645,1,3,3,1,12/06/2005,1,14:08,15,E09000016,3,118,6,30,0,-1,-1,0,0,0,1,1,1,0,0,1,1,E01002356,2025-12-09 14:08:00,14,2005-12-06,Tuesday,12.0
200501KD50369,552210,181370,0.19203,51.510706,1,3,1,1,13/06/2005,2,18:05,15,E09000016,3,13,3,70,0,-1,-1,0,0,0,1,1,1,0,0,2,1,E01002344,2025-12-09 18:05:00,18,,,
200501KD50370,553840,190310,0.219408,51.590589,1,3,2,2,13/06/2005,2,07:25,15,E09000016,6,0,6,30,0,-1,-1,0,0,0,1,1,1,0,2,1,1,E01002293,2025-12-09 07:25:00,7,,,
200501KD50371,558310,188730,0.28317,51.575156,1,3,3,2,17/06/2005,6,11:20,15,E09000016,1,25,3,70,0,-1,-1,0,0,0,1,1,1,0,0,2,1,E01002259,2025-12-09 11:20:00,11,,,
200501KD50373,550590,189700,0.172266,51.585985,1,3,2,1,19/06/2005,1,22:20,15,E09000016,3,12,3,30,3,2,6,0,0,5,4,1,1,0,0,1,2,E01002245,2025-12-09 22:20:00,22,,,
200501KD50374,552050,182210,0.190088,51.518296,1,3,2,1,11/06/2005,7,18:35,15,E09000016,4,1335,6,30,3,4,4,1335,0,0,1,1,1,0,0,1,1,E01002345,2025-12-09 18:35:00,18,2005-11-06,Sunday,11.0
200501KD50375,553590,193070,0.21701,51.615455,1,3,3,1,23/06/2005,5,14:23,15,E09000016,5,0,1,30,2,4,5,0,0,0,1,1,1,0,0,1,1,E01002312,2025-12-09 14:23:00,14,,,
200501KD50376,553390,190540,0.213017,51.592778,1,3,2,1,12/06/2005,1,17:15,15,E09000016,3,12,1,30,1,4,3,127,0,0,1,1,1,0,0,1,1,E01002310,2025-12-09 17:15:00,17,2005-12-06,Tuesday,12.0
200501KD50377,554030,186990,0.220694,51.560708,1,3,2,2,17/06/2005,6,08:45,15,E09000016,5,0,6,30,3,4,6,0,0,1,1,1,1,0,0,1,1,E01002361,2025-12-09 08:45:00,8,,,
200501KD50378,553720,192180,0.218496,51.607423,1,3,1,1,17/06/2005,6,13:22,15,E09000016,5,0,6,30,0,-1,-1,0,0,0,1,1,1,0,0,1,1,E01002282,2025-12-09 13:22:00,13,,,
200501KD50379,550790,182240,0.171955,51.518903,1,3,2,1,18/06/2005,7,09:55,15,E09000016,3,13,3,70,5,4,6,0,0,0,1,1,1,0,0,2,1,E01002370,2025-12-09 09:55:00,9,,,
200501KD50380,553330,190920,0.212318,51.596208,1,3,2,1,18/06/2005,7,17:45,15,E09000016,5,0,1,30,2,4,5,0,0,0,1,1,1,0,0,1,1,E01002309,2025-12-09 17:45:00,17,,,
200501KD50381,553990,187220,0.220218,51.562785,1,3,2,1,18/06/2005,7,13:30,15,E09000016,5,0,6,30,3,4,6,0,0,0,1,1,1,0,0,1,2,E01002361,2025-12-09 13:30:00,13,,,
200501KD50382,551200,188060,0.180359,51.571087,1,3,1,1,22/06/2005,4,14:24,15,E09000016,5,0,1,30,1,4,6,0,0,0,1,1,1,0,0,1,2,E01002249,2025-12-09 14:24:00,14,,,
200501KD50383,552190,189690,0.195339,51.585466,1,3,2,1,05/06/2005,1,14:12,15,E09000016,3,118,6,30,6,4,6,0,0,0,1,1,1,0,0,1,1,E01002354,2025-12-09 14:12:00,14,2005-05-06,Friday,5.0
200501KD50384,550210,188360,0.166213,51.574047,1,3,2,1,20/06/2005,2,16:28,15,E09000016,3,118,6,30,8,4,6,0,0,0,1,1,1,0,0,1,1,E01002247,2025-12-09 16:28:00,16,,,
200501KD50385,551120,190320,0.180177,51.591414,1,2,1,1,21/06/2005,3,01:37,15,E09000016,3,12,3,50,0,-1,-1,0,0,0,4,1,1,0,0,1,1,E01002334,2025-12-09 01:37:00,1,,,
200501KD50386,554960,190830,0.235792,51.594954,1,3,2,2,21/06/2005,3,17:10,15,E09000016,5,0,6,30,3,4,6,0,0,0,1,1,1,0,0,1,1,E01002300,2025-12-09 17:10:00,17,,,
200501KD50387,554000,186400,0.220003,51.555415,1,3,2,1,22/06/2005,4,18:24,15,E09000016,3,124,6,30,6,4,6,0,0,0,1,1,1,0,0,1,1,E01002291,2025-12-09 18:24:00,18,,,
200501KD50388,556870,187400,0.261813,51.563609,1,3,1,2,22/06/2005,4,11:00,15,E09000016,6,0,6,30,0,-1,-1,0,0,0,1,1,1,0,0,1,2,E01002254,2025-12-09 11:00:00,11,,,
200501KD50389,553900,192260,0.221128,51.608093,1,3,2,1,23/06/2005,5,12:55,15,E09000016,5,0,6,30,3,4,6,0,0,0,1,1,1,0,0,1,1,E01002280,2025-12-09 12:55:00,12,,,
200501KD50390,556100,186920,0.250501,51.55951,1,3,3,1,24/06/2005,6,20:10,15,E09000016,5,0,6,30,0,-1,-1,0,0,0,4,1,1,0,0,1,2,E01002257,2025-12-09 20:10:00,20,,,
200501KD50391,553970,186280,0.219518,51.554345,1,3,1,1,25/06/2005,7,18:07,15,E09000016,3,124,6,30,0,-1,-1,0,0,0,1,1,1,0,0,1,1,E01002291,2025-12-09 18:07:00,18,,,
200501KD50392,550070,190530,0.165121,51.593582,1,3,1,1,23/06/2005,5,10:40,15,E09000016,4,174,6,30,3,4,6,0,0,0,1,1,1,0,0,1,1,E01002327,2025-12-09 10:40:00,10,,,
200501KD50395,550090,189190,0.164837,51.581536,1,3,1,1,21/05/2005,7,12:45,15,E09000016,5,0,3,50,6,2,3,12,0,5,1,1,1,1,0,1,1,E01002244,2025-12-09 12:45:00,12,,,
200501KD50396,556140,187030,0.251126,51.560487,1,3,3,1,24/06/2005,6,08:25,15,E09000016,5,0,6,30,0,-1,-1,0,0,0,1,1,1,0,0,1,1,E01002257,2025-12-09 08:25:00,8,,,
200501KD50397,553780,188410,0.217711,51.573534,1,3,2,2,30/06/2005,5,09:09,15,E09000016,5,0,1,30,2,4,5,0,0,0,1,2,2,0,0,1,1,E01002274,2025-12-09 09:09:00,9,,,
200501KD50399,552050,181360,0.189722,51.510659,1,3,2,2,30/06/2005,5,09:35,15,E09000016,3,13,3,70,0,-1,-1,0,0,0,1,2,2,0,0,2,1,E01002344,2025-12-09 09:35:00,9,,,
200501KD50400,551240,183220,0.178856,51.527588,1,3,2,3,30/06/2005,5,08:44,15,E09000016,6,0,6,30,6,4,6,0,0,0,1,1,1,0,0,1,1,E01002371,2025-12-09 08:44:00,8,,,
200501KD50402,551710,183670,0.18582,51.531506,1,3,1,1,01/07/2005,6,07:37,15,E09000016,3,125,6,30,3,4,6,0,0,0,1,1,1,0,0,1,1,E01002373,2025-12-09 07:37:00,7,2005-01-07,Friday,1.0
200501KD50403,554410,186990,0.226171,51.560604,1,3,2,1,01/07/2005,6,15:30,15,E09000016,3,124,6,30,0,-1,-1,0,0,0,1,1,1,0,0,1,2,E01002360,2025-12-09 15:30:00,15,2005-01-07,Friday,1.0
200501KD50404,554980,188850,0.235207,51.577159,1,3,2,1,03/07/2005,1,13:38,15,E09000016,5,0,6,30,0,-1,-1,0,0,0,1,1,1,0,0,1,1,E01002269,2025-12-09 13:38:00,13,2005-03-07,Monday,3.0
200501KD50405,549430,188310,0.154944,51.573805,1,3,3,2,29/06/2005,4,09:33,15,E09000016,3,118,6,30,3,4,6,0,0,0,1,1,1,0,0,1,1,E01002250,2025-12-09 09:33:00,9,,,
200501KD50406,551870,188620,0.190261,51.575938,1,3,2,3,01/07/2005,6,11:42,15,E09000016,5,0,6,30,8,4,6,0,0,0,1,1,1,0,0,1,1,E01002358,2025-12-09 11:42:00,11,2005-01-07,Friday,1.0
200501KD50407,552590,188440,0.200565,51.574127,1,3,2,1,04/07/2005,2,16:20,15,E09000016,5,0,6,30,3,4,6,0,0,0,1,1,1,0,0,1,1,E01002317,2025-12-09 16:20:00,16,2005-04-07,Thursday,4.0
200501KD50408,559570,187550,0.300802,51.5642,1,3,1,1,02/07/2005,7,23:35,15,E09000016,4,186,6,30,0,-1,-1,0,0,0,4,1,1,0,0,2,1,E01002391,2025-12-09 23:35:00,23,2005-02-07,Monday,2.0
200501KD50409,553280,182530,0.207941,51.520839,1,3,2,1,05/07/2005,3,17:05,15,E09000016,5,0,6,30,3,4,6,0,0,0,1,1,1,0,0,1,2,E01002343,2025-12-09 17:05:00,17,2005-05-07,Saturday,5.0
200501KD50410,553930,187930,0.219663,51.56918,1,3,2,1,02/07/2005,7,15:15,15,E09000016,5,0,6,30,3,4,6,0,0,0,1,1,1,0,0,1,1,E01002274,2025-12-09 15:15:00,15,2005-02-07,Monday,2.0
200501KD50411,550630,182930,0.169945,51.525146,1,3,2,2,03/07/2005,1,22:18,15,E09000016,3,1306,3,30,3,2,5,0,0,0,4,1,1,4,0,1,1,E01002368,2025-12-09 22:18:00,22,2005-03-07,Monday,3.0
200501KD50412,554450,189690,0.227934,51.584852,1,3,2,1,07/07/2005,5,16:20,15,E09000016,3,127,3,30,3,4,6,0,0,0,1,1,1,0,0,1,2,E01002378,2025-12-09 16:20:00,16,2005-07-07,Thursday,7.0
200501KD50413,549920,191910,0.163546,51.606021,1,3,1,1,28/06/2005,3,17:18,15,E09000016,6,0,6,30,0,-1,-1,0,0,0,1,1,1,0,0,1,1,E01002301,2025-12-09 17:18:00,17,,,
200501KD50415,552330,187420,0.196374,51.565032,1,3,2,1,09/07/2005,7,19:30,15,E09000016,3,124,6,30,0,-1,-1,0,0,0,1,1,1,0,0,1,2,E01002320,2025-12-09 19:30:00,19,2005-09-07,Wednesday,9.0
200501KD50416,557190,186690,0.266109,51.557141,1,3,2,1,07/07/2005,5,17:48,15,E09000016,4,187,1,30,1,4,6,0,0,0,1,1,1,0,0,1,1,E01002391,2025-12-09 17:48:00,17,2005-07-07,Thursday,7.0
200501KD50417,551670,188520,0.187334,51.575094,1,3,2,2,10/07/2005,1,01:54,15,E09000016,5,0,6,30,6,2,5,0,0,5,4,1,1,0,0,1,1,E01002358,2025-12-09 01:54:00,1,2005-10-07,Friday,10.0
200501KD50418,551230,191180,0.182134,51.599112,1,3,1,1,10/07/2005,1,12:40,15,E09000016,6,0,6,30,0,-1,-1,0,0,0,1,1,1,0,0,1,1,E01002341,2025-12-09 12:40:00,12,2005-10-07,Friday,10.0
200501KD50419,555550,191680,0.24468,51.602429,1,3,2,2,10/07/2005,1,14:18,15,E09000016,5,0,3,50,3,2,3,12,0,5,1,1,1,0,0,1,1,E01002283,2025-12-09 14:18:00,14,2005-10-07,Friday,10.0
200501KD50420,555380,193740,0.24314,51.620984,1,3,3,1,03/07/2005,1,13:16,15,E09000016,1,25,3,70,0,-1,-1,0,0,0,1,1,1,0,0,2,1,E01002276,2025-12-09 13:16:00,13,2005-03-07,Monday,3.0
200501KD50421,551550,189700,0.186112,51.585728,1,3,1,2,12/07/2005,3,18:52,15,E09000016,5,0,6,30,3,4,6,0,0,0,1,1,1,0,0,1,1,E01002353,2025-12-09 18:52:00,18,2005-12-07,Wednesday,12.0
200501KD50423,551680,183700,0.185401,51.531783,1,3,2,3,14/07/2005,5,18:50,15,E09000016,3,125,6,30,3,4,6,0,0,0,1,1,1,0,0,1,1,E01002373,2025-12-09 18:50:00,18,,,
200501KD50425,550870,188530,0.175802,51.575398,1,3,1,1,14/07/2005,5,22:50,15,E09000016,3,118,2,30,0,-1,-1,0,0,0,4,1,1,0,0,1,1,E01002356,2025-12-09 22:50:00,22,,,
200501KD50426,556670,192550,0.261227,51.609935,1,3,2,1,11/07/2005,2,11:25,15,E09000016,1,25,6,30,0,-1,-1,0,0,0,1,1,1,0,0,2,2,E01002277,2025-12-09 11:25:00,11,2005-11-07,Monday,11.0
200501KD50427,552000,182340,0.189424,51.519478,1,3,2,1,13/07/2005,4,19:03,15,E09000016,4,1335,1,30,1,4,6,0,0,0,1,1,1,0,0,1,1,E01002345,2025-12-09 19:03:00,19,,,
200501KD50428,554300,181520,0.22219,51.511487,1,3,2,1,18/07/2005,2,22:30,15,E09000016,3,1306,6,30,6,4,5,0,0,0,4,1,1,0,0,2,1,E01002344,2025-12-09 22:30:00,22,,,
200501KD50429,558260,188830,0.282494,51.576069,1,3,2,1,14/07/2005,5,14:30,15,E09000016,1,25,3,70,5,4,6,0,0,0,1,1,1,0,0,2,1,E01002259,2025-12-09 14:30:00,14,,,
200501KD50430,558170,189120,0.281327,51.578699,1,3,2,1,14/07/2005,5,08:45,15,E09000016,1,25,3,70,0,-1,-1,0,0,0,1,1,1,0,0,2,2,E01002259,2025-12-09 08:45:00,8,,,
200501KD50431,551440,189710,0.18453,51.585848,1,3,2,1,19/07/2005,3,19:38,15,E09000016,6,0,6,30,6,4,6,0,0,0,1,1,1,0,0,1,1,E01002339,2025-12-09 19:38:00,19,,,
200501KD50432,551600,189230,0.186631,51.581492,1,3,2,1,19/07/2005,3,13:30,15,E09000016,3,118,6,30,3,4,6,0,0,0,1,1,1,4,0,1,1,E01002357,2025-12-09 13:30:00,13,,,
200501KD50433,554260,189830,0.225255,51.586161,1,2,2,1,15/07/2005,6,09:15,15,E09000016,3,127,3,50,0,-1,-1,0,0,0,1,1,1,0,0,1,2,E01002378,2025-12-09 09:15:00,9,,,
200501KD50434,553060,187300,0.206846,51.563757,1,3,3,1,16/07/2005,7,10:58,15,E09000016,3,124,6,40,3,4,6,0,0,0,1,1,1,0,0,1,1,E01002321,2025-12-09 10:58:00,10,,,
200501KD50435,551000,189020,0.177887,51.579766,1,3,2,1,16/07/2005,7,10:00,15,E09000016,3,118,1,30,1,4,6,0,0,0,1,1,1,0,0,1,1,E01002243,2025-12-09 10:00:00,10,,,
200501KD50436,551460,188400,0.184254,51.574072,1,3,2,1,15/08/2005,2,22:50,15,E09000016,5,0,6,30,0,-1,-1,0,0,0,4,1,1,0,0,1,1,E01002356,2025-12-09 22:50:00,22,,,
200501KD50437,551740,187450,0.187881,51.565461,1,3,2,1,19/07/2005,3,15:20,15,E09000016,3,124,2,30,0,-1,-1,0,0,0,1,1,1,0,0,1,2,E01002319,2025-12-09 15:20:00,15,,,
200501KD50438,551510,181550,0.182028,51.512511,1,2,3,4,26/07/2005,3,20:23,15,E09000016,3,13,3,70,0,-1,-1,0,0,0,1,1,1,0,0,2,1,E01002344,2025-12-09 20:23:00,20,,,
200501KD50439,550720,189510,0.17406,51.584243,1,3,2,1,19/05/2005,5,11:39,15,E09000016,6,0,3,30,3,2,3,125,0,5,1,1,1,0,0,1,1,E01002245,2025-12-09 11:39:00,11,,,
200501KD50440,550630,189740,0.17286,51.586334,1,3,2,1,03/06/2005,6,06:00,15,E09000016,3,12,3,30,6,2,3,125,0,0,1,1,1,0,0,1,1,E01002340,2025-12-09 06:00:00,6,2005-03-06,Sunday,3.0
200501KD50441,551440,188350,0.183944,51.573628,1,3,1,1,19/07/2005,3,16:23,15,E09000016,5,0,6,30,0,-1,-1,0,0,0,1,1,1,0,0,1,1,E01002356,2025-12-09 16:23:00,16,,,
200501KD50442,551670,188520,0.187334,51.575094,1,2,2,1,07/07/2005,5,14:04,15,E09000016,5,0,3,30,6,2,5,0,0,5,1,1,1,0,0,1,1,E01002358,2025-12-09 14:04:00,14,2005-07-07,Thursday,7.0
200501KD50443,552330,185090,0.195366,51.544097,1,3,1,1,20/07/2005,4,13:50,15,E09000016,6,0,6,30,3,4,6,0,0,0,1,1,1,0,0,1,1,E01002266,2025-12-09 13:50:00,13,,,
200501KD50444,557860,185030,0.275021,51.54204,1,3,1,1,20/07/2005,4,10:30,15,E09000016,4,1421,6,30,3,4,6,0,0,0,1,1,1,4,0,2,1,E01002385,2025-12-09 10:30:00,10,,,
200501KD50445,551400,188590,0.183471,51.575795,1,3,1,1,29/07/2005,6,13:15,15,E09000016,6,0,6,30,8,4,6,0,0,0,1,1,1,0,0,1,2,E01002356,2025-12-09 13:15:00,13,,,
200501KD50447,553170,190310,0.209743,51.590771,1,3,2,1,20/07/2005,4,11:40,15,E09000016,3,118,6,30,3,2,3,118,0,5,1,1,1,0,0,1,1,E01002337,2025-12-09 11:40:00,11,,,
200501KD50448,549410,190980,0.155791,51.5978,1,3,2,1,03/07/2005,1,13:30,15,E09000016,4,174,6,30,3,4,5,0,0,1,1,1,1,0,0,1,2,E01002325,2025-12-09 13:30:00,13,2005-03-07,Monday,3.0
200501KD50449,552050,182190,0.19008,51.518116,1,3,1,1,20/07/2005,4,07:46,15,E09000016,4,1335,6,30,0,-1,-1,0,0,0,1,1,1,0,0,1,1,E01002345,2025-12-09 07:46:00,7,,,
200501KD50450,552020,182410,0.189743,51.520101,1,3,1,1,21/07/2005,5,18:25,15,E09000016,4,1335,6,30,0,-1,-1,0,0,1,1,1,1,0,0,1,1,E01002345,2025-12-09 18:25:00,18,,,
200501KD50451,549780,189040,0.160302,51.580271,1,2,1,1,22/07/2005,6,14:50,15,E09000016,3,12,3,50,0,-1,-1,0,0,0,1,1,1,0,0,1,1,E01002244,2025-12-09 14:50:00,14,,,
200501KD50452,550530,189660,0.171384,51.585642,1,2,2,1,27/07/2005,4,07:35,15,E09000016,3,12,3,70,3,4,6,0,0,0,1,2,2,0,0,1,1,E01002328,2025-12-09 07:35:00,7,,,
200501KD50453,554540,180930,0.225387,51.50612,1,3,2,1,24/07/2005,1,14:20,15,E09000016,3,1306,6,30,3,4,4,1335,0,0,1,1,1,0,0,2,1,E01002344,2025-12-09 14:20:00,14,,,
200501KD50454,553830,187210,0.217907,51.562739,1,3,1,1,22/07/2005,6,15:30,15,E09000016,3,124,6,30,0,-1,-1,0,0,4,1,1,1,0,0,1,1,E01002361,2025-12-09 15:30:00,15,,,
200501KD50455,549460,188320,0.155381,51.573886,1,3,1,1,28/07/2005,5,16:12,15,E09000016,3,118,6,30,3,4,6,0,0,0,1,1,1,0,0,1,1,E01002250,2025-12-09 16:12:00,16,,,
200501KD50456,554970,188960,0.235112,51.57815,1,3,1,1,28/07/2005,5,15:15,15,E09000016,5,0,6,30,3,4,6,0,0,0,1,1,1,0,0,1,1,E01002269,2025-12-09 15:15:00,15,,,
200501KD50457,551450,188270,0.184054,51.572906,1,3,2,1,03/08/2005,4,22:54,15,E09000016,5,0,6,30,0,-1,-1,0,0,1,4,1,1,0,0,1,1,E01002356,2025-12-09 22:54:00,22,2005-03-08,Tuesday,3.0
200501KD50458,553540,187220,0.213731,51.562908,1,2,1,1,19/05/2005,5,21:20,15,E09000016,3,124,6,30,0,-1,-1,0,0,0,4,1,1,0,0,1,1,E01002361,2025-12-09 21:20:00,21,,,
200501KD50459,554600,191370,0.230837,51.599905,1,3,1,1,31/07/2005,1,23:32,15,E09000016,5,0,6,30,3,4,6,0,0,0,4,1,1,0,0,1,1,E01002300,2025-12-09 23:32:00,23,,,
200501KD50460,552920,187380,0.204862,51.564513,1,3,2,1,10/08/2005,4,18:30,15,E09000016,6,0,6,30,8,4,3,124,0,0,1,1,1,0,0,1,2,E01002321,2025-12-09 18:30:00,18,2005-10-08,Saturday,10.0
200501KD50461,553450,190550,0.213887,51.592851,1,3,1,1,21/07/2005,5,00:27,15,E09000016,3,12,3,50,3,4,3,127,0,4,4,1,1,0,0,1,1,E01002310,2025-12-09 00:27:00,0,,,
200501KD50462,558210,189020,0.281859,51.57779,1,3,3,1,01/08/2005,2,11:50,15,E09000016,1,25,3,70,0,-1,-1,0,0,0,1,1,1,0,0,2,1,E01002259,2025-12-09 11:50:00,11,2005-01-08,Saturday,1.0
200501KD50463,553400,190520,0.213153,51.592595,1,3,2,1,30/07/2005,7,16:52,15,E09000016,3,12,3,30,1,4,3,127,0,0,1,1,1,0,0,1,1,E01002293,2025-12-09 16:52:00,16,,,
200501KD50464,551800,184670,0.187548,51.540466,1,3,2,1,27/07/2005,4,10:15,15,E09000016,3,125,6,30,3,4,6,0,0,0,1,1,1,0,0,1,1,E01002260,2025-12-09 10:15:00,10,,,
200501KD50465,550530,189650,0.171379,51.585552,1,3,2,1,24/07/2005,1,07:52,15,E09000016,3,12,6,30,6,4,6,0,0,0,1,1,1,0,0,1,1,E01002245,2025-12-09 07:52:00,7,,,
200501KD50466,552530,189820,0.200299,51.586542,1,3,2,2,21/08/2005,1,19:00,15,E09000016,3,118,6,30,0,-1,-1,0,0,0,4,1,1,0,0,1,2,E01002379,2025-12-09 19:00:00,19,,,
200501KD50467,554230,186090,0.223182,51.552567,1,2,1,1,24/07/2005,1,17:40,15,E09000016,6,0,6,30,3,4,6,0,0,0,1,1,1,0,0,1,1,E01002290,2025-12-09 17:40:00,17,,,
200501KD50468,558370,185350,0.282514,51.544772,1,3,4,2,25/07/2005,2,15:45,15,E09000016,1,25,3,70,0,-1,-1,0,0,0,1,1,1,0,0,2,1,E01002385,2025-12-09 15:45:00,15,,,
200501KD50469,553950,190070,0.220889,51.588402,1,3,2,1,13/08/2005,7,13:30,15,E09000016,3,127,6,30,3,4,6,0,0,0,1,1,1,0,0,1,1,E01002377,2025-12-09 13:30:00,13,,,
200501KD50470,554070,191820,0.223388,51.604093,1,3,2,1,26/07/2005,3,09:15,15,E09000016,6,0,6,30,3,4,6,0,0,0,1,1,1,0,0,1,1,E01002284,2025-12-09 09:15:00,9,,,
200501KD50471,556000,186470,0.24886,51.555494,1,3,2,1,30/07/2005,7,17:00,15,E09000016,4,1421,6,30,0,-1,-1,0,0,0,1,1,1,0,0,1,2,E01002386,2025-12-09 17:00:00,17,,,
200501KD50472,553350,190520,0.212432,51.592609,1,3,2,2,30/07/2005,7,21:50,15,E09000016,3,12,6,30,1,4,3,12,0,0,1,1,1,0,0,1,1,E01002337,2025-12-09 21:50:00,21,,,
200501KD50473,550620,189760,0.172725,51.586516,1,3,2,2,02/08/2005,3,11:57,15,E09000016,3,12,6,40,6,2,4,174,0,5,1,1,1,0,0,1,1,E01002338,2025-12-09 11:57:00,11,2005-02-08,Tuesday,2.0
200501KD50474,554890,188720,0.233852,51.576016,1,3,2,1,04/08/2005,5,14:56,15,E09000016,6,0,6,30,8,4,6,0,0,0,1,1,1,0,0,1,1,E01002271,2025-12-09 14:56:00,14,2005-04-08,Friday,4.0
200501KD50475,554980,191850,0.236531,51.604113,1,3,1,1,07/08/2005,1,14:15,15,E09000016,5,0,6,30,0,-1,-1,0,0,0,1,1,1,0,0,1,1,E01002283,2025-12-09 14:15:00,14,2005-07-08,Friday,7.0
200501KD50476,555130,186810,0.23647,51.558789,1,2,2,1,29/08/2005,2,15:00,15,E09000016,3,124,6,30,3,4,6,0,0,0,1,1,1,0,0,1,1,E01002362,2025-12-09 15:00:00,15,,,
200501KD50477,552900,187390,0.204579,51.564609,1,3,2,2,06/08/2005,7,14:44,15,E09000016,3,124,6,30,3,4,6,0,0,0,1,1,1,0,0,1,1,E01002321,2025-12-09 14:44:00,14,2005-06-08,Wednesday,6.0
200501KD50478,551560,188860,0.185894,51.578178,1,2,1,1,30/08/2005,3,17:30,15,E09000016,5,0,3,40,1,4,5,0,0,0,1,1,1,0,0,1,1,E01002357,2025-12-09 17:30:00,17,,,
200501KD50479,550230,187220,0.166014,51.563798,1,2,2,3,08/08/2005,2,13:30,15,E09000016,3,124,6,30,3,4,6,0,0,0,1,1,1,0,0,1,1,E01002251,2025-12-09 13:30:00,13,2005-08-08,Monday,8.0
200501KD50480,559160,185320,0.293883,51.54428,1,3,2,1,11/08/2005,5,12:45,15,E09000016,4,186,6,30,3,4,4,1421,0,0,1,1,1,0,0,2,2,E01002385,2025-12-09 12:45:00,12,2005-11-08,Tuesday,11.0
200501KD50482,555290,186770,0.238759,51.558386,1,3,1,1,05/08/2005,6,23:11,15,E09000016,3,124,6,30,0,-1,-1,0,0,0,4,1,1,0,0,1,1,E01002289,2025-12-09 23:11:00,23,2005-05-08,Sunday,5.0
200501KD50483,550390,187280,0.168346,51.564295,1,2,3,1,07/09/2005,4,21:56,15,E09000016,3,124,6,30,3,4,6,0,0,0,4,1,1,0,0,1,1,E01002251,2025-12-09 21:56:00,21,2005-07-09,Saturday,7.0
200501KD50485,553830,187310,0.21795,51.563637,1,3,2,2,15/08/2005,2,13:03,15,E09000016,6,0,6,30,8,4,6,0,0,0,1,1,1,0,0,1,1,E01002361,2025-12-09 13:03:00,13,,,
200501KD50486,558450,188310,0.284999,51.571343,1,3,2,1,16/08/2005,3,09:50,15,E09000016,1,25,3,70,5,4,3,127,0,0,1,1,1,0,0,2,2,E01002252,2025-12-09 09:50:00,9,,,
200501KD50487,558200,189030,0.281719,51.577882,1,2,2,1,15/08/2005,2,13:35,15,E09000016,1,25,3,70,0,-1,-1,0,0,0,1,1,1,0,0,2,1,E01002259,2025-12-09 13:35:00,13,,,
200501KD50488,555730,191760,0.247312,51.603098,1,3,2,1,01/08/2005,2,09:50,15,E09000016,3,12,3,50,8,4,5,0,0,0,1,1,1,0,0,1,1,E01002296,2025-12-09 09:50:00,9,2005-01-08,Saturday,1.0
200501KD50489,552340,188410,0.196947,51.573925,1,3,2,1,03/08/2005,4,12:30,15,E09000016,5,0,6,30,3,4,6,0,0,0,1,1,1,0,0,1,2,E01002352,2025-12-09 12:30:00,12,2005-03-08,Tuesday,3.0
200501KD50490,554160,189900,0.223844,51.586818,1,3,1,1,05/08/2005,6,14:00,15,E09000016,5,0,6,30,6,2,3,127,0,5,1,1,1,0,0,1,2,E01002377,2025-12-09 14:00:00,14,2005-05-08,Sunday,5.0
200501KD50491,550080,189210,0.164701,51.581719,1,3,2,1,05/08/2005,6,10:40,15,E09000016,3,12,3,30,7,2,5,0,0,5,1,1,1,0,0,1,2,E01002329,2025-12-09 10:40:00,10,2005-05-08,Sunday,5.0
200501KD50492,551490,188090,0.184553,51.571278,1,3,1,1,05/08/2005,6,13:30,15,E09000016,5,0,6,30,0,-1,-1,0,0,1,1,1,1,0,0,1,1,E01002350,2025-12-09 13:30:00,13,2005-05-08,Sunday,5.0
200501KD50493,554200,185700,0.222579,51.549071,1,3,2,1,07/08/2005,1,15:30,15,E09000016,6,0,6,30,3,4,6,0,0,0,1,1,1,0,0,1,1,E01002290,2025-12-09 15:30:00,15,2005-07-08,Friday,7.0
200501KD50494,551840,182860,0.187344,51.524193,1,3,2,2,08/08/2005,2,17:25,15,E09000016,6,0,6,30,3,4,6,0,0,0,1,1,1,0,0,1,1,E01002370,2025-12-09 17:25:00,17,2005-08-08,Monday,8.0
200501KD50495,550620,189750,0.17272,51.586427,1,3,2,2,10/08/2005,4,20:10,15,E09000016,3,125,6,30,6,2,3,12,0,0,4,1,1,0,0,1,1,E01002338,2025-12-09 20:10:00,20,2005-10-08,Saturday,10.0
200501KD50496,551440,189970,0.184642,51.588184,1,3,2,1,22/08/2005,2,17:39,15,E09000016,5,0,6,30,3,4,6,0,0,0,1,2,2,0,0,1,1,E01002339,2025-12-09 17:39:00,17,,,
200501KD50497,557040,188940,0.264952,51.577398,1,3,2,1,27/05/2005,6,18:19,15,E09000016,3,127,3,50,3,4,6,0,0,0,1,1,1,0,0,2,1,E01002296,2025-12-09 18:19:00,18,,,
200501KD50499,552940,185640,0.204395,51.548874,1,3,2,1,13/08/2005,7,17:25,15,E09000016,5,0,6,30,3,4,6,0,0,0,1,2,2,0,0,1,1,E01002287,2025-12-09 17:25:00,17,,,
200501KD50500,550250,189060,0.167089,51.580326,1,3,2,3,17/08/2005,4,12:26,15,E09000016,5,0,6,30,3,4,6,0,0,0,1,1,1,0,0,1,1,E01002244,2025-12-09 12:26:00,12,,,
200501KD50501,558440,188320,0.28486,51.571436,1,3,2,1,28/07/2005,5,06:30,15,E09000016,1,25,3,70,1,4,3,127,0,0,1,1,1,0,0,2,1,E01002252,2025-12-09 06:30:00,6,,,
200501KD50502,556260,189100,0.253776,51.579052,1,3,2,4,16/08/2005,3,22:35,15,E09000016,5,0,3,60,3,4,6,0,0,0,4,1,1,0,0,2,1,E01002296,2025-12-09 22:35:00,22,,,
200501KD50503,554810,190530,0.233496,51.5923,1,3,2,1,16/08/2005,3,14:34,15,E09000016,6,0,6,30,0,-1,-1,0,0,0,1,1,1,0,0,1,1,E01002294,2025-12-09 14:34:00,14,,,
200501KD50504,553400,190540,0.213162,51.592775,1,2,2,1,30/08/2005,3,13:14,15,E09000016,3,12,1,50,1,4,3,127,0,0,1,1,1,0,0,1,1,E01002310,2025-12-09 13:14:00,13,,,
200501KD50505,549910,187120,0.161358,51.562985,1,3,2,1,30/08/2005,3,20:09,15,E09000016,3,124,6,30,3,4,6,0,0,0,1,1,1,0,0,1,1,E01002251,2025-12-09 20:09:00,20,,,
200501KD50506,554670,180290,0.226978,51.500334,1,3,2,1,17/08/2005,4,18:20,15,E09000016,3,13,3,70,5,4,3,1306,0,0,1,1,1,0,0,2,1,E01002344,2025-12-09 18:20:00,18,,,
200501KD50507,553080,188880,0.207822,51.577947,1,3,1,1,25/08/2005,5,14:48,15,E09000016,5,0,1,30,1,4,5,0,0,0,1,2,2,0,0,1,1,E01002379,2025-12-09 14:48:00,14,,,
200501KD50508,553020,190590,0.207702,51.593328,1,3,2,1,19/08/2005,6,18:30,15,E09000016,3,12,3,60,0,-1,-1,0,0,0,1,1,1,0,0,2,1,E01002311,2025-12-09 18:30:00,18,,,
200501KD50509,552500,187420,0.198825,51.564986,1,3,3,1,19/08/2005,6,15:37,15,E09000016,3,124,6,30,0,-1,-1,0,0,0,1,2,2,0,0,1,1,E01002321,2025-12-09 15:37:00,15,,,
200501KD50510,550980,189140,0.177651,51.580849,1,3,2,2,22/08/2005,2,20:38,15,E09000016,6,0,6,30,8,4,3,125,0,0,1,2,2,0,0,1,1,E01002243,2025-12-09 20:38:00,20,,,
200501KD50511,550910,192370,0.178029,51.60989,1,3,2,1,22/08/2005,2,23:17,15,E09000016,4,175,6,30,3,4,6,0,0,0,4,2,2,0,0,1,1,E01002304,2025-12-09 23:17:00,23,,,
200501KD50513,551660,181480,0.184158,51.511842,1,3,1,1,22/08/2005,2,03:15,15,E09000016,3,13,3,50,5,4,5,0,0,0,4,1,1,0,0,2,1,E01002344,2025-12-09 03:15:00,3,,,
200501KD50514,552660,187390,0.201119,51.564674,1,3,2,2,23/08/2005,3,10:00,15,E09000016,6,0,6,30,3,4,3,124,0,4,1,2,2,0,0,1,1,E01002321,2025-12-09 10:00:00,10,,,
200501KD50515,551090,192830,0.180825,51.613975,1,3,1,1,23/08/2005,3,02:28,15,E09000016,4,175,6,30,0,-1,-1,0,0,0,4,1,2,0,0,1,1,E01002304,2025-12-09 02:28:00,2,,,
200501KD50516,553100,188990,0.208158,51.57893,1,3,2,1,26/08/2005,6,17:20,15,E09000016,5,0,6,30,8,4,6,0,0,0,1,1,1,0,0,1,1,E01002379,2025-12-09 17:20:00,17,,,
200501KD50517,551590,188800,0.186301,51.577631,1,2,1,1,25/08/2005,5,09:50,15,E09000016,5,0,3,50,0,-1,-1,0,0,1,1,1,1,0,0,1,1,E01002357,2025-12-09 09:50:00,9,,,
200501KD50518,549940,188400,0.162336,51.574478,1,2,1,1,26/08/2005,6,02:16,15,E09000016,6,0,6,30,3,4,3,118,0,0,4,1,1,0,0,1,1,E01002246,2025-12-09 02:16:00,2,,,
200501KD50519,553410,190490,0.213284,51.592323,1,3,2,3,01/09/2005,5,21:30,15,E09000016,3,12,1,30,1,4,3,127,0,0,4,1,1,0,0,1,1,E01002383,2025-12-09 21:30:00,21,2005-01-09,Sunday,1.0
200501KD50520,551440,189970,0.184642,51.588184,1,3,2,1,05/09/2005,2,12:17,15,E09000016,5,0,6,30,3,4,6,0,0,0,1,1,1,0,0,1,1,E01002339,2025-12-09 12:17:00,12,2005-05-09,Monday,5.0
200501KD50521,553530,192310,0.215811,51.608643,1,3,2,1,05/09/2005,2,19:20,15,E09000016,6,0,6,30,3,4,6,0,0,0,1,1,1,0,0,1,1,E01002282,2025-12-09 19:20:00,19,2005-05-09,Monday,5.0
200501KD50522,556210,183550,0.250591,51.529201,1,3,3,1,06/09/2005,3,17:55,15,E09000016,5,0,6,30,3,4,6,0,0,0,1,1,1,0,0,2,2,E01002385,2025-12-09 17:55:00,17,2005-06-09,Thursday,6.0
200501KD50524,554190,191980,0.22519,51.605498,1,2,2,1,28/08/2005,1,14:15,15,E09000016,5,0,6,30,3,4,6,0,0,0,1,1,1,0,0,1,1,E01002284,2025-12-09 14:15:00,14,,,
200501KD50525,553370,190550,0.212733,51.592873,1,3,2,1,13/08/2005,7,11:15,15,E09000016,3,12,1,30,1,4,3,127,0,0,1,1,1,0,0,1,2,E01002310,2025-12-09 11:15:00,11,,,
200501KD50526,554610,189580,0.230193,51.583819,1,3,2,2,13/08/2005,7,02:20,15,E09000016,3,127,3,50,0,-1,-1,0,0,0,4,1,1,0,3,1,1,E01002378,2025-12-09 02:20:00,2,,,
200501KD50527,553190,190330,0.210041,51.590945,1,3,2,1,31/08/2005,4,17:15,15,E09000016,5,0,3,40,3,2,3,118,0,5,1,1,1,0,0,1,2,E01002383,2025-12-09 17:15:00,17,,,
200501KD50528,558360,188470,0.283774,51.572806,1,3,2,1,03/09/2005,7,07:40,15,E09000016,1,25,1,30,1,4,3,127,0,0,1,1,1,0,0,2,1,E01002252,2025-12-09 07:40:00,7,2005-03-09,Wednesday,3.0
200501KD50529,551240,190420,0.181951,51.592281,1,3,3,1,15/08/2005,2,16:16,15,E09000016,3,12,3,50,6,2,5,0,0,0,1,1,1,0,0,1,1,E01002334,2025-12-09 16:16:00,16,,,
200501KD50530,554640,186930,0.22946,51.560002,1,3,1,2,08/09/2005,5,22:45,15,E09000016,3,124,6,30,6,2,5,0,0,5,4,1,1,0,0,1,1,E01002360,2025-12-09 22:45:00,22,2005-08-09,Tuesday,8.0
200501KD50531,554750,184970,0.230184,51.542361,1,2,1,1,11/09/2005,1,10:35,15,E09000016,5,0,6,30,0,-1,-1,0,0,0,1,1,2,0,0,2,1,E01002385,2025-12-09 10:35:00,10,2005-11-09,Wednesday,11.0
200501KD50532,552710,185950,0.201214,51.551722,1,3,1,1,15/09/2005,5,22:25,15,E09000016,5,0,6,30,0,-1,-1,0,0,0,4,2,2,0,0,1,1,E01002365,2025-12-09 22:25:00,22,,,
200501KD50534,554180,189890,0.224128,51.586722,1,3,2,1,16/08/2005,3,11:50,15,E09000016,3,127,3,40,7,2,5,0,0,0,1,1,1,0,0,1,1,E01002378,2025-12-09 11:50:00,11,,,
200501KD50535,555010,188700,0.235574,51.575803,1,3,2,1,18/08/2005,5,08:03,15,E09000016,5,0,6,30,3,4,6,0,0,0,1,1,1,0,0,1,1,E01002269,2025-12-09 08:03:00,8,,,
200501KD50536,554130,192050,0.224355,51.606143,1,3,2,1,20/08/2005,7,17:45,15,E09000016,5,0,6,30,3,4,6,0,0,0,1,1,1,0,0,1,2,E01002282,2025-12-09 17:45:00,17,,,
200501KD50537,553280,189940,0.211169,51.587417,1,3,2,1,20/08/2005,7,15:56,15,E09000016,5,0,6,30,3,4,6,0,0,0,1,1,1,0,0,1,1,E01002383,2025-12-09 15:56:00,15,,,
200501KD50538,554560,189680,0.229516,51.584732,1,3,2,1,21/08/2005,1,00:15,15,E09000016,6,0,6,30,3,4,6,0,0,0,4,1,1,0,0,1,2,E01002268,2025-12-09 00:15:00,0,,,
200501KD50539,550910,187940,0.176126,51.570086,1,3,1,1,21/08/2005,1,08:29,15,E09000016,5,0,6,30,0,-1,-1,0,0,0,1,1,1,0,0,1,1,E01002249,2025-12-09 08:29:00,8,,,
200501KD50540,555680,191740,0.246582,51.602932,1,3,2,2,11/09/2005,1,20:50,15,E09000016,3,12,3,50,6,2,6,0,0,5,4,1,2,0,0,1,1,E01002296,2025-12-09 20:50:00,20,2005-11-09,Wednesday,11.0
200501KD50541,554960,190250,0.235536,51.589743,1,3,2,1,06/09/2005,3,08:25,15,E09000016,5,0,6,30,3,4,6,0,0,0,1,1,1,0,0,1,1,E01002294,2025-12-09 08:25:00,8,2005-06-09,Thursday,6.0
200501KD50542,550950,189190,0.177239,51.581307,1,2,1,3,21/09/2005,4,20:55,15,E09000016,3,125,6,30,3,4,6,0,0,4,4,1,1,0,0,1,1,E01002243,2025-12-09 20:55:00,20,,,
200501KD50544,551230,188650,0.181045,51.57638,1,3,2,1,08/09/2005,5,22:30,15,E09000016,6,0,6,30,8,4,6,0,0,0,4,1,1,0,0,1,2,E01002356,2025-12-09 22:30:00,22,2005-08-09,Tuesday,8.0
200501KD50545,554270,193730,0.227114,51.621199,1,3,2,3,02/09/2005,6,18:25,15,E09000016,5,0,6,30,3,4,5,0,0,0,1,1,1,0,0,2,2,E01002276,2025-12-09 18:25:00,18,2005-02-09,Wednesday,2.0
200501KD50546,551960,187410,0.191036,51.565042,1,3,1,2,12/09/2005,2,08:00,15,E09000016,3,124,3,30,0,-1,-1,0,0,0,1,1,1,0,0,1,1,E01002319,2025-12-09 08:00:00,8,2005-12-09,Friday,12.0
200501KD50547,553980,187160,0.220047,51.562249,1,3,2,2,13/09/2005,3,10:05,15,E09000016,3,124,6,30,3,4,5,0,0,0,1,1,1,0,0,1,1,E01002361,2025-12-09 10:05:00,10,,,
200501KD50548,558240,188900,0.282237,51.576703,1,3,2,1,11/09/2005,1,00:17,15,E09000016,1,25,3,70,0,-1,-1,0,0,0,4,2,2,0,0,2,1,E01002259,2025-12-09 00:17:00,0,2005-11-09,Wednesday,11.0
200501KD50549,552220,183210,0.192968,51.527235,1,3,3,2,13/09/2005,3,10:00,15,E09000016,3,125,6,30,3,4,6,0,0,0,1,1,1,0,0,1,1,E01002370,2025-12-09 10:00:00,10,,,
200501KD50550,555980,186540,0.248602,51.556129,1,3,1,1,02/09/2005,6,17:00,15,E09000016,3,124,6,30,6,2,5,0,0,0,1,1,1,0,0,1,1,E01002386,2025-12-09 17:00:00,17,2005-02-09,Wednesday,2.0
200501KD50551,557130,184380,0.264213,51.536403,1,2,2,3,16/09/2005,6,07:10,15,E09000016,6,0,6,30,0,-1,-1,0,0,0,1,1,1,0,0,2,1,E01002385,2025-12-09 07:10:00,7,,,
200501KD50552,549890,187720,0.161325,51.568381,1,3,2,2,06/09/2005,3,13:20,15,E09000016,6,0,1,30,2,4,6,0,0,0,1,1,1,0,0,1,1,E01002248,2025-12-09 13:20:00,13,2005-06-09,Thursday,6.0
200501KD50553,551920,183340,0.188703,51.528484,1,3,1,1,16/09/2005,6,16:12,15,E09000016,6,0,6,30,0,-1,-1,0,0,0,1,1,1,0,0,1,1,E01002371,2025-12-09 16:12:00,16,,,
200501KD50554,551060,191700,0.179906,51.60383,1,3,1,1,16/09/2005,6,17:30,15,E09000016,4,1459,6,30,6,4,4,175,0,0,1,1,1,0,0,1,2,E01002303,2025-12-09 17:30:00,17,,,
200501KD50555,553140,189260,0.208853,51.581345,1,3,1,1,13/09/2005,3,17:53,15,E09000016,5,0,6,30,2,4,5,0,0,0,1,1,1,0,0,1,1,E01002379,2025-12-09 17:53:00,17,,,
200501KD50556,551440,188550,0.18403,51.575425,1,3,1,1,17/09/2005,7,01:45,15,E09000016,6,0,2,30,3,4,6,0,0,0,4,1,1,0,0,1,1,E01002356,2025-12-09 01:45:00,1,,,
200501KD50557,551230,190440,0.181816,51.592463,1,3,2,4,10/09/2005,7,12:00,15,E09000016,5,0,6,30,3,4,3,12,0,0,1,1,1,0,0,1,2,E01002334,2025-12-09 12:00:00,12,2005-10-09,Sunday,10.0
200501KD50558,553390,190560,0.213026,51.592958,1,3,2,1,15/09/2005,5,08:30,15,E09000016,5,0,6,30,3,4,3,12,0,0,1,1,1,0,0,1,1,E01002310,2025-12-09 08:30:00,8,,,
200501KD50559,558150,186830,0.280009,51.558131,1,3,2,1,04/08/2005,5,10:43,15,E09000016,6,0,6,30,8,4,4,187,0,0,1,1,1,0,0,2,1,E01002391,2025-12-09 10:43:00,10,2005-04-08,Friday,4.0
200501KD50560,555070,188420,0.236315,51.573271,1,3,2,2,03/09/2005,7,12:00,15,E09000016,5,0,6,30,3,4,6,0,0,0,1,1,1,0,0,1,1,E01002273,2025-12-09 12:00:00,12,2005-03-09,Wednesday,3.0
200501KD50561,549980,189530,0.163395,51.58462,1,3,1,1,20/09/2005,3,06:16,15,E09000016,5,0,6,30,0,-1,-1,0,0,0,1,1,1,0,0,1,1,E01002329,2025-12-09 06:16:00,6,,,
200501KD50562,550270,188350,0.167073,51.573941,1,3,2,5,16/09/2005,6,18:34,15,E09000016,3,118,6,30,3,4,6,0,0,0,1,1,1,0,0,1,1,E01002247,2025-12-09 18:34:00,18,,,
200501KD50564,551450,188150,0.184002,51.571828,1,3,2,1,18/09/2005,1,21:25,15,E09000016,5,0,3,50,6,2,5,0,0,5,4,1,1,0,0,1,1,E01002350,2025-12-09 21:25:00,21,,,
200501KD50566,551990,183380,0.189729,51.528825,1,3,2,1,17/09/2005,7,17:20,15,E09000016,3,125,6,30,6,2,5,0,0,0,1,1,1,0,0,1,2,E01002374,2025-12-09 17:20:00,17,,,
200501KD50568,556050,186700,0.249682,51.557547,1,3,1,1,23/09/2005,6,18:30,15,E09000016,5,0,6,30,0,-1,-1,0,0,4,1,1,1,0,0,1,1,E01002386,2025-12-09 18:30:00,18,,,
200501KD50569,554060,187080,0.221165,51.561508,1,3,2,1,19/09/2005,2,07:55,15,E09000016,3,124,6,30,0,-1,-1,0,0,0,1,1,1,0,0,1,2,E01002361,2025-12-09 07:55:00,7,,,
200501KD50570,550470,183030,0.167683,51.526087,1,3,1,1,21/09/2005,4,11:52,15,E09000016,6,0,6,30,0,-1,-1,0,0,0,1,1,1,0,0,1,1,E01002368,2025-12-09 11:52:00,11,,,
200501KD50571,553870,187190,0.218475,51.562548,1,3,1,1,10/09/2005,7,11:59,15,E09000016,3,124,6,30,0,-1,-1,0,0,1,1,1,1,0,0,1,1,E01002361,2025-12-09 11:59:00,11,2005-10-09,Sunday,10.0
200501KD50572,551420,187850,0.18344,51.569141,1,3,2,1,22/09/2005,5,17:45,15,E09000016,3,125,3,40,0,-1,-1,0,0,0,1,1,1,0,0,1,1,E01002350,2025-12-09 17:45:00,17,,,
200501KD50573,551190,190380,0.181213,51.591935,1,3,2,1,11/09/2005,1,10:05,15,E09000016,3,12,3,50,0,-1,-1,0,0,0,1,1,1,0,0,1,1,E01002334,2025-12-09 10:05:00,10,2005-11-09,Wednesday,11.0
200501KD50574,550940,188810,0.176932,51.577895,1,3,1,1,19/09/2005,2,09:57,15,E09000016,3,118,6,30,3,4,5,0,0,0,1,1,1,0,0,1,1,E01002243,2025-12-09 09:57:00,9,,,
200501KD50575,555550,191680,0.24468,51.602429,1,3,2,1,17/09/2005,7,07:58,15,E09000016,3,12,6,30,3,2,5,0,0,0,1,1,1,0,0,1,1,E01002283,2025-12-09 07:58:00,7,,,
200501KD50576,556210,183500,0.250569,51.528752,1,3,2,3,20/09/2005,3,17:22,15,E09000016,5,0,6,30,6,4,5,0,0,0,1,1,1,0,0,2,1,E01002385,2025-12-09 17:22:00,17,,,
200501KD50577,550090,190490,0.165392,51.593217,1,3,2,1,20/09/2005,3,14:35,15,E09000016,4,174,6,30,0,-1,-1,0,0,0,1,1,1,0,0,1,1,E01002327,2025-12-09 14:35:00,14,,,
200501KD50578,552010,182360,0.189577,51.519655,1,3,1,1,03/10/2005,2,10:50,15,E09000016,6,0,1,30,1,4,4,1335,0,0,1,1,1,0,0,1,1,E01002345,2025-12-09 10:50:00,10,2005-03-10,Thursday,3.0
200501KD50579,551530,187550,0.184897,51.566416,1,3,2,2,28/09/2005,4,22:22,15,E09000016,6,0,6,30,3,4,6,0,0,0,4,2,2,0,0,1,1,E01002249,2025-12-09 22:22:00,22,,,
200501KD50580,550880,190050,0.176599,51.589053,1,3,1,1,30/09/2005,6,11:40,15,E09000016,3,12,6,30,0,-1,-1,0,0,0,1,1,1,0,0,1,1,E01002338,2025-12-09 11:40:00,11,,,
200501KD50581,552110,182730,0.191177,51.522952,1,3,3,1,18/09/2005,1,12:05,15,E09000016,3,125,6,30,0,-1,-1,0,0,0,1,1,1,0,0,1,1,E01002370,2025-12-09 12:05:00,12,,,
200501KD50582,553090,191870,0.20927,51.604809,1,3,2,1,29/09/2005,5,13:13,15,E09000016,5,0,6,30,3,4,5,0,0,0,1,1,1,0,0,1,1,E01002311,2025-12-09 13:13:00,13,,,
200501KD50583,556090,183480,0.248832,51.528605,1,3,1,1,30/09/2005,6,08:45,15,E09000016,5,0,6,30,0,-1,-1,0,0,0,1,1,1,0,0,2,1,E01002385,2025-12-09 08:45:00,8,,,
200501KD50584,551450,188170,0.184011,51.572008,1,3,2,3,25/09/2005,1,13:55,15,E09000016,5,0,6,30,6,2,5,0,0,5,1,1,1,0,0,1,2,E01002356,2025-12-09 13:55:00,13,,,
200501KD50585,551950,188190,0.191229,51.572053,1,3,2,1,24/09/2005,7,22:25,15,E09000016,5,0,6,30,2,4,5,0,0,1,4,1,1,0,0,1,1,E01002351,2025-12-09 22:25:00,22,,,
200501KD50586,555120,192090,0.238657,51.606231,1,2,2,2,21/08/2005,1,20:00,15,E09000016,6,0,6,30,3,4,6,0,0,0,1,1,1,0,0,1,1,E01002277,2025-12-09 20:00:00,20,,,
200501KD50588,551210,188120,0.180529,51.571623,1,3,2,1,30/09/2005,6,08:05,15,E09000016,3,125,6,30,1,4,3,125,0,0,1,1,1,0,0,1,1,E01002249,2025-12-09 08:05:00,8,,,
200501KD50589,552940,190040,0.206308,51.588408,1,3,2,1,03/10/2005,2,16:30,15,E09000016,3,118,6,30,0,-1,-1,0,0,0,1,1,1,0,0,1,1,E01002376,2025-12-09 16:30:00,16,2005-03-10,Thursday,3.0
200501KD50590,551270,193040,0.183513,51.615813,1,3,2,1,05/10/2005,4,16:40,15,E09000016,4,175,2,30,3,4,5,0,0,0,1,1,1,0,0,1,1,E01002304,2025-12-09 16:40:00,16,2005-05-10,Tuesday,5.0
200501KD50591,550010,191400,0.164627,51.601415,1,3,2,1,29/08/2005,2,12:28,15,E09000016,6,0,6,30,3,4,6,0,0,0,1,1,1,0,0,1,1,E01002302,2025-12-09 12:28:00,12,,,
200501KD50592,554140,186140,0.221907,51.55304,1,3,2,1,01/10/2005,7,21:59,15,E09000016,6,0,6,30,6,4,6,0,0,0,4,1,1,0,0,1,1,E01002290,2025-12-09 21:59:00,21,2005-01-10,Monday,1.0
200501KD50593,553480,187200,0.212857,51.562744,1,2,2,1,05/10/2005,4,18:37,15,E09000016,3,124,6,30,3,4,3,124,0,0,1,1,1,0,0,1,1,E01002361,2025-12-09 18:37:00,18,2005-05-10,Tuesday,5.0
200501KD50594,557210,183950,0.265174,51.532518,1,3,3,4,04/10/2005,3,07:52,15,E09000016,5,0,6,60,3,4,6,0,0,0,1,1,1,0,0,2,1,E01002385,2025-12-09 07:52:00,7,2005-04-10,Sunday,4.0
200501KD50597,555450,191600,0.243202,51.601737,1,3,2,2,06/10/2005,5,10:22,15,E09000016,3,12,3,50,9,4,6,0,0,0,1,1,1,0,0,1,1,E01002298,2025-12-09 10:22:00,10,2005-06-10,Friday,6.0
200501KD50598,555640,193580,0.246821,51.619474,1,3,2,2,07/10/2005,6,09:00,15,E09000016,1,25,3,70,0,-1,-1,0,0,0,1,1,1,0,0,2,1,E01002276,2025-12-09 09:00:00,9,2005-07-10,Sunday,7.0
200501KD50599,552070,182230,0.190385,51.51847,1,2,1,1,06/10/2005,5,15:50,15,E09000016,4,1335,6,30,3,4,4,1335,0,0,1,1,1,0,0,1,1,E01002345,2025-12-09 15:50:00,15,2005-06-10,Friday,6.0
200501KD50600,552260,188350,0.195768,51.573407,1,3,1,2,08/10/2005,7,20:08,15,E09000016,5,0,6,30,3,4,6,0,0,0,4,1,1,0,0,1,1,E01002352,2025-12-09 20:08:00,20,2005-08-10,Wednesday,8.0
200501KD50601,553140,187270,0.207986,51.563465,1,3,1,1,25/10/2005,3,23:27,15,E09000016,3,124,6,30,3,4,6,0,0,0,4,1,1,0,0,1,1,E01002321,2025-12-09 23:27:00,23,,,
200501KD50603,553430,190480,0.213568,51.592228,1,3,2,1,08/10/2005,7,18:56,15,E09000016,3,127,6,30,0,-1,-1,0,0,4,1,1,1,0,0,1,1,E01002293,2025-12-09 18:56:00,18,2005-08-10,Wednesday,8.0
200501KD50604,555990,185280,0.248188,51.544805,1,2,1,1,10/10/2005,2,17:56,15,E09000016,4,1421,6,30,0,-1,-1,0,0,0,1,1,1,0,0,1,1,E01002388,2025-12-09 17:56:00,17,2005-10-10,Monday,10.0
200501KD50605,550550,188410,0.171137,51.574405,1,3,2,3,09/10/2005,1,16:33,15,E09000016,3,118,6,30,7,4,6,0,0,0,4,1,1,0,0,1,1,E01002356,2025-12-09 16:33:00,16,2005-09-10,Saturday,9.0
200501KD50607,553510,190570,0.214761,51.593015,1,3,4,1,15/10/2005,7,12:43,15,E09000016,3,12,3,50,0,-1,-1,0,0,0,1,1,1,0,0,1,1,E01002293,2025-12-09 12:43:00,12,,,
200501KD50608,552930,188580,0.205529,51.575293,1,3,2,1,15/10/2005,7,13:25,15,E09000016,5,0,6,30,3,4,6,0,0,0,1,1,1,0,0,1,1,E01002382,2025-12-09 13:25:00,13,,,
200501KD50609,553780,191170,0.218919,51.598332,1,3,2,1,11/10/2005,3,10:25,15,E09000016,6,0,6,30,8,4,6,0,0,0,1,1,1,0,0,1,1,E01002316,2025-12-09 10:25:00,10,2005-11-10,Thursday,11.0
200501KD50610,553390,190540,0.213017,51.592778,1,3,2,1,11/10/2005,3,07:23,15,E09000016,3,12,1,30,1,4,3,12,0,0,1,1,1,0,0,1,1,E01002310,2025-12-09 07:23:00,7,2005-11-10,Thursday,11.0
200501KD50611,549540,191580,0.157922,51.603157,1,3,2,1,13/10/2005,5,22:05,15,E09000016,6,0,6,30,3,4,6,0,0,0,4,1,1,0,0,1,1,E01002308,2025-12-09 22:05:00,22,,,
200501KD50612,553620,190630,0.216374,51.593524,1,3,1,1,11/10/2005,3,12:00,15,E09000016,3,12,6,30,8,4,6,0,0,0,1,1,1,0,0,1,1,E01002293,2025-12-09 12:00:00,12,2005-11-10,Thursday,11.0
200501KD50613,553120,189250,0.20856,51.581261,1,3,2,3,15/10/2005,7,20:15,15,E09000016,5,0,6,30,2,4,5,0,0,0,4,2,2,0,0,1,2,E01002379,2025-12-09 20:15:00,20,,,
200501KD50614,549620,191550,0.159064,51.602866,1,3,2,1,15/10/2005,7,13:10,15,E09000016,6,0,6,30,3,4,6,0,0,0,1,1,1,0,0,1,3,E01002302,2025-12-09 13:10:00,13,,,
200501KD50615,553930,187890,0.219646,51.568821,1,3,2,1,03/10/2005,2,07:55,15,E09000016,5,0,6,30,0,-1,-1,0,0,0,1,1,1,0,0,1,2,E01002274,2025-12-09 07:55:00,7,2005-03-10,Thursday,3.0
200501KD50616,551240,190410,0.181947,51.592191,1,3,2,2,19/10/2005,4,18:52,15,E09000016,5,0,3,50,6,2,3,12,0,5,4,2,2,0,0,1,1,E01002334,2025-12-09 18:52:00,18,,,
200501KD50617,554010,192300,0.222733,51.608422,1,3,2,1,19/10/2005,4,08:46,15,E09000016,5,0,1,30,1,4,5,0,0,1,1,1,2,0,0,1,1,E01002278,2025-12-09 08:46:00,8,,,
200501KD50618,554250,189940,0.225159,51.587152,1,3,1,1,17/10/2005,2,10:25,15,E09000016,5,0,6,30,0,-1,-1,0,0,0,1,1,1,0,0,1,1,E01002268,2025-12-09 10:25:00,10,,,
200501KD50619,552860,185250,0.203072,51.545392,1,3,3,2,05/10/2005,4,18:30,15,E09000016,5,0,6,30,8,4,5,0,0,0,1,1,1,0,0,1,2,E01002265,2025-12-09 18:30:00,18,2005-05-10,Tuesday,5.0
200501KD50620,555060,191800,0.237663,51.603642,1,3,1,1,20/10/2005,5,20:40,15,E09000016,5,0,6,30,3,4,6,0,0,0,4,1,1,0,0,1,1,E01002283,2025-12-09 20:40:00,20,,,
200501KD50621,556500,188120,0.2568,51.570181,1,3,2,1,13/10/2005,5,13:27,15,E09000016,5,0,1,30,2,4,6,0,0,0,1,1,1,0,0,1,1,E01002253,2025-12-09 13:27:00,13,,,
200501KD50622,553610,188430,0.215268,51.57376,1,3,2,2,20/10/2005,5,12:15,15,E09000016,5,0,6,30,3,4,6,0,0,0,1,2,2,0,0,1,2,E01002274,2025-12-09 12:15:00,12,,,
200501KD50623,550620,189740,0.172716,51.586337,1,3,2,1,13/10/2005,5,13:26,15,E09000016,3,125,6,30,6,4,3,12,0,0,1,2,2,0,0,1,1,E01002340,2025-12-09 13:26:00,13,,,
200501KD50624,554150,189890,0.223695,51.586731,1,3,2,1,24/10/2005,2,21:04,15,E09000016,6,0,6,30,6,2,3,127,0,0,4,1,1,0,0,1,1,E01002377,2025-12-09 21:04:00,21,,,
200501KD50625,552150,190770,0.19523,51.59518,1,3,3,3,23/10/2005,1,14:00,15,E09000016,3,12,3,50,0,-1,-1,0,0,0,1,1,1,0,7,2,1,E01002311,2025-12-09 14:00:00,14,,,
200501KD50626,554710,191020,0.23227,51.59673,1,3,2,1,25/10/2005,3,06:20,15,E09000016,5,0,6,30,6,4,6,0,0,0,1,1,1,0,0,1,1,E01002300,2025-12-09 06:20:00,6,,,
200501KD50627,554260,180270,0.221067,51.500267,1,2,2,4,27/10/2005,5,15:30,15,E09000016,3,13,3,70,0,-1,-1,0,0,0,1,1,1,0,0,2,1,E01002344,2025-12-09 15:30:00,15,,,
200501KD50628,555550,191680,0.24468,51.602429,1,2,2,1,24/10/2005,2,16:18,15,E09000016,5,0,3,50,3,2,3,12,0,5,1,2,2,0,0,1,1,E01002283,2025-12-09 16:18:00,16,,,
200501KD50629,558640,188020,0.287608,51.568685,1,2,2,2,31/10/2005,2,10:15,15,E09000016,1,25,3,70,0,-1,-1,0,0,0,1,1,1,0,0,2,1,E01002252,2025-12-09 10:15:00,10,,,
200501KD50631,552080,181350,0.19015,51.510561,1,3,2,2,20/10/2005,5,09:17,15,E09000016,3,13,3,70,0,-1,-1,0,0,0,1,1,1,0,0,2,1,E01002344,2025-12-09 09:17:00,9,,,
200501KD50632,551980,189530,0.192241,51.584085,1,3,1,2,19/10/2005,4,19:45,15,E09000016,3,118,6,30,3,4,6,0,0,1,4,1,1,0,0,1,1,E01002354,2025-12-09 19:45:00,19,,,
200501KD50633,556810,192410,0.263185,51.608638,1,3,2,1,25/10/2005,3,22:05,15,E09000016,3,12,1,30,1,4,3,12,0,0,4,1,1,0,0,2,1,E01002296,2025-12-09 22:05:00,22,,,
200501KD50634,556020,185250,0.248607,51.544528,1,3,2,2,19/10/2005,4,19:50,15,E09000016,4,1421,6,30,3,4,6,0,0,0,1,1,1,0,0,1,1,E01002388,2025-12-09 19:50:00,19,,,
200501KD50635,553420,190540,0.21345,51.59277,1,3,2,1,21/10/2005,6,15:00,15,E09000016,3,12,6,30,1,4,3,12,0,0,1,1,1,0,0,1,1,E01002310,2025-12-09 15:00:00,15,,,
200501KD50636,555140,189210,0.237673,51.580349,1,3,2,1,22/10/2005,7,21:21,15,E09000016,3,127,3,50,8,4,6,0,0,0,4,1,1,0,0,1,1,E01002269,2025-12-09 21:21:00,21,,,
200501KD50637,552930,192390,0.207188,51.609525,1,3,2,1,28/10/2005,6,10:03,15,E09000016,5,0,6,30,3,4,5,0,0,0,1,1,1,0,0,2,1,E01002313,2025-12-09 10:03:00,10,,,
200501KD50638,550910,182200,0.173666,51.518512,1,3,2,1,28/10/2005,6,22:20,15,E09000016,3,13,3,70,0,-1,-1,0,0,0,4,1,1,0,0,2,1,E01002368,2025-12-09 22:20:00,22,,,
200501KD50639,553850,190750,0.219745,51.594539,1,3,4,1,29/10/2005,7,09:05,15,E09000016,3,12,3,40,0,-1,-1,0,0,0,1,1,1,0,0,1,1,E01002293,2025-12-09 09:05:00,9,,,
200501KD50640,552390,185530,0.196421,51.548035,1,3,1,1,31/10/2005,2,18:30,15,E09000016,6,0,6,30,0,-1,-1,0,0,0,4,1,1,0,0,1,1,E01002261,2025-12-09 18:30:00,18,,,
200501KD50641,553950,191350,0.22145,51.599903,1,3,2,1,31/10/2005,2,05:34,15,E09000016,6,0,6,30,3,4,6,0,0,0,4,2,2,0,0,1,1,E01002297,2025-12-09 05:34:00,5,,,
200501KD50643,550970,188610,0.177279,51.57609,1,3,2,2,30/10/2005,1,23:25,15,E09000016,3,125,1,30,1,4,3,118,0,0,4,1,1,0,0,1,1,E01002356,2025-12-09 23:25:00,23,,,
200501KD50645,551630,190030,0.187409,51.588672,1,3,2,1,06/11/2005,1,00:30,15,E09000016,6,0,6,30,0,-1,-1,0,0,0,4,2,2,0,0,1,2,E01002339,2025-12-09 00:30:00,0,2005-06-11,Saturday,6.0
200501KD50646,551350,190110,0.183404,51.589466,1,3,2,2,03/11/2005,5,17:00,15,E09000016,5,0,6,30,3,4,6,0,0,0,4,1,1,0,0,1,1,E01002339,2025-12-09 17:00:00,17,2005-03-11,Friday,3.0
200501KD50648,553400,186400,0.211355,51.555578,1,3,2,1,31/10/2005,2,08:10,15,E09000016,5,0,6,30,3,4,6,0,0,0,1,1,1,0,0,1,1,E01002363,2025-12-09 08:10:00,8,,,
200501KD50649,555550,186680,0.242467,51.557505,1,3,2,1,13/11/2005,1,18:15,15,E09000016,3,124,6,30,3,4,6,0,0,0,4,1,1,0,0,1,1,E01002386,2025-12-09 18:15:00,18,,,
200501KD50650,551170,190380,0.180924,51.59194,1,3,2,1,12/10/2005,4,14:45,15,E09000016,3,12,3,50,6,2,6,0,0,0,1,2,2,0,0,1,2,E01002334,2025-12-09 14:45:00,14,2005-12-10,Saturday,12.0
200501KD50651,553120,189250,0.20856,51.581261,1,3,2,1,12/11/2005,7,20:24,15,E09000016,5,0,6,30,6,4,5,0,0,0,4,1,1,0,0,1,1,E01002379,2025-12-09 20:24:00,20,2005-12-11,Sunday,12.0
200501KD50652,553830,190730,0.219447,51.594365,1,3,4,2,04/11/2005,6,09:09,15,E09000016,3,12,3,50,3,2,6,0,0,5,1,1,1,0,0,1,1,E01002293,2025-12-09 09:09:00,9,2005-04-11,Monday,4.0
200501KD50653,553460,190550,0.214031,51.592849,1,3,3,1,12/11/2005,7,13:45,15,E09000016,3,12,3,30,0,-1,-1,0,0,4,1,1,1,0,0,1,2,E01002293,2025-12-09 13:45:00,13,2005-12-11,Sunday,12.0
200501KD50654,555060,186830,0.23547,51.558988,1,3,1,1,10/11/2005,5,17:48,15,E09000016,3,124,6,30,3,4,6,0,0,4,4,1,1,0,0,1,1,E01002362,2025-12-09 17:48:00,17,2005-10-11,Tuesday,10.0
200501KD50656,549440,188300,0.155084,51.573712,1,3,1,1,11/11/2005,6,15:57,15,E09000016,6,0,6,30,3,4,3,118,0,0,1,1,1,0,0,1,1,E01002250,2025-12-09 15:57:00,15,2005-11-11,Friday,11.0
200501KD50658,549960,189590,0.163133,51.585165,1,3,3,1,13/11/2005,1,12:00,15,E09000016,5,0,6,30,0,-1,-1,0,0,0,1,1,1,0,0,1,2,E01002329,2025-12-09 12:00:00,12,,,
200501KD50659,551480,188140,0.18443,51.57173,1,3,2,1,12/11/2005,7,10:40,15,E09000016,5,0,6,30,6,2,5,0,0,5,1,1,1,0,0,1,2,E01002350,2025-12-09 10:40:00,10,2005-12-11,Sunday,12.0
200501KD50660,550950,189150,0.177222,51.580947,1,3,2,1,15/11/2005,3,16:55,15,E09000016,3,125,6,30,0,-1,-1,0,0,0,4,1,1,0,0,1,2,E01002243,2025-12-09 16:55:00,16,,,
200501KD50662,550660,189560,0.173216,51.584709,1,3,2,2,29/10/2005,7,20:30,15,E09000016,3,125,6,30,3,4,6,0,0,0,4,1,2,0,0,1,1,E01002245,2025-12-09 20:30:00,20,,,
200501KD50663,554310,191770,0.226829,51.603578,1,3,2,1,04/11/2005,6,13:04,15,E09000016,6,0,6,30,8,4,6,0,0,0,1,1,1,0,0,1,1,E01002299,2025-12-09 13:04:00,13,2005-04-11,Monday,4.0
200501KD50664,550300,182440,0.164983,51.520831,1,3,1,1,06/11/2005,1,06:25,15,E09000016,3,13,3,70,0,-1,-1,0,0,0,1,1,1,0,0,1,1,E01002368,2025-12-09 06:25:00,6,2005-06-11,Saturday,6.0
200501KD50665,551440,188740,0.184112,51.577132,1,3,2,2,14/11/2005,2,08:56,15,E09000016,5,0,6,30,0,-1,-1,0,0,0,1,1,1,0,0,1,2,E01002357,2025-12-09 08:56:00,8,,,
200501KD50666,553400,191960,0.213782,51.605534,1,3,2,1,18/11/2005,6,06:55,15,E09000016,5,0,6,30,0,-1,-1,0,0,0,1,1,1,0,0,1,2,E01002314,2025-12-09 06:55:00,6,,,
200501KD50667,552740,186320,0.201807,51.555038,1,3,2,1,20/11/2005,1,12:45,15,E09000016,6,0,6,30,0,-1,-1,0,0,0,1,1,1,0,0,1,2,E01002365,2025-12-09 12:45:00,12,,,
200501KD50670,550540,182300,0.16838,51.519509,1,3,2,1,13/11/2005,1,08:15,15,E09000016,3,13,1,30,1,4,3,13,0,0,1,1,1,0,0,1,2,E01002370,2025-12-09 08:15:00,8,,,
200501KD50671,553070,187300,0.20699,51.563754,1,3,3,1,13/11/2005,1,14:40,15,E09000016,3,124,6,30,3,4,6,0,0,0,1,1,1,0,0,1,1,E01002321,2025-12-09 14:40:00,14,,,
200501KD50672,556860,192380,0.263893,51.608355,1,3,2,1,06/10/2005,5,16:15,15,E09000016,1,25,1,30,1,4,3,12,0,0,1,1,1,0,0,2,2,E01002296,2025-12-09 16:15:00,16,2005-06-10,Friday,6.0
200501KD50673,553810,188570,0.218213,51.574963,1,3,2,1,01/11/2005,3,09:10,15,E09000016,5,0,6,30,6,4,6,0,0,0,1,1,1,0,0,1,1,E01002381,2025-12-09 09:10:00,9,2005-01-11,Tuesday,1.0
200501KD50674,553100,186160,0.206927,51.553503,1,3,3,1,03/11/2005,5,16:55,15,E09000016,5,0,6,30,3,4,5,0,0,0,4,8,2,0,0,1,1,E01002366,2025-12-09 16:55:00,16,2005-03-11,Friday,3.0
200501KD50676,554460,189690,0.228078,51.584849,1,3,2,3,24/10/2005,2,12:10,15,E09000016,3,127,3,50,3,3,6,0,0,0,1,1,1,0,0,1,1,E01002378,2025-12-09 12:10:00,12,,,
200501KD50677,551830,187040,0.189002,51.561753,1,3,3,2,06/11/2005,1,12:37,15,E09000016,3,125,6,30,3,4,6,0,0,0,1,2,2,0,0,1,1,E01002319,2025-12-09 12:37:00,12,2005-06-11,Saturday,6.0
200501KD50678,550620,189770,0.172729,51.586606,1,3,2,2,13/11/2005,1,00:05,15,E09000016,3,12,3,50,6,2,4,174,0,5,4,1,1,0,0,1,1,E01002338,2025-12-09 00:05:00,0,,,
200501KD50679,552180,188290,0.194588,51.57289,1,3,2,2,13/11/2005,1,12:39,15,E09000016,5,0,6,30,3,4,6,0,0,0,1,1,1,0,0,1,1,E01002352,2025-12-09 12:39:00,12,,,
200501KD50680,552630,185570,0.199897,51.548329,1,3,2,1,15/11/2005,3,19:07,15,E09000016,6,0,1,30,1,4,6,0,0,4,4,1,1,0,0,1,1,E01002262,2025-12-09 19:07:00,19,,,
200501KD50682,553140,182480,0.205903,51.520428,1,3,2,1,17/11/2005,5,22:26,15,E09000016,5,0,6,30,6,2,3,1306,0,5,4,1,1,0,0,1,1,E01002344,2025-12-09 22:26:00,22,,,
200501KD50683,556880,192370,0.264177,51.608259,1,3,2,1,21/11/2005,2,11:30,15,E09000016,1,25,1,50,1,4,3,12,0,0,1,1,1,0,0,2,1,E01002296,2025-12-09 11:30:00,11,,,
200501KD50684,552070,185380,0.191744,51.546773,1,3,2,1,20/11/2005,1,08:21,15,E09000016,6,0,6,30,6,4,6,0,0,0,1,7,1,0,0,1,1,E01002262,2025-12-09 08:21:00,8,,,
200501KD50685,550940,188850,0.176949,51.578254,1,3,1,1,20/11/2005,1,13:53,15,E09000016,3,118,3,30,3,4,3,118,0,0,1,1,1,0,0,1,1,E01002243,2025-12-09 13:53:00,13,,,
200501KD50686,556270,183570,0.251464,51.529364,1,3,2,2,19/11/2005,7,14:40,15,E09000016,6,0,6,30,0,-1,-1,0,0,0,1,1,2,0,0,2,1,E01002385,2025-12-09 14:40:00,14,,,
200501KD50687,558480,188340,0.285445,51.571605,1,3,3,2,13/10/2005,5,06:50,15,E09000016,1,25,1,70,1,4,3,127,0,0,1,1,1,0,0,2,2,E01002252,2025-12-09 06:50:00,6,,,
200501KD50688,554720,184010,0.22933,51.533744,1,3,2,1,22/11/2005,3,15:43,15,E09000016,5,0,6,30,3,4,6,0,0,0,1,2,2,0,0,2,1,E01002348,2025-12-09 15:43:00,15,,,
200501KD50689,557130,187960,0.265812,51.568568,1,3,1,1,22/11/2005,3,16:49,15,E09000016,6,0,6,30,6,4,6,0,0,0,4,1,1,0,0,1,1,E01002258,2025-12-09 16:49:00,16,,,
200501KD50690,558550,188200,0.286391,51.570327,1,3,3,1,22/11/2005,3,18:25,15,E09000016,1,25,3,70,5,4,6,0,0,0,4,1,2,0,0,2,1,E01002252,2025-12-09 18:25:00,18,,,
200501KD50692,549420,190790,0.155855,51.59609,1,3,1,1,22/10/2005,7,01:20,15,E09000016,5,0,6,30,0,-1,-1,0,0,0,4,1,1,0,0,1,1,E01002325,2025-12-09 01:20:00,1,,,
200501KD50693,553320,190540,0.212008,51.592797,1,2,1,1,14/11/2005,2,17:33,15,E09000016,3,12,3,40,7,2,3,12,0,5,4,1,1,0,0,2,1,E01002311,2025-12-09 17:33:00,17,,,
200501KD50694,549970,190940,0.163853,51.597292,1,3,2,1,01/11/2005,3,18:15,15,E09000016,4,174,6,30,3,4,6,0,0,0,4,1,1,0,0,1,1,E01002326,2025-12-09 18:15:00,18,2005-01-11,Tuesday,1.0
200501KD50695,556410,189020,0.255903,51.578292,1,3,2,1,14/11/2005,2,08:35,15,E09000016,6,0,3,50,6,4,3,127,0,0,1,1,1,0,0,2,1,E01002296,2025-12-09 08:35:00,8,,,
200501KD50697,550120,188400,0.164932,51.57443,1,3,3,1,15/11/2005,3,19:20,15,E09000016,3,118,6,30,3,4,6,0,0,4,4,1,2,0,0,1,1,E01002247,2025-12-09 19:20:00,19,,,
200501KD50699,553100,188900,0.208119,51.578122,1,3,2,1,20/11/2005,1,15:13,15,E09000016,5,0,1,30,1,4,5,0,0,0,1,1,1,0,0,1,1,E01002381,2025-12-09 15:13:00,15,,,
200501KD50700,558150,189110,0.281034,51.578615,1,3,2,1,15/11/2005,3,10:35,15,E09000016,1,25,3,70,0,-1,-1,0,0,0,1,2,2,0,0,2,1,E01002259,2025-12-09 10:35:00,10,,,
200501KD50701,558610,188090,0.287207,51.569322,1,3,8,6,27/11/2005,1,17:25,15,E09000016,1,25,3,70,0,-1,-1,0,0,0,4,1,2,0,0,2,1,E01002252,2025-12-09 17:25:00,17,,,
200501KD50702,558170,189120,0.281327,51.578699,1,3,2,1,17/11/2005,5,09:14,15,E09000016,1,25,3,70,0,-1,-1,0,0,0,1,1,1,0,0,2,1,E01002259,2025-12-09 09:14:00,9,,,
200501KD50703,556480,192760,0.258579,51.611874,1,3,2,1,23/11/2005,4,16:50,15,E09000016,1,25,2,70,5,4,6,0,0,0,4,1,1,0,0,2,1,E01002277,2025-12-09 16:50:00,16,,,
200501KD50704,551430,188390,0.183817,51.57399,1,3,1,1,19/11/2005,7,20:14,15,E09000016,5,0,6,30,6,4,5,0,0,0,4,1,2,0,0,1,1,E01002356,2025-12-09 20:14:00,20,,,
200501KD50705,553840,188770,0.218733,51.576752,1,3,2,1,26/11/2005,7,17:50,15,E09000016,5,0,6,30,0,-1,-1,0,0,0,4,1,2,0,0,1,1,E01002381,2025-12-09 17:50:00,17,,,
200501KD50708,553780,191490,0.219059,51.601207,1,3,2,1,07/12/2005,4,08:00,15,E09000016,6,0,6,30,0,-1,-1,0,0,0,1,1,4,0,0,1,1,E01002316,2025-12-09 08:00:00,8,2005-07-12,Tuesday,7.0
200501KD50709,550550,191050,0.172268,51.598126,1,3,2,1,20/11/2005,1,19:06,15,E09000016,6,0,6,30,0,-1,-1,0,0,0,4,1,4,0,0,1,1,E01002332,2025-12-09 19:06:00,19,,,
200501KD50711,558300,188750,0.283035,51.575339,1,3,2,1,17/11/2005,5,08:45,15,E09000016,1,25,2,70,5,4,6,0,0,0,1,1,1,0,0,2,1,E01002259,2025-12-09 08:45:00,8,,,
200501KD50712,550170,190200,0.166422,51.59059,1,3,2,1,22/11/2005,3,09:50,15,E09000016,4,174,6,30,3,4,6,0,0,0,1,1,1,0,0,1,2,E01002328,2025-12-09 09:50:00,9,,,
200501KD50713,550370,188360,0.16852,51.574004,1,3,2,2,16/11/2005,4,16:07,15,E09000016,6,0,6,30,3,4,3,118,0,4,1,1,1,0,0,1,1,E01002247,2025-12-09 16:07:00,16,,,
200501KD50714,551040,191690,0.179613,51.603745,1,2,1,3,27/11/2005,1,21:29,15,E09000016,4,1459,6,30,0,-1,-1,0,0,0,4,1,1,0,0,1,1,E01002303,2025-12-09 21:29:00,21,,,
200501KD50715,553540,193010,0.216262,51.614929,1,3,2,1,28/11/2005,2,17:44,15,E09000016,5,0,6,30,3,4,6,0,0,0,6,1,1,0,0,1,1,E01002312,2025-12-09 17:44:00,17,,,
200501KD50716,554820,189310,0.233103,51.581336,1,3,1,1,28/11/2005,2,15:52,15,E09000016,5,0,6,30,0,-1,-1,0,0,0,1,1,1,0,0,1,1,E01002268,2025-12-09 15:52:00,15,,,
200501KD50717,553800,188500,0.218038,51.574337,1,3,1,1,30/11/2005,4,17:05,15,E09000016,5,0,6,30,0,-1,-1,0,0,0,4,1,1,0,0,1,1,E01002274,2025-12-09 17:05:00,17,,,
200501KD50718,554840,187150,0.23244,51.561923,1,3,2,1,30/11/2005,4,11:55,15,E09000016,5,0,6,30,6,4,6,0,0,0,1,1,1,0,0,1,1,E01002362,2025-12-09 11:55:00,11,,,
200501KD50719,550120,188390,0.164928,51.57434,1,3,2,1,16/12/2005,6,23:38,15,E09000016,3,118,6,30,3,4,6,0,0,0,4,1,1,0,0,1,1,E01002246,2025-12-09 23:38:00,23,,,
200501KD50720,551970,185910,0.190532,51.551562,1,3,2,1,10/12/2005,7,13:35,15,E09000016,3,125,6,30,3,2,5,0,0,5,1,1,1,0,0,1,1,E01002260,2025-12-09 13:35:00,13,2005-10-12,Wednesday,10.0
200501KD50721,553300,190450,0.21168,51.591994,1,3,3,2,03/12/2005,7,15:20,15,E09000016,3,118,6,30,0,-1,-1,0,0,4,1,1,2,0,0,1,2,E01002337,2025-12-09 15:20:00,15,2005-03-12,Saturday,3.0
200501KD50722,556730,192300,0.261981,51.607672,1,3,2,1,09/12/2005,6,10:05,15,E09000016,1,25,1,30,1,2,3,12,0,0,1,1,1,0,0,2,2,E01002296,2025-12-09 10:05:00,10,2005-09-12,Monday,9.0
200501KD50723,550820,191100,0.176185,51.598503,1,3,2,2,02/12/2005,6,11:48,15,E09000016,4,175,6,30,3,4,6,0,0,0,1,1,2,0,0,1,1,E01002303,2025-12-09 11:48:00,11,2005-02-12,Saturday,2.0
200501KD50724,554030,191570,0.222701,51.601858,1,3,3,1,01/12/2005,5,16:21,15,E09000016,6,0,6,30,0,-1,-1,0,0,0,1,2,2,0,0,1,1,E01002284,2025-12-09 16:21:00,16,2005-01-12,Wednesday,1.0
200501KD50725,558610,188020,0.287175,51.568693,1,3,5,5,02/12/2005,6,17:55,15,E09000016,1,25,3,70,0,-1,-1,0,0,0,4,1,2,0,0,2,1,E01002252,2025-12-09 17:55:00,17,2005-02-12,Saturday,2.0
200501KD50726,556430,188920,0.256147,51.577388,1,3,3,2,01/12/2005,5,12:17,15,E09000016,5,0,7,30,5,4,6,0,0,0,1,1,1,0,0,2,1,E01002253,2025-12-09 12:17:00,12,2005-01-12,Wednesday,1.0
200501KD50727,553920,188030,0.219563,51.570082,1,3,2,1,05/12/2005,2,20:54,15,E09000016,5,0,6,30,3,4,6,0,0,0,4,2,2,0,0,1,1,E01002270,2025-12-09 20:54:00,20,2005-05-12,Thursday,5.0
200501KD50728,550940,188620,0.17685,51.576188,1,3,2,1,05/12/2005,2,07:20,15,E09000016,3,118,1,30,1,4,3,125,0,0,4,1,1,0,0,1,2,E01002356,2025-12-09 07:20:00,7,2005-05-12,Thursday,5.0
200501KD50729,553260,182530,0.207653,51.520844,1,2,1,1,08/12/2005,5,15:30,15,E09000016,5,0,6,30,3,4,6,0,0,0,1,1,1,0,0,1,1,E01002344,2025-12-09 15:30:00,15,2005-08-12,Friday,8.0
200501KD50732,554430,186990,0.226459,51.560598,1,3,1,1,07/12/2005,4,19:45,15,E09000016,3,124,6,30,0,-1,-1,0,0,4,4,1,1,0,0,1,1,E01002360,2025-12-09 19:45:00,19,2005-07-12,Tuesday,7.0
200501KD50734,555660,184710,0.243181,51.539775,1,3,2,2,08/12/2005,5,16:19,15,E09000016,5,0,1,30,2,4,6,0,0,0,6,1,1,0,0,2,1,E01002385,2025-12-09 16:19:00,16,2005-08-12,Friday,8.0
200501KD50735,555890,185850,0.247,51.549954,1,3,2,2,07/12/2005,4,11:36,15,E09000016,4,1421,6,30,6,4,6,0,0,0,1,1,1,0,0,1,1,E01002389,2025-12-09 11:36:00,11,2005-07-12,Tuesday,7.0
200501KD50736,553440,182230,0.210115,51.5181,1,3,2,3,08/12/2005,5,19:47,15,E09000016,3,1306,6,30,3,4,6,0,0,0,4,1,2,0,0,1,1,E01002344,2025-12-09 19:47:00,19,2005-08-12,Friday,8.0
200501KD50737,553100,192590,0.209728,51.611276,1,3,2,2,05/12/2005,2,14:37,15,E09000016,5,0,6,30,0,-1,-1,0,0,0,1,1,1,0,0,1,1,E01002312,2025-12-09 14:37:00,14,2005-05-12,Thursday,5.0
200501KD50738,553070,186090,0.206464,51.552882,1,3,2,2,06/12/2005,3,18:40,15,E09000016,5,0,6,30,0,-1,-1,0,0,0,4,8,2,0,0,1,1,E01002366,2025-12-09 18:40:00,18,2005-06-12,Sunday,6.0
200501KD50739,551210,188120,0.180529,51.571623,1,3,2,1,10/12/2005,7,13:10,15,E09000016,3,125,1,30,1,4,5,0,0,0,1,1,1,0,0,1,2,E01002249,2025-12-09 13:10:00,13,2005-10-12,Wednesday,10.0
200501KD50744,550720,190870,0.174643,51.596463,1,3,2,2,13/12/2005,3,18:30,15,E09000016,5,0,1,30,2,4,4,175,0,0,4,1,1,0,0,1,2,E01002336,2025-12-09 18:30:00,18,,,
200501KD50745,552240,181340,0.192449,51.510428,1,3,1,2,11/12/2005,1,16:00,15,E09000016,3,13,3,40,0,-1,-1,0,0,0,4,1,2,0,0,2,1,E01002344,2025-12-09 16:00:00,16,2005-11-12,Saturday,11.0
200501KD50746,550990,188670,0.177593,51.576624,1,3,2,1,13/10/2005,5,17:30,15,E09000016,3,125,1,30,1,4,3,118,0,0,1,1,1,0,0,1,2,E01002356,2025-12-09 17:30:00,17,,,
200501KD50747,549970,187140,0.162232,51.563149,1,3,1,1,12/12/2005,2,20:50,15,E09000016,3,124,6,30,0,-1,-1,0,0,0,4,1,1,0,0,1,1,E01002251,2025-12-09 20:50:00,20,2005-12-12,Monday,12.0
200501KD50748,553840,187330,0.218103,51.563814,1,3,2,1,17/12/2005,7,11:50,15,E09000016,6,0,6,30,8,4,6,0,0,0,1,1,1,0,0,1,2,E01002361,2025-12-09 11:50:00,11,,,
200501KD50749,553120,190560,0.209131,51.593031,1,3,3,1,26/11/2005,7,09:00,15,E09000016,3,12,3,50,0,-1,-1,0,0,0,1,1,1,0,0,2,1,E01002337,2025-12-09 09:00:00,9,,,
200501KD50750,554170,189900,0.223988,51.586815,1,3,2,1,08/12/2005,5,06:30,15,E09000016,3,127,3,70,6,2,5,0,0,0,4,1,2,0,0,1,1,E01002377,2025-12-09 06:30:00,6,2005-08-12,Friday,8.0
200501KD50751,558190,189080,0.281597,51.578334,1,3,1,1,10/12/2005,7,16:49,15,E09000016,1,25,3,70,0,-1,-1,0,0,0,4,1,1,0,0,2,1,E01002259,2025-12-09 16:49:00,16,2005-10-12,Wednesday,10.0
200501KD50752,556210,183490,0.250565,51.528662,1,3,2,1,30/11/2005,4,18:56,15,E09000016,5,0,6,30,3,4,5,0,0,0,4,1,1,0,0,2,1,E01015924,2025-12-09 18:56:00,18,,,
200501KD50753,556140,190310,0.252583,51.589957,1,3,3,2,11/12/2005,1,11:30,15,E09000016,5,0,6,30,0,-1,-1,0,0,0,1,2,2,0,0,2,1,E01002296,2025-12-09 11:30:00,11,2005-11-12,Saturday,11.0
200501KD50754,551160,191670,0.181336,51.603533,1,2,2,1,12/12/2005,2,22:55,15,E09000016,5,0,6,30,8,4,6,0,0,0,4,2,2,0,0,1,1,E01002341,2025-12-09 22:55:00,22,2005-12-12,Monday,12.0
200501KD50757,550720,190880,0.174648,51.596553,1,3,2,1,15/12/2005,5,17:15,15,E09000016,4,175,1,30,1,4,5,0,0,0,4,1,1,0,0,1,1,E01002332,2025-12-09 17:15:00,17,,,
200501KD50758,550900,189250,0.176544,51.581859,1,3,1,1,16/12/2005,6,10:53,15,E09000016,3,125,6,30,8,4,6,0,0,0,1,1,1,0,0,1,1,E01002243,2025-12-09 10:53:00,10,,,
200501KD50760,549890,191130,0.16278,51.599021,1,3,1,1,15/12/2005,5,15:00,15,E09000016,4,1459,6,30,1,4,4,174,0,4,1,1,1,0,0,1,1,E01002326,2025-12-09 15:00:00,15,,,
200501KD50762,553070,191930,0.209007,51.605354,1,3,1,1,13/12/2005,3,20:59,15,E09000016,5,0,6,30,0,-1,-1,0,0,0,4,1,1,0,0,1,1,E01002311,2025-12-09 20:59:00,20,,,
200501KD50764,555950,186310,0.248068,51.554071,1,3,1,1,19/12/2005,2,17:00,15,E09000016,4,1421,6,30,0,-1,-1,0,0,0,4,1,1,0,0,1,2,E01002386,2025-12-09 17:00:00,17,,,
200501KD50766,551500,188160,0.184727,51.571905,1,3,2,1,20/12/2005,3,10:25,15,E09000016,5,0,6,30,6,2,5,0,0,5,1,1,1,0,0,1,1,E01002350,2025-12-09 10:25:00,10,,,
200501KD50767,554570,191390,0.230413,51.600093,1,3,2,3,23/12/2005,6,18:00,15,E09000016,5,0,6,30,3,4,6,0,0,0,4,1,1,0,0,1,1,E01002299,2025-12-09 18:00:00,18,,,
200501KD50768,554410,192380,0.22854,51.609031,1,2,1,1,15/12/2005,5,22:08,15,E09000016,5,0,6,30,0,-1,-1,0,0,0,4,1,1,0,0,1,1,E01002282,2025-12-09 22:08:00,22,,,
200501KD50769,550870,187760,0.175472,51.56848,1,3,3,1,14/12/2005,4,12:35,15,E09000016,5,0,6,30,0,-1,-1,0,0,0,1,1,1,0,0,1,1,E01002248,2025-12-09 12:35:00,12,,,
200501KD50770,556400,187740,0.255189,51.566794,1,3,2,1,11/12/2005,1,10:50,15,E09000016,5,0,6,30,8,4,6,0,0,0,1,1,1,0,0,1,1,E01002253,2025-12-09 10:50:00,10,2005-11-12,Saturday,11.0
200501KD50771,555180,188070,0.237747,51.570096,1,3,2,2,14/12/2005,4,19:55,15,E09000016,5,0,6,30,6,4,6,0,0,0,4,1,1,0,0,1,1,E01002273,2025-12-09 19:55:00,19,,,
200501KD50772,550630,191480,0.173607,51.601968,1,2,1,1,21/12/2005,4,18:16,15,E09000016,4,1459,6,30,3,4,6,0,0,0,4,2,2,0,0,1,1,E01002304,2025-12-09 18:16:00,18,,,
200501KD50774,552580,189570,0.200912,51.584282,1,3,2,1,18/12/2005,1,17:55,15,E09000016,5,0,6,30,3,4,6,0,0,0,4,1,1,0,0,1,2,E01002379,2025-12-09 17:55:00,17,,,
200501KD50776,554180,189910,0.224136,51.586902,1,3,2,1,25/12/2005,1,07:40,15,E09000016,3,127,3,40,6,2,5,0,0,5,1,1,1,0,0,1,1,E01002295,2025-12-09 07:40:00,7,,,
200501KD50777,552240,182080,0.192769,51.517077,1,3,1,1,31/12/2005,7,15:07,15,E09000016,4,1335,6,30,3,4,6,0,0,0,1,1,1,0,0,1,1,E01002345,2025-12-09 15:07:00,15,,,
200501KD50778,558550,185980,0.285391,51.550382,1,3,3,2,27/12/2005,3,15:50,15,E09000016,1,25,3,70,0,-1,-1,0,0,0,1,1,2,0,0,2,1,E01002391,2025-12-09 15:50:00,15,,,
200501KD59002,555180,188070,0.237747,51.570096,1,3,2,4,27/12/2005,3,10:40,15,E09000016,5,0,6,30,6,4,6,0,0,0,1,3,2,0,0,1,1,E01002273,2025-12-09 10:40:00,10,,,
200501KD59003,550620,189740,0.172716,51.586337,1,3,2,1,24/12/2005,7,18:55,15,E09000016,3,12,3,40,6,2,3,125,0,5,4,1,2,0,0,1,1,E01002340,2025-12-09 18:55:00,18,,,
200501KD59004,554450,189690,0.227934,51.584852,1,3,2,1,26/12/2005,2,13:00,15,E09000016,3,127,3,40,3,4,6,0,0,0,1,1,1,0,0,1,2,E01002378,2025-12-09 13:00:00,13,,,
200501KD59005,550580,189720,0.172131,51.586168,1,3,5,2,13/12/2005,3,08:25,15,E09000016,3,12,3,50,0,-1,-1,0,0,5,1,1,2,0,0,1,1,E01002328,2025-12-09 08:25:00,8,,,
200501KD59006,549870,190290,0.162133,51.591478,1,2,2,1,31/12/2005,7,16:56,15,E09000016,6,0,6,30,0,-1,-1,0,0,0,4,1,2,0,0,1,1,E01002328,2025-12-09 16:56:00,16,,,
200501KD59010,551210,190420,0.181519,51.592289,1,3,2,1,31/12/2005,7,10:00,15,E09000016,3,12,3,50,6,2,5,0,0,5,1,1,1,0,0,1,1,E01002334,2025-12-09 10:00:00,10,,,
200501KD59014,552820,187400,0.20343,51.56472,1,3,2,1,15/12/2005,5,16:50,15,E09000016,3,124,6,30,8,4,6,0,0,0,4,1,1,0,0,1,1,E01002321,2025-12-09 16:50:00,16,,,
200501KD59030,550080,190520,0.165261,51.593489,1,3,2,1,12/11/2005,7,08:45,15,E09000016,4,174,6,30,3,4,6,0,0,0,1,1,1,0,0,1,2,E01002327,2025-12-09 08:45:00,8,2005-12-11,Sunday,12.0
200501KD59063,549230,190950,0.153182,51.597578,1,3,2,1,22/12/2005,5,12:00,15,E09000016,4,174,6,30,1,4,5,0,0,0,1,1,1,0,0,1,2,E01002325,2025-12-09 12:00:00,12,,,
200501KD59093,551980,189540,0.192245,51.584175,1,3,2,1,04/12/2005,1,01:55,15,E09000016,6,0,6,30,3,4,3,118,0,0,4,1,1,0,0,1,2,E01002337,2025-12-09 01:55:00,1,2005-04-12,Tuesday,4.0
200501KD59094,555790,184450,0.244939,51.537403,1,3,2,3,05/11/2005,7,15:00,15,E09000016,5,0,6,30,0,-1,-1,0,0,0,1,1,1,0,0,2,2,E01002385,2025-12-09 15:00:00,15,2005-05-11,Wednesday,5.0
200501KD59095,554080,192160,0.223682,51.607145,1,3,1,1,16/11/2005,4,07:30,15,E09000016,5,0,6,30,0,-1,-1,0,0,0,1,1,2,0,0,1,1,E01002282,2025-12-09 07:30:00,7,,,
200501KD59096,550070,191880,0.165698,51.605711,1,3,2,2,26/08/2005,6,17:53,15,E09000016,6,0,6,30,6,4,6,0,0,0,1,1,1,0,0,1,1,E01002301,2025-12-09 17:53:00,17,,,
200501KD59103,556520,188520,0.257267,51.573769,1,3,3,1,22/12/2005,5,12:00,15,E09000016,5,0,6,30,0,-1,-1,0,0,0,1,7,2,0,0,1,1,E01002253,2025-12-09 12:00:00,12,,,
200501KD59112,552380,190240,0.198318,51.590356,1,3,2,1,15/10/2005,7,17:30,15,E09000016,6,0,6,30,3,4,6,0,0,0,1,1,1,0,0,2,2,E01002337,2025-12-09 17:30:00,17,,,
200501KD59113,553610,190330,0.216099,51.590831,1,3,2,1,24/12/2005,7,15:00,15,E09000016,3,127,3,40,0,-1,-1,0,0,0,1,1,1,0,0,1,1,E01002293,2025-12-09 15:00:00,15,,,
200501KD59153,552060,189410,0.193343,51.582985,1,3,2,1,28/11/2005,2,11:00,15,E09000016,6,0,6,30,0,-1,-1,0,0,0,1,1,1,0,0,1,2,E01002354,2025-12-09 11:00:00,11,,,
200501KG70055,550730,182260,0.171099,51.519099,1,3,2,1,31/01/2005,2,15:38,15,E09000016,3,13,9,70,0,-1,-1,0,0,0,1,1,1,0,0,2,1,E01002370,2025-12-09 15:38:00,15,,,
200501KG70131,549800,187070,0.159751,51.562565,1,3,1,1,28/03/2005,2,16:35,15,E09000016,3,124,1,30,1,4,3,124,0,0,1,1,1,6,0,1,1,E01000061,2025-12-09 16:35:00,16,,,
200501KG70138,551390,181660,0.180347,51.513531,1,3,1,2,15/04/2005,6,11:30,15,E09000016,3,13,3,50,5,4,6,0,0,0,1,1,1,0,0,2,1,E01002344,2025-12-09 11:30:00,11,,,
200501KG70329,550540,182300,0.16838,51.519509,1,3,1,1,24/07/2005,1,15:29,15,E09000016,3,13,1,40,1,4,3,13,0,0,1,1,1,0,0,1,1,E01002370,2025-12-09 15:29:00,15,,,
200501TC00028,553900,185870,0.21833,51.55068,1,3,4,2,23/01/2005,1,17:12,15,E09000016,5,0,6,30,6,4,6,0,0,0,4,1,1,0,0,1,1,E01002285,2025-12-09 17:12:00,17,,,
200501TC00042,550600,187370,0.171412,51.565047,1,1,1,6,25/02/2005,6,21:39,15,E09000016,3,124,6,30,0,-1,-1,0,0,0,4,1,2,0,0,1,1,E01002248,2025-12-09 21:39:00,21,,,
200501TC00067,549860,189290,0.161562,51.582496,1,3,2,1,12/01/2005,4,23:29,15,E09000016,6,0,6,30,3,4,6,0,0,0,4,1,1,0,0,1,1,E01002330,2025-12-09 23:29:00,23,2005-12-01,Thursday,12.0
200501TC00071,553660,192150,0.217617,51.60717,1,2,1,1,15/01/2005,7,18:50,15,E09000016,5,0,6,30,0,-1,-1,0,0,0,1,1,1,0,0,1,1,E01002282,2025-12-09 18:50:00,18,,,
200501TC00074,554000,187220,0.220362,51.562782,1,3,1,1,29/01/2005,7,10:35,15,E09000016,5,0,6,30,3,4,6,0,0,0,1,1,2,0,0,1,1,E01002361,2025-12-09 10:35:00,10,,,
200501TC00146,550980,187430,0.176916,51.565485,1,2,2,3,18/02/2005,6,23:35,15,E09000016,3,124,6,30,0,-1,-1,0,0,0,4,1,2,0,0,1,1,E01002249,2025-12-09 23:35:00,23,,,
200501TC00154,550990,188670,0.177593,51.576624,1,3,2,1,19/03/2005,7,15:55,15,E09000016,3,125,6,30,3,4,3,118,0,0,1,1,1,0,0,1,1,E01002356,2025-12-09 15:55:00,15,,,
200501TC00162,556870,192360,0.264028,51.608172,1,3,3,1,04/04/2005,2,16:35,15,E09000016,3,12,1,30,1,4,1,25,0,0,1,1,1,0,0,2,1,E01002296,2025-12-09 16:35:00,16,2005-04-04,Monday,4.0
200501TC00206,552900,187390,0.204579,51.564609,1,2,1,1,15/05/2005,1,21:25,15,E09000016,3,124,6,30,3,4,6,0,0,0,4,1,1,0,0,1,1,E01002321,2025-12-09 21:25:00,21,,,
200501TC00209,554540,180930,0.225387,51.50612,1,2,2,2,04/05/2005,4,08:56,15,E09000016,4,1335,6,30,3,4,3,1306,0,0,1,1,1,0,0,2,1,E01002344,2025-12-09 08:56:00,8,2005-04-05,Tuesday,4.0
200501TC00216,554670,180610,0.227119,51.50321,1,1,2,2,28/05/2005,7,11:30,15,E09000016,3,1306,3,60,3,4,6,0,0,0,1,1,1,0,0,2,1,E01002344,2025-12-09 11:30:00,11,,,
200501TC00219,550620,189760,0.172725,51.586516,1,3,2,1,25/05/2005,4,15:30,15,E09000016,3,12,3,50,6,2,3,125,0,5,1,1,1,0,0,1,1,E01002338,2025-12-09 15:30:00,15,,,
200501TC00252,553380,190710,0.212947,51.594308,1,3,2,2,14/06/2005,3,13:12,15,E09000016,5,0,3,40,3,2,3,118,0,0,1,1,1,0,0,1,1,E01002310,2025-12-09 13:12:00,13,,,
200501TC00255,553090,188880,0.207966,51.577945,1,2,2,2,14/06/2005,3,13:35,15,E09000016,5,0,1,30,1,4,5,0,0,0,1,1,1,0,0,1,1,E01002272,2025-12-09 13:35:00,13,,,
200501TC00272,552810,190640,0.204694,51.593834,1,1,1,1,03/07/2005,1,19:05,15,E09000016,3,12,3,60,0,-1,-1,0,0,0,1,1,1,0,0,2,1,E01002337,2025-12-09 19:05:00,19,2005-03-07,Monday,3.0
200501TC00294,553250,191590,0.211456,51.60225,1,3,2,1,13/07/2005,4,15:37,15,E09000016,6,0,6,30,0,-1,-1,0,0,0,1,1,1,0,0,1,1,E01002314,2025-12-09 15:37:00,15,,,
200501TC00311,552100,187410,0.193054,51.565005,1,3,2,3,09/08/2005,3,13:09,15,E09000016,3,124,6,30,6,2,6,0,0,5,1,1,1,0,0,1,1,E01002319,2025-12-09 13:09:00,13,2005-09-08,Thursday,9.0
200501TC00351,558380,185240,0.282608,51.543781,1,2,2,1,01/09/2005,5,16:00,15,E09000016,1,25,3,70,0,-1,-1,0,0,0,1,1,1,0,0,2,1,E01002385,2025-12-09 16:00:00,16,2005-01-09,Sunday,1.0
200501TC00400,554760,186900,0.231177,51.559699,1,2,1,2,12/10/2005,4,13:32,15,E09000016,3,124,6,30,3,4,6,0,0,0,1,2,2,0,0,1,1,E01002362,2025-12-09 13:32:00,13,2005-12-10,Saturday,12.0
200501TC00408,550730,191360,0.174998,51.600863,1,3,1,1,25/10/2005,3,02:03,15,E09000016,6,0,6,30,0,-1,-1,0,0,0,4,5,2,0,0,1,1,E01002303,2025-12-09 02:03:00,2,,,
200501TC00435,554770,180290,0.228418,51.500307,1,1,1,4,20/11/2005,1,20:00,15,E09000016,3,13,3,70,5,4,3,1306,0,0,4,1,2,0,0,2,1,E01002344,2025-12-09 20:00:00,20,,,
200501TC00439,553940,186190,0.219046,51.553544,1,1,1,1,24/11/2005,5,17:05,15,E09000016,5,0,6,30,0,-1,-1,0,0,4,4,1,2,0,0,1,1,E01002291,2025-12-09 17:05:00,17,,,
200501TC00444,557420,188640,0.270297,51.574597,1,2,2,1,15/11/2005,3,17:35,15,E09000016,5,0,6,30,0,-1,-1,0,0,0,4,1,1,0,0,1,1,E01002259,2025-12-09 17:35:00,17,,,
200501TC00445,550720,190850,0.174635,51.596283,1,2,1,1,20/10/2005,5,12:00,15,E09000016,4,175,6,30,6,4,4,175,0,0,1,1,1,0,0,1,1,E01002336,2025-12-09 12:00:00,12,,,
200501TC00449,558450,188320,0.285004,51.571433,1,3,2,2,05/12/2005,2,13:50,15,E09000016,1,25,1,70,1,4,3,127,0,0,1,1,1,0,0,2,1,E01002252,2025-12-09 13:50:00,13,2005-05-12,Thursday,5.0
200501TC00452,549960,190990,0.16373,51.597744,1,1,1,1,18/12/2005,1,10:22,15,E09000016,4,174,6,30,0,-1,-1,0,0,0,1,1,1,0,0,1,1,E01002326,2025-12-09 10:22:00,10,,,
200501TC00463,551720,187450,0.187593,51.565466,1,2,1,2,23/12/2005,6,22:33,15,E09000016,3,124,3,30,0,-1,-1,0,0,0,4,1,1,0,0,1,1,E01002319,2025-12-09 22:33:00,22,,,
200601HT20531,553310,190540,0.211863,51.5928,1,3,2,1,13/09/2006,4,07:16,15,E09000016,3,12,3,30,1,4,5,0,0,0,1,1,1,0,0,2,1,E01002311,2025-12-09 07:16:00,7,,,
200601JC30629,551890,183930,0.188525,51.533793,1,3,2,2,30/09/2006,7,14:08,15,E09000016,6,0,6,30,3,4,6,0,0,0,1,1,1,0,0,1,1,E01002373,2025-12-09 14:08:00,14,,,
200601JI40075,549840,189290,0.161274,51.582501,1,3,3,1,10/02/2006,6,16:45,15,E09000016,6,0,6,30,8,4,6,0,0,0,1,1,1,0,0,1,1,E01002330,2025-12-09 16:45:00,16,2006-10-02,Monday,10.0
200601JI40204,550900,187940,0.175982,51.570089,1,3,2,1,04/04/2006,3,14:30,15,E09000016,5,0,6,30,0,-1,-1,0,0,0,1,1,1,0,0,1,2,E01002249,2025-12-09 14:30:00,14,2006-04-04,Tuesday,4.0
200601KD50007,553400,189430,0.212677,51.582802,1,2,2,1,01/01/2006,1,14:10,15,E09000016,6,0,6,30,3,4,6,0,0,0,1,1,1,0,0,1,1,E01002380,2025-12-09 14:10:00,14,2006-01-01,Sunday,1.0
200601KD50008,552800,189810,0.204189,51.586379,1,3,2,1,08/01/2006,1,14:55,15,E09000016,6,0,6,30,0,-1,-1,0,0,0,1,2,2,0,0,1,1,E01002376,2025-12-09 14:55:00,14,2006-08-01,Tuesday,8.0
200601KD50011,552910,192390,0.206899,51.60953,1,3,2,1,06/01/2006,6,09:04,15,E09000016,5,0,6,40,3,2,6,0,0,5,1,1,1,0,0,2,1,E01002313,2025-12-09 09:04:00,9,2006-06-01,Thursday,6.0
200601KD50012,549900,189090,0.162054,51.580688,1,3,2,1,17/01/2006,3,17:56,15,E09000016,3,12,3,50,0,-1,-1,0,0,0,1,1,1,0,0,1,2,E01002330,2025-12-09 17:56:00,17,,,
200601KD50013,554010,187130,0.220466,51.561971,1,3,1,1,05/01/2006,5,09:32,15,E09000016,3,124,6,30,0,-1,-1,0,0,4,1,8,1,0,0,1,1,E01002361,2025-12-09 09:32:00,9,2006-05-01,Monday,5.0
200601KD50015,550100,189240,0.165002,51.581983,1,3,1,1,21/01/2006,7,01:42,15,E09000016,5,0,3,50,6,2,3,12,0,5,4,1,1,0,0,1,1,E01002329,2025-12-09 01:42:00,1,,,
200601KD50016,553200,190310,0.210176,51.590763,1,3,2,1,13/01/2006,6,18:00,15,E09000016,5,0,6,30,3,4,3,118,0,0,4,1,1,0,0,1,1,E01002383,2025-12-09 18:00:00,18,,,
200601KD50017,550540,182970,0.168666,51.525529,1,3,2,1,07/01/2006,7,14:47,15,E09000016,6,0,3,60,3,4,3,1306,0,0,1,1,1,0,0,1,1,E01002368,2025-12-09 14:47:00,14,2006-07-01,Saturday,7.0
200601KD50018,551450,188150,0.184002,51.571828,1,3,2,2,27/01/2006,6,15:42,15,E09000016,5,0,3,40,6,2,5,0,0,5,1,1,1,0,0,1,1,E01002350,2025-12-09 15:42:00,15,,,
200601KD50019,552080,187420,0.19277,51.5651,1,3,2,1,26/01/2006,5,18:00,15,E09000016,6,0,6,30,6,2,3,124,0,5,1,1,1,0,0,1,2,E01002319,2025-12-09 18:00:00,18,,,
200601KD50020,551450,188410,0.184114,51.574164,1,3,1,1,09/01/2006,2,16:13,15,E09000016,5,0,6,30,6,4,5,0,0,0,1,1,1,0,0,1,1,E01002356,2025-12-09 16:13:00,16,2006-09-01,Friday,9.0
200601KD50021,554740,190640,0.232535,51.593307,1,3,1,1,20/01/2006,6,18:00,15,E09000016,5,0,6,30,3,4,5,0,0,1,4,1,1,0,0,1,1,E01002293,2025-12-09 18:00:00,18,,,
200601KD50023,553400,190510,0.213148,51.592506,1,3,2,2,04/01/2006,4,17:50,15,E09000016,3,12,1,30,1,4,3,127,0,0,4,1,1,0,0,1,1,E01002293,2025-12-09 17:50:00,17,2006-04-01,Saturday,4.0
200601KD50024,553840,190700,0.219579,51.594093,1,3,2,4,13/01/2006,6,11:25,15,E09000016,6,0,6,30,0,-1,-1,0,0,5,1,1,1,0,0,1,1,E01002293,2025-12-09 11:25:00,11,,,
200601KD50025,552490,189800,0.199713,51.586373,1,3,2,2,07/02/2006,3,14:33,15,E09000016,3,118,6,30,3,4,5,0,0,0,1,1,1,0,0,1,1,E01002354,2025-12-09 14:33:00,14,2006-07-02,Sunday,7.0
200601KD50026,552740,184520,0.201027,51.538865,1,3,2,1,05/02/2006,1,09:05,15,E09000016,5,0,1,30,1,4,5,0,0,0,1,1,1,0,0,1,1,E01002263,2025-12-09 09:05:00,9,2006-05-02,Tuesday,5.0
200601KD50027,554590,191370,0.230693,51.599907,1,3,2,1,19/01/2006,5,12:00,15,E09000016,5,0,6,30,3,4,6,0,0,0,1,1,2,0,0,1,1,E01002300,2025-12-09 12:00:00,12,,,
200601KD50029,550620,189790,0.172737,51.586786,1,3,2,1,09/02/2006,5,10:15,15,E09000016,4,174,6,50,6,2,3,12,0,5,1,1,1,0,0,1,2,E01002338,2025-12-09 10:15:00,10,2006-09-02,Saturday,9.0
200601KD50031,551450,188140,0.183998,51.571738,1,3,2,1,10/01/2006,3,18:09,15,E09000016,5,0,6,30,6,2,5,0,0,5,4,1,1,0,0,1,1,E01002350,2025-12-09 18:09:00,18,2006-10-01,Sunday,10.0
200601KD50032,554970,186850,0.234182,51.559192,1,2,1,1,01/02/2006,4,23:00,15,E09000016,3,124,6,30,3,4,6,0,0,0,4,1,1,0,0,1,1,E01002362,2025-12-09 23:00:00,23,2006-01-02,Monday,1.0
200601KD50033,553380,182570,0.209399,51.521171,1,3,1,1,04/02/2006,7,00:15,15,E09000016,5,0,6,30,3,4,6,0,0,0,4,1,1,0,0,1,2,E01002343,2025-12-09 00:15:00,0,2006-04-02,Sunday,4.0
200601KD50034,550140,189250,0.165583,51.582062,1,2,1,1,05/01/2006,5,15:15,15,E09000016,3,12,3,50,0,-1,-1,0,0,0,1,1,1,0,0,1,1,E01002244,2025-12-09 15:15:00,15,2006-05-01,Monday,5.0
200601KD50035,553840,190740,0.219596,51.594452,1,2,2,1,06/02/2006,2,05:37,15,E09000016,3,12,6,30,3,4,6,0,0,0,4,1,1,0,0,1,1,E01002293,2025-12-09 05:37:00,5,2006-06-02,Friday,6.0
200601KD50036,558730,186370,0.288161,51.553835,1,2,2,6,05/02/2006,1,13:15,15,E09000016,1,25,3,70,0,-1,-1,0,0,0,1,1,1,0,0,2,1,E01002391,2025-12-09 13:15:00,13,2006-05-02,Tuesday,5.0
200601KD50037,554010,192260,0.222715,51.608063,1,3,2,1,16/01/2006,2,07:23,15,E09000016,5,0,1,30,1,4,5,0,0,0,4,2,2,0,0,1,1,E01002282,2025-12-09 07:23:00,7,,,
200601KD50038,555890,185840,0.246995,51.549865,1,3,3,1,03/02/2006,6,08:44,15,E09000016,4,1421,6,30,6,4,6,0,0,0,1,1,1,0,0,1,1,E01002389,2025-12-09 08:44:00,8,2006-03-02,Thursday,3.0
200601KD50040,551420,182690,0.181221,51.522778,1,2,2,1,10/01/2006,3,18:26,15,E09000016,3,1306,3,40,7,2,3,1306,0,5,4,1,2,0,0,1,1,E01002370,2025-12-09 18:26:00,18,2006-10-01,Sunday,10.0
200601KD50041,551090,191690,0.180334,51.603732,1,3,2,1,17/01/2006,3,19:20,15,E09000016,4,1459,6,30,6,2,5,0,0,5,4,1,1,0,0,1,1,E01002303,2025-12-09 19:20:00,19,,,
200601KD50042,552030,185200,0.19109,51.545167,1,3,2,1,16/01/2006,2,17:25,15,E09000016,3,125,6,30,3,4,6,0,0,0,4,2,2,0,0,1,1,E01002260,2025-12-09 17:25:00,17,,,
200601KD50044,554020,186810,0.220471,51.559093,1,3,2,1,04/01/2006,4,17:00,15,E09000016,5,0,6,30,8,4,6,0,0,0,4,1,1,0,0,1,1,E01002364,2025-12-09 17:00:00,17,2006-04-01,Saturday,4.0
200601KD50045,551510,183280,0.182771,51.528055,1,3,2,1,25/01/2006,4,15:51,15,E09000016,6,0,6,30,0,-1,-1,0,0,0,1,1,1,0,0,1,1,E01002371,2025-12-09 15:51:00,15,,,
200601KD50046,558590,188070,0.286909,51.569148,1,3,1,1,28/01/2006,7,22:02,15,E09000016,1,25,3,70,0,-1,-1,0,0,0,4,1,1,0,0,2,1,E01002252,2025-12-09 22:02:00,22,,,
200601KD50047,554820,189420,0.233151,51.582324,1,3,3,1,25/01/2006,4,08:55,15,E09000016,3,127,3,50,5,4,5,0,0,0,1,1,1,0,0,1,2,E01002268,2025-12-09 08:55:00,8,,,
200601KD50048,554710,191110,0.232309,51.597538,1,3,1,1,03/02/2006,6,13:40,15,E09000016,5,0,6,30,0,-1,-1,0,0,0,1,1,1,0,0,1,1,E01002300,2025-12-09 13:40:00,13,2006-03-02,Thursday,3.0
200601KD50051,551030,182090,0.175347,51.517491,1,3,2,1,07/01/2006,7,06:58,15,E09000016,3,13,3,50,0,-1,-1,0,0,0,4,2,2,0,7,2,1,E01002368,2025-12-09 06:58:00,6,2006-07-01,Saturday,7.0
200601KD50052,554540,186960,0.228032,51.560299,1,3,2,2,20/01/2006,6,22:02,15,E09000016,3,124,6,30,0,-1,-1,0,0,0,4,1,1,0,0,1,1,E01002360,2025-12-09 22:02:00,22,,,
200601KD50053,550940,188610,0.176846,51.576098,1,3,2,1,21/01/2006,7,13:00,15,E09000016,3,118,1,30,1,4,3,118,0,0,1,1,1,0,0,1,2,E01002356,2025-12-09 13:00:00,13,,,
200601KD50055,550390,188230,0.168752,51.572831,1,3,3,1,19/01/2006,5,15:10,15,E09000016,6,0,6,30,0,-1,-1,0,0,0,1,1,1,0,0,1,1,E01002247,2025-12-09 15:10:00,15,,,
200601KD50056,553120,182480,0.205615,51.520433,1,3,2,1,30/01/2006,2,11:30,15,E09000016,5,0,6,30,6,2,3,1306,0,5,1,1,1,0,0,1,1,E01002344,2025-12-09 11:30:00,11,,,
200601KD50057,551990,187830,0.19165,51.568808,1,3,2,1,31/01/2006,3,22:08,15,E09000016,6,0,6,30,0,-1,-1,0,0,0,4,1,1,0,0,1,1,E01002351,2025-12-09 22:08:00,22,,,
200601KD50058,554750,190640,0.232679,51.593305,1,3,2,1,01/02/2006,4,19:11,15,E09000016,5,0,6,30,3,4,5,0,0,0,4,1,1,0,0,1,1,E01002293,2025-12-09 19:11:00,19,2006-01-02,Monday,1.0
200601KD50059,559150,185330,0.293744,51.544373,1,3,2,1,02/02/2006,5,14:20,15,E09000016,4,186,6,30,3,4,4,1421,0,0,1,1,1,0,0,2,1,E01002385,2025-12-09 14:20:00,14,2006-02-02,Thursday,2.0
200601KD50060,551670,189280,0.187662,51.581922,1,3,2,1,06/02/2006,2,12:30,15,E09000016,3,118,6,30,3,4,6,0,0,0,1,1,1,0,0,1,1,E01002357,2025-12-09 12:30:00,12,2006-06-02,Friday,6.0
200601KD50061,554210,181780,0.221008,51.513847,1,3,2,1,07/02/2006,3,11:35,15,E09000016,5,0,6,30,0,-1,-1,0,0,0,1,1,1,0,0,2,1,E01002344,2025-12-09 11:35:00,11,2006-07-02,Sunday,7.0
200601KD50062,558650,187990,0.287738,51.568412,1,3,2,1,07/02/2006,3,07:50,15,E09000016,1,25,3,70,0,-1,-1,0,0,0,1,1,1,0,0,2,1,E01002252,2025-12-09 07:50:00,7,2006-07-02,Sunday,7.0
200601KD50064,558030,188480,0.27902,51.572989,1,3,2,1,16/01/2006,2,06:15,15,E09000016,3,127,7,30,5,4,6,0,0,0,4,1,1,0,0,2,2,E01002259,2025-12-09 06:15:00,6,,,
200601KD50065,553360,190770,0.212685,51.594853,1,3,3,1,28/01/2006,7,14:10,15,E09000016,5,0,6,30,3,4,6,0,0,0,1,1,1,0,0,1,1,E01002310,2025-12-09 14:10:00,14,,,
200601KD50066,550630,182930,0.169945,51.525146,1,3,2,2,17/01/2006,3,20:45,15,E09000016,5,0,3,50,3,2,3,1306,0,5,4,1,1,0,0,1,1,E01002368,2025-12-09 20:45:00,20,,,
200601KD50068,554760,187040,0.231238,51.560957,1,3,2,1,23/01/2006,2,17:15,15,E09000016,5,0,6,30,8,4,6,0,0,0,4,1,1,0,0,1,1,E01002362,2025-12-09 17:15:00,17,,,
200601KD50069,555670,193600,0.247263,51.619646,1,3,2,2,03/01/2006,3,04:45,15,E09000016,1,25,3,70,0,-1,-1,0,0,0,4,1,2,0,0,2,1,E01002276,2025-12-09 04:45:00,4,2006-03-01,Wednesday,3.0
200601KD50071,554740,184020,0.229623,51.533829,1,3,2,1,17/01/2006,3,15:00,15,E09000016,5,0,3,50,3,4,6,0,0,0,1,2,2,0,0,2,1,E01002348,2025-12-09 15:00:00,15,,,
200601KD50072,551440,189120,0.184276,51.580546,1,3,3,1,21/01/2006,7,16:40,15,E09000016,3,118,1,30,1,4,3,118,0,0,4,1,1,0,0,1,1,E01002357,2025-12-09 16:40:00,16,,,
200601KD50073,558200,189050,0.281728,51.578062,1,3,2,1,28/01/2006,7,22:15,15,E09000016,1,25,3,70,0,-1,-1,0,0,0,4,1,1,0,0,2,1,E01002259,2025-12-09 22:15:00,22,,,
200601KD50074,551380,183910,0.181169,51.533751,1,3,3,1,01/02/2006,4,08:11,15,E09000016,3,125,6,30,0,-1,-1,0,0,0,1,1,1,0,0,1,1,E01002375,2025-12-09 08:11:00,8,2006-01-02,Monday,1.0
200601KD50075,555550,191680,0.24468,51.602429,1,3,3,3,28/01/2006,7,21:45,15,E09000016,5,0,3,50,3,2,3,12,0,5,4,1,2,0,0,1,1,E01002283,2025-12-09 21:45:00,21,,,
200601KD50076,553710,192180,0.218351,51.607426,1,2,2,1,29/01/2006,1,13:50,15,E09000016,5,0,6,30,3,4,6,0,0,1,1,1,1,0,0,1,1,E01002280,2025-12-09 13:50:00,13,,,
200601KD50077,550780,190560,0.175376,51.593662,1,3,2,2,04/02/2006,7,08:45,15,E09000016,4,175,6,30,0,-1,-1,0,0,0,1,1,2,0,0,1,1,E01002336,2025-12-09 08:45:00,8,2006-04-02,Sunday,4.0
200601KD50079,556820,188980,0.261797,51.577818,1,3,2,1,09/02/2006,5,14:55,15,E09000016,3,127,3,70,0,-1,-1,0,0,0,1,1,1,0,0,2,1,E01002296,2025-12-09 14:55:00,14,2006-09-02,Saturday,9.0
200601KD50081,553160,186390,0.207891,51.555553,1,3,2,1,08/02/2006,4,17:15,15,E09000016,5,0,6,30,7,4,5,0,0,0,4,1,1,0,0,1,2,E01002363,2025-12-09 17:15:00,17,2006-08-02,Wednesday,8.0
200601KD50082,553440,190450,0.213699,51.591956,1,3,2,2,01/03/2006,4,07:03,15,E09000016,3,127,6,30,0,-1,-1,0,0,0,1,1,1,0,0,1,1,E01002383,2025-12-09 07:03:00,7,2006-01-03,Tuesday,1.0
200601KD50083,554150,189890,0.223695,51.586731,1,3,2,1,10/02/2006,6,11:45,15,E09000016,5,0,6,30,6,2,3,127,0,0,1,1,1,0,0,1,2,E01002377,2025-12-09 11:45:00,11,2006-10-02,Monday,10.0
200601KD50085,553090,191860,0.209265,51.604719,1,3,2,1,14/02/2006,3,12:28,15,E09000016,5,0,6,30,3,4,5,0,0,0,1,1,1,0,0,1,1,E01002311,2025-12-09 12:28:00,12,,,
200601KD50087,555660,184710,0.243181,51.539775,1,3,2,1,12/02/2006,1,13:14,15,E09000016,5,0,6,30,3,4,6,0,0,0,1,2,2,0,0,2,1,E01002385,2025-12-09 13:14:00,13,2006-12-02,Saturday,12.0
200601KD50089,550080,189200,0.164697,51.581629,1,3,2,1,14/02/2006,3,19:08,15,E09000016,3,12,3,40,6,2,5,0,0,5,4,1,1,0,0,1,1,E01002244,2025-12-09 19:08:00,19,,,
200601KD50090,550630,189690,0.172839,51.585885,1,3,3,1,17/02/2006,6,08:10,15,E09000016,6,0,6,30,3,4,3,125,0,0,1,1,2,0,0,1,1,E01002340,2025-12-09 08:10:00,8,,,
200601KD50091,557960,188470,0.278007,51.572918,1,2,2,5,09/02/2006,5,13:30,15,E09000016,3,127,3,50,0,-1,-1,0,0,0,1,1,1,0,0,2,1,E01002259,2025-12-09 13:30:00,13,2006-09-02,Saturday,9.0
200601KD50097,554720,191000,0.232405,51.596547,1,3,2,1,16/02/2006,5,21:08,15,E09000016,5,0,6,30,6,4,6,0,0,0,4,1,1,0,0,1,1,E01002300,2025-12-09 21:08:00,21,,,
200601KD50098,553330,190520,0.212143,51.592615,1,3,2,1,24/02/2006,6,13:30,15,E09000016,3,12,6,30,1,4,3,118,0,0,1,1,1,0,0,2,2,E01002337,2025-12-09 13:30:00,13,,,
200601KD50099,551410,190500,0.184438,51.592954,1,2,2,1,28/02/2006,3,18:40,15,E09000016,3,12,3,50,0,-1,-1,0,0,0,4,1,1,0,0,1,1,E01002334,2025-12-09 18:40:00,18,,,
200601KD50100,553350,190510,0.212427,51.592519,1,3,2,1,13/02/2006,2,06:53,15,E09000016,3,118,1,30,1,4,3,12,0,0,1,1,1,0,0,1,1,E01002337,2025-12-09 06:53:00,6,,,
200601KD50102,550550,182970,0.16881,51.525526,1,3,2,1,17/02/2006,6,08:40,15,E09000016,6,0,6,30,3,4,3,1306,0,0,1,1,1,0,0,1,1,E01002368,2025-12-09 08:40:00,8,,,
200601KD50104,551800,183600,0.187086,51.530852,1,2,1,1,22/02/2006,4,00:20,15,E09000016,6,0,6,30,3,4,3,125,0,1,4,2,2,0,0,1,1,E01002373,2025-12-09 00:20:00,0,,,
200601KD50105,553200,190350,0.210194,51.591122,1,2,1,1,14/02/2006,3,18:12,15,E09000016,5,0,3,50,3,2,3,118,0,5,4,1,1,0,0,1,1,E01002337,2025-12-09 18:12:00,18,,,
200601KD50106,553420,190530,0.213446,51.59268,1,3,2,2,20/02/2006,2,09:30,15,E09000016,3,12,3,50,3,2,3,127,0,5,1,1,1,0,0,1,2,E01002293,2025-12-09 09:30:00,9,,,
200601KD50107,555900,185860,0.247148,51.550041,1,3,2,3,22/02/2006,4,18:07,15,E09000016,6,0,6,30,6,4,4,1421,0,0,4,1,1,0,0,1,1,E01002390,2025-12-09 18:07:00,18,,,
200601KD50108,552930,189260,0.205824,51.581402,1,3,3,1,23/02/2006,5,15:25,15,E09000016,6,0,6,30,0,-1,-1,0,0,1,1,2,2,0,0,1,1,E01002379,2025-12-09 15:25:00,15,,,
200601KD50109,549870,190220,0.162103,51.590849,1,3,1,1,03/03/2006,6,12:00,15,E09000016,6,0,6,30,0,-1,-1,0,0,0,1,1,1,0,0,1,1,E01002328,2025-12-09 12:00:00,12,2006-03-03,Friday,3.0
200601KD50111,557810,189630,0.276365,51.583382,1,3,2,1,15/02/2006,4,10:01,15,E09000016,1,25,3,70,0,-1,-1,0,0,0,1,1,2,0,0,2,1,E01002259,2025-12-09 10:01:00,10,,,
200601KD50114,558210,189030,0.281863,51.57788,1,3,3,2,22/02/2006,4,18:00,15,E09000016,1,25,3,70,0,-1,-1,0,0,0,4,1,1,0,0,2,1,E01002259,2025-12-09 18:00:00,18,,,
200601KD50115,552860,188510,0.204489,51.574683,1,3,2,1,15/02/2006,4,06:43,15,E09000016,5,0,6,30,3,4,6,0,0,0,4,2,2,0,0,1,1,E01002272,2025-12-09 06:43:00,6,,,
200601KD50116,555960,189050,0.249427,51.578686,1,3,2,1,17/02/2006,6,18:47,15,E09000016,3,127,3,40,0,-1,-1,0,0,0,4,1,1,0,0,2,1,E01002296,2025-12-09 18:47:00,18,,,
200601KD50117,550520,189660,0.171239,51.585645,1,3,2,1,07/03/2006,3,09:40,15,E09000016,6,0,3,50,3,2,3,12,0,5,1,1,1,0,0,1,2,E01002328,2025-12-09 09:40:00,9,2006-07-03,Monday,7.0
200601KD50119,558550,188190,0.286387,51.570237,1,3,1,1,28/02/2006,3,19:55,15,E09000016,1,25,3,70,0,-1,-1,0,0,0,4,1,1,0,0,2,2,E01002252,2025-12-09 19:55:00,19,,,
200601KD50120,554130,186040,0.221719,51.552145,1,3,2,1,04/03/2006,7,11:26,15,E09000016,6,0,6,30,6,4,6,0,0,0,1,1,1,0,0,1,1,E01002290,2025-12-09 11:26:00,11,2006-04-03,Monday,4.0
200601KD50121,554170,189920,0.223997,51.586995,1,3,3,1,20/02/2006,2,12:20,15,E09000016,5,0,3,50,6,2,3,127,0,5,1,1,1,0,0,1,1,E01002295,2025-12-09 12:20:00,12,,,
200601KD50122,550460,183020,0.167535,51.525999,1,3,2,1,25/02/2006,7,11:30,15,E09000016,6,0,6,30,3,2,3,1306,0,5,1,1,1,0,0,1,2,E01002368,2025-12-09 11:30:00,11,,,
200601KD50123,558200,189030,0.281719,51.577882,1,3,2,1,24/02/2006,6,09:00,15,E09000016,1,25,3,50,0,-1,-1,0,0,0,1,1,1,0,0,2,2,E01002259,2025-12-09 09:00:00,9,,,
200601KD50124,550990,189010,0.177739,51.579679,1,3,2,1,11/02/2006,7,18:00,15,E09000016,3,118,6,30,1,4,6,0,0,0,4,1,1,0,0,1,1,E01002243,2025-12-09 18:00:00,18,2006-11-02,Thursday,11.0
200601KD50125,554780,190340,0.23298,51.590601,1,3,1,1,17/02/2006,6,11:45,15,E09000016,5,0,6,30,0,-1,-1,0,0,0,1,1,1,0,0,1,1,E01002294,2025-12-09 11:45:00,11,,,
200601KD50126,550620,189700,0.172699,51.585977,1,3,1,1,24/02/2006,6,08:30,15,E09000016,3,125,6,30,0,-1,-1,0,0,0,1,1,1,0,0,1,1,E01002340,2025-12-09 08:30:00,8,,,
200601KD50127,550620,189760,0.172725,51.586516,1,3,2,1,01/03/2006,4,13:20,15,E09000016,3,12,6,30,6,2,4,174,0,5,1,1,1,0,0,1,1,E01002338,2025-12-09 13:20:00,13,2006-01-03,Tuesday,1.0
200601KD50128,550180,187200,0.165285,51.563632,1,3,2,1,03/03/2006,6,08:30,15,E09000016,3,124,6,30,0,-1,-1,0,0,0,1,1,1,0,0,1,1,E01002251,2025-12-09 08:30:00,8,2006-03-03,Friday,3.0
200601KD50129,555950,186320,0.248073,51.554161,1,3,1,1,19/02/2006,1,15:00,15,E09000016,4,1421,6,30,0,-1,-1,0,0,0,1,1,1,0,0,1,2,E01002386,2025-12-09 15:00:00,15,,,
200601KD50130,554850,183030,0.230772,51.524903,1,3,2,1,26/02/2006,1,17:15,15,E09000016,5,0,6,30,3,4,6,0,0,0,4,1,1,0,0,2,2,E01002348,2025-12-09 17:15:00,17,,,
200601KD50131,549730,191070,0.160446,51.598524,1,3,2,1,07/03/2006,3,19:10,15,E09000016,4,174,6,30,3,4,6,0,0,0,4,1,1,0,0,1,1,E01002326,2025-12-09 19:10:00,19,2006-07-03,Monday,7.0
200601KD50132,556550,188980,0.257904,51.577893,1,3,1,1,03/03/2006,6,08:25,15,E09000016,6,0,3,50,3,4,3,127,0,0,1,1,1,0,0,2,1,E01002259,2025-12-09 08:25:00,8,2006-03-03,Friday,3.0
200601KD50133,551100,191690,0.180478,51.603729,1,3,2,3,07/03/2006,3,17:26,15,E09000016,4,1459,6,30,6,2,4,175,0,5,1,1,1,0,0,1,1,E01002303,2025-12-09 17:26:00,17,2006-07-03,Monday,7.0
200601KD50135,553420,187120,0.211957,51.562042,1,2,1,2,27/02/2006,2,16:20,15,E09000016,5,0,6,30,0,-1,-1,0,0,0,1,1,1,0,0,1,1,E01002361,2025-12-09 16:20:00,16,,,
200601KD50136,552060,183750,0.190897,51.53213,1,3,2,2,27/02/2006,2,14:00,15,E09000016,5,0,6,30,3,4,6,0,0,0,1,1,1,0,0,1,1,E01002374,2025-12-09 14:00:00,14,,,
200601KD50137,550090,189220,0.164849,51.581806,1,3,2,1,17/02/2006,6,18:25,15,E09000016,5,0,6,30,6,2,3,12,0,5,4,1,1,0,0,1,1,E01002329,2025-12-09 18:25:00,18,,,
200601KD50138,552460,188450,0.198695,51.574252,1,3,2,1,17/02/2006,6,10:20,15,E09000016,5,0,6,30,3,4,6,0,0,0,1,1,1,0,0,1,1,E01002352,2025-12-09 10:20:00,10,,,
200601KD50139,552960,192310,0.207586,51.608798,1,3,2,2,11/03/2006,7,23:26,15,E09000016,5,0,6,30,0,-1,-1,0,0,0,4,1,1,0,0,2,1,E01002313,2025-12-09 23:26:00,23,2006-11-03,Friday,11.0
200601KD50140,550890,187720,0.175743,51.568115,1,2,2,1,25/02/2006,7,16:50,15,E09000016,5,0,6,30,3,4,6,0,0,0,1,1,1,0,0,1,1,E01002248,2025-12-09 16:50:00,16,,,
200601KD50141,553490,190560,0.214468,51.59293,1,3,3,1,28/02/2006,3,07:50,15,E09000016,3,12,3,30,0,-1,-1,0,0,0,1,1,1,0,0,1,2,E01002293,2025-12-09 07:50:00,7,,,
200601KD50142,556760,192480,0.262495,51.609281,1,2,2,1,07/03/2006,3,15:20,15,E09000016,1,25,1,30,1,2,3,12,0,0,1,2,2,0,0,2,1,E01002277,2025-12-09 15:20:00,15,2006-07-03,Monday,7.0
200601KD50143,554090,192130,0.223813,51.606873,1,3,1,1,10/03/2006,6,11:41,15,E09000016,5,0,6,30,0,-1,-1,0,0,0,1,1,1,0,0,1,1,E01002282,2025-12-09 11:41:00,11,2006-10-03,Tuesday,10.0
200601KD50144,552490,189800,0.199713,51.586373,1,3,2,1,08/03/2006,4,15:47,15,E09000016,3,118,6,30,3,2,5,0,0,5,1,1,1,0,0,1,1,E01002354,2025-12-09 15:47:00,15,2006-08-03,Thursday,8.0
200601KD50145,551720,190620,0.188962,51.593949,1,3,1,1,09/03/2006,5,09:00,15,E09000016,3,12,6,30,0,-1,-1,0,0,0,1,1,1,0,0,1,1,E01002334,2025-12-09 09:00:00,9,2006-09-03,Sunday,9.0
200601KD50146,552770,188470,0.203174,51.574348,1,3,2,1,09/03/2006,5,08:24,15,E09000016,5,0,6,30,3,4,6,0,0,0,1,1,1,0,0,1,1,E01002272,2025-12-09 08:24:00,8,2006-09-03,Sunday,9.0
200601KD50147,550910,187940,0.176126,51.570086,1,3,2,1,09/03/2006,5,15:10,15,E09000016,5,0,6,30,8,4,6,0,0,0,1,1,1,0,0,1,1,E01002249,2025-12-09 15:10:00,15,2006-09-03,Sunday,9.0
200601KD50148,553970,186320,0.219535,51.554704,1,2,1,1,08/03/2006,4,18:15,15,E09000016,3,124,6,30,0,-1,-1,0,0,0,4,1,1,0,0,1,2,E01002291,2025-12-09 18:15:00,18,2006-08-03,Thursday,8.0
200601KD50149,558620,187990,0.287306,51.568421,1,3,2,1,17/03/2006,6,13:49,15,E09000016,1,25,3,70,0,-1,-1,0,0,0,1,1,1,0,0,2,1,E01002252,2025-12-09 13:49:00,13,,,
200601KD50150,554690,191180,0.232052,51.598173,1,3,2,1,04/01/2006,4,23:15,15,E09000016,5,0,3,50,6,2,3,12,0,5,4,1,1,0,0,1,1,E01002299,2025-12-09 23:15:00,23,2006-04-01,Saturday,4.0
200601KD50151,553580,185560,0.213583,51.547982,1,2,2,3,08/03/2006,4,21:55,15,E09000016,6,0,6,30,3,4,6,0,0,0,4,2,2,0,0,1,1,E01002285,2025-12-09 21:55:00,21,2006-08-03,Thursday,8.0
200601KD50152,551310,183960,0.180182,51.534219,1,3,2,1,07/02/2006,3,16:50,15,E09000016,3,125,1,30,1,4,4,178,0,0,1,1,1,0,0,1,2,E01002375,2025-12-09 16:50:00,16,2006-07-02,Sunday,7.0
200601KD50154,551350,188370,0.182655,51.573832,1,3,2,1,11/02/2006,7,17:45,15,E09000016,6,0,6,30,0,-1,-1,0,0,0,4,1,1,0,0,1,2,E01002356,2025-12-09 17:45:00,17,2006-11-02,Thursday,11.0
200601KD50155,553040,190950,0.208147,51.596557,1,3,2,1,11/02/2006,7,17:30,15,E09000016,6,0,6,30,6,4,6,0,0,0,1,1,1,0,0,1,2,E01002309,2025-12-09 17:30:00,17,2006-11-02,Thursday,11.0
200601KD50158,550720,190880,0.174648,51.596553,1,3,2,1,11/03/2006,7,12:30,15,E09000016,4,175,6,30,1,4,4,175,0,0,1,1,1,0,0,1,2,E01002332,2025-12-09 12:30:00,12,2006-11-03,Friday,11.0
200601KD50159,552520,189820,0.200155,51.586545,1,2,2,1,16/03/2006,5,08:06,15,E09000016,3,118,3,50,0,-1,-1,0,0,0,1,2,2,0,0,1,1,E01002379,2025-12-09 08:06:00,8,,,
200601KD50160,552960,192440,0.207643,51.609966,1,3,2,1,16/03/2006,5,16:21,15,E09000016,5,0,6,30,3,4,5,0,0,0,1,1,1,0,0,2,1,E01002313,2025-12-09 16:21:00,16,,,
200601KD50161,551530,184230,0.183468,51.536586,1,3,2,1,17/03/2006,6,08:45,15,E09000016,3,125,6,30,3,4,6,0,0,0,1,1,1,0,0,1,1,E01002266,2025-12-09 08:45:00,8,,,
200601KD50162,556420,188940,0.256012,51.57757,1,3,2,2,18/03/2006,7,11:04,15,E09000016,6,0,6,40,3,4,5,0,0,0,1,1,1,0,0,2,1,E01002259,2025-12-09 11:04:00,11,,,
200601KD50163,551650,182870,0.184612,51.524334,1,3,2,1,08/03/2006,4,12:19,15,E09000016,6,0,6,30,0,-1,-1,0,0,0,1,1,1,0,0,1,1,E01002370,2025-12-09 12:19:00,12,2006-08-03,Thursday,8.0
200601KD50164,549220,190990,0.153054,51.59794,1,2,1,1,04/04/2006,3,13:45,15,E09000016,6,0,6,30,0,-1,-1,0,0,0,1,1,1,0,0,1,1,E01002331,2025-12-09 13:45:00,13,2006-04-04,Tuesday,4.0
200601KD50165,550940,188800,0.176928,51.577805,1,3,2,1,14/03/2006,3,15:50,15,E09000016,3,118,6,30,0,-1,-1,0,0,0,1,1,1,0,0,1,1,E01002243,2025-12-09 15:50:00,15,,,
200601KD50166,553830,190140,0.219189,51.589064,1,2,4,2,31/03/2006,6,17:12,15,E09000016,6,0,3,50,3,4,3,127,0,0,1,1,1,0,0,1,1,E01002377,2025-12-09 17:12:00,17,,,
200601KD50167,552150,182930,0.191839,51.524738,1,3,3,1,21/03/2006,3,13:30,15,E09000016,3,125,6,30,3,4,6,0,0,0,1,1,1,0,0,1,2,E01002370,2025-12-09 13:30:00,13,,,
200601KD50168,552220,187430,0.194793,51.565152,1,3,3,1,19/03/2006,1,11:44,15,E09000016,6,0,6,30,3,4,3,124,0,0,1,1,1,0,0,1,1,E01002319,2025-12-09 11:44:00,11,,,
200601KD50169,558750,187700,0.289049,51.565779,1,3,2,1,18/03/2006,7,17:25,15,E09000016,1,25,3,70,0,-1,-1,0,0,0,4,1,1,0,0,2,1,E01002252,2025-12-09 17:25:00,17,,,
200601KD50171,551670,188520,0.187334,51.575094,1,3,2,2,24/03/2006,6,07:10,15,E09000016,5,0,6,30,6,2,5,0,0,5,4,1,1,0,0,1,1,E01002358,2025-12-09 07:10:00,7,,,
200601KD50173,553910,186040,0.218548,51.552205,1,3,2,1,24/03/2006,6,20:15,15,E09000016,5,0,6,30,0,-1,-1,0,0,0,4,1,1,0,0,1,1,E01002285,2025-12-09 20:15:00,20,,,
200601KD50174,553430,182250,0.20998,51.518283,1,3,1,1,28/03/2006,3,08:26,15,E09000016,3,1306,6,30,6,4,6,0,0,4,1,1,1,0,0,1,1,E01002344,2025-12-09 08:26:00,8,,,
200601KD50175,552180,181340,0.191585,51.510444,1,3,2,1,25/03/2006,7,05:36,15,E09000016,3,13,3,70,0,-1,-1,0,0,0,4,1,1,0,0,2,1,E01002344,2025-12-09 05:36:00,5,,,
200601KD50176,553340,190540,0.212296,51.592792,1,3,2,1,29/03/2006,4,11:15,15,E09000016,5,0,1,30,1,4,3,12,0,0,1,1,1,0,0,2,1,E01002311,2025-12-09 11:15:00,11,,,
200601KD50178,553410,190520,0.213297,51.592593,1,2,2,1,04/04/2006,3,01:00,15,E09000016,3,12,1,30,1,4,3,12,0,0,4,1,1,0,0,1,1,E01002293,2025-12-09 01:00:00,1,2006-04-04,Tuesday,4.0
200601KD50179,551960,183360,0.189288,51.528653,1,3,1,1,29/03/2006,4,19:19,15,E09000016,6,0,6,30,0,-1,-1,0,0,0,4,1,1,0,0,1,1,E01002371,2025-12-09 19:19:00,19,,,
200601KD50180,551230,190420,0.181807,51.592283,1,3,2,2,22/03/2006,4,11:50,15,E09000016,5,0,3,50,6,2,3,12,0,5,1,1,1,0,0,1,1,E01002334,2025-12-09 11:50:00,11,,,
200601KD50182,554230,188050,0.224041,51.570177,1,3,2,1,24/03/2006,6,16:18,15,E09000016,6,0,6,30,6,4,6,0,0,0,1,1,1,0,0,1,1,E01002270,2025-12-09 16:18:00,16,,,
200601KD50183,554680,191170,0.231903,51.598086,1,3,2,1,22/03/2006,4,16:05,15,E09000016,5,0,6,30,6,2,3,12,0,5,1,1,1,0,0,1,2,E01002300,2025-12-09 16:05:00,16,,,
200601KD50185,551430,189030,0.184093,51.57974,1,3,2,1,29/03/2006,4,18:01,15,E09000016,5,0,1,30,1,4,3,118,0,0,1,1,1,0,0,1,1,E01002357,2025-12-09 18:01:00,18,,,
200601KD50186,554610,186940,0.229032,51.5601,1,3,1,1,23/03/2006,5,14:23,15,E09000016,3,124,6,30,0,-1,-1,0,0,0,1,1,1,0,0,1,1,E01002360,2025-12-09 14:23:00,14,,,
200601KD50187,549920,187130,0.161507,51.563072,1,3,2,1,25/03/2006,7,18:31,15,E09000016,6,0,6,30,3,4,3,124,0,0,4,2,2,0,0,1,1,E01002251,2025-12-09 18:31:00,18,,,
200601KD50188,553950,186250,0.219217,51.554081,1,3,1,1,27/03/2006,2,09:14,15,E09000016,3,124,6,30,0,-1,-1,0,0,0,1,1,1,0,0,1,2,E01002291,2025-12-09 09:14:00,9,,,
200601KD50189,553860,187010,0.218252,51.560934,1,2,2,1,29/03/2006,4,08:29,15,E09000016,6,0,6,30,8,4,6,0,0,0,1,1,1,0,0,1,1,E01002361,2025-12-09 08:29:00,8,,,
200601KD50190,552110,183900,0.191682,51.533465,1,3,2,1,01/04/2006,7,08:50,15,E09000016,5,0,6,30,0,-1,-1,0,0,0,1,1,1,0,0,1,2,E01002373,2025-12-09 08:50:00,8,2006-01-04,Wednesday,1.0
200601KD50191,550520,187330,0.170242,51.564709,1,3,2,1,03/04/2006,2,18:00,15,E09000016,3,124,6,30,3,4,6,0,0,0,1,1,1,0,0,1,1,E01002251,2025-12-09 18:00:00,18,2006-03-04,Saturday,3.0
200601KD50192,554230,188050,0.224041,51.570177,1,3,2,1,05/04/2006,4,12:00,15,E09000016,6,0,6,30,6,4,6,0,0,0,1,1,1,0,0,1,1,E01002270,2025-12-09 12:00:00,12,2006-05-04,Thursday,5.0
200601KD50193,552340,189780,0.197541,51.586234,1,3,2,1,23/04/2006,1,07:15,15,E09000016,3,118,6,30,8,4,6,0,0,0,1,1,1,0,0,1,2,E01002337,2025-12-09 07:15:00,7,,,
200601KD50195,554230,188050,0.224041,51.570177,1,3,2,2,05/04/2006,4,18:15,15,E09000016,6,0,6,30,6,4,6,0,0,0,1,1,1,0,0,1,1,E01002270,2025-12-09 18:15:00,18,2006-05-04,Thursday,5.0
200601KD50196,551310,182740,0.179659,51.523257,1,3,2,1,26/03/2006,1,14:20,15,E09000016,6,0,6,30,8,4,3,1306,0,0,1,1,1,0,0,1,1,E01002368,2025-12-09 14:20:00,14,,,
200601KD50197,552010,186030,0.19116,51.55263,1,3,2,1,10/04/2006,2,17:00,15,E09000016,3,125,6,30,0,-1,-1,0,0,0,1,1,1,0,0,1,1,E01002260,2025-12-09 17:00:00,17,2006-10-04,Wednesday,10.0
200601KD50198,554660,189730,0.23098,51.585153,1,3,2,1,03/04/2006,2,18:10,15,E09000016,6,0,6,30,6,4,6,0,0,0,1,1,1,0,0,1,1,E01002268,2025-12-09 18:10:00,18,2006-03-04,Saturday,3.0
200601KD50199,554640,188060,0.229957,51.570154,1,3,2,1,24/03/2006,6,11:15,15,E09000016,6,0,6,30,3,4,6,0,0,0,1,1,1,0,0,1,2,E01002273,2025-12-09 11:15:00,11,,,
200601KD50200,555570,191700,0.244977,51.602603,1,3,2,1,09/04/2006,1,09:30,15,E09000016,5,0,6,30,3,2,3,12,0,5,1,1,1,0,0,1,2,E01002277,2025-12-09 09:30:00,9,2006-09-04,Monday,9.0
200601KD50201,550800,189400,0.175166,51.583234,1,3,2,1,12/04/2006,4,21:09,15,E09000016,3,125,6,30,3,4,6,0,0,0,4,1,1,0,0,1,1,E01002243,2025-12-09 21:09:00,21,2006-12-04,Monday,12.0
200601KD50202,550660,189560,0.173216,51.584709,1,3,3,1,02/04/2006,1,12:35,15,E09000016,6,0,6,30,3,4,3,125,0,0,1,1,1,0,0,1,2,E01002245,2025-12-09 12:35:00,12,2006-02-04,Saturday,2.0
200601KD50203,552340,182050,0.194196,51.51678,1,3,2,1,15/04/2006,7,18:30,15,E09000016,4,1335,6,30,0,-1,-1,0,0,0,1,1,1,0,0,1,2,E01002345,2025-12-09 18:30:00,18,,,
200601KD50204,553990,187220,0.220218,51.562785,1,3,2,1,27/03/2006,2,12:22,15,E09000016,5,0,6,30,3,4,6,0,0,4,1,1,1,0,0,1,1,E01002361,2025-12-09 12:22:00,12,,,
200601KD50205,550520,182980,0.168382,51.525624,1,3,1,1,14/04/2006,6,17:02,15,E09000016,3,1306,6,30,3,4,6,0,0,0,1,1,1,0,0,1,1,E01002368,2025-12-09 17:02:00,17,,,
200601KD50206,550310,181850,0.164876,51.515527,1,3,1,1,11/04/2006,3,15:48,15,E09000016,6,0,6,30,0,-1,-1,0,0,0,1,1,1,0,0,1,2,E01002370,2025-12-09 15:48:00,15,2006-11-04,Saturday,11.0
200601KD50207,550630,189710,0.172847,51.586065,1,3,2,1,07/04/2006,6,15:15,15,E09000016,3,12,6,30,8,4,3,125,0,0,1,1,1,0,0,1,2,E01002340,2025-12-09 15:15:00,15,2006-07-04,Tuesday,7.0
200601KD50208,550620,189740,0.172716,51.586337,1,3,2,2,10/04/2006,2,12:25,15,E09000016,3,12,6,30,6,2,3,125,0,5,1,1,1,0,0,1,1,E01002340,2025-12-09 12:25:00,12,2006-10-04,Wednesday,10.0
200601KD50209,556880,192370,0.264177,51.608259,1,3,2,1,23/03/2006,5,11:15,15,E09000016,1,25,1,30,1,2,3,12,0,0,1,1,1,0,0,2,2,E01002296,2025-12-09 11:15:00,11,,,
200601KD50210,552560,185800,0.198988,51.550415,1,3,1,1,15/04/2006,7,10:09,15,E09000016,5,0,6,30,0,-1,-1,0,0,0,1,1,1,0,0,1,1,E01002261,2025-12-09 10:09:00,10,,,
200601KD50211,551570,188030,0.185681,51.570718,1,3,1,1,15/04/2006,7,16:24,15,E09000016,6,0,6,30,0,-1,-1,0,0,0,1,1,1,0,0,1,1,E01002350,2025-12-09 16:24:00,16,,,
200601KD50212,550600,187370,0.171412,51.565047,1,3,2,1,12/04/2006,4,17:35,15,E09000016,3,124,6,30,0,-1,-1,0,0,0,1,1,1,0,0,1,1,E01002248,2025-12-09 17:35:00,17,2006-12-04,Monday,12.0
200601KD50214,552260,181340,0.192737,51.510423,1,3,2,1,22/03/2006,4,07:27,15,E09000016,3,13,3,70,0,-1,-1,0,0,0,1,1,1,0,0,2,1,E01002344,2025-12-09 07:27:00,7,,,
200601KD50215,550040,192240,0.165419,51.608954,1,3,2,1,09/04/2006,1,11:47,15,E09000016,6,0,1,30,2,4,6,0,0,0,1,1,1,0,0,1,1,E01002307,2025-12-09 11:47:00,11,2006-09-04,Monday,9.0
200601KD50216,553410,190500,0.213288,51.592413,1,3,2,2,19/04/2006,4,19:09,15,E09000016,3,12,1,30,1,4,3,127,0,0,1,1,1,0,0,1,1,E01002293,2025-12-09 19:09:00,19,,,
200601KD50217,552400,184090,0.195942,51.535094,1,3,1,1,29/04/2006,7,00:55,15,E09000016,5,0,6,30,3,4,6,0,0,0,4,1,1,0,0,1,1,E01002372,2025-12-09 00:55:00,0,,,
200601KD50218,553360,190780,0.212689,51.594942,1,3,2,1,21/04/2006,6,22:30,15,E09000016,5,0,6,30,3,4,6,0,0,0,4,1,1,0,0,1,1,E01002310,2025-12-09 22:30:00,22,,,
200601KD50219,555700,186610,0.244598,51.556835,1,2,1,1,16/04/2006,1,10:40,15,E09000016,3,124,6,30,0,-1,-1,0,0,0,1,1,1,0,0,1,1,E01002386,2025-12-09 10:40:00,10,,,
200601KD50220,551920,188270,0.190831,51.57278,1,2,2,1,22/04/2006,7,18:55,15,E09000016,6,0,2,30,0,-1,-1,0,0,0,1,1,1,0,0,1,1,E01002358,2025-12-09 18:55:00,18,,,
200601KD50221,558200,189040,0.281723,51.577972,1,3,2,3,19/04/2006,4,17:20,15,E09000016,1,25,3,50,0,-1,-1,0,0,0,1,1,1,0,0,2,1,E01002259,2025-12-09 17:20:00,17,,,
200601KD50222,553380,191990,0.213507,51.605809,1,3,2,1,26/04/2006,4,15:32,15,E09000016,5,0,6,30,3,4,5,0,0,0,1,1,1,0,0,1,1,E01002314,2025-12-09 15:32:00,15,,,
200601KD50223,554750,191230,0.232939,51.598606,1,3,4,4,09/04/2006,1,17:06,15,E09000016,3,12,3,50,0,-1,-1,0,0,0,1,2,2,0,0,1,1,E01002299,2025-12-09 17:06:00,17,2006-09-04,Monday,9.0
200601KD50224,551220,190420,0.181663,51.592286,1,3,2,2,20/04/2006,5,15:12,15,E09000016,5,0,6,30,6,2,3,12,0,5,1,1,1,0,0,1,1,E01002334,2025-12-09 15:12:00,15,,,
200601KD50225,554020,186990,0.220549,51.56071,1,3,1,1,20/04/2006,5,10:29,15,E09000016,6,0,6,30,3,4,6,0,0,0,1,2,2,0,0,1,1,E01002361,2025-12-09 10:29:00,10,,,
200601KD50226,553060,191950,0.208872,51.605536,1,3,1,1,25/04/2006,3,11:35,15,E09000016,5,0,6,30,0,-1,-1,0,0,1,1,1,1,0,0,1,1,E01002311,2025-12-09 11:35:00,11,,,
200601KD50227,551190,193340,0.182488,51.61853,1,3,3,1,12/04/2006,4,16:52,15,E09000016,4,175,6,30,0,-1,-1,0,0,0,1,1,1,0,0,1,1,E01002304,2025-12-09 16:52:00,16,2006-12-04,Monday,12.0
200601KD50228,555770,191800,0.247907,51.603446,1,3,2,1,30/04/2006,1,18:20,15,E09000016,6,0,6,30,3,4,3,12,0,1,1,1,1,0,0,1,2,E01002277,2025-12-09 18:20:00,18,,,
200601KD50229,553390,190560,0.213026,51.592958,1,3,2,1,28/04/2006,6,15:10,15,E09000016,5,0,1,30,1,4,3,12,0,0,1,1,1,0,0,1,2,E01002310,2025-12-09 15:10:00,15,,,
200601KD50230,552790,187400,0.202997,51.564728,1,3,2,1,22/04/2006,7,09:50,15,E09000016,3,124,6,30,3,4,6,0,0,0,1,1,1,0,0,1,2,E01002321,2025-12-09 09:50:00,9,,,
200601KD50231,549280,190960,0.153907,51.597655,1,3,1,2,01/05/2006,2,15:18,15,E09000016,4,174,6,30,0,-1,-1,0,0,0,1,1,1,0,0,1,1,E01002325,2025-12-09 15:18:00,15,2006-01-05,Thursday,1.0
200601KD50232,558250,188910,0.282386,51.57679,1,3,2,2,30/04/2006,1,00:01,15,E09000016,1,25,3,70,0,-1,-1,0,0,0,4,1,1,0,0,2,1,E01002259,2025-12-09 00:01:00,0,,,
200601KD50233,557040,188930,0.264947,51.577308,1,3,1,1,02/05/2006,3,17:42,15,E09000016,3,127,3,60,6,4,6,0,0,0,1,1,1,0,0,2,1,E01002259,2025-12-09 17:42:00,17,2006-02-05,Sunday,2.0
200601KD50234,553880,189120,0.219463,51.579886,1,3,2,1,28/04/2006,6,17:03,15,E09000016,5,0,6,30,8,4,6,0,0,0,1,1,1,0,0,1,2,E01002377,2025-12-09 17:03:00,17,,,
200601KD50235,554350,192730,0.227828,51.612192,1,3,2,2,27/04/2006,5,08:14,15,E09000016,6,0,6,30,3,4,6,0,0,0,1,1,1,0,0,1,1,E01002278,2025-12-09 08:14:00,8,,,
200601KD50236,550630,182930,0.169945,51.525146,1,3,2,1,04/04/2006,3,10:55,15,E09000016,5,0,3,50,3,2,3,1306,0,5,1,1,1,0,0,1,1,E01002368,2025-12-09 10:55:00,10,2006-04-04,Tuesday,4.0
200601KD50237,553940,186210,0.219055,51.553724,1,3,1,1,25/04/2006,3,13:04,15,E09000016,5,0,6,30,0,-1,-1,0,0,0,1,1,1,0,0,1,1,E01002291,2025-12-09 13:04:00,13,,,
200601KD50238,553910,190100,0.220325,51.588683,1,3,2,1,26/04/2006,4,20:25,15,E09000016,6,0,3,50,3,4,3,127,0,0,4,1,1,0,0,1,1,E01002377,2025-12-09 20:25:00,20,,,
200601KD50240,551220,190430,0.181667,51.592376,1,3,2,1,25/04/2006,3,08:46,15,E09000016,5,0,6,30,3,2,3,12,0,5,1,1,1,0,0,1,1,E01002334,2025-12-09 08:46:00,8,,,
200601KD50242,555050,189110,0.236331,51.579476,1,3,2,2,20/04/2006,5,18:00,15,E09000016,6,0,6,30,3,4,6,0,0,0,1,1,1,0,0,1,2,E01002269,2025-12-09 18:00:00,18,,,
200601KD50243,554730,186430,0.230538,51.555485,1,3,2,1,02/05/2006,3,18:29,15,E09000016,6,0,6,30,6,4,6,0,0,0,1,1,1,0,0,2,1,E01002292,2025-12-09 18:29:00,18,2006-02-05,Sunday,2.0
200601KD50244,552130,181350,0.19087,51.510547,1,3,2,2,03/05/2006,4,15:30,15,E09000016,3,13,3,70,0,-1,-1,0,0,0,1,1,1,0,0,2,1,E01002344,2025-12-09 15:30:00,15,2006-03-05,Sunday,3.0
200601KD50245,554270,180290,0.22122,51.500444,1,3,2,1,28/04/2006,6,19:35,15,E09000016,3,13,3,70,0,-1,-1,0,0,0,1,1,1,0,0,2,1,E01002344,2025-12-09 19:35:00,19,,,
200601KD50246,552590,188450,0.200569,51.574217,1,3,1,1,04/05/2006,5,21:45,15,E09000016,5,0,6,30,3,4,6,0,0,0,4,1,1,0,7,1,2,E01002317,2025-12-09 21:45:00,21,2006-04-05,Wednesday,4.0
200601KD50247,553830,190730,0.219447,51.594365,1,3,2,1,01/05/2006,2,22:44,15,E09000016,6,0,3,50,3,2,3,12,0,5,4,1,1,0,0,1,2,E01002293,2025-12-09 22:44:00,22,2006-01-05,Thursday,1.0
200601KD50248,554400,187000,0.226031,51.560696,1,3,1,1,05/05/2006,6,16:42,15,E09000016,3,124,6,30,0,-1,-1,0,0,0,1,1,1,0,0,1,1,E01002360,2025-12-09 16:42:00,16,2006-05-05,Friday,5.0
200601KD50249,552200,181370,0.191886,51.510708,1,3,2,1,06/05/2006,7,19:15,15,E09000016,3,13,3,70,0,-1,-1,0,0,0,4,2,2,0,0,2,1,E01002344,2025-12-09 19:15:00,19,2006-06-05,Monday,6.0
200601KD50250,554650,180600,0.226826,51.503125,1,3,2,1,02/05/2006,3,16:03,15,E09000016,3,1306,6,30,3,4,6,0,0,0,1,1,1,0,0,2,1,E01002344,2025-12-09 16:03:00,16,2006-02-05,Sunday,2.0
200601KD50251,550950,189150,0.177222,51.580947,1,3,1,1,04/05/2006,5,11:10,15,E09000016,3,125,6,30,3,4,6,0,0,0,1,1,1,0,0,1,1,E01002243,2025-12-09 11:10:00,11,2006-04-05,Wednesday,4.0
200601KD50252,550630,189680,0.172835,51.585795,1,3,2,1,04/05/2006,5,08:53,15,E09000016,3,125,6,30,3,4,6,0,0,0,1,1,1,0,0,1,1,E01002340,2025-12-09 08:53:00,8,2006-04-05,Wednesday,4.0
200601KD50253,552640,188840,0.20146,51.577707,1,3,1,1,05/05/2006,6,18:15,15,E09000016,5,0,6,30,3,4,6,0,0,0,1,1,1,0,0,1,1,E01002382,2025-12-09 18:15:00,18,2006-05-05,Friday,5.0
200601KD50254,557220,191340,0.268622,51.59891,1,3,2,1,08/05/2006,2,11:35,15,E09000016,1,25,3,70,0,-1,-1,0,0,0,1,2,2,0,0,2,1,E01002296,2025-12-09 11:35:00,11,2006-08-05,Saturday,8.0
200601KD50255,549590,187720,0.157,51.568461,1,3,1,1,08/05/2006,2,23:30,15,E09000016,6,0,6,30,0,-1,-1,0,0,0,4,1,1,0,0,1,1,E01002250,2025-12-09 23:30:00,23,2006-08-05,Saturday,8.0
200601KD50256,553900,191810,0.220931,51.60405,1,3,1,2,18/05/2006,5,13:31,15,E09000016,6,0,6,30,3,4,6,0,0,0,1,1,1,0,0,1,1,E01002284,2025-12-09 13:31:00,13,,,
200601KD50257,551870,186740,0.189449,51.559047,1,3,2,1,11/05/2006,5,17:18,15,E09000016,6,0,6,30,3,4,6,0,0,1,1,1,1,0,0,1,1,E01002322,2025-12-09 17:18:00,17,2006-11-05,Sunday,11.0
200601KD50258,552840,185260,0.202788,51.545487,1,3,2,1,05/05/2006,6,16:29,15,E09000016,5,0,6,30,6,4,5,0,0,0,1,1,1,0,0,1,1,E01002265,2025-12-09 16:29:00,16,2006-05-05,Friday,5.0
200601KD50259,556420,192860,0.257758,51.612789,1,3,2,1,03/05/2006,4,16:00,15,E09000016,1,25,3,70,0,-1,-1,0,0,0,1,1,1,0,0,2,1,E01002277,2025-12-09 16:00:00,16,2006-03-05,Sunday,3.0
200601KD50260,558350,188480,0.283634,51.572899,1,3,2,1,01/05/2006,2,15:45,15,E09000016,3,127,1,30,1,4,1,25,0,0,1,1,1,0,0,2,1,E01002252,2025-12-09 15:45:00,15,2006-01-05,Thursday,1.0
200601KD50261,550920,187420,0.176047,51.565411,1,3,2,1,10/05/2006,4,23:10,15,E09000016,3,124,6,30,6,2,3,124,0,5,4,1,1,0,0,1,1,E01002248,2025-12-09 23:10:00,23,2006-10-05,Thursday,10.0
200601KD50262,550970,188670,0.177304,51.576629,1,3,2,1,12/05/2006,6,18:00,15,E09000016,3,125,1,30,1,4,3,118,0,0,1,1,1,0,0,1,2,E01002356,2025-12-09 18:00:00,18,2006-12-05,Tuesday,12.0
200601KD50263,550620,189740,0.172716,51.586337,1,3,2,2,14/05/2006,1,20:35,15,E09000016,3,12,3,50,6,2,3,125,0,5,4,1,1,0,0,1,2,E01002340,2025-12-09 20:35:00,20,,,
200601KD50265,549860,188400,0.161183,51.574499,1,3,2,1,02/05/2006,3,12:55,15,E09000016,3,118,6,30,8,4,6,0,0,0,1,1,1,0,0,1,1,E01002246,2025-12-09 12:55:00,12,2006-02-05,Sunday,2.0
200601KD50266,553020,184850,0.205204,51.541755,1,2,2,1,15/05/2006,2,16:30,15,E09000016,6,0,6,30,0,-1,-1,0,0,0,1,1,1,0,0,1,2,E01002265,2025-12-09 16:30:00,16,,,
200601KD50267,556810,188040,0.261234,51.569376,1,3,1,1,15/05/2006,2,11:30,15,E09000016,6,0,6,30,8,4,6,0,0,0,1,1,1,0,0,1,2,E01002254,2025-12-09 11:30:00,11,,,
200601KD50268,553840,188720,0.218712,51.576303,1,3,1,1,19/05/2006,6,13:45,15,E09000016,5,0,6,30,3,4,6,0,0,0,1,1,1,0,0,1,1,E01002270,2025-12-09 13:45:00,13,,,
200601KD50269,552110,182730,0.191177,51.522952,1,3,2,1,04/05/2006,5,17:00,15,E09000016,3,125,6,30,0,-1,-1,0,0,0,1,1,1,0,0,1,2,E01002370,2025-12-09 17:00:00,17,2006-04-05,Wednesday,4.0
200601KD50270,554540,186960,0.228032,51.560299,1,3,1,1,24/05/2006,4,13:15,15,E09000016,3,124,6,30,0,-1,-1,0,0,0,1,1,1,0,0,1,1,E01002360,2025-12-09 13:15:00,13,,,
200601KD50271,554610,186950,0.229036,51.56019,1,3,1,1,19/05/2006,6,12:10,15,E09000016,3,124,6,30,0,-1,-1,0,0,0,1,2,2,0,0,1,1,E01002360,2025-12-09 12:10:00,12,,,
200601KD50272,551320,187960,0.182046,51.570156,1,3,3,2,10/05/2006,4,11:50,15,E09000016,6,0,3,50,8,2,3,125,0,5,1,1,1,0,0,1,1,E01002249,2025-12-09 11:50:00,11,2006-10-05,Thursday,10.0
200601KD50273,556380,187680,0.254874,51.566261,1,3,2,1,12/05/2006,6,18:15,15,E09000016,5,0,6,30,3,4,6,0,0,0,1,1,1,0,0,1,1,E01002253,2025-12-09 18:15:00,18,2006-12-05,Tuesday,12.0
200601KD50274,553410,190950,0.213485,51.596456,1,3,2,1,23/05/2006,3,17:15,15,E09000016,6,0,6,30,3,4,6,0,0,0,1,1,1,0,0,1,2,E01002310,2025-12-09 17:15:00,17,,,
200601KD50275,551100,188010,0.178895,51.570664,1,3,2,2,18/05/2006,5,18:05,15,E09000016,5,0,6,30,3,4,6,0,0,0,1,1,1,0,0,1,2,E01002249,2025-12-09 18:05:00,18,,,
200601KD50276,557320,183970,0.266768,51.532667,1,3,2,1,12/05/2006,6,08:15,15,E09000016,5,0,6,30,0,-1,-1,0,0,0,1,1,1,0,0,2,1,E01002385,2025-12-09 08:15:00,8,2006-12-05,Tuesday,12.0
200601KD50277,556700,192510,0.261642,51.609567,1,3,3,3,12/05/2006,6,12:30,15,E09000016,1,25,2,50,5,4,3,12,0,0,1,1,1,0,0,2,1,E01002277,2025-12-09 12:30:00,12,2006-12-05,Tuesday,12.0
200601KD50278,551130,187450,0.179087,51.565625,1,3,1,1,29/04/2006,7,18:00,15,E09000016,3,124,6,30,3,4,6,0,0,0,1,1,1,0,0,1,1,E01002249,2025-12-09 18:00:00,18,,,
200601KD50279,551120,188230,0.179278,51.572636,1,3,1,1,22/05/2006,2,17:33,15,E09000016,3,125,6,30,8,4,6,0,0,0,1,1,1,0,0,1,1,E01002249,2025-12-09 17:33:00,17,,,
200601KD50280,553130,182480,0.205759,51.52043,1,3,1,1,15/05/2006,2,07:35,15,E09000016,3,1306,6,30,6,4,5,0,0,0,1,1,1,0,0,1,1,E01002344,2025-12-09 07:35:00,7,,,
200601KD50281,555410,191660,0.242651,51.602287,1,3,2,1,24/05/2006,4,19:25,15,E09000016,6,0,6,30,3,4,6,0,0,0,1,1,1,0,0,1,1,E01002283,2025-12-09 19:25:00,19,,,
200601KD50283,553930,191320,0.221149,51.599639,1,3,2,1,29/04/2006,7,20:00,15,E09000016,6,0,6,30,3,4,6,0,0,0,4,1,1,0,0,1,1,E01002297,2025-12-09 20:00:00,20,,,
200601KD50284,553680,187220,0.215749,51.562869,1,3,2,1,30/05/2006,3,08:15,15,E09000016,3,124,6,30,3,4,6,0,0,0,1,1,1,0,0,1,1,E01002361,2025-12-09 08:15:00,8,,,
200601KD50285,553380,190490,0.212851,51.592331,1,3,2,2,20/05/2006,7,01:00,15,E09000016,3,127,1,30,1,4,3,12,0,0,4,1,1,0,0,1,1,E01002383,2025-12-09 01:00:00,1,,,
200601KD50286,551070,191690,0.180046,51.603737,1,2,2,1,26/05/2006,6,10:26,15,E09000016,4,175,6,30,6,2,4,1459,0,5,1,1,1,6,0,1,1,E01002303,2025-12-09 10:26:00,10,,,
200601KD50287,551240,193160,0.183132,51.616899,1,3,2,1,03/05/2006,4,09:55,15,E09000016,4,175,6,30,8,4,6,0,0,0,1,1,1,0,0,1,1,E01002304,2025-12-09 09:55:00,9,2006-03-05,Sunday,3.0
200601KD50288,551990,183370,0.189724,51.528735,1,3,1,1,01/04/2006,7,18:28,15,E09000016,3,125,6,30,6,2,3,125,0,5,1,1,1,0,0,1,1,E01002374,2025-12-09 18:28:00,18,2006-01-04,Wednesday,1.0
200601KD50289,554020,186760,0.220449,51.558644,1,3,3,2,28/05/2006,1,22:21,15,E09000016,5,0,6,30,6,4,6,0,0,0,4,1,1,0,0,1,1,E01002364,2025-12-09 22:21:00,22,,,
200601KD50291,553810,188570,0.218213,51.574963,1,3,2,1,19/05/2006,6,07:50,15,E09000016,5,0,6,30,6,4,6,0,0,0,1,1,1,0,0,1,1,E01002381,2025-12-09 07:50:00,7,,,
200601KD50292,553930,187010,0.219261,51.560914,1,3,2,1,27/05/2006,7,14:20,15,E09000016,6,0,6,30,8,4,6,0,0,0,1,1,1,0,0,1,2,E01002361,2025-12-09 14:20:00,14,,,
200601KD50293,551810,183220,0.187067,51.527435,1,3,2,1,25/05/2006,5,17:35,15,E09000016,6,0,6,30,8,4,6,0,0,0,1,1,1,0,0,1,2,E01002371,2025-12-09 17:35:00,17,,,
200601KD50294,553160,186400,0.207896,51.555643,1,3,2,1,23/05/2006,3,22:00,15,E09000016,5,0,6,30,6,4,5,0,0,0,4,1,1,0,0,1,2,E01002363,2025-12-09 22:00:00,22,,,
200601KD50295,552020,185210,0.190951,51.545259,1,3,2,1,20/04/2006,5,19:00,15,E09000016,6,0,6,30,3,4,3,125,0,0,1,1,1,0,0,1,2,E01002260,2025-12-09 19:00:00,19,,,
200601KD50296,549970,190940,0.163853,51.597292,1,3,2,2,26/05/2006,6,18:12,15,E09000016,6,0,6,30,3,4,4,174,0,0,1,1,1,0,0,1,1,E01002326,2025-12-09 18:12:00,18,,,
200601KD50297,549230,190950,0.153182,51.597578,1,3,2,4,29/05/2006,2,12:40,15,E09000016,5,0,1,30,2,4,4,174,0,0,1,1,1,0,0,1,2,E01002325,2025-12-09 12:40:00,12,,,
200601KD50298,558400,188660,0.284436,51.574502,1,3,2,2,26/05/2006,6,13:45,15,E09000016,1,25,2,50,5,4,3,127,0,0,1,1,1,0,0,2,1,E01002259,2025-12-09 13:45:00,13,,,
200601KD50299,554200,189910,0.224425,51.586897,1,3,2,1,06/06/2006,3,16:45,15,E09000016,3,127,6,30,6,2,3,127,0,5,1,1,1,0,0,1,2,E01002268,2025-12-09 16:45:00,16,2006-06-06,Tuesday,6.0
200601KD50300,553010,185890,0.205512,51.551102,1,3,2,1,03/06/2006,7,17:50,15,E09000016,5,0,6,30,0,-1,-1,0,0,0,1,1,1,0,0,1,2,E01002366,2025-12-09 17:50:00,17,2006-03-06,Monday,3.0
200601KD50301,553400,190950,0.213341,51.596459,1,3,1,1,09/06/2006,6,15:30,15,E09000016,6,0,6,30,3,4,6,0,0,0,1,1,1,0,0,1,2,E01002310,2025-12-09 15:30:00,15,2006-09-06,Wednesday,9.0
200601KD50302,556680,192540,0.261367,51.609842,1,3,3,4,29/05/2006,2,12:45,15,E09000016,1,25,2,70,5,4,3,12,0,0,1,1,1,0,0,2,1,E01002277,2025-12-09 12:45:00,12,,,
200601KD50303,552030,183450,0.190335,51.529443,1,2,3,1,31/05/2006,4,19:15,15,E09000016,5,0,6,30,8,4,6,0,0,0,1,1,1,0,0,1,1,E01002374,2025-12-09 19:15:00,19,,,
200601KD50304,550930,187490,0.176221,51.566038,1,3,1,1,04/06/2006,1,10:38,15,E09000016,5,0,6,30,3,4,6,0,0,0,1,1,1,0,0,1,1,E01002248,2025-12-09 10:38:00,10,2006-04-06,Thursday,4.0
200601KD50305,553990,190820,0.221795,51.59513,1,2,2,1,02/06/2006,6,13:30,15,E09000016,6,0,3,50,6,2,3,12,0,5,1,1,1,0,0,1,1,E01002293,2025-12-09 13:30:00,13,2006-02-06,Monday,2.0
200601KD50306,551830,187030,0.188998,51.561663,1,3,2,1,02/06/2006,6,14:00,15,E09000016,3,125,6,30,3,4,6,0,0,0,1,1,1,0,0,1,1,E01002323,2025-12-09 14:00:00,14,2006-02-06,Monday,2.0
200601KD50307,551210,188110,0.180524,51.571533,1,3,1,2,29/05/2006,2,01:55,15,E09000016,3,125,3,30,1,4,5,0,0,0,4,1,1,0,0,1,1,E01002249,2025-12-09 01:55:00,1,,,
200601KD50308,553900,185970,0.218373,51.551578,1,3,2,1,01/06/2006,5,17:00,15,E09000016,5,0,6,30,6,4,6,0,0,0,1,1,1,0,0,1,1,E01002285,2025-12-09 17:00:00,17,2006-01-06,Friday,1.0
200601KD50309,551650,187830,0.186748,51.568899,1,3,2,1,31/05/2006,4,17:45,15,E09000016,5,0,6,30,3,4,6,0,0,0,1,1,1,0,0,1,1,E01002350,2025-12-09 17:45:00,17,,,
200601KD50310,553380,190490,0.212851,51.592331,1,2,2,1,06/06/2006,3,14:21,15,E09000016,3,127,6,30,1,4,3,118,0,0,1,1,1,0,0,1,1,E01002383,2025-12-09 14:21:00,14,2006-06-06,Tuesday,6.0
200601KD50311,554830,189410,0.233291,51.582232,1,3,4,1,30/05/2006,3,11:15,15,E09000016,3,127,3,50,3,4,3,127,0,0,1,1,2,0,0,1,1,E01002268,2025-12-09 11:15:00,11,,,
200601KD50312,552970,192310,0.20773,51.608795,1,3,1,1,09/06/2006,6,15:22,15,E09000016,5,0,6,30,0,-1,-1,0,0,0,1,1,1,0,0,2,1,E01002313,2025-12-09 15:22:00,15,2006-09-06,Wednesday,9.0
200601KD50313,550890,189260,0.176404,51.581952,1,3,1,1,10/06/2006,7,09:15,15,E09000016,3,125,6,30,3,4,6,0,0,0,1,1,1,0,0,1,1,E01002243,2025-12-09 09:15:00,9,2006-10-06,Friday,10.0
200601KD50314,551600,189350,0.186683,51.58257,1,3,2,1,10/06/2006,7,15:00,15,E09000016,6,0,6,30,0,-1,-1,0,0,0,1,1,1,0,0,1,1,E01002353,2025-12-09 15:00:00,15,2006-10-06,Friday,10.0
200601KD50315,550530,183260,0.168646,51.528137,1,3,1,1,20/05/2006,7,11:43,15,E09000016,6,0,6,30,0,-1,-1,0,0,0,1,1,2,0,0,1,1,E01002368,2025-12-09 11:43:00,11,,,
200601KD50316,552080,182670,0.190719,51.522421,1,3,2,1,12/06/2006,2,09:10,15,E09000016,3,125,6,30,0,-1,-1,0,0,0,1,1,1,0,0,1,1,E01002370,2025-12-09 09:10:00,9,2006-12-06,Wednesday,12.0
200601KD50317,556440,192820,0.258029,51.612425,1,3,2,1,11/06/2006,1,12:05,15,E09000016,1,25,3,70,0,-1,-1,0,0,0,1,1,1,0,0,2,1,E01002277,2025-12-09 12:05:00,12,2006-11-06,Monday,11.0
200601KD50318,552330,189770,0.197393,51.586147,1,3,2,1,03/05/2006,4,09:59,15,E09000016,3,118,6,30,0,-1,-1,0,0,0,1,1,1,0,0,1,1,E01002337,2025-12-09 09:59:00,9,2006-03-05,Sunday,3.0
200601KD50319,554210,189870,0.224552,51.586534,1,3,1,1,07/06/2006,4,12:52,15,E09000016,3,127,6,30,0,-1,-1,0,0,0,1,1,1,0,0,1,1,E01002378,2025-12-09 12:52:00,12,2006-07-06,Thursday,7.0
200601KD50320,552840,184800,0.202589,51.541354,1,3,3,2,14/06/2006,4,12:41,15,E09000016,5,0,6,30,3,4,6,0,0,0,1,1,1,0,0,1,1,E01002264,2025-12-09 12:41:00,12,,,
200601KD50321,551550,189180,0.185888,51.581056,1,3,1,2,08/06/2006,5,09:36,15,E09000016,3,118,6,30,0,-1,-1,0,0,0,1,1,1,0,0,1,1,E01002357,2025-12-09 09:36:00,9,2006-08-06,Sunday,8.0
200601KD50322,550620,189740,0.172716,51.586337,1,3,2,1,18/06/2006,1,10:30,15,E09000016,3,12,6,30,6,2,3,125,0,5,1,1,1,0,0,1,1,E01002340,2025-12-09 10:30:00,10,,,
200601KD50323,551630,189320,0.187102,51.582292,1,3,2,1,16/06/2006,6,16:52,15,E09000016,6,0,6,30,8,4,6,0,0,0,1,1,1,0,0,1,1,E01002353,2025-12-09 16:52:00,16,,,
200601KD50324,555290,186780,0.238763,51.558475,1,3,1,1,15/06/2006,5,19:16,15,E09000016,3,124,6,30,0,-1,-1,0,0,0,1,1,1,0,0,1,1,E01002289,2025-12-09 19:16:00,19,,,
200601KD50326,559170,187070,0.294819,51.56,1,3,2,1,09/06/2006,6,08:00,15,E09000016,4,187,6,30,2,4,4,186,0,0,1,1,1,0,0,2,1,E01002391,2025-12-09 08:00:00,8,2006-09-06,Wednesday,9.0
200601KD50327,550980,188670,0.177449,51.576626,1,2,1,1,12/06/2006,2,09:40,15,E09000016,3,125,6,30,1,4,3,118,0,0,1,1,1,0,0,1,1,E01002356,2025-12-09 09:40:00,9,2006-12-06,Wednesday,12.0
200601KD50328,554670,191180,0.231763,51.598178,1,3,3,1,18/06/2006,1,11:27,15,E09000016,5,0,3,50,6,2,3,12,0,5,1,1,1,0,0,1,1,E01002300,2025-12-09 11:27:00,11,,,
200601KD50329,552030,182460,0.189908,51.520548,1,3,2,1,13/06/2006,3,09:22,15,E09000016,4,1335,6,30,0,-1,-1,0,0,0,1,2,2,0,0,1,1,E01002345,2025-12-09 09:22:00,9,,,
200601KD50330,557320,187950,0.268546,51.568425,1,3,1,1,15/06/2006,5,20:15,15,E09000016,5,0,6,30,6,4,6,0,0,0,1,1,1,0,0,1,1,E01002258,2025-12-09 20:15:00,20,,,
200601KD50331,550050,189190,0.16426,51.581547,1,3,1,1,06/06/2006,3,19:53,15,E09000016,3,12,3,50,0,-1,-1,0,0,0,1,1,1,0,0,1,1,E01002329,2025-12-09 19:53:00,19,2006-06-06,Tuesday,6.0
200601KD50332,556140,187010,0.251117,51.560307,1,3,2,1,01/06/2006,5,17:00,15,E09000016,5,0,6,30,0,-1,-1,0,0,0,1,1,1,0,0,1,1,E01002257,2025-12-09 17:00:00,17,2006-01-06,Friday,1.0
200601KD50333,551440,181390,0.180951,51.511092,1,2,2,2,21/04/2006,6,15:50,15,E09000016,6,0,6,30,3,4,6,0,0,0,1,1,1,0,0,2,1,E01002344,2025-12-09 15:50:00,15,,,
200601KD50334,549710,191060,0.160153,51.598439,1,3,2,1,18/06/2006,1,01:50,15,E09000016,4,174,6,30,3,4,6,0,0,0,4,1,1,0,0,1,1,E01002326,2025-12-09 01:50:00,1,,,
200601KD50335,553460,186400,0.21222,51.555562,1,3,2,1,17/06/2006,7,02:23,15,E09000016,5,0,6,30,3,4,6,0,0,0,4,1,1,0,0,1,1,E01002363,2025-12-09 02:23:00,2,,,
200601KD50336,556310,189000,0.254452,51.57814,1,3,2,1,04/06/2006,1,13:45,15,E09000016,5,0,3,50,3,4,3,127,0,0,1,1,1,0,0,2,2,E01002259,2025-12-09 13:45:00,13,2006-04-06,Thursday,4.0
200601KD50337,552820,184970,0.202374,51.542887,1,3,1,1,23/06/2006,6,15:40,15,E09000016,5,0,6,30,3,4,6,0,0,0,1,1,1,0,0,1,2,E01002264,2025-12-09 15:40:00,15,,,
200601KD50338,554810,184320,0.230763,51.536505,1,3,1,1,13/06/2006,3,10:16,15,E09000016,5,0,6,30,0,-1,-1,0,0,0,1,1,1,0,0,2,2,E01002385,2025-12-09 10:16:00,10,,,
200601KD50339,555090,191800,0.238096,51.603633,1,3,2,1,19/06/2006,2,08:14,15,E09000016,5,0,6,30,3,4,6,0,0,0,1,1,1,0,0,1,1,E01002283,2025-12-09 08:14:00,8,,,
200601KD50341,556040,186660,0.24952,51.55719,1,3,1,1,16/06/2006,6,10:10,15,E09000016,5,0,6,30,6,4,6,0,0,0,1,1,1,0,0,1,2,E01002386,2025-12-09 10:10:00,10,,,
200601KD50342,553860,187450,0.218444,51.564887,1,3,2,1,15/06/2006,5,16:30,15,E09000016,6,0,6,30,8,4,6,0,0,0,1,1,1,0,0,1,1,E01002367,2025-12-09 16:30:00,16,,,
200601KD50343,558210,189030,0.281863,51.57788,1,2,2,1,14/06/2006,4,19:43,15,E09000016,1,25,3,70,0,-1,-1,0,0,0,1,1,1,0,0,2,1,E01002259,2025-12-09 19:43:00,19,,,
200601KD50344,556250,190370,0.254196,51.590465,1,3,2,1,09/02/2006,5,14:15,15,E09000016,5,0,6,30,3,4,5,0,0,0,1,1,1,0,0,2,1,E01002294,2025-12-09 14:15:00,14,2006-09-02,Saturday,9.0
200601KD50345,552180,183050,0.192323,51.525808,1,3,2,1,06/02/2006,2,20:45,15,E09000016,6,0,6,30,3,4,3,125,0,0,4,1,1,0,0,1,2,E01002370,2025-12-09 20:45:00,20,2006-06-02,Friday,6.0
200601KD50346,551460,188140,0.184142,51.571736,1,3,2,2,16/06/2006,6,17:15,15,E09000016,5,0,3,50,6,2,5,0,0,5,1,1,1,0,0,1,2,E01002350,2025-12-09 17:15:00,17,,,
200601KD50347,553920,189250,0.220097,51.581043,1,3,1,1,26/06/2006,2,09:20,15,E09000016,5,0,6,30,0,-1,-1,0,0,0,1,1,1,0,0,1,1,E01002377,2025-12-09 09:20:00,9,,,
200601KD50348,558830,187360,0.290049,51.562701,1,3,5,1,09/06/2006,6,11:50,15,E09000016,1,25,3,70,0,-1,-1,0,0,0,1,1,1,0,0,2,1,E01002391,2025-12-09 11:50:00,11,2006-09-06,Wednesday,9.0
200601KD50349,553360,190510,0.212571,51.592517,1,3,2,2,24/06/2006,7,16:05,15,E09000016,3,12,3,50,0,-1,-1,0,0,0,1,1,1,0,0,1,1,E01002337,2025-12-09 16:05:00,16,,,
200601KD50350,550100,189210,0.164989,51.581713,1,3,2,1,02/05/2006,3,17:50,15,E09000016,5,0,3,50,6,2,3,12,0,5,1,1,1,0,0,1,2,E01002244,2025-12-09 17:50:00,17,2006-02-05,Sunday,2.0
200601KD50351,553410,190520,0.213297,51.592593,1,3,2,1,30/05/2006,3,18:50,15,E09000016,3,12,1,30,1,4,3,127,0,0,1,1,1,0,0,1,2,E01002293,2025-12-09 18:50:00,18,,,
200601KD50353,551600,187480,0.185876,51.565768,1,3,2,3,23/05/2006,3,22:00,15,E09000016,3,125,6,30,3,2,3,124,0,5,4,1,1,0,0,1,1,E01002249,2025-12-09 22:00:00,22,,,
200601KD50354,554380,192370,0.228103,51.60895,1,3,1,1,21/06/2006,4,20:44,15,E09000016,5,0,6,30,0,-1,-1,0,0,0,1,1,1,0,0,1,1,E01002282,2025-12-09 20:44:00,20,,,
200601KD50355,556150,185120,0.250423,51.543324,1,3,2,1,10/06/2006,7,11:33,15,E09000016,4,1421,6,30,3,4,6,0,0,0,1,1,1,0,0,1,1,E01002388,2025-12-09 11:33:00,11,2006-10-06,Friday,10.0
200601KD50356,551940,183450,0.189039,51.529467,1,3,2,2,04/06/2006,1,13:47,15,E09000016,6,0,6,30,8,4,3,125,0,0,1,1,1,0,0,1,1,E01002371,2025-12-09 13:47:00,13,2006-04-06,Thursday,4.0
200601KD50358,551600,187550,0.185906,51.566397,1,2,2,1,24/06/2006,7,14:36,15,E09000016,3,125,6,30,3,2,5,0,0,0,1,1,1,0,0,1,1,E01002249,2025-12-09 14:36:00,14,,,
200601KD50359,557230,187200,0.266913,51.561712,1,3,2,1,05/07/2006,4,16:15,15,E09000016,5,0,6,30,3,4,6,0,0,0,1,1,1,0,0,1,1,E01002254,2025-12-09 16:15:00,16,2006-05-07,Sunday,5.0
200601KD50360,552890,182520,0.20232,51.520855,1,3,1,1,18/06/2006,1,13:40,15,E09000016,6,0,6,30,8,4,6,0,0,0,1,1,1,0,0,1,1,E01002342,2025-12-09 13:40:00,13,,,
200601KD50361,552290,189760,0.196811,51.586068,1,3,2,1,16/06/2006,6,13:10,15,E09000016,3,118,6,30,8,4,6,0,0,0,1,1,1,0,0,1,1,E01002337,2025-12-09 13:10:00,13,,,
200601KD50362,550630,189720,0.172852,51.586154,1,3,2,1,29/06/2006,5,12:15,15,E09000016,3,125,6,30,6,2,3,12,0,5,1,1,1,0,0,1,1,E01002340,2025-12-09 12:15:00,12,,,
200601KD50363,557210,183950,0.265174,51.532518,1,3,2,1,23/06/2006,6,13:39,15,E09000016,5,0,6,30,3,4,6,0,0,0,1,1,1,0,0,2,1,E01002385,2025-12-09 13:39:00,13,,,
200601KD50364,553780,192460,0.219484,51.609922,1,3,2,1,22/06/2006,5,08:29,15,E09000016,5,0,6,30,8,4,6,0,0,0,1,1,1,0,0,1,1,E01002278,2025-12-09 08:29:00,8,,,
200601KD50365,558260,185080,0.280807,51.542377,1,3,3,1,20/06/2006,3,11:55,15,E09000016,4,1421,6,30,0,-1,-1,0,0,0,1,1,1,0,0,2,1,E01002385,2025-12-09 11:55:00,11,,,
200601KD50366,550940,188660,0.176868,51.576547,1,3,2,1,20/06/2006,3,20:57,15,E09000016,3,118,1,30,1,4,3,118,0,0,4,1,1,0,0,1,1,E01002244,2025-12-09 20:57:00,20,,,
200601KD50367,551830,186500,0.188769,51.556901,1,3,1,1,30/06/2006,6,07:57,15,E09000016,3,125,6,30,0,-1,-1,0,0,0,1,1,1,0,0,1,1,E01002322,2025-12-09 07:57:00,7,,,
200601KD50368,550090,189200,0.164841,51.581626,1,3,2,1,16/04/2006,1,12:10,15,E09000016,3,12,3,50,6,2,3,12,0,5,1,1,1,0,0,1,1,E01002244,2025-12-09 12:10:00,12,,,
200601KD50369,550620,189740,0.172716,51.586337,1,3,2,1,02/07/2006,1,11:51,15,E09000016,3,12,3,50,6,2,3,125,0,5,1,1,1,0,0,1,1,E01002340,2025-12-09 11:51:00,11,2006-02-07,Tuesday,2.0
200601KD50370,551420,181400,0.180668,51.511187,1,3,1,1,11/03/2006,7,12:00,15,E09000016,6,0,6,30,0,-1,-1,0,0,0,1,1,1,0,0,2,1,E01002344,2025-12-09 12:00:00,12,2006-11-03,Friday,11.0
200601KD50371,551420,188730,0.183819,51.577048,1,3,1,1,23/06/2006,6,12:41,15,E09000016,5,0,6,30,0,-1,-1,0,0,0,1,1,1,0,0,1,1,E01002357,2025-12-09 12:41:00,12,,,
200601KD50372,554130,191660,0.224183,51.602639,1,3,2,1,26/06/2006,2,12:52,15,E09000016,6,0,6,30,0,-1,-1,0,0,0,1,1,1,0,0,1,1,E01002284,2025-12-09 12:52:00,12,,,
200601KD50373,552460,189800,0.199281,51.586381,1,3,1,1,09/07/2006,1,17:30,15,E09000016,3,118,6,30,3,4,5,0,0,1,1,1,1,0,0,1,2,E01002354,2025-12-09 17:30:00,17,2006-09-07,Thursday,9.0
200601KD50374,556030,186760,0.249421,51.558092,1,3,1,1,01/07/2006,7,12:10,15,E09000016,6,0,6,30,0,-1,-1,0,0,0,1,1,1,0,0,1,1,E01002386,2025-12-09 12:10:00,12,2006-01-07,Saturday,1.0
200601KD50375,558330,188460,0.283337,51.572725,1,3,2,1,26/06/2006,2,07:45,15,E09000016,3,127,2,30,5,4,1,25,0,1,1,1,1,0,0,2,2,E01002252,2025-12-09 07:45:00,7,,,
200601KD50376,552560,185800,0.198988,51.550415,1,3,2,1,30/06/2006,6,22:43,15,E09000016,5,0,6,30,0,-1,-1,0,0,0,4,1,1,0,0,1,1,E01002261,2025-12-09 22:43:00,22,,,
200601KD50377,549810,188150,0.160355,51.572266,1,3,3,1,05/07/2006,4,17:40,15,E09000016,6,0,6,30,0,-1,-1,0,0,0,1,1,1,0,0,1,1,E01002246,2025-12-09 17:40:00,17,2006-05-07,Sunday,5.0
200601KD50378,551930,185250,0.189671,51.545643,1,3,2,1,03/07/2006,2,08:50,15,E09000016,3,125,6,30,3,4,6,0,0,0,1,1,1,0,0,1,1,E01002260,2025-12-09 08:50:00,8,2006-03-07,Tuesday,3.0
200601KD50379,553760,187400,0.216981,51.564465,1,3,2,2,03/07/2006,2,14:38,15,E09000016,6,0,6,30,3,4,6,0,0,0,1,1,1,0,0,1,1,E01002367,2025-12-09 14:38:00,14,2006-03-07,Tuesday,3.0
200601KD50380,553710,190680,0.217695,51.593949,1,3,3,1,20/06/2006,3,14:25,15,E09000016,3,12,3,50,0,-1,-1,0,0,0,1,1,1,0,0,1,1,E01002293,2025-12-09 14:25:00,14,,,
200601KD50381,551420,188410,0.183682,51.574172,1,3,1,1,06/07/2006,5,14:10,15,E09000016,5,0,6,30,2,4,5,0,0,0,1,1,1,0,0,1,1,E01002356,2025-12-09 14:10:00,14,2006-06-07,Wednesday,6.0
200601KD50382,554680,191180,0.231907,51.598176,1,3,2,1,11/05/2006,5,13:15,15,E09000016,5,0,3,50,6,2,3,12,0,5,1,1,1,0,0,1,1,E01002300,2025-12-09 13:15:00,13,2006-11-05,Sunday,11.0
200601KD50383,550630,189770,0.172873,51.586604,1,3,1,1,02/07/2006,1,03:41,15,E09000016,3,12,3,30,0,-1,-1,0,0,0,4,1,1,0,0,1,1,E01002338,2025-12-09 03:41:00,3,2006-02-07,Tuesday,2.0
200601KD50384,551110,182800,0.176804,51.523849,1,3,2,1,21/06/2006,4,17:45,15,E09000016,6,0,3,50,3,4,3,1306,0,0,1,1,1,0,0,1,1,E01002368,2025-12-09 17:45:00,17,,,
200601KD50385,556880,192360,0.264173,51.608169,1,3,2,2,03/07/2006,2,00:01,15,E09000016,3,12,1,30,1,4,3,12,0,0,4,1,1,0,0,2,1,E01002296,2025-12-09 00:01:00,0,2006-03-07,Tuesday,3.0
200601KD50386,553560,192580,0.216362,51.611061,1,3,1,1,04/07/2006,3,15:40,15,E09000016,6,0,6,30,3,4,6,0,0,0,1,1,1,0,0,1,1,E01002312,2025-12-09 15:40:00,15,2006-04-07,Friday,4.0
200601KD50387,551240,190420,0.181951,51.592281,1,3,2,1,03/07/2006,2,11:30,15,E09000016,3,12,3,50,6,2,5,0,0,5,1,1,1,0,0,1,1,E01002334,2025-12-09 11:30:00,11,2006-03-07,Tuesday,3.0
200601KD50388,553830,190720,0.219443,51.594275,1,3,2,1,26/06/2006,2,17:36,15,E09000016,6,0,3,50,6,2,3,12,0,5,1,1,2,0,0,1,1,E01002293,2025-12-09 17:36:00,17,,,
200601KD50389,552390,182600,0.195153,51.521709,1,3,2,1,01/07/2006,7,20:40,15,E09000016,3,1306,6,30,8,4,6,0,0,0,1,1,1,0,0,2,1,E01002345,2025-12-09 20:40:00,20,2006-01-07,Saturday,1.0
200601KD50390,551490,190540,0.185609,51.593292,1,2,2,1,30/06/2006,6,16:10,15,E09000016,6,0,3,50,3,4,3,12,0,0,1,1,1,0,0,1,1,E01002334,2025-12-09 16:10:00,16,,,
200601KD50391,553980,188040,0.220432,51.570155,1,3,1,1,24/06/2006,7,06:05,15,E09000016,6,0,6,30,0,-1,-1,0,0,0,1,1,1,0,7,1,1,E01002270,2025-12-09 06:05:00,6,,,
200601KD50392,550180,182480,0.163272,51.521222,1,3,3,1,28/06/2006,4,12:15,15,E09000016,3,13,3,70,0,-1,-1,0,0,0,1,1,1,0,0,1,1,E01002368,2025-12-09 12:15:00,12,,,
200601KD50393,552420,181310,0.195028,51.51011,1,3,3,1,04/07/2006,3,12:50,15,E09000016,3,13,3,50,0,-1,-1,0,0,0,1,1,1,6,0,2,1,E01002344,2025-12-09 12:50:00,12,2006-04-07,Friday,4.0
200601KD50395,554680,191160,0.231898,51.597996,1,3,2,2,23/06/2006,6,10:50,15,E09000016,5,0,6,30,6,2,3,12,0,5,1,1,1,0,0,1,1,E01002300,2025-12-09 10:50:00,10,,,
200601KD50396,557510,189980,0.272195,51.586611,1,3,2,1,30/06/2006,6,04:15,15,E09000016,1,25,3,70,0,-1,-1,0,0,0,1,1,1,0,0,2,1,E01002259,2025-12-09 04:15:00,4,,,
200601KD50397,552780,187490,0.202892,51.56554,1,3,2,2,05/07/2006,4,09:54,15,E09000016,6,0,6,30,3,4,6,0,0,0,1,1,1,0,0,1,1,E01002320,2025-12-09 09:54:00,9,2006-05-07,Sunday,5.0
200601KD50398,550470,187320,0.169517,51.564633,1,3,3,1,07/07/2006,6,20:00,15,E09000016,3,124,6,30,0,-1,-1,0,0,0,1,1,1,0,0,1,1,E01002251,2025-12-09 20:00:00,20,2006-07-07,Friday,7.0
200601KD50399,555060,190930,0.237279,51.595825,1,3,2,1,07/07/2006,6,18:45,15,E09000016,5,0,6,30,8,4,6,0,0,0,1,1,1,0,0,1,1,E01002300,2025-12-09 18:45:00,18,2006-07-07,Friday,7.0
200601KD50400,554670,186930,0.229893,51.559993,1,3,2,1,08/07/2006,7,18:30,15,E09000016,5,0,6,30,6,2,3,124,0,5,1,1,1,0,0,1,2,E01002362,2025-12-09 18:30:00,18,2006-08-07,Monday,8.0
200601KD50401,554380,184020,0.224436,51.533927,1,3,2,1,13/07/2006,5,10:47,15,E09000016,5,0,6,30,0,-1,-1,0,0,0,1,2,2,0,0,2,1,E01002348,2025-12-09 10:47:00,10,,,
200601KD50403,555670,184680,0.243312,51.539503,1,3,2,2,16/07/2006,1,17:27,15,E09000016,5,0,6,30,0,-1,-1,0,0,0,1,1,1,0,0,2,1,E01002385,2025-12-09 17:27:00,17,,,
200601KD50405,553260,182530,0.207653,51.520844,1,3,2,1,10/07/2006,2,09:15,15,E09000016,5,0,6,30,3,4,6,0,0,0,1,1,1,0,0,1,1,E01002344,2025-12-09 09:15:00,9,2006-10-07,Saturday,10.0
200601KD50406,553940,190480,0.220925,51.592089,1,3,1,1,17/07/2006,2,23:26,15,E09000016,6,0,6,30,3,4,6,0,0,0,4,1,1,0,0,1,1,E01002293,2025-12-09 23:26:00,23,,,
200601KD50407,552300,188520,0.196418,51.574924,1,3,2,1,17/07/2006,2,19:49,15,E09000016,6,0,6,30,0,-1,-1,0,0,0,1,1,1,0,0,1,1,E01002352,2025-12-09 19:49:00,19,,,
200601KD50408,551560,189700,0.186257,51.585725,1,3,2,1,17/07/2006,2,10:35,15,E09000016,5,0,6,30,3,4,6,0,0,0,1,1,1,0,0,1,1,E01002353,2025-12-09 10:35:00,10,,,
200601KD50409,550940,188670,0.176872,51.576637,1,2,2,1,18/07/2006,3,13:09,15,E09000016,3,118,1,30,1,4,3,118,0,0,1,1,1,0,0,1,1,E01002244,2025-12-09 13:09:00,13,,,
200601KD50410,550050,189330,0.16432,51.582805,1,3,2,1,18/07/2006,3,18:00,15,E09000016,5,0,6,30,3,4,6,0,0,0,1,1,1,0,0,1,2,E01002329,2025-12-09 18:00:00,18,,,
200601KD50411,554790,190310,0.233111,51.590329,1,3,2,1,19/07/2006,4,17:40,15,E09000016,5,0,6,30,0,-1,-1,0,0,0,1,1,1,0,0,1,1,E01002294,2025-12-09 17:40:00,17,,,
200601KD50413,552740,189930,0.203376,51.587474,1,3,3,2,11/07/2006,3,12:07,15,E09000016,3,118,6,30,0,-1,-1,0,0,0,1,1,1,0,0,1,1,E01002379,2025-12-09 12:07:00,12,2006-11-07,Tuesday,11.0
200601KD50414,553090,187280,0.20727,51.563569,1,3,2,1,23/07/2006,1,16:45,15,E09000016,3,124,6,30,0,-1,-1,0,0,1,1,1,1,0,0,1,2,E01002321,2025-12-09 16:45:00,16,,,
200601KD50415,550090,189190,0.164837,51.581536,1,3,2,2,23/07/2006,1,16:15,15,E09000016,3,12,6,30,6,2,3,12,0,5,1,1,1,0,0,1,2,E01002244,2025-12-09 16:15:00,16,,,
200601KD50416,557210,191220,0.268424,51.597835,1,3,2,1,22/07/2006,7,12:36,15,E09000016,1,25,3,70,0,-1,-1,0,0,0,1,1,1,0,0,2,1,E01002296,2025-12-09 12:36:00,12,,,
200601KD50417,554140,189880,0.223546,51.586643,1,3,2,2,23/07/2006,1,09:50,15,E09000016,5,0,6,30,0,-1,-1,0,0,0,1,1,1,0,0,1,1,E01002377,2025-12-09 09:50:00,9,,,
200601KD50419,551410,190470,0.184425,51.592684,1,3,1,2,13/07/2006,5,16:16,15,E09000016,3,12,3,70,3,4,6,0,0,0,1,1,1,0,0,1,1,E01002334,2025-12-09 16:16:00,16,,,
200601KD50420,555180,188070,0.237747,51.570096,1,3,2,1,09/07/2006,1,07:12,15,E09000016,5,0,6,30,2,4,6,0,0,0,1,2,2,0,0,1,1,E01002273,2025-12-09 07:12:00,7,2006-09-07,Thursday,9.0
200601KD50422,551950,188190,0.191229,51.572053,1,3,2,1,25/07/2006,3,12:45,15,E09000016,5,0,6,30,2,4,5,0,0,0,1,1,1,0,0,1,2,E01002351,2025-12-09 12:45:00,12,,,
200601KD50423,552370,182300,0.194736,51.519019,1,2,2,1,06/07/2006,5,20:25,15,E09000016,5,0,6,30,3,4,6,0,0,0,1,1,1,0,0,1,1,E01002345,2025-12-09 20:25:00,20,2006-06-07,Wednesday,6.0
200601KD50424,556880,192370,0.264177,51.608259,1,3,3,1,10/07/2006,2,10:50,15,E09000016,1,25,1,30,1,4,3,12,0,0,1,1,1,0,0,2,2,E01002296,2025-12-09 10:50:00,10,2006-10-07,Saturday,10.0
200601KD50425,551990,185880,0.190807,51.551287,1,3,2,1,19/06/2006,2,12:00,15,E09000016,3,125,6,30,0,-1,-1,0,0,0,1,1,1,0,0,1,2,E01002260,2025-12-09 12:00:00,12,,,
200601KD50426,552750,184500,0.201162,51.538683,1,3,2,1,13/06/2006,3,17:42,15,E09000016,5,0,6,30,3,4,5,0,0,0,1,1,1,0,0,1,1,E01002263,2025-12-09 17:42:00,17,,,
200601KD50427,551770,188560,0.188793,51.575426,1,3,2,1,27/06/2006,3,18:05,15,E09000016,5,0,6,30,3,4,6,0,0,0,1,1,1,0,0,1,1,E01002358,2025-12-09 18:05:00,18,,,
200601KD50428,553390,190630,0.213057,51.593587,1,3,2,1,05/07/2006,4,10:33,15,E09000016,5,0,6,30,0,-1,-1,0,0,0,1,1,1,0,0,1,1,E01002310,2025-12-09 10:33:00,10,2006-05-07,Sunday,5.0
200601KD50429,552530,187420,0.199258,51.564978,1,3,2,1,21/07/2006,6,20:14,15,E09000016,3,124,6,30,0,-1,-1,0,0,0,1,1,1,0,0,1,1,E01002321,2025-12-09 20:14:00,20,,,
200601KD50430,555490,191840,0.243885,51.603883,1,3,1,1,25/07/2006,3,20:45,15,E09000016,5,0,6,30,0,-1,-1,0,0,0,1,1,1,0,0,1,1,E01002277,2025-12-09 20:45:00,20,,,
200601KD50431,549900,190300,0.16257,51.59156,1,3,1,1,25/07/2006,3,14:00,15,E09000016,6,0,6,30,0,-1,-1,0,0,0,1,1,1,0,0,1,1,E01002328,2025-12-09 14:00:00,14,,,
200601KD50432,551200,188100,0.180376,51.571446,1,3,1,2,26/07/2006,4,14:45,15,E09000016,5,0,1,30,1,4,3,125,0,0,1,1,1,0,0,1,1,E01002249,2025-12-09 14:45:00,14,,,
200601KD50433,553250,182530,0.207509,51.520847,1,3,1,1,31/07/2006,2,17:25,15,E09000016,5,0,6,30,3,4,6,0,0,0,1,1,1,0,0,1,1,E01002344,2025-12-09 17:25:00,17,,,
200601KD50434,561130,184960,0.322103,51.540487,1,3,2,2,01/08/2006,3,15:25,15,E09000016,5,0,6,30,0,-1,-1,0,0,0,1,1,1,0,0,2,1,E01002391,2025-12-09 15:25:00,15,2006-01-08,Sunday,1.0
200601KD50435,553340,190510,0.212283,51.592522,1,3,2,1,27/06/2006,3,06:14,15,E09000016,3,118,1,30,1,4,3,12,0,0,1,1,1,0,0,1,1,E01002337,2025-12-09 06:14:00,6,,,
200601KD50436,552930,187370,0.205002,51.564421,1,3,2,1,15/07/2006,7,13:45,15,E09000016,3,124,6,30,0,-1,-1,0,0,0,1,1,1,0,0,1,1,E01002321,2025-12-09 13:45:00,13,,,
200601KD50437,554810,189410,0.233003,51.582237,1,3,1,1,06/08/2006,1,02:00,15,E09000016,6,0,6,30,3,4,3,127,0,0,4,1,1,0,0,1,1,E01002268,2025-12-09 02:00:00,2,2006-06-08,Thursday,6.0
200601KD50438,552120,182110,0.191053,51.517379,1,3,1,1,02/08/2006,4,12:45,15,E09000016,4,1335,6,30,2,4,4,1335,0,0,1,1,1,0,0,1,1,E01002345,2025-12-09 12:45:00,12,2006-02-08,Wednesday,2.0
200601KD50439,558210,189030,0.281863,51.57788,1,3,2,2,25/07/2006,3,14:30,15,E09000016,1,25,3,70,0,-1,-1,0,0,0,1,1,1,0,0,2,1,E01002259,2025-12-09 14:30:00,14,,,
200601KD50440,552930,192400,0.207192,51.609615,1,3,2,3,27/07/2006,5,13:59,15,E09000016,5,0,6,30,3,2,5,0,0,5,1,1,1,0,0,2,1,E01002313,2025-12-09 13:59:00,13,,,
200601KD50441,551220,188110,0.180669,51.571531,1,3,2,1,26/07/2006,4,14:40,15,E09000016,3,125,1,30,1,4,3,125,0,0,1,1,1,0,0,1,1,E01002350,2025-12-09 14:40:00,14,,,
200601KD50442,551680,188520,0.187478,51.575091,1,3,2,1,31/07/2006,2,19:27,15,E09000016,5,0,6,30,6,2,5,0,0,5,1,1,1,0,0,1,1,E01002358,2025-12-09 19:27:00,19,,,
200601KD50443,553580,193050,0.216856,51.615278,1,3,2,1,02/08/2006,4,16:45,15,E09000016,5,0,6,30,3,4,5,0,0,0,1,1,1,0,0,1,2,E01002312,2025-12-09 16:45:00,16,2006-02-08,Wednesday,2.0
200601KD50444,553080,190560,0.208554,51.593042,1,3,4,2,03/08/2006,5,17:38,15,E09000016,3,12,3,50,0,-1,-1,0,0,0,1,1,1,0,0,2,1,E01002337,2025-12-09 17:38:00,17,2006-03-08,Wednesday,3.0
200601KD50445,553360,190480,0.212558,51.592247,1,3,2,1,03/08/2006,5,14:40,15,E09000016,3,118,7,30,5,4,3,12,0,5,1,1,1,0,0,1,1,E01002383,2025-12-09 14:40:00,14,2006-03-08,Wednesday,3.0
200601KD50446,552480,189800,0.199569,51.586376,1,3,2,1,07/08/2006,2,19:30,15,E09000016,3,118,6,30,3,4,5,0,0,4,1,1,1,0,0,1,1,E01002354,2025-12-09 19:30:00,19,2006-07-08,Saturday,7.0
200601KD50447,553960,190070,0.221033,51.5884,1,3,2,1,15/07/2006,7,17:42,15,E09000016,6,0,6,30,3,4,3,127,0,0,1,1,1,0,0,1,2,E01002295,2025-12-09 17:42:00,17,,,
200601KD50448,556670,192380,0.261151,51.608407,1,3,2,1,19/07/2006,4,15:15,15,E09000016,1,25,1,30,1,4,3,12,0,0,1,1,1,0,0,2,2,E01002277,2025-12-09 15:15:00,15,,,
200601KD50449,553790,185470,0.21657,51.547116,1,3,1,1,07/08/2006,2,20:03,15,E09000016,5,0,6,30,0,-1,-1,0,0,0,4,1,1,0,0,1,1,E01002285,2025-12-09 20:03:00,20,2006-07-08,Saturday,7.0
200601KD50450,551970,188670,0.191725,51.576361,1,3,2,1,07/08/2006,2,05:55,15,E09000016,5,0,6,30,3,4,6,0,0,0,1,2,2,4,0,1,1,E01002358,2025-12-09 05:55:00,5,2006-07-08,Saturday,7.0
200601KD50452,553990,186410,0.219863,51.555507,1,3,2,1,28/05/2006,1,14:24,15,E09000016,3,124,6,30,3,4,6,0,0,0,1,1,1,0,0,1,1,E01002291,2025-12-09 14:24:00,14,,,
200601KD50453,551750,184590,0.186793,51.539761,1,3,3,1,26/07/2006,4,20:38,15,E09000016,3,125,6,30,0,-1,-1,0,0,0,4,1,1,0,0,1,1,E01002260,2025-12-09 20:38:00,20,,,
200601KD50454,552900,189200,0.205366,51.580871,1,2,1,1,29/07/2006,7,14:15,15,E09000016,5,0,6,30,3,4,6,0,0,1,1,1,1,0,0,1,1,E01002379,2025-12-09 14:15:00,14,,,
200601KD50455,551260,188070,0.181228,51.57116,1,3,2,1,17/08/2006,5,10:36,15,E09000016,3,125,1,30,1,4,3,125,0,0,1,1,1,0,0,1,1,E01002350,2025-12-09 10:36:00,10,,,
200601KD50456,550630,189730,0.172856,51.586244,1,3,2,1,15/04/2006,7,07:40,15,E09000016,3,125,6,30,6,2,3,12,0,5,1,1,1,0,0,1,1,E01002340,2025-12-09 07:40:00,7,,,
200601KD50457,554510,181010,0.22499,51.506847,1,3,2,1,28/05/2006,1,06:50,15,E09000016,3,1306,6,60,9,4,6,0,0,0,1,1,1,0,0,2,1,E01002344,2025-12-09 06:50:00,6,,,
200601KD50459,552070,185100,0.191624,51.544257,1,3,1,3,06/08/2006,1,14:29,15,E09000016,3,125,7,30,3,4,6,0,0,0,1,1,1,0,0,1,1,E01002260,2025-12-09 14:29:00,14,2006-06-08,Thursday,6.0
200601KD50460,551280,188950,0.181895,51.579062,1,3,1,1,24/07/2006,2,11:40,15,E09000016,6,0,6,30,0,-1,-1,0,0,0,1,1,1,0,0,1,1,E01002357,2025-12-09 11:40:00,11,,,
200601KD50461,551210,190420,0.181519,51.592289,1,3,2,1,24/07/2006,2,15:45,15,E09000016,5,0,3,50,6,2,3,12,0,5,1,1,1,0,0,1,1,E01002334,2025-12-09 15:45:00,15,,,
200601KD50462,551100,191680,0.180474,51.603639,1,3,2,1,01/08/2006,3,21:59,15,E09000016,4,1459,6,30,6,2,4,175,0,5,4,1,1,0,0,1,1,E01002303,2025-12-09 21:59:00,21,2006-01-08,Sunday,1.0
200601KD50463,552780,187390,0.202849,51.564641,1,3,3,1,18/08/2006,6,10:20,15,E09000016,3,124,6,30,3,4,6,0,2,0,1,1,1,0,0,1,1,E01002321,2025-12-09 10:20:00,10,,,
200601KD50466,552600,184300,0.198914,51.536926,1,3,2,1,10/08/2006,5,15:20,15,E09000016,5,0,6,30,9,4,6,0,0,0,1,1,1,0,0,1,1,E01002267,2025-12-09 15:20:00,15,2006-10-08,Sunday,10.0
200601KD50467,553130,189260,0.208709,51.581348,1,3,2,1,20/08/2006,1,15:57,15,E09000016,5,0,6,30,2,4,5,0,0,0,1,1,1,0,0,1,1,E01002379,2025-12-09 15:57:00,15,,,
200601KD50468,552670,189900,0.202353,51.587223,1,3,2,1,19/08/2006,7,10:15,15,E09000016,6,0,6,30,3,4,3,118,0,0,1,1,1,0,0,1,2,E01002379,2025-12-09 10:15:00,10,,,
200601KD50469,550980,188600,0.177419,51.575998,1,3,2,4,19/08/2006,7,13:45,15,E09000016,3,125,1,30,1,4,3,118,0,0,1,1,1,0,0,1,2,E01002356,2025-12-09 13:45:00,13,,,
200601KD50470,550750,190970,0.175119,51.597354,1,3,2,1,27/03/2006,2,21:40,15,E09000016,4,175,6,30,8,4,6,0,0,0,4,1,1,0,0,1,1,E01002332,2025-12-09 21:40:00,21,,,
200601KD50471,556680,192370,0.261291,51.608315,1,3,2,1,04/08/2006,6,08:25,15,E09000016,3,12,1,30,1,4,1,25,0,0,1,1,1,0,0,2,2,E01002277,2025-12-09 08:25:00,8,2006-04-08,Saturday,4.0
200601KD50472,551240,190410,0.181947,51.592191,1,3,2,4,01/01/2006,1,13:45,15,E09000016,5,0,3,50,6,2,3,12,0,5,1,1,1,0,0,1,2,E01002334,2025-12-09 13:45:00,13,2006-01-01,Sunday,1.0
200601KD50473,558620,187990,0.287306,51.568421,1,3,2,1,26/08/2006,7,02:25,15,E09000016,1,25,3,70,0,-1,-1,0,0,0,4,1,2,0,0,2,1,E01002252,2025-12-09 02:25:00,2,,,
200601KD50474,552580,185730,0.199246,51.54978,1,3,1,1,04/08/2006,6,14:47,15,E09000016,5,0,6,30,0,-1,-1,0,0,0,1,1,1,0,0,1,2,E01002261,2025-12-09 14:47:00,14,2006-04-08,Saturday,4.0
200601KD50475,550080,189210,0.164701,51.581719,1,3,2,2,30/07/2006,1,20:00,15,E09000016,3,12,3,50,6,2,3,12,0,5,1,1,1,0,0,1,1,E01002329,2025-12-09 20:00:00,20,,,
200601KD50476,549240,190960,0.15333,51.597666,1,3,2,1,07/08/2006,2,15:15,15,E09000016,5,0,6,30,2,4,4,174,0,0,1,1,1,0,0,1,1,E01002326,2025-12-09 15:15:00,15,2006-07-08,Saturday,7.0
200601KD50477,551640,188660,0.186962,51.57636,1,3,2,2,05/08/2006,7,02:25,15,E09000016,5,0,6,30,3,2,6,0,0,5,4,1,1,0,0,1,1,E01002358,2025-12-09 02:25:00,2,2006-05-08,Monday,5.0
200601KD50478,550100,189210,0.164989,51.581713,1,2,2,2,23/08/2006,4,05:26,15,E09000016,3,12,3,50,6,2,3,12,0,5,4,1,1,0,0,1,1,E01002244,2025-12-09 05:26:00,5,,,
200601KD50479,558400,188330,0.284287,51.571537,1,3,2,1,09/08/2006,4,21:20,15,E09000016,1,25,1,30,1,4,3,127,0,0,4,1,1,0,0,2,1,E01002252,2025-12-09 21:20:00,21,2006-09-08,Friday,9.0
200601KD50481,552550,187420,0.199546,51.564973,1,3,2,1,12/08/2006,7,20:00,15,E09000016,6,0,6,30,6,4,3,124,0,0,1,1,1,0,0,1,2,E01002321,2025-12-09 20:00:00,20,2006-12-08,Friday,12.0
200601KD50482,553350,190540,0.21244,51.592789,1,3,2,1,01/09/2006,6,17:59,15,E09000016,3,12,1,30,1,4,3,12,0,0,1,1,1,0,0,1,1,E01002311,2025-12-09 17:59:00,17,2006-01-09,Monday,1.0
200601KD50483,553330,190920,0.212318,51.596208,1,3,2,3,07/08/2006,2,12:01,15,E09000016,5,0,6,30,3,4,5,0,0,0,1,2,2,0,0,1,1,E01002309,2025-12-09 12:01:00,12,2006-07-08,Saturday,7.0
200601KD50484,554180,189890,0.224128,51.586722,1,3,3,2,09/08/2006,4,18:45,15,E09000016,3,127,3,50,3,2,3,127,0,5,1,1,1,0,0,1,2,E01002378,2025-12-09 18:45:00,18,2006-09-08,Friday,9.0
200601KD50485,555090,191800,0.238096,51.603633,1,3,2,2,12/08/2006,7,14:00,15,E09000016,5,0,6,30,3,4,6,0,0,0,1,2,2,0,0,1,1,E01002283,2025-12-09 14:00:00,14,2006-12-08,Friday,12.0
200601KD50486,551780,188130,0.188752,51.57156,1,3,2,1,14/08/2006,2,13:11,15,E09000016,5,0,6,30,3,4,6,0,0,0,1,2,2,0,0,1,1,E01002350,2025-12-09 13:11:00,13,,,
200601KD50487,554750,190610,0.232666,51.593035,1,3,2,2,26/07/2006,4,06:48,15,E09000016,5,0,6,30,3,4,5,0,0,1,1,1,1,0,0,1,1,E01002293,2025-12-09 06:48:00,6,,,
200601KD50488,550910,187410,0.175898,51.565324,1,3,2,1,18/08/2006,6,03:50,15,E09000016,3,124,7,30,5,4,3,124,0,0,4,1,1,0,0,1,1,E01002248,2025-12-09 03:50:00,3,,,
200601KD50489,551440,188370,0.183953,51.573808,1,3,1,1,19/08/2006,7,01:45,15,E09000016,5,0,6,30,0,-1,-1,0,0,1,4,1,1,0,0,1,1,E01002356,2025-12-09 01:45:00,1,,,
200601KD50490,551810,187430,0.188882,51.565262,1,2,1,1,02/09/2006,7,01:27,15,E09000016,3,124,6,30,3,4,3,125,0,1,4,1,1,0,0,1,1,E01002319,2025-12-09 01:27:00,1,2006-02-09,Thursday,2.0
200601KD50491,551640,188890,0.187061,51.578426,1,3,1,1,12/08/2006,7,11:50,15,E09000016,6,0,6,30,0,-1,-1,0,0,0,1,2,2,0,0,1,1,E01002357,2025-12-09 11:50:00,11,2006-12-08,Friday,12.0
200601KD50492,551220,190420,0.181663,51.592286,1,3,2,1,14/08/2006,2,18:55,15,E09000016,5,0,3,50,6,2,3,12,0,5,1,1,1,0,0,1,1,E01002334,2025-12-09 18:55:00,18,,,
200601KD50493,552910,192610,0.206995,51.611507,1,3,4,1,15/08/2006,3,18:45,15,E09000016,5,0,6,30,0,-1,-1,0,0,0,1,1,1,0,0,2,1,E01002304,2025-12-09 18:45:00,18,,,
200601KD50494,558280,188790,0.282764,51.575704,1,3,2,1,03/09/2006,1,16:15,15,E09000016,1,25,3,70,0,-1,-1,0,0,0,1,1,1,0,0,2,1,E01002259,2025-12-09 16:15:00,16,2006-03-09,Thursday,3.0
200601KD50495,558610,188030,0.28718,51.568783,1,3,2,1,18/08/2006,6,17:50,15,E09000016,1,25,3,50,0,-1,-1,0,0,0,1,1,1,0,0,2,1,E01002252,2025-12-09 17:50:00,17,,,
200601KD50496,551070,189030,0.178901,51.579837,1,2,1,1,12/08/2006,7,21:48,15,E09000016,3,118,6,30,1,4,3,118,0,0,4,1,1,0,0,1,1,E01002353,2025-12-09 21:48:00,21,2006-12-08,Friday,12.0
200601KD50497,552930,192400,0.207192,51.609615,1,3,2,1,15/08/2006,3,19:42,15,E09000016,5,0,6,30,3,4,5,0,0,0,1,1,1,0,0,2,1,E01002313,2025-12-09 19:42:00,19,,,
200601KD50498,556960,187980,0.26337,51.568795,1,3,2,2,20/08/2006,1,18:59,15,E09000016,6,0,6,30,3,4,6,0,0,0,1,1,1,0,0,1,1,E01002254,2025-12-09 18:59:00,18,,,
200601KD50499,553400,190520,0.213153,51.592595,1,3,2,1,22/08/2006,3,00:51,15,E09000016,3,127,1,30,1,4,3,12,0,0,4,1,1,0,0,1,1,E01002293,2025-12-09 00:51:00,0,,,
200601KD50500,553450,192040,0.214538,51.606239,1,3,2,1,13/08/2006,1,13:23,15,E09000016,5,0,6,30,8,4,6,0,0,0,1,1,1,0,0,1,1,E01002282,2025-12-09 13:23:00,13,,,
200601KD50501,554720,187010,0.230648,51.560698,1,3,1,1,22/08/2006,3,14:45,15,E09000016,5,0,6,30,0,-1,-1,0,0,4,1,1,1,0,0,1,2,E01002362,2025-12-09 14:45:00,14,,,
200601KD50502,553010,185910,0.205521,51.551281,1,3,6,4,23/08/2006,4,20:38,15,E09000016,5,0,6,30,0,-1,-1,0,0,4,4,2,2,0,0,1,1,E01002366,2025-12-09 20:38:00,20,,,
200601KD50503,551300,183960,0.180038,51.534221,1,3,2,1,06/08/2006,1,10:44,15,E09000016,3,125,1,30,1,4,3,125,0,0,1,1,1,0,0,1,1,E01002375,2025-12-09 10:44:00,10,2006-06-08,Thursday,6.0
200601KD50504,552980,192460,0.20794,51.61014,1,2,1,1,03/07/2006,2,17:56,15,E09000016,5,0,7,30,9,4,5,0,0,0,1,1,1,0,0,1,1,E01002312,2025-12-09 17:56:00,17,2006-03-07,Tuesday,3.0
200601KD50506,551600,188010,0.186105,51.57053,1,3,2,1,24/08/2006,5,10:03,15,E09000016,5,0,1,30,1,4,5,0,0,0,1,1,1,0,0,1,1,E01002350,2025-12-09 10:03:00,10,,,
200601KD50507,553490,187210,0.213005,51.562831,1,3,1,1,24/08/2006,5,14:45,15,E09000016,3,124,6,30,3,4,3,124,0,0,1,1,1,0,0,1,2,E01002361,2025-12-09 14:45:00,14,,,
200601KD50509,554300,181530,0.222194,51.511577,1,3,2,3,26/08/2006,7,22:50,15,E09000016,5,0,6,30,6,4,3,1306,0,0,4,1,2,0,0,2,1,E01002344,2025-12-09 22:50:00,22,,,
200601KD50510,550230,190100,0.167245,51.589675,1,3,2,7,26/08/2006,7,00:30,15,E09000016,6,0,6,30,3,4,4,174,0,4,4,2,2,0,0,1,1,E01002328,2025-12-09 00:30:00,0,,,
200601KD50511,552500,186000,0.19821,51.552228,1,2,2,1,28/08/2006,2,20:08,15,E09000016,6,0,6,30,8,4,6,0,0,0,1,1,1,0,0,1,1,E01002261,2025-12-09 20:08:00,20,,,
200601KD50513,552100,185840,0.192376,51.550898,1,3,2,1,01/09/2006,6,09:40,15,E09000016,5,0,6,30,3,4,6,0,0,0,1,1,1,0,0,1,2,E01002260,2025-12-09 09:40:00,9,2006-01-09,Monday,1.0
200601KD50514,550950,188720,0.177038,51.577084,1,3,1,1,03/09/2006,1,07:15,15,E09000016,3,118,3,50,0,-1,-1,0,0,0,1,1,1,0,0,1,1,E01002356,2025-12-09 07:15:00,7,2006-03-09,Thursday,3.0
200601KD50515,551080,188390,0.17877,51.574084,1,3,2,2,07/09/2006,5,20:55,15,E09000016,6,0,6,30,3,4,3,125,0,0,4,1,1,0,0,1,1,E01002356,2025-12-09 20:55:00,20,2006-07-09,Sunday,7.0
200601KD50516,550640,189570,0.172932,51.584804,1,2,1,1,07/09/2006,5,18:20,15,E09000016,6,0,6,30,3,4,6,0,0,0,1,1,1,0,0,1,1,E01002245,2025-12-09 18:20:00,18,2006-07-09,Sunday,7.0
200601KD50517,551330,188650,0.182487,51.576353,1,2,1,2,31/08/2006,5,12:30,15,E09000016,5,0,6,30,3,2,5,0,0,5,1,1,1,0,0,1,1,E01002356,2025-12-09 12:30:00,12,,,
200601KD50518,550630,189680,0.172835,51.585795,1,3,2,1,30/08/2006,4,17:11,15,E09000016,6,0,6,30,3,4,3,125,0,1,1,1,1,0,0,1,1,E01002340,2025-12-09 17:11:00,17,,,
200601KD50519,551330,188650,0.182487,51.576353,1,3,1,1,30/08/2006,4,12:30,15,E09000016,5,0,2,30,3,4,5,0,0,0,1,1,1,0,0,1,1,E01002356,2025-12-09 12:30:00,12,,,
200601KD50520,554930,191890,0.235827,51.604486,1,3,1,1,07/09/2006,5,15:29,15,E09000016,5,0,6,30,0,-1,-1,0,0,0,1,1,1,0,0,1,1,E01002281,2025-12-09 15:29:00,15,2006-07-09,Sunday,7.0
200601KD50521,551390,188400,0.183245,51.574091,1,2,1,1,09/09/2006,7,03:30,15,E09000016,6,0,6,30,0,-1,-1,0,0,0,4,1,1,0,0,1,1,E01002356,2025-12-09 03:30:00,3,2006-09-09,Saturday,9.0
200601KD50522,550630,189760,0.172869,51.586514,1,3,2,1,09/09/2006,7,12:40,15,E09000016,4,174,6,30,6,2,3,12,0,5,1,1,1,0,0,1,2,E01002340,2025-12-09 12:40:00,12,2006-09-09,Saturday,9.0
200601KD50523,550850,189320,0.175853,51.582502,1,3,1,3,11/09/2006,2,09:27,15,E09000016,3,125,6,30,3,4,6,0,0,0,1,1,1,0,0,1,1,E01002243,2025-12-09 09:27:00,9,2006-11-09,Thursday,11.0
200601KD50524,552840,188550,0.204218,51.575047,1,2,1,1,04/09/2006,2,20:33,15,E09000016,6,0,6,30,0,-1,-1,0,0,0,4,1,1,0,0,1,1,E01002382,2025-12-09 20:33:00,20,2006-04-09,Sunday,4.0
200601KD50526,551770,186730,0.188003,51.558984,1,3,1,1,29/07/2006,7,07:00,15,E09000016,3,125,6,30,3,4,6,0,0,0,1,1,1,0,0,1,1,E01002322,2025-12-09 07:00:00,7,,,
200601KD50527,556610,188990,0.258774,51.577967,1,3,2,1,29/08/2006,3,17:00,15,E09000016,3,127,3,70,0,-1,-1,0,0,0,1,1,1,0,0,2,1,E01002259,2025-12-09 17:00:00,17,,,
200601KD50530,555840,186560,0.246593,51.556347,1,3,1,1,11/09/2006,2,10:05,15,E09000016,6,0,6,30,3,4,3,124,0,4,1,1,1,0,0,1,1,E01002386,2025-12-09 10:05:00,10,2006-11-09,Thursday,11.0
200601KD50531,553090,186120,0.206765,51.553146,1,3,2,1,11/09/2006,2,11:25,15,E09000016,5,0,6,30,0,-1,-1,0,0,0,1,1,1,0,0,1,1,E01002366,2025-12-09 11:25:00,11,2006-11-09,Thursday,11.0
200601KD50532,554730,184870,0.229852,51.541468,1,3,1,1,13/09/2006,4,08:39,15,E09000016,5,0,6,30,0,-1,-1,0,0,0,1,2,2,0,0,2,1,E01002385,2025-12-09 08:39:00,8,,,
200601KD50533,553780,188400,0.217706,51.573444,1,3,2,1,13/09/2006,4,23:20,15,E09000016,5,0,6,30,2,4,5,0,0,0,4,2,2,0,0,1,1,E01002274,2025-12-09 23:20:00,23,,,
200601KD50534,551600,181420,0.183268,51.511319,1,3,2,1,14/09/2006,5,07:40,15,E09000016,6,0,6,30,2,4,6,0,0,0,1,2,2,0,0,2,1,E01002344,2025-12-09 07:40:00,7,,,
200601KD50535,553470,190550,0.214176,51.592846,1,2,2,1,14/09/2006,5,09:50,15,E09000016,3,12,6,30,0,-1,-1,0,0,0,1,1,1,0,0,1,1,E01002293,2025-12-09 09:50:00,9,,,
200601KD50536,553820,188570,0.218357,51.574961,1,3,2,1,12/09/2006,3,18:59,15,E09000016,5,0,6,30,3,4,6,0,0,0,1,1,1,0,0,1,1,E01002270,2025-12-09 18:59:00,18,2006-12-09,Saturday,12.0
200601KD50537,553120,187270,0.207698,51.563471,1,3,1,1,09/09/2006,7,22:40,15,E09000016,3,124,6,30,6,4,6,0,0,0,4,1,1,0,0,1,1,E01002321,2025-12-09 22:40:00,22,2006-09-09,Saturday,9.0
200601KD50538,556790,187070,0.260513,51.560666,1,3,2,1,12/09/2006,3,10:30,15,E09000016,6,0,6,30,0,-1,-1,0,0,0,1,1,1,0,0,1,2,E01002254,2025-12-09 10:30:00,10,2006-12-09,Saturday,12.0
200601KD50539,550980,188610,0.177423,51.576087,1,3,2,1,15/09/2006,6,16:45,15,E09000016,3,125,1,30,1,4,3,118,0,0,1,1,1,0,0,1,2,E01002356,2025-12-09 16:45:00,16,,,
200601KD50540,550170,189120,0.165961,51.580886,1,2,2,1,15/09/2006,6,19:50,15,E09000016,5,0,6,30,3,4,6,0,0,0,1,1,1,0,0,1,1,E01002244,2025-12-09 19:50:00,19,,,
200601KD50541,555710,191750,0.247019,51.603013,1,3,2,1,15/09/2006,6,09:02,15,E09000016,5,0,3,50,6,2,3,12,0,5,1,1,1,0,0,1,1,E01002296,2025-12-09 09:02:00,9,,,
200601KD50542,556000,191540,0.25111,51.601046,1,3,2,1,16/09/2006,7,19:15,15,E09000016,6,0,6,30,0,-1,-1,0,0,0,1,1,1,0,0,1,1,E01002296,2025-12-09 19:15:00,19,,,
200601KD50543,549740,191080,0.160595,51.598611,1,2,1,2,09/09/2006,7,21:47,15,E09000016,6,0,6,30,3,4,4,174,0,4,4,1,1,0,0,1,1,E01002326,2025-12-09 21:47:00,21,2006-09-09,Saturday,9.0
200601KD50544,551680,188520,0.187478,51.575091,1,2,2,6,15/09/2006,6,20:31,15,E09000016,5,0,6,30,6,2,5,0,0,5,4,1,1,0,0,1,1,E01002358,2025-12-09 20:31:00,20,,,
200601KD50545,554130,186040,0.221719,51.552145,1,3,2,1,15/09/2006,6,18:38,15,E09000016,6,0,6,30,6,4,6,0,0,0,1,1,1,0,0,1,1,E01002290,2025-12-09 18:38:00,18,,,
200601KD50546,555140,192350,0.239061,51.608561,1,3,2,2,19/09/2006,3,08:47,15,E09000016,5,0,6,30,3,4,5,0,0,0,1,1,1,0,0,1,2,E01002279,2025-12-09 08:47:00,8,,,
200601KD50547,551270,188110,0.18139,51.571517,1,3,1,1,17/09/2006,1,23:41,15,E09000016,3,125,1,30,1,4,3,125,0,0,4,1,1,0,0,1,1,E01002350,2025-12-09 23:41:00,23,,,
200601KD50548,549760,191190,0.16093,51.599594,1,3,2,1,23/09/2006,7,00:10,15,E09000016,6,0,6,30,0,-1,-1,0,0,0,4,1,1,0,0,1,1,E01002331,2025-12-09 00:10:00,0,,,
200601KD50549,553110,182480,0.205471,51.520436,1,3,2,2,18/09/2006,2,20:33,15,E09000016,5,0,6,30,6,2,3,1306,0,5,4,1,1,0,0,1,1,E01002342,2025-12-09 20:33:00,20,,,
200601KD50550,552790,187400,0.202997,51.564728,1,3,2,1,31/08/2006,5,10:30,15,E09000016,3,124,6,30,3,4,6,0,0,0,1,1,1,0,0,1,2,E01002321,2025-12-09 10:30:00,10,,,
200601KD50551,551190,190390,0.181217,51.592024,1,3,2,1,03/09/2006,1,09:25,15,E09000016,3,12,3,30,3,4,5,0,0,0,1,1,1,0,0,1,1,E01002334,2025-12-09 09:25:00,9,2006-03-09,Thursday,3.0
200601KD50552,551920,187410,0.190459,51.565053,1,3,2,1,11/09/2006,2,09:05,15,E09000016,3,124,1,30,1,2,3,124,0,5,1,1,1,0,0,1,2,E01002319,2025-12-09 09:05:00,9,2006-11-09,Thursday,11.0
200601KD50553,554480,190050,0.228525,51.588078,1,3,1,1,09/09/2006,7,14:07,15,E09000016,5,0,6,30,3,4,6,0,0,0,1,1,1,0,0,1,1,E01002268,2025-12-09 14:07:00,14,2006-09-09,Saturday,9.0
200601KD50554,555910,186170,0.24743,51.552824,1,3,1,5,23/08/2006,4,21:57,15,E09000016,4,1421,6,30,3,4,6,0,0,0,4,8,2,0,0,1,1,E01002390,2025-12-09 21:57:00,21,,,
200601KD50555,553340,190510,0.212283,51.592522,1,3,2,1,25/09/2006,2,07:05,15,E09000016,3,12,1,30,1,4,3,12,0,0,1,1,1,0,0,1,1,E01002337,2025-12-09 07:05:00,7,,,
200601KD50556,549780,192290,0.161688,51.609472,1,3,2,1,14/09/2006,5,16:11,15,E09000016,6,0,6,30,3,4,6,0,0,0,1,1,1,0,0,1,1,E01002305,2025-12-09 16:11:00,16,,,
200601KD50558,554920,186160,0.233157,51.553007,1,3,2,1,13/09/2006,4,19:30,15,E09000016,6,0,6,30,3,4,6,0,0,0,1,1,1,0,0,1,2,E01002292,2025-12-09 19:30:00,19,,,
200601KD50559,554030,186990,0.220694,51.560708,1,3,2,1,12/01/2006,5,11:50,15,E09000016,5,0,6,30,3,4,6,0,0,0,1,1,1,0,0,1,2,E01002361,2025-12-09 11:50:00,11,2006-12-01,Friday,12.0
200601KD50560,550910,187490,0.175933,51.566043,1,3,2,1,05/09/2006,3,19:20,15,E09000016,5,0,6,30,0,-1,-1,0,0,0,1,1,1,0,0,1,1,E01002248,2025-12-09 19:20:00,19,2006-05-09,Tuesday,5.0
200601KD50561,550310,187350,0.167223,51.564945,1,3,3,1,09/09/2006,7,19:03,15,E09000016,6,0,6,30,0,-1,-1,0,0,0,1,1,1,0,0,1,1,E01002251,2025-12-09 19:03:00,19,2006-09-09,Saturday,9.0
200601KD50562,556630,190330,0.259659,51.59,1,3,1,2,19/09/2006,3,12:59,15,E09000016,5,0,6,30,0,-1,-1,0,0,0,1,1,1,0,0,2,1,E01002296,2025-12-09 12:59:00,12,,,
200601KD50563,553060,188890,0.207538,51.578043,1,3,2,1,26/09/2006,3,19:55,15,E09000016,5,0,1,30,1,4,5,0,0,1,1,1,1,0,0,1,2,E01002379,2025-12-09 19:55:00,19,,,
200601KD50564,552900,189200,0.205366,51.580871,1,3,1,2,12/09/2006,3,16:05,15,E09000016,6,0,6,30,3,4,6,0,0,1,1,1,1,0,0,1,2,E01002379,2025-12-09 16:05:00,16,2006-12-09,Saturday,12.0
200601KD50565,552050,182210,0.190088,51.518296,1,3,2,1,26/09/2006,3,08:50,15,E09000016,4,1335,6,30,3,4,4,1335,0,0,1,1,1,0,0,1,1,E01002345,2025-12-09 08:50:00,8,,,
200601KD50566,558320,188470,0.283197,51.572817,1,3,2,1,29/09/2006,6,13:45,15,E09000016,3,127,6,50,0,-1,-1,0,0,0,1,1,1,0,0,2,2,E01002259,2025-12-09 13:45:00,13,,,
200601KD50568,553100,187280,0.207414,51.563566,1,3,4,5,29/09/2006,6,17:44,15,E09000016,3,124,6,30,3,1,6,0,0,0,1,1,1,0,0,1,1,E01002321,2025-12-09 17:44:00,17,,,
200601KD50569,549410,190960,0.155783,51.59762,1,3,1,1,25/09/2006,2,17:00,15,E09000016,5,0,6,30,3,4,4,174,0,0,1,1,1,0,0,1,1,E01002325,2025-12-09 17:00:00,17,,,
200601KD50570,550850,187410,0.175033,51.56534,1,3,2,1,28/09/2006,5,14:24,15,E09000016,3,124,6,30,0,-1,-1,0,0,0,1,1,1,0,0,1,1,E01002248,2025-12-09 14:24:00,14,,,
200601KD50573,558530,188530,0.286252,51.573297,1,3,2,1,19/09/2006,3,10:00,15,E09000016,3,127,6,30,7,4,1,25,0,0,1,1,1,0,0,2,1,E01002252,2025-12-09 10:00:00,10,,,
200601KD50574,550630,182930,0.169945,51.525146,1,3,2,1,21/09/2006,5,13:00,15,E09000016,5,0,6,30,3,2,3,1306,0,5,1,1,1,0,0,1,1,E01002368,2025-12-09 13:00:00,13,,,
200601KD50575,554560,191410,0.230277,51.600275,1,3,2,1,22/09/2006,6,17:41,15,E09000016,5,0,6,30,3,4,6,0,0,0,1,1,1,0,0,1,1,E01002299,2025-12-09 17:41:00,17,,,
200601KD50576,557340,190370,0.269918,51.590162,1,3,1,1,05/09/2006,3,12:00,15,E09000016,1,25,3,50,0,-1,-1,0,0,0,1,1,1,0,0,2,1,E01002296,2025-12-09 12:00:00,12,2006-05-09,Tuesday,5.0
200601KD50577,550990,191690,0.178891,51.603759,1,3,1,1,09/09/2006,7,11:00,15,E09000016,4,1459,6,30,0,-1,-1,0,0,0,1,1,1,0,0,1,1,E01002303,2025-12-09 11:00:00,11,2006-09-09,Saturday,9.0
200601KD50579,554970,186950,0.234226,51.560091,1,2,1,1,04/10/2006,4,14:07,15,E09000016,6,0,6,30,0,-1,-1,0,0,0,1,1,1,0,0,1,1,E01002362,2025-12-09 14:07:00,14,2006-04-10,Monday,4.0
200601KD50580,556490,187900,0.256558,51.568207,1,3,1,1,06/10/2006,6,15:00,15,E09000016,5,0,6,30,0,-1,-1,0,0,0,1,1,1,0,0,1,1,E01002253,2025-12-09 15:00:00,15,2006-06-10,Saturday,6.0
200601KD50581,554060,186150,0.220758,51.553152,1,3,2,1,26/09/2006,3,09:40,15,E09000016,6,0,6,30,0,-1,-1,0,0,0,1,1,1,0,0,1,2,E01002290,2025-12-09 09:40:00,9,,,
200601KD50582,551510,188800,0.185147,51.577652,1,3,2,1,12/10/2006,5,13:13,15,E09000016,5,0,6,30,3,4,5,0,0,0,1,1,1,0,0,1,1,E01002357,2025-12-09 13:13:00,13,2006-12-10,Sunday,12.0
200601KD50585,551870,183530,0.188065,51.530205,1,2,2,2,09/09/2006,7,06:20,15,E09000016,6,0,6,30,8,4,3,125,0,0,1,1,1,0,0,1,1,E01002373,2025-12-09 06:20:00,6,2006-09-09,Saturday,9.0
200601KD50586,554950,190830,0.235648,51.594957,1,3,2,1,18/09/2006,2,17:00,15,E09000016,6,0,6,30,3,4,6,0,0,0,1,1,1,0,0,1,2,E01002300,2025-12-09 17:00:00,17,,,
200601KD50587,550580,191420,0.17286,51.601442,1,3,3,1,29/09/2006,6,07:15,15,E09000016,6,0,6,30,3,2,4,1459,0,5,1,1,1,0,0,1,1,E01002303,2025-12-09 07:15:00,7,,,
200601KD50589,551260,193030,0.183365,51.615726,1,3,2,1,23/06/2006,6,04:28,15,E09000016,4,175,6,30,3,4,5,0,0,0,1,1,1,0,0,1,1,E01002304,2025-12-09 04:28:00,4,,,
200601KD50590,550600,182030,0.169129,51.517067,1,3,2,3,22/09/2006,6,16:47,15,E09000016,6,0,6,30,0,-1,-1,0,0,0,1,1,1,0,0,1,1,E01002370,2025-12-09 16:47:00,16,,,
200601KD50591,552020,182410,0.189743,51.520101,1,3,2,1,22/09/2006,6,16:30,15,E09000016,4,1335,6,30,6,4,6,0,0,0,1,1,1,0,0,1,2,E01002345,2025-12-09 16:30:00,16,,,
200601KD50593,555710,191760,0.247024,51.603103,1,3,2,4,03/10/2006,3,21:15,15,E09000016,3,12,3,70,3,2,5,0,0,5,4,1,1,0,0,1,1,E01002277,2025-12-09 21:15:00,21,2006-03-10,Friday,3.0
200601KD50594,550950,187950,0.176707,51.570165,1,2,2,1,13/09/2006,4,16:35,15,E09000016,5,0,6,30,0,-1,-1,0,0,1,1,1,1,0,0,1,1,E01002249,2025-12-09 16:35:00,16,,,
200601KD50595,553760,190710,0.218429,51.594205,1,3,3,1,19/10/2006,5,17:20,15,E09000016,3,12,3,30,3,2,6,0,0,5,1,1,1,0,0,1,1,E01002293,2025-12-09 17:20:00,17,,,
200601KD50596,550760,183340,0.171993,51.528795,1,2,1,1,05/10/2006,5,17:33,15,E09000016,6,0,6,30,3,4,6,0,0,0,1,2,2,0,0,1,1,E01002368,2025-12-09 17:33:00,17,2006-05-10,Wednesday,5.0
200601KD50597,558520,188390,0.286045,51.572042,1,3,3,1,07/10/2006,7,10:55,15,E09000016,3,127,1,30,1,4,1,25,0,0,1,1,1,0,0,2,1,E01002252,2025-12-09 10:55:00,10,2006-07-10,Monday,7.0
200601KD50598,550360,189500,0.168863,51.58425,1,3,2,3,08/10/2006,1,14:10,15,E09000016,3,12,3,40,3,4,6,0,0,0,1,1,1,0,0,1,1,E01002329,2025-12-09 14:10:00,14,2006-08-10,Thursday,8.0
200601KD50599,555070,187620,0.235962,51.566083,1,3,2,1,09/10/2006,2,15:34,15,E09000016,5,0,6,30,3,4,6,0,0,0,1,1,1,0,0,1,1,E01002273,2025-12-09 15:34:00,15,2006-09-10,Sunday,9.0
200601KD50600,550320,187780,0.167551,51.568806,1,2,1,1,09/10/2006,2,16:09,15,E09000016,6,0,6,30,0,-1,-1,0,0,0,1,1,1,0,0,1,1,E01002248,2025-12-09 16:09:00,16,2006-09-10,Sunday,9.0
200601KD50601,551890,188630,0.190554,51.576023,1,3,2,1,10/10/2006,3,12:50,15,E09000016,5,0,6,30,0,-1,-1,0,0,0,1,1,1,0,0,1,1,E01002358,2025-12-09 12:50:00,12,2006-10-10,Tuesday,10.0
200601KD50602,554480,189670,0.228358,51.584664,1,3,4,1,10/10/2006,3,07:40,15,E09000016,3,127,3,50,3,4,6,0,0,0,1,1,1,0,0,1,1,E01002378,2025-12-09 07:40:00,7,2006-10-10,Tuesday,10.0
200601KD50604,553550,184950,0.212884,51.542509,1,2,2,2,21/05/2006,1,12:53,15,E09000016,5,0,6,30,3,4,6,0,0,0,1,1,1,0,0,1,1,E01002265,2025-12-09 12:53:00,12,,,
200601KD50605,549690,189320,0.159123,51.582811,1,3,5,1,06/10/2006,6,08:20,15,E09000016,6,0,6,30,0,-1,-1,0,0,0,1,1,1,0,0,1,1,E01002330,2025-12-09 08:20:00,8,2006-06-10,Saturday,6.0
200601KD50606,550830,187890,0.174951,51.569658,1,3,1,1,08/06/2006,5,08:15,15,E09000016,5,0,6,30,2,4,5,0,2,0,1,1,1,0,0,1,1,E01002248,2025-12-09 08:15:00,8,2006-08-06,Sunday,8.0
200601KD50607,552090,181350,0.190294,51.510558,1,3,3,2,11/10/2006,4,08:15,15,E09000016,3,13,3,70,0,-1,-1,0,0,0,1,1,1,0,0,2,1,E01002344,2025-12-09 08:15:00,8,2006-11-10,Friday,11.0
200601KD50608,550720,190870,0.174643,51.596463,1,3,2,1,12/10/2006,5,14:23,15,E09000016,4,175,6,30,2,4,4,175,0,0,1,1,1,0,0,1,1,E01002336,2025-12-09 14:23:00,14,2006-12-10,Sunday,12.0
200601KD50610,551050,188430,0.178355,51.574451,1,3,5,3,06/10/2006,6,15:10,15,E09000016,3,125,3,50,0,-1,-1,0,0,0,1,2,2,0,0,1,1,E01002356,2025-12-09 15:10:00,15,2006-06-10,Saturday,6.0
200601KD50611,553530,193010,0.216117,51.614932,1,3,2,2,06/10/2006,6,16:45,15,E09000016,5,0,6,30,3,4,6,0,0,0,1,1,1,0,0,1,1,E01002312,2025-12-09 16:45:00,16,2006-06-10,Saturday,6.0
200601KD50613,551560,189190,0.186037,51.581143,1,2,2,1,12/10/2006,5,15:51,15,E09000016,6,0,6,30,8,4,3,118,0,0,1,1,1,0,0,1,1,E01002357,2025-12-09 15:51:00,15,2006-12-10,Sunday,12.0
200601KD50614,552370,181330,0.194317,51.510303,1,3,2,1,04/11/2006,7,21:54,15,E09000016,3,13,3,70,0,-1,-1,0,0,0,4,1,1,0,0,2,1,E01002344,2025-12-09 21:54:00,21,2006-04-11,Tuesday,4.0
200601KD50616,549450,190990,0.156373,51.597879,1,2,1,1,14/10/2006,7,12:55,15,E09000016,4,174,6,30,0,-1,-1,0,0,0,1,1,1,0,0,1,1,E01002325,2025-12-09 12:55:00,12,,,
200601KD50617,550930,188830,0.176796,51.578077,1,3,2,1,13/10/2006,6,13:12,15,E09000016,3,118,3,40,3,4,3,118,0,0,1,1,1,0,0,1,1,E01002243,2025-12-09 13:12:00,13,,,
200601KD50618,553480,188530,0.213437,51.574694,1,3,1,2,14/10/2006,7,00:01,15,E09000016,5,0,6,30,3,4,6,0,0,0,4,1,1,0,0,1,1,E01002274,2025-12-09 00:01:00,0,,,
200601KD50619,550970,188610,0.177279,51.57609,1,3,2,1,16/10/2006,2,09:03,15,E09000016,3,118,1,30,1,1,3,125,0,0,1,1,1,0,0,1,2,E01002356,2025-12-09 09:03:00,9,,,
200601KD50620,549410,190980,0.155791,51.5978,1,3,2,1,17/10/2006,3,07:38,15,E09000016,4,174,6,30,3,4,5,0,0,0,1,1,1,0,0,1,1,E01002325,2025-12-09 07:38:00,7,,,
200601KD50621,552580,188440,0.200421,51.574129,1,3,2,1,17/10/2006,3,15:10,15,E09000016,5,0,6,30,3,4,6,0,0,0,1,1,1,0,0,1,2,E01002317,2025-12-09 15:10:00,15,,,
200601KD50623,550850,182190,0.172798,51.518438,1,3,1,1,21/10/2006,7,16:35,15,E09000016,3,13,3,50,0,-1,-1,0,0,0,4,1,1,0,0,2,1,E01002370,2025-12-09 16:35:00,16,,,
200601KD50624,551220,188050,0.180643,51.570991,1,3,2,1,19/10/2006,5,21:40,15,E09000016,5,0,1,30,1,4,3,125,0,0,4,1,1,0,0,1,2,E01002249,2025-12-09 21:40:00,21,,,
200601KD50625,552100,188260,0.193422,51.572642,1,3,2,2,22/10/2006,1,16:00,15,E09000016,5,0,6,30,3,4,6,0,0,0,1,2,2,0,0,1,1,E01002352,2025-12-09 16:00:00,16,,,
200601KD50626,551270,188100,0.181385,51.571427,1,3,1,1,23/10/2006,2,15:50,15,E09000016,5,0,1,30,1,4,3,125,0,0,1,1,1,0,0,1,1,E01002350,2025-12-09 15:50:00,15,,,
200601KD50627,550930,187440,0.1762,51.565588,1,3,1,1,19/10/2006,5,12:30,15,E09000016,3,124,6,30,3,2,3,124,0,5,1,1,1,0,0,1,1,E01002248,2025-12-09 12:30:00,12,,,
200601KD50628,553400,190580,0.213179,51.593135,1,3,2,1,25/10/2006,4,17:06,15,E09000016,5,0,6,30,8,4,3,12,0,0,4,1,1,0,0,1,1,E01002310,2025-12-09 17:06:00,17,,,
200601KD50629,552130,182780,0.191486,51.523396,1,3,2,1,19/10/2006,5,16:45,15,E09000016,6,0,6,30,3,4,3,125,0,0,4,1,1,0,0,1,1,E01002370,2025-12-09 16:45:00,16,,,
200601KD50630,553810,192200,0.219803,51.607578,1,3,1,1,10/10/2006,3,20:04,15,E09000016,5,0,6,30,3,4,6,0,0,0,4,1,1,0,0,1,1,E01002282,2025-12-09 20:04:00,20,2006-10-10,Tuesday,10.0
200601KD50631,553110,182480,0.205471,51.520436,1,2,2,3,18/10/2006,4,12:25,15,E09000016,5,0,6,30,6,2,3,1306,0,5,1,1,1,1,0,1,1,E01002342,2025-12-09 12:25:00,12,,,
200601KD50632,554810,184300,0.230754,51.536325,1,3,2,1,20/10/2006,6,13:00,15,E09000016,5,0,6,30,0,-1,-1,0,0,0,1,2,2,0,0,2,1,E01002348,2025-12-09 13:00:00,13,,,
200601KD50633,558410,188660,0.28458,51.574499,1,3,2,1,20/10/2006,6,13:20,15,E09000016,1,25,2,50,5,4,3,127,0,0,1,1,1,0,0,2,1,E01002259,2025-12-09 13:20:00,13,,,
200601KD50634,551680,188520,0.187478,51.575091,1,3,2,1,14/10/2006,7,00:02,15,E09000016,5,0,3,40,6,2,5,0,0,5,4,1,1,0,0,1,1,E01002358,2025-12-09 00:02:00,0,,,
200601KD50635,553960,190060,0.221029,51.58831,1,2,5,3,21/10/2006,7,17:10,15,E09000016,6,0,3,50,3,4,3,127,0,0,4,1,1,0,0,1,1,E01002377,2025-12-09 17:10:00,17,,,
200601KD50636,554170,189920,0.223997,51.586995,1,3,3,1,21/10/2006,7,18:30,15,E09000016,3,127,3,50,6,2,3,127,0,5,4,2,2,0,0,1,2,E01002295,2025-12-09 18:30:00,18,,,
200601KD50637,553320,189320,0.211475,51.581835,1,3,2,1,26/10/2006,5,17:15,15,E09000016,5,0,6,30,3,4,6,0,0,0,1,1,1,0,0,1,1,E01002380,2025-12-09 17:15:00,17,,,
200601KD50638,553090,191830,0.209252,51.60445,1,3,1,1,26/10/2006,5,11:40,15,E09000016,5,0,6,30,0,-1,-1,0,0,1,1,1,1,0,0,2,1,E01002311,2025-12-09 11:40:00,11,,,
200601KD50639,550910,187380,0.175886,51.565055,1,3,2,1,27/10/2006,6,16:35,15,E09000016,5,0,6,30,0,-1,-1,0,0,0,1,1,1,0,0,1,1,E01002248,2025-12-09 16:35:00,16,,,
200601KD50640,551520,188910,0.185339,51.578638,1,3,1,1,30/10/2006,2,10:00,15,E09000016,5,0,6,30,0,-1,-1,0,0,0,1,1,1,0,0,1,1,E01002357,2025-12-09 10:00:00,10,,,
200601KD50641,556410,188970,0.255881,51.577842,1,3,2,1,03/11/2006,6,04:51,15,E09000016,5,0,6,30,0,-1,-1,0,0,0,4,1,2,0,0,2,1,E01002259,2025-12-09 04:51:00,4,2006-03-11,Saturday,3.0
200601KD50642,553970,180370,0.216936,51.501244,1,3,3,3,04/11/2006,7,00:30,15,E09000016,3,13,3,70,0,-1,-1,0,0,0,4,1,1,0,0,2,1,E01002344,2025-12-09 00:30:00,0,2006-04-11,Tuesday,4.0
200601KD50643,553910,192830,0.221523,51.613211,1,3,1,1,05/11/2006,1,13:45,15,E09000016,6,0,6,30,3,4,6,0,0,0,1,1,1,0,0,1,1,E01002276,2025-12-09 13:45:00,13,2006-05-11,Thursday,5.0
200601KD50645,554640,180600,0.226682,51.503128,1,3,2,1,29/08/2006,3,17:32,15,E09000016,3,1306,3,30,3,4,6,0,0,0,1,1,1,0,0,2,2,E01002344,2025-12-09 17:32:00,17,,,
200601KD50646,552200,182220,0.192253,51.518346,1,3,2,1,07/10/2006,7,17:00,15,E09000016,5,0,6,30,3,4,6,0,0,0,1,1,1,0,0,1,2,E01002345,2025-12-09 17:00:00,17,2006-07-10,Monday,7.0
200601KD50647,556790,192340,0.262865,51.608015,1,3,2,1,16/10/2006,2,08:10,15,E09000016,1,25,3,70,1,4,3,12,0,0,1,1,1,0,0,2,1,E01002296,2025-12-09 08:10:00,8,,,
200601KD50648,554760,185060,0.230368,51.543167,1,3,2,1,16/10/2006,2,08:25,15,E09000016,5,0,6,30,3,4,5,0,0,0,1,1,1,0,0,2,2,E01002385,2025-12-09 08:25:00,8,,,
200601KD50649,551780,186710,0.188139,51.558801,1,3,1,1,02/11/2006,5,10:27,15,E09000016,3,125,6,30,0,-1,-1,0,0,4,1,1,1,0,0,1,1,E01002322,2025-12-09 10:27:00,10,2006-02-11,Saturday,2.0
200601KD50650,558240,184320,0.280178,51.535554,1,3,2,1,22/09/2006,6,11:45,15,E09000016,1,25,3,70,0,-1,-1,0,0,0,1,1,1,0,0,2,2,E01002385,2025-12-09 11:45:00,11,,,
200601KD50651,551300,181280,0.178888,51.510141,1,3,1,1,13/10/2006,6,08:08,15,E09000016,6,0,1,30,1,4,6,0,0,0,1,1,1,0,0,2,1,E01002344,2025-12-09 08:08:00,8,,,
200601KD50652,551130,191680,0.180907,51.603631,1,2,3,4,28/10/2006,7,18:08,15,E09000016,5,0,3,40,0,-1,-1,0,0,0,4,1,1,0,0,1,1,E01002304,2025-12-09 18:08:00,18,,,
200601KD50653,558520,188390,0.286045,51.572042,1,3,2,1,17/10/2006,3,10:45,15,E09000016,3,127,1,30,1,4,1,25,0,0,1,1,1,0,0,2,2,E01002252,2025-12-09 10:45:00,10,,,
200601KD50654,556440,192820,0.258029,51.612425,1,3,2,1,16/10/2006,2,19:10,15,E09000016,1,25,3,70,0,-1,-1,0,0,0,1,1,1,0,0,2,1,E01002277,2025-12-09 19:10:00,19,,,
200601KD50655,554670,180600,0.227114,51.50312,1,2,2,1,20/10/2006,6,21:30,15,E09000016,3,1306,3,40,3,4,6,0,0,0,4,1,1,0,0,2,1,E01002344,2025-12-09 21:30:00,21,,,
200601KD50656,556860,192230,0.263826,51.607007,1,3,2,1,22/10/2006,1,10:58,15,E09000016,1,25,6,30,9,4,3,12,0,0,1,1,1,0,0,2,1,E01021468,2025-12-09 10:58:00,10,,,
200601KD50657,556250,190380,0.254201,51.590555,1,3,2,1,27/10/2006,6,18:05,15,E09000016,5,0,6,30,3,4,5,0,0,0,1,1,1,0,0,2,2,E01002294,2025-12-09 18:05:00,18,,,
200601KD50658,549820,191120,0.161766,51.598949,1,3,1,1,03/11/2006,6,18:00,15,E09000016,4,174,6,30,0,-1,-1,0,0,0,4,1,1,0,0,1,1,E01002326,2025-12-09 18:00:00,18,2006-03-11,Saturday,3.0
200601KD50659,554570,180850,0.225784,51.505393,1,3,1,1,03/11/2006,6,22:15,15,E09000016,3,1306,6,40,3,4,6,0,0,0,4,1,1,0,0,2,1,E01002344,2025-12-09 22:15:00,22,2006-03-11,Saturday,3.0
200601KD50660,556000,186490,0.248869,51.555674,1,3,2,1,23/10/2006,2,06:50,15,E09000016,4,1421,6,30,3,4,6,0,0,0,1,1,1,0,0,1,2,E01002386,2025-12-09 06:50:00,6,,,
200601KD50661,550890,182220,0.173387,51.518697,1,2,1,1,04/11/2006,7,00:10,15,E09000016,3,13,3,70,0,-1,-1,0,0,0,4,1,2,0,0,2,1,E01002368,2025-12-09 00:10:00,0,2006-04-11,Tuesday,4.0
200601KD50662,550980,188660,0.177444,51.576537,1,3,2,1,26/10/2006,5,14:37,15,E09000016,3,125,6,30,3,2,3,118,0,5,1,1,1,0,0,1,1,E01002356,2025-12-09 14:37:00,14,,,
200601KD50663,550560,187350,0.170827,51.564878,1,3,2,1,20/11/2006,2,05:07,15,E09000016,3,124,6,30,0,-1,-1,0,0,0,4,1,1,0,0,1,1,E01002248,2025-12-09 05:07:00,5,,,
200601KD50664,554760,185060,0.230368,51.543167,1,3,1,2,29/10/2006,1,13:31,15,E09000016,5,0,6,30,3,4,5,0,0,0,1,1,1,0,0,2,1,E01002385,2025-12-09 13:31:00,13,,,
200601KD50665,551070,191700,0.18005,51.603827,1,3,2,1,03/11/2006,6,17:35,15,E09000016,4,1459,3,50,6,2,4,175,0,5,4,1,1,0,0,1,2,E01002303,2025-12-09 17:35:00,17,2006-03-11,Saturday,3.0
200601KD50666,554260,193730,0.226969,51.621202,1,3,2,1,28/10/2006,7,13:00,15,E09000016,5,0,6,30,3,4,5,0,0,0,1,1,1,0,0,2,2,E01002276,2025-12-09 13:00:00,13,,,
200601KD50667,554030,186980,0.220689,51.560618,1,3,1,1,12/09/2006,3,19:20,15,E09000016,5,0,6,30,3,4,6,0,0,0,1,1,1,0,0,1,1,E01002361,2025-12-09 19:20:00,19,2006-12-09,Saturday,12.0
200601KD50668,551200,188100,0.180376,51.571446,1,3,3,1,28/10/2006,7,15:23,15,E09000016,3,125,1,30,1,4,3,125,0,0,1,1,1,0,0,1,1,E01002249,2025-12-09 15:23:00,15,,,
200601KD50670,550910,187420,0.175903,51.565414,1,3,2,1,29/10/2006,1,19:50,15,E09000016,3,124,3,50,6,2,3,124,0,5,4,1,1,0,0,1,1,E01002248,2025-12-09 19:50:00,19,,,
200601KD50671,550310,191740,0.169101,51.60439,1,3,2,1,29/10/2006,1,10:27,15,E09000016,6,0,6,30,3,4,6,0,0,0,1,2,2,0,0,1,2,E01002301,2025-12-09 10:27:00,10,,,
200601KD50672,553930,185760,0.218714,51.549683,1,3,2,1,16/11/2006,5,12:12,15,E09000016,6,0,6,30,0,-1,-1,0,0,0,1,1,1,0,0,1,1,E01002285,2025-12-09 12:12:00,12,,,
200601KD50675,549890,191140,0.162785,51.59911,1,3,2,1,01/11/2006,4,11:55,15,E09000016,4,174,1,30,1,4,4,174,0,1,1,1,1,0,0,1,2,E01002326,2025-12-09 11:55:00,11,2006-01-11,Wednesday,1.0
200601KD50676,551660,188580,0.187216,51.575635,1,3,1,1,02/11/2006,5,16:20,15,E09000016,5,0,3,40,0,-1,-1,0,0,0,4,1,1,0,0,1,1,E01002358,2025-12-09 16:20:00,16,2006-02-11,Saturday,2.0
200601KD50677,554500,192400,0.229848,51.609186,1,3,2,3,02/11/2006,5,19:48,15,E09000016,5,0,6,30,2,4,6,0,0,0,4,1,1,0,0,1,1,E01002281,2025-12-09 19:48:00,19,2006-02-11,Saturday,2.0
200601KD50678,553910,189180,0.219922,51.580417,1,3,2,1,02/11/2006,5,12:15,15,E09000016,5,0,6,30,3,4,6,0,0,0,1,1,1,0,0,1,2,E01002270,2025-12-09 12:15:00,12,2006-02-11,Saturday,2.0
200601KD50679,554050,190860,0.222678,51.595473,1,3,2,2,26/10/2006,5,10:10,15,E09000016,3,12,3,50,0,-1,-1,0,0,0,1,2,2,0,0,1,1,E01002293,2025-12-09 10:10:00,10,,,
200601KD50680,553940,189530,0.220508,51.583553,1,2,1,1,08/11/2006,4,18:55,15,E09000016,5,0,6,30,3,4,5,0,0,0,4,1,1,0,0,1,1,E01002377,2025-12-09 18:55:00,18,2006-08-11,Friday,8.0
200601KD50682,554840,185990,0.231929,51.551501,1,3,3,2,03/11/2006,6,12:40,15,E09000016,5,0,6,30,3,4,6,0,0,0,1,1,1,0,0,1,1,E01002292,2025-12-09 12:40:00,12,2006-03-11,Saturday,3.0
200601KD50683,554950,186890,0.233911,51.559557,1,3,2,2,03/11/2006,6,08:35,15,E09000016,6,0,6,30,0,-1,-1,0,0,0,1,1,1,0,0,1,1,E01002362,2025-12-09 08:35:00,8,2006-03-11,Saturday,3.0
200601KD50684,551740,183650,0.186244,51.531318,1,3,4,1,03/11/2006,6,08:55,15,E09000016,6,0,6,30,3,4,3,125,0,0,1,1,1,0,0,1,1,E01002373,2025-12-09 08:55:00,8,2006-03-11,Saturday,3.0
200601KD50685,550370,183010,0.166234,51.525934,1,3,2,1,27/10/2006,6,22:04,15,E09000016,6,0,6,30,3,4,3,1306,0,0,4,1,1,0,0,1,1,E01002368,2025-12-09 22:04:00,22,,,
200601KD50686,549920,187130,0.161507,51.563072,1,3,2,1,23/10/2006,2,18:15,15,E09000016,6,0,6,30,3,4,3,124,0,0,1,1,1,0,0,1,2,E01002251,2025-12-09 18:15:00,18,,,
200601KD50687,557040,188930,0.264947,51.577308,1,3,3,2,22/10/2006,1,13:11,15,E09000016,6,0,3,50,3,4,3,127,0,0,1,1,1,0,0,2,1,E01002259,2025-12-09 13:11:00,13,,,
200601KD50688,551640,187690,0.186543,51.567644,1,3,2,1,26/10/2006,5,19:20,15,E09000016,5,0,6,30,3,4,6,0,0,0,4,1,1,0,0,1,2,E01002350,2025-12-09 19:20:00,19,,,
200601KD50689,550080,189210,0.164701,51.581719,1,3,2,1,16/11/2006,5,20:35,15,E09000016,3,12,3,50,6,2,3,12,0,5,4,1,1,0,0,1,2,E01002329,2025-12-09 20:35:00,20,,,
200601KD50691,554200,189900,0.22442,51.586807,1,3,2,1,17/11/2006,6,08:20,15,E09000016,3,127,3,50,6,2,3,127,0,5,1,1,1,0,0,1,2,E01002268,2025-12-09 08:20:00,8,,,
200601KD50692,556050,189040,0.250721,51.578571,1,2,2,2,23/11/2006,5,07:31,15,E09000016,3,127,3,70,0,-1,-1,0,0,0,1,1,1,0,0,2,1,E01002296,2025-12-09 07:31:00,7,,,
200601KD50693,553260,185040,0.208745,51.543397,1,3,2,1,04/11/2006,7,20:20,15,E09000016,5,0,6,30,8,4,6,0,0,0,4,1,4,0,0,1,1,E01002265,2025-12-09 20:20:00,20,2006-04-11,Tuesday,4.0
200601KD50694,553760,192480,0.219204,51.610108,1,2,4,2,04/11/2006,7,22:58,15,E09000016,5,0,6,30,0,-1,-1,0,0,0,4,1,4,0,0,1,1,E01002278,2025-12-09 22:58:00,22,2006-04-11,Tuesday,4.0
200601KD50695,551740,183650,0.186244,51.531318,1,3,4,1,04/11/2006,7,06:29,15,E09000016,6,0,6,30,3,4,3,125,0,0,4,1,1,0,0,1,1,E01002373,2025-12-09 06:29:00,6,2006-04-11,Tuesday,4.0
200601KD50697,551290,181740,0.178941,51.514277,1,3,2,1,07/11/2006,3,08:40,15,E09000016,3,13,3,50,0,-1,-1,0,0,0,1,1,1,0,0,2,1,E01002344,2025-12-09 08:40:00,8,2006-07-11,Tuesday,7.0
200601KD50698,550700,182300,0.170684,51.519466,1,3,2,3,05/11/2006,1,12:00,15,E09000016,3,13,3,50,0,-1,-1,0,0,0,1,1,1,0,0,2,2,E01002370,2025-12-09 12:00:00,12,2006-05-11,Thursday,5.0
200601KD50699,553810,185510,0.216875,51.54747,1,3,2,1,06/11/2006,2,18:19,15,E09000016,5,0,6,30,0,-1,-1,0,0,0,4,1,1,0,0,1,1,E01002285,2025-12-09 18:19:00,18,2006-06-11,Sunday,6.0
200601KD50700,551600,187460,0.185867,51.565588,1,3,1,1,09/11/2006,5,00:24,15,E09000016,3,124,6,30,3,2,3,125,0,5,4,2,2,0,0,1,1,E01002249,2025-12-09 00:24:00,0,2006-09-11,Monday,9.0
200601KD50701,551810,187430,0.188882,51.565262,1,3,2,1,08/11/2006,4,19:48,15,E09000016,3,124,3,40,3,4,3,124,0,1,4,1,2,0,0,1,1,E01002319,2025-12-09 19:48:00,19,2006-08-11,Friday,8.0
200601KD50702,556130,186650,0.250813,51.557076,1,3,1,1,09/11/2006,5,08:50,15,E09000016,6,0,6,30,8,4,6,0,0,0,1,1,1,0,0,1,1,E01002384,2025-12-09 08:50:00,8,2006-09-11,Monday,9.0
200601KD50703,551210,188120,0.180529,51.571623,1,2,3,3,09/11/2006,5,13:40,15,E09000016,3,125,1,30,1,4,3,125,0,0,1,1,1,0,0,1,1,E01002249,2025-12-09 13:40:00,13,2006-09-11,Monday,9.0
200601KD50704,556030,189040,0.250432,51.578577,1,3,4,1,13/11/2006,2,18:20,15,E09000016,3,127,3,50,0,-1,-1,0,0,0,4,1,1,0,0,2,1,E01002296,2025-12-09 18:20:00,18,,,
200601KD50705,558210,189010,0.281854,51.5777,1,3,3,2,09/11/2006,5,16:10,15,E09000016,1,25,3,70,0,-1,-1,0,0,0,4,1,1,0,0,2,1,E01002259,2025-12-09 16:10:00,16,2006-09-11,Monday,9.0
200601KD50706,558650,187990,0.287738,51.568412,1,3,2,1,08/11/2006,4,20:30,15,E09000016,1,25,3,70,0,-1,-1,0,0,0,4,1,1,0,0,2,2,E01002252,2025-12-09 20:30:00,20,2006-08-11,Friday,8.0
200601KD50707,558200,189040,0.281723,51.577972,1,3,2,1,14/11/2006,3,19:20,15,E09000016,1,25,3,70,0,-1,-1,0,0,0,4,1,2,0,0,2,1,E01002259,2025-12-09 19:20:00,19,,,
200601KD50709,550800,187410,0.174313,51.565353,1,2,1,1,12/11/2006,1,14:50,15,E09000016,6,0,6,30,3,4,3,124,0,0,1,1,1,0,0,1,1,E01002248,2025-12-09 14:50:00,14,2006-12-11,Monday,12.0
200601KD50710,549410,187720,0.154405,51.568509,1,3,1,1,13/11/2006,2,09:02,15,E09000016,6,0,6,30,0,-1,-1,0,0,0,1,1,1,0,0,1,1,E01002250,2025-12-09 09:02:00,9,,,
200601KD50711,553920,188030,0.219563,51.570082,1,3,2,1,13/11/2006,2,13:15,15,E09000016,5,0,6,30,3,4,6,0,0,0,1,1,1,0,0,1,1,E01002270,2025-12-09 13:15:00,13,,,
200601KD50712,551850,189430,0.190323,51.583222,1,2,2,1,15/11/2006,4,06:45,15,E09000016,6,0,6,30,3,4,3,118,0,0,4,1,2,0,0,1,1,E01002354,2025-12-09 06:45:00,6,,,
200601KD50713,554660,186940,0.229753,51.560086,1,3,2,2,17/11/2006,6,10:31,15,E09000016,5,0,6,30,6,2,3,124,0,5,1,1,1,0,0,1,1,E01002362,2025-12-09 10:31:00,10,,,
200601KD50714,550690,190410,0.174013,51.592338,1,3,2,2,17/11/2006,6,17:04,15,E09000016,6,0,6,30,3,4,4,175,0,0,1,1,1,0,0,1,1,E01002335,2025-12-09 17:04:00,17,,,
200601KD50715,552060,183670,0.190862,51.531411,1,3,2,1,14/11/2006,3,20:35,15,E09000016,5,0,6,30,0,-1,-1,0,0,0,4,1,1,0,0,1,2,E01002374,2025-12-09 20:35:00,20,,,
200601KD50716,550890,187700,0.175735,51.567935,1,3,2,1,17/11/2006,6,18:00,15,E09000016,5,0,6,30,3,4,6,0,0,0,4,1,1,0,0,1,1,E01002248,2025-12-09 18:00:00,18,,,
200601KD50717,553160,186390,0.207891,51.555553,1,3,2,2,16/11/2006,5,08:33,15,E09000016,5,0,6,30,6,4,5,0,0,0,1,1,1,0,0,1,1,E01002363,2025-12-09 08:33:00,8,,,
200601KD50718,558800,187000,0.289454,51.559475,1,3,1,1,19/11/2006,1,10:45,15,E09000016,4,187,6,30,0,-1,-1,0,0,0,1,1,1,0,0,2,1,E01002391,2025-12-09 10:45:00,10,,,
200601KD50721,552080,183300,0.190991,51.528082,1,3,1,1,21/11/2006,3,09:05,15,E09000016,3,125,6,30,0,-1,-1,0,0,0,1,1,1,0,0,1,1,E01002374,2025-12-09 09:05:00,9,,,
200601KD50722,551810,184140,0.187463,51.535702,1,3,1,1,22/11/2006,4,15:58,15,E09000016,6,0,6,30,0,-1,-1,0,0,0,1,1,2,0,0,1,1,E01002373,2025-12-09 15:58:00,15,,,
200601KD50723,549220,190970,0.153046,51.597761,1,3,1,1,22/11/2006,4,08:10,15,E09000016,5,0,6,30,3,2,4,174,0,5,1,1,1,0,0,1,1,E01002331,2025-12-09 08:10:00,8,,,
200601KD50724,553460,187190,0.212564,51.56266,1,3,1,1,23/11/2006,5,08:57,15,E09000016,5,0,6,30,0,-1,-1,0,0,4,1,1,1,0,0,1,1,E01002361,2025-12-09 08:57:00,8,,,
200601KD50725,553940,189640,0.220557,51.584542,1,3,3,4,29/11/2006,4,12:10,15,E09000016,5,0,6,30,3,4,6,0,0,0,1,1,1,0,0,1,1,E01002377,2025-12-09 12:10:00,12,,,
200601KD50726,550920,189220,0.17682,51.581584,1,3,2,1,24/11/2006,6,09:20,15,E09000016,6,0,6,30,8,4,3,125,0,0,1,1,1,0,0,1,1,E01002243,2025-12-09 09:20:00,9,,,
200601KD50727,553980,187220,0.220073,51.562788,1,3,2,1,24/11/2006,6,09:05,15,E09000016,5,0,6,30,3,4,6,0,0,1,1,1,1,0,0,1,1,E01002361,2025-12-09 09:05:00,9,,,
200601KD50728,550600,182890,0.169496,51.524794,1,3,2,1,25/11/2006,7,11:07,15,E09000016,5,0,6,30,0,-1,-1,0,0,0,1,1,1,0,0,1,1,E01002368,2025-12-09 11:07:00,11,,,
200601KD50729,552270,190780,0.196965,51.595238,1,2,1,1,27/11/2006,2,10:00,15,E09000016,3,12,3,70,0,-1,-1,0,0,0,1,2,2,0,0,2,1,E01002311,2025-12-09 10:00:00,10,,,
200601KD50730,550740,183290,0.171684,51.528351,1,3,1,2,27/11/2006,2,19:02,15,E09000016,6,0,6,30,0,-1,-1,0,0,0,4,1,1,0,0,1,1,E01002368,2025-12-09 19:02:00,19,,,
200601KD50731,553980,187230,0.220078,51.562877,1,3,1,1,15/11/2006,4,10:25,15,E09000016,5,0,6,30,6,4,6,0,0,0,1,1,1,0,0,1,2,E01002361,2025-12-09 10:25:00,10,,,
200601KD50732,558230,184150,0.279957,51.53403,1,2,2,2,30/11/2006,5,05:55,15,E09000016,1,25,3,70,0,-1,-1,0,0,0,4,1,1,0,0,2,1,E01002385,2025-12-09 05:55:00,5,,,
200601KD50733,552530,185900,0.198599,51.551321,1,2,1,1,30/11/2006,5,10:35,15,E09000016,5,0,6,30,0,-1,-1,0,0,0,1,1,1,0,0,1,1,E01002261,2025-12-09 10:35:00,10,,,
200601KD50735,553640,180530,0.212255,51.502771,1,2,3,2,28/11/2006,3,06:15,15,E09000016,3,13,3,70,0,-1,-1,0,0,0,4,2,2,0,0,2,1,E01002344,2025-12-09 06:15:00,6,,,
200601KD50737,553340,190540,0.212296,51.592792,1,3,2,1,27/11/2006,2,22:40,15,E09000016,3,12,1,30,1,4,3,12,0,0,4,2,2,0,0,2,1,E01002311,2025-12-09 22:40:00,22,,,
200601KD50738,551070,188390,0.178626,51.574087,1,2,1,1,25/11/2006,7,16:28,15,E09000016,3,125,3,50,8,2,6,0,0,5,4,1,1,0,0,1,1,E01002356,2025-12-09 16:28:00,16,,,
200601KD50739,553330,190920,0.212318,51.596208,1,3,2,1,28/11/2006,3,06:10,15,E09000016,5,0,6,30,2,4,5,0,0,0,4,2,2,0,0,1,1,E01002309,2025-12-09 06:10:00,6,,,
200601KD50740,552000,181360,0.189002,51.510672,1,3,1,1,01/12/2006,6,17:05,15,E09000016,3,13,7,70,0,-1,-1,0,0,0,4,1,1,0,0,2,1,E01002344,2025-12-09 17:05:00,17,2006-01-12,Thursday,1.0
200601KD50741,554370,191800,0.227708,51.603831,1,3,2,1,30/11/2006,5,16:50,15,E09000016,5,0,6,30,3,4,5,0,0,0,4,1,1,0,0,1,1,E01002299,2025-12-09 16:50:00,16,,,
200601KD50742,551230,190400,0.181798,51.592104,1,3,2,1,07/12/2006,5,10:30,15,E09000016,5,0,3,50,6,2,3,12,0,5,1,1,1,0,0,1,1,E01002334,2025-12-09 10:30:00,10,2006-07-12,Wednesday,7.0
200601KD50743,550540,189470,0.171446,51.583932,1,3,2,2,03/12/2006,1,13:30,15,E09000016,6,0,6,30,3,4,6,0,0,0,1,1,1,0,0,1,2,E01002245,2025-12-09 13:30:00,13,2006-03-12,Sunday,3.0
200601KD50744,556230,187370,0.252574,51.563517,1,3,2,1,05/12/2006,3,17:30,15,E09000016,5,0,6,30,3,4,6,0,0,0,1,1,1,0,0,1,2,E01002257,2025-12-09 17:30:00,17,2006-05-12,Friday,5.0
200601KD50746,551450,188150,0.184002,51.571828,1,3,2,2,07/12/2006,5,21:21,15,E09000016,5,0,3,50,6,2,5,0,0,5,4,2,2,1,0,1,1,E01002350,2025-12-09 21:21:00,21,2006-07-12,Wednesday,7.0
200601KD50747,551240,183220,0.178856,51.527588,1,3,2,2,01/12/2006,6,16:40,15,E09000016,6,0,6,30,6,4,6,0,0,0,1,4,1,0,0,1,1,E01002371,2025-12-09 16:40:00,16,2006-01-12,Thursday,1.0
200601KD50748,551660,188910,0.187358,51.5786,1,3,1,1,02/12/2006,7,15:33,15,E09000016,6,0,6,30,8,4,6,0,0,0,1,1,1,0,0,1,1,E01002357,2025-12-09 15:33:00,15,2006-02-12,Sunday,2.0
200601KD50749,551380,181670,0.180207,51.513624,1,3,2,1,01/12/2006,6,08:43,15,E09000016,3,13,3,50,0,-1,-1,0,0,0,1,2,2,0,0,2,1,E01002344,2025-12-09 08:43:00,8,2006-01-12,Thursday,1.0
200601KD50750,554790,190290,0.233102,51.590149,1,3,1,1,07/12/2006,5,16:29,15,E09000016,5,0,6,30,0,-1,-1,0,0,0,4,1,1,0,0,1,1,E01002294,2025-12-09 16:29:00,16,2006-07-12,Wednesday,7.0
200601KD50752,553380,190700,0.212943,51.594218,1,2,1,1,13/12/2006,4,22:40,15,E09000016,5,0,6,30,3,4,6,0,0,0,4,1,1,0,0,1,1,E01002310,2025-12-09 22:40:00,22,,,
200601KD50753,552640,188700,0.201399,51.576449,1,2,2,2,11/12/2006,2,18:05,15,E09000016,6,0,6,30,6,4,6,0,0,0,4,1,1,0,0,1,1,E01002382,2025-12-09 18:05:00,18,2006-11-12,Sunday,11.0
200601KD50754,553150,190550,0.20956,51.592933,1,3,2,1,04/12/2006,2,08:50,15,E09000016,3,12,3,50,0,-1,-1,0,0,0,1,1,1,0,0,2,2,E01002337,2025-12-09 08:50:00,8,2006-04-12,Wednesday,4.0
200601KD50755,549900,191150,0.162933,51.599198,1,3,2,1,02/12/2006,7,12:55,15,E09000016,4,174,6,30,3,4,4,1459,0,0,1,1,1,0,0,1,1,E01002302,2025-12-09 12:55:00,12,2006-02-12,Sunday,2.0
200601KD50756,551000,182840,0.175236,51.524238,1,2,2,2,10/12/2006,1,09:00,15,E09000016,6,0,3,50,6,4,3,1306,0,0,1,1,1,0,0,1,1,E01002368,2025-12-09 09:00:00,9,2006-10-12,Thursday,10.0
200601KD50757,555460,191610,0.24335,51.601824,1,3,2,1,12/12/2006,3,09:45,15,E09000016,6,0,3,50,3,4,3,12,0,0,1,1,1,0,0,1,2,E01002296,2025-12-09 09:45:00,9,2006-12-12,Tuesday,12.0
200601KD50758,553650,187220,0.215316,51.562878,1,3,3,3,01/12/2006,6,22:00,15,E09000016,3,124,6,30,0,-1,-1,0,0,0,4,2,2,0,0,1,1,E01002361,2025-12-09 22:00:00,22,2006-01-12,Thursday,1.0
200601KD50759,555550,191680,0.24468,51.602429,1,3,2,1,16/12/2006,7,12:48,15,E09000016,3,12,6,30,3,2,5,0,0,5,1,1,1,0,0,1,2,E01002283,2025-12-09 12:48:00,12,,,
200601KD50760,550620,189650,0.172677,51.585528,1,2,1,3,20/12/2006,4,23:48,15,E09000016,3,125,6,30,0,-1,-1,0,0,0,4,2,4,0,0,1,1,E01002245,2025-12-09 23:48:00,23,,,
200601KD50761,554230,188050,0.224041,51.570177,1,3,4,2,06/12/2006,4,10:12,15,E09000016,6,0,6,30,6,4,6,0,0,0,1,1,1,0,0,1,1,E01002270,2025-12-09 10:12:00,10,2006-06-12,Monday,6.0
200601KD50762,558840,185230,0.289232,51.543562,1,2,2,2,09/12/2006,7,08:45,15,E09000016,4,1421,6,30,0,-1,-1,0,0,0,1,2,2,0,0,2,1,E01002385,2025-12-09 08:45:00,8,2006-09-12,Tuesday,9.0
200601KD50763,553970,190810,0.221502,51.595046,1,3,2,1,09/12/2006,7,23:15,15,E09000016,3,12,3,50,7,2,6,0,0,5,4,2,2,0,0,1,1,E01002293,2025-12-09 23:15:00,23,2006-09-12,Tuesday,9.0
200601KD50764,555340,184350,0.238412,51.536629,1,3,2,1,13/12/2006,4,07:38,15,E09000016,6,0,6,30,0,-1,-1,0,0,0,1,2,2,0,0,2,1,E01002385,2025-12-09 07:38:00,7,,,
200601KD50765,558430,188330,0.28472,51.571529,1,3,2,1,06/12/2006,4,18:03,15,E09000016,1,25,1,30,1,4,3,127,0,0,1,1,1,0,0,2,1,E01002252,2025-12-09 18:03:00,18,2006-06-12,Monday,6.0
200601KD50766,554760,190500,0.232762,51.592044,1,3,2,2,08/12/2006,6,09:45,15,E09000016,5,0,6,30,3,4,6,0,0,0,1,1,1,0,0,1,1,E01002293,2025-12-09 09:45:00,9,2006-08-12,Saturday,8.0
200601KD50767,554500,191360,0.22939,51.599842,1,2,2,1,15/12/2006,6,14:45,15,E09000016,6,0,6,30,3,4,6,0,0,0,1,1,1,0,0,1,1,E01002299,2025-12-09 14:45:00,14,,,
200601KD50768,551000,188550,0.177686,51.575543,1,3,2,1,18/12/2006,2,17:55,15,E09000016,3,125,3,50,0,-1,-1,0,0,0,4,1,1,0,0,1,1,E01002356,2025-12-09 17:55:00,17,,,
200601KD50769,553150,190560,0.209564,51.593023,1,3,2,3,07/12/2006,5,22:00,15,E09000016,3,12,3,50,0,-1,-1,0,0,0,4,1,1,0,0,2,1,E01002337,2025-12-09 22:00:00,22,2006-07-12,Wednesday,7.0
200601KD50770,549480,188320,0.155669,51.573881,1,3,1,1,23/11/2006,5,15:54,15,E09000016,3,118,6,30,0,-1,-1,0,0,0,1,1,1,0,0,1,1,E01002250,2025-12-09 15:54:00,15,,,
200601KD50771,552900,189190,0.205361,51.580781,1,3,1,1,12/12/2006,3,08:05,15,E09000016,5,0,6,30,3,4,6,0,0,4,1,1,1,0,0,1,1,E01002379,2025-12-09 08:05:00,8,2006-12-12,Tuesday,12.0
200601KD50772,554670,180600,0.227114,51.50312,1,3,2,1,17/12/2006,1,09:45,15,E09000016,3,1306,3,50,3,4,6,0,0,0,1,1,1,0,0,2,2,E01002344,2025-12-09 09:45:00,9,,,
200601KD50773,551050,189070,0.17863,51.580202,1,3,3,3,10/12/2006,1,16:10,15,E09000016,3,118,6,30,3,4,3,125,0,0,1,1,1,0,0,1,1,E01002353,2025-12-09 16:10:00,16,2006-10-12,Thursday,10.0
200601KD50774,557050,187970,0.264663,51.56868,1,3,2,2,18/12/2006,2,15:30,15,E09000016,6,0,6,30,3,4,6,0,0,0,1,1,1,0,0,1,1,E01002254,2025-12-09 15:30:00,15,,,
200601KD50775,552980,192250,0.207848,51.608253,1,3,2,1,14/12/2006,5,17:20,15,E09000016,5,0,6,30,3,4,6,0,0,0,4,1,1,0,0,1,2,E01002313,2025-12-09 17:20:00,17,,,
200601KD50776,552000,181360,0.189002,51.510672,1,3,1,1,20/12/2006,4,14:20,15,E09000016,3,13,7,70,0,-1,-1,0,0,0,1,1,1,0,0,2,1,E01002344,2025-12-09 14:20:00,14,,,
200601KD50777,551970,185910,0.190532,51.551562,1,3,2,1,02/12/2006,7,06:30,15,E09000016,3,125,6,30,3,4,5,0,0,0,1,1,1,0,0,1,1,E01002260,2025-12-09 06:30:00,6,2006-02-12,Sunday,2.0
200601KD50779,551290,190440,0.182681,51.592447,1,3,3,2,14/12/2006,5,16:46,15,E09000016,3,12,3,50,0,-1,-1,0,0,5,1,1,1,0,0,1,1,E01002334,2025-12-09 16:46:00,16,,,
200601KD50780,555930,186540,0.247882,51.556143,1,3,1,1,19/12/2006,3,17:35,15,E09000016,3,124,6,30,0,-1,-1,0,0,0,1,1,1,0,0,1,1,E01002386,2025-12-09 17:35:00,17,,,
200601KD50781,551650,187620,0.186657,51.567013,1,3,2,1,16/12/2006,7,02:15,15,E09000016,5,0,6,30,3,4,6,0,0,0,4,2,2,0,0,1,1,E01002350,2025-12-09 02:15:00,2,,,
200601KD50782,555420,186730,0.240615,51.55799,1,3,2,1,19/12/2006,3,11:50,15,E09000016,6,0,6,30,3,4,3,124,0,0,1,1,1,0,0,1,1,E01002386,2025-12-09 11:50:00,11,,,
200601KD50783,551610,188010,0.186249,51.570527,1,3,2,4,23/12/2006,7,23:25,15,E09000016,5,0,1,30,2,4,5,0,0,0,4,1,1,0,0,1,1,E01002350,2025-12-09 23:25:00,23,,,
200601KD50784,553920,188030,0.219563,51.570082,1,3,2,2,20/12/2006,4,17:40,15,E09000016,5,0,6,30,3,4,6,0,2,0,4,1,1,0,0,1,1,E01002270,2025-12-09 17:40:00,17,,,
200601KD50785,550890,188550,0.176099,51.575572,1,3,2,1,23/12/2006,7,10:27,15,E09000016,3,118,6,30,3,4,6,0,0,0,1,1,1,0,0,1,1,E01002247,2025-12-09 10:27:00,10,,,
200601KD50786,557660,186780,0.272924,51.557818,1,3,2,1,21/12/2006,5,12:56,15,E09000016,4,187,6,30,0,-1,-1,0,0,0,1,1,1,0,0,1,1,E01002391,2025-12-09 12:56:00,12,,,
200601KD50787,553600,187230,0.2146,51.562981,1,3,2,2,10/12/2006,1,01:09,15,E09000016,3,124,6,30,0,-1,-1,0,0,5,4,1,1,0,0,1,1,E01002361,2025-12-09 01:09:00,1,2006-10-12,Thursday,10.0
200601KD50788,550730,189880,0.174363,51.587565,1,3,2,1,22/07/2006,7,13:50,15,E09000016,3,12,6,30,3,2,6,0,0,5,1,1,1,0,0,1,2,E01002338,2025-12-09 13:50:00,13,,,
200601KD50789,553130,189330,0.208739,51.581977,1,2,2,1,24/12/2006,1,15:20,15,E09000016,5,0,6,30,0,-1,-1,0,0,0,1,2,2,0,0,1,1,E01002379,2025-12-09 15:20:00,15,,,
200601KD50790,552220,183140,0.192938,51.526606,1,3,2,1,29/12/2006,6,10:38,15,E09000016,3,125,6,30,3,4,6,0,0,0,1,1,1,0,0,1,1,E01002370,2025-12-09 10:38:00,10,,,
200601KD50791,553890,185870,0.218186,51.550683,1,3,2,1,30/12/2006,7,18:45,15,E09000016,5,0,6,30,6,4,6,0,0,0,4,2,2,0,0,1,2,E01002285,2025-12-09 18:45:00,18,,,
200601KD50792,553180,185010,0.207579,51.543149,1,3,2,1,30/12/2006,7,10:07,15,E09000016,5,0,6,20,3,4,6,0,0,0,1,1,2,0,0,1,1,E01002265,2025-12-09 10:07:00,10,,,
200601KD50793,554690,186430,0.229961,51.555496,1,3,2,2,31/12/2006,1,19:30,15,E09000016,5,0,6,30,3,4,6,0,0,0,1,1,1,0,0,2,2,E01002289,2025-12-09 19:30:00,19,,,
200601KD50794,551390,189100,0.183546,51.58038,1,3,1,1,17/11/2006,6,12:45,15,E09000016,3,118,6,30,1,4,6,0,0,0,1,1,1,0,0,1,2,E01002357,2025-12-09 12:45:00,12,,,
200601KD50795,551620,188250,0.186496,51.572681,1,3,1,1,31/12/2006,1,06:49,15,E09000016,6,0,6,30,0,-1,-1,0,0,0,1,1,1,0,0,1,1,E01002358,2025-12-09 06:49:00,6,,,
200601KD50796,556710,192330,0.261706,51.607947,1,3,2,2,15/12/2006,6,13:34,15,E09000016,3,12,1,30,1,4,3,12,0,0,1,1,1,0,0,2,1,E01002296,2025-12-09 13:34:00,13,,,
200601KD50797,551640,190590,0.187795,51.593701,1,3,3,1,22/12/2006,6,09:30,15,E09000016,3,12,3,70,0,-1,-1,0,0,0,1,1,1,0,0,1,1,E01002334,2025-12-09 09:30:00,9,,,
200601KD50801,551410,190500,0.184438,51.592954,1,3,2,1,21/12/2006,5,11:32,15,E09000016,3,12,3,70,0,-1,-1,0,0,0,1,2,2,0,0,1,1,E01002334,2025-12-09 11:32:00,11,,,
200601KD50802,551560,188860,0.185894,51.578178,1,3,2,1,23/12/2006,7,13:00,15,E09000016,5,0,3,50,1,4,5,0,0,0,1,1,1,0,0,1,1,E01002357,2025-12-09 13:00:00,13,,,
200601KD50803,552110,188260,0.193566,51.572639,1,3,2,2,22/12/2006,6,16:05,15,E09000016,5,0,6,30,3,4,6,0,0,0,1,1,1,0,0,1,1,E01002352,2025-12-09 16:05:00,16,,,
200601KD50806,553440,182240,0.21012,51.51819,1,2,3,4,28/11/2006,3,07:20,15,E09000016,3,1306,6,30,6,4,6,0,0,0,1,1,1,0,0,1,1,E01002344,2025-12-09 07:20:00,7,,,
200601KD50824,552020,181370,0.189294,51.510757,1,3,3,2,26/12/2006,3,16:56,15,E09000016,3,13,3,70,5,4,6,0,0,0,1,2,2,0,0,2,1,E01002344,2025-12-09 16:56:00,16,,,
200601KD59021,551440,183880,0.182021,51.533465,1,3,3,3,19/12/2006,3,17:45,15,E09000016,3,125,6,30,3,4,6,0,0,0,1,1,1,0,0,1,1,E01002375,2025-12-09 17:45:00,17,,,
200601KD59057,551840,184130,0.187891,51.535604,1,3,2,1,02/12/2006,7,19:30,15,E09000016,6,0,6,30,3,4,6,0,0,0,1,1,1,0,0,1,1,E01002373,2025-12-09 19:30:00,19,2006-02-12,Sunday,2.0
200601KG70132,554440,180240,0.223646,51.499948,1,2,2,1,28/03/2006,3,08:11,15,E09000016,3,13,3,40,0,-1,-1,0,0,0,1,1,1,0,0,2,1,E01002344,2025-12-09 08:11:00,8,,,
200601KG70140,554250,180290,0.220932,51.500449,1,3,1,1,30/03/2006,5,07:30,15,E09000016,3,13,3,40,0,-1,-1,0,0,0,4,1,1,0,0,2,1,E01002344,2025-12-09 07:30:00,7,,,
200601KG70169,552190,182590,0.192269,51.521673,1,3,4,1,21/05/2006,1,13:17,15,E09000016,3,1306,7,30,1,4,4,1335,0,0,1,1,1,0,0,2,1,E01002370,2025-12-09 13:17:00,13,,,
200601KG70266,551070,182010,0.175889,51.516762,1,3,2,1,03/07/2006,2,23:41,15,E09000016,3,13,6,30,1,4,6,0,0,0,4,1,1,0,0,2,1,E01002370,2025-12-09 23:41:00,23,2006-03-07,Tuesday,3.0
200601KG70551,550910,182200,0.173666,51.518512,1,2,3,1,10/12/2006,1,18:23,15,E09000016,3,13,3,70,0,-1,-1,0,0,0,1,1,1,0,0,2,1,E01002368,2025-12-09 18:23:00,18,2006-10-12,Thursday,10.0
200601KG70564,550580,182940,0.169229,51.525249,1,3,2,2,20/12/2006,4,19:16,15,E09000016,3,1306,6,30,3,4,5,0,0,0,1,1,1,0,0,1,1,E01002368,2025-12-09 19:16:00,19,,,
200601TC00017,554160,189910,0.223848,51.586908,1,2,1,1,30/01/2006,2,12:49,15,E09000016,3,127,3,50,6,2,5,0,0,5,1,1,1,0,0,1,1,E01002377,2025-12-09 12:49:00,12,,,
200601TC00041,558410,188330,0.284432,51.571534,1,2,2,6,21/01/2006,7,03:04,15,E09000016,1,25,3,70,5,4,3,127,0,0,4,1,1,0,0,2,1,E01002252,2025-12-09 03:04:00,3,,,
200601TC00047,552290,185040,0.194768,51.543659,1,2,1,1,14/02/2006,3,18:19,15,E09000016,6,0,6,30,0,-1,-1,0,0,0,4,1,1,0,0,1,1,E01002266,2025-12-09 18:19:00,18,,,
200601TC00069,553140,189450,0.208936,51.583052,1,3,2,1,24/02/2006,6,16:10,15,E09000016,5,0,6,30,0,-1,-1,0,0,0,1,1,1,0,0,1,1,E01002376,2025-12-09 16:10:00,16,,,
200601TC00122,551560,188830,0.185881,51.577909,1,3,2,1,11/04/2006,3,07:34,15,E09000016,5,0,1,40,1,4,5,0,0,0,1,1,1,0,0,1,1,E01002357,2025-12-09 07:34:00,7,2006-11-04,Saturday,11.0
200601TC00149,555990,186540,0.248747,51.556126,1,2,1,2,29/05/2006,2,11:11,15,E09000016,3,124,6,30,6,2,4,1421,0,5,1,2,2,0,0,1,1,E01002386,2025-12-09 11:11:00,11,,,
200601TC00198,558170,189130,0.281331,51.578789,1,2,2,2,19/07/2006,4,13:55,15,E09000016,1,25,3,70,0,-1,-1,0,0,0,1,1,1,0,0,2,1,E01002259,2025-12-09 13:55:00,13,,,
200601TC00207,554540,180930,0.225387,51.50612,1,1,2,3,25/07/2006,3,18:51,15,E09000016,3,1306,6,30,3,4,4,1335,0,0,1,1,1,0,0,2,1,E01002344,2025-12-09 18:51:00,18,,,
200601TC00223,555010,189300,0.235838,51.581194,1,2,1,1,30/07/2006,1,22:50,15,E09000016,3,127,3,50,0,-1,-1,0,0,0,4,1,1,0,0,1,1,E01002269,2025-12-09 22:50:00,22,,,
200601TC00226,553440,190450,0.213699,51.591956,1,2,1,2,12/08/2006,7,09:05,15,E09000016,3,127,3,30,0,-1,-1,0,0,0,1,2,2,0,0,1,1,E01002383,2025-12-09 09:05:00,9,2006-12-08,Friday,12.0
200601TC00228,554300,181520,0.22219,51.511487,1,2,2,1,21/07/2006,6,08:46,15,E09000016,3,1306,6,60,6,4,5,0,0,0,1,1,1,0,0,2,1,E01002344,2025-12-09 08:46:00,8,,,
200601TC00230,553210,191390,0.210792,51.600464,1,2,1,1,11/08/2006,6,16:20,15,E09000016,5,0,6,30,0,-1,-1,0,0,0,1,1,1,0,0,1,1,E01002315,2025-12-09 16:20:00,16,2006-11-08,Wednesday,11.0
200601TC00245,551650,187620,0.186657,51.567013,1,2,1,1,22/08/2006,3,17:56,15,E09000016,5,0,6,30,3,4,6,0,0,0,1,1,1,0,0,1,1,E01002350,2025-12-09 17:56:00,17,,,
200601TC00254,558070,189350,0.279988,51.580794,1,1,1,6,21/08/2006,2,03:15,15,E09000016,1,25,3,70,0,-1,-1,0,0,0,6,1,1,0,0,2,1,E01021473,2025-12-09 03:15:00,3,,,
200601TC00309,558350,185090,0.282108,51.542442,1,2,2,2,17/10/2006,3,13:18,15,E09000016,1,25,3,70,0,-1,-1,0,0,0,1,1,1,0,0,2,1,E01002385,2025-12-09 13:18:00,13,,,
200601TC00340,553930,187950,0.219672,51.56936,1,2,1,2,25/11/2006,7,17:09,15,E09000016,5,0,6,30,3,4,6,0,0,1,4,2,2,0,0,1,1,E01002274,2025-12-09 17:09:00,17,,,
200601TC00350,554800,184340,0.230628,51.536687,1,2,1,1,27/11/2006,2,11:05,15,E09000016,5,0,6,50,0,-1,-1,0,0,0,1,1,2,0,0,2,1,E01002385,2025-12-09 11:05:00,11,,,
200601TC00357,553460,190450,0.213988,51.59195,1,2,1,1,15/11/2006,4,03:32,15,E09000016,3,127,3,30,0,-1,-1,0,0,0,4,1,2,0,0,1,1,E01002293,2025-12-09 03:32:00,3,,,
200601TC00359,552600,182370,0.198079,51.519585,1,2,5,1,02/12/2006,7,16:46,15,E09000016,5,0,6,30,3,4,6,0,0,0,1,1,1,0,0,1,1,E01002345,2025-12-09 16:46:00,16,2006-02-12,Sunday,2.0
200601TC00372,553980,190820,0.221651,51.595133,1,2,2,1,18/12/2006,2,21:53,15,E09000016,3,12,3,50,3,2,6,0,0,0,4,1,4,0,0,1,1,E01002293,2025-12-09 21:53:00,21,,,
200601TC00373,554680,191180,0.231907,51.598176,1,2,1,1,07/12/2006,5,19:16,15,E09000016,3,12,3,50,7,2,5,0,0,5,4,4,2,0,0,1,1,E01002300,2025-12-09 19:16:00,19,2006-07-12,Wednesday,7.0
200601TC09072,549800,187070,0.159751,51.562565,1,1,2,1,30/10/2006,2,01:26,15,E09000016,3,124,6,30,3,4,3,124,0,0,4,1,1,0,0,1,1,E01000061,2025-12-09 01:26:00,1,,,
200701JI68112,550300,187240,0.167032,51.563959,1,3,2,1,16/11/2007,6,15:10,15,E09000016,3,124,9,30,0,-1,-1,0,0,1,1,1,1,0,0,1,2,E01002251,2025-12-09 15:10:00,15,,,
200701KD50001,555420,192110,0.242995,51.606328,1,3,2,1,02/01/2007,3,22:32,15,E09000016,5,0,6,30,3,2,6,0,0,0,4,2,2,1,0,1,1,E01002279,2025-12-09 22:32:00,22,2007-02-01,Thursday,2.0
200701KD50002,551760,188980,0.18883,51.579203,1,3,2,1,08/01/2007,2,11:30,15,E09000016,6,0,6,30,3,4,6,0,0,0,1,1,1,0,0,1,1,E01002357,2025-12-09 11:30:00,11,2007-08-01,Wednesday,8.0
200701KD50003,549990,190890,0.16412,51.596838,1,3,1,1,11/01/2007,5,14:30,15,E09000016,4,174,6,30,8,4,6,0,0,0,1,1,1,0,0,1,1,E01002326,2025-12-09 14:30:00,14,2007-11-01,Thursday,11.0
200701KD50005,551050,189030,0.178613,51.579842,1,3,1,1,11/01/2007,5,13:30,15,E09000016,3,118,1,30,1,4,3,118,0,0,1,2,2,0,0,1,1,E01002353,2025-12-09 13:30:00,13,2007-11-01,Thursday,11.0
200701KD50006,556060,186750,0.249849,51.557994,1,2,1,1,12/01/2007,6,12:00,15,E09000016,5,0,6,30,3,4,6,0,0,0,1,1,1,0,0,1,1,E01002386,2025-12-09 12:00:00,12,2007-12-01,Saturday,12.0
200701KD50007,550940,182170,0.174085,51.518234,1,3,2,1,12/01/2007,6,08:55,15,E09000016,3,13,6,30,0,-1,-1,0,0,0,1,1,1,0,0,2,1,E01002370,2025-12-09 08:55:00,8,2007-12-01,Saturday,12.0
200701KD50008,550400,187300,0.168499,51.564472,1,3,2,1,16/01/2007,3,20:15,15,E09000016,6,0,6,30,3,4,3,124,0,0,4,1,1,0,0,1,1,E01002251,2025-12-09 20:15:00,20,,,
200701KD50009,551990,183390,0.189733,51.528915,1,3,2,1,17/01/2007,4,13:55,15,E09000016,3,125,6,30,6,2,3,125,0,5,1,1,1,0,0,1,2,E01002374,2025-12-09 13:55:00,13,,,
200701KD50010,551450,188140,0.183998,51.571738,1,2,2,3,04/01/2007,5,19:41,15,E09000016,5,0,3,50,6,2,5,0,0,5,4,1,1,2,0,1,1,E01002350,2025-12-09 19:41:00,19,2007-04-01,Sunday,4.0
200701KD50011,556220,183500,0.250713,51.528749,1,3,3,1,18/01/2007,5,11:45,15,E09000016,5,0,6,30,7,4,5,0,0,0,1,1,1,0,0,2,1,E01015924,2025-12-09 11:45:00,11,,,
200701KD50012,551990,183390,0.189733,51.528915,1,3,2,1,18/01/2007,5,09:40,15,E09000016,3,125,6,30,6,2,3,125,0,5,1,1,1,0,0,1,1,E01002374,2025-12-09 09:40:00,9,,,
200701KD50013,553400,190520,0.213153,51.592595,1,3,1,1,19/01/2007,6,07:15,15,E09000016,3,12,6,30,1,4,3,127,0,0,1,1,1,0,0,1,2,E01002293,2025-12-09 07:15:00,7,,,
200701KD50014,550320,187780,0.167551,51.568806,1,3,2,1,19/01/2007,6,11:00,15,E09000016,6,0,6,30,0,-1,-1,0,0,0,1,1,1,0,0,1,1,E01002248,2025-12-09 11:00:00,11,,,
200701KD50015,553190,182040,0.206432,51.516461,1,3,2,2,19/01/2007,6,09:15,15,E09000016,6,0,6,30,3,4,6,0,0,0,1,1,1,0,0,1,1,E01002344,2025-12-09 09:15:00,9,,,
200701KD50016,554740,190620,0.232526,51.593128,1,2,2,2,19/01/2007,6,07:58,15,E09000016,5,0,6,30,3,4,5,0,0,4,1,1,1,0,0,1,1,E01002293,2025-12-09 07:58:00,7,,,
200701KD50017,551110,188010,0.17904,51.570662,1,3,2,2,20/01/2007,7,01:42,15,E09000016,5,0,6,30,3,3,6,0,0,0,4,1,1,0,0,1,1,E01002249,2025-12-09 01:42:00,1,,,
200701KD50018,554880,183070,0.231222,51.525255,1,2,1,1,18/01/2007,5,19:45,15,E09000016,6,0,6,30,0,-1,-1,0,0,0,6,4,2,0,0,2,1,E01002348,2025-12-09 19:45:00,19,,,
200701KD50019,556650,186510,0.258246,51.555674,1,3,1,1,22/01/2007,2,08:30,15,E09000016,6,0,6,30,0,-1,-1,0,0,0,1,1,1,0,0,1,2,E01002384,2025-12-09 08:30:00,8,,,
200701KD50020,550620,189760,0.172725,51.586516,1,3,1,1,23/01/2007,3,19:58,15,E09000016,3,12,6,30,3,2,4,174,0,5,1,1,1,0,0,1,1,E01002338,2025-12-09 19:58:00,19,,,
200701KD50022,553370,187040,0.211201,51.561336,1,3,2,1,08/01/2007,2,18:40,15,E09000016,5,0,6,30,3,4,6,0,0,0,1,1,1,0,0,1,1,E01002363,2025-12-09 18:40:00,18,2007-08-01,Wednesday,8.0
200701KD50023,551560,193090,0.18772,51.616184,1,2,1,1,23/01/2007,3,21:38,15,E09000016,5,0,6,30,0,-1,-1,0,0,0,4,8,4,0,0,2,1,E01002304,2025-12-09 21:38:00,21,,,
200701KD50024,552180,181380,0.191603,51.510803,1,3,1,1,14/01/2007,1,10:27,15,E09000016,3,13,3,50,0,-1,-1,0,0,0,1,1,1,0,0,2,1,E01002344,2025-12-09 10:27:00,10,,,
200701KD50025,556160,183850,0.250004,51.53191,1,3,1,1,24/01/2007,4,04:20,15,E09000016,5,0,6,30,0,-1,-1,0,0,0,6,3,3,0,0,2,1,E01002385,2025-12-09 04:20:00,4,,,
200701KD50026,550710,189510,0.173915,51.584246,1,3,2,1,26/01/2007,6,18:30,15,E09000016,6,0,6,30,3,4,3,125,0,4,4,1,1,0,0,1,1,E01002245,2025-12-09 18:30:00,18,,,
200701KD50027,553760,190070,0.218149,51.588454,1,2,2,1,18/01/2007,5,18:51,15,E09000016,6,0,6,30,6,4,6,0,0,0,4,4,1,0,0,1,1,E01002383,2025-12-09 18:51:00,18,,,
200701KD50028,554070,192160,0.223537,51.607148,1,3,2,2,19/01/2007,6,12:00,15,E09000016,5,0,6,30,8,4,6,0,0,0,1,1,1,0,0,1,1,E01002282,2025-12-09 12:00:00,12,,,
200701KD50029,553960,186280,0.219374,51.554347,1,3,2,1,13/01/2007,7,01:30,15,E09000016,3,124,6,30,0,-1,-1,0,0,0,4,2,2,0,0,1,1,E01002291,2025-12-09 01:30:00,1,,,
200701KD50033,558230,188460,0.281895,51.572753,1,3,3,2,04/01/2007,5,08:10,15,E09000016,3,127,3,50,0,-1,-1,0,0,0,1,1,1,0,0,2,1,E01002252,2025-12-09 08:10:00,8,2007-04-01,Sunday,4.0
200701KD50034,552040,187410,0.192189,51.565021,1,3,2,2,08/01/2007,2,08:55,15,E09000016,6,0,6,30,3,4,3,124,0,0,1,1,2,0,0,1,1,E01002319,2025-12-09 08:55:00,8,2007-08-01,Wednesday,8.0
200701KD50035,554810,191260,0.233818,51.598859,1,3,2,1,07/01/2007,1,16:14,15,E09000016,3,12,3,50,0,-1,-1,0,0,0,4,1,1,0,0,1,1,E01002299,2025-12-09 16:14:00,16,2007-07-01,Sunday,7.0
200701KD50036,550840,187890,0.175095,51.569656,1,3,2,1,08/01/2007,2,11:00,15,E09000016,5,0,6,30,0,-1,-1,0,0,0,1,2,2,0,0,1,1,E01002248,2025-12-09 11:00:00,11,2007-08-01,Wednesday,8.0
200701KD50037,551850,189420,0.190318,51.583132,1,3,2,2,13/01/2007,7,19:20,15,E09000016,6,0,6,30,3,4,3,118,0,0,4,1,1,0,0,1,1,E01002354,2025-12-09 19:20:00,19,,,
200701KD50038,554010,190010,0.221728,51.587847,1,3,2,2,09/01/2007,3,09:00,15,E09000016,3,127,3,60,0,-1,-1,0,0,0,1,1,1,0,0,1,2,E01002377,2025-12-09 09:00:00,9,2007-09-01,Saturday,9.0
200701KD50039,553790,190730,0.21887,51.594376,1,3,2,2,02/01/2007,3,11:42,15,E09000016,6,0,3,50,3,2,3,12,0,5,1,1,1,0,0,1,1,E01002310,2025-12-09 11:42:00,11,2007-02-01,Thursday,2.0
200701KD50040,550810,187400,0.174453,51.565261,1,3,2,1,02/01/2007,3,10:30,15,E09000016,6,0,6,30,3,4,3,124,0,0,1,1,1,0,0,1,1,E01002248,2025-12-09 10:30:00,10,2007-02-01,Thursday,2.0
200701KD50041,551520,184220,0.183319,51.536498,1,3,2,1,04/01/2007,5,08:38,15,E09000016,6,0,6,30,3,4,3,125,0,0,1,1,1,0,0,1,1,E01002375,2025-12-09 08:38:00,8,2007-04-01,Sunday,4.0
200701KD50042,551610,187970,0.186232,51.570168,1,3,1,1,07/01/2007,1,03:10,15,E09000016,5,0,6,30,3,4,5,0,0,0,4,1,1,0,0,1,2,E01002350,2025-12-09 03:10:00,3,2007-07-01,Sunday,7.0
200701KD50043,555020,186060,0.234554,51.552081,1,3,1,3,11/01/2007,5,09:00,15,E09000016,6,0,6,30,3,4,6,0,0,0,1,1,1,0,0,1,1,E01002292,2025-12-09 09:00:00,9,2007-11-01,Thursday,11.0
200701KD50044,556040,191820,0.251812,51.603551,1,2,1,1,02/01/2007,3,12:33,15,E09000016,6,0,6,30,3,4,6,0,0,0,1,1,1,0,0,1,1,E01002296,2025-12-09 12:33:00,12,2007-02-01,Thursday,2.0
200701KD50045,554180,189910,0.224136,51.586902,1,3,2,1,10/01/2007,4,08:25,15,E09000016,3,127,6,30,6,2,3,127,0,5,1,1,1,0,0,1,2,E01002295,2025-12-09 08:25:00,8,2007-10-01,Monday,10.0
200701KD50046,553110,182480,0.205471,51.520436,1,3,1,1,04/01/2007,5,17:15,15,E09000016,3,1306,6,40,6,2,5,0,0,5,1,1,1,0,0,1,1,E01002342,2025-12-09 17:15:00,17,2007-04-01,Sunday,4.0
200701KD50047,554050,191600,0.223003,51.602122,1,3,1,1,05/01/2007,6,08:07,15,E09000016,6,0,6,30,9,4,6,0,0,0,1,1,1,0,0,1,1,E01002284,2025-12-09 08:07:00,8,2007-05-01,Tuesday,5.0
200701KD50048,556440,192770,0.258006,51.611975,1,2,2,1,19/01/2007,6,13:25,15,E09000016,1,25,3,60,0,-1,-1,0,0,0,1,1,1,0,0,2,1,E01002277,2025-12-09 13:25:00,13,,,
200701KD50049,554650,192000,0.231836,51.605551,1,2,3,1,30/01/2007,3,09:04,15,E09000016,5,0,6,30,0,-1,-1,0,0,0,1,1,1,0,0,1,1,E01002281,2025-12-09 09:04:00,9,,,
200701KD50050,550930,187530,0.176238,51.566397,1,3,2,1,16/01/2007,3,15:20,15,E09000016,5,0,6,30,3,4,6,0,0,0,1,2,2,0,0,1,2,E01002248,2025-12-09 15:20:00,15,,,
200701KD50051,552960,181790,0.203012,51.514277,1,3,2,1,11/01/2007,5,20:00,15,E09000016,6,0,6,30,8,4,4,1335,0,0,4,1,1,0,0,1,1,E01002347,2025-12-09 20:00:00,20,2007-11-01,Thursday,11.0
200701KD50052,551440,188150,0.183858,51.571831,1,3,2,1,08/01/2007,2,09:09,15,E09000016,5,0,3,50,6,2,5,0,0,5,1,2,2,1,0,1,1,E01002350,2025-12-09 09:09:00,9,2007-08-01,Wednesday,8.0
200701KD50053,550950,188840,0.177089,51.578162,1,3,2,1,19/01/2007,6,12:45,15,E09000016,3,118,6,30,3,4,3,118,0,0,1,1,1,0,0,1,1,E01002243,2025-12-09 12:45:00,12,,,
200701KD50054,553550,187220,0.213875,51.562905,1,3,2,2,12/01/2007,6,11:30,15,E09000016,3,124,6,30,0,-1,-1,0,0,0,1,1,1,0,0,1,2,E01002361,2025-12-09 11:30:00,11,2007-12-01,Saturday,12.0
200701KD50056,551210,188120,0.180529,51.571623,1,3,2,1,01/02/2007,5,08:38,15,E09000016,3,125,1,30,1,4,3,125,0,0,1,1,1,0,0,1,2,E01002350,2025-12-09 08:38:00,8,2007-01-02,Tuesday,1.0
200701KD50058,551130,188840,0.179685,51.578114,1,2,1,1,29/01/2007,2,13:41,15,E09000016,6,0,6,30,0,-1,-1,0,0,0,1,1,1,0,0,1,1,E01002353,2025-12-09 13:41:00,13,,,
200701KD50059,552660,189890,0.202204,51.587136,1,2,2,2,15/01/2007,2,12:10,15,E09000016,6,0,6,30,3,4,3,118,0,0,1,1,1,0,0,1,1,E01002379,2025-12-09 12:10:00,12,,,
200701KD50060,554130,186040,0.221719,51.552145,1,3,2,1,23/01/2007,3,22:20,15,E09000016,6,0,6,30,6,4,6,0,0,0,4,1,1,0,0,1,1,E01002290,2025-12-09 22:20:00,22,,,
200701KD50061,553450,182230,0.210259,51.518097,1,3,2,1,26/01/2007,6,13:30,15,E09000016,6,0,6,30,6,4,3,1306,0,0,1,1,1,0,0,2,2,E01002344,2025-12-09 13:30:00,13,,,
200701KD50062,557480,188750,0.271211,51.575568,1,2,2,2,17/01/2007,4,12:25,15,E09000016,3,127,3,50,0,-1,-1,0,0,0,1,2,2,0,0,2,1,E01002259,2025-12-09 12:25:00,12,,,
200701KD50063,552050,182210,0.190088,51.518296,1,3,2,1,16/01/2007,3,11:27,15,E09000016,4,1335,6,30,3,4,4,1335,0,0,1,2,2,0,0,1,1,E01002345,2025-12-09 11:27:00,11,,,
200701KD50064,554170,189910,0.223992,51.586905,1,3,2,1,21/01/2007,1,13:15,15,E09000016,3,127,3,50,6,2,3,127,0,5,1,1,1,0,0,1,2,E01002377,2025-12-09 13:15:00,13,,,
200701KD50066,550620,189650,0.172677,51.585528,1,2,2,3,26/01/2007,6,01:23,15,E09000016,3,125,6,30,0,-1,-1,0,0,0,4,1,4,0,0,1,1,E01002245,2025-12-09 01:23:00,1,,,
200701KD50067,551440,188210,0.183884,51.57237,1,3,1,1,27/01/2007,7,14:00,15,E09000016,5,0,6,30,0,-1,-1,0,0,0,1,1,1,0,0,1,1,E01002356,2025-12-09 14:00:00,14,,,
200701KD50068,554670,186250,0.229594,51.553884,1,3,1,1,29/01/2007,2,14:40,15,E09000016,6,0,6,30,0,-1,-1,0,0,0,1,1,1,0,0,1,1,E01002292,2025-12-09 14:40:00,14,,,
200701KD50069,552290,186950,0.195594,51.56082,1,3,2,1,30/01/2007,3,14:04,15,E09000016,6,0,6,30,0,-1,-1,0,0,0,1,1,1,0,0,1,1,E01002324,2025-12-09 14:04:00,14,,,
200701KD50070,551210,190450,0.181531,51.592558,1,2,1,1,04/02/2007,1,14:13,15,E09000016,5,0,6,30,0,-1,-1,0,0,0,1,1,1,0,0,1,1,E01002334,2025-12-09 14:13:00,14,2007-04-02,Monday,4.0
200701KD50071,555950,186540,0.24817,51.556137,1,3,1,1,01/02/2007,5,02:00,15,E09000016,3,124,6,30,0,-1,-1,0,0,0,4,1,1,0,0,1,1,E01002386,2025-12-09 02:00:00,2,2007-01-02,Tuesday,1.0
200701KD50073,551390,188620,0.183339,51.576067,1,3,1,1,10/02/2007,7,13:35,15,E09000016,6,0,6,30,3,4,6,0,0,0,1,1,1,0,0,1,1,E01002356,2025-12-09 13:35:00,13,2007-10-02,Tuesday,10.0
200701KD50074,553350,190540,0.21244,51.592789,1,3,2,1,05/01/2007,6,12:30,15,E09000016,3,12,6,30,3,4,3,12,0,0,1,1,1,0,0,1,1,E01002311,2025-12-09 12:30:00,12,2007-05-01,Tuesday,5.0
200701KD50075,550630,189750,0.172865,51.586424,1,3,2,1,31/01/2007,4,12:37,15,E09000016,3,12,6,30,7,2,3,125,0,5,1,1,1,0,0,1,1,E01002338,2025-12-09 12:37:00,12,,,
200701KD50076,554000,186410,0.220007,51.555505,1,3,2,1,31/01/2007,4,11:15,15,E09000016,3,124,6,30,6,4,6,0,0,0,1,1,1,0,0,1,2,E01002291,2025-12-09 11:15:00,11,,,
200701KD50077,550340,191290,0.169341,51.600338,1,3,1,1,07/02/2007,4,07:15,15,E09000016,4,1459,6,30,3,4,6,0,0,0,1,1,1,0,0,1,1,E01002332,2025-12-09 07:15:00,7,2007-07-02,Monday,7.0
200701KD50078,551900,186370,0.189722,51.555714,1,3,2,1,07/02/2007,4,08:15,15,E09000016,3,125,6,30,3,4,6,0,0,0,1,1,1,0,0,1,1,E01002322,2025-12-09 08:15:00,8,2007-07-02,Monday,7.0
200701KD50079,551630,188670,0.186822,51.576452,1,3,3,3,09/02/2007,6,16:00,15,E09000016,5,0,6,30,3,2,6,0,0,5,1,1,1,0,0,1,1,E01002358,2025-12-09 16:00:00,16,2007-09-02,Sunday,9.0
200701KD50080,555580,186660,0.24289,51.557317,1,3,1,1,10/02/2007,7,23:30,15,E09000016,3,124,3,30,3,4,6,0,0,1,4,1,1,0,0,1,1,E01002386,2025-12-09 23:30:00,23,2007-10-02,Tuesday,10.0
200701KD50081,553930,189540,0.220368,51.583646,1,3,1,1,10/02/2007,7,21:09,15,E09000016,5,0,6,30,7,4,5,0,0,0,4,1,1,0,0,1,1,E01002377,2025-12-09 21:09:00,21,2007-10-02,Tuesday,10.0
200701KD50082,553720,185300,0.215487,51.545608,1,3,2,3,02/02/2007,6,11:31,15,E09000016,5,0,6,30,3,4,6,0,0,0,1,1,1,0,0,1,1,E01002288,2025-12-09 11:31:00,11,2007-02-02,Friday,2.0
200701KD50083,557740,188570,0.274879,51.573878,1,2,4,2,17/01/2007,4,08:48,15,E09000016,3,127,3,50,0,-1,-1,0,0,0,1,2,2,0,0,2,1,E01002252,2025-12-09 08:48:00,8,,,
200701KD50084,553920,188030,0.219563,51.570082,1,3,3,3,19/02/2007,2,08:50,15,E09000016,5,0,6,30,3,4,6,0,0,0,1,1,2,0,0,1,1,E01002274,2025-12-09 08:50:00,8,,,
200701KD50085,551970,183390,0.189445,51.52892,1,3,2,1,16/02/2007,6,10:30,15,E09000016,3,125,6,30,6,2,3,125,0,5,1,1,1,0,0,1,2,E01002371,2025-12-09 10:30:00,10,,,
200701KD50086,552240,181360,0.192458,51.510608,1,3,1,2,15/02/2007,5,13:43,15,E09000016,3,13,3,30,0,-1,-1,0,0,0,1,1,1,0,0,2,1,E01002344,2025-12-09 13:43:00,13,,,
200701KD50087,553590,191890,0.216493,51.604853,1,3,2,1,15/02/2007,5,10:30,15,E09000016,6,0,6,30,3,4,6,0,0,0,1,1,1,0,0,1,2,E01002284,2025-12-09 10:30:00,10,,,
200701KD50088,555760,191640,0.247692,51.602011,1,3,2,1,14/02/2007,4,14:00,15,E09000016,5,0,6,30,3,4,6,0,0,0,1,1,1,0,0,1,2,E01002296,2025-12-09 14:00:00,14,,,
200701KD50089,551240,188040,0.180927,51.570896,1,3,2,3,13/02/2007,3,11:01,15,E09000016,3,125,6,30,1,4,6,0,0,0,1,1,1,0,0,1,2,E01002249,2025-12-09 11:01:00,11,,,
200701KD50090,553590,190880,0.216051,51.595778,1,3,1,1,12/02/2007,2,18:10,15,E09000016,6,0,6,30,8,4,6,0,0,0,4,1,1,0,0,1,1,E01002310,2025-12-09 18:10:00,18,2007-12-02,Sunday,12.0
200701KD50091,558080,188430,0.279719,51.572525,1,3,1,1,07/02/2007,4,22:48,15,E09000016,3,127,3,50,0,-1,-1,0,0,0,4,1,1,0,0,2,1,E01002252,2025-12-09 22:48:00,22,2007-07-02,Monday,7.0
200701KD50092,559100,185310,0.293014,51.544207,1,2,2,1,15/02/2007,5,17:52,15,E09000016,4,1421,6,60,3,4,6,0,0,0,1,1,1,0,0,2,1,E01002385,2025-12-09 17:52:00,17,,,
200701KD50093,550940,182170,0.174085,51.518234,1,3,1,1,12/02/2007,2,17:35,15,E09000016,3,13,3,50,0,-1,-1,0,0,0,4,1,1,0,0,2,1,E01002370,2025-12-09 17:35:00,17,2007-12-02,Sunday,12.0
200701KD50094,551930,188200,0.190945,51.572148,1,3,3,2,16/02/2007,6,17:35,15,E09000016,5,0,6,30,1,4,5,0,0,0,4,1,1,0,0,1,1,E01002358,2025-12-09 17:35:00,17,,,
200701KD50095,552990,192470,0.208089,51.610227,1,3,1,1,10/02/2007,7,13:45,15,E09000016,5,0,6,30,0,-1,-1,0,0,0,1,1,1,0,0,1,1,E01002312,2025-12-09 13:45:00,13,2007-10-02,Tuesday,10.0
200701KD50096,550110,189220,0.165138,51.5818,1,3,2,1,10/01/2007,4,12:10,15,E09000016,3,12,3,50,6,2,3,12,0,5,1,1,1,0,0,1,2,E01002244,2025-12-09 12:10:00,12,2007-10-01,Monday,10.0
200701KD50097,549730,191080,0.160451,51.598614,1,3,2,1,19/02/2007,2,08:41,15,E09000016,6,0,6,30,3,4,4,174,0,0,1,1,1,0,0,1,1,E01002326,2025-12-09 08:41:00,8,,,
200701KD50098,553800,188170,0.217894,51.571372,1,3,2,1,25/02/2007,1,20:25,15,E09000016,6,0,6,30,0,-1,-1,0,0,0,4,1,1,0,0,1,1,E01002274,2025-12-09 20:25:00,20,,,
200701KD50099,549410,190980,0.155791,51.5978,1,3,2,1,24/02/2007,7,08:15,15,E09000016,4,174,6,30,3,4,5,0,0,0,1,1,1,0,0,1,1,E01002325,2025-12-09 08:15:00,8,,,
200701KD50100,552010,183430,0.190038,51.529269,1,3,2,1,03/02/2007,7,12:30,15,E09000016,5,0,6,30,0,-1,-1,0,0,0,1,1,1,0,0,1,2,E01002371,2025-12-09 12:30:00,12,2007-03-02,Friday,3.0
200701KD50101,555600,186650,0.243174,51.557222,1,3,1,1,13/02/2007,3,09:08,15,E09000016,3,124,6,30,0,-1,-1,0,0,0,1,1,1,0,0,1,1,E01002386,2025-12-09 09:08:00,9,,,
200701KD50102,553670,187220,0.215605,51.562872,1,3,2,1,03/02/2007,7,18:18,15,E09000016,3,124,6,30,3,4,6,0,0,0,4,1,1,0,0,1,1,E01002361,2025-12-09 18:18:00,18,2007-03-02,Friday,3.0
200701KD50103,550920,182150,0.173789,51.51806,1,3,2,1,23/02/2007,6,19:40,15,E09000016,3,13,3,50,0,-1,-1,0,0,0,4,1,1,0,0,2,2,E01002370,2025-12-09 19:40:00,19,,,
200701KD50105,556250,190360,0.254192,51.590375,1,3,2,1,22/02/2007,5,20:15,15,E09000016,5,0,6,30,3,4,5,0,0,0,4,1,1,0,0,2,2,E01002296,2025-12-09 20:15:00,20,,,
200701KD50106,551230,182760,0.178515,51.523458,1,3,2,1,07/02/2007,4,17:55,15,E09000016,3,1306,6,30,8,4,6,0,0,0,4,1,1,0,0,1,1,E01002368,2025-12-09 17:55:00,17,2007-07-02,Monday,7.0
200701KD50107,553440,182230,0.210115,51.5181,1,3,2,1,22/02/2007,5,18:12,15,E09000016,3,1306,6,30,6,4,6,0,0,4,4,1,1,0,0,1,1,E01002344,2025-12-09 18:12:00,18,,,
200701KD50109,553680,187220,0.215749,51.562869,1,3,2,1,18/02/2007,1,13:20,15,E09000016,3,124,6,30,3,4,6,0,0,0,1,1,1,0,0,1,1,E01002361,2025-12-09 13:20:00,13,,,
200701KD50110,555160,187870,0.23737,51.568305,1,3,3,2,16/02/2007,6,19:40,15,E09000016,6,0,1,30,2,4,6,0,0,0,4,1,1,0,0,1,1,E01002273,2025-12-09 19:40:00,19,,,
200701KD50111,551610,189230,0.186775,51.581489,1,3,2,1,20/02/2007,3,20:50,15,E09000016,3,118,6,30,3,4,6,0,0,0,4,1,1,0,0,1,1,E01002357,2025-12-09 20:50:00,20,,,
200701KD50112,555580,191700,0.245122,51.6026,1,3,2,2,24/02/2007,7,12:38,15,E09000016,5,0,6,30,3,4,3,12,0,0,1,1,1,0,0,1,1,E01002283,2025-12-09 12:38:00,12,,,
200701KD50115,550340,183030,0.165811,51.526121,1,3,2,2,02/02/2007,6,20:40,15,E09000016,3,1306,6,30,0,-1,-1,0,0,0,4,1,1,0,0,1,1,E01002368,2025-12-09 20:40:00,20,2007-02-02,Friday,2.0
200701KD50116,553070,188860,0.207669,51.57777,1,3,1,1,23/02/2007,6,23:35,15,E09000016,5,0,6,30,8,4,5,0,0,0,4,1,1,0,0,1,1,E01002379,2025-12-09 23:35:00,23,,,
200701KD50117,552130,182780,0.191486,51.523396,1,3,2,1,28/02/2007,4,08:16,15,E09000016,3,125,6,30,3,4,6,0,0,0,1,1,2,0,0,1,1,E01002370,2025-12-09 08:16:00,8,,,
200701KD50118,551200,190410,0.18137,51.592201,1,3,2,1,22/02/2007,5,22:45,15,E09000016,3,12,6,30,6,2,5,0,0,5,4,1,1,0,0,1,1,E01002334,2025-12-09 22:45:00,22,,,
200701KD50120,551440,189020,0.184233,51.579648,1,3,2,1,03/03/2007,7,14:20,15,E09000016,5,0,6,30,0,-1,-1,0,0,0,1,1,1,0,0,1,1,E01002357,2025-12-09 14:20:00,14,2007-03-03,Saturday,3.0
200701KD50121,551840,188170,0.189634,51.571903,1,3,1,1,04/03/2007,1,01:15,15,E09000016,5,0,6,30,3,4,6,0,0,0,4,1,1,0,0,1,1,E01002358,2025-12-09 01:15:00,1,2007-04-03,Tuesday,4.0
200701KD50122,550990,188580,0.177554,51.575815,1,2,1,1,20/02/2007,3,17:15,15,E09000016,3,125,6,30,1,4,6,0,0,0,1,1,1,0,0,1,1,E01002356,2025-12-09 17:15:00,17,,,
200701KD50123,552240,184480,0.193805,51.538641,1,3,2,1,21/02/2007,4,20:03,15,E09000016,6,0,6,30,3,4,6,0,0,0,1,1,1,0,0,1,1,E01002372,2025-12-09 20:03:00,20,,,
200701KD50125,554900,186600,0.233063,51.556965,1,3,2,2,24/02/2007,7,14:53,15,E09000016,6,0,6,30,0,-1,-1,0,0,0,1,1,1,0,0,1,1,E01002289,2025-12-09 14:53:00,14,,,
200701KD50126,555900,186160,0.247281,51.552737,1,3,2,1,23/02/2007,6,09:00,15,E09000016,4,1421,6,30,3,4,6,0,0,0,1,1,1,0,0,1,2,E01002390,2025-12-09 09:00:00,9,,,
200701KD50127,552570,182420,0.197668,51.520043,1,2,2,1,27/02/2007,3,07:58,15,E09000016,6,0,6,30,3,4,6,0,0,0,1,1,1,0,0,1,1,E01002342,2025-12-09 07:58:00,7,,,
200701KD50128,552940,192380,0.207328,51.609432,1,3,1,1,20/02/2007,3,19:00,15,E09000016,6,0,6,30,3,4,6,0,0,0,1,1,1,0,0,2,1,E01002313,2025-12-09 19:00:00,19,,,
200701KD50129,551850,188400,0.189878,51.573967,1,3,1,1,27/02/2007,3,16:00,15,E09000016,6,0,6,30,3,4,6,0,0,0,1,1,1,0,0,1,1,E01002358,2025-12-09 16:00:00,16,,,
200701KD50131,551850,188420,0.189886,51.574147,1,3,1,1,08/03/2007,5,08:00,15,E09000016,6,0,6,30,3,4,6,0,0,0,1,1,1,0,0,1,2,E01002358,2025-12-09 08:00:00,8,2007-08-03,Friday,8.0
200701KD50132,551250,190420,0.182096,51.592278,1,2,2,1,05/03/2007,2,08:55,15,E09000016,3,12,3,50,6,2,5,0,0,0,1,1,1,0,0,1,1,E01002334,2025-12-09 08:55:00,8,2007-05-03,Thursday,5.0
200701KD50133,550600,190210,0.172629,51.590565,1,3,3,1,07/03/2007,4,22:28,15,E09000016,4,175,6,30,3,4,6,0,0,0,4,1,1,0,0,1,1,E01002338,2025-12-09 22:28:00,22,2007-07-03,Tuesday,7.0
200701KD50134,554800,185060,0.230944,51.543156,1,3,3,1,02/03/2007,6,12:30,15,E09000016,5,0,6,30,0,-1,-1,0,0,0,1,1,1,0,0,2,1,E01002385,2025-12-09 12:30:00,12,2007-02-03,Saturday,2.0
200701KD50136,550090,189210,0.164845,51.581716,1,3,4,1,25/02/2007,1,14:37,15,E09000016,3,12,3,50,6,2,5,0,0,5,1,1,1,0,0,1,1,E01002329,2025-12-09 14:37:00,14,,,
200701KD50137,551390,189080,0.183538,51.5802,1,2,1,1,02/03/2007,6,19:54,15,E09000016,3,118,6,30,1,4,5,0,0,0,1,1,1,0,0,1,1,E01002357,2025-12-09 19:54:00,19,2007-02-03,Saturday,2.0
200701KD50138,551290,181290,0.178748,51.510234,1,3,2,2,22/02/2007,5,18:50,15,E09000016,6,0,6,30,3,4,6,0,0,0,1,1,1,0,0,2,2,E01002344,2025-12-09 18:50:00,18,,,
200701KD50139,553710,192180,0.218351,51.607426,1,2,1,1,07/05/2007,2,16:20,15,E09000016,5,0,6,30,3,4,6,0,0,1,1,1,1,0,0,1,1,E01002280,2025-12-09 16:20:00,16,2007-07-05,Thursday,7.0
200701KD50140,553870,185750,0.217845,51.54961,1,2,1,2,01/03/2007,5,18:32,15,E09000016,5,0,6,30,0,-1,-1,0,0,0,1,1,1,0,0,1,1,E01002285,2025-12-09 18:32:00,18,2007-01-03,Wednesday,1.0
200701KD50142,553190,190550,0.210137,51.592922,1,3,1,1,03/03/2007,7,18:35,15,E09000016,3,12,3,50,0,-1,-1,0,0,0,1,1,1,0,0,2,1,E01002337,2025-12-09 18:35:00,18,2007-03-03,Saturday,3.0
200701KD50143,557370,188800,0.269648,51.576048,1,3,2,1,14/03/2007,4,23:45,15,E09000016,3,127,6,30,0,-1,-1,0,0,0,4,1,1,0,0,2,1,E01002259,2025-12-09 23:45:00,23,,,
200701KD50145,551740,188110,0.188166,51.571391,1,3,2,1,28/02/2007,4,06:50,15,E09000016,5,0,6,30,3,4,6,0,0,0,1,1,1,0,0,1,2,E01002350,2025-12-09 06:50:00,6,,,
200701KD50147,553980,189490,0.221068,51.583183,1,2,2,1,20/02/2007,3,12:25,15,E09000016,6,0,6,30,0,-1,-1,0,0,0,1,1,1,0,0,1,1,E01002377,2025-12-09 12:25:00,12,,,
200701KD50148,553770,187220,0.217046,51.562845,1,3,2,1,23/02/2007,6,10:15,15,E09000016,3,124,6,30,0,-1,-1,0,0,0,1,1,1,0,0,1,2,E01002361,2025-12-09 10:15:00,10,,,
200701KD50149,555190,188070,0.237891,51.570093,1,3,2,1,12/05/2007,7,17:52,15,E09000016,5,0,1,30,2,4,6,0,0,0,1,1,1,0,0,1,1,E01002273,2025-12-09 17:52:00,17,2007-12-05,Wednesday,12.0
200701KD50150,555280,186150,0.238341,51.552818,1,3,2,1,06/03/2007,3,08:50,15,E09000016,6,0,6,30,3,4,6,0,0,0,1,1,1,0,0,1,2,E01002390,2025-12-09 08:50:00,8,2007-06-03,Sunday,6.0
200701KD50151,552130,183260,0.191694,51.527709,1,3,2,1,11/03/2007,1,13:30,15,E09000016,3,125,6,30,3,4,6,0,0,0,1,1,1,0,0,1,1,E01002370,2025-12-09 13:30:00,13,2007-11-03,Saturday,11.0
200701KD50152,553100,182490,0.205332,51.520528,1,3,2,2,11/03/2007,1,11:40,15,E09000016,3,1306,3,30,6,4,5,0,0,0,1,1,1,0,0,1,1,E01002342,2025-12-09 11:40:00,11,2007-11-03,Saturday,11.0
200701KD50153,554030,186970,0.220685,51.560528,1,2,3,5,10/03/2007,7,00:19,15,E09000016,5,0,6,30,3,4,6,0,0,0,4,1,1,0,0,1,1,E01002361,2025-12-09 00:19:00,0,2007-10-03,Wednesday,10.0
200701KD50154,551930,185240,0.189667,51.545553,1,3,1,1,15/03/2007,5,01:45,15,E09000016,3,125,6,30,3,4,6,0,0,0,4,1,1,0,0,1,1,E01002260,2025-12-09 01:45:00,1,,,
200701KD50155,549890,191130,0.16278,51.599021,1,3,2,2,14/03/2007,4,19:08,15,E09000016,4,174,1,30,1,4,4,1459,0,0,1,1,1,0,0,1,1,E01002326,2025-12-09 19:08:00,19,,,
200701KD50156,552120,182110,0.191053,51.517379,1,3,2,2,01/03/2007,5,23:12,15,E09000016,4,1335,6,30,3,4,4,1335,0,0,4,1,1,0,0,1,1,E01002345,2025-12-09 23:12:00,23,2007-01-03,Wednesday,1.0
200701KD50157,553780,188460,0.217733,51.573983,1,3,1,1,20/03/2007,3,09:50,15,E09000016,5,0,6,30,0,-1,-1,0,0,0,1,1,1,0,0,1,1,E01002381,2025-12-09 09:50:00,9,,,
200701KD50158,556890,184900,0.260987,51.541142,1,3,3,1,15/03/2007,5,08:52,15,E09000016,4,1421,6,30,0,-1,-1,0,0,0,1,1,1,0,0,2,1,E01002385,2025-12-09 08:52:00,8,,,
200701KD50159,549750,191080,0.160739,51.598608,1,3,2,2,17/03/2007,7,15:00,15,E09000016,4,174,6,30,3,4,6,0,0,4,1,1,1,0,0,1,2,E01002326,2025-12-09 15:00:00,15,,,
200701KD50160,553500,190570,0.214617,51.593018,1,3,3,2,18/03/2007,1,12:45,15,E09000016,3,12,6,30,0,-1,-1,0,0,0,1,1,1,0,0,1,2,E01002293,2025-12-09 12:45:00,12,,,
200701KD50161,553390,189360,0.212502,51.582176,1,2,1,1,24/03/2007,7,20:55,15,E09000016,5,0,6,30,3,4,6,0,0,0,4,1,1,0,0,1,1,E01002380,2025-12-09 20:55:00,20,,,
200701KD50162,550280,191820,0.168702,51.605116,1,3,2,1,22/03/2007,5,11:52,15,E09000016,6,0,6,30,3,4,6,0,0,0,1,1,1,0,0,1,1,E01002306,2025-12-09 11:52:00,11,,,
200701KD50163,554000,189820,0.221501,51.586143,1,3,2,2,26/03/2007,2,17:10,15,E09000016,5,0,6,30,3,4,6,0,0,0,1,1,1,0,0,1,1,E01002377,2025-12-09 17:10:00,17,,,
200701KD50164,551640,188690,0.186975,51.576629,1,3,1,1,21/03/2007,4,15:00,15,E09000016,5,0,6,30,3,2,6,0,0,5,1,1,1,0,0,1,1,E01002357,2025-12-09 15:00:00,15,,,
200701KD50165,550680,188750,0.173157,51.577426,1,3,1,1,17/03/2007,7,17:10,15,E09000016,6,0,6,30,3,4,6,0,0,0,1,1,1,0,0,1,1,E01002244,2025-12-09 17:10:00,17,,,
200701KD50166,556110,186950,0.250658,51.559777,1,2,2,2,27/02/2007,3,16:17,15,E09000016,5,0,6,30,3,4,6,0,0,0,1,1,1,0,0,1,1,E01002257,2025-12-09 16:17:00,16,,,
200701KD50167,550870,181500,0.172791,51.512233,1,3,4,1,23/03/2007,6,06:54,15,E09000016,6,0,6,30,3,4,6,0,0,0,1,1,1,0,0,1,1,E01002370,2025-12-09 06:54:00,6,,,
200701KD50168,553960,190060,0.221029,51.58831,1,3,2,2,15/01/2007,2,17:30,15,E09000016,3,127,7,70,5,4,6,0,0,0,1,1,1,0,0,1,2,E01002377,2025-12-09 17:30:00,17,,,
200701KD50169,553100,182480,0.205327,51.520439,1,3,2,2,18/03/2007,1,19:51,15,E09000016,3,1306,6,30,6,2,5,0,0,5,1,1,1,0,0,1,1,E01002342,2025-12-09 19:51:00,19,,,
200701KD50170,557440,188750,0.270635,51.575579,1,3,3,2,15/03/2007,5,07:34,15,E09000016,3,127,3,30,0,-1,-1,0,0,0,1,1,1,0,0,2,1,E01002259,2025-12-09 07:34:00,7,,,
200701KD50171,553460,183410,0.210917,51.528697,1,3,2,1,16/03/2007,6,15:35,15,E09000016,6,0,6,30,3,4,6,0,0,0,1,1,1,0,0,1,1,E01002349,2025-12-09 15:35:00,15,,,
200701KD50172,550080,189180,0.164688,51.581449,1,3,3,1,24/03/2007,7,12:56,15,E09000016,3,12,6,30,6,2,3,12,0,5,1,1,1,0,0,1,1,E01002244,2025-12-09 12:56:00,12,,,
200701KD50173,551920,186330,0.189993,51.555349,1,3,2,2,25/03/2007,1,13:55,15,E09000016,3,125,6,30,3,4,6,0,0,0,1,1,1,0,0,1,2,E01002322,2025-12-09 13:55:00,13,,,
200701KD50174,549370,188290,0.15407,51.573641,1,3,1,1,21/03/2007,4,16:07,15,E09000016,3,118,6,30,0,-1,-1,0,0,0,1,1,1,0,0,1,1,E01002250,2025-12-09 16:07:00,16,,,
200701KD50176,552840,185250,0.202784,51.545397,1,3,2,1,20/03/2007,3,18:15,15,E09000016,5,0,6,30,6,4,5,0,0,0,1,1,1,0,0,1,2,E01002265,2025-12-09 18:15:00,18,,,
200701KD50177,553400,190520,0.213153,51.592595,1,3,2,4,13/03/2007,3,15:12,15,E09000016,3,127,6,30,1,4,3,12,0,0,1,1,1,0,0,1,1,E01002293,2025-12-09 15:12:00,15,,,
200701KD50178,552260,185080,0.194353,51.544026,1,3,1,1,17/03/2007,7,15:30,15,E09000016,6,0,6,30,3,4,6,0,0,0,1,1,1,0,0,1,2,E01002266,2025-12-09 15:30:00,15,,,
200701KD50179,551350,187910,0.182457,51.569699,1,3,1,1,25/03/2007,1,00:25,15,E09000016,3,125,6,30,0,-1,-1,0,0,0,4,1,1,0,0,1,1,E01002249,2025-12-09 00:25:00,0,,,
200701KD50180,553880,185770,0.217998,51.549787,1,2,1,1,28/03/2007,4,15:21,15,E09000016,5,0,6,30,3,4,6,0,0,1,1,1,1,0,0,1,1,E01002285,2025-12-09 15:21:00,15,,,
200701KD50181,551370,191610,0.18434,51.602938,1,3,2,1,30/03/2007,6,06:05,15,E09000016,5,0,6,30,3,4,6,0,0,0,1,1,1,0,0,1,1,E01002341,2025-12-09 06:05:00,6,,,
200701KD50182,557230,183950,0.265462,51.532512,1,3,2,1,26/03/2007,2,09:30,15,E09000016,5,0,6,30,3,4,6,0,0,0,1,1,1,0,0,2,1,E01002385,2025-12-09 09:30:00,9,,,
200701KD50183,551650,181440,0.183997,51.511485,1,3,2,1,26/02/2007,2,06:30,15,E09000016,6,0,6,30,0,-1,-1,0,0,0,1,1,1,0,0,2,2,E01002344,2025-12-09 06:30:00,6,,,
200701KD50184,554720,190870,0.232348,51.595379,1,3,2,1,28/03/2007,4,10:15,15,E09000016,5,0,6,30,3,4,6,0,0,0,1,1,1,0,0,1,1,E01002300,2025-12-09 10:15:00,10,,,
200701KD50185,553210,186610,0.208708,51.557516,1,2,2,1,03/04/2007,3,22:20,15,E09000016,5,0,6,30,8,4,6,0,0,0,4,1,1,0,0,1,1,E01002363,2025-12-09 22:20:00,22,2007-03-04,Sunday,3.0
200701KD50186,549750,191080,0.160739,51.598608,1,3,1,1,29/03/2007,5,22:25,15,E09000016,4,174,6,30,3,2,6,0,0,5,4,1,1,0,0,1,1,E01002326,2025-12-09 22:25:00,22,,,
200701KD50187,552000,183370,0.189868,51.528732,1,3,1,1,29/03/2007,5,16:00,15,E09000016,3,125,6,30,6,2,3,125,0,0,1,1,1,0,0,1,1,E01002374,2025-12-09 16:00:00,16,,,
200701KD50188,554000,186500,0.220047,51.556313,1,3,3,1,31/03/2007,7,15:49,15,E09000016,5,0,6,30,3,4,3,124,0,0,1,1,1,0,0,1,1,E01002291,2025-12-09 15:49:00,15,,,
200701KD50190,558310,188700,0.283156,51.574887,1,3,1,1,14/03/2007,4,11:07,15,E09000016,1,25,3,70,0,-1,-1,0,0,0,1,1,1,0,0,2,1,E01002259,2025-12-09 11:07:00,11,,,
200701KD50191,553600,182650,0.212602,51.52183,1,3,2,1,29/03/2007,5,22:30,15,E09000016,5,0,6,30,3,4,6,0,0,0,4,1,1,0,0,1,1,E01002343,2025-12-09 22:30:00,22,,,
200701KD50192,556230,183510,0.250862,51.528836,1,3,2,1,31/03/2007,7,12:50,15,E09000016,5,0,6,30,3,4,5,0,0,0,1,1,1,0,0,2,1,E01002385,2025-12-09 12:50:00,12,,,
200701KD50193,558690,187880,0.288265,51.567413,1,3,2,1,31/03/2007,7,00:50,15,E09000016,1,25,3,70,0,-1,-1,0,0,0,4,1,1,0,0,2,1,E01002252,2025-12-09 00:50:00,0,,,
200701KD50194,552030,190740,0.193486,51.594943,1,2,3,2,25/03/2007,1,08:30,15,E09000016,3,12,6,30,3,4,6,0,0,0,1,1,1,0,0,1,2,E01002334,2025-12-09 08:30:00,8,,,
200701KD50195,551240,190410,0.181947,51.592191,1,2,2,1,08/04/2007,1,11:06,15,E09000016,3,12,6,30,6,2,5,0,0,5,1,1,1,0,0,1,1,E01002334,2025-12-09 11:06:00,11,2007-08-04,Saturday,8.0
200701KD50196,553420,190590,0.213472,51.593219,1,3,2,1,05/04/2007,5,07:45,15,E09000016,3,12,6,30,1,4,3,127,0,4,1,1,1,0,0,1,1,E01002310,2025-12-09 07:45:00,7,2007-05-04,Friday,5.0
200701KD50197,553890,185780,0.218146,51.549874,1,3,2,1,31/03/2007,7,15:17,15,E09000016,5,0,6,30,3,4,6,0,0,1,1,1,1,0,0,1,1,E01002285,2025-12-09 15:17:00,15,,,
200701KD50200,553900,185970,0.218373,51.551578,1,3,2,1,05/04/2007,5,20:00,15,E09000016,5,0,6,30,6,4,6,0,0,0,1,1,1,0,0,1,1,E01002285,2025-12-09 20:00:00,20,2007-05-04,Friday,5.0
200701KD50201,554550,188870,0.229015,51.577457,1,3,2,3,30/03/2007,6,17:05,15,E09000016,6,0,6,30,0,-1,-1,0,0,0,1,1,1,0,0,1,1,E01002271,2025-12-09 17:05:00,17,,,
200701KD50202,549740,188370,0.15944,51.574261,1,3,2,1,20/03/2007,3,18:47,15,E09000016,3,118,6,30,3,4,6,0,0,0,1,1,1,0,0,1,1,E01002246,2025-12-09 18:47:00,18,,,
200701KD50205,556010,186540,0.249035,51.556121,1,3,1,1,12/04/2007,5,07:55,15,E09000016,3,124,6,30,3,4,4,1421,0,0,1,1,1,0,0,1,2,E01002386,2025-12-09 07:55:00,7,2007-12-04,Tuesday,12.0
200701KD50206,556040,186660,0.24952,51.55719,1,3,3,1,15/04/2007,1,10:40,15,E09000016,5,0,6,30,6,4,6,0,0,0,1,1,1,0,0,1,1,E01002386,2025-12-09 10:40:00,10,,,
200701KD50207,550230,182460,0.163983,51.521029,1,3,2,1,22/03/2007,5,13:20,15,E09000016,3,13,3,70,0,-1,-1,0,0,0,1,1,1,0,0,1,1,E01002368,2025-12-09 13:20:00,13,,,
200701KD50209,551400,183600,0.181324,51.53096,1,3,2,1,17/04/2007,3,22:23,15,E09000016,6,0,6,30,0,-1,-1,0,0,0,4,1,1,0,0,1,1,E01002369,2025-12-09 22:23:00,22,,,
200701KD50210,554690,180600,0.227402,51.503114,1,3,3,1,29/03/2007,5,09:15,15,E09000016,6,0,6,30,3,4,3,1306,0,0,1,1,1,0,0,2,2,E01002344,2025-12-09 09:15:00,9,,,
200701KD50211,552910,181920,0.202348,51.515458,1,3,2,3,21/03/2007,4,08:25,15,E09000016,6,0,6,30,0,-1,-1,0,0,0,1,1,1,0,0,1,2,E01002347,2025-12-09 08:25:00,8,,,
200701KD50212,558210,189010,0.281854,51.5777,1,3,1,2,31/03/2007,7,02:52,15,E09000016,1,25,3,70,0,-1,-1,0,0,0,4,1,1,0,0,2,1,E01002259,2025-12-09 02:52:00,2,,,
200701KD50213,550560,189700,0.171834,51.585993,1,3,2,2,15/04/2007,1,15:35,15,E09000016,3,12,3,50,0,-1,-1,0,0,0,1,1,1,0,0,1,1,E01002328,2025-12-09 15:35:00,15,,,
200701KD50215,556420,192800,0.257731,51.61225,1,3,1,1,03/04/2007,3,23:47,15,E09000016,1,25,3,70,0,-1,-1,0,0,0,4,1,1,0,2,2,1,E01002277,2025-12-09 23:47:00,23,2007-03-04,Sunday,3.0
200701KD50216,551950,188190,0.191229,51.572053,1,2,2,1,17/04/2007,3,18:30,15,E09000016,5,0,1,30,2,4,5,0,0,0,1,1,1,0,0,1,1,E01002351,2025-12-09 18:30:00,18,,,
200701KD50217,550800,187400,0.174308,51.565264,1,3,2,1,13/04/2007,6,20:30,15,E09000016,3,124,6,30,3,4,6,0,0,0,4,1,1,0,0,1,1,E01002248,2025-12-09 20:30:00,20,,,
200701KD50218,553900,189180,0.219778,51.58042,1,3,2,2,07/04/2007,7,20:06,15,E09000016,5,0,6,30,3,4,6,0,0,0,1,1,1,0,0,1,1,E01002377,2025-12-09 20:06:00,20,2007-07-04,Wednesday,7.0
200701KD50219,552570,185480,0.198993,51.547537,1,3,2,1,22/04/2007,1,16:58,15,E09000016,6,0,6,30,3,4,6,0,0,0,1,1,1,0,0,1,1,E01002262,2025-12-09 16:58:00,16,,,
200701KD50220,554820,185060,0.231232,51.543151,1,3,2,1,11/04/2007,4,13:20,15,E09000016,5,0,6,30,0,-1,-1,0,0,0,1,1,1,0,0,2,1,E01002385,2025-12-09 13:20:00,13,2007-11-04,Sunday,11.0
200701KD50221,551450,188150,0.184002,51.571828,1,3,2,1,20/04/2007,6,12:27,15,E09000016,5,0,6,30,3,4,5,0,0,0,1,1,1,0,0,1,1,E01002350,2025-12-09 12:27:00,12,,,
200701KD50222,551820,188230,0.189372,51.572448,1,3,1,1,18/04/2007,4,15:20,15,E09000016,6,0,6,30,6,4,6,0,0,0,1,1,1,0,0,1,1,E01002358,2025-12-09 15:20:00,15,,,
200701KD50223,552750,184500,0.201162,51.538683,1,3,3,1,18/04/2007,4,08:30,15,E09000016,5,0,6,30,2,4,5,0,0,0,1,1,1,0,0,1,2,E01002263,2025-12-09 08:30:00,8,,,
200701KD50224,551170,188160,0.179969,51.571993,1,3,3,1,14/04/2007,7,13:03,15,E09000016,3,125,6,30,0,-1,-1,0,0,0,1,1,1,0,0,1,1,E01002249,2025-12-09 13:03:00,13,,,
200701KD50225,552190,189690,0.195339,51.585466,1,3,2,1,23/04/2007,2,07:10,15,E09000016,3,118,6,30,6,4,6,0,0,0,1,1,1,0,0,1,1,E01002354,2025-12-09 07:10:00,7,,,
200701KD50227,553380,190490,0.212851,51.592331,1,3,2,1,28/04/2007,7,11:22,15,E09000016,3,127,6,30,0,-1,-1,0,0,0,1,1,1,0,0,1,1,E01002383,2025-12-09 11:22:00,11,,,
200701KD50228,554160,189900,0.223844,51.586818,1,3,2,1,28/04/2007,7,09:00,15,E09000016,3,127,6,30,6,2,3,127,0,0,1,1,1,0,0,1,2,E01002377,2025-12-09 09:00:00,9,,,
200701KD50229,554180,189890,0.224128,51.586722,1,3,2,1,01/05/2007,3,11:28,15,E09000016,3,127,3,50,6,2,3,127,0,0,1,1,1,0,0,1,1,E01002378,2025-12-09 11:28:00,11,2007-01-05,Friday,1.0
200701KD50230,553770,188410,0.217567,51.573537,1,3,3,1,23/04/2007,2,16:18,15,E09000016,5,0,6,30,1,4,5,0,0,0,1,1,1,0,0,1,1,E01002274,2025-12-09 16:18:00,16,,,
200701KD50231,554680,191180,0.231907,51.598176,1,3,2,1,23/05/2007,4,19:33,15,E09000016,3,12,6,30,6,2,5,0,0,5,1,1,1,0,0,1,1,E01002300,2025-12-09 19:33:00,19,,,
200701KD50232,554640,180620,0.226691,51.503308,1,3,3,2,17/04/2007,3,18:25,15,E09000016,3,1306,6,30,3,4,6,0,0,0,1,1,1,0,0,2,2,E01002344,2025-12-09 18:25:00,18,,,
200701KD50233,553090,181590,0.204797,51.512445,1,3,2,1,26/04/2007,5,09:00,15,E09000016,4,1335,6,30,3,4,6,0,0,0,1,1,1,0,0,1,2,E01002347,2025-12-09 09:00:00,9,,,
200701KD50234,553970,187400,0.220008,51.564408,1,3,1,1,12/04/2007,5,07:30,15,E09000016,5,0,6,30,0,-1,-1,0,0,0,1,1,1,0,0,1,1,E01002361,2025-12-09 07:30:00,7,2007-12-04,Tuesday,12.0
200701KD50235,551060,188770,0.178645,51.577504,1,3,1,2,03/05/2007,5,11:55,15,E09000016,6,0,6,30,3,4,6,0,0,0,1,1,1,0,0,1,1,E01002356,2025-12-09 11:55:00,11,2007-03-05,Monday,3.0
200701KD50236,550270,191370,0.168365,51.601076,1,3,1,1,22/04/2007,1,19:36,15,E09000016,6,0,6,30,0,-1,-1,0,0,0,1,1,1,0,0,1,1,E01002301,2025-12-09 19:36:00,19,,,
200701KD50237,553350,190830,0.212567,51.595394,1,3,1,1,28/04/2007,7,08:10,15,E09000016,5,0,6,30,0,-1,-1,0,0,0,1,1,1,0,0,1,1,E01002309,2025-12-09 08:10:00,8,,,
200701KD50238,550970,189150,0.177511,51.580942,1,3,3,2,01/05/2007,3,15:50,15,E09000016,3,125,6,30,3,4,6,0,0,0,1,1,1,0,0,1,1,E01002243,2025-12-09 15:50:00,15,2007-01-05,Friday,1.0
200701KD50239,553810,190720,0.219155,51.594281,1,2,2,2,25/04/2007,4,18:00,15,E09000016,6,0,6,30,3,4,3,12,0,0,1,1,1,0,0,1,1,E01002293,2025-12-09 18:00:00,18,,,
200701KD50241,554040,192280,0.223157,51.608234,1,3,1,1,22/04/2007,1,10:18,15,E09000016,5,0,6,30,1,4,5,0,0,0,1,1,1,0,0,1,1,E01002282,2025-12-09 10:18:00,10,,,
200701KD50242,558450,185120,0.283563,51.542683,1,3,2,2,21/04/2007,7,17:00,15,E09000016,4,1421,6,30,0,-1,-1,0,0,0,1,1,1,0,0,2,1,E01002385,2025-12-09 17:00:00,17,,,
200701KD50243,556930,184820,0.261528,51.540412,1,3,2,4,12/04/2007,5,15:16,15,E09000016,4,1421,6,30,3,4,6,0,0,0,1,1,1,0,0,2,1,E01002385,2025-12-09 15:16:00,15,2007-12-04,Tuesday,12.0
200701KD50244,554710,191020,0.23227,51.59673,1,3,2,1,15/03/2007,5,17:55,15,E09000016,5,0,6,30,6,4,6,0,0,0,1,1,1,0,0,1,1,E01002300,2025-12-09 17:55:00,17,,,
200701KD50245,551680,187450,0.187017,51.565477,1,3,2,1,02/05/2007,4,23:45,15,E09000016,3,124,6,30,0,-1,-1,0,0,0,4,1,1,0,0,1,2,E01002319,2025-12-09 23:45:00,23,2007-02-05,Monday,2.0
200701KD50246,553920,188030,0.219563,51.570082,1,3,2,1,29/04/2007,1,14:20,15,E09000016,5,0,6,30,3,4,6,0,0,0,1,1,1,0,0,1,2,E01002274,2025-12-09 14:20:00,14,,,
200701KD50247,548990,187750,0.148362,51.568889,1,3,1,1,02/05/2007,4,15:53,15,E09000016,6,0,6,30,0,-1,-1,0,0,0,1,1,1,0,0,1,1,E01002250,2025-12-09 15:53:00,15,2007-02-05,Monday,2.0
200701KD50248,551860,188170,0.189922,51.571898,1,3,1,1,01/05/2007,3,19:10,15,E09000016,5,0,6,30,3,4,6,0,0,0,1,1,1,0,0,1,1,E01002351,2025-12-09 19:10:00,19,2007-01-05,Friday,1.0
200701KD50249,556150,183860,0.249864,51.532003,1,2,1,1,07/05/2007,2,15:25,15,E09000016,5,0,6,30,0,-1,-1,0,0,0,1,1,1,0,0,2,1,E01002385,2025-12-09 15:25:00,15,2007-07-05,Thursday,7.0
200701KD50250,552950,189260,0.206113,51.581397,1,3,2,1,27/04/2007,6,18:54,15,E09000016,6,0,6,30,0,-1,-1,0,0,0,1,1,1,0,0,1,1,E01002379,2025-12-09 18:54:00,18,,,
200701KD50251,552100,181380,0.190451,51.510825,1,2,2,1,03/05/2007,5,16:40,15,E09000016,3,13,6,30,3,4,6,0,0,0,1,1,1,0,0,2,1,E01002344,2025-12-09 16:40:00,16,2007-03-05,Monday,3.0
200701KD50252,553440,182240,0.21012,51.51819,1,2,2,1,24/02/2007,7,11:20,15,E09000016,6,0,6,30,3,4,3,1306,0,0,1,1,1,0,0,1,1,E01002344,2025-12-09 11:20:00,11,,,
200701KD50253,553410,190540,0.213306,51.592772,1,3,3,1,21/04/2007,7,16:36,15,E09000016,5,0,6,30,3,4,3,12,0,0,1,1,1,0,0,1,1,E01002310,2025-12-09 16:36:00,16,,,
200701KD50254,554850,187150,0.232584,51.561921,1,3,2,3,09/05/2007,4,15:00,15,E09000016,5,0,6,30,3,4,6,0,0,0,1,1,1,0,0,1,1,E01002362,2025-12-09 15:00:00,15,2007-09-05,Wednesday,9.0
200701KD50255,550630,189750,0.172865,51.586424,1,2,2,1,03/05/2007,5,20:48,15,E09000016,4,174,6,30,3,4,3,12,0,0,1,1,1,0,0,1,1,E01002338,2025-12-09 20:48:00,20,2007-03-05,Monday,3.0
200701KD50257,550880,182210,0.173238,51.51861,1,2,2,1,04/05/2007,6,16:10,15,E09000016,3,13,6,30,3,4,6,0,0,0,1,1,1,0,0,2,1,E01002370,2025-12-09 16:10:00,16,2007-04-05,Thursday,4.0
200701KD50258,553850,187360,0.218261,51.564081,1,2,3,1,21/04/2007,7,17:46,15,E09000016,6,0,6,30,3,4,6,0,0,0,1,1,1,0,0,1,1,E01002361,2025-12-09 17:46:00,17,,,
200701KD50259,556420,189000,0.256038,51.578109,1,3,3,3,23/04/2007,2,13:58,15,E09000016,3,127,6,30,0,-1,-1,0,0,0,1,1,1,0,0,2,1,E01002259,2025-12-09 13:58:00,13,,,
200701KD50261,551170,190390,0.180929,51.59203,1,3,2,1,26/04/2007,5,10:50,15,E09000016,6,0,6,30,3,4,3,12,0,0,1,1,1,0,0,1,2,E01002334,2025-12-09 10:50:00,10,,,
200701KD50264,552100,183280,0.19127,51.527897,1,3,2,1,10/05/2007,5,11:35,15,E09000016,3,125,6,30,0,-1,-1,0,0,0,1,1,1,0,0,1,1,E01002374,2025-12-09 11:35:00,11,2007-10-05,Friday,10.0
200701KD50265,550400,187310,0.168503,51.564562,1,3,1,1,05/05/2007,7,23:25,15,E09000016,6,0,6,30,3,4,3,124,0,0,4,1,1,0,0,1,1,E01002251,2025-12-09 23:25:00,23,2007-05-05,Saturday,5.0
200701KD50266,551960,188190,0.191373,51.572051,1,3,2,1,24/04/2007,3,12:58,15,E09000016,5,0,6,30,2,4,5,0,0,0,1,1,1,0,0,1,1,E01002351,2025-12-09 12:58:00,12,,,
200701KD50267,549530,191000,0.157531,51.597948,1,3,2,1,09/05/2007,4,08:45,15,E09000016,4,174,6,30,3,4,6,0,0,0,1,1,1,0,0,1,1,E01002325,2025-12-09 08:45:00,8,2007-09-05,Wednesday,9.0
200701KD50271,556500,188130,0.256805,51.57027,1,3,2,1,07/05/2007,2,21:25,15,E09000016,5,0,1,30,2,4,6,0,0,0,1,1,1,0,0,1,1,E01002253,2025-12-09 21:25:00,21,2007-07-05,Thursday,7.0
200701KD50272,557580,187400,0.272048,51.563411,1,3,2,1,06/05/2007,1,10:50,15,E09000016,6,0,6,30,8,4,6,0,0,0,1,1,1,0,0,1,2,E01002256,2025-12-09 10:50:00,10,2007-06-05,Tuesday,6.0
200701KD50274,558830,187400,0.290067,51.563061,1,3,2,1,04/05/2007,6,22:05,15,E09000016,1,25,3,70,0,-1,-1,0,0,0,4,1,1,0,0,2,1,E01002391,2025-12-09 22:05:00,22,2007-04-05,Thursday,4.0
200701KD50275,553940,189500,0.220495,51.583284,1,3,2,1,07/05/2007,2,22:30,15,E09000016,5,0,6,30,8,4,5,0,0,0,4,1,1,0,0,1,1,E01002377,2025-12-09 22:30:00,22,2007-07-05,Thursday,7.0
200701KD50277,556600,192590,0.260235,51.610314,1,3,2,1,12/04/2007,5,08:05,15,E09000016,1,25,3,70,0,-1,-1,0,0,0,1,1,1,0,0,2,1,E01002277,2025-12-09 08:05:00,8,2007-12-04,Tuesday,12.0
200701KD50278,552870,187400,0.20415,51.564707,1,3,2,1,10/05/2007,5,10:40,15,E09000016,6,0,6,30,3,4,3,124,0,0,1,1,1,0,0,1,2,E01002321,2025-12-09 10:40:00,10,2007-10-05,Friday,10.0
200701KD50279,551820,187030,0.188854,51.561666,1,3,2,1,16/05/2007,4,17:15,15,E09000016,6,0,6,30,3,4,3,125,0,0,1,1,1,0,0,1,2,E01002323,2025-12-09 17:15:00,17,,,
200701KD50280,550640,189760,0.173013,51.586511,1,3,3,1,02/05/2007,4,17:40,15,E09000016,3,12,6,30,6,2,3,125,0,5,1,1,1,0,0,1,2,E01002340,2025-12-09 17:40:00,17,2007-02-05,Monday,2.0
200701KD50281,556170,186560,0.25135,51.556256,1,3,2,1,10/05/2007,5,23:45,15,E09000016,4,187,6,30,3,4,6,0,0,0,4,1,1,0,0,1,2,E01002386,2025-12-09 23:45:00,23,2007-10-05,Friday,10.0
200701KD50282,554230,188050,0.224041,51.570177,1,3,2,1,13/05/2007,1,20:30,15,E09000016,6,0,6,30,6,4,6,0,0,0,4,1,1,0,0,1,1,E01002270,2025-12-09 20:30:00,20,,,
200701KD50283,550630,182930,0.169945,51.525146,1,3,2,1,14/05/2007,2,07:00,15,E09000016,3,1306,6,30,3,4,5,0,0,0,1,1,1,0,0,1,1,E01002368,2025-12-09 07:00:00,7,,,
200701KD50284,553030,185990,0.205844,51.551995,1,3,2,1,02/05/2007,4,13:35,15,E09000016,5,0,6,30,0,-1,-1,0,0,0,1,1,1,0,0,1,1,E01002366,2025-12-09 13:35:00,13,2007-02-05,Monday,2.0
200701KD50285,553870,192410,0.220761,51.609449,1,3,1,1,26/05/2007,7,15:27,15,E09000016,5,0,6,30,3,4,6,0,0,0,1,1,1,0,0,1,1,E01002278,2025-12-09 15:27:00,15,,,
200701KD50289,554840,187140,0.232435,51.561834,1,3,1,1,27/04/2007,6,11:45,15,E09000016,5,0,6,30,3,4,6,0,0,0,1,1,1,0,0,1,1,E01002362,2025-12-09 11:45:00,11,,,
200701KD50290,553180,190330,0.209896,51.590948,1,3,2,1,13/05/2007,1,12:30,15,E09000016,3,118,6,30,3,4,5,0,0,0,1,1,1,0,0,1,2,E01002337,2025-12-09 12:30:00,12,,,
200701KD50291,551750,189350,0.188846,51.58253,1,3,2,1,23/05/2007,4,14:30,15,E09000016,3,118,6,30,3,4,5,0,0,0,1,1,1,0,0,1,1,E01002354,2025-12-09 14:30:00,14,,,
200701KD50292,553440,182240,0.21012,51.51819,1,3,3,1,14/05/2007,2,11:46,15,E09000016,6,0,6,30,3,4,3,1306,0,0,1,1,1,0,0,1,1,E01002344,2025-12-09 11:46:00,11,,,
200701KD50293,555290,186770,0.238759,51.558386,1,3,2,1,23/05/2007,4,16:45,15,E09000016,3,124,6,30,3,4,6,0,0,0,1,1,1,0,0,1,2,E01002289,2025-12-09 16:45:00,16,,,
200701KD50294,556460,192180,0.258032,51.606669,1,3,2,1,21/05/2007,2,09:00,15,E09000016,3,12,6,30,3,4,6,0,0,0,1,1,1,0,0,2,2,E01002296,2025-12-09 09:00:00,9,,,
200701KD50295,550090,189210,0.164845,51.581716,1,3,3,2,12/05/2007,7,11:30,15,E09000016,3,12,6,30,3,4,5,0,0,0,1,1,1,0,0,1,1,E01002329,2025-12-09 11:30:00,11,2007-12-05,Wednesday,12.0
200701KD50296,558640,187960,0.287581,51.568145,1,3,2,1,18/05/2007,6,16:45,15,E09000016,1,25,6,30,0,-1,-1,0,0,0,1,1,1,0,0,2,2,E01002252,2025-12-09 16:45:00,16,,,
200701KD50297,552970,182300,0.203377,51.518856,1,3,2,1,14/05/2007,2,15:21,15,E09000016,6,0,6,30,3,4,6,0,0,0,1,1,1,0,0,1,1,E01002342,2025-12-09 15:21:00,15,,,
200701KD50298,554760,185070,0.230372,51.543257,1,3,2,1,25/05/2007,6,18:00,15,E09000016,5,0,6,30,3,4,5,0,0,0,1,1,1,0,0,2,2,E01002385,2025-12-09 18:00:00,18,,,
200701KD50299,553120,189250,0.20856,51.581261,1,3,2,2,20/05/2007,1,02:13,15,E09000016,5,0,6,30,3,4,5,0,0,0,4,1,1,0,0,1,1,E01002379,2025-12-09 02:13:00,2,,,
200701KD50300,549940,188410,0.162341,51.574568,1,3,1,1,27/05/2007,1,06:00,15,E09000016,3,118,6,30,3,4,6,0,0,0,1,1,1,0,0,1,1,E01002246,2025-12-09 06:00:00,6,,,
200701KD50301,551450,188160,0.184006,51.571918,1,3,2,1,06/05/2007,1,18:10,15,E09000016,5,0,6,30,3,4,5,0,0,0,1,1,1,0,0,1,1,E01002356,2025-12-09 18:10:00,18,2007-06-05,Tuesday,6.0
200701KD50302,552420,182320,0.195465,51.519185,1,3,2,1,25/05/2007,6,11:25,15,E09000016,5,0,6,30,3,4,6,0,0,0,1,1,1,0,0,1,2,E01002345,2025-12-09 11:25:00,11,,,
200701KD50303,550800,188850,0.17493,51.578292,1,3,2,1,27/05/2007,1,15:12,15,E09000016,5,0,6,30,0,-1,-1,0,0,0,1,1,1,0,0,1,2,E01002243,2025-12-09 15:12:00,15,,,
200701KD50304,554650,186930,0.229604,51.559999,1,3,2,1,08/05/2007,3,22:05,15,E09000016,5,0,6,30,3,4,3,124,0,0,1,1,1,0,0,1,1,E01002360,2025-12-09 22:05:00,22,2007-08-05,Sunday,8.0
200701KD50306,553980,190820,0.221651,51.595133,1,3,2,1,12/05/2007,7,12:30,15,E09000016,3,12,6,30,3,4,6,0,0,0,1,1,1,0,0,1,1,E01002293,2025-12-09 12:30:00,12,2007-12-05,Wednesday,12.0
200701KD50307,550630,182930,0.169945,51.525146,1,3,3,1,22/05/2007,3,08:10,15,E09000016,5,0,6,30,3,4,3,1306,0,0,1,1,1,0,0,1,1,E01002368,2025-12-09 08:10:00,8,,,
200701KD50308,553480,190560,0.214324,51.592933,1,3,2,2,11/04/2007,4,22:46,15,E09000016,3,12,6,30,0,-1,-1,0,0,0,1,1,1,0,0,1,1,E01002293,2025-12-09 22:46:00,22,2007-11-04,Sunday,11.0
200701KD50309,558520,188390,0.286045,51.572042,1,3,2,1,12/05/2007,7,23:00,15,E09000016,3,127,6,30,3,4,1,25,0,0,4,1,1,0,0,2,1,E01002252,2025-12-09 23:00:00,23,2007-12-05,Wednesday,12.0
200701KD50310,552100,188250,0.193417,51.572552,1,3,2,2,27/05/2007,1,20:31,15,E09000016,5,0,6,30,3,4,6,0,0,0,1,1,1,0,0,1,1,E01002352,2025-12-09 20:31:00,20,,,
200701KD50311,554040,190840,0.222525,51.595296,1,3,4,4,19/05/2007,7,12:29,15,E09000016,3,12,6,30,0,-1,-1,0,0,0,1,1,1,0,0,1,1,E01002293,2025-12-09 12:29:00,12,,,
200701KD50312,548990,191040,0.149757,51.59845,1,3,2,1,19/05/2007,7,18:50,15,E09000016,4,174,6,30,3,4,6,0,0,0,1,1,1,0,0,2,1,E01002331,2025-12-09 18:50:00,18,,,
200701KD50314,551260,188050,0.18122,51.570981,1,3,1,1,26/05/2007,7,00:46,15,E09000016,3,125,3,30,1,4,5,0,0,0,4,1,1,0,0,1,1,E01002350,2025-12-09 00:46:00,0,,,
200701KD50315,558670,187840,0.287959,51.567059,1,3,2,1,24/04/2007,3,18:20,15,E09000016,1,25,3,70,0,-1,-1,0,0,0,1,1,1,0,0,2,1,E01002252,2025-12-09 18:20:00,18,,,
200701KD50316,552040,183490,0.190496,51.5298,1,3,1,1,19/05/2007,7,16:45,15,E09000016,5,0,6,30,3,4,6,0,0,0,1,1,1,0,0,1,1,E01002371,2025-12-09 16:45:00,16,,,
200701KD50317,556400,192820,0.257452,51.612436,1,3,4,3,27/05/2007,1,17:01,15,E09000016,1,25,3,70,0,-1,-1,0,0,0,1,2,2,0,0,2,1,E01002277,2025-12-09 17:01:00,17,,,
200701KD50318,550680,189540,0.173496,51.584524,1,3,2,1,15/01/2007,2,16:35,15,E09000016,3,125,6,30,3,4,6,0,0,0,1,1,1,0,0,1,2,E01002245,2025-12-09 16:35:00,16,,,
200701KD50322,550640,189750,0.173009,51.586421,1,3,3,3,06/03/2007,3,14:57,15,E09000016,3,12,6,30,6,2,3,125,0,0,1,1,1,0,0,1,1,E01002340,2025-12-09 14:57:00,14,2007-06-03,Sunday,6.0
200701KD50325,550460,183000,0.167527,51.52582,1,3,2,1,18/05/2007,6,14:15,15,E09000016,3,1306,6,30,3,4,6,0,0,0,1,1,1,0,0,1,1,E01002368,2025-12-09 14:15:00,14,,,
200701KD62101,550100,189200,0.164985,51.581623,1,3,2,2,30/04/2007,2,19:12,15,E09000016,3,12,3,50,6,2,5,0,0,5,1,1,1,0,0,1,1,E01002244,2025-12-09 19:12:00,19,,,
200701KD62324,555920,189050,0.24885,51.578697,1,3,2,1,29/05/2007,3,13:35,15,E09000016,3,127,3,50,0,-1,-1,0,0,0,1,2,2,4,3,2,1,E01002296,2025-12-09 13:35:00,13,,,
200701KD62327,553420,190540,0.21345,51.59277,1,3,2,1,28/05/2007,2,12:22,15,E09000016,3,12,1,30,9,4,3,12,0,0,1,2,2,0,0,1,1,E01002310,2025-12-09 12:22:00,12,,,
200701KD62513,552110,181370,0.19059,51.510732,1,3,2,1,29/05/2007,3,17:09,15,E09000016,3,13,3,70,0,-1,-1,0,0,0,1,1,1,0,0,2,1,E01002344,2025-12-09 17:09:00,17,,,
200701KD62822,551680,181540,0.184472,51.512375,1,3,1,1,12/05/2007,7,16:00,15,E09000016,5,0,3,70,0,-1,-1,0,0,0,1,4,2,0,0,2,1,E01002344,2025-12-09 16:00:00,16,2007-12-05,Wednesday,12.0
200701KD62872,552100,182120,0.19077,51.517474,1,3,2,2,29/05/2007,3,17:09,15,E09000016,4,1335,3,70,9,4,4,1335,0,0,1,2,2,0,0,1,1,E01002345,2025-12-09 17:09:00,17,,,
200701KD62896,556250,186580,0.252512,51.556414,1,2,1,1,29/05/2007,3,12:10,15,E09000016,4,187,6,30,3,4,6,0,0,0,1,2,2,0,0,1,1,E01002386,2025-12-09 12:10:00,12,,,
200701KD62904,556160,190350,0.252889,51.59031,1,3,2,1,30/05/2007,4,12:59,15,E09000016,5,0,6,40,3,4,5,0,0,0,1,2,2,0,0,2,1,E01002296,2025-12-09 12:59:00,12,,,
200701KD62944,549420,190990,0.15594,51.597887,1,3,2,1,30/05/2007,4,17:56,15,E09000016,4,174,6,30,3,4,5,0,0,0,1,1,1,0,0,1,1,E01002326,2025-12-09 17:56:00,17,,,
200701KD62952,550630,182950,0.169954,51.525325,1,3,3,1,30/05/2007,4,18:38,15,E09000016,3,1306,3,40,9,2,5,0,0,0,1,1,1,0,0,1,1,E01002368,2025-12-09 18:38:00,18,,,
200701KD62962,554820,180320,0.229151,51.500563,1,3,2,4,29/05/2007,3,14:50,15,E09000016,3,1306,1,60,1,4,3,13,0,0,1,2,2,0,0,2,2,E01015924,2025-12-09 14:50:00,14,,,
200701KD62972,549900,189780,0.162348,51.586888,1,3,1,1,29/05/2007,3,11:00,15,E09000016,5,0,6,30,3,4,6,0,0,0,1,8,2,0,0,1,1,E01002329,2025-12-09 11:00:00,11,,,
200701KD62975,553340,190920,0.212462,51.596206,1,3,1,1,28/05/2007,2,12:04,15,E09000016,5,0,1,30,2,4,5,0,0,0,1,2,2,0,0,1,1,E01002310,2025-12-09 12:04:00,12,,,
200701KD62996,553800,191210,0.219225,51.598686,1,3,2,1,29/05/2007,3,13:10,15,E09000016,6,0,6,30,3,4,6,0,0,0,1,5,2,0,0,1,1,E01002316,2025-12-09 13:10:00,13,,,
200701KD63047,553290,189960,0.211322,51.587594,1,3,1,1,18/06/2007,2,23:00,15,E09000016,5,0,6,30,3,4,6,0,0,0,4,1,1,0,2,1,1,E01002383,2025-12-09 23:00:00,23,,,
200701KD63067,556750,192410,0.262319,51.608655,1,2,1,1,05/06/2007,3,21:43,15,E09000016,3,12,7,70,0,-1,-1,0,0,0,4,1,1,0,0,2,1,E01002277,2025-12-09 21:43:00,21,2007-05-06,Sunday,5.0
200701KD63079,554680,191200,0.231916,51.598355,1,2,4,2,28/06/2007,5,18:03,15,E09000016,3,12,6,30,9,4,5,0,0,0,1,1,1,0,0,1,1,E01002299,2025-12-09 18:03:00,18,,,
200701KD63096,554200,189920,0.224429,51.586986,1,3,2,1,14/06/2007,5,16:40,15,E09000016,3,127,6,30,3,4,3,127,0,0,1,1,1,0,0,1,2,E01002295,2025-12-09 16:40:00,16,,,
200701KD63134,551380,184060,0.181234,51.535098,1,3,1,1,08/06/2007,6,03:10,15,E09000016,6,0,6,30,3,4,6,0,0,0,4,1,2,0,0,1,1,E01002375,2025-12-09 03:10:00,3,2007-08-06,Monday,8.0
200701KD63205,553370,182320,0.209146,51.518928,1,3,2,2,29/06/2007,6,10:03,15,E09000016,3,1306,6,50,0,-1,-1,0,0,0,1,1,1,0,0,1,1,E01002344,2025-12-09 10:03:00,10,,,
200701KD63222,552000,183400,0.189881,51.529002,1,3,2,2,29/06/2007,6,13:38,15,E09000016,3,125,6,30,6,2,3,125,0,4,1,8,2,0,0,1,1,E01002374,2025-12-09 13:38:00,13,,,
200701KD63225,550630,189730,0.172856,51.586244,1,3,2,1,07/06/2007,5,21:17,15,E09000016,3,125,3,30,6,2,3,12,0,5,4,1,1,0,0,1,1,E01002340,2025-12-09 21:17:00,21,2007-07-06,Friday,7.0
200701KD63238,550920,187940,0.17627,51.570083,1,3,2,1,27/06/2007,4,08:20,15,E09000016,5,0,6,30,0,-1,-1,0,0,0,1,1,1,0,0,1,2,E01002249,2025-12-09 08:20:00,8,,,
200701KD63261,558210,189030,0.281863,51.57788,1,3,2,1,18/06/2007,2,16:30,15,E09000016,1,25,3,70,0,-1,-1,0,0,0,7,1,1,0,0,2,2,E01002259,2025-12-09 16:30:00,16,,,
200701KD63288,555360,186760,0.239763,51.558277,1,3,2,1,08/06/2007,6,12:55,15,E09000016,3,124,6,30,3,4,6,0,0,0,1,1,1,0,0,1,1,E01002386,2025-12-09 12:55:00,12,2007-08-06,Monday,8.0
200701KD63308,552670,187420,0.201276,51.564941,1,3,2,1,16/06/2007,7,16:45,15,E09000016,3,124,6,30,3,4,6,0,0,0,1,1,1,0,0,1,1,E01002321,2025-12-09 16:45:00,16,,,
200701KD63361,554460,191320,0.228795,51.599494,1,3,2,1,24/06/2007,1,19:15,15,E09000016,6,0,9,30,0,-1,-1,0,0,0,1,2,2,0,0,1,2,E01002297,2025-12-09 19:15:00,19,,,
200701KD63398,551960,188200,0.191377,51.57214,1,3,2,1,17/06/2007,1,21:10,15,E09000016,5,0,1,30,1,4,5,0,0,0,1,1,1,0,0,1,2,E01002351,2025-12-09 21:10:00,21,,,
200701KD63401,550990,189000,0.177735,51.579589,1,3,2,1,11/06/2007,2,16:20,15,E09000016,3,118,6,30,0,-1,-1,0,0,0,1,1,1,0,0,1,2,E01002243,2025-12-09 16:20:00,16,2007-11-06,Tuesday,11.0
200701KD63402,553940,189700,0.220583,51.585081,1,3,2,1,24/06/2007,1,10:30,15,E09000016,5,0,9,30,0,-1,-1,0,0,0,1,9,1,0,0,1,2,E01002377,2025-12-09 10:30:00,10,,,
200701KD63469,550980,188670,0.177449,51.576626,1,3,1,1,05/06/2007,3,12:55,15,E09000016,3,118,3,30,9,4,3,125,0,0,1,1,1,0,0,1,1,E01002356,2025-12-09 12:55:00,12,2007-05-06,Sunday,5.0
200701KD63476,553960,186180,0.21933,51.553449,1,3,2,2,13/06/2007,4,15:05,15,E09000016,5,0,6,30,3,4,6,0,0,0,1,1,1,0,0,1,2,E01002291,2025-12-09 15:05:00,15,,,
200701KD63477,551810,183600,0.187231,51.53085,1,3,1,1,28/06/2007,5,10:40,15,E09000016,3,125,6,30,6,4,6,0,0,1,1,1,1,0,0,1,1,E01002373,2025-12-09 10:40:00,10,,,
200701KD63484,551990,189540,0.192389,51.584172,1,3,2,1,28/06/2007,5,18:05,15,E09000016,3,118,9,30,0,-1,-1,0,0,0,1,4,1,0,0,1,2,E01002354,2025-12-09 18:05:00,18,,,
200701KD63486,551310,189130,0.182405,51.580671,1,3,2,1,25/06/2007,2,17:52,15,E09000016,6,0,3,30,0,-1,-1,0,0,0,1,2,2,0,0,1,1,E01002353,2025-12-09 17:52:00,17,,,
200701KD63488,550100,189220,0.164994,51.581803,1,3,2,3,29/06/2007,6,15:00,15,E09000016,5,0,3,40,0,-1,-1,0,0,0,1,1,1,0,0,1,1,E01002329,2025-12-09 15:00:00,15,,,
200701KD63496,553610,190320,0.216095,51.590741,1,3,3,2,18/06/2007,2,16:21,15,E09000016,3,127,3,40,0,-1,-1,0,0,0,1,1,1,0,1,1,1,E01002383,2025-12-09 16:21:00,16,,,
200701KD63497,550300,190080,0.168246,51.589477,1,3,1,1,16/06/2007,7,10:51,15,E09000016,4,174,6,30,0,-1,-1,0,0,0,1,1,1,0,0,1,1,E01002338,2025-12-09 10:51:00,10,,,
200701KD63522,553280,186820,0.209808,51.559384,1,2,2,1,07/06/2007,5,08:52,15,E09000016,5,0,6,30,3,4,6,0,0,1,1,1,1,0,0,1,1,E01002363,2025-12-09 08:52:00,8,2007-07-06,Friday,7.0
200701KD63534,552640,185900,0.200184,51.551292,1,3,2,2,29/06/2007,6,16:20,15,E09000016,5,0,6,30,3,4,6,0,0,0,1,1,1,0,0,1,1,E01002365,2025-12-09 16:20:00,16,,,
200701KD63549,553110,184800,0.206479,51.541281,1,2,2,1,26/06/2007,3,17:32,15,E09000016,5,0,6,30,3,4,6,0,0,0,1,1,1,0,0,1,1,E01002265,2025-12-09 17:32:00,17,,,
200701KD63583,553980,187160,0.220047,51.562249,1,3,2,1,18/06/2007,2,23:45,15,E09000016,3,124,6,30,3,4,3,124,0,0,4,1,1,0,0,1,2,E01002361,2025-12-09 23:45:00,23,,,
200701KD63589,553400,190550,0.213166,51.592865,1,3,2,3,30/06/2007,7,15:20,15,E09000016,3,12,1,70,0,-1,-1,0,0,0,1,9,1,0,0,1,2,E01002310,2025-12-09 15:20:00,15,,,
200701KD63614,550230,190100,0.167245,51.589675,1,3,1,1,08/06/2007,6,18:10,15,E09000016,4,174,6,30,0,-1,-1,0,0,4,1,1,1,0,0,1,1,E01002328,2025-12-09 18:10:00,18,2007-08-06,Monday,8.0
200701KD63645,553130,182480,0.205759,51.52043,1,3,2,1,26/06/2007,3,08:25,15,E09000016,5,0,6,30,9,4,5,0,0,0,1,1,1,0,0,1,2,E01002342,2025-12-09 08:25:00,8,,,
200701KD63666,554980,187320,0.234533,51.563412,1,3,1,1,09/06/2007,7,16:17,15,E09000016,5,0,6,30,9,2,6,0,0,4,1,1,1,0,0,1,1,E01002273,2025-12-09 16:17:00,16,2007-09-06,Thursday,9.0
200701KD63693,553930,191940,0.221421,51.605209,1,2,1,1,04/06/2007,2,17:45,15,E09000016,6,0,6,30,9,4,6,0,0,0,1,9,1,0,0,1,2,E01002282,2025-12-09 17:45:00,17,2007-04-06,Friday,4.0
200701KD63710,551750,189360,0.18885,51.582619,1,3,2,1,02/06/2007,7,23:10,15,E09000016,3,118,6,30,9,3,5,0,0,0,4,1,1,0,0,1,1,E01002354,2025-12-09 23:10:00,23,2007-02-06,Tuesday,2.0
200701KD63726,551470,183130,0.182131,51.526718,1,3,2,2,04/06/2007,2,09:15,15,E09000016,6,0,6,30,3,4,6,0,0,0,1,1,1,0,0,1,1,E01002371,2025-12-09 09:15:00,9,2007-04-06,Friday,4.0
200701KD63730,553100,188380,0.207893,51.573449,1,3,2,2,26/06/2007,3,10:07,15,E09000016,6,0,6,30,6,4,6,0,0,0,1,1,1,0,0,1,1,E01002272,2025-12-09 10:07:00,10,,,
200701KD63739,552100,187850,0.193244,51.568958,1,3,1,1,03/06/2007,1,15:10,15,E09000016,5,0,6,30,0,-1,-1,0,0,0,1,1,1,0,0,1,1,E01002351,2025-12-09 15:10:00,15,2007-03-06,Tuesday,3.0
200701KD63745,551750,188420,0.188444,51.574174,1,2,2,1,08/06/2007,6,17:03,15,E09000016,6,0,6,30,3,3,6,0,0,0,1,1,1,5,0,1,1,E01002358,2025-12-09 17:03:00,17,2007-08-06,Monday,8.0
200701KD63746,552070,181370,0.190014,51.510743,1,3,1,1,22/06/2007,6,13:30,15,E09000016,3,13,3,70,0,-1,-1,0,0,0,1,1,1,0,2,2,1,E01002344,2025-12-09 13:30:00,13,,,
200701KD63747,554620,186680,0.229062,51.557761,1,3,2,1,26/06/2007,3,12:50,15,E09000016,5,0,6,30,3,4,6,0,0,0,1,1,1,0,0,1,1,E01002360,2025-12-09 12:50:00,12,,,
200701KD63748,551210,188090,0.180516,51.571354,1,2,1,1,23/06/2007,7,22:00,15,E09000016,3,125,1,30,1,4,3,125,0,0,1,1,1,0,0,1,2,E01002249,2025-12-09 22:00:00,22,,,
200701KD63755,556030,186550,0.249327,51.556205,1,3,2,1,16/06/2007,7,11:00,15,E09000016,3,124,6,30,6,2,4,1421,0,5,1,2,2,0,0,1,1,E01002386,2025-12-09 11:00:00,11,,,
200701KD63770,550620,189760,0.172725,51.586516,1,3,2,1,13/06/2007,4,02:40,15,E09000016,3,12,3,50,6,2,3,12,0,0,4,1,1,0,0,1,1,E01002338,2025-12-09 02:40:00,2,,,
200701KD63771,556530,188730,0.257504,51.575653,1,3,2,1,07/06/2007,5,11:52,15,E09000016,5,0,6,30,3,2,6,0,0,0,1,1,1,4,0,2,1,E01002253,2025-12-09 11:52:00,11,2007-07-06,Friday,7.0
200701KD63793,555360,186760,0.239763,51.558277,1,3,1,1,06/06/2007,4,12:30,15,E09000016,3,124,6,30,0,-1,-1,0,0,5,1,1,1,0,0,1,1,E01002386,2025-12-09 12:30:00,12,2007-06-06,Wednesday,6.0
200701KD63794,549420,190990,0.15594,51.597887,1,3,2,1,18/06/2007,2,08:15,15,E09000016,5,0,6,30,3,4,5,0,0,0,1,2,2,0,0,1,1,E01002326,2025-12-09 08:15:00,8,,,
200701KD63819,553480,187210,0.212861,51.562834,1,3,2,2,17/06/2007,1,13:15,15,E09000016,3,124,6,30,0,-1,-1,0,0,1,1,1,1,0,0,1,2,E01002361,2025-12-09 13:15:00,13,,,
200701KD63820,553410,190530,0.213301,51.592683,1,3,1,2,04/06/2007,2,16:42,15,E09000016,3,12,1,30,1,4,3,12,0,0,1,1,1,0,0,1,2,E01002293,2025-12-09 16:42:00,16,2007-04-06,Friday,4.0
200701KD63825,553930,191320,0.221149,51.599639,1,3,1,1,18/06/2007,2,10:20,15,E09000016,6,0,6,30,3,4,6,0,0,0,1,1,1,0,0,1,2,E01002316,2025-12-09 10:20:00,10,,,
200701KD63837,551050,189800,0.178944,51.586761,1,3,1,1,05/06/2007,3,20:15,15,E09000016,6,0,6,30,0,-1,-1,0,0,0,1,1,1,0,0,1,1,E01002340,2025-12-09 20:15:00,20,2007-05-06,Sunday,5.0
200701KD63856,551660,189290,0.187522,51.582015,1,3,3,1,16/06/2007,7,13:30,15,E09000016,6,0,6,30,3,4,3,118,0,0,1,1,1,0,0,1,2,E01002353,2025-12-09 13:30:00,13,,,
200701KD63873,560440,187520,0.313329,51.563684,1,2,1,1,04/06/2007,2,18:15,15,E09000016,5,0,6,60,0,-1,-1,0,0,0,1,1,1,0,0,2,1,E01002391,2025-12-09 18:15:00,18,2007-04-06,Friday,4.0
200701KD63902,556270,189110,0.253924,51.579139,1,3,2,2,26/06/2007,3,08:32,15,E09000016,5,0,7,60,6,4,6,0,0,0,1,1,1,0,0,2,1,E01002296,2025-12-09 08:32:00,8,,,
200701KD63903,553890,187200,0.218767,51.562632,1,3,2,1,29/06/2007,6,11:25,15,E09000016,3,124,6,30,0,-1,-1,0,0,0,1,1,1,0,0,1,1,E01002361,2025-12-09 11:25:00,11,,,
200701KD63955,551990,189570,0.192402,51.584442,1,3,2,1,19/06/2007,3,14:30,15,E09000016,3,118,6,30,0,-1,-1,0,0,0,1,1,1,0,0,1,1,E01002337,2025-12-09 14:30:00,14,,,
200701KD63984,550820,189360,0.175438,51.582869,1,3,2,2,24/06/2007,1,20:21,15,E09000016,3,125,6,30,0,-1,-1,0,0,0,1,2,2,0,0,1,1,E01002243,2025-12-09 20:21:00,20,,,
200701KD64203,551460,188160,0.184151,51.571915,1,3,2,1,29/05/2007,3,19:40,15,E09000016,5,0,6,30,6,2,5,0,0,0,1,1,1,0,0,1,1,E01002350,2025-12-09 19:40:00,19,,,
200701KD64307,550740,189450,0.174322,51.583699,1,1,1,2,27/06/2007,4,10:30,15,E09000016,3,125,6,30,7,4,6,0,0,0,1,1,1,0,0,1,1,E01002243,2025-12-09 10:30:00,10,,,
200701KD64375,551220,190420,0.181663,51.592286,1,2,2,1,20/06/2007,4,23:15,15,E09000016,3,12,3,50,6,2,5,0,0,0,4,1,2,0,0,1,1,E01002334,2025-12-09 23:15:00,23,,,
200701KD64401,556000,186550,0.248895,51.556213,1,2,1,1,16/06/2007,7,17:45,15,E09000016,4,1421,6,30,6,2,4,1421,0,0,1,1,1,0,0,1,2,E01002386,2025-12-09 17:45:00,17,,,
200701KD64415,550640,187380,0.171993,51.565127,1,2,2,1,27/06/2007,4,16:43,15,E09000016,3,124,9,30,0,-1,-1,0,0,0,1,9,1,0,0,1,1,E01002248,2025-12-09 16:43:00,16,,,
200701KD64505,558450,188390,0.285035,51.572062,1,3,3,2,04/07/2007,4,13:19,15,E09000016,1,25,3,70,0,-1,-1,0,0,0,1,1,1,0,0,2,1,E01002252,2025-12-09 13:19:00,13,2007-04-07,Saturday,4.0
200701KD64507,556760,192400,0.262459,51.608562,1,3,1,1,02/07/2007,2,22:57,15,E09000016,1,25,3,70,0,-1,-1,0,0,0,7,2,1,0,0,2,1,E01002277,2025-12-09 22:57:00,22,2007-02-07,Wednesday,2.0
200701KD64509,552070,189600,0.193569,51.58469,1,3,2,1,16/07/2007,2,17:20,15,E09000016,3,118,6,30,0,-1,-1,0,0,0,1,1,1,0,0,1,1,E01002354,2025-12-09 17:20:00,17,,,
200701KD64510,555380,193810,0.243171,51.621613,1,3,1,1,15/07/2007,1,02:35,15,E09000016,1,25,3,70,0,-1,-1,0,0,0,4,1,1,0,0,2,1,E01021468,2025-12-09 02:35:00,2,,,
200701KD64536,553960,187830,0.220052,51.568274,1,3,1,1,06/07/2007,6,21:15,15,E09000016,5,0,6,30,0,-1,-1,0,0,5,1,1,1,0,0,1,1,E01002367,2025-12-09 21:15:00,21,2007-06-07,Thursday,6.0
200701KD64555,550930,188610,0.176702,51.576101,1,3,2,1,20/07/2007,6,12:55,15,E09000016,3,118,6,30,1,4,6,0,0,0,1,2,2,0,0,1,2,E01002247,2025-12-09 12:55:00,12,,,
200701KD64563,553400,190560,0.21317,51.592955,1,3,2,1,19/07/2007,5,17:12,15,E09000016,3,12,1,30,1,4,3,127,0,0,1,1,1,0,0,1,1,E01002310,2025-12-09 17:12:00,17,,,
200701KD64626,556620,192540,0.260501,51.609859,1,3,3,1,15/07/2007,1,10:30,15,E09000016,1,25,9,70,0,-1,-1,0,0,0,1,9,1,0,0,2,2,E01002277,2025-12-09 10:30:00,10,,,
200701KD64629,549520,192210,0.157902,51.608823,1,3,3,2,21/07/2007,7,17:56,15,E09000016,6,0,9,30,0,-1,-1,0,0,0,1,1,1,0,0,1,1,E01002305,2025-12-09 17:56:00,17,,,
200701KD64634,552000,183400,0.189881,51.529002,1,3,2,1,12/07/2007,5,23:15,15,E09000016,3,125,6,30,6,2,3,125,0,0,7,1,1,0,0,1,2,E01002374,2025-12-09 23:15:00,23,2007-12-07,Friday,12.0
200701KD64639,550740,187420,0.173452,51.565459,1,3,2,1,19/07/2007,5,00:05,15,E09000016,3,124,6,30,0,-1,-1,0,0,0,4,1,1,0,0,1,1,E01002248,2025-12-09 00:05:00,0,,,
200701KD64640,558690,187880,0.288265,51.567413,1,3,2,1,07/07/2007,7,13:45,15,E09000016,1,25,9,70,0,-1,-1,0,0,0,1,1,1,0,0,2,1,E01002252,2025-12-09 13:45:00,13,2007-07-07,Saturday,7.0
200701KD64651,550400,187880,0.168747,51.569683,1,3,2,1,04/07/2007,4,16:30,15,E09000016,6,0,6,30,0,-1,-1,0,0,0,1,1,1,0,0,1,2,E01002247,2025-12-09 16:30:00,16,2007-04-07,Saturday,4.0
200701KD64666,551430,188400,0.183821,51.57408,1,3,1,1,17/07/2007,3,07:44,15,E09000016,5,0,6,30,0,-1,-1,0,0,1,1,1,1,0,0,1,1,E01002356,2025-12-09 07:44:00,7,,,
200701KD64712,554360,180280,0.222511,51.500329,1,3,2,1,31/07/2007,3,21:30,15,E09000016,3,13,3,70,0,-1,-1,0,0,0,4,1,1,0,0,2,2,E01002344,2025-12-09 21:30:00,21,,,
200701KD64765,554490,186970,0.227315,51.560402,1,2,1,1,25/07/2007,4,20:28,15,E09000016,3,124,6,30,3,4,6,0,0,4,4,1,1,0,0,1,1,E01002360,2025-12-09 20:28:00,20,,,
200701KD64772,553110,186170,0.207075,51.55359,1,3,1,1,28/07/2007,7,22:50,15,E09000016,5,0,6,30,3,4,5,0,0,1,4,2,2,0,0,1,1,E01002366,2025-12-09 22:50:00,22,,,
200701KD64821,553950,190810,0.221214,51.595051,1,3,2,1,23/07/2007,2,00:27,15,E09000016,3,12,3,50,0,-1,-1,0,0,0,4,1,1,0,0,1,1,E01002310,2025-12-09 00:27:00,0,,,
200701KD64900,553450,182240,0.210264,51.518187,1,3,2,1,17/07/2007,3,09:10,15,E09000016,3,1306,3,30,6,4,6,0,0,0,1,1,1,0,0,1,2,E01002344,2025-12-09 09:10:00,9,,,
200701KD64932,550100,189200,0.164985,51.581623,1,3,1,1,19/07/2007,5,07:05,15,E09000016,3,12,3,40,0,-1,-1,0,0,5,1,1,1,4,0,1,1,E01002244,2025-12-09 07:05:00,7,,,
200701KD65034,553120,182480,0.205615,51.520433,1,1,2,3,03/07/2007,3,17:09,15,E09000016,3,1306,6,50,6,2,5,0,0,5,1,4,1,0,0,1,1,E01002342,2025-12-09 17:09:00,17,2007-03-07,Wednesday,3.0
200701KD65056,552030,182260,0.189822,51.518751,1,3,2,1,09/07/2007,2,20:13,15,E09000016,4,1335,6,30,0,-1,-1,0,0,0,1,5,2,0,0,1,1,E01002345,2025-12-09 20:13:00,20,2007-09-07,Friday,9.0
200701KD65109,556500,188170,0.256822,51.57063,1,3,2,1,27/07/2007,6,17:05,15,E09000016,5,0,6,30,0,-1,-1,0,0,0,1,1,1,0,0,2,2,E01002253,2025-12-09 17:05:00,17,,,
200701KD65136,552340,188460,0.196969,51.574374,1,2,3,2,26/07/2007,5,18:30,15,E09000016,6,0,6,30,0,-1,-1,0,0,0,1,8,2,0,0,1,2,E01002352,2025-12-09 18:30:00,18,,,
200701KD65140,554360,191850,0.227585,51.604283,1,2,1,2,25/07/2007,4,17:48,15,E09000016,5,0,6,40,0,-1,-1,0,0,0,1,1,1,0,0,1,1,E01002299,2025-12-09 17:48:00,17,,,
200701KD65142,553320,192640,0.212925,51.611665,1,3,2,1,16/07/2007,2,14:08,15,E09000016,6,0,6,30,9,1,6,0,0,0,1,1,1,0,0,1,1,E01002313,2025-12-09 14:08:00,14,,,
200701KD65165,558450,188370,0.285026,51.571882,1,3,1,3,28/07/2007,7,17:48,15,E09000016,1,25,3,70,0,-1,-1,0,0,0,1,1,1,0,0,2,1,E01002252,2025-12-09 17:48:00,17,,,
200701KD65179,551450,188160,0.184006,51.571918,1,3,2,1,19/07/2007,5,19:20,15,E09000016,5,0,9,30,0,-1,-1,0,0,0,4,9,1,0,0,1,2,E01002356,2025-12-09 19:20:00,19,,,
200701KD65191,551030,188520,0.178105,51.575265,1,3,2,1,07/07/2007,7,02:27,15,E09000016,3,125,3,30,9,2,6,0,0,5,4,1,1,0,0,1,1,E01002356,2025-12-09 02:27:00,2,2007-07-07,Saturday,7.0
200701KD65194,553690,187190,0.21588,51.562597,1,3,1,1,12/07/2007,5,15:15,15,E09000016,3,124,6,30,3,4,6,0,0,0,1,1,1,0,0,1,1,E01002361,2025-12-09 15:15:00,15,2007-12-07,Friday,12.0
200701KD65205,551660,181500,0.184166,51.512021,1,3,1,1,03/07/2007,3,15:53,15,E09000016,3,13,3,60,9,4,5,0,0,0,1,1,1,0,0,2,1,E01002344,2025-12-09 15:53:00,15,2007-03-07,Wednesday,3.0
200701KD65228,556320,187540,0.253947,51.565019,1,3,1,1,01/07/2007,1,21:10,15,E09000016,5,0,6,40,0,-1,-1,0,0,0,4,1,1,0,0,1,1,E01002257,2025-12-09 21:10:00,21,2007-01-07,Sunday,1.0
200701KD65239,553450,190550,0.213887,51.592851,1,3,2,1,03/07/2007,3,11:30,15,E09000016,3,12,3,60,1,4,3,12,0,5,1,1,1,0,0,1,1,E01002310,2025-12-09 11:30:00,11,2007-03-07,Wednesday,3.0
200701KD65251,557310,186720,0.267852,51.557377,1,3,2,1,05/07/2007,5,13:00,15,E09000016,4,187,6,30,3,4,6,0,1,0,1,1,1,0,0,1,1,E01002391,2025-12-09 13:00:00,13,2007-05-07,Monday,5.0
200701KD65272,553000,182550,0.203917,51.521095,1,2,1,3,29/07/2007,1,00:17,15,E09000016,3,1306,6,40,3,4,6,0,0,0,5,2,2,0,0,1,1,E01002342,2025-12-09 00:17:00,0,,,
200701KD65279,552960,191330,0.207159,51.599993,1,3,1,1,26/07/2007,5,08:26,15,E09000016,6,0,6,30,0,-1,-1,0,0,0,1,1,1,0,0,1,2,E01002315,2025-12-09 08:26:00,8,,,
200701KD65287,557930,186670,0.276766,51.556755,1,3,1,1,01/07/2007,1,12:15,15,E09000016,6,0,6,60,0,-1,-1,0,0,0,1,1,1,0,3,2,2,E01002391,2025-12-09 12:15:00,12,2007-01-07,Sunday,1.0
200701KD65296,552000,183400,0.189881,51.529002,1,3,2,1,04/07/2007,4,23:25,15,E09000016,3,125,6,30,6,2,3,125,0,5,4,1,1,0,0,1,1,E01002374,2025-12-09 23:25:00,23,2007-04-07,Saturday,4.0
200701KD65305,558310,188710,0.283161,51.574976,1,3,3,1,25/07/2007,4,17:57,15,E09000016,1,25,3,70,5,4,6,0,0,0,1,1,1,0,0,2,1,E01002259,2025-12-09 17:57:00,17,,,
200701KD65344,554190,189920,0.224285,51.586989,1,2,2,3,19/07/2007,5,16:05,15,E09000016,3,127,3,40,7,2,3,127,0,7,1,1,1,0,0,1,1,E01002295,2025-12-09 16:05:00,16,,,
200701KD65495,553080,187290,0.20713,51.563661,1,3,3,2,24/07/2007,3,17:04,15,E09000016,3,124,6,30,3,4,6,0,0,1,1,1,1,0,0,1,1,E01002321,2025-12-09 17:04:00,17,,,
200701KD65603,550040,191510,0.165107,51.602395,1,3,3,2,20/07/2007,6,13:04,15,E09000016,6,0,6,30,0,-1,-1,0,1,1,1,2,2,0,0,1,1,E01002302,2025-12-09 13:04:00,13,,,
200701KD65630,552050,182610,0.190261,51.52189,1,3,1,1,19/07/2007,5,00:02,15,E09000016,3,1306,1,60,1,4,4,1335,0,0,4,1,1,0,0,2,1,E01002370,2025-12-09 00:02:00,0,,,
200701KD65640,550070,189350,0.164617,51.582979,1,3,2,2,31/07/2007,3,17:38,15,E09000016,5,0,6,30,0,-1,-1,0,0,0,1,1,1,0,0,1,1,E01002329,2025-12-09 17:38:00,17,,,
200701KD65652,549220,190950,0.153037,51.597581,1,3,3,1,24/07/2007,3,18:45,15,E09000016,4,174,6,30,9,4,5,0,0,0,1,1,1,0,0,1,2,E01002325,2025-12-09 18:45:00,18,,,
200701KD65654,550760,189480,0.174624,51.583963,1,3,1,1,14/07/2007,7,01:15,15,E09000016,3,125,6,30,0,-1,-1,0,0,0,7,1,1,0,0,1,2,E01002340,2025-12-09 01:15:00,1,,,
200701KD65706,552490,181310,0.196036,51.510091,1,1,2,1,31/07/2007,3,14:25,15,E09000016,3,13,3,70,0,-1,-1,0,0,0,1,1,1,4,0,2,1,E01002344,2025-12-09 14:25:00,14,,,
200701KD65724,549450,188310,0.155232,51.573799,1,3,2,1,12/07/2007,5,15:09,15,E09000016,3,118,6,30,3,4,6,0,0,0,1,1,1,0,0,1,1,E01002250,2025-12-09 15:09:00,15,2007-12-07,Friday,12.0
200701KD65730,551420,188140,0.183565,51.571747,1,2,2,2,13/07/2007,6,23:45,15,E09000016,5,0,3,30,7,2,5,0,0,5,4,1,2,0,0,1,1,E01002350,2025-12-09 23:45:00,23,,,
200701KD65901,553380,190800,0.212987,51.595117,1,3,2,1,01/07/2007,1,21:50,15,E09000016,5,0,6,30,3,4,6,0,0,0,7,1,1,0,0,1,1,E01002310,2025-12-09 21:50:00,21,2007-01-07,Sunday,1.0
200701KD65903,552010,187420,0.191761,51.565119,1,3,2,1,12/07/2007,5,17:30,15,E09000016,3,124,6,30,0,-1,-1,0,0,0,1,1,1,0,0,1,2,E01002319,2025-12-09 17:30:00,17,2007-12-07,Friday,12.0
200701KD65922,553860,188260,0.218799,51.572165,1,2,2,2,01/08/2007,4,09:15,15,E09000016,5,0,9,30,0,-1,-1,0,0,0,1,9,1,0,0,1,1,E01002270,2025-12-09 09:15:00,9,2007-01-08,Monday,1.0
200701KD65926,554010,186460,0.220173,51.555951,1,3,3,1,13/08/2007,2,18:15,15,E09000016,3,124,6,30,0,-1,-1,0,0,1,1,1,1,0,0,1,2,E01002291,2025-12-09 18:15:00,18,,,
200701KD65961,556380,192890,0.257194,51.61307,1,3,2,1,01/08/2007,4,07:09,15,E09000016,1,25,3,70,0,-1,-1,0,0,0,1,1,1,0,0,2,1,E01002277,2025-12-09 07:09:00,7,2007-01-08,Monday,1.0
200701KD65975,551230,188780,0.181101,51.577548,1,3,1,1,21/08/2007,3,00:01,15,E09000016,6,0,2,20,0,-1,-1,0,0,0,4,1,1,0,0,1,1,E01002357,2025-12-09 00:01:00,0,,,
200701KD65982,555860,184310,0.245886,51.536126,1,3,2,1,27/08/2007,2,14:45,15,E09000016,5,0,6,50,0,-1,-1,0,0,0,1,1,1,0,0,2,2,E01002385,2025-12-09 14:45:00,14,,,
200701KD65983,552560,188450,0.200137,51.574225,1,3,2,3,22/08/2007,4,17:58,15,E09000016,5,0,6,30,0,-1,-1,0,0,1,1,9,1,0,0,1,2,E01002317,2025-12-09 17:58:00,17,,,
200701KD65984,551250,188640,0.181329,51.576285,1,3,1,1,20/08/2007,2,17:05,15,E09000016,6,0,6,30,6,4,6,0,0,0,1,1,1,0,0,1,1,E01002357,2025-12-09 17:05:00,17,,,
200701KD65986,551020,188570,0.177983,51.575717,1,2,1,1,11/08/2007,7,12:12,15,E09000016,3,125,9,30,0,-1,-1,0,0,4,1,1,1,1,0,1,1,E01002356,2025-12-09 12:12:00,12,2007-11-08,Thursday,11.0
200701KD66002,550850,189340,0.175862,51.582681,1,3,1,1,22/08/2007,4,08:50,15,E09000016,3,125,9,40,0,-1,-1,0,0,0,1,9,1,0,0,1,1,E01002353,2025-12-09 08:50:00,8,,,
200701KD66004,558320,188470,0.283197,51.572817,1,3,2,1,22/08/2007,4,20:30,15,E09000016,1,25,1,70,0,-1,-1,0,0,0,4,2,2,0,0,2,2,E01002259,2025-12-09 20:30:00,20,,,
200701KD66034,558380,188380,0.284022,51.571992,1,3,2,2,21/08/2007,3,11:50,15,E09000016,1,25,3,70,0,-1,-1,0,0,0,1,1,2,0,0,2,1,E01002252,2025-12-09 11:50:00,11,,,
200701KD66041,553060,186060,0.206307,51.552615,1,3,2,1,21/08/2007,3,19:57,15,E09000016,5,0,6,30,0,-1,-1,0,0,1,1,1,1,0,0,1,1,E01002366,2025-12-09 19:57:00,19,,,
200701KD66071,553190,190330,0.210041,51.590945,1,2,2,4,09/08/2007,5,17:15,15,E09000016,3,118,9,30,3,2,3,118,0,5,1,1,1,0,0,1,1,E01002383,2025-12-09 17:15:00,17,2007-09-08,Saturday,9.0
200701KD66084,551440,188330,0.183936,51.573448,1,3,1,1,29/08/2007,4,18:24,15,E09000016,5,0,6,30,3,4,6,0,0,0,1,1,1,0,2,1,1,E01002356,2025-12-09 18:24:00,18,,,
200701KD66093,555610,193620,0.246406,51.619842,1,3,3,1,23/08/2007,5,06:45,15,E09000016,1,25,3,70,0,-1,-1,0,0,0,1,2,2,0,0,2,1,E01002276,2025-12-09 06:45:00,6,,,
200701KD66097,551210,188090,0.180516,51.571354,1,3,1,1,29/08/2007,4,12:51,15,E09000016,5,0,6,30,0,-1,-1,0,0,0,1,1,1,0,0,1,1,E01002249,2025-12-09 12:51:00,12,,,
200701KD66133,551340,188420,0.182532,51.574284,1,2,1,1,24/08/2007,6,06:45,15,E09000016,6,0,6,30,0,-1,-1,0,0,0,1,1,1,0,0,1,1,E01002356,2025-12-09 06:45:00,6,,,
200701KD66154,552020,182420,0.189747,51.520191,1,3,2,1,10/08/2007,6,19:13,15,E09000016,6,0,6,30,0,-1,-1,0,0,0,1,1,1,0,0,1,1,E01002345,2025-12-09 19:13:00,19,2007-10-08,Monday,10.0
200701KD66157,553940,186180,0.219042,51.553454,1,3,2,1,23/08/2007,5,18:30,15,E09000016,5,0,6,30,3,4,6,0,0,0,1,1,1,0,0,1,1,E01002291,2025-12-09 18:30:00,18,,,
200701KD66178,550580,182370,0.168986,51.520127,1,3,2,1,30/08/2007,5,03:20,15,E09000016,3,13,3,70,9,4,5,0,0,0,4,1,1,0,0,1,1,,2025-12-09 03:20:00,3,,,
200701KD66180,553370,187040,0.211201,51.561336,1,3,2,2,11/08/2007,7,10:45,15,E09000016,5,0,9,30,0,-1,-1,0,0,0,1,9,1,0,0,1,1,E01002363,2025-12-09 10:45:00,10,2007-11-08,Thursday,11.0
200701KD66186,553160,187260,0.20827,51.56337,1,2,2,1,02/08/2007,5,06:55,15,E09000016,3,124,6,30,3,4,6,0,0,0,1,1,1,0,0,1,1,E01002321,2025-12-09 06:55:00,6,2007-02-08,Thursday,2.0
200701KD66215,551290,189110,0.182108,51.580497,1,3,2,2,09/08/2007,5,13:45,15,E09000016,3,118,3,30,0,-1,-1,0,0,0,1,1,1,0,2,1,2,E01002357,2025-12-09 13:45:00,13,2007-09-08,Saturday,9.0
200701KD66234,551850,188170,0.189778,51.5719,1,3,2,1,28/08/2007,3,13:35,15,E09000016,5,0,6,30,3,4,6,0,0,0,1,1,1,0,0,1,1,,2025-12-09 13:35:00,13,,,
200701KD66235,553410,190550,0.21331,51.592862,1,3,2,1,14/08/2007,3,13:30,15,E09000016,3,12,1,30,1,4,3,12,0,0,1,1,1,0,0,1,1,E01002310,2025-12-09 13:30:00,13,,,
200701KD66237,556810,192410,0.263185,51.608638,1,3,2,1,30/08/2007,5,14:30,15,E09000016,1,25,9,50,0,-1,-1,0,0,0,1,1,1,0,0,2,2,E01002296,2025-12-09 14:30:00,14,,,
200701KD66238,554690,191180,0.232052,51.598173,1,3,2,1,28/08/2007,3,15:00,15,E09000016,3,12,6,50,0,-1,-1,0,0,0,1,1,1,0,0,1,2,E01002299,2025-12-09 15:00:00,15,,,
200701KD66248,556790,192280,0.262838,51.607476,1,3,2,2,04/08/2007,7,10:53,15,E09000016,1,25,3,70,5,4,3,12,0,0,1,1,1,0,0,2,1,E01002296,2025-12-09 10:53:00,10,2007-04-08,Sunday,4.0
200701KD66261,556810,192410,0.263185,51.608638,1,3,2,1,05/08/2007,1,17:25,15,E09000016,1,25,3,70,0,-1,-1,0,0,0,1,1,1,0,0,2,1,E01002296,2025-12-09 17:25:00,17,2007-05-08,Tuesday,5.0
200701KD66262,551450,188160,0.184006,51.571918,1,3,2,2,02/08/2007,5,16:20,15,E09000016,5,0,6,30,6,2,5,0,0,5,1,1,1,1,0,1,1,E01002356,2025-12-09 16:20:00,16,2007-02-08,Thursday,2.0
200701KD66315,556250,189100,0.253631,51.579055,1,3,2,2,21/08/2007,3,09:47,15,E09000016,5,0,6,60,3,4,6,0,0,0,1,1,1,0,0,2,1,E01002296,2025-12-09 09:47:00,9,,,
200701KD66505,550920,187420,0.176047,51.565411,1,3,3,1,03/08/2007,6,16:05,15,E09000016,3,124,9,30,0,-1,-1,0,0,0,1,9,1,0,0,1,1,E01002248,2025-12-09 16:05:00,16,2007-03-08,Thursday,3.0
200701KD66580,550410,191330,0.170368,51.600679,1,3,1,2,10/08/2007,6,20:45,15,E09000016,4,1459,6,30,0,-1,-1,0,0,0,1,1,1,0,0,1,2,E01002301,2025-12-09 20:45:00,20,2007-10-08,Monday,10.0
200701KD66585,551230,190420,0.181807,51.592283,1,3,2,1,05/08/2007,1,11:00,15,E09000016,3,12,3,40,6,2,5,0,0,0,1,1,1,0,0,1,2,E01002334,2025-12-09 11:00:00,11,2007-05-08,Tuesday,5.0
200701KD66619,550470,183010,0.167675,51.525907,1,3,2,1,02/08/2007,5,14:15,15,E09000016,3,1306,9,30,0,-1,-1,0,0,0,1,9,1,0,0,1,2,E01002368,2025-12-09 14:15:00,14,2007-02-08,Thursday,2.0
200701KD66674,556380,187350,0.254728,51.563296,1,3,2,1,04/08/2007,7,18:40,15,E09000016,6,0,6,30,0,-1,-1,0,0,0,1,1,1,0,0,1,1,E01002257,2025-12-09 18:40:00,18,2007-04-08,Sunday,4.0
200701KD66684,552340,189060,0.197229,51.579765,1,3,3,1,06/08/2007,2,14:29,15,E09000016,6,0,9,30,0,-1,-1,0,0,0,1,9,1,0,0,1,1,E01002355,2025-12-09 14:29:00,14,2007-06-08,Friday,6.0
200701KD66706,555360,186440,0.239622,51.555401,1,3,2,1,21/08/2007,3,18:10,15,E09000016,6,0,9,30,3,4,6,0,0,0,1,9,1,0,0,1,1,E01002386,2025-12-09 18:10:00,18,,,
200701KD66708,558380,188380,0.284022,51.571992,1,3,2,1,08/08/2007,4,20:30,15,E09000016,1,25,1,70,0,-1,-1,0,0,0,4,1,1,0,0,2,1,E01002252,2025-12-09 20:30:00,20,2007-08-08,Wednesday,8.0
200701KD66746,550510,190070,0.171271,51.589331,1,3,2,1,12/08/2007,1,00:50,15,E09000016,4,174,6,30,0,-1,-1,0,0,0,4,1,1,0,0,1,1,E01002338,2025-12-09 00:50:00,0,2007-12-08,Saturday,12.0
200701KD66748,551310,189110,0.182397,51.580491,1,3,1,1,22/09/2007,7,11:16,15,E09000016,3,118,3,30,0,-1,-1,0,0,0,1,1,1,0,0,1,1,E01002357,2025-12-09 11:16:00,11,,,
200701KD66760,550280,188360,0.167222,51.574028,1,3,3,1,28/09/2007,6,19:25,15,E09000016,3,118,6,30,3,4,6,0,0,0,7,2,2,0,0,1,2,E01002247,2025-12-09 19:25:00,19,,,
200701KD66797,553450,190550,0.213887,51.592851,1,3,2,1,28/09/2007,6,12:50,15,E09000016,3,12,3,50,9,4,3,118,0,0,1,2,2,0,0,1,1,E01002310,2025-12-09 12:50:00,12,,,
200701KD66810,558350,188440,0.283616,51.572539,1,3,2,1,16/09/2007,1,10:36,15,E09000016,3,127,1,60,0,-1,-1,0,0,0,1,1,1,0,0,2,1,E01002252,2025-12-09 10:36:00,10,,,
200701KD66811,553480,187210,0.212861,51.562834,1,2,2,1,17/09/2007,2,14:40,15,E09000016,3,124,6,30,6,2,5,0,0,0,1,1,1,0,0,1,1,E01002361,2025-12-09 14:40:00,14,,,
200701KD66813,551680,188500,0.187469,51.574911,1,3,2,1,18/09/2007,3,21:13,15,E09000016,5,0,3,30,6,2,5,0,0,5,4,1,1,0,0,1,1,E01002358,2025-12-09 21:13:00,21,,,
200701KD66818,550300,190100,0.168255,51.589657,1,3,4,1,19/09/2007,4,09:41,15,E09000016,4,174,6,30,0,-1,-1,0,0,0,1,1,1,0,0,1,1,E01002338,2025-12-09 09:41:00,9,,,
200701KD66825,551420,189080,0.18397,51.580192,1,3,2,1,18/09/2007,3,13:50,15,E09000016,3,118,1,30,1,4,3,118,0,0,1,1,1,0,0,1,2,E01002357,2025-12-09 13:50:00,13,,,
200701KD66827,553280,192800,0.212418,51.613113,1,3,2,1,12/09/2007,4,15:50,15,E09000016,5,0,6,30,3,4,6,0,0,0,1,1,1,0,0,1,1,E01002312,2025-12-09 15:50:00,15,2007-12-09,Sunday,12.0
200701KD66828,558340,188430,0.283467,51.572452,1,3,2,1,11/09/2007,3,18:40,15,E09000016,3,127,9,70,0,-1,-1,0,0,0,1,9,1,0,0,2,2,E01002252,2025-12-09 18:40:00,18,2007-11-09,Friday,11.0
200701KD66830,554520,182850,0.22594,51.523377,1,3,2,1,11/09/2007,3,15:40,15,E09000016,5,0,6,30,0,-1,-1,0,0,0,1,1,1,0,0,1,1,E01002348,2025-12-09 15:40:00,15,2007-11-09,Friday,11.0
200701KD66831,550010,188410,0.16335,51.574549,1,3,2,1,04/09/2007,3,06:55,15,E09000016,3,118,6,30,0,-1,-1,0,0,0,1,1,1,0,0,1,2,E01002246,2025-12-09 06:55:00,6,2007-04-09,Monday,4.0
200701KD66847,554560,191390,0.230269,51.600095,1,3,1,1,16/09/2007,1,07:55,15,E09000016,5,0,6,30,3,4,6,0,0,0,1,1,1,0,0,1,1,E01002299,2025-12-09 07:55:00,7,,,
200701KD66856,550410,187300,0.168643,51.564469,1,2,1,1,26/09/2007,4,11:38,15,E09000016,3,124,1,30,1,4,6,0,0,8,1,1,1,0,0,1,1,E01002251,2025-12-09 11:38:00,11,,,
200701KD66880,555220,184140,0.23659,51.534775,1,3,2,2,10/09/2007,2,11:03,15,E09000016,6,0,9,60,0,-1,-1,0,0,0,1,1,2,0,0,2,1,E01002385,2025-12-09 11:03:00,11,2007-10-09,Tuesday,10.0
200701KD66887,554550,191380,0.23012,51.600008,1,3,2,1,28/09/2007,6,15:10,15,E09000016,5,0,6,30,3,4,6,0,0,0,1,9,2,0,0,1,2,E01002299,2025-12-09 15:10:00,15,,,
200701KD66898,557230,191330,0.268761,51.598818,1,3,2,1,18/09/2007,3,10:20,15,E09000016,1,25,3,70,0,-1,-1,0,0,0,1,1,1,0,0,2,1,E01002296,2025-12-09 10:20:00,10,,,
200701KD66911,551390,189050,0.183525,51.579931,1,2,1,1,29/09/2007,7,12:30,15,E09000016,6,0,9,30,9,1,6,0,0,0,1,1,1,0,0,1,1,E01002357,2025-12-09 12:30:00,12,,,
200701KD66919,553090,191870,0.20927,51.604809,1,3,2,1,14/09/2007,6,11:30,15,E09000016,5,0,6,30,3,4,5,0,0,0,1,1,1,0,0,1,2,E01002311,2025-12-09 11:30:00,11,,,
200701KD66920,558380,188380,0.284022,51.571992,1,3,2,1,15/09/2007,7,15:00,15,E09000016,1,25,9,70,9,4,3,127,0,0,1,1,1,0,0,2,1,E01002252,2025-12-09 15:00:00,15,,,
200701KD66924,551670,188520,0.187334,51.575094,1,3,1,1,15/09/2007,7,10:06,15,E09000016,5,0,9,30,0,-1,-1,0,0,0,1,9,1,0,0,1,1,E01002358,2025-12-09 10:06:00,10,,,
200701KD66927,553310,191010,0.212068,51.597023,1,3,2,1,20/09/2007,5,20:41,15,E09000016,5,0,6,30,3,4,6,0,0,0,6,1,1,0,0,1,1,E01002309,2025-12-09 20:41:00,20,,,
200701KD66939,553750,185920,0.21619,51.55117,1,3,2,1,11/09/2007,3,20:25,15,E09000016,6,0,6,30,0,-1,-1,0,0,0,4,1,1,0,0,1,1,E01002291,2025-12-09 20:25:00,20,2007-11-09,Friday,11.0
200701KD66944,550630,182950,0.169954,51.525325,1,3,2,3,06/09/2007,5,14:30,15,E09000016,3,1306,3,40,3,2,5,0,0,5,1,1,1,0,0,1,1,E01002368,2025-12-09 14:30:00,14,2007-06-09,Saturday,6.0
200701KD67025,551000,188680,0.177741,51.576711,1,3,2,3,15/09/2007,7,12:00,15,E09000016,3,125,2,30,1,4,3,125,0,0,1,1,1,0,0,1,1,E01002356,2025-12-09 12:00:00,12,,,
200701KD67031,549970,191300,0.164007,51.600527,1,1,1,1,22/09/2007,7,10:30,15,E09000016,6,0,6,30,0,-1,-1,0,0,0,1,1,1,0,0,1,1,E01002302,2025-12-09 10:30:00,10,,,
200701KD67039,553720,192180,0.218496,51.607423,1,2,1,1,20/09/2007,5,21:05,15,E09000016,5,0,6,30,3,4,6,0,0,1,4,1,1,0,0,1,1,E01002282,2025-12-09 21:05:00,21,,,
200701KD67090,552870,187400,0.20415,51.564707,1,3,2,5,02/09/2007,1,03:29,15,E09000016,3,124,6,30,9,4,6,0,0,0,4,1,1,0,0,1,1,E01002321,2025-12-09 03:29:00,3,2007-02-09,Friday,2.0
200701KD67109,553810,190980,0.219268,51.596617,1,3,2,1,14/09/2007,6,11:15,15,E09000016,6,0,6,30,8,4,6,0,0,0,1,1,1,0,0,1,2,E01002310,2025-12-09 11:15:00,11,,,
200701KD67143,553230,180820,0.206479,51.505488,1,3,2,1,21/09/2007,6,06:18,15,E09000016,3,13,3,70,0,-1,-1,0,0,0,1,1,1,0,0,2,1,E01002344,2025-12-09 06:18:00,6,,,
200701KD67160,556780,192290,0.262698,51.607568,1,3,2,1,07/09/2007,6,11:28,15,E09000016,1,25,1,30,1,2,3,12,0,0,1,1,1,0,0,2,1,E01002296,2025-12-09 11:28:00,11,2007-07-09,Monday,7.0
200701KD67163,552400,184090,0.195942,51.535094,1,2,1,1,01/09/2007,7,08:05,15,E09000016,5,0,6,30,3,4,6,0,0,0,1,1,1,0,0,1,1,E01002372,2025-12-09 08:05:00,8,2007-01-09,Tuesday,1.0
200701KD67168,553620,190620,0.21637,51.593434,1,1,1,1,11/09/2007,3,19:03,15,E09000016,3,12,3,50,0,-1,-1,0,0,0,1,1,1,0,0,1,1,E01002293,2025-12-09 19:03:00,19,2007-11-09,Friday,11.0
200701KD67169,551670,188560,0.187351,51.575453,1,2,2,2,10/09/2007,2,21:59,15,E09000016,5,0,9,30,9,2,5,0,0,5,4,1,1,0,0,1,1,E01002358,2025-12-09 21:59:00,21,2007-10-09,Tuesday,10.0
200701KD67170,554180,187080,0.222895,51.561475,1,3,2,1,24/09/2007,2,16:28,15,E09000016,3,124,6,30,0,-1,-1,0,0,0,1,1,1,0,0,1,1,E01002360,2025-12-09 16:28:00,16,,,
200701KD67179,553820,188570,0.218357,51.574961,1,3,2,3,16/09/2007,1,22:56,15,E09000016,5,0,6,30,0,-1,-1,0,0,0,4,1,1,0,0,1,1,E01002270,2025-12-09 22:56:00,22,,,
200701KD67188,551470,193820,0.186737,51.622768,1,3,2,1,05/09/2007,4,07:10,15,E09000016,4,175,6,30,0,-1,-1,0,0,0,1,1,1,0,0,1,1,E01002304,2025-12-09 07:10:00,7,2007-05-09,Wednesday,5.0
200701KD67193,552000,183400,0.189881,51.529002,1,3,2,1,20/09/2007,5,17:55,15,E09000016,3,125,6,30,3,4,5,0,0,4,1,1,1,0,0,1,1,E01002374,2025-12-09 17:55:00,17,,,
200701KD67195,550580,182370,0.168986,51.520127,1,3,2,1,10/09/2007,2,07:30,15,E09000016,3,13,3,40,7,4,5,0,0,0,1,1,1,0,0,1,1,,2025-12-09 07:30:00,7,2007-10-09,Tuesday,10.0
200701KD67198,550800,188480,0.174772,51.574967,1,3,2,1,08/09/2007,7,17:30,15,E09000016,3,118,6,30,3,4,6,0,0,0,1,1,1,0,0,1,1,E01002356,2025-12-09 17:30:00,17,2007-08-09,Thursday,8.0
200701KD67200,550960,189180,0.177379,51.581214,1,3,2,1,05/09/2007,4,07:32,15,E09000016,3,125,6,30,3,2,6,0,0,4,1,1,1,0,0,1,1,E01002243,2025-12-09 07:32:00,7,2007-05-09,Wednesday,5.0
200701KD67202,550870,188550,0.175811,51.575578,1,3,2,1,11/09/2007,3,15:10,15,E09000016,3,118,2,30,0,-1,-1,0,0,0,1,1,1,0,0,1,1,E01002247,2025-12-09 15:10:00,15,2007-11-09,Friday,11.0
200701KD67206,552250,184480,0.193949,51.538638,1,2,2,1,07/09/2007,6,07:05,15,E09000016,6,0,6,30,3,4,6,0,0,0,1,1,1,0,0,1,1,E01002372,2025-12-09 07:05:00,7,2007-07-09,Monday,7.0
200701KD67211,550990,188640,0.17758,51.576354,1,3,2,1,05/09/2007,4,17:10,15,E09000016,3,125,1,30,1,4,3,125,0,0,1,9,1,0,0,1,2,E01002356,2025-12-09 17:10:00,17,2007-05-09,Wednesday,5.0
200701KD67213,554360,194600,0.228796,51.628991,1,3,1,1,09/09/2007,1,05:30,15,E09000016,1,25,3,70,0,-1,-1,0,0,0,4,1,1,0,0,2,1,E01002276,2025-12-09 05:30:00,5,2007-09-09,Sunday,9.0
200701KD67217,552810,189550,0.20422,51.58404,1,3,2,1,20/09/2007,5,17:30,15,E09000016,6,0,6,30,0,-1,-1,0,0,0,1,1,1,0,0,1,1,E01002379,2025-12-09 17:30:00,17,,,
200701KD67222,549740,191090,0.160599,51.598701,1,3,2,1,14/09/2007,6,16:00,15,E09000016,4,174,6,30,0,-1,-1,0,0,0,1,1,1,0,0,1,1,E01002326,2025-12-09 16:00:00,16,,,
200701KD67254,555450,185790,0.240632,51.549537,1,3,1,1,03/10/2007,4,08:55,15,E09000016,6,0,6,30,0,-1,-1,0,0,0,1,1,2,0,0,1,1,E01002390,2025-12-09 08:55:00,8,2007-03-10,Saturday,3.0
200701KD67255,550170,187200,0.16514,51.563635,1,3,1,1,07/10/2007,1,10:45,15,E09000016,3,124,6,30,0,-1,-1,0,0,0,1,1,1,0,0,1,2,E01002251,2025-12-09 10:45:00,10,2007-07-10,Tuesday,7.0
200701KD67280,551090,188370,0.178906,51.573902,1,3,2,1,15/10/2007,2,12:36,15,E09000016,3,125,9,30,3,2,6,0,0,4,1,1,1,0,0,1,1,E01002356,2025-12-09 12:36:00,12,,,
200701KD67281,553340,190920,0.212462,51.596206,1,3,2,2,15/10/2007,2,09:50,15,E09000016,5,0,1,30,1,4,5,0,0,0,1,1,1,0,0,1,1,E01002310,2025-12-09 09:50:00,9,,,
200701KD67287,558710,187840,0.288536,51.567048,1,3,2,1,17/10/2007,4,07:00,15,E09000016,1,25,3,70,0,-1,-1,0,0,0,4,1,2,0,0,2,1,E01002252,2025-12-09 07:00:00,7,,,
200701KD67312,553300,192300,0.212488,51.608616,1,3,2,1,19/10/2007,6,11:50,15,E09000016,6,0,6,30,0,-1,-1,0,0,0,1,1,1,0,0,1,2,E01002280,2025-12-09 11:50:00,11,,,
200701KD67319,553420,190530,0.213446,51.59268,1,3,3,2,06/10/2007,7,12:52,15,E09000016,3,12,1,50,1,4,3,127,0,0,1,1,1,0,0,1,1,E01002293,2025-12-09 12:52:00,12,2007-06-10,Sunday,6.0
200701KD67341,552140,182110,0.191341,51.517373,1,3,3,2,14/10/2007,1,05:50,15,E09000016,4,1335,3,70,0,-1,-1,0,0,0,4,1,1,0,7,1,1,E01002345,2025-12-09 05:50:00,5,,,
200701KD67342,553190,190330,0.210041,51.590945,1,3,2,1,04/10/2007,5,08:50,15,E09000016,3,118,6,30,3,4,5,0,0,0,1,1,1,0,0,1,2,E01002383,2025-12-09 08:50:00,8,2007-04-10,Tuesday,4.0
200701KD67348,552490,189810,0.199718,51.586463,1,3,2,1,25/10/2007,5,17:20,15,E09000016,3,118,6,30,3,2,5,0,0,5,4,2,2,0,0,1,1,E01002379,2025-12-09 17:20:00,17,,,
200701KD67349,557680,187680,0.273615,51.565899,1,3,2,1,31/10/2007,4,07:25,15,E09000016,6,0,6,30,6,4,6,0,0,0,1,1,1,0,0,1,1,E01002256,2025-12-09 07:25:00,7,,,
200701KD67353,550990,188640,0.17758,51.576354,1,3,2,1,25/10/2007,5,23:37,15,E09000016,3,125,3,30,0,-1,-1,0,0,0,4,2,2,0,0,1,1,E01002356,2025-12-09 23:37:00,23,,,
200701KD67362,552230,187420,0.194933,51.565059,1,3,2,2,05/10/2007,6,17:15,15,E09000016,3,124,6,30,6,2,5,0,0,0,1,1,1,0,0,1,2,E01002319,2025-12-09 17:15:00,17,2007-05-10,Thursday,5.0
200701KD67369,550140,190410,0.166079,51.592485,1,3,2,1,10/10/2007,4,18:35,15,E09000016,4,174,6,30,3,4,6,0,0,0,4,1,1,0,0,1,1,E01002335,2025-12-09 18:35:00,18,2007-10-10,Wednesday,10.0
200701KD67377,551170,189110,0.180378,51.580529,1,3,2,1,17/10/2007,4,18:45,15,E09000016,3,118,1,30,1,3,6,0,0,0,1,1,1,0,0,1,2,E01002353,2025-12-09 18:45:00,18,,,
200701KD67388,551220,193260,0.182887,51.617803,1,2,2,1,12/10/2007,6,13:55,15,E09000016,4,175,6,30,9,4,6,0,0,0,1,1,1,0,0,1,2,E01002304,2025-12-09 13:55:00,13,2007-12-10,Monday,12.0
200701KD67390,553460,190550,0.214031,51.592849,1,3,2,1,08/10/2007,2,18:30,15,E09000016,3,12,3,30,1,4,3,12,0,4,4,1,1,0,0,1,1,E01002293,2025-12-09 18:30:00,18,2007-08-10,Friday,8.0
200701KD67393,551300,181750,0.17909,51.514364,1,3,2,2,02/10/2007,3,16:37,15,E09000016,3,13,3,70,0,-1,-1,0,0,0,1,2,2,0,0,2,1,E01002344,2025-12-09 16:37:00,16,2007-02-10,Saturday,2.0
200701KD67398,558470,188340,0.285301,51.571607,1,3,3,7,27/10/2007,7,18:25,15,E09000016,1,25,3,70,0,-1,-1,0,0,0,4,1,1,0,0,2,1,E01002252,2025-12-09 18:25:00,18,,,
200701KD67400,550500,182330,0.167817,51.519789,1,3,1,1,01/10/2007,2,21:05,15,E09000016,3,13,6,50,5,4,3,13,0,0,4,1,2,0,0,1,1,E01002370,2025-12-09 21:05:00,21,2007-01-10,Wednesday,1.0
200701KD67404,554020,186820,0.220475,51.559183,1,3,3,1,22/10/2007,2,21:00,15,E09000016,5,0,6,30,0,-1,-1,0,0,0,4,1,1,0,0,1,1,E01002364,2025-12-09 21:00:00,21,,,
200701KD67405,558530,188400,0.286193,51.57213,1,3,2,2,27/10/2007,7,19:05,15,E09000016,1,25,1,70,1,4,3,127,0,0,1,8,1,0,0,2,1,E01002252,2025-12-09 19:05:00,19,,,
200701KD67411,549910,191160,0.163082,51.599285,1,3,2,2,20/10/2007,7,14:15,15,E09000016,4,174,6,30,0,-1,-1,0,0,5,1,1,1,0,0,1,1,E01002302,2025-12-09 14:15:00,14,,,
200701KD67414,553450,190550,0.213887,51.592851,1,3,3,1,24/10/2007,4,10:10,15,E09000016,3,12,3,50,0,-1,-1,0,0,0,1,1,1,4,0,1,1,E01002310,2025-12-09 10:10:00,10,,,
200701KD67415,553910,185970,0.218518,51.551576,1,3,1,1,24/10/2007,4,11:40,15,E09000016,5,0,9,30,0,-1,-1,0,0,0,4,9,2,0,0,1,2,E01002285,2025-12-09 11:40:00,11,,,
200701KD67418,552020,187410,0.191901,51.565026,1,3,2,1,16/10/2007,3,11:15,15,E09000016,3,124,3,30,3,2,6,0,0,0,1,1,1,0,0,1,1,E01002319,2025-12-09 11:15:00,11,,,
200701KD67429,553040,186060,0.206018,51.552621,1,3,2,1,27/10/2007,7,11:10,15,E09000016,5,0,6,30,0,-1,-1,0,0,0,1,1,1,0,0,1,1,E01002366,2025-12-09 11:10:00,11,,,
200701KD67431,559170,185980,0.294326,51.550207,1,3,2,2,10/10/2007,4,08:29,15,E09000016,4,186,6,30,0,-1,-1,0,0,0,1,2,2,0,0,2,1,E01002391,2025-12-09 08:29:00,8,2007-10-10,Wednesday,10.0
200701KD67435,551600,188020,0.186109,51.57062,1,2,1,1,01/10/2007,2,10:45,15,E09000016,5,0,6,30,3,4,5,0,0,0,1,2,2,0,0,1,1,E01002350,2025-12-09 10:45:00,10,2007-01-10,Wednesday,1.0
200701KD67437,556270,189030,0.253889,51.57842,1,3,2,1,28/10/2007,1,11:10,15,E09000016,3,127,6,30,0,-1,-1,0,0,0,1,2,2,0,0,2,1,E01002296,2025-12-09 11:10:00,11,,,
200701KD67442,556800,192430,0.263049,51.608821,1,3,2,2,12/10/2007,6,19:38,15,E09000016,1,25,9,70,0,-1,-1,0,0,0,5,9,1,0,0,2,2,E01002296,2025-12-09 19:38:00,19,2007-12-10,Monday,12.0
200701KD67450,552490,189810,0.199718,51.586463,1,3,1,1,29/10/2007,2,08:10,15,E09000016,5,0,6,30,3,2,3,118,0,0,1,1,1,0,0,1,1,E01002379,2025-12-09 08:10:00,8,,,
200701KD67461,553280,192800,0.212418,51.613113,1,2,1,1,24/10/2007,4,18:30,15,E09000016,5,0,9,30,0,-1,-1,0,0,0,1,9,1,0,0,1,1,E01002312,2025-12-09 18:30:00,18,,,
200701KD67463,553100,190570,0.208847,51.593126,1,2,2,2,17/10/2007,4,15:30,15,E09000016,3,12,3,50,5,4,6,0,0,0,1,1,1,0,0,2,1,E01002311,2025-12-09 15:30:00,15,,,
200701KD67471,555410,186700,0.240458,51.557724,1,3,2,1,28/10/2007,1,12:11,15,E09000016,6,0,9,30,0,-1,-1,0,0,0,1,9,2,0,1,1,1,E01002386,2025-12-09 12:11:00,12,,,
200701KD67481,553040,185990,0.205988,51.551992,1,3,2,1,01/10/2007,2,08:34,15,E09000016,5,0,6,30,0,-1,-1,0,0,0,1,1,1,0,0,1,1,E01002366,2025-12-09 08:34:00,8,2007-01-10,Wednesday,1.0
200701KD67509,553210,186630,0.208717,51.557696,1,3,2,2,09/10/2007,3,14:29,15,E09000016,5,0,6,30,9,4,6,0,0,0,1,2,2,0,0,1,1,E01002363,2025-12-09 14:29:00,14,2007-09-10,Monday,9.0
200701KD67517,551450,189970,0.184787,51.588181,1,3,2,1,29/10/2007,2,16:45,15,E09000016,5,0,6,30,3,4,6,0,0,0,1,1,1,0,0,1,1,E01002339,2025-12-09 16:45:00,16,,,
200701KD67519,555960,186260,0.24819,51.553619,1,2,1,2,01/10/2007,2,21:00,15,E09000016,4,1421,6,30,0,-1,-1,0,0,4,4,1,2,0,0,1,1,E01002386,2025-12-09 21:00:00,21,2007-01-10,Wednesday,1.0
200701KD67527,553980,186350,0.219693,51.554971,1,3,2,2,28/10/2007,1,16:00,15,E09000016,3,124,6,30,3,4,6,0,0,0,1,1,2,0,0,1,2,E01002291,2025-12-09 16:00:00,16,,,
200701KD67542,553980,192340,0.222318,51.60879,1,3,1,1,11/10/2007,5,15:15,15,E09000016,5,0,6,30,0,-1,-1,0,0,0,1,1,1,0,0,1,1,E01002278,2025-12-09 15:15:00,15,2007-11-10,Saturday,11.0
200701KD67548,553890,185790,0.218151,51.549964,1,2,1,1,10/10/2007,4,10:50,15,E09000016,5,0,6,30,3,4,6,0,0,1,1,8,2,0,0,1,2,E01002285,2025-12-09 10:50:00,10,2007-10-10,Wednesday,10.0
200701KD67558,551060,189050,0.178766,51.580019,1,3,2,2,20/10/2007,7,13:01,15,E09000016,3,125,1,30,1,4,3,118,0,0,1,1,1,0,0,1,1,E01002353,2025-12-09 13:01:00,13,,,
200701KD67571,558380,188380,0.284022,51.571992,1,3,2,1,17/10/2007,4,19:37,15,E09000016,1,25,1,70,0,-1,-1,0,0,0,4,1,1,0,0,2,1,E01002252,2025-12-09 19:37:00,19,,,
200701KD67572,551970,187420,0.191184,51.565129,1,3,2,1,26/10/2007,6,12:00,15,E09000016,3,124,6,30,0,-1,-1,0,0,4,1,1,1,0,0,1,2,E01002319,2025-12-09 12:00:00,12,,,
200701KD67574,553390,191580,0.213472,51.602122,1,3,2,1,17/10/2007,4,10:26,15,E09000016,6,0,6,20,9,4,6,0,0,0,1,1,1,0,0,1,2,E01002314,2025-12-09 10:26:00,10,,,
200701KD67596,550630,187360,0.17184,51.56495,1,3,2,1,18/10/2007,5,17:10,15,E09000016,3,124,6,30,0,-1,-1,0,0,0,1,1,1,0,0,1,1,E01002248,2025-12-09 17:10:00,17,,,
200701KD67597,550050,188400,0.163923,51.574449,1,3,2,1,18/10/2007,5,08:15,15,E09000016,3,118,6,30,3,4,6,0,0,0,1,1,1,0,0,1,1,E01002246,2025-12-09 08:15:00,8,,,
200701KD67661,549900,191170,0.162942,51.599377,1,3,2,2,05/10/2007,6,17:02,15,E09000016,4,174,1,30,1,4,4,174,0,0,4,1,2,0,0,1,1,E01002326,2025-12-09 17:02:00,17,2007-05-10,Thursday,5.0
200701KD67662,551890,188820,0.190636,51.57773,1,3,1,1,06/10/2007,7,10:30,15,E09000016,6,0,9,30,0,-1,-1,0,0,0,1,1,1,0,0,1,1,E01002357,2025-12-09 10:30:00,10,2007-06-10,Sunday,6.0
200701KD67667,552930,181880,0.202619,51.515094,1,3,1,1,14/10/2007,1,01:30,15,E09000016,4,1335,6,30,7,4,4,1335,0,0,4,1,1,0,0,1,1,E01002347,2025-12-09 01:30:00,1,,,
200701KD67669,551420,182960,0.181337,51.525204,1,3,2,1,17/10/2007,4,08:28,15,E09000016,6,0,6,30,0,-1,-1,0,0,0,1,1,1,0,0,1,1,E01002369,2025-12-09 08:28:00,8,,,
200701KD67671,554310,192750,0.22726,51.612383,1,3,1,1,30/10/2007,3,15:25,15,E09000016,6,0,6,30,0,-1,-1,0,0,0,1,1,1,0,0,1,2,E01002278,2025-12-09 15:25:00,15,,,
200701KD67681,556030,186550,0.249327,51.556205,1,2,1,1,23/10/2007,3,15:16,15,E09000016,4,1421,6,30,6,2,4,1421,0,5,1,1,1,0,0,1,1,E01002386,2025-12-09 15:16:00,15,,,
200701KD67703,554880,191930,0.235124,51.604859,1,3,2,2,09/10/2007,3,11:22,15,E09000016,5,0,6,30,0,-1,-1,0,0,0,1,2,1,0,0,1,1,E01002281,2025-12-09 11:22:00,11,2007-09-10,Monday,9.0
200701KD67715,553050,192030,0.208762,51.606258,1,3,2,1,09/10/2007,3,08:29,15,E09000016,5,0,6,30,0,-1,-1,0,0,0,1,2,2,0,0,1,1,E01002314,2025-12-09 08:29:00,8,2007-09-10,Monday,9.0
200701KD67768,551980,183400,0.189593,51.529007,1,3,2,1,12/11/2007,2,18:45,15,E09000016,3,125,6,30,6,2,3,125,0,0,4,1,1,0,0,1,2,E01002371,2025-12-09 18:45:00,18,2007-12-11,Tuesday,12.0
200701KD67774,550120,189190,0.165269,51.581528,1,3,1,1,13/11/2007,3,18:32,15,E09000016,3,12,3,30,6,2,3,12,0,0,4,1,1,0,0,1,1,E01002244,2025-12-09 18:32:00,18,,,
200701KD67778,551000,188620,0.177716,51.576172,1,3,2,1,15/11/2007,5,08:55,15,E09000016,3,125,1,30,1,4,3,125,0,0,1,1,1,0,0,1,2,E01002356,2025-12-09 08:55:00,8,,,
200701KD67815,558380,188380,0.284022,51.571992,1,3,14,5,28/11/2007,4,07:03,15,E09000016,1,25,3,70,1,4,3,127,0,0,1,7,2,0,0,2,1,E01002252,2025-12-09 07:03:00,7,,,
200701KD67818,551030,189070,0.178342,51.580207,1,3,1,1,20/11/2007,3,02:00,15,E09000016,3,118,1,30,1,4,3,118,0,0,4,2,2,0,0,1,1,E01002243,2025-12-09 02:00:00,2,,,
200701KD67824,553160,187260,0.20827,51.56337,1,3,1,1,13/11/2007,3,14:23,15,E09000016,3,124,6,30,3,2,6,0,0,0,1,1,1,0,0,1,2,E01002321,2025-12-09 14:23:00,14,,,
200701KD67833,553190,190330,0.210041,51.590945,1,3,1,1,08/11/2007,5,14:50,15,E09000016,3,118,9,30,0,-1,-1,0,0,0,1,9,1,0,0,1,1,E01002383,2025-12-09 14:50:00,14,2007-08-11,Saturday,8.0
200701KD67849,549230,190960,0.153186,51.597668,1,3,2,1,20/11/2007,3,20:15,15,E09000016,5,0,1,30,2,4,5,0,0,0,4,2,2,0,0,1,2,E01002326,2025-12-09 20:15:00,20,,,
200701KD67855,552490,189810,0.199718,51.586463,1,3,2,1,29/11/2007,5,19:00,15,E09000016,5,0,6,40,3,2,5,0,0,4,4,1,2,0,0,1,1,E01002379,2025-12-09 19:00:00,19,,,
200701KD67867,551780,187410,0.188441,51.565091,1,3,2,1,12/11/2007,2,08:30,15,E09000016,3,125,9,30,0,-1,-1,0,0,0,1,9,1,0,0,1,2,E01002319,2025-12-09 08:30:00,8,2007-12-11,Tuesday,12.0
200701KD67872,550950,188840,0.177089,51.578162,1,3,2,2,11/11/2007,1,13:35,15,E09000016,3,118,6,30,3,4,3,118,0,0,1,1,1,0,0,1,2,E01002243,2025-12-09 13:35:00,13,2007-11-11,Sunday,11.0
200701KD67876,550160,191550,0.166855,51.602722,1,3,2,1,18/11/2007,1,13:04,15,E09000016,6,0,6,30,6,4,6,0,0,8,1,1,1,0,0,1,1,E01002302,2025-12-09 13:04:00,13,,,
200701KD67896,550630,182940,0.16995,51.525235,1,2,2,1,30/11/2007,6,22:40,15,E09000016,3,1306,3,30,7,2,5,0,0,5,4,2,2,0,0,1,1,E01002368,2025-12-09 22:40:00,22,,,
200701KD67897,553650,187260,0.215334,51.563237,1,3,2,1,01/11/2007,5,11:31,15,E09000016,6,0,6,30,0,-1,-1,0,0,0,1,9,1,0,0,1,1,E01002361,2025-12-09 11:31:00,11,2007-01-11,Thursday,1.0
200701KD67902,558360,188410,0.283747,51.572267,1,3,2,1,22/11/2007,5,16:45,15,E09000016,3,127,1,30,1,4,1,25,0,0,7,9,1,0,0,2,2,E01002252,2025-12-09 16:45:00,16,,,
200701KD67906,551780,187410,0.188441,51.565091,1,3,2,1,12/11/2007,2,13:22,15,E09000016,3,124,6,30,6,2,3,124,0,4,1,1,1,0,0,1,1,E01002319,2025-12-09 13:22:00,13,2007-12-11,Tuesday,12.0
200701KD67937,554020,186760,0.220449,51.558644,1,3,1,1,10/11/2007,7,12:30,15,E09000016,5,0,9,30,0,-1,-1,0,0,0,1,9,1,0,0,1,2,E01002364,2025-12-09 12:30:00,12,2007-10-11,Thursday,10.0
200701KD67941,554740,184020,0.229623,51.533829,1,3,2,1,16/11/2007,6,14:58,15,E09000016,5,0,6,30,3,4,6,0,0,0,1,1,1,0,0,2,1,E01002385,2025-12-09 14:58:00,14,,,
200701KD67947,551970,185900,0.190528,51.551472,1,3,2,1,16/11/2007,6,08:00,15,E09000016,3,125,9,30,0,-1,-1,0,0,0,1,9,1,0,0,1,2,E01002260,2025-12-09 08:00:00,8,,,
200701KD67957,553000,188690,0.206586,51.576262,1,3,1,1,09/11/2007,6,21:07,15,E09000016,5,0,9,30,0,-1,-1,0,0,0,4,1,1,0,0,1,1,E01002379,2025-12-09 21:07:00,21,2007-09-11,Tuesday,9.0
200701KD67967,551570,189220,0.186194,51.58141,1,3,2,1,23/11/2007,6,15:15,15,E09000016,3,118,9,30,0,-1,-1,0,0,0,1,9,1,0,0,1,1,E01002353,2025-12-09 15:15:00,15,,,
200701KD67996,554840,183040,0.230633,51.524996,1,3,2,1,15/11/2007,5,21:00,15,E09000016,5,0,6,60,3,4,6,0,0,0,6,1,2,0,0,2,1,E01002348,2025-12-09 21:00:00,21,,,
200701KD67999,551270,193030,0.183509,51.615723,1,2,2,2,21/11/2007,4,11:05,15,E09000016,4,175,6,30,9,4,5,0,0,0,1,1,1,0,0,1,1,E01002304,2025-12-09 11:05:00,11,,,
200701KD68009,553750,185400,0.215963,51.546498,1,3,1,1,28/11/2007,4,16:48,15,E09000016,5,0,6,30,9,4,6,0,0,1,4,1,1,0,0,1,1,E01002288,2025-12-09 16:48:00,16,,,
200701KD68012,553130,182480,0.205759,51.52043,1,3,3,2,01/11/2007,5,17:55,15,E09000016,3,1306,3,50,9,2,3,1306,0,5,1,1,1,0,0,1,1,E01002342,2025-12-09 17:55:00,17,2007-01-11,Thursday,1.0
200701KD68065,549230,190960,0.153186,51.597668,1,3,2,2,24/11/2007,7,08:20,15,E09000016,5,0,1,30,2,4,5,0,0,0,1,1,1,0,0,1,1,E01002326,2025-12-09 08:20:00,8,,,
200701KD68087,553380,187200,0.211415,51.562771,1,1,2,3,28/10/2007,1,21:39,15,E09000016,3,124,6,30,0,-1,-1,0,0,0,4,2,2,0,0,1,1,E01002361,2025-12-09 21:39:00,21,,,
200701KD68100,553080,187310,0.207139,51.563841,1,2,1,1,30/11/2007,6,16:50,15,E09000016,6,0,6,30,3,4,3,124,0,0,4,2,2,0,0,1,1,E01002318,2025-12-09 16:50:00,16,,,
200701KD68117,553030,190100,0.207633,51.588922,1,3,2,1,09/11/2007,6,12:05,15,E09000016,6,0,6,40,0,-1,-1,0,0,0,1,1,1,4,0,1,1,E01002376,2025-12-09 12:05:00,12,2007-09-11,Tuesday,9.0
200701KD68119,552600,185710,0.199525,51.549595,1,3,2,1,02/11/2007,6,18:15,15,E09000016,5,0,6,30,0,-1,-1,0,0,4,4,1,1,0,0,1,1,E01002287,2025-12-09 18:15:00,18,2007-02-11,Sunday,2.0
200701KD68120,554080,189990,0.222729,51.587648,1,3,4,1,03/11/2007,7,17:13,15,E09000016,3,127,3,50,0,-1,-1,0,0,0,4,1,1,0,0,1,1,E01002295,2025-12-09 17:13:00,17,2007-03-11,Sunday,3.0
200701KD68121,554420,194510,0.229622,51.628166,1,3,2,1,03/11/2007,7,07:35,15,E09000016,1,25,3,70,0,-1,-1,0,0,0,1,1,1,0,0,2,2,E01002276,2025-12-09 07:35:00,7,2007-03-11,Sunday,3.0
200701KD68122,553820,188560,0.218353,51.574871,1,3,1,1,15/11/2007,5,12:35,15,E09000016,5,0,6,30,0,-1,-1,0,0,0,1,1,1,0,2,1,1,E01002274,2025-12-09 12:35:00,12,,,
200701KD68123,551910,186350,0.189857,51.555532,1,3,2,1,16/11/2007,6,18:35,15,E09000016,3,125,6,30,0,-1,-1,0,0,0,4,1,4,0,0,1,1,E01002322,2025-12-09 18:35:00,18,,,
200701KD68124,552120,182600,0.191265,51.521781,1,3,1,1,27/11/2007,3,17:32,15,E09000016,4,1335,6,30,2,2,4,1335,0,4,4,1,1,0,0,2,1,E01002370,2025-12-09 17:32:00,17,,,
200701KD68125,554080,192180,0.22369,51.607325,1,3,2,1,28/11/2007,4,18:30,15,E09000016,5,0,3,30,0,-1,-1,0,0,0,4,1,1,0,0,1,1,E01002282,2025-12-09 18:30:00,18,,,
200701KD68134,551410,188490,0.183572,51.574894,1,3,1,1,07/11/2007,4,15:58,15,E09000016,5,0,6,30,0,-1,-1,0,0,0,1,1,1,0,0,1,1,E01002356,2025-12-09 15:58:00,15,2007-07-11,Wednesday,7.0
200701KD68135,551040,189020,0.178464,51.579755,1,3,2,1,09/11/2007,6,17:00,15,E09000016,3,118,3,30,0,-1,-1,0,0,0,4,4,1,0,0,1,2,E01002353,2025-12-09 17:00:00,17,2007-09-11,Tuesday,9.0
200701KD68136,552980,185770,0.205028,51.550031,1,3,2,1,09/11/2007,6,16:10,15,E09000016,5,0,6,30,0,-1,-1,0,0,0,1,1,1,0,0,1,1,E01002287,2025-12-09 16:10:00,16,2007-09-11,Tuesday,9.0
200701KD68137,554640,190120,0.230863,51.588663,1,3,2,2,11/11/2007,1,12:40,15,E09000016,5,0,6,30,0,-1,-1,0,0,0,1,1,1,0,0,1,1,E01002295,2025-12-09 12:40:00,12,2007-11-11,Sunday,11.0
200701KD68138,549890,191140,0.162785,51.59911,1,3,2,1,15/11/2007,5,19:22,15,E09000016,4,174,6,30,0,-1,-1,0,0,0,4,1,1,0,0,1,2,E01002326,2025-12-09 19:22:00,19,,,
200701KD68139,553870,187480,0.218601,51.565154,1,3,1,1,17/11/2007,7,19:15,15,E09000016,6,0,9,30,0,-1,-1,0,0,0,4,9,1,0,0,1,1,E01002361,2025-12-09 19:15:00,19,,,
200701KD68149,555000,188790,0.235469,51.576614,1,3,2,2,23/11/2007,6,10:00,15,E09000016,5,0,6,30,0,-1,-1,0,0,0,1,1,1,0,0,1,1,E01002269,2025-12-09 10:00:00,10,,,
200701KD68152,553400,190620,0.213196,51.593494,1,3,2,1,05/11/2007,2,14:00,15,E09000016,5,0,9,60,0,-1,-1,0,0,0,1,9,1,0,0,1,2,E01002310,2025-12-09 14:00:00,14,2007-05-11,Friday,5.0
200701KD68154,550570,187360,0.170975,51.564966,1,3,2,1,13/11/2007,3,09:15,15,E09000016,3,124,6,30,0,-1,-1,0,0,0,1,1,2,0,0,1,2,E01002248,2025-12-09 09:15:00,9,,,
200701KD68155,556780,192450,0.26277,51.609006,1,3,3,1,25/11/2007,1,19:00,15,E09000016,1,25,3,70,0,-1,-1,0,0,0,4,1,1,0,0,2,1,E01002277,2025-12-09 19:00:00,19,,,
200701KD68156,556750,192410,0.262319,51.608655,1,3,3,1,30/11/2007,6,06:40,15,E09000016,1,25,3,70,0,-1,-1,0,0,0,1,1,2,0,0,2,1,E01002277,2025-12-09 06:40:00,6,,,
200701KD68188,551690,188530,0.187627,51.575178,1,3,2,2,19/10/2007,6,11:42,15,E09000016,5,0,3,30,6,2,5,0,0,5,1,1,1,0,0,1,1,E01002357,2025-12-09 11:42:00,11,,,
200701KD68224,558440,188400,0.284896,51.572155,1,2,2,1,15/09/2007,7,11:00,15,E09000016,1,25,3,70,0,-1,-1,0,0,0,1,1,1,0,0,2,1,E01002252,2025-12-09 11:00:00,11,,,
200701KD68236,554810,180250,0.228976,51.499937,1,3,2,1,24/09/2007,2,15:05,15,E09000016,3,1306,3,40,1,4,3,13,0,0,1,1,1,0,0,2,2,E01002344,2025-12-09 15:05:00,15,,,
200701KD68245,550700,182300,0.170684,51.519466,1,3,2,1,09/11/2007,6,07:15,15,E09000016,3,13,3,70,0,-1,-1,0,0,0,1,1,1,0,0,2,1,E01002370,2025-12-09 07:15:00,7,2007-09-11,Tuesday,9.0
200701KD68253,558570,188140,0.286653,51.569782,1,3,2,1,25/10/2007,5,18:34,15,E09000016,1,25,3,70,0,-1,-1,0,0,0,4,2,2,0,0,2,1,E01002252,2025-12-09 18:34:00,18,,,
200701KD68269,554090,192150,0.223821,51.607052,1,3,3,1,26/11/2007,2,09:30,15,E09000016,5,0,6,30,0,-1,-1,0,0,1,1,1,1,0,0,1,1,E01002282,2025-12-09 09:30:00,9,,,
200701KD68270,554790,189430,0.232723,51.582422,1,3,1,1,22/10/2007,2,08:43,15,E09000016,5,0,6,30,3,4,3,127,0,0,1,1,1,0,0,1,1,E01002268,2025-12-09 08:43:00,8,,,
200701KD68286,552240,183240,0.193269,51.527499,1,3,2,2,15/11/2007,5,14:40,15,E09000016,6,0,6,30,0,-1,-1,0,0,0,1,1,1,0,0,1,2,E01002370,2025-12-09 14:40:00,14,,,
200701KD68290,555920,186240,0.247605,51.55345,1,2,1,1,25/11/2007,1,17:15,15,E09000016,4,1421,6,30,3,2,6,0,0,4,4,2,2,0,0,1,1,E01002386,2025-12-09 17:15:00,17,,,
200701KD68292,558860,186840,0.290246,51.558021,1,3,2,1,15/08/2007,4,11:35,15,E09000016,1,25,3,70,0,-1,-1,0,0,0,1,1,1,0,0,2,1,E01002391,2025-12-09 11:35:00,11,,,
200701KD68293,553450,182240,0.210264,51.518187,1,3,2,1,17/10/2007,4,08:45,15,E09000016,3,1306,3,40,7,4,6,0,0,0,1,1,1,0,0,1,1,E01002344,2025-12-09 08:45:00,8,,,
200701KD68294,552040,181370,0.189582,51.510751,1,3,2,1,07/11/2007,4,07:15,15,E09000016,3,13,3,70,0,-1,-1,0,0,0,4,1,1,0,0,2,1,E01002344,2025-12-09 07:15:00,7,2007-07-11,Wednesday,7.0
200701KD68323,556450,189010,0.256475,51.578191,1,2,2,1,10/11/2007,7,15:59,15,E09000016,3,127,3,70,5,4,6,0,0,0,1,1,1,0,0,2,1,E01002296,2025-12-09 15:59:00,15,2007-10-11,Thursday,10.0
200701KD68325,551230,188780,0.181101,51.577548,1,3,2,1,23/10/2007,3,16:45,15,E09000016,6,0,3,30,9,4,6,0,0,0,1,1,1,0,0,1,2,E01002357,2025-12-09 16:45:00,16,,,
200701KD68337,554490,181090,0.224737,51.507571,1,2,2,6,10/11/2007,7,00:15,15,E09000016,3,1306,6,60,3,4,6,0,0,0,4,2,2,0,0,2,1,E01002344,2025-12-09 00:15:00,0,2007-10-11,Thursday,10.0
200701KD68340,554510,192400,0.229992,51.609184,1,1,2,1,08/11/2007,5,06:10,15,E09000016,5,0,1,30,2,4,6,0,0,8,4,1,1,0,0,1,1,E01002281,2025-12-09 06:10:00,6,2007-08-11,Saturday,8.0
200701KD68347,554870,194140,0.235955,51.624718,1,3,2,1,23/11/2007,6,10:20,15,E09000016,1,25,3,70,0,-1,-1,0,0,0,1,1,1,0,0,2,1,E01002276,2025-12-09 10:20:00,10,,,
200701KD68384,558840,187400,0.290211,51.563058,1,3,2,3,10/11/2007,7,23:55,15,E09000016,1,25,3,70,0,-1,-1,0,0,0,4,1,1,4,0,2,1,E01002391,2025-12-09 23:55:00,23,2007-10-11,Thursday,10.0
200701KD68393,558380,188380,0.284022,51.571992,1,3,2,2,30/11/2007,6,14:15,15,E09000016,1,25,3,70,0,-1,-1,0,0,0,1,1,1,0,0,2,1,E01002252,2025-12-09 14:15:00,14,,,
200701KD68422,554720,191020,0.232414,51.596727,1,3,2,1,07/12/2007,6,18:20,15,E09000016,5,0,9,30,0,-1,-1,0,0,0,7,2,2,0,0,1,2,E01002300,2025-12-09 18:20:00,18,2007-07-12,Thursday,7.0
200701KD68439,556690,192400,0.261449,51.608582,1,2,2,1,12/12/2007,4,16:34,15,E09000016,1,25,1,50,1,4,3,12,0,0,4,1,1,0,0,2,1,E01002277,2025-12-09 16:34:00,16,2007-12-12,Wednesday,12.0
200701KD68443,550590,182290,0.169096,51.519406,1,3,1,1,05/12/2007,4,13:30,15,E09000016,3,13,1,30,1,4,3,13,0,0,1,2,2,6,0,2,1,E01002370,2025-12-09 13:30:00,13,2007-05-12,Saturday,5.0
200701KD68449,551880,183500,0.188196,51.529932,1,2,1,1,12/12/2007,4,12:25,15,E09000016,6,0,6,30,3,4,3,125,0,0,1,1,2,0,0,1,1,E01002371,2025-12-09 12:25:00,12,2007-12-12,Wednesday,12.0
200701KD68457,551150,188200,0.179698,51.572358,1,3,1,1,04/12/2007,3,10:53,15,E09000016,3,125,9,30,0,-1,-1,0,0,0,1,9,1,0,0,1,2,E01002249,2025-12-09 10:53:00,10,2007-04-12,Thursday,4.0
200701KD68469,554170,189900,0.223988,51.586815,1,3,2,1,10/12/2007,2,07:20,15,E09000016,3,127,3,50,6,4,5,0,0,0,4,1,1,0,0,1,2,E01002377,2025-12-09 07:20:00,7,2007-10-12,Friday,10.0
200701KD68490,554830,180220,0.229251,51.499662,1,3,2,1,05/12/2007,4,06:50,15,E09000016,3,1306,3,70,0,-1,-1,0,0,0,1,5,2,0,0,2,1,E01002344,2025-12-09 06:50:00,6,2007-05-12,Saturday,5.0
200701KD68494,550050,192250,0.165568,51.609041,1,3,2,1,02/12/2007,1,14:07,15,E09000016,6,0,6,30,2,4,6,0,0,0,1,1,1,0,0,1,1,E01002307,2025-12-09 14:07:00,14,2007-02-12,Monday,2.0
200701KD68503,554380,189620,0.226894,51.584242,1,3,2,2,18/12/2007,3,14:58,15,E09000016,6,0,6,30,6,4,6,0,0,0,1,1,1,0,0,1,1,E01002378,2025-12-09 14:58:00,14,,,
200701KD68514,550860,189330,0.176002,51.582589,1,3,1,1,07/12/2007,6,17:00,15,E09000016,3,125,6,30,0,-1,-1,0,0,0,4,2,2,0,0,1,1,E01002353,2025-12-09 17:00:00,17,2007-07-12,Thursday,7.0
200701KD68515,551660,189290,0.187522,51.582015,1,3,2,2,05/12/2007,4,15:20,15,E09000016,3,118,6,30,9,4,6,0,0,0,1,5,2,0,0,1,1,E01002353,2025-12-09 15:20:00,15,2007-05-12,Saturday,5.0
200701KD68516,554520,190070,0.229111,51.588247,1,2,1,1,05/12/2007,4,19:05,15,E09000016,5,0,6,30,3,2,6,0,0,4,4,1,1,0,0,1,1,E01002295,2025-12-09 19:05:00,19,2007-05-12,Saturday,5.0
200701KD68520,553080,190580,0.208563,51.593222,1,3,2,1,16/12/2007,1,19:30,15,E09000016,3,12,3,50,9,4,6,0,0,0,4,1,4,0,0,2,1,E01002311,2025-12-09 19:30:00,19,,,
200701KD68525,554470,192610,0.229507,51.611081,1,3,1,1,07/12/2007,6,07:30,15,E09000016,6,0,6,30,0,-1,-1,0,0,0,1,1,1,0,0,1,1,E01002278,2025-12-09 07:30:00,7,2007-07-12,Thursday,7.0
200701KD68529,556810,192420,0.263189,51.608728,1,3,3,1,26/12/2007,4,11:38,15,E09000016,1,25,3,70,0,-1,-1,0,0,0,1,1,1,0,0,2,2,E01002296,2025-12-09 11:38:00,11,,,
200701KD68531,554960,190830,0.235792,51.594954,1,3,1,1,18/12/2007,3,10:16,15,E09000016,6,0,9,30,9,4,6,0,0,0,1,1,1,0,0,1,2,E01002300,2025-12-09 10:16:00,10,,,
200701KD68532,553820,193300,0.22043,51.617459,1,3,2,1,13/12/2007,5,13:55,15,E09000016,5,0,9,30,0,-1,-1,0,0,0,1,9,1,0,0,1,2,E01002276,2025-12-09 13:55:00,13,,,
200701KD68536,553400,190630,0.213201,51.593584,1,3,2,1,23/12/2007,1,00:55,15,E09000016,3,12,6,30,1,4,3,12,0,8,4,7,2,0,0,1,1,E01002310,2025-12-09 00:55:00,0,,,
200701KD68540,553400,189400,0.212664,51.582533,1,3,1,1,19/12/2007,4,19:00,15,E09000016,6,0,6,30,0,-1,-1,0,0,0,4,1,2,0,0,1,1,E01002380,2025-12-09 19:00:00,19,,,
200701KD68542,554360,191850,0.227585,51.604283,1,3,1,1,19/12/2007,4,16:06,15,E09000016,5,0,6,30,0,-1,-1,0,0,0,1,1,1,0,0,1,1,E01002299,2025-12-09 16:06:00,16,,,
200701KD68545,553940,191150,0.221218,51.598109,1,3,1,1,20/12/2007,5,14:40,15,E09000016,6,0,9,30,0,-1,-1,0,0,0,1,1,2,0,0,1,1,E01002293,2025-12-09 14:40:00,14,,,
200701KD68550,552070,182700,0.190588,51.522693,1,3,2,1,18/12/2007,3,15:18,15,E09000016,3,125,6,30,0,-1,-1,0,0,0,1,1,2,0,0,1,1,E01002370,2025-12-09 15:18:00,15,,,
200701KD68555,551110,182810,0.176808,51.523939,1,3,2,1,12/12/2007,4,07:15,15,E09000016,3,1306,3,30,0,-1,-1,0,0,0,4,8,2,0,0,1,1,E01002368,2025-12-09 07:15:00,7,2007-12-12,Wednesday,12.0
200701KD68560,552120,183920,0.191834,51.533642,1,3,2,1,28/12/2007,6,17:53,15,E09000016,5,0,6,30,0,-1,-1,0,0,0,4,2,2,0,0,1,1,E01002374,2025-12-09 17:53:00,17,,,
200701KD68564,550990,188610,0.177567,51.576085,1,3,2,1,01/12/2007,7,16:45,15,E09000016,3,125,9,30,0,-1,-1,0,0,0,1,9,2,0,0,1,2,E01002356,2025-12-09 16:45:00,16,2007-01-12,Friday,1.0
200701KD68570,549430,190690,0.155956,51.595189,1,2,2,1,27/12/2007,5,11:05,15,E09000016,5,0,6,30,3,4,6,0,0,0,1,1,1,0,0,1,1,E01002325,2025-12-09 11:05:00,11,,,
200701KD68571,558180,189120,0.281471,51.578697,1,3,2,1,13/12/2007,5,17:00,15,E09000016,1,25,3,70,0,-1,-1,0,0,0,4,1,4,0,0,2,2,E01002259,2025-12-09 17:00:00,17,,,
200701KD68584,550810,189390,0.175306,51.583141,1,3,2,1,11/12/2007,3,16:45,15,E09000016,3,125,6,30,3,4,6,0,0,0,4,1,1,0,0,1,2,E01002243,2025-12-09 16:45:00,16,2007-11-12,Monday,11.0
200701KD68585,556890,192380,0.264326,51.608346,1,3,3,1,14/12/2007,6,17:20,15,E09000016,3,12,1,60,1,2,1,25,0,0,4,9,2,0,0,2,2,E01002296,2025-12-09 17:20:00,17,,,
200701KD68600,551010,187440,0.177353,51.565567,1,3,2,1,07/12/2007,6,21:50,15,E09000016,3,124,6,30,0,-1,-1,0,0,0,4,1,1,0,0,1,2,E01002249,2025-12-09 21:50:00,21,2007-07-12,Thursday,7.0
200701KD68603,558260,184300,0.280457,51.535369,1,3,2,1,09/12/2007,1,16:41,15,E09000016,1,25,3,70,0,-1,-1,0,0,0,5,2,2,0,0,2,1,E01002385,2025-12-09 16:41:00,16,2007-09-12,Wednesday,9.0
200701KD68605,556270,189030,0.253889,51.57842,1,3,2,1,13/12/2007,5,05:50,15,E09000016,3,127,3,70,5,4,5,0,0,0,4,8,4,0,0,2,1,E01002296,2025-12-09 05:50:00,5,,,
200701KD68608,551990,183390,0.189733,51.528915,1,3,2,1,21/12/2007,6,11:50,15,E09000016,5,0,6,30,3,2,3,125,0,0,1,1,1,0,0,1,2,E01002374,2025-12-09 11:50:00,11,,,
200701KD68648,558380,188380,0.284022,51.571992,1,3,5,1,10/12/2007,2,17:36,15,E09000016,3,127,3,70,9,4,1,25,0,0,6,1,1,4,0,2,1,E01002252,2025-12-09 17:36:00,17,2007-10-12,Friday,10.0
200701KD68653,550810,189390,0.175306,51.583141,1,3,2,1,11/12/2007,3,11:03,15,E09000016,3,125,3,30,0,-1,-1,0,0,0,1,1,1,0,0,1,1,E01002243,2025-12-09 11:03:00,11,2007-11-12,Monday,11.0
200701KD68654,550840,188500,0.175357,51.575136,1,3,2,1,17/12/2007,2,22:30,15,E09000016,3,118,6,30,0,-1,-1,0,0,0,4,1,1,0,0,1,1,E01002356,2025-12-09 22:30:00,22,,,
200701KD68659,553940,190490,0.220929,51.592179,1,3,2,2,20/12/2007,5,22:50,15,E09000016,6,0,6,30,3,4,6,0,0,0,4,1,2,0,0,1,1,E01002293,2025-12-09 22:50:00,22,,,
200701KD68662,551780,187410,0.188441,51.565091,1,3,2,1,10/12/2007,2,15:50,15,E09000016,3,124,9,30,3,2,3,124,0,0,1,1,1,0,0,1,1,E01002319,2025-12-09 15:50:00,15,2007-10-12,Friday,10.0
200701KD68685,558180,189090,0.281458,51.578427,1,3,2,1,18/12/2007,3,19:30,15,E09000016,1,25,3,70,0,-1,-1,0,0,0,4,1,1,0,0,2,2,E01002259,2025-12-09 19:30:00,19,,,
200701KD68695,552000,183400,0.189881,51.529002,1,3,2,2,17/12/2007,2,10:55,15,E09000016,3,125,6,30,6,2,3,125,0,5,1,1,2,0,0,1,1,E01002374,2025-12-09 10:55:00,10,,,
200701KD68698,551260,188030,0.181211,51.570801,1,3,2,1,19/12/2007,4,14:45,15,E09000016,3,125,1,30,1,4,6,0,0,0,1,1,1,0,0,1,2,E01002249,2025-12-09 14:45:00,14,,,
200701KD68715,556800,192290,0.262987,51.607563,1,3,2,1,23/12/2007,1,09:20,15,E09000016,1,25,1,30,1,4,3,12,0,0,1,7,1,0,0,2,2,E01002296,2025-12-09 09:20:00,9,,,
200701KD68717,555550,191660,0.244671,51.602249,1,2,2,1,17/12/2007,2,15:55,15,E09000016,3,12,3,50,6,2,5,0,0,0,4,1,1,0,0,1,1,E01002296,2025-12-09 15:55:00,15,,,
200701KD68718,554620,186680,0.229062,51.557761,1,3,1,1,05/12/2007,4,07:34,15,E09000016,5,0,6,30,0,-1,-1,0,0,0,1,2,2,0,0,1,1,E01002360,2025-12-09 07:34:00,7,2007-05-12,Saturday,5.0
200701KD68724,551660,181480,0.184158,51.511842,1,3,2,1,08/12/2007,7,19:20,15,E09000016,3,13,3,50,0,-1,-1,0,0,0,4,2,2,0,2,2,1,E01002344,2025-12-09 19:20:00,19,2007-08-12,Sunday,8.0
200701KD68730,553110,186170,0.207075,51.55359,1,3,2,1,27/12/2007,5,14:15,15,E09000016,5,0,9,30,0,-1,-1,0,0,0,1,9,1,0,0,1,2,E01002366,2025-12-09 14:15:00,14,,,
200701KD68735,553540,183050,0.211912,51.525441,1,3,2,1,09/10/2007,3,14:45,15,E09000016,6,0,9,30,0,-1,-1,0,0,0,1,9,2,0,0,1,2,E01002349,2025-12-09 14:45:00,14,2007-09-10,Monday,9.0
200701KD68740,554380,188810,0.226538,51.576964,1,3,2,1,17/12/2007,2,10:14,15,E09000016,6,0,6,30,3,4,6,0,0,0,1,1,1,0,0,1,2,E01002270,2025-12-09 10:14:00,10,,,
200701KD68752,554990,187370,0.234699,51.563859,1,2,2,1,31/12/2007,2,00:38,15,E09000016,5,0,6,30,9,4,6,0,0,0,4,1,2,0,0,1,1,E01002273,2025-12-09 00:38:00,0,,,
200701KD68759,550650,182930,0.170233,51.52514,1,3,2,1,22/12/2007,7,10:12,15,E09000016,3,1306,3,30,3,2,5,0,0,0,1,1,2,0,0,1,1,E01002368,2025-12-09 10:12:00,10,,,
200701KD68766,554120,187070,0.222026,51.561402,1,2,1,1,20/12/2007,5,09:15,15,E09000016,3,124,6,30,5,4,3,124,0,4,1,1,2,0,0,1,1,E01002361,2025-12-09 09:15:00,9,,,
200701KD68769,554710,180280,0.22755,51.500234,1,2,1,2,28/12/2007,6,22:55,15,E09000016,3,13,3,70,5,4,3,1306,0,0,6,5,2,0,0,2,1,E01002344,2025-12-09 22:55:00,22,,,
200701KD68811,553930,187960,0.219677,51.56945,1,3,2,1,28/12/2007,6,20:02,15,E09000016,5,0,6,30,3,4,6,0,0,0,4,2,2,0,0,1,1,E01002274,2025-12-09 20:02:00,20,,,
200701KD68827,553350,190540,0.21244,51.592789,1,3,2,2,28/08/2007,3,07:07,15,E09000016,3,12,1,30,1,4,3,118,0,4,1,1,1,0,0,1,1,E01002311,2025-12-09 07:07:00,7,,,
200701KD68873,551300,191630,0.183338,51.603136,1,2,2,2,23/12/2007,1,19:24,15,E09000016,5,0,6,30,0,-1,-1,0,0,0,4,7,2,0,0,1,1,E01002341,2025-12-09 19:24:00,19,,,
200701KD68903,554140,186040,0.221863,51.552142,1,3,3,3,22/11/2007,5,19:00,15,E09000016,6,0,6,30,6,4,6,0,0,0,4,1,1,3,0,1,1,E01002290,2025-12-09 19:00:00,19,,,
200701KD68955,552000,183360,0.189864,51.528642,1,3,2,2,14/12/2007,6,11:45,15,E09000016,3,125,6,30,7,4,3,125,0,0,1,1,1,0,0,1,1,E01002374,2025-12-09 11:45:00,11,,,
200701KD68967,554330,180260,0.222071,51.500158,1,3,2,1,06/11/2007,3,12:34,15,E09000016,3,13,3,30,0,-1,-1,0,0,0,1,9,1,0,0,2,1,E01002344,2025-12-09 12:34:00,12,2007-06-11,Monday,6.0
200701KD68992,556040,186540,0.249467,51.556112,1,3,2,1,22/08/2007,4,22:10,15,E09000016,4,187,6,30,0,-1,-1,0,0,5,1,2,2,0,0,1,1,E01002386,2025-12-09 22:10:00,22,,,
200701KD69022,558750,187720,0.289058,51.565958,1,3,2,2,29/12/2007,7,14:05,15,E09000016,1,25,3,70,0,-1,-1,0,0,0,1,1,1,0,0,2,1,E01002252,2025-12-09 14:05:00,14,,,
200701KD69026,550630,182950,0.169954,51.525325,1,3,2,2,03/12/2007,2,17:32,15,E09000016,3,1306,3,30,3,2,5,0,0,5,4,1,2,0,0,1,1,E01002368,2025-12-09 17:32:00,17,2007-03-12,Monday,3.0
200701KF67223,551770,188570,0.188797,51.575516,1,3,2,1,05/09/2007,4,09:15,15,E09000016,5,0,6,30,0,-1,-1,0,0,0,1,1,1,0,0,1,2,E01002357,2025-12-09 09:15:00,9,2007-05-09,Wednesday,5.0
200701KG68071,552440,185140,0.196972,51.544517,1,3,1,1,19/11/2007,2,20:10,15,E09000016,6,0,3,30,0,-1,-1,0,0,0,4,2,2,0,0,1,2,E01002266,2025-12-09 20:10:00,20,,,
200701KG68219,554560,186960,0.22832,51.560293,1,2,2,1,05/10/2007,6,15:46,15,E09000016,3,124,9,30,0,-1,-1,0,0,0,1,1,1,0,0,1,1,E01002360,2025-12-09 15:46:00,15,2007-05-10,Thursday,5.0
200701KG70041,550630,182930,0.169945,51.525146,1,3,1,1,29/01/2007,2,12:19,15,E09000016,5,0,3,50,3,4,3,1306,0,0,1,1,1,0,0,1,1,E01002368,2025-12-09 12:19:00,12,,,
200701KG70061,551510,183840,0.183012,51.533087,1,3,2,1,22/02/2007,5,19:15,15,E09000016,3,125,6,30,0,-1,-1,0,0,0,4,1,1,0,0,1,2,E01002375,2025-12-09 19:15:00,19,,,
200701KG70086,551580,189650,0.186524,51.585271,1,2,1,1,24/03/2007,7,14:34,15,E09000016,5,0,6,30,3,4,6,0,0,0,1,1,1,0,0,1,1,E01002353,2025-12-09 14:34:00,14,,,
200701TC00013,553330,190530,0.212147,51.592704,1,2,3,1,05/01/2007,6,17:40,15,E09000016,3,12,3,30,1,4,3,12,0,0,4,1,2,0,0,2,1,E01002337,2025-12-09 17:40:00,17,2007-05-01,Tuesday,5.0
200701TC00014,553590,187330,0.214499,51.563882,1,3,1,1,18/01/2007,5,20:00,15,E09000016,6,0,6,30,0,-1,-1,0,0,0,4,1,2,0,0,1,1,E01002367,2025-12-09 20:00:00,20,,,
200701TC00022,551070,191690,0.180046,51.603737,1,2,2,2,02/02/2007,6,22:05,15,E09000016,4,1459,6,30,6,2,4,175,0,5,4,1,1,0,0,1,1,E01002303,2025-12-09 22:05:00,22,2007-02-02,Friday,2.0
200701TC00038,553820,180420,0.214799,51.501734,1,2,1,1,18/01/2007,5,08:30,15,E09000016,3,13,3,50,0,-1,-1,0,0,0,1,5,2,0,0,2,1,E01002344,2025-12-09 08:30:00,8,,,
200701TC00039,551810,187090,0.188735,51.562207,1,2,1,1,08/01/2007,2,15:08,15,E09000016,3,125,6,30,3,4,6,0,0,0,1,8,2,0,0,1,1,E01002319,2025-12-09 15:08:00,15,2007-08-01,Wednesday,8.0
200701TC00045,553420,190530,0.213446,51.59268,1,2,2,2,12/01/2007,6,10:12,15,E09000016,3,12,1,30,1,4,3,127,0,4,1,1,1,0,0,1,1,E01002293,2025-12-09 10:12:00,10,2007-12-01,Saturday,12.0
200701TC00047,554020,180340,0.217643,51.500961,1,1,2,1,16/01/2007,3,06:40,15,E09000016,3,13,3,70,0,-1,-1,0,0,0,4,1,1,0,0,2,1,E01002344,2025-12-09 06:40:00,6,,,
200701TC00051,551410,182950,0.181189,51.525117,1,2,2,2,28/02/2007,4,12:30,15,E09000016,6,0,6,30,6,2,6,0,0,0,1,2,2,0,0,1,1,E01002369,2025-12-09 12:30:00,12,,,
200701TC00054,550730,189500,0.1742,51.584151,1,1,1,1,13/03/2007,3,10:30,15,E09000016,3,125,6,30,6,4,6,0,0,1,1,1,1,0,0,1,1,E01002243,2025-12-09 10:30:00,10,,,
200701TC00073,554530,180930,0.225243,51.506123,1,2,2,2,13/03/2007,3,08:17,15,E09000016,3,1306,6,30,3,4,4,1335,0,0,1,1,1,0,0,2,1,E01002344,2025-12-09 08:17:00,8,,,
200701TC00076,551230,190400,0.181798,51.592104,1,3,2,2,22/03/2007,5,13:30,15,E09000016,3,12,3,50,7,2,6,0,0,5,1,1,1,0,0,1,1,E01002334,2025-12-09 13:30:00,13,,,
200701TC00116,554840,185380,0.231661,51.54602,1,1,2,2,18/05/2007,6,17:55,15,E09000016,5,0,6,30,3,4,6,0,0,0,1,1,1,0,0,2,1,E01002389,2025-12-09 17:55:00,17,,,
200701TC00126,550860,187790,0.175341,51.568752,1,2,1,1,21/05/2007,2,16:15,15,E09000016,5,0,6,30,0,-1,-1,0,0,0,1,1,2,0,0,1,1,E01002248,2025-12-09 16:15:00,16,,,
200701TC00127,553210,186600,0.208703,51.557427,1,3,2,1,17/05/2007,5,12:06,15,E09000016,5,0,6,30,3,4,6,0,0,0,1,1,2,0,0,1,1,E01002363,2025-12-09 12:06:00,12,,,
200801HT70294,553260,189720,0.210784,51.585446,1,3,1,1,12/03/2008,4,15:30,15,E09000016,5,0,6,30,3,4,6,0,0,0,1,1,1,0,0,1,2,E01002383,2025-12-09 15:30:00,15,2008-12-03,Wednesday,12.0
200801JI69940,552590,190960,0.20166,51.596769,1,3,1,1,12/02/2008,3,08:25,15,E09000016,6,0,6,30,0,-1,-1,0,0,0,1,7,2,0,0,1,2,E01002311,2025-12-09 08:25:00,8,2008-12-02,Tuesday,12.0
200801JI70423,553860,188980,0.219114,51.578634,1,2,2,1,19/03/2008,4,20:10,15,E09000016,5,0,1,30,1,4,6,0,0,8,7,1,1,0,0,1,1,E01002270,2025-12-09 20:10:00,20,,,
200801KD69063,553810,189500,0.21862,51.583319,1,3,2,1,06/01/2008,1,21:15,15,E09000016,5,0,6,30,6,4,6,0,0,0,4,2,2,0,0,1,1,E01002380,2025-12-09 21:15:00,21,2008-06-01,Sunday,6.0
200801KD69069,552200,184010,0.193026,51.534429,1,3,1,1,09/01/2008,4,09:00,15,E09000016,5,0,6,30,3,3,6,0,0,0,1,9,1,0,0,1,2,E01002372,2025-12-09 09:00:00,9,2008-09-01,Monday,9.0
200801KD69079,550940,188600,0.176842,51.576008,1,3,2,1,12/01/2008,7,23:05,15,E09000016,3,118,1,30,1,4,6,0,0,0,4,2,2,0,0,1,1,E01002356,2025-12-09 23:05:00,23,2008-12-01,Monday,12.0
200801KD69082,553070,190160,0.208236,51.589451,1,3,2,1,15/01/2008,3,08:20,15,E09000016,3,118,3,30,3,3,6,0,0,0,1,9,1,0,0,1,2,E01002337,2025-12-09 08:20:00,8,,,
200801KD69085,552000,183400,0.189881,51.529002,1,3,2,1,15/01/2008,3,19:54,15,E09000016,3,125,6,30,6,2,5,0,0,0,4,2,2,0,0,1,1,E01002374,2025-12-09 19:54:00,19,,,
200801KD69088,551100,191690,0.180478,51.603729,1,3,2,1,16/01/2008,4,19:54,15,E09000016,4,1459,6,30,6,2,6,0,0,0,4,1,1,0,0,1,1,E01002304,2025-12-09 19:54:00,19,,,
200801KD69095,556250,186580,0.252512,51.556414,1,3,2,1,23/01/2008,4,14:00,15,E09000016,4,187,6,30,3,4,6,0,0,0,1,1,1,0,0,1,1,E01002386,2025-12-09 14:00:00,14,,,
200801KD69097,550630,189750,0.172865,51.586424,1,3,2,1,03/01/2008,5,17:45,15,E09000016,3,12,3,60,5,2,4,174,0,0,4,1,1,0,0,1,2,E01002338,2025-12-09 17:45:00,17,2008-03-01,Saturday,3.0
200801KD69099,551790,187420,0.188589,51.565178,1,3,2,1,09/01/2008,4,18:50,15,E09000016,3,124,9,30,0,-1,-1,0,0,0,4,9,1,0,0,1,2,E01002319,2025-12-09 18:50:00,18,2008-09-01,Monday,9.0
200801KD69100,551450,188160,0.184006,51.571918,1,3,2,1,10/01/2008,5,07:50,15,E09000016,5,0,6,30,7,2,5,0,0,0,1,9,1,0,0,1,2,E01002356,2025-12-09 07:50:00,7,2008-10-01,Wednesday,10.0
200801KD69106,558480,188290,0.285423,51.571155,1,3,1,1,04/01/2008,6,11:00,15,E09000016,1,25,3,40,5,4,6,0,0,0,1,1,2,0,0,2,1,E01002252,2025-12-09 11:00:00,11,2008-04-01,Tuesday,4.0
200801KD69117,556030,186550,0.249327,51.556205,1,3,2,2,11/01/2008,6,20:00,15,E09000016,5,0,6,30,6,2,4,1421,0,0,7,1,2,0,0,1,2,E01002386,2025-12-09 20:00:00,20,2008-11-01,Saturday,11.0
200801KD69119,551100,191690,0.180478,51.603729,1,3,2,2,27/01/2008,1,15:19,15,E09000016,4,1459,6,30,6,2,4,1459,0,0,1,1,1,0,0,1,1,E01002304,2025-12-09 15:19:00,15,,,
200801KD69124,552260,188350,0.195768,51.573407,1,3,2,1,25/01/2008,6,17:00,15,E09000016,5,0,6,30,3,4,6,0,0,0,4,1,1,0,0,1,1,E01002352,2025-12-09 17:00:00,17,,,
200801KD69135,550920,187420,0.176047,51.565411,1,3,3,1,03/01/2008,5,17:45,15,E09000016,3,124,3,40,0,-1,-1,0,0,0,4,9,2,0,0,1,2,E01002248,2025-12-09 17:45:00,17,2008-03-01,Saturday,3.0
200801KD69136,551600,188020,0.186109,51.57062,1,2,3,1,02/01/2008,4,12:54,15,E09000016,5,0,6,30,3,4,5,0,0,0,1,1,1,0,0,1,2,E01002350,2025-12-09 12:54:00,12,2008-02-01,Friday,2.0
200801KD69151,550430,182360,0.166821,51.520077,1,3,3,1,31/01/2008,5,06:14,15,E09000016,3,13,6,40,5,4,5,0,0,0,4,1,2,0,0,1,1,E01002370,2025-12-09 06:14:00,6,,,
200801KD69158,553930,190950,0.220986,51.596314,1,3,1,2,19/01/2008,7,14:50,15,E09000016,6,0,6,30,1,4,6,0,0,0,1,1,2,0,0,1,1,E01002293,2025-12-09 14:50:00,14,,,
200801KD69159,552230,188810,0.195534,51.577548,1,2,3,1,28/01/2008,2,06:25,15,E09000016,5,0,6,30,3,4,6,0,0,0,4,7,2,0,0,1,1,E01002382,2025-12-09 06:25:00,6,,,
200801KD69160,552060,183560,0.190815,51.530423,1,3,2,2,11/01/2008,6,19:45,15,E09000016,5,0,6,30,3,4,6,0,0,0,4,1,1,0,0,1,2,E01002374,2025-12-09 19:45:00,19,2008-11-01,Saturday,11.0
200801KD69161,553280,186820,0.209808,51.559384,1,3,2,1,22/01/2008,3,15:05,15,E09000016,5,0,6,30,0,-1,-1,0,0,1,1,1,1,0,0,1,1,E01002363,2025-12-09 15:05:00,15,,,
200801KD69162,550830,191110,0.176333,51.59859,1,3,2,1,14/01/2008,2,07:40,15,E09000016,4,175,6,30,3,4,6,0,0,8,1,1,1,0,0,1,2,E01002333,2025-12-09 07:40:00,7,,,
200801KD69175,556500,188120,0.2568,51.570181,1,3,2,1,18/01/2008,6,10:16,15,E09000016,5,0,1,30,1,4,6,0,0,0,1,1,1,0,0,1,1,E01002253,2025-12-09 10:16:00,10,,,
200801KD69179,550630,182950,0.169954,51.525325,1,3,2,3,05/01/2008,7,19:05,15,E09000016,3,1306,3,30,6,2,5,0,0,0,4,1,2,0,0,1,1,E01002368,2025-12-09 19:05:00,19,2008-05-01,Thursday,5.0
200801KD69183,550070,192100,0.165792,51.607688,1,3,2,1,20/01/2008,1,20:15,15,E09000016,6,0,6,30,3,4,6,0,0,0,4,1,1,0,0,1,1,E01002307,2025-12-09 20:15:00,20,,,
200801KD69185,551030,189070,0.178342,51.580207,1,3,2,1,30/01/2008,4,10:55,15,E09000016,3,125,1,30,1,4,3,118,0,0,1,1,1,0,0,1,1,E01002243,2025-12-09 10:55:00,10,,,
200801KD69192,552540,184250,0.198028,51.536493,1,3,2,1,23/01/2008,4,08:30,15,E09000016,5,0,6,30,0,-1,-1,0,0,0,1,1,1,0,0,1,1,E01002372,2025-12-09 08:30:00,8,,,
200801KD69199,551680,183710,0.185405,51.531873,1,3,2,1,10/01/2008,5,16:31,15,E09000016,6,0,6,30,3,4,3,125,0,0,4,2,2,0,0,1,1,,2025-12-09 16:31:00,16,2008-10-01,Wednesday,10.0
200801KD69200,556930,184830,0.261532,51.540502,1,3,2,2,16/01/2008,4,10:35,15,E09000016,4,1421,6,60,9,4,6,0,0,0,1,8,2,0,0,2,1,E01002385,2025-12-09 10:35:00,10,,,
200801KD69212,556500,188130,0.256805,51.57027,1,3,2,1,05/01/2008,7,09:58,15,E09000016,5,0,1,30,1,4,6,0,0,0,1,1,2,0,0,1,1,E01002253,2025-12-09 09:58:00,9,2008-05-01,Thursday,5.0
200801KD69214,550430,188920,0.169625,51.57902,1,2,2,2,27/01/2008,1,17:30,15,E09000016,5,0,6,30,3,4,6,0,0,0,4,1,1,0,0,1,1,E01002243,2025-12-09 17:30:00,17,,,
200801KD69218,549410,190990,0.155795,51.59789,1,3,2,1,20/01/2008,1,18:33,15,E09000016,4,174,6,30,3,2,5,0,0,4,4,1,1,0,0,1,1,E01002326,2025-12-09 18:33:00,18,,,
200801KD69219,550630,182950,0.169954,51.525325,1,3,2,1,31/01/2008,5,07:56,15,E09000016,5,0,3,30,9,2,5,0,0,8,1,4,2,0,0,1,1,E01002368,2025-12-09 07:56:00,7,,,
200801KD69227,554140,186040,0.221863,51.552142,1,3,2,3,08/01/2008,3,08:58,15,E09000016,6,0,6,30,9,3,6,0,0,0,1,9,2,0,0,1,1,E01002290,2025-12-09 08:58:00,8,2008-08-01,Friday,8.0
200801KD69233,550650,189570,0.173076,51.584801,1,3,2,1,09/01/2008,4,22:42,15,E09000016,3,125,2,30,3,4,6,0,0,0,4,1,1,0,0,1,1,E01002245,2025-12-09 22:42:00,22,2008-09-01,Monday,9.0
200801KD69239,553990,187220,0.220218,51.562785,1,3,1,1,12/01/2008,7,11:50,15,E09000016,5,0,6,30,3,4,6,0,0,0,1,9,1,0,0,1,1,E01002361,2025-12-09 11:50:00,11,2008-12-01,Monday,12.0
200801KD69243,549230,190960,0.153186,51.597668,1,3,1,1,29/01/2008,3,08:10,15,E09000016,4,174,2,30,9,1,5,0,0,0,1,1,1,0,0,1,1,E01002326,2025-12-09 08:10:00,8,,,
200801KD69269,553450,182240,0.210264,51.518187,1,3,3,1,10/01/2008,5,14:59,15,E09000016,3,1306,3,40,6,4,6,0,0,0,1,4,2,0,0,1,1,E01002344,2025-12-09 14:59:00,14,2008-10-01,Wednesday,10.0
200801KD69283,550960,188680,0.177165,51.576722,1,3,2,2,19/01/2008,7,18:58,15,E09000016,3,125,1,30,1,4,3,125,0,0,4,1,2,0,0,1,1,E01002356,2025-12-09 18:58:00,18,,,
200801KD69286,550630,189750,0.172865,51.586424,1,3,3,1,02/01/2008,4,16:50,15,E09000016,3,12,3,60,9,2,3,12,0,0,1,9,1,0,0,1,1,E01002338,2025-12-09 16:50:00,16,2008-02-01,Friday,2.0
200801KD69287,557360,188300,0.26928,51.571559,1,2,1,1,27/01/2008,1,02:51,15,E09000016,5,0,6,30,0,-1,-1,0,0,0,4,1,1,0,0,1,1,E01002259,2025-12-09 02:51:00,2,,,
200801KD69307,553890,185970,0.218229,51.551581,1,3,1,1,21/01/2008,2,17:22,15,E09000016,5,0,6,30,3,4,6,0,0,0,1,5,2,0,0,1,1,E01002285,2025-12-09 17:22:00,17,,,
200801KD69328,551000,188650,0.177729,51.576441,1,3,2,3,31/01/2008,5,12:56,15,E09000016,3,125,1,30,1,2,3,125,0,0,1,2,2,0,0,1,1,E01002356,2025-12-09 12:56:00,12,,,
200801KD69329,550300,190100,0.168255,51.589657,1,3,2,1,18/01/2008,6,18:00,15,E09000016,6,0,6,30,3,4,4,174,0,0,4,9,2,0,0,1,2,E01002338,2025-12-09 18:00:00,18,,,
200801KD69338,556010,186550,0.249039,51.55621,1,2,1,1,29/01/2008,3,17:15,15,E09000016,4,1421,6,30,6,4,3,124,0,4,1,1,1,0,0,1,2,E01002386,2025-12-09 17:15:00,17,,,
200801KD69376,557190,191370,0.268202,51.599188,1,3,3,2,28/01/2008,2,06:45,15,E09000016,1,25,3,70,0,-1,-1,0,0,0,4,7,2,0,0,2,1,E01002296,2025-12-09 06:45:00,6,,,
200801KD69388,553940,190120,0.220767,51.588854,1,3,2,1,12/01/2008,7,09:50,15,E09000016,3,127,9,30,0,-1,-1,0,0,0,1,9,1,0,0,1,1,E01002295,2025-12-09 09:50:00,9,2008-12-01,Monday,12.0
200801KD69389,549990,188420,0.163066,51.574644,1,2,2,1,14/01/2008,2,08:55,15,E09000016,3,118,6,30,8,4,6,0,0,0,1,9,1,0,0,1,2,E01002246,2025-12-09 08:55:00,8,,,
200801KD69399,551120,192980,0.181323,51.615314,1,2,2,1,18/01/2008,6,07:05,15,E09000016,4,175,6,30,9,4,6,0,0,0,1,1,1,0,0,2,2,E01002304,2025-12-09 07:05:00,7,,,
200801KD69405,556250,193120,0.255421,51.615173,1,3,2,3,16/01/2008,4,04:21,15,E09000016,1,25,3,70,0,-1,-1,0,0,0,4,1,2,0,0,2,1,E01002277,2025-12-09 04:21:00,4,,,
200801KD69409,554420,194510,0.229622,51.628166,1,3,2,2,08/01/2008,3,02:15,15,E09000016,1,25,3,70,0,-1,-1,0,0,0,4,1,1,0,0,2,2,E01002276,2025-12-09 02:15:00,2,2008-08-01,Friday,8.0
200801KD69415,550140,192090,0.166798,51.60758,1,3,2,1,06/01/2008,1,12:55,15,E09000016,6,0,6,30,0,-1,-1,0,0,0,1,1,1,0,0,1,2,E01002307,2025-12-09 12:55:00,12,2008-06-01,Sunday,6.0
200801KD69441,553440,190540,0.213739,51.592764,1,3,2,3,22/01/2008,3,15:21,15,E09000016,3,12,1,30,0,-1,-1,0,0,0,1,1,1,0,0,1,1,E01002293,2025-12-09 15:21:00,15,,,
200801KD69448,553850,190680,0.219714,51.59391,1,3,1,1,17/01/2008,5,13:25,15,E09000016,6,0,6,30,0,-1,-1,0,0,0,1,1,2,0,0,1,1,E01002293,2025-12-09 13:25:00,13,,,
200801KD69461,553440,190540,0.213739,51.592764,1,3,2,1,29/01/2008,3,14:30,15,E09000016,3,127,6,30,9,4,3,12,0,0,1,1,1,0,0,1,2,E01002293,2025-12-09 14:30:00,14,,,
200801KD69488,554800,190190,0.233202,51.589248,1,3,1,2,30/01/2008,4,17:45,15,E09000016,5,0,6,30,9,4,5,0,0,0,1,1,1,0,0,1,2,E01002295,2025-12-09 17:45:00,17,,,
200801KD69489,554810,186020,0.23151,51.551779,1,3,1,1,17/01/2008,5,14:30,15,E09000016,5,0,6,30,0,-1,-1,0,0,0,1,2,2,0,0,1,1,E01002292,2025-12-09 14:30:00,14,,,
200801KD69492,551620,187190,0.186039,51.563157,1,3,1,1,24/01/2008,5,16:30,15,E09000016,6,0,9,30,0,-1,-1,0,0,0,1,1,1,0,0,1,2,E01002323,2025-12-09 16:30:00,16,,,
200801KD69496,556750,192390,0.26231,51.608475,1,3,2,1,21/01/2008,2,08:01,15,E09000016,1,25,3,70,0,-1,-1,0,0,0,1,1,1,0,0,2,1,E01002277,2025-12-09 08:01:00,8,,,
200801KD69502,551540,187170,0.184878,51.562999,1,3,1,1,24/01/2008,5,16:52,15,E09000016,6,0,6,30,9,4,6,0,0,0,5,1,1,0,0,1,2,E01002323,2025-12-09 16:52:00,16,,,
200801KD69523,553790,187220,0.217334,51.562839,1,3,1,2,01/02/2008,6,21:46,15,E09000016,3,124,6,30,0,-1,-1,0,0,5,4,1,1,0,0,1,1,E01002361,2025-12-09 21:46:00,21,2008-01-02,Wednesday,1.0
200801KD69536,556070,185220,0.249314,51.544244,1,3,1,1,02/02/2008,7,09:15,15,E09000016,4,1421,6,30,3,4,6,0,0,0,1,1,1,0,0,1,1,E01002388,2025-12-09 09:15:00,9,2008-02-02,Saturday,2.0
200801KD69537,551780,187410,0.188441,51.565091,1,3,1,1,15/02/2008,6,02:00,15,E09000016,3,124,1,30,1,4,3,125,0,0,4,2,2,0,0,1,1,E01002319,2025-12-09 02:00:00,2,,,
200801KD69547,551900,187430,0.19018,51.565238,1,3,2,2,23/02/2008,7,09:50,15,E09000016,3,124,6,30,7,2,3,125,0,0,1,1,1,0,0,1,1,E01002319,2025-12-09 09:50:00,9,,,
200801KD69566,554640,186950,0.229469,51.560181,1,3,1,1,26/02/2008,3,21:00,15,E09000016,3,124,6,30,6,4,5,0,0,0,4,1,1,0,0,1,2,E01002362,2025-12-09 21:00:00,21,,,
200801KD69581,558540,188160,0.286229,51.56997,1,3,4,2,11/02/2008,2,08:35,15,E09000016,1,25,3,70,5,4,6,0,0,0,1,7,2,0,0,2,1,E01002252,2025-12-09 08:35:00,8,2008-11-02,Sunday,11.0
200801KD69591,549930,191180,0.163379,51.599459,1,3,1,1,03/02/2008,1,09:30,15,E09000016,4,174,6,30,1,4,4,1459,0,0,1,1,1,0,0,1,1,E01002302,2025-12-09 09:30:00,9,2008-03-02,Sunday,3.0
200801KD69607,551410,181660,0.180635,51.513526,1,3,2,1,25/02/2008,2,02:20,15,E09000016,3,13,3,50,5,4,6,0,0,0,4,1,2,0,0,2,2,E01002344,2025-12-09 02:20:00,2,,,
200801KD69631,555190,188070,0.237891,51.570093,1,3,2,1,23/02/2008,7,15:00,15,E09000016,5,0,1,30,1,4,6,0,0,0,1,1,1,0,0,1,1,E01002273,2025-12-09 15:00:00,15,,,
200801KD69648,553820,192230,0.219961,51.607845,1,3,2,1,21/02/2008,5,00:01,15,E09000016,5,0,6,30,3,4,6,0,0,0,7,1,1,0,0,1,2,E01002280,2025-12-09 00:01:00,0,,,
200801KD69664,551260,188030,0.181211,51.570801,1,3,2,1,28/02/2008,5,14:46,15,E09000016,3,125,1,30,1,4,6,0,0,0,1,1,1,0,0,1,1,E01002249,2025-12-09 14:46:00,14,,,
200801KD69669,553920,186130,0.218732,51.553011,1,3,1,1,26/02/2008,3,07:45,15,E09000016,5,0,6,30,3,4,6,0,0,0,1,4,2,0,0,1,1,E01002291,2025-12-09 07:45:00,7,,,
200801KD69670,549750,190800,0.16062,51.596093,1,2,1,1,20/02/2008,4,15:30,15,E09000016,6,0,9,30,0,-1,-1,0,0,0,1,9,1,0,0,1,2,E01002326,2025-12-09 15:30:00,15,,,
200801KD69671,553710,189070,0.21699,51.579483,1,3,2,1,28/02/2008,5,07:05,15,E09000016,6,0,6,30,9,3,6,0,0,0,1,1,1,0,0,1,1,E01002380,2025-12-09 07:05:00,7,,,
200801KD69673,552740,189290,0.203097,51.581723,1,3,1,1,07/02/2008,5,22:05,15,E09000016,5,0,6,30,3,4,6,0,0,0,4,1,1,0,0,1,1,E01002355,2025-12-09 22:05:00,22,2008-07-02,Wednesday,7.0
200801KD69688,553780,190420,0.21859,51.591593,1,3,2,1,05/02/2008,3,19:59,15,E09000016,6,0,6,30,9,4,6,0,0,0,4,2,2,0,0,1,1,E01002293,2025-12-09 19:59:00,19,2008-05-02,Friday,5.0
200801KD69692,551460,188140,0.184142,51.571736,1,3,2,1,28/02/2008,5,11:30,15,E09000016,5,0,6,30,6,2,5,0,0,5,1,1,1,0,0,1,1,E01002350,2025-12-09 11:30:00,11,,,
200801KD69702,550520,182380,0.168126,51.520233,1,3,2,1,19/02/2008,3,06:55,15,E09000016,3,13,3,70,0,-1,-1,0,0,0,1,1,1,0,0,1,1,E01002370,2025-12-09 06:55:00,6,,,
200801KD69714,553480,187210,0.212861,51.562834,1,3,1,1,02/02/2008,7,17:45,15,E09000016,3,124,6,30,3,4,5,0,0,0,4,1,1,0,0,1,2,E01002361,2025-12-09 17:45:00,17,2008-02-02,Saturday,2.0
200801KD69780,550800,188480,0.174772,51.574967,1,3,2,2,24/02/2008,1,16:45,15,E09000016,3,118,3,30,3,4,6,0,0,0,1,2,2,0,0,1,2,E01002356,2025-12-09 16:45:00,16,,,
200801KD69818,552070,183790,0.191058,51.532487,1,3,2,1,05/02/2008,3,11:30,15,E09000016,5,0,6,30,0,-1,-1,0,0,0,1,1,1,0,0,1,2,E01002374,2025-12-09 11:30:00,11,2008-05-02,Friday,5.0
200801KD69854,554770,180270,0.228409,51.500127,1,3,2,1,26/02/2008,3,16:55,15,E09000016,3,13,3,70,0,-1,-1,0,0,0,1,1,1,0,0,2,1,E01002344,2025-12-09 16:55:00,16,,,
200801KD69859,556880,192380,0.264182,51.608349,1,2,4,2,12/02/2008,3,18:57,15,E09000016,3,12,3,70,9,4,1,25,0,0,1,1,1,0,0,2,1,E01002296,2025-12-09 18:57:00,18,2008-12-02,Tuesday,12.0
200801KD69869,554460,181200,0.224354,51.508568,1,3,2,2,22/02/2008,6,15:30,15,E09000016,3,1306,3,70,0,-1,-1,0,0,0,1,1,1,0,0,2,1,E01002344,2025-12-09 15:30:00,15,,,
200801KD69879,551640,183880,0.184902,51.533411,1,3,2,1,17/02/2008,1,11:10,15,E09000016,6,0,6,30,8,4,6,0,0,0,1,1,1,0,0,1,1,E01002375,2025-12-09 11:10:00,11,,,
200801KD69880,551310,190470,0.182983,51.592711,1,3,3,2,16/02/2008,7,08:32,15,E09000016,3,12,3,50,0,-1,-1,0,0,0,1,1,1,0,0,1,1,E01002334,2025-12-09 08:32:00,8,,,
200801KD69881,554320,194550,0.228196,51.628553,1,3,2,1,29/02/2008,6,09:40,15,E09000016,1,25,3,70,0,-1,-1,0,0,0,1,1,1,0,0,2,1,E01002276,2025-12-09 09:40:00,9,,,
200801KD69883,553410,190530,0.213301,51.592683,1,3,2,1,28/02/2008,5,22:55,15,E09000016,3,12,9,40,1,4,3,12,0,0,4,9,1,0,0,1,1,E01002293,2025-12-09 22:55:00,22,,,
200801KD69892,554140,194700,0.225664,51.62995,1,3,2,1,18/02/2008,2,14:00,15,E09000016,1,25,3,70,0,-1,-1,0,0,0,1,1,1,0,0,2,1,E01002276,2025-12-09 14:00:00,14,,,
200801KD69901,554670,186120,0.229537,51.552716,1,3,2,1,13/02/2008,4,12:00,15,E09000016,6,0,6,30,0,-1,-1,0,0,0,1,1,1,0,0,1,2,E01002292,2025-12-09 12:00:00,12,,,
200801KD69902,551530,189170,0.185595,51.580972,1,3,2,1,22/02/2008,6,08:05,15,E09000016,3,118,6,30,0,-1,-1,0,0,0,1,1,1,0,0,1,2,E01002353,2025-12-09 08:05:00,8,,,
200801KD69907,551290,193040,0.183802,51.615808,1,2,1,1,16/02/2008,7,23:54,15,E09000016,5,0,6,30,3,4,4,175,0,0,4,3,4,0,0,1,1,E01002304,2025-12-09 23:54:00,23,,,
200801KD69927,551260,190460,0.182257,51.592635,1,3,2,1,18/02/2008,2,07:55,15,E09000016,6,0,6,30,0,-1,-1,0,0,0,1,1,1,0,0,1,1,E01002334,2025-12-09 07:55:00,7,,,
200801KD69929,555090,191800,0.238096,51.603633,1,2,1,2,10/02/2008,1,21:20,15,E09000016,5,0,6,30,9,4,6,0,0,0,4,1,1,0,0,1,1,E01002283,2025-12-09 21:20:00,21,2008-10-02,Thursday,10.0
200801KD69941,558460,188290,0.285134,51.571161,1,3,2,1,23/02/2008,7,12:10,15,E09000016,6,0,7,70,5,4,1,25,0,0,1,1,1,0,0,2,1,E01002252,2025-12-09 12:10:00,12,,,
200801KD69942,549500,190360,0.156826,51.592206,1,3,2,1,21/02/2008,5,12:48,15,E09000016,5,0,6,30,9,4,6,0,0,0,1,1,1,0,0,1,1,E01002325,2025-12-09 12:48:00,12,,,
200801KD69943,558690,187850,0.288252,51.567143,1,3,2,3,07/02/2008,5,12:00,15,E09000016,1,25,3,70,0,-1,-1,0,0,0,1,1,1,0,0,2,1,E01002252,2025-12-09 12:00:00,12,2008-07-02,Wednesday,7.0
200801KD69948,550560,188420,0.171285,51.574492,1,3,2,1,26/02/2008,3,22:55,15,E09000016,3,118,6,30,3,4,6,0,0,0,4,1,1,0,0,1,1,E01002356,2025-12-09 22:55:00,22,,,
200801KD69967,553910,185970,0.218518,51.551576,1,3,2,1,22/02/2008,6,21:10,15,E09000016,5,0,6,30,9,4,6,0,0,0,4,1,1,0,0,1,1,E01002285,2025-12-09 21:10:00,21,,,
200801KD69971,554720,191020,0.232414,51.596727,1,3,2,1,21/02/2008,5,16:45,15,E09000016,5,0,6,30,6,4,6,0,0,0,7,2,2,0,0,1,2,E01002300,2025-12-09 16:45:00,16,,,
200801KD69985,553850,187370,0.218265,51.564171,1,3,2,1,07/02/2008,5,09:10,15,E09000016,6,0,6,30,0,-1,-1,0,0,0,1,1,1,0,0,1,1,E01002367,2025-12-09 09:10:00,9,2008-07-02,Wednesday,7.0
200801KD70008,553270,191930,0.211893,51.605299,1,3,1,1,22/02/2008,6,08:35,15,E09000016,5,0,6,30,0,-1,-1,0,0,0,1,1,1,0,0,1,1,E01002314,2025-12-09 08:35:00,8,,,
200801KD70018,552560,185490,0.198853,51.547629,1,2,1,1,27/02/2008,4,16:30,15,E09000016,6,0,6,30,1,4,6,0,0,0,1,9,1,0,0,1,2,E01002262,2025-12-09 16:30:00,16,,,
200801KD70021,553370,185890,0.2107,51.551004,1,3,2,1,29/02/2008,6,23:27,15,E09000016,6,0,6,30,3,4,6,0,0,0,4,5,2,0,0,1,1,E01002286,2025-12-09 23:27:00,23,,,
200801KD70031,551590,187470,0.185728,51.565681,1,3,1,1,06/03/2008,5,06:55,15,E09000016,3,124,3,30,3,4,3,124,0,4,1,1,1,6,0,1,1,E01002249,2025-12-09 06:55:00,6,2008-06-03,Tuesday,6.0
200801KD70047,556390,192880,0.257334,51.612977,1,3,2,1,10/03/2008,2,09:40,15,E09000016,1,25,3,70,5,4,6,0,0,0,1,5,2,0,0,2,2,E01002277,2025-12-09 09:40:00,9,2008-10-03,Friday,10.0
200801KD70050,550220,187770,0.166105,51.568743,1,3,2,2,11/03/2008,3,17:34,15,E09000016,6,0,6,30,3,4,6,0,0,0,1,1,2,0,0,1,1,E01002248,2025-12-09 17:34:00,17,2008-11-03,Monday,11.0
200801KD70058,550620,189790,0.172737,51.586786,1,3,1,1,13/03/2008,5,10:08,15,E09000016,4,174,6,30,6,4,3,12,0,0,1,1,1,0,0,1,1,E01002338,2025-12-09 10:08:00,10,,,
200801KD70065,555600,191700,0.24541,51.602594,1,3,2,1,02/03/2008,1,00:40,15,E09000016,5,0,9,30,3,4,3,12,0,0,4,9,1,0,0,1,2,E01002283,2025-12-09 00:40:00,0,2008-02-03,Sunday,2.0
200801KD70068,552060,188520,0.192958,51.574989,1,3,2,1,20/03/2008,5,22:09,15,E09000016,6,0,6,30,3,4,6,0,0,0,4,5,2,0,0,1,1,E01002352,2025-12-09 22:09:00,22,,,
200801KD70080,553820,193300,0.22043,51.617459,1,3,2,1,07/03/2008,6,11:49,15,E09000016,5,0,6,30,3,4,6,0,0,0,1,1,1,0,0,1,1,E01002276,2025-12-09 11:49:00,11,2008-07-03,Thursday,7.0
200801KD70088,556270,186580,0.2528,51.556408,1,3,2,1,20/03/2008,5,10:25,15,E09000016,4,187,6,30,3,2,6,0,0,4,1,1,1,0,0,1,2,E01002387,2025-12-09 10:25:00,10,,,
200801KD70100,550620,189730,0.172712,51.586247,1,3,2,1,06/03/2008,5,20:20,15,E09000016,3,125,3,30,6,2,3,12,0,5,4,1,1,0,0,1,2,E01002245,2025-12-09 20:20:00,20,2008-06-03,Tuesday,6.0
200801KD70105,556300,189000,0.254308,51.578142,1,3,1,1,25/03/2008,3,20:04,15,E09000016,3,127,7,70,5,4,5,0,0,0,1,8,2,0,0,2,1,E01002253,2025-12-09 20:04:00,20,,,
200801KD70108,551680,181540,0.184472,51.512375,1,3,1,1,31/03/2008,2,07:27,15,E09000016,3,13,1,30,1,4,3,13,0,0,1,1,1,0,0,2,1,E01002344,2025-12-09 07:27:00,7,,,
200801KD70112,556910,192390,0.264619,51.608431,1,3,2,1,18/03/2008,3,17:15,15,E09000016,3,12,1,30,1,4,1,25,0,0,1,1,1,0,0,2,2,E01021468,2025-12-09 17:15:00,17,,,
200801KD70114,551460,188140,0.184142,51.571736,1,3,2,1,19/03/2008,4,13:00,15,E09000016,5,0,3,30,6,2,5,0,0,4,1,1,1,0,0,1,1,E01002350,2025-12-09 13:00:00,13,,,
200801KD70122,550100,189200,0.164985,51.581623,1,3,2,1,11/03/2008,3,08:24,15,E09000016,3,12,6,30,7,2,5,0,0,0,1,1,1,0,0,1,1,E01002244,2025-12-09 08:24:00,8,2008-11-03,Monday,11.0
200801KD70123,553690,192170,0.218058,51.607341,1,2,1,1,02/03/2008,1,00:50,15,E09000016,5,0,6,30,9,2,6,0,2,5,4,4,1,0,0,1,1,E01002282,2025-12-09 00:50:00,0,2008-02-03,Sunday,2.0
200801KD70129,552160,183990,0.192441,51.53426,1,3,1,1,28/03/2008,6,15:20,15,E09000016,5,0,6,30,9,4,6,0,0,1,1,8,2,0,6,1,1,E01002372,2025-12-09 15:20:00,15,,,
200801KD70139,553260,191230,0.211443,51.599013,1,2,1,1,09/03/2008,1,19:39,15,E09000016,5,0,6,30,3,4,6,0,0,0,4,1,2,0,0,1,1,E01002316,2025-12-09 19:39:00,19,2008-09-03,Wednesday,9.0
200801KD70143,558550,188160,0.286373,51.569968,1,3,1,1,01/03/2008,7,07:40,15,E09000016,1,25,3,70,0,-1,-1,0,0,0,1,1,1,0,2,2,1,E01002252,2025-12-09 07:40:00,7,2008-01-03,Thursday,1.0
200801KD70150,554860,185980,0.232213,51.551406,1,3,2,1,12/03/2008,4,11:50,15,E09000016,5,0,6,30,3,4,6,0,0,0,1,1,1,0,0,1,1,E01002292,2025-12-09 11:50:00,11,2008-12-03,Wednesday,12.0
200801KD70222,553270,185050,0.208893,51.543484,1,2,1,1,08/03/2008,7,14:00,15,E09000016,5,0,6,30,0,-1,-1,0,0,4,1,1,1,0,0,1,1,E01002265,2025-12-09 14:00:00,14,2008-08-03,Sunday,8.0
200801KD70230,553400,190550,0.213166,51.592865,1,3,2,2,03/03/2008,2,05:11,15,E09000016,3,12,1,30,1,4,3,12,0,0,1,1,1,0,0,1,1,E01002310,2025-12-09 05:11:00,5,2008-03-03,Monday,3.0
200801KD70251,552870,188520,0.204637,51.57477,1,3,2,1,03/03/2008,2,09:37,15,E09000016,5,0,6,30,6,4,6,0,0,0,1,1,1,0,0,1,1,E01002272,2025-12-09 09:37:00,9,2008-03-03,Monday,3.0
200801KD70289,554490,192520,0.229756,51.610267,1,3,2,1,26/03/2008,4,15:00,15,E09000016,6,0,6,30,3,4,6,0,0,0,1,2,2,0,0,1,1,E01002278,2025-12-09 15:00:00,15,,,
200801KD70304,551670,188910,0.187502,51.578598,1,3,1,1,26/02/2008,3,10:54,15,E09000016,6,0,6,30,0,-1,-1,0,0,0,1,1,1,0,0,1,1,E01002357,2025-12-09 10:54:00,10,,,
200801KD70323,558750,187630,0.289018,51.56515,1,3,2,1,03/02/2008,1,19:45,15,E09000016,1,25,3,70,0,-1,-1,0,0,0,4,1,1,0,0,2,1,E01002252,2025-12-09 19:45:00,19,2008-03-02,Sunday,3.0
200801KD70325,553830,188700,0.218559,51.576126,1,3,1,1,01/03/2008,7,18:00,15,E09000016,5,0,9,30,0,-1,-1,0,0,0,4,9,1,0,0,1,2,E01002381,2025-12-09 18:00:00,18,2008-01-03,Thursday,1.0
200801KD70344,556720,192380,0.261873,51.608394,1,1,1,1,24/02/2008,1,00:54,15,E09000016,3,12,1,70,0,-1,-1,0,0,0,4,1,1,0,0,2,1,E01002277,2025-12-09 00:54:00,0,,,
200801KD70346,550980,183300,0.175145,51.528377,1,3,2,1,05/03/2008,4,15:20,15,E09000016,6,0,6,30,3,4,6,0,0,0,1,1,1,0,0,1,1,E01002369,2025-12-09 15:20:00,15,2008-05-03,Saturday,5.0
200801KD70352,551980,191650,0.193158,51.603133,1,3,1,2,29/02/2008,6,10:30,15,E09000016,5,0,6,30,0,-1,-1,0,0,0,1,1,1,0,0,2,1,E01002304,2025-12-09 10:30:00,10,,,
200801KD70354,550120,190460,0.165812,51.592939,1,3,1,1,18/03/2008,3,12:15,15,E09000016,4,174,9,30,0,-1,-1,0,0,0,1,1,1,0,0,1,1,E01002335,2025-12-09 12:15:00,12,,,
200801KD70356,550370,183020,0.166239,51.526023,1,3,2,2,25/03/2008,3,09:25,15,E09000016,3,1306,3,30,3,2,6,0,0,0,1,1,1,0,0,1,1,E01002368,2025-12-09 09:25:00,9,,,
200801KD70357,558380,188510,0.28408,51.57316,1,2,2,1,30/03/2008,1,18:15,15,E09000016,3,127,1,70,1,2,1,25,0,0,1,1,1,0,0,2,2,,2025-12-09 18:15:00,18,,,
200801KD70358,554410,188660,0.226904,51.575608,1,3,2,4,26/03/2008,4,18:20,15,E09000016,6,0,6,30,0,-1,-1,0,0,0,4,2,2,0,0,1,1,E01002271,2025-12-09 18:20:00,18,,,
200801KD70359,553930,187920,0.219659,51.569091,1,3,1,1,08/03/2008,7,09:46,15,E09000016,5,0,6,30,9,4,6,0,0,0,1,1,1,0,0,1,1,E01002274,2025-12-09 09:46:00,9,2008-08-03,Sunday,8.0
200801KD70361,556900,192390,0.264475,51.608433,1,3,2,2,26/03/2008,4,19:30,15,E09000016,3,12,1,60,1,4,1,25,0,0,4,2,2,0,0,2,1,E01021468,2025-12-09 19:30:00,19,,,
200801KD70370,552800,191630,0.204981,51.602732,1,3,1,1,04/03/2008,3,11:16,15,E09000016,6,0,9,30,0,-1,-1,0,0,0,1,9,1,0,0,1,1,E01002311,2025-12-09 11:16:00,11,2008-04-03,Thursday,4.0
200801KD70377,553590,188160,0.214862,51.57134,1,3,2,2,05/03/2008,4,09:00,15,E09000016,6,0,6,30,0,-1,-1,0,0,0,1,1,1,0,0,1,1,E01002274,2025-12-09 09:00:00,9,2008-05-03,Saturday,5.0
200801KD70387,554440,192760,0.22914,51.612437,1,3,1,1,12/03/2008,4,09:18,15,E09000016,6,0,9,30,0,-1,-1,0,0,0,1,9,1,0,0,1,1,E01002279,2025-12-09 09:18:00,9,2008-12-03,Wednesday,12.0
200801KD70393,558380,188380,0.284022,51.571992,1,3,10,1,11/02/2008,2,08:40,15,E09000016,1,25,3,70,0,-1,-1,0,0,0,1,7,1,0,0,2,1,E01002252,2025-12-09 08:40:00,8,2008-11-02,Sunday,11.0
200801KD70410,556920,183730,0.260898,51.530622,1,3,1,1,24/03/2008,2,08:55,15,E09000016,5,0,1,40,0,-1,-1,0,0,0,1,3,2,0,0,2,1,E01002385,2025-12-09 08:55:00,8,,,
200801KD70413,554460,194470,0.230182,51.627796,1,2,2,1,26/03/2008,4,07:58,15,E09000016,1,25,3,70,0,-1,-1,0,0,0,1,1,2,0,0,2,1,E01002276,2025-12-09 07:58:00,7,,,
200801KD70415,553210,187580,0.20913,51.566232,1,3,1,1,14/03/2008,6,09:25,15,E09000016,6,0,6,30,0,-1,-1,0,0,0,1,1,1,0,0,1,1,E01002318,2025-12-09 09:25:00,9,,,
200801KD70476,550760,190480,0.175053,51.592948,1,3,2,1,28/03/2008,6,19:30,15,E09000016,4,175,6,30,3,4,6,0,0,0,4,2,2,0,0,1,1,E01002336,2025-12-09 19:30:00,19,,,
200801KD70480,555400,191240,0.242321,51.598517,1,3,2,1,28/03/2008,6,22:35,15,E09000016,6,0,6,30,0,-1,-1,0,0,0,1,4,2,0,0,1,1,E01002298,2025-12-09 22:35:00,22,,,
200801KD70517,553630,194270,0.218113,51.626226,1,3,1,2,26/03/2008,4,20:20,15,E09000016,5,0,9,30,0,-1,-1,0,0,0,4,9,1,0,0,2,2,E01002276,2025-12-09 20:20:00,20,,,
200801KD70518,550100,189200,0.164985,51.581623,1,3,3,5,22/03/2008,7,15:54,15,E09000016,3,12,3,50,9,4,3,12,0,0,1,4,1,0,0,1,1,E01002244,2025-12-09 15:54:00,15,,,
200801KD70520,552120,182740,0.191325,51.523039,1,3,3,3,02/03/2008,1,16:27,15,E09000016,3,125,6,30,0,-1,-1,0,0,0,1,1,1,0,0,1,1,E01002370,2025-12-09 16:27:00,16,2008-02-03,Sunday,2.0
200801KD72002,550570,182430,0.168868,51.520669,1,3,2,1,12/04/2008,7,19:30,15,E09000016,3,13,1,30,1,4,3,13,0,0,5,8,2,0,0,1,2,E01002368,2025-12-09 19:30:00,19,2008-12-04,Thursday,12.0
200801KD72012,555590,191700,0.245266,51.602597,1,3,2,3,04/04/2008,6,14:49,15,E09000016,5,0,7,30,5,4,3,12,0,0,1,1,1,0,0,1,1,E01002283,2025-12-09 14:49:00,14,2008-04-04,Friday,4.0
200801KD72015,556200,183510,0.250429,51.528845,1,3,2,1,02/04/2008,4,11:20,15,E09000016,5,0,6,60,3,4,5,0,0,0,1,1,1,0,0,2,1,E01002385,2025-12-09 11:20:00,11,2008-02-04,Monday,2.0
200801KD72025,551610,187460,0.186012,51.565586,1,3,2,2,16/04/2008,4,10:30,15,E09000016,3,124,6,30,0,-1,-1,0,0,0,1,1,1,0,0,1,2,E01002249,2025-12-09 10:30:00,10,,,
200801KD72028,555680,193610,0.247412,51.619733,1,3,3,2,07/04/2008,2,04:50,15,E09000016,1,25,3,70,0,-1,-1,0,0,0,4,1,2,0,0,2,1,E01002276,2025-12-09 04:50:00,4,2008-07-04,Friday,7.0
200801KD72040,558160,188440,0.280877,51.572593,1,3,2,1,01/04/2008,3,09:36,15,E09000016,3,127,7,70,0,-1,-1,0,0,0,1,9,1,0,0,2,1,E01002252,2025-12-09 09:36:00,9,2008-01-04,Friday,1.0
200801KD72042,550530,187340,0.17039,51.564797,1,3,2,1,15/04/2008,3,15:40,15,E09000016,3,124,6,30,3,4,6,0,0,0,1,1,1,0,0,1,1,E01002251,2025-12-09 15:40:00,15,,,
200801KD72056,554320,187040,0.224896,51.561078,1,3,2,1,09/04/2008,4,12:20,15,E09000016,3,124,9,30,0,-1,-1,0,0,4,1,9,1,0,0,1,2,E01002360,2025-12-09 12:20:00,12,2008-09-04,Thursday,9.0
200801KD72058,553680,183360,0.214064,51.528188,1,3,2,3,15/04/2008,3,16:37,15,E09000016,6,0,6,30,9,4,6,0,0,0,1,1,1,0,0,1,1,E01002349,2025-12-09 16:37:00,16,,,
200801KD72069,550780,189440,0.174895,51.583598,1,3,1,1,11/04/2008,6,08:41,15,E09000016,3,125,2,30,0,-1,-1,0,0,0,1,1,1,0,0,1,2,E01002340,2025-12-09 08:41:00,8,2008-11-04,Tuesday,11.0
200801KD72071,549610,189060,0.157859,51.580496,1,3,4,1,24/04/2008,5,17:42,15,E09000016,3,12,3,50,0,-1,-1,0,0,0,1,1,1,0,0,1,1,E01002330,2025-12-09 17:42:00,17,,,
200801KD72072,554630,186620,0.22918,51.557219,1,3,2,1,23/04/2008,4,09:50,15,E09000016,5,0,6,30,0,-1,-1,0,0,0,1,2,2,0,0,1,1,E01002362,2025-12-09 09:50:00,9,,,
200801KD72103,551230,190420,0.181807,51.592283,1,3,2,2,06/04/2008,1,11:18,15,E09000016,5,0,3,50,6,2,3,12,0,0,1,3,2,0,0,1,1,E01002334,2025-12-09 11:18:00,11,2008-06-04,Wednesday,6.0
200801KD72109,553910,186010,0.218535,51.551935,1,3,2,1,18/04/2008,6,20:00,15,E09000016,5,0,6,30,0,-1,-1,0,0,0,7,1,1,0,0,1,2,E01002285,2025-12-09 20:00:00,20,,,
200801KD72118,551220,191660,0.182197,51.603427,1,3,2,1,22/04/2008,3,17:25,15,E09000016,5,0,6,30,8,4,6,0,0,0,1,1,1,0,0,1,1,E01002304,2025-12-09 17:25:00,17,,,
200801KD72126,552820,182400,0.20126,51.519796,1,3,1,1,25/04/2008,6,19:15,15,E09000016,5,0,6,30,3,4,6,0,0,0,1,1,1,0,0,1,2,E01002342,2025-12-09 19:15:00,19,,,
200801KD72131,552630,185570,0.199897,51.548329,1,3,2,1,25/04/2008,6,22:50,15,E09000016,6,0,1,30,1,4,6,0,0,0,4,1,1,0,0,1,2,E01002262,2025-12-09 22:50:00,22,,,
200801KD72132,553950,190810,0.221214,51.595051,1,3,2,2,25/04/2008,6,14:50,15,E09000016,3,12,7,30,3,2,6,0,0,8,1,1,1,0,0,1,1,E01002310,2025-12-09 14:50:00,14,,,
200801KD72134,552480,181310,0.195892,51.510094,1,3,2,1,22/04/2008,3,09:15,15,E09000016,3,13,3,30,0,-1,-1,0,0,0,1,1,1,0,0,2,2,E01002344,2025-12-09 09:15:00,9,,,
200801KD72146,558200,189030,0.281719,51.577882,1,3,2,1,24/04/2008,5,11:37,15,E09000016,1,25,3,70,0,-1,-1,0,0,0,1,2,2,0,0,2,1,E01002259,2025-12-09 11:37:00,11,,,
200801KD72150,551440,181380,0.180947,51.511002,1,3,2,1,28/04/2008,2,12:40,15,E09000016,6,0,6,30,0,-1,-1,0,0,0,1,1,1,0,0,2,1,E01002344,2025-12-09 12:40:00,12,,,
200801KD72151,550080,191880,0.165842,51.605709,1,3,2,1,25/04/2008,6,08:17,15,E09000016,6,0,6,30,6,4,6,0,0,0,1,1,1,0,0,1,1,E01002301,2025-12-09 08:17:00,8,,,
200801KD72173,552940,192400,0.207336,51.609612,1,3,2,1,19/04/2008,7,15:25,15,E09000016,5,0,6,30,3,2,5,0,0,0,1,1,1,0,0,2,2,E01002313,2025-12-09 15:25:00,15,,,
200801KD72187,554590,191370,0.230693,51.599907,1,3,2,1,21/04/2008,2,20:30,15,E09000016,5,0,6,30,3,4,6,0,0,0,4,1,1,0,0,1,2,E01002300,2025-12-09 20:30:00,20,,,
200801KD72189,551230,190420,0.181807,51.592283,1,3,2,3,26/04/2008,7,22:50,15,E09000016,3,12,3,50,6,2,5,0,0,8,4,1,1,0,0,1,1,E01002334,2025-12-09 22:50:00,22,,,
200801KD72199,550680,189560,0.173504,51.584703,1,3,2,2,12/04/2008,7,08:20,15,E09000016,3,125,6,30,9,4,6,0,0,0,1,1,1,0,0,1,1,E01002245,2025-12-09 08:20:00,8,2008-12-04,Thursday,12.0
200801KD72211,550630,189750,0.172865,51.586424,1,3,2,2,20/04/2008,1,22:32,15,E09000016,3,12,3,50,6,2,3,125,0,0,4,2,2,0,0,1,1,E01002338,2025-12-09 22:32:00,22,,,
200801KD72226,549420,190990,0.15594,51.597887,1,3,2,3,04/04/2008,6,08:23,15,E09000016,4,174,6,30,3,4,5,0,0,0,1,1,1,0,0,1,2,E01002326,2025-12-09 08:23:00,8,2008-04-04,Friday,4.0
200801KD72229,554780,190380,0.232997,51.59096,1,3,2,1,30/04/2008,4,23:00,15,E09000016,5,0,6,30,3,4,6,0,0,0,4,2,2,0,0,1,1,E01002294,2025-12-09 23:00:00,23,,,
200801KD72246,550160,191550,0.166855,51.602722,1,3,2,1,29/04/2008,3,18:19,15,E09000016,6,0,6,30,6,4,6,0,0,0,1,2,2,0,0,1,1,E01002302,2025-12-09 18:19:00,18,,,
200801KD72250,553340,187010,0.210756,51.561075,1,2,1,1,18/04/2008,6,17:02,15,E09000016,5,0,6,30,0,-1,-1,0,0,0,1,8,1,0,0,1,1,E01002361,2025-12-09 17:02:00,17,,,
200801KD72251,551080,188390,0.17877,51.574084,1,3,1,1,07/04/2008,2,10:37,15,E09000016,3,125,3,30,6,2,6,0,0,4,1,1,1,0,0,1,1,E01002356,2025-12-09 10:37:00,10,2008-07-04,Friday,7.0
200801KD72271,551260,188950,0.181607,51.579067,1,3,2,1,05/04/2008,7,19:30,15,E09000016,6,0,6,20,3,4,6,0,0,0,1,1,1,0,0,1,1,E01002357,2025-12-09 19:30:00,19,2008-05-04,Sunday,5.0
200801KD72277,554130,189960,0.223437,51.587365,1,3,2,1,03/04/2008,5,07:45,15,E09000016,3,127,3,40,0,-1,-1,0,0,4,1,1,1,0,0,1,2,E01002295,2025-12-09 07:45:00,7,2008-03-04,Tuesday,3.0
200801KD72282,553820,187290,0.217798,51.56346,1,3,4,1,10/04/2008,5,08:50,15,E09000016,6,0,6,30,3,4,6,0,0,0,1,1,1,0,0,1,1,E01002361,2025-12-09 08:50:00,8,2008-10-04,Saturday,10.0
200801KD72291,550680,189560,0.173504,51.584703,1,3,2,1,25/04/2008,6,12:20,15,E09000016,3,125,6,30,5,4,6,0,0,0,1,1,1,0,0,1,2,E01002245,2025-12-09 12:20:00,12,,,
200801KD72306,556880,192370,0.264177,51.608259,1,3,2,1,12/04/2008,7,12:57,15,E09000016,3,12,1,30,2,4,3,12,0,0,1,1,1,0,0,2,1,E01002296,2025-12-09 12:57:00,12,2008-12-04,Thursday,12.0
200801KD72308,550630,189760,0.172869,51.586514,1,3,2,1,09/04/2008,4,11:40,15,E09000016,4,174,6,30,6,2,3,12,0,0,1,1,1,0,0,1,1,,2025-12-09 11:40:00,11,2008-09-04,Thursday,9.0
200801KD72309,554220,192770,0.22597,51.612587,1,3,2,3,17/04/2008,5,11:56,15,E09000016,6,0,6,30,3,4,6,0,0,0,1,1,1,0,0,1,1,E01002278,2025-12-09 11:56:00,11,,,
200801KD72317,550810,189400,0.175311,51.583231,1,3,2,1,29/04/2008,3,08:50,15,E09000016,3,125,6,30,3,4,6,0,1,0,1,2,2,0,0,1,2,E01002340,2025-12-09 08:50:00,8,,,
200801KD72325,553930,187960,0.219677,51.56945,1,3,2,1,13/04/2008,1,12:48,15,E09000016,5,0,6,30,3,4,6,0,0,0,1,1,2,0,0,1,1,E01002274,2025-12-09 12:48:00,12,,,
200801KD72328,556230,187370,0.252574,51.563517,1,3,2,1,25/04/2008,6,16:17,15,E09000016,5,0,6,30,3,4,6,0,0,0,1,1,1,0,0,1,1,E01002257,2025-12-09 16:17:00,16,,,
200801KD72342,550190,188370,0.165928,51.574142,1,3,2,1,17/04/2008,5,05:56,15,E09000016,3,118,6,30,3,4,6,0,0,0,1,1,1,0,0,1,1,,2025-12-09 05:56:00,5,,,
200801KD72347,553760,190710,0.218429,51.594205,1,3,2,1,04/04/2008,6,19:44,15,E09000016,3,12,3,50,0,-1,-1,0,0,5,4,1,1,0,0,1,1,E01002293,2025-12-09 19:44:00,19,2008-04-04,Friday,4.0
200801KD72365,556960,192420,0.265354,51.608686,1,3,2,1,17/03/2008,2,13:57,15,E09000016,1,25,6,30,1,3,3,12,0,0,1,4,2,0,0,2,1,E01021468,2025-12-09 13:57:00,13,,,
200801KD72378,551490,188780,0.18485,51.577478,1,3,2,3,11/04/2008,6,16:04,15,E09000016,5,0,6,30,8,4,6,0,0,0,1,1,1,0,0,1,1,E01002357,2025-12-09 16:04:00,16,2008-11-04,Tuesday,11.0
200801KD72387,558440,188600,0.284986,51.573952,1,3,4,10,26/04/2008,7,20:00,15,E09000016,1,25,7,70,5,4,3,127,0,0,1,1,1,0,0,2,1,E01002259,2025-12-09 20:00:00,20,,,
200801KD72417,556530,188520,0.257411,51.573766,1,3,2,2,24/04/2008,5,08:07,15,E09000016,5,0,6,30,9,1,6,0,0,0,1,1,1,0,0,1,1,E01002253,2025-12-09 08:07:00,8,,,
200801KD72418,553260,189680,0.210767,51.585086,1,3,3,3,20/04/2008,1,15:09,15,E09000016,6,0,6,30,9,4,6,0,0,0,1,1,1,0,0,1,1,E01002376,2025-12-09 15:09:00,15,,,
200801KD72433,550850,188850,0.175651,51.578279,1,3,2,1,17/04/2008,5,13:06,15,E09000016,5,0,6,30,3,4,6,0,0,0,1,1,1,0,0,1,1,E01002243,2025-12-09 13:06:00,13,,,
200801KD72454,559660,187110,0.3019,51.560221,1,3,2,1,17/03/2008,2,07:36,15,E09000016,5,0,6,50,3,4,4,186,0,0,1,1,2,0,0,2,1,E01002391,2025-12-09 07:36:00,7,,,
200801KD72460,551450,188160,0.184006,51.571918,1,3,2,1,24/04/2008,5,14:55,15,E09000016,5,0,3,40,6,2,5,0,0,5,1,9,2,0,0,1,1,E01002356,2025-12-09 14:55:00,14,,,
200801KD72484,551650,187680,0.186683,51.567552,1,3,2,1,01/04/2008,3,16:00,15,E09000016,5,0,6,30,0,-1,-1,0,0,0,1,1,1,0,0,1,2,E01002350,2025-12-09 16:00:00,16,2008-01-04,Friday,1.0
200801KD72487,556220,183500,0.250713,51.528749,1,3,2,4,26/04/2008,7,15:23,15,E09000016,5,0,6,60,3,4,5,0,0,0,1,1,1,0,0,2,1,E01015924,2025-12-09 15:23:00,15,,,
200801KD72533,550340,191310,0.16935,51.600518,1,3,2,2,08/05/2008,5,21:06,15,E09000016,4,1459,6,30,3,4,6,0,0,0,4,1,1,0,0,1,1,E01002301,2025-12-09 21:06:00,21,2008-08-05,Tuesday,8.0
200801KD72544,551750,189360,0.18885,51.582619,1,3,2,1,10/05/2008,7,21:11,15,E09000016,5,0,6,30,3,4,3,118,0,0,4,1,1,0,0,1,1,E01002354,2025-12-09 21:11:00,21,2008-10-05,Sunday,10.0
200801KD72554,552030,182430,0.189895,51.520278,1,3,2,1,05/05/2008,2,13:20,15,E09000016,4,1335,9,30,0,-1,-1,0,0,0,1,9,1,0,0,1,2,E01002345,2025-12-09 13:20:00,13,2008-05-05,Monday,5.0
200801KD72562,555600,191700,0.24541,51.602594,1,3,2,1,09/05/2008,6,22:02,15,E09000016,3,12,3,50,3,2,3,12,0,5,4,1,1,0,0,1,1,E01002283,2025-12-09 22:02:00,22,2008-09-05,Friday,9.0
200801KD72563,551050,191460,0.179658,51.601676,1,3,1,1,13/05/2008,3,08:05,15,E09000016,6,0,6,30,0,-1,-1,0,0,0,1,1,1,0,0,1,1,E01002303,2025-12-09 08:05:00,8,,,
200801KD72564,553820,193300,0.22043,51.617459,1,3,2,2,15/05/2008,5,13:40,15,E09000016,5,0,1,30,1,4,6,0,0,0,1,2,2,0,0,1,1,E01002276,2025-12-09 13:40:00,13,,,
200801KD72566,552100,182720,0.191028,51.522865,1,3,2,1,06/05/2008,3,07:20,15,E09000016,3,125,6,30,8,4,4,1335,0,0,1,1,1,0,0,1,1,E01002370,2025-12-09 07:20:00,7,2008-06-05,Thursday,6.0
200801KD72571,551220,188990,0.181047,51.579437,1,3,1,1,01/05/2008,5,14:00,15,E09000016,6,0,6,30,0,-1,-1,0,0,0,1,2,2,0,0,1,1,E01002353,2025-12-09 14:00:00,14,2008-01-05,Saturday,1.0
200801KD72597,553810,189500,0.21862,51.583319,1,3,2,2,02/05/2008,6,08:10,15,E09000016,5,0,6,30,3,4,6,0,0,0,1,1,1,0,0,1,1,E01002380,2025-12-09 08:10:00,8,2008-02-05,Tuesday,2.0
200801KD72600,553910,190110,0.22033,51.588773,1,3,2,2,02/05/2008,6,20:20,15,E09000016,3,127,7,60,3,4,6,0,0,0,4,1,1,0,0,1,1,E01002295,2025-12-09 20:20:00,20,2008-02-05,Tuesday,2.0
200801KD72601,553340,190520,0.212287,51.592612,1,3,2,1,07/05/2008,4,18:30,15,E09000016,3,12,1,30,1,4,3,12,0,0,1,1,1,0,0,1,2,E01002337,2025-12-09 18:30:00,18,2008-07-05,Saturday,7.0
200801KD72623,550780,182300,0.171837,51.519445,1,3,2,1,19/05/2008,2,18:30,15,E09000016,3,13,3,70,0,-1,-1,0,0,0,1,1,1,0,0,2,1,E01002370,2025-12-09 18:30:00,18,,,
200801KD72628,550950,188750,0.17705,51.577353,1,3,1,1,26/05/2008,2,18:05,15,E09000016,3,118,3,30,0,-1,-1,0,0,0,1,2,2,0,0,1,1,E01002244,2025-12-09 18:05:00,18,,,
200801KD72632,551080,191000,0.179893,51.597535,1,3,1,1,10/05/2008,7,13:50,15,E09000016,6,0,6,30,0,-1,-1,0,0,0,1,1,1,0,0,1,1,E01002333,2025-12-09 13:50:00,13,2008-10-05,Sunday,10.0
200801KD72634,550830,187880,0.174947,51.569568,1,3,1,1,09/05/2008,6,11:45,15,E09000016,5,0,1,30,1,4,5,0,0,0,1,1,1,0,0,1,2,E01002248,2025-12-09 11:45:00,11,2008-09-05,Friday,9.0
200801KD72637,556810,192270,0.263122,51.60738,1,3,2,1,15/05/2008,5,18:10,15,E09000016,3,12,1,30,1,2,3,12,0,0,1,2,2,0,0,2,1,E01002296,2025-12-09 18:10:00,18,,,
200801KD72643,554820,190200,0.233495,51.589332,1,3,1,1,23/05/2008,6,21:00,15,E09000016,5,0,1,30,2,4,5,0,0,0,5,1,1,0,0,1,1,E01002295,2025-12-09 21:00:00,21,,,
200801KD72646,549740,191090,0.160599,51.598701,1,3,2,1,13/05/2008,3,15:20,15,E09000016,6,0,6,30,7,4,4,174,0,0,1,1,1,0,0,1,1,E01002326,2025-12-09 15:20:00,15,,,
200801KD72648,551000,188640,0.177724,51.576352,1,3,1,1,12/05/2008,2,13:45,15,E09000016,3,125,1,40,1,4,3,118,0,0,1,1,1,0,0,1,2,E01002356,2025-12-09 13:45:00,13,2008-12-05,Friday,12.0
200801KD72649,553040,185990,0.205988,51.551992,1,3,1,1,01/05/2008,5,15:25,15,E09000016,5,0,6,30,0,-1,-1,0,0,0,1,2,2,0,0,1,1,E01002366,2025-12-09 15:25:00,15,2008-01-05,Saturday,1.0
200801KD72652,551260,181780,0.178527,51.514644,1,3,1,2,18/05/2008,1,06:05,15,E09000016,3,13,3,70,0,-1,-1,0,0,0,1,1,1,0,0,2,1,E01002370,2025-12-09 06:05:00,6,,,
200801KD72660,555740,184560,0.244267,51.538406,1,3,1,1,19/05/2008,2,23:52,15,E09000016,5,0,6,50,0,-1,-1,0,0,0,6,1,1,0,7,2,1,E01002385,2025-12-09 23:52:00,23,,,
200801KD72665,549930,191090,0.16334,51.59865,1,3,1,2,27/05/2008,3,13:24,15,E09000016,4,174,6,30,7,4,6,0,0,8,1,1,1,0,0,1,1,E01002326,2025-12-09 13:24:00,13,,,
200801KD72666,557890,188510,0.277015,51.573297,1,3,2,1,28/05/2008,4,00:29,15,E09000016,3,127,3,70,0,-1,-1,0,0,0,4,1,2,0,0,2,1,E01002259,2025-12-09 00:29:00,0,,,
200801KD72667,550920,187420,0.176047,51.565411,1,3,2,1,15/05/2008,5,12:39,15,E09000016,3,124,6,30,6,4,5,0,0,0,1,1,1,0,0,1,1,E01002248,2025-12-09 12:39:00,12,,,
200801KD72672,551320,193670,0.184507,51.62146,1,3,1,1,29/05/2008,5,20:34,15,E09000016,4,175,6,30,0,-1,-1,0,0,0,4,2,2,0,0,1,1,E01002304,2025-12-09 20:34:00,20,,,
200801KD72675,558330,188420,0.283319,51.572365,1,3,2,1,18/05/2008,1,17:15,15,E09000016,1,25,3,70,1,4,3,127,0,0,1,1,1,0,0,2,2,E01002252,2025-12-09 17:15:00,17,,,
200801KD72693,550940,188840,0.176945,51.578165,1,3,2,1,09/05/2008,6,11:00,15,E09000016,3,118,3,30,3,4,5,0,0,0,1,1,1,0,0,1,1,E01002243,2025-12-09 11:00:00,11,2008-09-05,Friday,9.0
200801KD72694,554180,189910,0.224136,51.586902,1,3,2,1,27/05/2008,3,20:00,15,E09000016,3,127,3,30,6,2,5,0,0,0,1,1,1,0,0,1,2,E01002295,2025-12-09 20:00:00,20,,,
200801KD72698,556560,192260,0.259511,51.60736,1,3,1,2,17/05/2008,7,14:30,15,E09000016,3,12,3,70,0,-1,-1,0,0,0,1,2,2,5,2,2,1,E01002277,2025-12-09 14:30:00,14,,,
200801KD72700,549310,188280,0.153201,51.573567,1,3,2,1,23/05/2008,6,08:05,15,E09000016,3,118,6,30,8,1,6,0,1,4,1,1,1,0,0,1,1,E01002250,2025-12-09 08:05:00,8,,,
200801KD72722,553840,188690,0.218698,51.576033,1,3,2,1,13/05/2008,3,13:45,15,E09000016,5,0,9,30,0,-1,-1,0,0,0,1,1,1,0,0,1,2,E01002270,2025-12-09 13:45:00,13,,,
200801KD72730,552230,188810,0.195534,51.577548,1,3,3,1,16/05/2008,6,20:20,15,E09000016,5,0,6,30,3,4,6,0,0,0,7,1,1,0,0,1,1,E01002382,2025-12-09 20:20:00,20,,,
200801KD72731,552410,184920,0.196445,51.542548,1,3,2,2,27/05/2008,3,11:50,15,E09000016,6,0,9,30,0,-1,-1,0,0,0,1,9,1,0,0,1,2,E01002264,2025-12-09 11:50:00,11,,,
200801KD72732,549960,188420,0.162633,51.574652,1,3,2,3,10/05/2008,7,13:30,15,E09000016,3,118,6,30,8,4,6,0,0,0,1,1,1,0,0,1,1,E01002246,2025-12-09 13:30:00,13,2008-10-05,Sunday,10.0
200801KD72749,554690,191180,0.232052,51.598173,1,2,2,4,13/05/2008,3,20:25,15,E09000016,3,12,3,50,6,4,6,0,0,0,1,1,1,0,0,1,1,E01002299,2025-12-09 20:25:00,20,,,
200801KD72796,553410,190510,0.213293,51.592503,1,3,2,3,22/05/2008,5,18:00,15,E09000016,5,0,1,30,1,4,3,118,0,0,1,1,1,0,0,1,2,E01002293,2025-12-09 18:00:00,18,,,
200801KD72836,550580,182370,0.168986,51.520127,1,3,2,1,20/05/2008,3,07:40,15,E09000016,3,13,3,70,0,-1,-1,0,0,0,1,1,1,0,0,1,1,,2025-12-09 07:40:00,7,,,
200801KD72843,554460,192470,0.229301,51.609826,1,2,1,1,28/05/2008,4,17:50,15,E09000016,6,0,6,30,0,-1,-1,0,0,0,1,1,1,0,0,1,1,E01002281,2025-12-09 17:50:00,17,,,
200801KD72854,549510,190330,0.156957,51.591933,1,3,2,2,20/05/2008,3,08:40,15,E09000016,5,0,6,30,0,-1,-1,0,1,4,1,1,1,0,0,1,1,E01002325,2025-12-09 08:40:00,8,,,
200801KD72875,556890,192380,0.264326,51.608346,1,2,2,1,12/05/2008,2,08:56,15,E09000016,3,12,6,60,1,3,3,12,0,0,1,9,1,0,0,2,1,E01002296,2025-12-09 08:56:00,8,2008-12-05,Friday,12.0
200801KD72880,552620,187400,0.200546,51.564774,1,3,2,1,14/05/2008,4,14:10,15,E09000016,3,124,6,30,0,-1,-1,0,0,0,1,1,1,0,2,1,1,E01002321,2025-12-09 14:10:00,14,,,
200801KD72881,553090,191870,0.20927,51.604809,1,3,2,2,08/05/2008,5,06:59,15,E09000016,5,0,6,30,3,4,5,0,0,8,1,1,1,0,0,1,1,E01002311,2025-12-09 06:59:00,6,2008-08-05,Tuesday,8.0
200801KD72884,551570,188860,0.186039,51.578175,1,3,2,1,17/05/2008,7,21:57,15,E09000016,5,0,6,30,6,2,5,0,0,5,4,1,1,0,0,1,1,E01002357,2025-12-09 21:57:00,21,,,
200801KD72890,552100,187440,0.193067,51.565274,1,3,2,1,19/05/2008,2,13:38,15,E09000016,6,0,3,30,6,2,3,124,0,5,1,1,1,0,0,1,1,E01002319,2025-12-09 13:38:00,13,,,
200801KD72936,558360,188600,0.283832,51.573974,1,3,2,1,21/05/2008,4,07:50,15,E09000016,1,25,3,70,0,-1,-1,0,0,0,1,1,1,0,0,2,1,E01002259,2025-12-09 07:50:00,7,,,
200801KD72966,550810,191670,0.176285,51.603627,1,2,3,1,14/05/2008,4,00:15,15,E09000016,4,1459,6,30,0,-1,-1,0,0,1,4,1,1,0,0,1,1,E01002304,2025-12-09 00:15:00,0,,,
200801KD72973,556270,189030,0.253889,51.57842,1,2,1,1,31/05/2008,7,01:11,15,E09000016,3,127,3,70,9,4,5,0,0,0,4,1,1,0,0,2,1,E01002296,2025-12-09 01:11:00,1,,,
200801KD72979,550950,188770,0.177059,51.577533,1,3,1,1,17/05/2008,7,22:55,15,E09000016,3,118,3,30,0,-1,-1,0,0,0,4,1,1,4,0,1,1,E01002243,2025-12-09 22:55:00,22,,,
200801KD72986,552390,182320,0.195032,51.519193,1,3,1,1,14/05/2008,4,17:30,15,E09000016,5,0,6,30,0,-1,-1,0,0,0,1,1,1,0,0,1,1,E01002345,2025-12-09 17:30:00,17,,,
200801KD73020,554830,189290,0.233238,51.581153,1,3,3,3,08/05/2008,5,20:00,15,E09000016,5,0,6,30,3,4,6,0,0,0,1,1,1,0,0,1,1,E01002268,2025-12-09 20:00:00,20,2008-08-05,Tuesday,8.0
200801KD73032,552320,182060,0.193912,51.516876,1,3,3,2,11/05/2008,1,14:14,15,E09000016,4,1335,3,70,0,-1,-1,0,0,0,1,1,1,0,0,1,1,E01002345,2025-12-09 14:14:00,14,2008-11-05,Wednesday,11.0
200801KD73036,551160,189080,0.180221,51.580262,1,3,2,3,22/05/2008,5,16:30,15,E09000016,3,118,1,50,3,4,6,0,0,0,1,9,1,0,0,1,2,E01002353,2025-12-09 16:30:00,16,,,
200801KD73042,552300,183900,0.194419,51.533413,1,3,2,1,01/06/2008,1,15:10,15,E09000016,6,0,6,30,0,-1,-1,0,0,0,1,1,1,0,0,1,1,E01002374,2025-12-09 15:10:00,15,2008-01-06,Sunday,1.0
200801KD73045,550370,188360,0.16852,51.574004,1,3,2,1,02/06/2008,2,14:50,15,E09000016,3,118,6,30,0,-1,-1,0,0,0,1,2,2,0,0,1,1,E01002247,2025-12-09 14:50:00,14,2008-02-06,Wednesday,2.0
200801KD73046,554410,180280,0.223231,51.500316,1,3,2,1,03/06/2008,3,14:00,15,E09000016,3,13,3,70,9,4,6,0,0,0,1,1,2,0,0,2,1,E01002344,2025-12-09 14:00:00,14,2008-03-06,Thursday,3.0
200801KD73047,549420,190990,0.15594,51.597887,1,3,2,1,04/06/2008,4,14:30,15,E09000016,4,174,6,30,3,4,5,0,0,0,1,1,1,0,0,1,1,E01002326,2025-12-09 14:30:00,14,2008-04-06,Sunday,4.0
200801KD73051,555990,193370,0.25178,51.617491,1,3,2,1,02/06/2008,2,14:00,15,E09000016,1,25,3,70,0,-1,-1,0,0,0,7,2,2,0,0,2,2,E01002276,2025-12-09 14:00:00,14,2008-02-06,Wednesday,2.0
200801KD73060,551140,188220,0.179562,51.57254,1,3,2,2,23/06/2008,2,10:45,15,E09000016,3,125,3,30,8,4,6,0,0,5,1,1,1,0,0,1,1,E01002249,2025-12-09 10:45:00,10,,,
200801KD73061,559180,187080,0.294967,51.560087,1,3,2,1,07/06/2008,7,17:55,15,E09000016,4,186,1,30,2,4,4,187,0,0,1,1,1,0,0,2,1,E01002391,2025-12-09 17:55:00,17,2008-07-06,Sunday,7.0
200801KD73062,555300,192270,0.241334,51.607798,1,3,2,1,19/06/2008,5,08:12,15,E09000016,5,0,6,30,0,-1,-1,0,0,0,1,1,1,0,0,1,1,E01002279,2025-12-09 08:12:00,8,,,
200801KD73082,554200,189920,0.224429,51.586986,1,3,3,1,16/06/2008,2,18:18,15,E09000016,3,127,6,30,6,4,3,127,0,0,1,1,1,0,0,1,1,E01002295,2025-12-09 18:18:00,18,,,
200801KD73088,553420,190540,0.21345,51.59277,1,3,2,1,22/06/2008,1,22:45,15,E09000016,3,12,1,30,1,4,3,12,0,0,1,1,1,0,0,1,1,E01002310,2025-12-09 22:45:00,22,,,
200801KD73090,551230,193180,0.182996,51.617082,1,3,3,3,04/06/2008,4,16:40,15,E09000016,4,175,6,30,0,-1,-1,0,0,0,1,1,1,0,0,1,1,E01002304,2025-12-09 16:40:00,16,2008-04-06,Sunday,4.0
200801KD73091,551740,188560,0.188361,51.575434,1,3,2,2,05/06/2008,5,08:31,15,E09000016,5,0,6,30,9,4,6,0,0,5,1,1,1,0,0,1,1,E01002357,2025-12-09 08:31:00,8,2008-05-06,Tuesday,5.0
200801KD73095,551200,181870,0.177701,51.515469,1,3,3,1,06/06/2008,6,08:30,15,E09000016,3,13,3,70,0,-1,-1,0,0,0,1,1,1,0,0,2,1,E01002370,2025-12-09 08:30:00,8,2008-06-06,Friday,6.0
200801KD73101,555720,191750,0.247164,51.603011,1,3,2,1,13/06/2008,6,16:55,15,E09000016,3,12,3,50,7,2,5,0,0,0,1,1,1,0,0,1,1,E01002296,2025-12-09 16:55:00,16,,,
200801KD73116,553930,191320,0.221149,51.599639,1,3,1,1,22/06/2008,1,10:53,15,E09000016,6,0,6,30,3,4,6,0,0,0,1,4,1,5,0,1,1,E01002316,2025-12-09 10:53:00,10,,,
200801KD73118,551240,190410,0.181947,51.592191,1,3,2,2,19/06/2008,5,11:00,15,E09000016,3,12,3,50,6,2,5,0,0,7,1,1,1,0,0,1,1,E01002334,2025-12-09 11:00:00,11,,,
200801KD73125,553310,192610,0.212767,51.611398,1,3,2,1,07/06/2008,7,21:23,15,E09000016,6,0,6,30,0,-1,-1,0,0,0,4,2,2,0,0,1,1,E01002313,2025-12-09 21:23:00,21,2008-07-06,Sunday,7.0
200801KD73132,553180,186410,0.208188,51.555728,1,3,2,2,28/06/2008,7,15:15,15,E09000016,5,0,6,30,6,3,5,0,0,0,1,2,1,0,0,1,1,E01002363,2025-12-09 15:15:00,15,,,
200801KD73135,553800,190390,0.218866,51.591319,1,3,2,1,25/06/2008,4,18:10,15,E09000016,6,0,6,30,8,4,6,0,0,0,1,1,1,0,0,1,1,E01002293,2025-12-09 18:10:00,18,,,
200801KD73142,552800,189570,0.204084,51.584223,1,3,2,1,24/06/2008,3,14:13,15,E09000016,6,0,6,30,0,-1,-1,0,0,0,1,1,1,0,0,1,1,E01002379,2025-12-09 14:13:00,14,,,
200801KD73149,553650,182670,0.213331,51.521996,1,3,2,2,25/06/2008,4,20:25,15,E09000016,5,0,6,30,3,4,6,0,0,0,1,1,1,0,0,1,1,E01002344,2025-12-09 20:25:00,20,,,
200801KD73159,554820,190230,0.233508,51.589602,1,3,3,1,05/06/2008,5,06:57,15,E09000016,5,0,6,30,1,4,5,0,0,0,1,1,1,0,0,1,2,E01002294,2025-12-09 06:57:00,6,2008-05-06,Tuesday,5.0
200801KD73162,550150,190300,0.166176,51.591494,1,3,2,1,27/06/2008,6,15:27,15,E09000016,4,174,6,30,3,4,4,174,0,0,1,1,1,0,0,1,1,E01002327,2025-12-09 15:27:00,15,,,
200801KD73168,554000,192280,0.22258,51.608245,1,3,1,1,26/06/2008,5,13:45,15,E09000016,5,0,1,30,1,4,5,0,0,0,1,1,1,0,0,1,1,E01002282,2025-12-09 13:45:00,13,,,
200801KD73170,554730,184020,0.229479,51.533831,1,3,2,1,28/06/2008,7,18:33,15,E09000016,5,0,6,60,7,4,6,0,0,0,1,1,1,0,0,2,1,E01002348,2025-12-09 18:33:00,18,,,
200801KD73181,554460,182280,0.224826,51.518272,1,3,2,1,28/06/2008,7,15:30,15,E09000016,5,0,6,30,0,-1,-1,0,0,0,7,1,1,0,0,2,2,E01002344,2025-12-09 15:30:00,15,,,
200801KD73182,551020,191680,0.17932,51.603661,1,3,1,1,30/06/2008,2,22:56,15,E09000016,4,1459,6,30,0,-1,-1,0,0,0,4,1,1,0,0,1,1,E01002303,2025-12-09 22:56:00,22,,,
200801KD73189,550740,189500,0.174344,51.584148,1,3,1,1,27/06/2008,6,15:25,15,E09000016,6,0,6,30,3,4,3,125,0,0,1,1,1,0,0,1,1,E01002340,2025-12-09 15:25:00,15,,,
200801KD73190,554360,188480,0.226104,51.574005,1,3,2,1,13/06/2008,6,08:10,15,E09000016,6,0,6,30,6,4,6,0,0,0,1,1,1,0,0,1,2,E01002270,2025-12-09 08:10:00,8,,,
200801KD73194,552530,185840,0.198573,51.550782,1,3,2,1,16/06/2008,2,18:50,15,E09000016,5,0,6,30,0,-1,-1,0,0,0,1,1,1,0,0,1,2,E01002261,2025-12-09 18:50:00,18,,,
200801KD73204,554510,182310,0.22556,51.518527,1,3,2,1,16/06/2008,2,16:20,15,E09000016,5,0,6,30,0,-1,-1,0,0,0,1,1,1,0,0,2,2,E01002344,2025-12-09 16:20:00,16,,,
200801KD73208,549310,188280,0.153201,51.573567,1,3,3,1,11/06/2008,4,08:45,15,E09000016,3,118,6,30,9,4,6,0,0,0,1,1,1,0,0,1,1,E01002250,2025-12-09 08:45:00,8,2008-11-06,Thursday,11.0
200801KD73218,556400,187740,0.255189,51.566794,1,3,1,1,14/06/2008,7,18:10,15,E09000016,5,0,6,30,0,-1,-1,0,0,0,1,1,1,0,0,1,1,E01002253,2025-12-09 18:10:00,18,,,
200801KD73230,558450,188320,0.285004,51.571433,1,3,2,1,30/06/2008,2,19:00,15,E09000016,1,25,1,30,1,4,3,127,0,0,1,1,1,0,0,2,2,E01002252,2025-12-09 19:00:00,19,,,
200801KD73234,553770,188420,0.217571,51.573627,1,3,2,1,26/06/2008,5,08:22,15,E09000016,5,0,1,30,1,4,5,0,0,0,1,1,1,0,0,1,1,E01002381,2025-12-09 08:22:00,8,,,
200801KD73244,554130,192080,0.224368,51.606413,1,3,1,1,02/06/2008,2,14:56,15,E09000016,5,0,6,30,0,-1,-1,0,0,4,1,1,1,0,0,1,1,E01002281,2025-12-09 14:56:00,14,2008-02-06,Wednesday,2.0
200801KD73245,554700,186430,0.230105,51.555493,1,3,3,1,08/06/2008,1,14:41,15,E09000016,5,0,6,30,7,4,6,0,0,0,1,1,1,0,0,2,1,E01002292,2025-12-09 14:41:00,14,2008-08-06,Wednesday,8.0
200801KD73254,550650,189760,0.173157,51.586508,1,3,2,3,24/06/2008,3,13:30,15,E09000016,3,12,3,50,5,4,3,125,0,0,1,1,1,0,0,1,1,E01002340,2025-12-09 13:30:00,13,,,
200801KD73257,550490,191360,0.171535,51.600927,1,3,2,1,21/06/2008,7,06:52,15,E09000016,4,1459,6,30,3,4,6,0,0,0,1,2,2,0,0,1,1,E01002301,2025-12-09 06:52:00,6,,,
200801KD73317,552730,184870,0.201034,51.542013,1,3,2,1,11/06/2008,4,11:25,15,E09000016,6,0,6,30,8,4,6,0,0,8,1,1,1,0,0,1,1,E01002264,2025-12-09 11:25:00,11,2008-11-06,Thursday,11.0
200801KD73327,560140,185200,0.307949,51.542925,1,3,1,1,12/06/2008,5,13:41,15,E09000016,5,0,6,60,0,-1,-1,0,0,0,1,1,1,0,0,2,1,E01002391,2025-12-09 13:41:00,13,2008-12-06,Saturday,12.0
200801KD73333,550240,188370,0.166649,51.574129,1,3,2,1,14/06/2008,7,23:37,15,E09000016,3,118,6,30,0,-1,-1,0,0,0,4,1,1,0,0,1,1,E01002247,2025-12-09 23:37:00,23,,,
200801KD73334,554190,189910,0.224281,51.586899,1,3,2,1,26/06/2008,5,12:40,15,E09000016,3,127,6,30,6,4,5,0,0,0,1,1,1,0,0,1,2,E01002268,2025-12-09 12:40:00,12,,,
200801KD73339,550520,187810,0.170447,51.569022,1,3,3,1,11/06/2008,4,20:15,15,E09000016,6,0,1,30,1,4,6,0,0,0,4,1,1,0,0,1,1,E01002249,2025-12-09 20:15:00,20,2008-11-06,Thursday,11.0
200801KD73377,553600,193070,0.217154,51.615452,1,3,2,1,08/06/2008,1,16:52,15,E09000016,5,0,1,30,2,4,5,0,0,0,1,1,1,0,0,1,1,E01002312,2025-12-09 16:52:00,16,2008-08-06,Wednesday,8.0
200801KD73399,550990,188640,0.17758,51.576354,1,3,2,1,11/06/2008,4,17:00,15,E09000016,3,125,1,40,1,4,3,125,0,0,1,1,1,0,0,1,2,E01002356,2025-12-09 17:00:00,17,2008-11-06,Thursday,11.0
200801KD73417,551580,189220,0.186338,51.581407,1,3,1,1,14/04/2008,2,15:15,15,E09000016,3,118,6,30,0,-1,-1,0,0,0,1,1,2,0,2,1,1,E01002353,2025-12-09 15:15:00,15,,,
200801KD73437,550620,182950,0.16981,51.525328,1,3,2,1,03/06/2008,3,19:00,15,E09000016,3,1306,3,30,7,2,5,0,0,0,1,2,2,0,0,1,1,E01002368,2025-12-09 19:00:00,19,2008-03-06,Thursday,3.0
200801KD73468,553710,186950,0.216063,51.560435,1,3,2,1,12/06/2008,5,08:05,15,E09000016,6,0,6,30,8,4,6,0,0,0,1,1,1,0,0,1,1,E01002361,2025-12-09 08:05:00,8,2008-12-06,Saturday,12.0
200801KD73481,551960,188200,0.191377,51.57214,1,3,2,1,16/06/2008,2,20:03,15,E09000016,5,0,1,30,6,4,5,0,0,0,1,1,1,0,0,1,1,E01002351,2025-12-09 20:03:00,20,,,
200801KD73488,553820,193300,0.22043,51.617459,1,3,2,1,15/06/2008,1,14:55,15,E09000016,5,0,1,30,1,4,6,0,0,0,1,1,1,0,0,1,2,E01002276,2025-12-09 14:55:00,14,,,
200801KD73513,551670,188520,0.187334,51.575094,1,2,2,1,15/06/2008,1,07:53,15,E09000016,5,0,3,30,6,3,5,0,0,0,1,1,1,0,0,1,1,E01002358,2025-12-09 07:53:00,7,,,
200801KD73528,556870,192400,0.264046,51.608531,1,1,2,1,27/06/2008,6,06:13,15,E09000016,3,12,1,70,1,4,3,12,0,0,1,1,1,0,0,2,1,E01002296,2025-12-09 06:13:00,6,,,
200801KD73531,554760,190170,0.232616,51.589079,1,3,2,1,25/06/2008,4,17:01,15,E09000016,5,0,6,30,3,4,6,0,0,0,1,1,1,0,0,1,1,E01002294,2025-12-09 17:01:00,17,,,
200801KD73559,553740,192080,0.21874,51.606519,1,3,2,1,12/06/2008,5,10:55,15,E09000016,6,0,6,30,0,-1,-1,0,0,0,1,1,1,0,0,1,2,E01002282,2025-12-09 10:55:00,10,2008-12-06,Saturday,12.0
200801KD73561,550630,189760,0.172869,51.586514,1,3,2,1,01/06/2008,1,16:21,15,E09000016,3,12,3,50,6,2,3,125,0,0,1,1,1,0,0,1,1,,2025-12-09 16:21:00,16,2008-01-06,Sunday,1.0
200801KD73566,553440,190540,0.213739,51.592764,1,3,2,1,24/06/2008,3,19:45,15,E09000016,3,12,1,30,1,4,3,12,0,4,1,1,1,0,0,1,1,E01002293,2025-12-09 19:45:00,19,,,
200801KD73569,550100,190540,0.165558,51.593663,1,3,3,1,08/06/2008,1,15:45,15,E09000016,4,174,6,30,3,4,6,0,0,0,1,1,1,0,0,1,2,E01002327,2025-12-09 15:45:00,15,2008-08-06,Wednesday,8.0
200801KD73579,551080,192600,0.180582,51.611911,1,3,2,1,02/06/2008,2,21:53,15,E09000016,4,175,6,30,0,-1,-1,0,0,0,4,2,2,0,0,1,1,E01002304,2025-12-09 21:53:00,21,2008-02-06,Wednesday,2.0
200801KD73595,552500,187430,0.198829,51.565076,1,3,1,1,17/06/2008,3,08:50,15,E09000016,3,124,6,30,0,-1,-1,0,0,0,1,1,1,0,0,1,2,E01002321,2025-12-09 08:50:00,8,,,
200801KD73610,553970,186290,0.219522,51.554435,1,3,2,2,04/07/2008,6,22:28,15,E09000016,3,124,6,30,0,-1,-1,0,0,1,4,1,1,0,0,1,1,E01002291,2025-12-09 22:28:00,22,2008-04-07,Monday,4.0
200801KD73619,551460,188150,0.184146,51.571826,1,3,2,1,04/07/2008,6,16:45,15,E09000016,5,0,3,30,6,2,5,0,0,5,1,1,1,0,2,1,1,E01002350,2025-12-09 16:45:00,16,2008-04-07,Monday,4.0
200801KD73621,554130,191300,0.224025,51.599404,1,3,2,1,01/07/2008,3,11:30,15,E09000016,6,0,6,30,0,-1,-1,0,0,0,1,1,1,0,0,1,2,E01002297,2025-12-09 11:30:00,11,2008-01-07,Monday,1.0
200801KD73623,550980,191980,0.178872,51.606367,1,3,1,2,02/07/2008,4,23:30,15,E09000016,4,175,6,30,0,-1,-1,0,0,0,4,1,1,0,0,1,1,E01002304,2025-12-09 23:30:00,23,2008-02-07,Thursday,2.0
200801KD73639,550070,188400,0.164211,51.574443,1,2,2,1,07/07/2008,2,10:35,15,E09000016,3,118,6,30,3,4,6,0,0,0,1,2,2,0,0,1,1,E01002246,2025-12-09 10:35:00,10,2008-07-07,Monday,7.0
200801KD73649,553450,190550,0.213887,51.592851,1,3,2,1,06/07/2008,1,13:30,15,E09000016,3,12,3,40,1,4,3,127,0,0,1,1,1,0,0,1,2,E01002310,2025-12-09 13:30:00,13,2008-06-07,Saturday,6.0
200801KD73656,552700,181200,0.199012,51.509046,1,3,2,3,06/07/2008,1,17:38,15,E09000016,3,13,3,70,0,-1,-1,0,0,0,1,5,2,0,0,2,1,E01002344,2025-12-09 17:38:00,17,2008-06-07,Saturday,6.0
200801KD73666,553060,188830,0.207512,51.577504,1,3,1,1,04/07/2008,6,16:09,15,E09000016,5,0,6,30,0,-1,-1,0,0,0,1,1,1,0,0,1,1,E01002379,2025-12-09 16:09:00,16,2008-04-07,Monday,4.0
200801KD73673,552300,186810,0.195678,51.55956,1,3,2,1,10/07/2008,5,08:45,15,E09000016,6,0,6,30,3,4,6,0,0,0,1,1,1,0,0,1,2,E01002324,2025-12-09 08:45:00,8,2008-10-07,Tuesday,10.0
200801KD73675,551980,188200,0.191666,51.572135,1,3,1,1,04/07/2008,6,15:35,15,E09000016,5,0,6,30,0,-1,-1,0,0,0,1,1,1,0,0,1,1,E01002351,2025-12-09 15:35:00,15,2008-04-07,Monday,4.0
200801KD73688,551160,188040,0.179773,51.570918,1,3,2,1,14/07/2008,2,17:15,15,E09000016,5,0,6,30,0,-1,-1,0,0,0,1,1,1,0,0,1,2,E01002249,2025-12-09 17:15:00,17,,,
200801KD73698,555950,186330,0.248077,51.55425,1,3,1,1,11/07/2008,6,09:10,15,E09000016,4,1421,6,30,0,-1,-1,0,0,1,1,1,1,0,0,1,1,E01002386,2025-12-09 09:10:00,9,2008-11-07,Friday,11.0
200801KD73699,554550,191390,0.230124,51.600098,1,3,2,1,24/07/2008,5,14:00,15,E09000016,5,0,6,30,3,4,6,0,0,0,1,1,1,0,0,1,1,E01002299,2025-12-09 14:00:00,14,,,
200801KD73701,551940,183450,0.189039,51.529467,1,3,2,1,25/07/2008,6,19:15,15,E09000016,3,125,6,30,0,-1,-1,0,0,0,1,1,1,0,0,1,1,E01002371,2025-12-09 19:15:00,19,,,
200801KD73707,551290,188700,0.181932,51.576813,1,3,2,1,17/07/2008,5,12:11,15,E09000016,6,0,6,30,0,-1,-1,0,0,0,1,1,1,0,0,1,2,E01002357,2025-12-09 12:11:00,12,,,
200801KD73714,551740,181450,0.185297,51.511551,1,3,2,2,19/07/2008,7,20:05,15,E09000016,3,13,3,70,0,-1,-1,0,0,0,1,1,1,0,0,2,1,E01002344,2025-12-09 20:05:00,20,,,
200801KD73721,553580,191240,0.216064,51.599016,1,3,2,1,15/07/2008,3,17:35,15,E09000016,6,0,6,30,9,4,6,0,0,0,1,1,1,0,0,1,1,E01002316,2025-12-09 17:35:00,17,,,
200801KD73723,552800,185290,0.202225,51.545767,1,3,1,1,24/07/2008,5,13:47,15,E09000016,5,0,6,30,0,-1,-1,0,0,0,1,1,1,0,0,1,1,E01002287,2025-12-09 13:47:00,13,,,
200801KD73724,551120,191680,0.180763,51.603634,1,3,2,1,24/07/2008,5,09:45,15,E09000016,5,0,6,30,9,2,4,1459,0,0,1,1,1,0,0,1,2,E01002341,2025-12-09 09:45:00,9,,,
200801KD73739,554640,191920,0.231656,51.604835,1,3,1,1,23/07/2008,4,15:58,15,E09000016,6,0,6,30,3,4,6,0,0,0,1,9,1,0,0,1,1,E01002281,2025-12-09 15:58:00,15,,,
200801KD73741,556050,186680,0.249673,51.557367,1,3,2,1,12/07/2008,7,01:06,15,E09000016,5,0,6,30,6,4,6,0,0,0,4,1,2,0,0,1,1,E01002386,2025-12-09 01:06:00,1,2008-12-07,Sunday,12.0
200801KD73742,553950,189330,0.220565,51.581754,1,3,2,1,22/07/2008,3,08:22,15,E09000016,5,0,6,30,0,-1,-1,0,0,0,1,1,1,0,0,1,1,E01002377,2025-12-09 08:22:00,8,,,
200801KD73743,549980,189530,0.163395,51.58462,1,3,2,1,20/07/2008,1,15:15,15,E09000016,5,0,6,30,0,-1,-1,0,0,0,1,1,1,0,0,1,1,E01002329,2025-12-09 15:15:00,15,,,
200801KD73747,554130,192060,0.224359,51.606233,1,3,1,1,13/07/2008,1,11:16,15,E09000016,5,0,6,30,9,4,6,0,0,1,1,1,1,0,0,1,1,E01002282,2025-12-09 11:16:00,11,,,
200801KD73748,558330,188670,0.283431,51.574611,1,3,2,4,29/07/2008,3,09:50,15,E09000016,1,25,7,70,5,4,3,127,0,0,1,1,1,0,0,2,1,E01002259,2025-12-09 09:50:00,9,,,
200801KD73753,551530,189180,0.1856,51.581061,1,3,2,2,30/07/2008,4,16:00,15,E09000016,3,118,9,30,0,-1,-1,0,0,0,1,1,1,0,0,1,2,E01002353,2025-12-09 16:00:00,16,,,
200801KD73762,553340,190480,0.21227,51.592252,1,3,2,1,22/07/2008,3,07:30,15,E09000016,3,118,1,60,1,4,3,12,0,0,1,9,1,0,0,1,2,E01002383,2025-12-09 07:30:00,7,,,
200801KD73767,551050,192500,0.180106,51.61102,1,3,1,2,25/07/2008,6,21:29,15,E09000016,4,175,3,30,0,-1,-1,0,0,0,4,1,1,0,0,1,1,E01002304,2025-12-09 21:29:00,21,,,
200801KD73769,549230,190960,0.153186,51.597668,1,3,2,1,26/07/2008,7,10:55,15,E09000016,4,174,1,30,1,4,5,0,0,0,1,1,1,0,0,1,1,E01002326,2025-12-09 10:55:00,10,,,
200801KD73771,551460,188160,0.184151,51.571915,1,3,2,9,02/07/2008,4,08:35,15,E09000016,5,0,6,30,6,2,5,0,0,4,1,1,1,0,0,1,1,E01002350,2025-12-09 08:35:00,8,2008-02-07,Thursday,2.0
200801KD73773,550840,189410,0.175747,51.583313,1,3,2,1,08/07/2008,3,13:48,15,E09000016,6,0,6,30,0,-1,-1,0,0,0,1,1,1,0,0,1,2,E01002353,2025-12-09 13:48:00,13,2008-08-07,Thursday,8.0
200801KD73781,550460,183010,0.167531,51.52591,1,3,2,1,31/07/2008,5,18:22,15,E09000016,3,1306,3,30,3,4,6,0,0,0,1,1,1,0,0,1,1,E01002368,2025-12-09 18:22:00,18,,,
200801KD73783,551010,188650,0.177873,51.576439,1,3,2,1,05/07/2008,7,15:30,15,E09000016,3,125,6,30,5,4,3,118,0,0,1,1,1,0,0,1,2,E01002356,2025-12-09 15:30:00,15,2008-05-07,Wednesday,5.0
200801KD73789,552020,183440,0.190187,51.529356,1,3,1,1,29/07/2008,3,01:00,15,E09000016,5,0,6,30,0,-1,-1,0,0,0,4,2,2,0,0,1,1,E01002371,2025-12-09 01:00:00,1,,,
200801KD73832,550920,189240,0.176828,51.581764,1,3,2,1,18/07/2008,6,00:01,15,E09000016,3,125,6,30,0,-1,-1,0,0,0,1,1,1,0,0,1,2,E01002353,2025-12-09 00:01:00,0,,,
200801KD73850,550730,189510,0.174204,51.584241,1,3,1,1,22/07/2008,3,20:00,15,E09000016,3,125,6,60,3,4,6,0,0,0,1,1,1,0,0,1,1,E01002340,2025-12-09 20:00:00,20,,,
200801KD73854,553770,185470,0.216282,51.547121,1,3,2,1,30/07/2008,4,18:12,15,E09000016,5,0,6,30,3,4,6,0,0,0,1,1,1,0,0,1,1,E01002285,2025-12-09 18:12:00,18,,,
200801KD73866,556230,185750,0.251855,51.548962,1,3,2,2,07/07/2008,2,16:35,15,E09000016,6,0,6,30,6,4,6,0,0,0,1,5,2,0,0,1,2,E01002388,2025-12-09 16:35:00,16,2008-07-07,Monday,7.0
200801KD73891,549500,190370,0.15683,51.592295,1,3,2,3,19/07/2008,7,01:10,15,E09000016,5,0,6,30,3,4,6,0,0,4,4,1,1,0,0,1,1,E01002325,2025-12-09 01:10:00,1,,,
200801KD73908,549900,189060,0.162041,51.580419,1,3,3,1,10/07/2008,5,05:49,15,E09000016,3,12,3,50,0,-1,-1,0,0,0,1,1,1,0,0,1,1,E01002244,2025-12-09 05:49:00,5,2008-10-07,Tuesday,10.0
200801KD73911,558420,188630,0.284711,51.574227,1,3,2,2,07/07/2008,2,11:15,15,E09000016,1,25,7,70,5,4,1,25,0,0,1,1,1,0,0,2,1,E01002259,2025-12-09 11:15:00,11,2008-07-07,Monday,7.0
200801KD73918,554690,180610,0.227407,51.503204,1,3,2,2,02/07/2008,4,09:35,15,E09000016,3,1306,3,40,3,4,6,0,0,0,1,1,1,0,0,2,1,E01002344,2025-12-09 09:35:00,9,2008-02-07,Thursday,2.0
200801KD73952,553340,189330,0.211768,51.58192,1,3,2,1,13/07/2008,1,17:10,15,E09000016,5,0,6,30,8,4,6,0,0,0,1,1,1,0,0,1,1,E01002380,2025-12-09 17:10:00,17,,,
200801KD73976,551970,188180,0.191513,51.571958,1,3,2,1,19/07/2008,7,06:36,15,E09000016,5,0,1,30,2,4,5,0,0,1,1,1,1,0,0,1,1,E01002351,2025-12-09 06:36:00,6,,,
200801KD73979,551650,187900,0.186778,51.569528,1,3,1,1,24/07/2008,5,11:50,15,E09000016,5,0,6,30,3,4,6,0,0,1,1,1,1,0,0,1,1,E01002350,2025-12-09 11:50:00,11,,,
200801KD73983,550790,189030,0.174863,51.579912,1,3,2,1,21/07/2008,2,09:00,15,E09000016,6,0,6,20,0,-1,-1,0,0,0,1,1,1,0,0,1,2,E01002243,2025-12-09 09:00:00,9,,,
200801KD73999,553680,182060,0.213497,51.516508,1,3,1,1,24/07/2008,5,00:01,15,E09000016,3,1306,9,60,0,-1,-1,0,0,0,1,9,1,0,0,2,2,E01002344,2025-12-09 00:01:00,0,,,
200801KD74005,554690,191180,0.232052,51.598173,1,3,2,1,25/07/2008,6,09:30,15,E09000016,5,0,3,40,7,2,3,12,0,1,1,1,1,0,0,1,1,E01002299,2025-12-09 09:30:00,9,,,
200801KD74018,555920,185490,0.247273,51.546712,1,3,3,3,13/07/2008,1,16:50,15,E09000016,4,1421,6,40,6,3,6,0,0,0,1,1,1,0,0,1,1,E01002388,2025-12-09 16:50:00,16,,,
200801KD74021,557300,187900,0.268236,51.567982,1,3,2,1,14/07/2008,2,10:37,15,E09000016,5,0,6,30,6,2,6,0,0,5,1,1,1,0,0,1,1,E01002258,2025-12-09 10:37:00,10,,,
200801KD74047,555100,185010,0.235245,51.542625,1,3,1,1,11/07/2008,6,00:30,15,E09000016,5,0,9,30,0,-1,-1,0,0,0,4,9,1,0,0,2,2,E01002385,2025-12-09 00:30:00,0,2008-11-07,Friday,11.0
200801KD74097,556240,185050,0.251689,51.54267,1,3,1,1,18/03/2008,3,16:22,15,E09000016,4,1421,6,30,3,2,4,1421,0,0,1,1,1,0,0,1,1,E01002385,2025-12-09 16:22:00,16,,,
200801KD74106,550580,182260,0.168939,51.519139,1,3,2,1,28/07/2008,2,10:05,15,E09000016,5,0,1,40,1,4,3,13,0,0,1,1,1,0,0,1,2,E01002370,2025-12-09 10:05:00,10,,,
200801KD74109,555590,193630,0.246122,51.619937,1,3,2,2,24/07/2008,5,22:20,15,E09000016,1,25,3,70,0,-1,-1,0,0,0,4,1,1,0,0,2,1,E01002276,2025-12-09 22:20:00,22,,,
200801KD74138,554140,187300,0.222415,51.563463,1,3,2,1,17/07/2008,5,12:45,15,E09000016,6,0,9,30,0,-1,-1,0,0,0,1,9,1,0,0,1,2,E01002359,2025-12-09 12:45:00,12,,,
200801KD74171,551670,188500,0.187325,51.574914,1,3,2,3,13/08/2008,4,15:45,15,E09000016,5,0,3,30,6,2,5,0,0,0,1,4,1,0,0,1,2,E01002358,2025-12-09 15:45:00,15,,,
200801KD74175,551970,183390,0.189445,51.52892,1,3,1,2,04/08/2008,2,20:20,15,E09000016,5,0,6,30,3,4,3,125,0,0,1,1,1,0,0,1,1,E01002371,2025-12-09 20:20:00,20,2008-04-08,Tuesday,4.0
200801KD74178,551440,188360,0.183948,51.573718,1,3,1,1,05/08/2008,3,10:29,15,E09000016,5,0,6,30,0,-1,-1,0,0,0,1,2,2,0,0,1,2,E01002356,2025-12-09 10:29:00,10,2008-05-08,Thursday,5.0
200801KD74179,550950,183180,0.174662,51.527306,1,3,4,2,03/08/2008,1,14:20,15,E09000016,6,0,6,30,8,4,6,0,0,0,1,1,1,0,0,1,1,E01002368,2025-12-09 14:20:00,14,2008-03-08,Saturday,3.0
200801KD74182,550620,189750,0.17272,51.586427,1,3,2,1,14/08/2008,5,13:26,15,E09000016,3,12,3,50,6,2,3,125,0,0,1,1,1,0,0,1,1,E01002338,2025-12-09 13:26:00,13,,,
200801KD74185,551270,181250,0.178443,51.50988,1,3,2,1,01/08/2008,6,10:32,15,E09000016,6,0,6,30,0,-1,-1,0,0,0,1,1,1,0,0,2,1,E01002344,2025-12-09 10:32:00,10,2008-01-08,Tuesday,1.0
200801KD74193,551680,188520,0.187478,51.575091,1,3,2,3,05/08/2008,3,06:30,15,E09000016,5,0,3,30,6,2,5,0,0,5,1,1,1,1,0,1,1,E01002358,2025-12-09 06:30:00,6,2008-05-08,Thursday,5.0
200801KD74194,550100,189210,0.164989,51.581713,1,3,2,1,09/08/2008,7,14:30,15,E09000016,3,12,3,30,6,2,5,0,0,0,1,2,2,6,0,1,2,E01002244,2025-12-09 14:30:00,14,2008-09-08,Monday,9.0
200801KD74195,552080,182580,0.19068,51.521612,1,2,1,2,08/08/2008,6,22:58,15,E09000016,3,1306,1,30,1,4,3,125,0,0,4,1,1,0,0,2,1,E01002370,2025-12-09 22:58:00,22,2008-08-08,Friday,8.0
200801KD74196,552140,182100,0.191337,51.517283,1,3,2,1,07/08/2008,5,17:22,15,E09000016,5,0,6,30,3,4,4,1335,0,0,1,1,1,0,0,1,1,E01002345,2025-12-09 17:22:00,17,2008-07-08,Tuesday,7.0
200801KD74197,551990,187410,0.191468,51.565034,1,3,1,1,09/08/2008,7,23:16,15,E09000016,3,124,6,30,0,-1,-1,0,0,5,4,1,1,0,0,1,1,E01002319,2025-12-09 23:16:00,23,2008-09-08,Monday,9.0
200801KD74203,558300,188740,0.28303,51.575249,1,3,2,2,23/08/2008,7,14:20,15,E09000016,1,25,1,70,0,-1,-1,0,0,0,1,1,1,0,0,2,1,E01002259,2025-12-09 14:20:00,14,,,
200801KD74205,554660,186940,0.229753,51.560086,1,2,2,1,12/08/2008,3,22:00,15,E09000016,5,0,6,30,6,2,3,124,0,0,4,1,2,0,0,1,1,E01002362,2025-12-09 22:00:00,22,2008-12-08,Monday,12.0
200801KD74206,552320,186760,0.195944,51.559105,1,2,3,1,23/08/2008,7,13:42,15,E09000016,6,0,6,30,0,-1,-1,0,0,0,1,1,1,0,0,1,1,E01002324,2025-12-09 13:42:00,13,,,
200801KD74208,551630,189330,0.187107,51.582382,1,3,2,1,06/08/2008,4,11:00,15,E09000016,6,0,6,30,0,-1,-1,0,0,0,1,1,1,0,0,1,2,E01002353,2025-12-09 11:00:00,11,2008-06-08,Sunday,6.0
200801KD74223,549570,192130,0.15859,51.608091,1,3,2,1,16/08/2008,7,16:00,15,E09000016,6,0,6,30,3,4,6,0,0,0,1,1,1,0,0,1,1,E01002305,2025-12-09 16:00:00,16,,,
200801KD74235,558340,188470,0.283485,51.572812,1,3,2,1,14/08/2008,5,10:32,15,E09000016,3,127,1,30,1,4,1,25,0,0,1,1,1,0,0,2,1,E01002259,2025-12-09 10:32:00,10,,,
200801KD74237,551100,189060,0.179347,51.580099,1,3,1,1,31/08/2008,1,01:00,15,E09000016,3,118,3,30,0,-1,-1,0,0,0,4,1,1,0,0,1,1,E01002353,2025-12-09 01:00:00,1,,,
200801KD74247,551950,183450,0.189183,51.529464,1,3,2,2,30/08/2008,7,14:07,15,E09000016,3,125,6,30,8,4,6,0,0,0,1,1,1,0,0,1,1,E01002371,2025-12-09 14:07:00,14,,,
200801KD74251,553190,190330,0.210041,51.590945,1,3,2,3,25/08/2008,2,01:38,15,E09000016,3,118,6,30,3,2,5,0,0,0,7,1,1,0,0,1,1,E01002383,2025-12-09 01:38:00,1,,,
200801KD74272,550570,182440,0.168872,51.520759,1,3,1,1,28/08/2008,5,12:27,15,E09000016,5,0,1,30,1,4,3,13,0,0,1,1,1,0,0,1,1,E01002368,2025-12-09 12:27:00,12,,,
200801KD74276,556560,186690,0.257029,51.557316,1,3,2,1,04/08/2008,2,07:35,15,E09000016,4,187,6,30,0,-1,-1,0,0,0,1,1,1,0,0,1,1,E01002384,2025-12-09 07:35:00,7,2008-04-08,Tuesday,4.0
200801KD74282,551480,188420,0.184551,51.574246,1,3,2,1,19/08/2008,3,20:40,15,E09000016,5,0,6,30,0,-1,-1,0,0,0,1,1,2,0,0,1,2,E01002356,2025-12-09 20:40:00,20,,,
200801KD74293,551240,188050,0.180931,51.570986,1,3,1,1,18/08/2008,2,16:17,15,E09000016,6,0,1,30,9,4,3,125,0,0,1,1,1,0,0,1,1,E01002249,2025-12-09 16:17:00,16,,,
200801KD74309,551230,190430,0.181811,51.592373,1,3,3,5,18/08/2008,2,16:30,15,E09000016,3,12,3,30,6,2,5,0,0,0,1,1,1,0,0,1,2,E01002334,2025-12-09 16:30:00,16,,,
200801KD74314,555070,189260,0.236686,51.580818,1,3,1,1,24/08/2008,1,08:14,15,E09000016,3,127,3,50,0,-1,-1,0,0,0,1,1,1,0,0,1,1,E01002269,2025-12-09 08:14:00,8,,,
200801KD74319,553520,190580,0.21491,51.593102,1,3,2,1,22/08/2008,6,17:00,15,E09000016,3,12,3,60,0,-1,-1,0,0,0,1,1,1,0,0,1,2,E01002293,2025-12-09 17:00:00,17,,,
200801KD74320,552060,181360,0.189866,51.510656,1,3,2,2,08/08/2008,6,20:00,15,E09000016,3,13,3,70,0,-1,-1,0,0,0,1,1,1,0,0,2,1,E01002344,2025-12-09 20:00:00,20,2008-08-08,Friday,8.0
200801KD74333,555710,191750,0.247019,51.603013,1,3,2,2,09/08/2008,7,21:30,15,E09000016,3,12,3,30,3,2,5,0,0,0,4,2,2,0,0,1,2,E01002296,2025-12-09 21:30:00,21,2008-09-08,Monday,9.0
200801KD74339,556730,192310,0.261986,51.607762,1,3,2,1,02/08/2008,7,12:30,15,E09000016,1,25,1,30,1,2,3,12,0,0,1,1,1,0,0,2,2,E01002296,2025-12-09 12:30:00,12,2008-02-08,Friday,2.0
200801KD74357,555540,191680,0.244536,51.602431,1,3,2,1,02/08/2008,7,10:38,15,E09000016,3,12,3,50,7,2,5,0,0,0,1,2,2,0,0,1,1,E01002283,2025-12-09 10:38:00,10,2008-02-08,Friday,2.0
200801KD74386,553640,183070,0.213362,51.525593,1,3,2,2,21/08/2008,5,19:15,15,E09000016,6,0,6,30,3,4,6,0,0,0,4,2,2,0,0,1,2,E01002349,2025-12-09 19:15:00,19,,,
200801KD74409,553430,190950,0.213773,51.596451,1,3,2,2,04/08/2008,2,21:16,15,E09000016,6,0,6,30,3,4,6,0,0,0,4,1,1,0,0,1,1,E01002310,2025-12-09 21:16:00,21,2008-04-08,Tuesday,4.0
200801KD74419,558630,186200,0.286643,51.552336,1,2,2,1,08/08/2008,6,14:55,15,E09000016,1,25,3,70,0,-1,-1,0,0,0,1,1,1,0,0,2,1,E01002391,2025-12-09 14:55:00,14,2008-08-08,Friday,8.0
200801KD74425,556940,184170,0.261383,51.534569,1,3,2,1,15/08/2008,6,00:14,15,E09000016,6,0,6,30,0,-1,-1,0,0,0,6,1,1,0,0,2,1,E01002385,2025-12-09 00:14:00,0,,,
200801KD74427,550840,187910,0.175104,51.569835,1,3,2,2,05/08/2008,3,14:30,15,E09000016,5,0,6,30,1,4,5,0,0,0,1,1,1,0,0,1,1,E01002249,2025-12-09 14:30:00,14,2008-05-08,Thursday,5.0
200801KD74445,549220,191170,0.153131,51.599558,1,2,1,1,29/08/2008,6,17:30,15,E09000016,6,0,9,30,0,-1,-1,0,0,0,1,1,1,0,0,1,2,E01002331,2025-12-09 17:30:00,17,,,
200801KD74458,554150,189900,0.223699,51.58682,1,2,2,3,13/08/2008,4,00:20,15,E09000016,5,0,3,50,7,2,3,127,0,0,4,1,2,0,0,1,1,E01002377,2025-12-09 00:20:00,0,,,
200801KD74459,554190,189900,0.224276,51.586809,1,2,2,3,13/08/2008,4,13:08,15,E09000016,3,127,3,40,3,2,5,0,0,0,1,1,1,0,0,1,1,E01002268,2025-12-09 13:08:00,13,,,
200801KD74462,550640,182930,0.170089,51.525143,1,3,2,3,17/08/2008,1,09:25,15,E09000016,3,1306,3,30,3,2,5,0,0,5,1,1,2,0,0,1,1,E01002368,2025-12-09 09:25:00,9,,,
200801KD74465,550630,182940,0.16995,51.525235,1,3,2,1,29/08/2008,6,22:37,15,E09000016,3,1306,3,30,3,2,5,0,0,0,4,1,1,0,0,1,1,E01002368,2025-12-09 22:37:00,22,,,
200801KD74469,553420,192030,0.214101,51.606157,1,3,2,1,07/08/2008,5,22:13,15,E09000016,5,0,6,30,3,4,5,0,0,0,4,8,2,0,0,1,1,E01002282,2025-12-09 22:13:00,22,2008-07-08,Tuesday,7.0
200801KD74471,550890,188410,0.176039,51.574314,1,3,2,2,28/08/2008,5,18:08,15,E09000016,6,0,9,30,6,4,6,0,0,0,1,1,1,0,0,1,1,E01002356,2025-12-09 18:08:00,18,,,
200801KD74504,552090,190780,0.194369,51.595286,1,1,1,1,21/08/2008,5,19:25,15,E09000016,3,12,3,50,0,-1,-1,0,0,0,1,1,1,0,0,2,1,E01002311,2025-12-09 19:25:00,19,,,
200801KD74506,556220,183510,0.250717,51.528839,1,3,2,2,04/08/2008,2,13:41,15,E09000016,5,0,6,30,7,4,5,0,0,0,1,1,1,0,0,2,1,E01002385,2025-12-09 13:41:00,13,2008-04-08,Tuesday,4.0
200801KD74508,551190,188060,0.180215,51.571089,1,3,2,1,06/08/2008,4,19:00,15,E09000016,5,0,1,30,1,4,6,0,0,0,1,1,1,0,2,1,1,E01002249,2025-12-09 19:00:00,19,2008-06-08,Sunday,6.0
200801KD74510,552630,185110,0.199697,51.544196,1,3,2,1,12/08/2008,3,11:30,15,E09000016,6,0,6,30,0,-1,-1,0,0,0,1,1,2,0,0,1,1,E01002264,2025-12-09 11:30:00,11,2008-12-08,Monday,12.0
200801KD74511,558680,187830,0.288099,51.566966,1,3,4,2,15/08/2008,6,10:30,15,E09000016,1,25,3,70,0,-1,-1,0,0,0,1,1,1,0,0,2,1,E01002252,2025-12-09 10:30:00,10,,,
200801KD74519,557240,191140,0.268821,51.597108,1,3,1,1,25/08/2008,2,06:47,15,E09000016,1,25,3,70,0,-1,-1,0,0,0,1,1,1,0,1,2,1,E01002296,2025-12-09 06:47:00,6,,,
200801KD74528,552740,184530,0.201031,51.538955,1,3,2,1,09/08/2008,7,18:53,15,E09000016,5,0,6,30,6,2,5,0,0,0,1,1,1,0,0,1,2,E01002263,2025-12-09 18:53:00,18,2008-09-08,Monday,9.0
200801KD74529,551620,190610,0.187515,51.593886,1,3,2,1,16/08/2008,7,07:25,15,E09000016,6,0,3,50,3,4,3,12,0,0,1,1,1,0,0,1,1,E01002334,2025-12-09 07:25:00,7,,,
200801KD74549,555060,194000,0.238636,51.623408,1,2,4,5,28/08/2008,5,23:45,15,E09000016,1,25,3,70,0,-1,-1,0,0,0,4,1,1,0,0,2,1,E01002276,2025-12-09 23:45:00,23,,,
200801KD74553,554490,188050,0.22779,51.570106,1,3,3,1,18/08/2008,2,19:05,15,E09000016,6,0,6,30,0,-1,-1,0,0,0,1,2,2,0,0,1,1,E01002275,2025-12-09 19:05:00,19,,,
200801KD74558,553340,185940,0.21029,51.551461,1,3,1,1,08/08/2008,6,21:44,15,E09000016,6,0,6,30,0,-1,-1,0,0,0,4,1,1,0,0,1,1,E01002286,2025-12-09 21:44:00,21,2008-08-08,Friday,8.0
200801KD74574,555050,186840,0.23533,51.559081,1,3,2,2,24/08/2008,1,14:05,15,E09000016,3,124,6,30,3,4,6,0,0,0,1,1,1,0,0,1,1,E01002362,2025-12-09 14:05:00,14,,,
200801KD74590,559540,185040,0.299232,51.541658,1,2,2,1,17/08/2008,1,11:40,15,E09000016,5,0,6,60,0,-1,-1,0,0,0,1,9,1,0,0,2,1,E01002391,2025-12-09 11:40:00,11,,,
200801KD74593,552030,182260,0.189822,51.518751,1,2,1,1,31/08/2008,1,11:35,15,E09000016,4,1335,6,30,3,4,5,0,0,0,1,1,1,0,0,1,1,E01002345,2025-12-09 11:35:00,11,,,
200801KD74608,553420,190510,0.213437,51.5925,1,3,2,1,09/08/2008,7,16:25,15,E09000016,3,12,1,50,1,4,3,127,0,0,1,5,2,0,0,1,1,E01002293,2025-12-09 16:25:00,16,2008-09-08,Monday,9.0
200801KD74612,554360,191850,0.227585,51.604283,1,3,2,1,05/09/2008,6,08:30,15,E09000016,5,0,6,30,3,4,5,0,0,0,1,1,1,0,0,1,2,E01002299,2025-12-09 08:30:00,8,2008-05-09,Friday,5.0
200801KD74613,554820,190210,0.233499,51.589422,1,3,2,1,04/09/2008,5,16:30,15,E09000016,5,0,6,30,7,4,5,0,0,0,1,9,1,0,0,1,2,E01002295,2025-12-09 16:30:00,16,2008-04-09,Wednesday,4.0
200801KD74614,552370,184080,0.195505,51.535012,1,3,1,1,02/09/2008,3,09:02,15,E09000016,5,0,6,30,3,4,6,0,0,0,1,1,1,0,0,1,1,E01002372,2025-12-09 09:02:00,9,2008-02-09,Saturday,2.0
200801KD74617,550380,183030,0.166387,51.526111,1,3,2,1,06/09/2008,7,09:05,15,E09000016,3,1306,6,30,3,2,6,0,0,4,1,1,1,0,0,1,1,E01002368,2025-12-09 09:05:00,9,2008-06-09,Monday,6.0
200801KD74619,553750,187220,0.216758,51.56285,1,3,2,1,06/09/2008,7,22:10,15,E09000016,3,124,9,30,0,-1,-1,0,0,0,4,2,2,0,0,1,2,E01002361,2025-12-09 22:10:00,22,2008-06-09,Monday,6.0
200801KD74620,552010,183410,0.19003,51.529089,1,3,1,1,01/09/2008,2,13:18,15,E09000016,3,125,6,30,9,2,5,0,0,4,1,1,1,0,0,1,1,E01002374,2025-12-09 13:18:00,13,2008-01-09,Wednesday,1.0
200801KD74621,553400,190610,0.213192,51.593404,1,3,1,1,01/09/2008,2,17:08,15,E09000016,5,0,6,30,0,-1,-1,0,0,0,1,1,1,0,0,1,1,E01002310,2025-12-09 17:08:00,17,2008-01-09,Wednesday,1.0
200801KD74622,554610,191070,0.230849,51.597207,1,3,2,1,11/09/2008,5,09:09,15,E09000016,6,0,6,30,0,-1,-1,0,0,0,1,1,1,0,0,1,1,E01002300,2025-12-09 09:09:00,9,2008-11-09,Sunday,11.0
200801KD74624,559630,187080,0.301454,51.55996,1,2,1,2,07/09/2008,1,22:32,15,E09000016,4,186,6,60,0,-1,-1,0,0,0,4,1,1,0,0,2,1,E01002391,2025-12-09 22:32:00,22,2008-07-09,Wednesday,7.0
200801KD74626,550310,187790,0.167411,51.568899,1,2,2,1,01/09/2008,2,15:45,15,E09000016,6,0,1,30,0,-1,-1,0,0,0,1,9,1,0,0,1,2,E01002248,2025-12-09 15:45:00,15,2008-01-09,Wednesday,1.0
200801KD74629,552550,185850,0.198865,51.550867,1,3,2,1,02/09/2008,3,07:30,15,E09000016,5,0,1,30,1,4,5,0,0,0,1,2,2,0,0,1,1,E01002261,2025-12-09 07:30:00,7,2008-02-09,Saturday,2.0
200801KD74631,554660,186460,0.229542,51.555773,1,3,2,1,01/09/2008,2,08:10,15,E09000016,5,0,6,30,0,-1,-1,0,0,0,1,1,1,0,0,1,1,E01002289,2025-12-09 08:10:00,8,2008-01-09,Wednesday,1.0
200801KD74634,556120,190350,0.252312,51.590321,1,3,1,1,07/09/2008,1,06:15,15,E09000016,5,0,6,30,0,-1,-1,0,0,0,1,2,2,0,0,2,1,E01002294,2025-12-09 06:15:00,6,2008-07-09,Wednesday,7.0
200801KD74640,556880,192380,0.264182,51.608349,1,3,2,2,08/09/2008,2,13:50,15,E09000016,3,12,1,30,1,4,3,12,0,0,1,1,1,0,0,2,1,E01002296,2025-12-09 13:50:00,13,2008-08-09,Saturday,8.0
200801KD74644,550720,190880,0.174648,51.596553,1,3,2,1,04/09/2008,5,19:56,15,E09000016,4,175,1,30,2,4,5,0,0,0,4,1,1,0,0,1,1,E01002336,2025-12-09 19:56:00,19,2008-04-09,Wednesday,4.0
200801KD74655,553410,190520,0.213297,51.592593,1,3,2,2,18/09/2008,5,16:49,15,E09000016,3,118,1,30,1,4,3,127,0,0,1,1,1,0,0,1,1,E01002293,2025-12-09 16:49:00,16,,,
200801KD74661,556680,188990,0.259783,51.577947,1,3,2,2,10/09/2008,4,15:53,15,E09000016,3,127,3,70,0,-1,-1,0,0,0,1,1,1,0,0,2,1,E01002259,2025-12-09 15:53:00,15,2008-10-09,Thursday,10.0
200801KD74662,551710,181540,0.184904,51.512367,1,3,2,1,10/09/2008,4,13:35,15,E09000016,5,0,1,30,1,4,3,13,0,0,1,1,1,0,0,2,1,E01002344,2025-12-09 13:35:00,13,2008-10-09,Thursday,10.0
200801KD74665,558530,188410,0.286198,51.572219,1,3,2,1,19/09/2008,6,13:00,15,E09000016,3,127,1,50,1,4,1,25,0,0,1,1,1,0,0,2,1,E01002252,2025-12-09 13:00:00,13,,,
200801KD74669,552860,181780,0.201567,51.514214,1,3,2,1,05/09/2008,6,18:00,15,E09000016,6,0,6,30,3,4,6,0,0,0,1,1,2,0,0,1,2,E01002347,2025-12-09 18:00:00,18,2008-05-09,Friday,5.0
200801KD74673,553990,187220,0.220218,51.562785,1,2,1,1,19/09/2008,6,23:55,15,E09000016,5,0,6,30,3,4,6,0,0,0,4,1,1,0,0,1,1,E01002361,2025-12-09 23:55:00,23,,,
200801KD74676,554850,187150,0.232584,51.561921,1,3,2,1,05/09/2008,6,20:00,15,E09000016,5,0,6,30,6,4,6,0,0,0,4,2,2,0,0,1,2,E01002362,2025-12-09 20:00:00,20,2008-05-09,Friday,5.0
200801KD74696,556260,189110,0.25378,51.579142,1,3,2,1,05/09/2008,6,11:59,15,E09000016,5,0,6,50,5,4,6,0,0,0,1,2,2,0,0,2,1,E01002296,2025-12-09 11:59:00,11,2008-05-09,Friday,5.0
200801KD74701,551820,183220,0.187211,51.527433,1,3,1,1,08/09/2008,2,17:30,15,E09000016,6,0,6,30,0,-1,-1,0,0,0,1,1,1,0,0,1,1,E01002370,2025-12-09 17:30:00,17,2008-08-09,Saturday,8.0
200801KD74704,557800,189620,0.276216,51.583295,1,3,2,1,18/09/2008,5,08:08,15,E09000016,1,25,3,70,0,-1,-1,0,0,0,1,1,1,0,0,2,1,E01002259,2025-12-09 08:08:00,8,,,
200801KD74707,558840,187250,0.290143,51.56171,1,3,5,2,01/09/2008,2,17:10,15,E09000016,1,25,3,70,0,-1,-1,0,0,0,1,1,1,6,3,2,1,E01002391,2025-12-09 17:10:00,17,2008-01-09,Wednesday,1.0
200801KD74744,550660,189780,0.17331,51.586685,1,3,2,1,24/09/2008,4,13:18,15,E09000016,3,12,3,50,9,2,3,125,0,0,1,2,2,0,0,1,1,E01002340,2025-12-09 13:18:00,13,,,
200801KD74764,552050,185380,0.191456,51.546779,1,2,1,1,17/09/2008,4,14:50,15,E09000016,6,0,6,30,2,4,6,0,0,8,1,1,1,0,0,1,1,E01002262,2025-12-09 14:50:00,14,,,
200801KD74769,552140,182110,0.191341,51.517373,1,3,2,1,09/09/2008,3,14:30,15,E09000016,5,0,6,30,3,4,4,1335,0,0,1,8,2,0,0,1,1,E01002345,2025-12-09 14:30:00,14,2008-09-09,Tuesday,9.0
200801KD74776,553410,190530,0.213301,51.592683,1,3,2,1,20/09/2008,7,12:40,15,E09000016,3,12,1,30,1,4,3,118,0,0,1,1,1,0,0,1,2,E01002293,2025-12-09 12:40:00,12,,,
200801KD74784,554940,185640,0.233217,51.548329,1,3,2,1,20/09/2008,7,12:53,15,E09000016,5,0,6,30,7,4,6,0,0,0,1,1,1,0,0,2,1,E01002389,2025-12-09 12:53:00,12,,,
200801KD74785,553930,191320,0.221149,51.599639,1,3,2,1,15/09/2008,2,06:45,15,E09000016,6,0,6,30,3,4,6,0,0,0,1,1,1,0,0,1,1,E01002316,2025-12-09 06:45:00,6,,,
200801KD74791,553140,189370,0.208901,51.582334,1,3,1,1,10/09/2008,4,17:00,15,E09000016,5,0,6,30,0,-1,-1,0,0,0,1,1,1,0,0,1,2,E01002379,2025-12-09 17:00:00,17,2008-10-09,Thursday,10.0
200801KD74797,551090,188000,0.178747,51.570577,1,2,1,1,30/09/2008,3,08:20,15,E09000016,5,0,6,30,0,-1,-1,0,1,4,1,2,2,0,0,1,1,E01002249,2025-12-09 08:20:00,8,,,
200801KD74824,552880,181900,0.201907,51.515287,1,3,2,1,21/09/2008,1,19:20,15,E09000016,4,1335,6,30,7,4,4,1335,0,0,4,1,1,0,0,1,1,E01002347,2025-12-09 19:20:00,19,,,
200801KD74829,551130,190610,0.180446,51.594017,1,2,2,1,11/09/2008,5,18:25,15,E09000016,5,0,6,30,7,4,6,0,0,1,1,1,1,0,0,1,1,E01002336,2025-12-09 18:25:00,18,2008-11-09,Sunday,11.0
200801KD74839,552880,189230,0.20509,51.581146,1,3,1,1,10/09/2008,4,15:55,15,E09000016,5,0,6,30,3,4,6,0,0,1,1,1,1,0,0,1,1,E01002379,2025-12-09 15:55:00,15,2008-10-09,Thursday,10.0
200801KD74840,551690,181470,0.184586,51.511744,1,3,2,4,23/09/2008,3,17:40,15,E09000016,3,13,3,70,0,-1,-1,0,0,0,1,1,1,0,0,2,1,E01002344,2025-12-09 17:40:00,17,,,
200801KD74842,553950,189680,0.220718,51.584898,1,2,2,2,18/09/2008,5,21:10,15,E09000016,5,0,6,30,0,-1,-1,0,0,0,1,1,1,0,0,1,1,E01002377,2025-12-09 21:10:00,21,,,
200801KD74856,558780,186510,0.288945,51.555079,1,3,2,5,23/09/2008,3,10:40,15,E09000016,1,25,3,70,0,-1,-1,0,0,0,1,1,1,0,0,2,1,E01002391,2025-12-09 10:40:00,10,,,
200801KD74921,556200,190350,0.253466,51.590299,1,3,3,3,24/09/2008,4,15:23,15,E09000016,5,0,6,40,3,4,5,0,0,0,1,2,2,0,2,2,1,E01002296,2025-12-09 15:23:00,15,,,
200801KD74933,551820,186540,0.188642,51.557263,1,3,2,1,16/09/2008,3,10:42,15,E09000016,3,125,6,30,8,4,6,0,0,0,1,1,1,0,0,1,1,E01002322,2025-12-09 10:42:00,10,,,
200801KD74983,550360,188360,0.168376,51.574007,1,3,1,1,26/09/2008,6,07:45,15,E09000016,3,118,6,30,3,4,6,0,0,0,1,1,1,0,0,1,2,E01002247,2025-12-09 07:45:00,7,,,
200801KD75031,554540,180930,0.225387,51.50612,1,3,2,1,23/09/2008,3,18:35,15,E09000016,3,1306,3,50,3,4,4,1335,0,0,4,1,1,0,0,2,1,E01002344,2025-12-09 18:35:00,18,,,
200801KD75037,553410,189440,0.212825,51.582889,1,3,1,1,13/09/2008,7,23:55,15,E09000016,6,0,6,30,3,4,6,0,0,0,4,1,1,0,0,1,1,E01002380,2025-12-09 23:55:00,23,,,
200801KD75039,551360,191620,0.1842,51.60303,1,3,2,1,08/09/2008,2,07:05,15,E09000016,5,0,1,30,1,4,6,0,0,0,1,1,1,0,0,1,1,E01002304,2025-12-09 07:05:00,7,2008-08-09,Saturday,8.0
200801KD75047,552600,184300,0.198914,51.536926,1,3,2,2,20/09/2008,7,20:05,15,E09000016,5,0,6,30,3,4,6,0,0,0,4,1,1,0,0,1,1,E01002267,2025-12-09 20:05:00,20,,,
200801KD75050,552190,183070,0.192476,51.525985,1,3,1,1,12/09/2008,6,15:35,15,E09000016,3,125,6,30,0,-1,-1,0,0,0,1,1,1,0,0,1,1,E01002370,2025-12-09 15:35:00,15,2008-12-09,Tuesday,12.0
200801KD75053,557240,187220,0.267067,51.561889,1,3,1,1,15/09/2008,2,17:00,15,E09000016,5,0,6,30,3,2,6,0,0,4,1,1,1,0,0,1,1,E01002254,2025-12-09 17:00:00,17,,,
200801KD75063,553050,186020,0.206145,51.552259,1,3,1,1,22/09/2008,2,15:35,15,E09000016,5,0,6,30,0,-1,-1,0,0,0,1,1,1,0,0,1,1,E01002366,2025-12-09 15:35:00,15,,,
200801KD75073,551900,187430,0.19018,51.565238,1,3,2,2,15/09/2008,2,18:40,15,E09000016,3,124,3,30,3,2,3,125,0,4,1,1,1,0,0,1,2,E01002319,2025-12-09 18:40:00,18,,,
200801KD75077,552540,184250,0.198028,51.536493,1,3,2,2,30/09/2008,3,08:35,15,E09000016,5,0,6,30,3,4,6,0,0,0,1,2,2,0,0,1,1,E01002372,2025-12-09 08:35:00,8,,,
200801KD75083,552880,188530,0.204786,51.574857,1,2,1,1,25/09/2008,5,13:55,15,E09000016,5,0,6,30,3,4,6,0,0,0,1,1,1,4,0,1,1,E01002272,2025-12-09 13:55:00,13,,,
200801KD75084,551870,189450,0.19062,51.583396,1,3,4,2,29/09/2008,2,15:27,15,E09000016,3,118,6,30,6,4,6,0,0,0,1,1,1,0,0,1,1,E01002353,2025-12-09 15:27:00,15,,,
200801KD75091,555950,185330,0.247634,51.545266,1,3,1,1,23/09/2008,3,08:55,15,E09000016,4,1421,6,30,0,-1,-1,0,0,0,1,1,1,0,0,1,1,E01002388,2025-12-09 08:55:00,8,,,
200801KD75113,552910,189250,0.205532,51.581318,1,3,1,1,25/09/2008,5,10:00,15,E09000016,6,0,3,30,0,-1,-1,0,0,1,1,1,1,0,0,1,2,E01002379,2025-12-09 10:00:00,10,,,
200801KD75115,554040,190010,0.222161,51.587839,1,3,2,1,29/09/2008,2,13:59,15,E09000016,3,127,9,30,0,-1,-1,0,0,0,1,1,1,0,0,1,2,E01002295,2025-12-09 13:59:00,13,,,
200801KD75120,554850,191520,0.23451,51.601184,1,3,2,1,20/09/2008,7,18:19,15,E09000016,6,0,6,30,3,4,6,0,0,0,1,1,1,0,0,1,2,E01002299,2025-12-09 18:19:00,18,,,
200801KD75144,551460,183100,0.181974,51.526451,1,2,2,1,19/09/2008,6,19:51,15,E09000016,6,0,6,30,0,-1,-1,0,0,0,1,1,1,0,0,1,1,E01002371,2025-12-09 19:51:00,19,,,
200801KD75171,551430,188730,0.183964,51.577045,1,3,1,1,22/09/2008,2,17:02,15,E09000016,5,0,6,30,0,-1,-1,0,0,0,1,1,1,0,0,1,2,E01002357,2025-12-09 17:02:00,17,,,
200801KD75173,549310,188280,0.153201,51.573567,1,2,2,2,03/10/2008,6,07:10,15,E09000016,3,118,6,30,8,4,6,0,0,0,1,1,1,0,0,1,1,E01002250,2025-12-09 07:10:00,7,2008-03-10,Monday,3.0
200801KD75181,553170,190560,0.209852,51.593017,1,3,2,2,05/10/2008,1,13:05,15,E09000016,3,12,6,50,0,-1,-1,0,0,0,1,9,1,0,0,2,2,E01002311,2025-12-09 13:05:00,13,2008-05-10,Saturday,5.0
200801KD75186,554570,190080,0.229836,51.588323,1,3,1,1,01/10/2008,4,15:16,15,E09000016,5,0,6,30,3,4,6,0,0,0,1,1,1,0,0,1,1,E01002268,2025-12-09 15:16:00,15,2008-01-10,Thursday,1.0
200801KD75187,554980,190380,0.235882,51.590906,1,3,1,1,10/10/2008,6,13:10,15,E09000016,6,0,6,30,0,-1,-1,0,0,0,1,1,1,0,0,1,1,E01002294,2025-12-09 13:10:00,13,2008-10-10,Friday,10.0
200801KD75195,555500,191530,0.243892,51.601095,1,3,2,1,18/10/2008,7,12:30,15,E09000016,6,0,6,30,0,-1,-1,0,0,0,1,1,1,0,0,1,2,E01002296,2025-12-09 12:30:00,12,,,
200801KD75197,553430,190530,0.21359,51.592677,1,3,3,1,10/10/2008,6,07:27,15,E09000016,3,12,3,30,1,4,3,12,0,4,1,1,1,0,0,1,1,E01002293,2025-12-09 07:27:00,7,2008-10-10,Friday,10.0
200801KD75218,554660,191190,0.231623,51.598271,1,3,2,1,20/10/2008,2,05:54,15,E09000016,3,12,3,50,6,2,5,0,0,4,4,1,1,0,0,1,1,E01002300,2025-12-09 05:54:00,5,,,
200801KD75226,558250,188920,0.28239,51.57688,1,3,1,1,05/10/2008,1,10:40,15,E09000016,1,25,3,70,0,-1,-1,0,0,0,1,2,2,0,0,2,1,E01002259,2025-12-09 10:40:00,10,2008-05-10,Saturday,5.0
200801KD75227,553420,189490,0.212991,51.583336,1,3,2,1,18/10/2008,7,10:00,15,E09000016,6,0,6,30,0,-1,-1,0,0,0,1,1,1,0,0,1,2,E01002380,2025-12-09 10:00:00,10,,,
200801KD75230,552520,188450,0.19956,51.574236,1,3,1,1,13/10/2008,2,08:49,15,E09000016,5,0,9,30,0,-1,-1,0,1,1,1,1,1,0,0,1,1,E01002352,2025-12-09 08:49:00,8,,,
200801KD75259,554150,180320,0.219506,51.500746,1,3,3,1,26/10/2008,1,02:02,15,E09000016,3,13,3,70,0,-1,-1,0,0,0,4,2,2,0,2,2,1,E01002344,2025-12-09 02:02:00,2,,,
200801KD75268,558440,188320,0.28486,51.571436,1,3,2,1,01/10/2008,4,06:30,15,E09000016,1,25,6,50,1,4,3,127,0,0,1,1,1,0,0,2,2,E01002252,2025-12-09 06:30:00,6,2008-01-10,Thursday,1.0
200801KD75277,555890,185830,0.246991,51.549775,1,3,1,1,11/10/2008,7,11:23,15,E09000016,4,1421,6,30,1,4,6,0,0,8,1,1,1,0,0,1,1,E01002389,2025-12-09 11:23:00,11,2008-11-10,Monday,11.0
200801KD75287,554200,182820,0.221318,51.523194,1,3,3,2,06/10/2008,2,14:50,15,E09000016,5,0,6,30,0,-1,-1,0,0,0,1,1,1,0,0,2,2,E01002348,2025-12-09 14:50:00,14,2008-06-10,Tuesday,6.0
200801KD75292,556300,189000,0.254308,51.578142,1,3,2,3,16/10/2008,5,15:35,15,E09000016,5,0,7,30,5,4,3,127,0,0,1,1,1,0,0,2,2,E01002253,2025-12-09 15:35:00,15,,,
200801KD75295,558530,188420,0.286202,51.572309,1,3,2,1,19/10/2008,1,15:02,15,E09000016,3,127,1,70,1,4,1,25,0,0,1,1,1,0,0,2,1,E01002252,2025-12-09 15:02:00,15,,,
200801KD75297,556820,192270,0.263267,51.607377,1,3,2,1,19/10/2008,1,16:45,15,E09000016,1,25,1,30,1,4,3,12,0,0,1,1,1,0,0,2,2,E01002296,2025-12-09 16:45:00,16,,,
200801KD75299,551400,188510,0.183436,51.575076,1,3,1,1,23/10/2008,5,10:25,15,E09000016,6,0,6,30,3,4,5,0,0,0,1,9,1,0,0,1,2,E01002356,2025-12-09 10:25:00,10,,,
200801KD75306,551160,182930,0.177579,51.525004,1,2,2,1,23/10/2008,5,17:53,15,E09000016,6,0,6,30,0,-1,-1,0,0,0,4,4,1,0,0,1,1,E01002369,2025-12-09 17:53:00,17,,,
200801KD75357,554750,190610,0.232666,51.593035,1,3,2,1,22/10/2008,4,15:52,15,E09000016,5,0,6,30,2,4,5,0,0,0,1,1,1,0,0,1,1,E01002293,2025-12-09 15:52:00,15,,,
200801KD75384,551950,188200,0.191233,51.572143,1,3,2,1,20/10/2008,2,20:01,15,E09000016,5,0,1,30,2,4,5,0,0,0,1,2,2,0,0,1,1,E01002358,2025-12-09 20:01:00,20,,,
200801KD75394,551400,188710,0.183522,51.576873,1,3,1,1,17/10/2008,6,12:00,15,E09000016,5,0,2,30,0,-1,-1,0,2,0,1,1,1,0,0,1,2,E01002357,2025-12-09 12:00:00,12,,,
200801KD75396,557060,186680,0.264231,51.557087,1,3,2,2,18/10/2008,7,19:55,15,E09000016,4,187,6,30,0,-1,-1,0,0,1,4,1,1,0,0,1,1,E01002387,2025-12-09 19:55:00,19,,,
200801KD75397,554700,190150,0.231742,51.588916,1,3,2,1,13/10/2008,2,09:05,15,E09000016,5,0,3,30,0,-1,-1,0,0,0,1,9,1,0,0,1,2,E01002295,2025-12-09 09:05:00,9,,,
200801KD75398,551270,188060,0.181368,51.571068,1,3,1,1,08/10/2008,4,01:28,15,E09000016,3,125,3,30,1,4,3,125,0,4,4,1,1,0,0,1,1,E01002350,2025-12-09 01:28:00,1,2008-08-10,Sunday,8.0
200801KD75399,556090,186860,0.25033,51.558974,1,3,2,1,09/10/2008,5,04:55,15,E09000016,5,0,6,30,3,4,6,0,0,0,4,1,1,0,0,1,1,E01002257,2025-12-09 04:55:00,4,2008-09-10,Wednesday,9.0
200801KD75406,558470,188560,0.2854,51.573584,1,3,2,1,29/10/2008,4,08:08,15,E09000016,1,25,7,70,5,2,3,127,0,0,1,1,2,0,0,2,1,E01002259,2025-12-09 08:08:00,8,,,
200801KD75420,552500,189790,0.199853,51.586281,1,3,2,1,13/10/2008,2,11:40,15,E09000016,5,0,6,30,0,-1,-1,0,0,0,1,1,1,0,0,1,2,E01002379,2025-12-09 11:40:00,11,,,
200801KD75428,558820,187410,0.289927,51.563153,1,2,1,3,26/10/2008,1,22:09,15,E09000016,1,25,3,70,0,-1,-1,0,0,0,4,1,1,0,0,2,1,E01002391,2025-12-09 22:09:00,22,,,
200801KD75450,551120,190610,0.180302,51.59402,1,3,2,1,21/10/2008,3,17:20,15,E09000016,5,0,6,30,3,4,6,0,0,0,1,1,1,0,0,1,1,E01002336,2025-12-09 17:20:00,17,,,
200801KD75466,553950,189400,0.220596,51.582383,1,3,2,1,31/10/2008,6,13:35,15,E09000016,5,0,6,30,3,4,6,0,0,0,1,1,1,0,0,1,1,E01002377,2025-12-09 13:35:00,13,,,
200801KD75481,553480,187200,0.212857,51.562744,1,3,2,1,01/10/2008,4,09:02,15,E09000016,5,0,6,30,3,2,3,124,0,5,1,1,1,0,0,1,1,E01002361,2025-12-09 09:02:00,9,2008-01-10,Thursday,1.0
200801KD75485,558610,188080,0.287202,51.569232,1,3,4,3,24/10/2008,6,20:06,15,E09000016,1,25,3,70,0,-1,-1,0,0,0,4,1,1,0,0,2,1,E01002252,2025-12-09 20:06:00,20,,,
200801KD75497,553680,188400,0.216264,51.573471,1,2,2,1,14/10/2008,3,09:10,15,E09000016,5,0,6,30,3,4,6,0,0,0,1,9,1,0,0,1,1,E01002274,2025-12-09 09:10:00,9,,,
200801KD75504,552140,185910,0.192982,51.551516,1,3,2,1,28/10/2008,3,19:55,15,E09000016,6,0,6,30,3,4,6,0,0,0,4,1,1,0,0,1,1,E01002261,2025-12-09 19:55:00,19,,,
200801KD75546,554630,186840,0.229276,51.559196,1,3,2,1,24/10/2008,6,12:35,15,E09000016,5,0,9,30,0,-1,-1,0,0,0,1,1,1,0,0,1,2,E01002360,2025-12-09 12:35:00,12,,,
200801KD75581,551790,187290,0.188533,51.56401,1,3,2,2,26/10/2008,1,13:45,15,E09000016,3,125,6,30,0,-1,-1,0,0,0,1,1,1,0,0,1,2,E01002319,2025-12-09 13:45:00,13,,,
200801KD75590,549950,189100,0.162779,51.580765,1,3,2,1,25/10/2008,7,18:30,15,E09000016,3,12,3,40,0,-1,-1,0,0,0,4,1,1,0,0,1,1,E01002244,2025-12-09 18:30:00,18,,,
200801KD75602,553780,194190,0.220243,51.625466,1,3,1,1,29/10/2008,4,07:35,15,E09000016,5,0,9,30,3,4,6,0,0,0,7,1,1,0,0,2,1,E01002276,2025-12-09 07:35:00,7,,,
200801KD75604,550660,189580,0.173224,51.584888,1,3,4,1,05/10/2008,1,06:31,15,E09000016,3,125,6,30,0,-1,-1,0,0,0,4,2,2,0,0,1,1,E01002245,2025-12-09 06:31:00,6,2008-05-10,Saturday,5.0
200801KD75607,551460,188130,0.184138,51.571646,1,3,2,1,15/10/2008,4,06:33,15,E09000016,5,0,3,30,7,2,5,0,0,0,4,1,1,0,0,1,1,E01002350,2025-12-09 06:33:00,6,,,
200801KD75609,552600,185620,0.199486,51.548787,1,3,2,1,11/10/2008,7,15:15,15,E09000016,6,0,6,30,0,-1,-1,0,0,0,1,1,1,0,0,1,2,E01002261,2025-12-09 15:15:00,15,2008-11-10,Monday,11.0
200801KD75613,557780,188140,0.275263,51.570004,1,3,2,2,06/10/2008,2,13:53,15,E09000016,6,0,6,30,3,4,6,0,0,0,1,1,1,0,0,1,1,E01002252,2025-12-09 13:53:00,13,2008-06-10,Tuesday,6.0
200801KD75614,550080,191760,0.165791,51.604631,1,3,4,1,14/10/2008,3,23:25,15,E09000016,6,0,6,30,0,-1,-1,0,0,0,4,1,1,0,0,1,1,E01002301,2025-12-09 23:25:00,23,,,
200801KD75619,551980,183390,0.189589,51.528917,1,3,2,1,10/10/2008,6,12:10,15,E09000016,3,125,6,30,3,4,5,0,0,0,1,1,1,0,0,1,1,E01002371,2025-12-09 12:10:00,12,2008-10-10,Friday,10.0
200801KD75650,553200,182500,0.206776,51.520591,1,3,2,1,29/10/2008,4,14:30,15,E09000016,5,0,6,30,0,-1,-1,0,0,0,1,1,1,0,0,1,2,E01002344,2025-12-09 14:30:00,14,,,
200801KD75657,551020,187980,0.177729,51.570416,1,3,2,1,17/10/2008,6,13:00,15,E09000016,5,0,6,30,0,-1,-1,0,0,0,1,1,1,0,0,1,2,E01002249,2025-12-09 13:00:00,13,,,
200801KD75667,553870,187450,0.218588,51.564884,1,3,2,2,20/10/2008,2,21:33,15,E09000016,6,0,6,30,0,-1,-1,0,0,0,4,2,2,0,0,1,1,E01002361,2025-12-09 21:33:00,21,,,
200801KD75709,552120,182810,0.191355,51.523668,1,3,2,1,09/10/2008,5,08:33,15,E09000016,6,0,6,30,0,-1,-1,0,0,0,1,1,1,0,0,1,1,E01002370,2025-12-09 08:33:00,8,2008-09-10,Wednesday,9.0
200801KD75711,554310,181530,0.222338,51.511574,1,2,3,1,06/10/2008,2,15:20,15,E09000016,3,1306,6,40,7,4,5,0,0,0,1,1,1,0,0,2,1,E01002344,2025-12-09 15:20:00,15,2008-06-10,Tuesday,6.0
200801KD75713,553380,190500,0.212856,51.592421,1,3,2,1,22/10/2008,4,09:15,15,E09000016,3,127,1,40,1,4,3,118,0,0,1,9,1,0,0,1,2,E01002383,2025-12-09 09:15:00,9,,,
200801KD75722,552940,192390,0.207332,51.609522,1,3,2,1,02/11/2008,1,14:00,15,E09000016,5,0,6,30,6,2,5,0,0,5,1,1,1,0,0,2,1,E01002313,2025-12-09 14:00:00,14,2008-02-11,Monday,2.0
200801KD75730,550080,189260,0.164722,51.582168,1,3,2,4,04/11/2008,3,21:36,15,E09000016,5,0,6,30,3,2,6,0,0,5,4,1,1,0,0,1,1,E01002329,2025-12-09 21:36:00,21,2008-04-11,Friday,4.0
200801KD75733,552420,185250,0.196732,51.545511,1,3,1,1,05/11/2008,4,15:16,15,E09000016,6,0,1,30,1,4,6,0,0,0,1,2,2,0,7,1,1,E01002262,2025-12-09 15:16:00,15,2008-05-11,Sunday,5.0
200801KD75734,549820,191110,0.161762,51.598859,1,3,2,1,04/11/2008,3,18:29,15,E09000016,4,174,6,30,9,2,6,0,0,4,4,1,1,0,0,1,1,E01002326,2025-12-09 18:29:00,18,2008-04-11,Friday,4.0
200801KD75738,554870,183040,0.231065,51.524988,1,3,2,1,05/11/2008,4,11:41,15,E09000016,5,0,6,60,3,4,6,0,0,0,1,1,2,0,0,2,1,E01002385,2025-12-09 11:41:00,11,2008-05-11,Sunday,5.0
200801KD75740,550190,188370,0.165928,51.574142,1,3,4,1,08/11/2008,7,02:48,15,E09000016,3,118,6,30,3,4,6,0,0,0,4,1,1,0,0,1,1,,2025-12-09 02:48:00,2,2008-08-11,Monday,8.0
200801KD75746,556190,189490,0.252939,51.582575,1,3,2,1,10/11/2008,2,12:40,15,E09000016,5,0,6,40,0,-1,-1,0,0,0,1,1,1,0,0,2,2,E01002296,2025-12-09 12:40:00,12,2008-10-11,Saturday,10.0
200801KD75751,553960,186270,0.219369,51.554258,1,3,2,1,13/11/2008,5,13:50,15,E09000016,3,124,6,30,0,-1,-1,0,0,4,1,1,1,4,0,1,2,E01002291,2025-12-09 13:50:00,13,,,
200801KD75752,553680,187420,0.215836,51.564666,1,3,2,1,12/11/2008,4,09:00,15,E09000016,6,0,6,30,0,-1,-1,0,0,0,1,1,1,0,0,1,2,E01002367,2025-12-09 09:00:00,9,2008-12-11,Thursday,12.0
200801KD75757,552030,183340,0.190288,51.528455,1,3,2,1,19/11/2008,4,21:00,15,E09000016,3,125,6,30,3,4,6,0,0,0,4,1,1,0,0,1,2,E01002374,2025-12-09 21:00:00,21,,,
200801KD75759,551120,182800,0.176948,51.523847,1,3,1,1,01/11/2008,7,14:00,15,E09000016,3,1306,3,30,3,4,6,0,0,0,1,8,2,0,0,1,1,E01002368,2025-12-09 14:00:00,14,2008-01-11,Friday,1.0
200801KD75760,553380,190550,0.212877,51.59287,1,3,2,1,06/11/2008,5,18:50,15,E09000016,3,127,1,30,1,4,3,12,0,0,4,2,2,0,0,1,2,E01002310,2025-12-09 18:50:00,18,2008-06-11,Wednesday,6.0
200801KD75762,551420,182700,0.181226,51.522868,1,3,2,1,13/11/2008,5,19:07,15,E09000016,3,1306,3,30,6,2,6,0,0,4,4,1,2,0,0,1,1,E01002370,2025-12-09 19:07:00,19,,,
200801KD75769,550640,189340,0.172833,51.582737,1,2,1,1,13/11/2008,5,19:38,15,E09000016,6,0,6,30,0,-1,-1,0,0,0,4,1,1,0,0,1,1,E01002243,2025-12-09 19:38:00,19,,,
200801KD75771,554320,180290,0.22194,51.50043,1,3,2,1,18/11/2008,3,11:12,15,E09000016,3,13,3,70,0,-1,-1,0,0,0,1,1,2,4,2,2,1,E01002344,2025-12-09 11:12:00,11,,,
200801KD75775,549850,190290,0.161845,51.591484,1,2,1,1,10/11/2008,2,11:25,15,E09000016,6,0,6,30,6,4,6,0,0,0,1,2,2,0,0,1,1,E01002327,2025-12-09 11:25:00,11,2008-10-11,Saturday,10.0
200801KD75784,553780,188410,0.217711,51.573534,1,3,2,1,13/11/2008,5,05:58,15,E09000016,5,0,1,30,1,4,5,0,0,0,4,1,1,0,0,1,1,E01002274,2025-12-09 05:58:00,5,,,
200801KD75789,554160,189900,0.223844,51.586818,1,3,2,1,21/11/2008,6,08:50,15,E09000016,3,127,3,30,5,2,5,0,0,0,1,1,1,0,0,1,2,E01002377,2025-12-09 08:50:00,8,,,
200801KD75790,554690,186490,0.229987,51.556035,1,3,2,2,04/11/2008,3,14:41,15,E09000016,5,0,6,30,0,-1,-1,0,0,0,1,1,2,0,0,2,1,E01002289,2025-12-09 14:41:00,14,2008-04-11,Friday,4.0
200801KD75791,552660,184540,0.199883,51.539067,1,3,2,2,03/11/2008,2,21:36,15,E09000016,6,0,6,30,0,-1,-1,0,0,0,4,1,2,0,0,1,1,E01002267,2025-12-09 21:36:00,21,2008-03-11,Tuesday,3.0
200801KD75794,551030,189020,0.17832,51.579758,1,3,2,2,01/11/2008,7,11:55,15,E09000016,6,0,1,30,1,4,3,118,0,0,1,1,1,0,0,1,2,E01002353,2025-12-09 11:55:00,11,2008-01-11,Friday,1.0
200801KD75807,552120,187410,0.193342,51.564999,1,3,2,1,06/11/2008,5,20:20,15,E09000016,3,124,6,30,3,2,6,0,0,0,4,2,2,0,0,1,2,E01002319,2025-12-09 20:20:00,20,2008-06-11,Wednesday,6.0
200801KD75821,552030,185210,0.191095,51.545256,1,3,2,1,17/11/2008,2,17:40,15,E09000016,6,0,6,30,3,4,3,125,0,0,4,1,2,0,0,1,1,E01002262,2025-12-09 17:40:00,17,,,
200801KD75849,552550,185870,0.198874,51.551046,1,3,2,1,05/11/2008,4,10:10,15,E09000016,5,0,6,30,1,4,5,0,0,0,1,1,2,0,0,1,1,E01002365,2025-12-09 10:10:00,10,2008-05-11,Sunday,5.0
200801KD75851,551760,187440,0.188166,51.565366,1,3,1,1,24/11/2008,2,00:28,15,E09000016,3,124,6,30,3,4,3,125,0,4,4,1,2,0,0,1,1,E01002319,2025-12-09 00:28:00,0,,,
200801KD75854,553030,182460,0.20431,51.520278,1,3,2,2,18/11/2008,3,18:44,15,E09000016,5,0,6,30,3,4,6,0,0,0,4,4,1,0,0,1,1,E01002342,2025-12-09 18:44:00,18,,,
200801KD75855,550570,188900,0.171635,51.578803,1,3,2,2,10/11/2008,2,18:50,15,E09000016,5,0,6,30,3,4,6,0,0,1,4,2,2,0,0,1,2,E01002243,2025-12-09 18:50:00,18,2008-10-11,Saturday,10.0
200801KD75860,556700,192330,0.261562,51.60795,1,3,2,1,24/11/2008,2,14:29,15,E09000016,1,25,1,30,7,4,3,12,0,0,1,1,1,0,0,2,1,E01002296,2025-12-09 14:29:00,14,,,
200801KD75876,553780,188410,0.217711,51.573534,1,3,2,1,14/11/2008,6,08:14,15,E09000016,5,0,1,30,1,4,5,0,0,0,1,8,2,0,0,1,1,E01002274,2025-12-09 08:14:00,8,,,
200801KD75880,553170,186410,0.208044,51.55573,1,3,2,2,26/11/2008,4,14:00,15,E09000016,5,0,6,30,3,4,5,0,0,0,1,1,1,0,0,1,1,E01002363,2025-12-09 14:00:00,14,,,
200801KD75893,552950,187370,0.205291,51.564415,1,3,2,1,28/11/2008,6,08:57,15,E09000016,3,124,6,30,0,-1,-1,0,0,0,1,2,2,0,0,1,1,E01002321,2025-12-09 08:57:00,8,,,
200801KD75896,557440,188080,0.270334,51.56956,1,3,1,1,18/11/2008,3,16:16,15,E09000016,6,0,6,30,0,-1,-1,0,0,0,1,1,1,0,0,1,2,E01002258,2025-12-09 16:16:00,16,,,
200801KD75897,554310,183320,0.223121,51.527657,1,3,2,1,17/11/2008,2,17:09,15,E09000016,5,0,6,40,0,-1,-1,0,0,0,7,1,1,0,0,2,1,E01002348,2025-12-09 17:09:00,17,,,
200801KD75899,557250,188880,0.267953,51.5768,1,3,2,1,26/11/2008,4,18:20,15,E09000016,3,127,3,70,0,-1,-1,0,0,0,7,1,1,0,0,2,2,E01002259,2025-12-09 18:20:00,18,,,
200801KD75907,559660,187110,0.3019,51.560221,1,3,3,2,14/11/2008,6,15:05,15,E09000016,4,186,6,50,9,4,4,186,0,0,1,1,1,0,0,2,1,E01002391,2025-12-09 15:05:00,15,,,
200801KD75914,554630,186940,0.22932,51.560094,1,3,1,1,03/11/2008,2,16:25,15,E09000016,3,124,6,30,0,-1,-1,0,0,5,4,2,2,0,0,1,1,E01002360,2025-12-09 16:25:00,16,2008-03-11,Tuesday,3.0
200801KD75924,549850,189040,0.161311,51.580252,1,3,2,1,13/11/2008,5,17:45,15,E09000016,3,12,3,50,0,-1,-1,0,0,0,4,2,1,0,0,1,1,E01002244,2025-12-09 17:45:00,17,,,
200801KD75952,553960,190090,0.221042,51.588579,1,3,2,2,26/11/2008,4,16:45,15,E09000016,6,0,2,30,5,4,3,127,0,0,1,1,1,0,0,1,2,E01002295,2025-12-09 16:45:00,16,,,
200801KD75961,552180,184760,0.193062,51.541173,1,3,1,1,11/11/2008,3,16:45,15,E09000016,6,0,6,30,3,4,6,0,0,0,4,1,1,0,0,1,1,E01002266,2025-12-09 16:45:00,16,2008-11-11,Tuesday,11.0
200801KD75981,551130,190610,0.180446,51.594017,1,3,2,1,17/11/2008,2,11:10,15,E09000016,5,0,6,30,3,4,6,0,0,0,1,1,1,0,0,1,2,E01002336,2025-12-09 11:10:00,11,,,
200801KD76003,549220,191140,0.153118,51.599288,1,3,2,1,04/11/2008,3,19:11,15,E09000016,6,0,6,30,0,-1,-1,0,0,0,4,1,2,0,0,1,1,E01002331,2025-12-09 19:11:00,19,2008-04-11,Friday,4.0
200801KD76006,553670,187220,0.215605,51.562872,1,3,2,1,21/11/2008,6,12:30,15,E09000016,3,124,6,30,3,4,6,0,0,0,1,9,1,0,0,1,2,E01002361,2025-12-09 12:30:00,12,,,
200801KD76013,551530,189160,0.185591,51.580882,1,3,2,1,12/11/2008,4,16:47,15,E09000016,3,118,6,30,0,-1,-1,0,0,1,4,1,1,0,0,1,1,E01002357,2025-12-09 16:47:00,16,2008-12-11,Thursday,12.0
200801KD76014,560190,185210,0.308674,51.543001,1,3,3,3,26/11/2008,4,16:00,15,E09000016,5,0,6,60,0,-1,-1,0,0,0,1,1,2,3,0,2,1,E01002391,2025-12-09 16:00:00,16,,,
200801KD76040,554320,188900,0.225712,51.577789,1,3,2,2,19/11/2008,4,08:40,15,E09000016,6,0,6,30,0,-1,-1,0,0,0,1,1,1,0,0,1,1,E01002270,2025-12-09 08:40:00,8,,,
200801KD76049,558590,188130,0.286937,51.569687,1,3,3,2,26/11/2008,4,20:22,15,E09000016,1,25,3,70,5,4,6,0,0,0,4,8,2,0,0,2,1,E01002252,2025-12-09 20:22:00,20,,,
200801KD76054,550320,187790,0.167555,51.568896,1,3,2,1,20/11/2008,5,11:15,15,E09000016,6,0,6,30,0,-1,-1,0,0,0,1,1,1,0,0,1,2,E01002248,2025-12-09 11:15:00,11,,,
200801KD76073,553510,190000,0.214512,51.587893,1,3,2,1,27/11/2008,5,09:06,15,E09000016,6,0,6,30,6,4,6,0,0,0,1,1,1,0,0,1,1,E01002377,2025-12-09 09:06:00,9,,,
200801KD76080,558530,188180,0.286094,51.570153,1,3,2,1,03/11/2008,2,15:00,15,E09000016,1,25,7,70,5,4,6,0,0,0,7,1,2,0,0,2,2,E01002252,2025-12-09 15:00:00,15,2008-03-11,Tuesday,3.0
200801KD76081,558400,188470,0.28435,51.572795,1,2,2,1,24/11/2008,2,13:58,15,E09000016,1,25,3,70,0,-1,-1,0,0,0,1,1,1,0,0,2,1,E01002252,2025-12-09 13:58:00,13,,,
200801KD76090,557390,188510,0.269806,51.573437,1,3,2,3,03/11/2008,2,16:03,15,E09000016,5,0,6,40,8,4,6,0,0,0,1,2,2,0,0,1,1,E01002259,2025-12-09 16:03:00,16,2008-03-11,Tuesday,3.0
200801KD76097,557470,188320,0.270874,51.571708,1,3,1,1,18/11/2008,3,15:30,15,E09000016,6,0,6,30,0,-1,-1,0,0,0,1,1,1,0,0,1,2,E01002259,2025-12-09 15:30:00,15,,,
200801KD76126,558340,188460,0.283481,51.572722,1,3,2,1,10/11/2008,2,05:40,15,E09000016,3,127,3,70,5,4,1,25,0,0,4,1,1,0,0,2,1,E01002252,2025-12-09 05:40:00,5,2008-10-11,Saturday,10.0
200801KD76144,551800,187200,0.188639,51.563199,1,3,1,4,29/11/2008,7,06:55,15,E09000016,3,125,6,30,0,-1,-1,0,0,0,4,1,2,0,0,1,1,E01002319,2025-12-09 06:55:00,6,,,
200801KD76161,554630,186820,0.229268,51.559016,1,3,2,3,15/11/2008,7,18:25,15,E09000016,5,0,6,30,0,-1,-1,0,0,0,4,1,1,0,0,1,1,E01002362,2025-12-09 18:25:00,18,,,
200801KD76173,550950,191690,0.178314,51.603769,1,3,2,1,05/11/2008,4,14:50,15,E09000016,4,1459,6,30,0,-1,-1,0,0,0,1,1,1,0,0,1,2,E01002303,2025-12-09 14:50:00,14,2008-05-11,Sunday,5.0
200801KD76216,550830,187890,0.174951,51.569658,1,3,1,1,21/11/2008,6,17:00,15,E09000016,5,0,1,30,1,4,5,0,0,8,4,2,2,0,0,1,1,E01002249,2025-12-09 17:00:00,17,,,
200801KD76220,553130,189260,0.208709,51.581348,1,3,2,1,17/11/2008,2,21:35,15,E09000016,5,0,1,30,1,4,5,0,0,0,4,2,2,0,0,1,1,E01002379,2025-12-09 21:35:00,21,,,
200801KD76239,552880,188740,0.204877,51.576744,1,3,1,1,13/11/2008,5,15:20,15,E09000016,6,0,6,30,0,-1,-1,0,0,0,1,1,1,0,0,1,2,E01002382,2025-12-09 15:20:00,15,,,
200801KD76240,553490,182610,0.211001,51.521501,1,3,2,2,03/11/2008,2,12:00,15,E09000016,5,0,6,30,0,-1,-1,0,0,0,1,1,1,0,0,1,2,E01002343,2025-12-09 12:00:00,12,2008-03-11,Tuesday,3.0
200801KD76274,551740,189340,0.188697,51.582442,1,2,1,1,22/11/2008,7,00:11,15,E09000016,3,118,6,30,3,4,6,0,0,4,4,1,1,0,0,1,1,E01002354,2025-12-09 00:11:00,0,,,
200801KD76284,550030,190640,0.164591,51.594581,1,3,1,1,05/12/2008,6,10:10,15,E09000016,4,174,6,30,0,-1,-1,0,0,0,1,1,1,0,0,1,2,E01002327,2025-12-09 10:10:00,10,2008-05-12,Monday,5.0
200801KD76287,554150,186040,0.222007,51.552139,1,3,2,2,01/12/2008,2,14:20,15,E09000016,6,0,6,30,6,4,6,0,0,0,1,1,1,0,0,1,1,E01002290,2025-12-09 14:20:00,14,2008-01-12,Saturday,1.0
200801KD76314,555910,186160,0.247425,51.552734,1,3,2,1,10/12/2008,4,20:10,15,E09000016,4,1421,6,30,3,4,6,0,0,0,4,1,4,0,0,1,1,E01002386,2025-12-09 20:10:00,20,2008-10-12,Sunday,10.0
200801KD76319,550630,189760,0.172869,51.586514,1,3,2,3,10/12/2008,4,20:15,15,E09000016,3,12,3,30,6,2,4,174,0,0,4,2,2,0,0,1,1,,2025-12-09 20:15:00,20,2008-10-12,Sunday,10.0
200801KD76325,551950,188200,0.191233,51.572143,1,3,1,1,17/12/2008,4,20:36,15,E09000016,5,0,6,30,2,4,5,0,0,0,4,1,1,0,0,1,1,E01002358,2025-12-09 20:36:00,20,,,
200801KD76333,558380,188380,0.284022,51.571992,1,3,2,1,09/12/2008,3,12:59,15,E09000016,1,25,3,70,5,4,3,127,0,0,1,1,1,0,0,2,1,E01002252,2025-12-09 12:59:00,12,2008-09-12,Friday,9.0
200801KD76336,553400,190560,0.21317,51.592955,1,3,2,1,13/12/2008,7,16:45,15,E09000016,3,12,3,50,1,2,5,0,0,0,4,2,2,0,0,1,2,E01002310,2025-12-09 16:45:00,16,,,
200801KD76353,551230,188050,0.180787,51.570989,1,3,2,2,01/12/2008,2,17:58,15,E09000016,6,0,1,30,1,4,6,0,0,0,4,1,1,4,0,1,1,E01002249,2025-12-09 17:58:00,17,2008-01-12,Saturday,1.0
200801KD76358,553860,187010,0.218252,51.560934,1,3,1,1,04/12/2008,5,12:00,15,E09000016,6,0,6,30,0,-1,-1,0,0,0,1,1,1,0,0,1,1,E01002361,2025-12-09 12:00:00,12,2008-04-12,Saturday,4.0
200801KD76370,553580,192100,0.216441,51.606742,1,3,2,1,23/12/2008,3,12:45,15,E09000016,5,0,6,30,9,4,6,0,0,0,1,1,1,0,0,1,1,E01002284,2025-12-09 12:45:00,12,,,
200801KD76374,555900,184250,0.246435,51.535576,1,2,2,2,05/12/2008,6,07:12,15,E09000016,5,0,6,60,0,-1,-1,0,0,0,6,1,2,0,0,2,1,E01002385,2025-12-09 07:12:00,7,2008-05-12,Monday,5.0
200801KD76405,551460,188160,0.184151,51.571915,1,3,2,1,29/12/2008,2,15:30,15,E09000016,5,0,6,30,7,2,5,0,0,4,1,1,1,0,0,1,2,E01002350,2025-12-09 15:30:00,15,,,
200801KD76406,553960,190080,0.221038,51.58849,1,3,2,2,20/12/2008,7,15:30,15,E09000016,3,127,7,30,5,3,6,0,0,0,1,1,1,0,0,1,2,E01002295,2025-12-09 15:30:00,15,,,
200801KD76409,551310,188560,0.18216,51.57555,1,3,2,1,03/12/2008,4,14:30,15,E09000016,6,0,6,30,8,4,6,0,0,0,1,1,1,0,0,1,1,E01002356,2025-12-09 14:30:00,14,2008-03-12,Wednesday,3.0
200801KD76412,552080,182580,0.19068,51.521612,1,3,2,1,05/12/2008,6,09:25,15,E09000016,3,1306,1,30,1,4,3,125,0,0,1,2,2,0,0,2,1,E01002370,2025-12-09 09:25:00,9,2008-05-12,Monday,5.0
200801KD76430,554420,188060,0.226785,51.570215,1,3,2,1,03/12/2008,4,17:16,15,E09000016,6,0,6,30,0,-1,-1,0,0,0,4,1,2,0,0,1,1,E01002270,2025-12-09 17:16:00,17,2008-03-12,Wednesday,3.0
200801KD76431,552940,185640,0.204395,51.548874,1,3,2,2,30/12/2008,3,21:55,15,E09000016,5,0,6,30,3,4,6,0,0,0,4,8,4,0,0,1,1,E01002287,2025-12-09 21:55:00,21,,,
200801KD76432,550620,189710,0.172703,51.586067,1,2,2,1,08/12/2008,2,14:26,15,E09000016,3,125,7,30,5,4,3,12,0,0,1,1,1,0,0,1,1,E01002245,2025-12-09 14:26:00,14,2008-08-12,Tuesday,8.0
200801KD76434,550810,191650,0.176277,51.603447,1,2,1,1,13/12/2008,7,17:20,15,E09000016,4,1459,6,30,0,-1,-1,0,0,1,4,2,2,0,0,1,1,E01002304,2025-12-09 17:20:00,17,,,
200801KD76437,555100,185010,0.235245,51.542625,1,2,2,4,24/12/2008,4,03:08,15,E09000016,5,0,6,60,0,-1,-1,0,0,0,6,1,1,0,0,2,1,E01002385,2025-12-09 03:08:00,3,,,
200801KD76464,555720,191750,0.247164,51.603011,1,3,2,1,19/12/2008,6,23:20,15,E09000016,3,12,3,30,7,2,5,0,0,0,4,1,1,0,0,1,1,E01002296,2025-12-09 23:20:00,23,,,
200801KD76466,555900,185850,0.247144,51.549952,1,3,2,2,22/12/2008,2,20:52,15,E09000016,4,1421,1,30,1,4,6,0,0,0,4,1,1,0,0,1,1,E01002390,2025-12-09 20:52:00,20,,,
200801KD76474,553090,191870,0.20927,51.604809,1,3,2,1,01/12/2008,2,15:56,15,E09000016,5,0,6,30,3,4,5,0,0,0,7,1,1,0,0,1,1,E01002311,2025-12-09 15:56:00,15,2008-01-12,Saturday,1.0
200801KD76494,552100,187420,0.193058,51.565094,1,3,2,1,26/12/2008,6,14:30,15,E09000016,3,124,6,30,9,2,6,0,0,5,1,1,1,0,0,1,1,E01002319,2025-12-09 14:30:00,14,,,
200801KD76504,549220,190960,0.153042,51.597671,1,3,2,1,04/12/2008,5,06:55,15,E09000016,4,174,1,30,2,4,5,0,0,0,4,2,2,0,0,1,1,E01002331,2025-12-09 06:55:00,6,2008-04-12,Saturday,4.0
200801KD76510,553870,185680,0.217814,51.548981,1,2,1,1,08/12/2008,2,16:44,15,E09000016,5,0,6,30,0,-1,-1,0,0,1,4,9,1,0,0,1,1,E01002285,2025-12-09 16:44:00,16,2008-08-12,Tuesday,8.0
200801KD76552,556290,193030,0.255958,51.614353,1,3,2,1,16/12/2008,3,17:12,15,E09000016,1,25,3,70,0,-1,-1,0,0,0,4,1,1,0,0,2,1,E01002277,2025-12-09 17:12:00,17,,,
200801KD76562,553870,187590,0.21865,51.566142,1,3,2,2,08/12/2008,2,11:28,15,E09000016,6,0,6,30,0,-1,-1,0,0,0,4,3,2,4,0,1,2,E01002367,2025-12-09 11:28:00,11,2008-08-12,Tuesday,8.0
200801KD76563,551370,188380,0.182948,51.573916,1,3,2,1,02/12/2008,3,09:40,15,E09000016,6,0,9,30,0,-1,-1,0,0,0,1,2,1,0,0,1,2,E01002356,2025-12-09 09:40:00,9,2008-02-12,Tuesday,2.0
200801KD76577,553060,181980,0.204534,51.515957,1,3,1,2,20/12/2008,7,11:10,15,E09000016,6,0,6,40,0,-1,-1,0,0,0,1,1,2,0,0,1,1,E01002344,2025-12-09 11:10:00,11,,,
200801KD76587,552330,185090,0.195366,51.544097,1,2,1,1,31/12/2008,4,10:45,15,E09000016,6,0,6,30,3,4,6,0,0,8,1,1,2,0,0,1,1,E01002266,2025-12-09 10:45:00,10,,,
200801KD76606,551220,193270,0.182891,51.617893,1,3,1,4,21/12/2008,1,06:25,15,E09000016,4,175,6,30,0,-1,-1,0,0,0,4,1,2,0,0,1,1,E01002304,2025-12-09 06:25:00,6,,,
200801KD76607,553810,188540,0.2182,51.574694,1,2,3,1,23/12/2008,3,20:00,15,E09000016,5,0,6,30,0,-1,-1,0,0,0,4,2,2,0,0,1,1,E01002274,2025-12-09 20:00:00,20,,,
200801KD76612,551690,188080,0.187432,51.571135,1,3,1,1,19/12/2008,6,14:50,15,E09000016,5,0,6,30,0,-1,-1,0,0,0,1,9,1,0,0,1,2,E01002350,2025-12-09 14:50:00,14,,,
200801KD76614,549770,187720,0.159595,51.568413,1,1,1,2,21/12/2008,1,01:08,15,E09000016,6,0,6,30,0,-1,-1,0,0,0,4,1,1,0,0,1,1,E01002250,2025-12-09 01:08:00,1,,,
200801KD76615,554880,187880,0.233338,51.568471,1,3,2,1,07/12/2008,1,20:00,15,E09000016,6,0,6,30,3,4,6,0,0,0,4,2,2,0,0,1,1,E01002273,2025-12-09 20:00:00,20,2008-07-12,Saturday,7.0
200801KD76619,551340,188660,0.182636,51.57644,1,2,1,1,29/12/2008,2,12:20,15,E09000016,5,0,3,30,0,-1,-1,0,0,4,1,1,1,0,0,1,1,E01002356,2025-12-09 12:20:00,12,,,
200801KD76625,552160,187660,0.194027,51.567235,1,2,2,1,24/12/2008,4,22:30,15,E09000016,6,0,6,30,3,4,6,0,0,0,4,1,1,0,0,1,1,E01002320,2025-12-09 22:30:00,22,,,
200801KD76632,552610,181300,0.19776,51.509969,1,3,2,3,21/12/2008,1,15:47,15,E09000016,3,13,3,70,0,-1,-1,0,0,0,4,1,1,0,0,2,1,E01002344,2025-12-09 15:47:00,15,,,
200801KD76639,554620,191140,0.231024,51.597833,1,3,2,1,28/12/2008,1,19:22,15,E09000016,3,12,3,50,0,-1,-1,0,0,0,4,1,2,0,0,1,1,E01002300,2025-12-09 19:22:00,19,,,
200801KD76641,551590,188790,0.186297,51.577541,1,3,1,1,29/12/2008,2,12:56,15,E09000016,5,0,3,30,0,-1,-1,0,0,0,1,1,1,0,0,1,2,E01002357,2025-12-09 12:56:00,12,,,
200801KD76644,551410,181670,0.180639,51.513616,1,2,2,4,21/12/2008,1,22:00,15,E09000016,3,13,3,70,0,-1,-1,0,0,0,4,1,1,0,0,2,1,E01002344,2025-12-09 22:00:00,22,,,
200801KD76645,553190,190560,0.210141,51.593012,1,3,2,1,06/12/2008,7,18:12,15,E09000016,3,12,3,50,0,-1,-1,0,0,0,4,1,1,0,0,2,1,E01002311,2025-12-09 18:12:00,18,2008-06-12,Thursday,6.0
200801KD76647,555920,185860,0.247436,51.550036,1,3,2,1,17/12/2008,4,21:40,15,E09000016,6,0,1,30,1,4,4,1421,0,8,4,1,1,0,0,1,1,E01002390,2025-12-09 21:40:00,21,,,
200801KD76652,551570,181550,0.182892,51.512495,1,3,3,1,05/12/2008,6,17:59,15,E09000016,3,13,3,70,0,-1,-1,0,0,0,4,1,2,0,0,2,1,E01002344,2025-12-09 17:59:00,17,2008-05-12,Monday,5.0
200801KD76654,555030,193980,0.238194,51.623236,1,3,2,2,03/12/2008,4,15:27,15,E09000016,1,25,9,70,0,-1,-1,0,0,0,1,9,1,0,0,2,1,E01002276,2025-12-09 15:27:00,15,2008-03-12,Wednesday,3.0
200801KD76662,551440,188400,0.183966,51.574077,1,3,2,1,21/12/2008,1,17:10,15,E09000016,5,0,1,30,1,4,5,0,0,1,4,1,1,0,0,1,1,E01002356,2025-12-09 17:10:00,17,,,
200801KD76663,554400,187010,0.226036,51.560786,1,3,2,1,20/12/2008,7,13:30,15,E09000016,3,124,6,30,0,-1,-1,0,0,0,1,1,1,0,0,1,2,E01002360,2025-12-09 13:30:00,13,,,
200801KD76672,557250,187080,0.267148,51.560628,1,3,1,3,13/12/2008,7,19:21,15,E09000016,6,0,6,30,0,-1,-1,0,0,0,4,2,2,0,0,1,1,E01002254,2025-12-09 19:21:00,19,,,
200801KD76679,553950,186240,0.219212,51.553991,1,3,1,1,12/12/2008,6,17:27,15,E09000016,5,0,6,30,0,-1,-1,0,0,1,4,2,2,0,0,1,1,E01002291,2025-12-09 17:27:00,17,2008-12-12,Friday,12.0
200801KD76680,553420,190520,0.213441,51.59259,1,3,2,1,30/12/2008,3,14:45,15,E09000016,3,118,1,30,1,4,3,127,0,0,1,1,1,0,0,1,2,E01002293,2025-12-09 14:45:00,14,,,
200801KD76683,553400,190610,0.213192,51.593404,1,2,1,1,08/12/2008,2,16:41,15,E09000016,5,0,6,30,0,-1,-1,0,0,0,4,1,2,0,0,1,1,E01002310,2025-12-09 16:41:00,16,2008-08-12,Tuesday,8.0
200801KD76684,557480,188760,0.271216,51.575658,1,3,2,1,11/12/2008,5,14:40,15,E09000016,3,127,3,70,6,4,5,0,0,0,1,1,1,0,0,2,2,E01002259,2025-12-09 14:40:00,14,2008-11-12,Wednesday,11.0
200801KD76687,558430,188620,0.284851,51.574134,1,3,3,4,09/07/2008,4,11:50,15,E09000016,1,25,7,70,5,2,3,127,0,0,1,2,2,0,0,2,1,E01002259,2025-12-09 11:50:00,11,2008-09-07,Sunday,9.0
200801KD76692,552020,181370,0.189294,51.510757,1,3,2,1,17/12/2008,4,07:29,15,E09000016,3,13,3,70,5,4,6,0,0,0,1,1,2,0,0,2,1,E01002344,2025-12-09 07:29:00,7,,,
200801KD76705,552610,181300,0.19776,51.509969,1,3,2,3,21/12/2008,1,15:47,15,E09000016,3,13,3,70,0,-1,-1,0,0,0,1,1,1,0,0,2,1,E01002344,2025-12-09 15:47:00,15,,,
200801KD76709,552540,189720,0.2004,51.585641,1,3,1,1,24/12/2008,4,14:59,15,E09000016,5,0,6,30,3,4,6,0,0,0,1,1,1,0,0,1,1,E01002379,2025-12-09 14:59:00,14,,,
200801KD76712,550940,187430,0.17634,51.565496,1,3,2,2,07/12/2008,1,17:28,15,E09000016,5,0,6,30,3,2,3,124,0,5,4,4,2,0,0,1,1,E01002248,2025-12-09 17:28:00,17,2008-07-12,Saturday,7.0
200801KD76717,551610,190080,0.187142,51.589126,1,3,2,1,08/12/2008,2,09:50,15,E09000016,6,0,6,30,0,-1,-1,0,0,0,1,8,4,0,0,1,1,E01002339,2025-12-09 09:50:00,9,2008-08-12,Tuesday,8.0
200801KD76732,555130,187190,0.236638,51.562203,1,3,2,1,17/12/2008,4,08:50,15,E09000016,6,0,6,30,0,-1,-1,0,0,0,1,1,1,0,0,1,2,E01002255,2025-12-09 08:50:00,8,,,
200801KD76733,550670,189570,0.173364,51.584796,1,3,2,1,29/12/2008,2,16:58,15,E09000016,3,125,3,30,3,4,6,0,0,0,4,4,4,0,0,1,1,E01002245,2025-12-09 16:58:00,16,,,
200801KF69949,554670,180620,0.227123,51.503299,1,2,2,1,16/02/2008,7,11:50,15,E09000016,3,1306,6,60,9,4,6,0,0,0,1,4,1,0,0,2,1,E01002344,2025-12-09 11:50:00,11,,,
200801KF76286,556480,187880,0.256405,51.56803,1,3,1,1,06/12/2008,7,15:49,15,E09000016,5,0,6,30,0,-1,-1,0,0,0,4,1,1,0,0,1,1,E01002253,2025-12-09 15:49:00,15,2008-06-12,Thursday,6.0
200801KG69198,551730,183670,0.186108,51.5315,1,3,2,1,24/01/2008,5,08:45,15,E09000016,3,125,3,30,1,4,6,0,0,0,1,9,1,0,0,1,2,E01002375,2025-12-09 08:45:00,8,,,
200801KG72106,550580,182950,0.169234,51.525339,1,3,3,1,17/04/2008,5,16:20,15,E09000016,3,1306,6,30,9,4,5,0,0,0,1,1,1,0,0,1,2,E01002368,2025-12-09 16:20:00,16,,,
200801KG75151,551850,183550,0.187785,51.53039,1,3,2,1,24/09/2008,4,12:30,15,E09000016,3,125,6,30,0,-1,-1,0,0,0,1,1,1,0,0,1,1,E01002373,2025-12-09 12:30:00,12,,,
200801KG75177,549390,189050,0.154682,51.580464,1,2,2,2,02/10/2008,5,09:45,15,E09000016,3,12,3,50,0,-1,-1,0,0,0,1,1,1,0,0,1,1,E01002250,2025-12-09 09:45:00,9,2008-02-10,Sunday,2.0
200801KG76256,550580,182350,0.168977,51.519947,1,3,2,1,18/11/2008,3,06:39,15,E09000016,3,13,3,70,0,-1,-1,0,0,0,4,2,2,0,0,1,1,E01002370,2025-12-09 06:39:00,6,,,
200801KG76352,552110,182590,0.191116,51.521694,1,2,1,1,30/12/2008,3,00:25,15,E09000016,3,1306,6,30,1,4,4,1335,0,4,4,9,4,0,0,2,1,E01002370,2025-12-09 00:25:00,0,,,
200901KD50002,551330,188530,0.182435,51.575275,1,3,1,1,17/01/2009,7,15:49,15,E09000016,6,0,6,30,3,4,6,0,0,0,1,1,1,0,0,1,1,E01002356,2025-12-09 15:49:00,15,,,
200901KD50005,552800,187180,0.203046,51.562749,1,3,1,1,01/02/2009,1,07:35,15,E09000016,6,0,6,30,3,4,6,0,0,0,1,1,1,0,0,1,1,E01002321,2025-12-09 07:35:00,7,2009-01-02,Friday,1.0
200901KD50006,549230,190950,0.153182,51.597578,1,3,2,2,26/01/2009,2,07:01,15,E09000016,4,174,1,30,2,4,5,0,0,0,4,1,1,0,0,1,1,E01002325,2025-12-09 07:01:00,7,,,
200901KD50007,553350,190540,0.21244,51.592789,1,3,2,1,29/01/2009,5,11:35,15,E09000016,3,12,1,30,1,4,5,0,0,0,1,1,1,0,0,1,1,E01002311,2025-12-09 11:35:00,11,,,
200901KD50009,557040,187680,0.264389,51.566077,1,3,1,1,31/01/2009,7,15:30,15,E09000016,6,0,6,30,3,4,6,0,0,0,1,1,1,0,0,1,1,E01002254,2025-12-09 15:30:00,15,,,
200901KD50011,553030,190840,0.207955,51.595571,1,3,3,3,01/02/2009,1,20:14,15,E09000016,6,0,6,30,0,-1,-1,0,0,0,4,3,3,0,0,1,1,E01002311,2025-12-09 20:14:00,20,2009-01-02,Friday,1.0
200901KD50012,551080,188370,0.178762,51.573904,1,3,1,1,01/02/2009,1,12:30,15,E09000016,3,125,3,30,3,2,6,0,0,5,1,1,1,0,0,1,1,E01002356,2025-12-09 12:30:00,12,2009-01-02,Friday,1.0
200901KD50013,551910,183310,0.188546,51.528217,1,3,1,1,29/01/2009,5,11:50,15,E09000016,6,0,6,30,0,-1,-1,0,0,0,1,1,1,0,0,1,1,E01002371,2025-12-09 11:50:00,11,,,
200901KD50014,552130,185110,0.192492,51.544331,1,3,2,1,30/01/2009,6,19:40,15,E09000016,6,0,6,30,3,4,6,0,0,0,4,1,1,0,0,1,1,E01002266,2025-12-09 19:40:00,19,,,
200901KD50015,552800,189290,0.203963,51.581707,1,3,2,1,07/02/2009,7,12:00,15,E09000016,5,0,6,30,3,4,6,0,0,0,1,1,2,0,0,1,2,E01002355,2025-12-09 12:00:00,12,2009-07-02,Thursday,7.0
200901KD50016,551910,188130,0.190626,51.571525,1,3,3,1,28/01/2009,4,09:50,15,E09000016,6,0,6,30,0,-1,-1,0,0,0,1,2,2,0,0,1,1,E01002351,2025-12-09 09:50:00,9,,,
200901KD50017,555500,191870,0.244043,51.604149,1,3,1,1,02/02/2009,2,11:30,15,E09000016,5,0,6,30,3,4,6,0,0,0,1,3,3,0,0,1,1,E01002277,2025-12-09 11:30:00,11,2009-02-02,Monday,2.0
200901KD50018,559160,185360,0.293901,51.54464,1,3,1,1,24/01/2009,7,06:00,15,E09000016,4,186,6,30,0,-1,-1,0,0,0,1,1,4,0,0,2,2,E01002385,2025-12-09 06:00:00,6,,,
200901KD50020,553470,188530,0.213293,51.574697,1,3,3,1,04/02/2009,4,07:25,15,E09000016,5,0,6,30,3,4,6,0,0,0,1,3,3,0,0,1,1,E01002274,2025-12-09 07:25:00,7,2009-04-02,Thursday,4.0
200901KD50021,551280,190250,0.182455,51.590742,1,3,2,1,22/01/2009,5,16:59,15,E09000016,5,0,6,30,3,4,6,0,0,0,4,1,2,0,0,1,1,E01002339,2025-12-09 16:59:00,16,,,
200901KD50022,554070,182780,0.219428,51.52287,1,3,2,1,07/02/2009,7,13:27,15,E09000016,6,0,6,30,8,4,6,0,0,0,1,1,1,0,0,1,1,E01002348,2025-12-09 13:27:00,13,2009-07-02,Thursday,7.0
200901KD50023,550640,189760,0.173013,51.586511,1,3,2,1,30/01/2009,6,07:00,15,E09000016,3,12,3,30,6,2,3,125,0,0,1,1,1,0,0,1,1,E01002340,2025-12-09 07:00:00,7,,,
200901KD50024,556440,192830,0.258033,51.612514,1,3,2,2,01/02/2009,1,19:15,15,E09000016,1,25,3,70,0,-1,-1,0,0,0,4,6,3,0,0,2,1,E01002277,2025-12-09 19:15:00,19,2009-01-02,Friday,1.0
200901KD50025,555510,191790,0.244151,51.603428,1,3,1,2,01/02/2009,1,21:30,15,E09000016,5,0,6,30,0,-1,-1,0,0,0,4,3,3,0,0,1,1,E01002283,2025-12-09 21:30:00,21,2009-01-02,Friday,1.0
200901KD50026,558080,189240,0.280083,51.579803,1,3,1,1,30/01/2009,6,20:15,15,E09000016,1,25,3,70,0,-1,-1,0,0,0,4,1,1,0,0,2,1,E01002259,2025-12-09 20:15:00,20,,,
200901KD50027,552300,187420,0.195942,51.56504,1,3,5,3,07/02/2009,7,11:29,15,E09000016,3,124,6,30,0,-1,-1,0,0,0,1,1,1,0,0,1,1,E01002319,2025-12-09 11:29:00,11,2009-07-02,Thursday,7.0
200901KD50028,555190,183900,0.236053,51.532627,1,3,2,1,05/02/2009,5,14:53,15,E09000016,6,0,6,30,8,4,6,0,0,0,1,2,3,0,0,2,1,E01002385,2025-12-09 14:53:00,14,2009-05-02,Saturday,5.0
200901KD50029,551600,187460,0.185867,51.565588,1,3,2,1,03/02/2009,3,09:05,15,E09000016,3,124,3,30,3,2,3,124,0,5,1,1,4,0,0,1,2,E01002249,2025-12-09 09:05:00,9,2009-03-02,Monday,3.0
200901KD50030,553930,187960,0.219677,51.56945,1,3,2,2,28/01/2009,4,17:07,15,E09000016,5,0,6,30,3,4,6,0,0,0,4,1,2,0,0,1,1,E01002274,2025-12-09 17:07:00,17,,,
200901KD50031,551800,187430,0.188738,51.565265,1,3,2,1,08/02/2009,1,10:45,15,E09000016,3,124,2,30,3,2,3,124,0,0,1,1,1,0,0,1,1,E01002319,2025-12-09 10:45:00,10,2009-08-02,Sunday,8.0
200901KD50032,557480,188380,0.271046,51.572244,1,3,2,1,06/02/2009,6,11:45,15,E09000016,6,0,6,30,3,4,6,0,0,0,1,1,4,0,0,1,1,E01002259,2025-12-09 11:45:00,11,2009-06-02,Tuesday,6.0
200901KD50033,554100,180330,0.21879,51.500849,1,3,3,2,01/02/2009,1,14:05,15,E09000016,3,13,3,70,0,-1,-1,0,0,0,1,1,1,0,0,2,1,E01002344,2025-12-09 14:05:00,14,2009-01-02,Friday,1.0
200901KD50034,558670,187850,0.287964,51.567149,1,3,1,1,03/01/2009,7,23:14,15,E09000016,1,25,3,70,0,-1,-1,0,0,0,4,1,2,0,0,2,1,E01002252,2025-12-09 23:14:00,23,2009-03-01,Sunday,3.0
200901KD50035,556160,193220,0.254166,51.616096,1,3,2,2,11/02/2009,4,08:36,15,E09000016,1,25,3,70,0,-1,-1,0,0,0,1,1,1,0,0,2,1,E01002277,2025-12-09 08:36:00,8,2009-11-02,Monday,11.0
200901KD50036,553350,190540,0.21244,51.592789,1,3,2,1,11/02/2009,4,05:00,15,E09000016,3,12,1,30,1,4,3,118,0,0,4,1,1,0,0,1,2,E01002311,2025-12-09 05:00:00,5,2009-11-02,Monday,11.0
200901KD50038,553760,187840,0.217173,51.568418,1,3,1,1,04/02/2009,4,19:16,15,E09000016,6,0,6,30,0,-1,-1,0,0,0,4,1,4,0,0,1,1,E01002367,2025-12-09 19:16:00,19,2009-04-02,Thursday,4.0
200901KD50039,551780,187400,0.188437,51.565001,1,3,2,4,14/02/2009,7,20:00,15,E09000016,3,124,2,30,3,2,3,124,0,0,4,1,1,0,0,1,1,E01002319,2025-12-09 20:00:00,20,,,
200901KD50040,551070,188370,0.178618,51.573907,1,2,1,1,16/01/2009,6,18:30,15,E09000016,3,125,6,30,3,2,6,0,0,0,4,1,1,0,0,1,2,E01002356,2025-12-09 18:30:00,18,,,
200901KD50041,553130,189260,0.208709,51.581348,1,3,2,2,15/02/2009,1,14:21,15,E09000016,5,0,1,30,2,4,5,0,0,0,1,1,1,0,0,1,1,E01002379,2025-12-09 14:21:00,14,,,
200901KD50043,551310,190460,0.182978,51.592621,1,3,2,1,05/02/2009,5,16:35,15,E09000016,3,12,3,50,0,-1,-1,0,0,0,4,1,2,0,0,1,2,E01002334,2025-12-09 16:35:00,16,2009-05-02,Saturday,5.0
200901KD50044,552680,187390,0.201407,51.564668,1,3,2,1,18/02/2009,4,08:15,15,E09000016,3,124,6,30,3,4,6,0,0,4,1,1,2,0,0,1,2,E01002321,2025-12-09 08:15:00,8,,,
200901KD50045,551740,187430,0.187873,51.565281,1,3,1,1,16/02/2009,2,13:30,15,E09000016,3,124,3,30,0,-1,-1,0,0,1,1,1,1,0,0,1,2,E01002319,2025-12-09 13:30:00,13,,,
200901KD50046,551400,187460,0.182984,51.565642,1,3,4,5,16/02/2009,2,09:24,15,E09000016,3,124,6,30,0,-1,-1,0,0,0,1,1,1,0,0,1,1,E01002249,2025-12-09 09:24:00,9,,,
200901KD50047,551090,192690,0.180765,51.612717,1,3,2,1,18/02/2009,4,14:00,15,E09000016,4,175,6,30,8,4,6,0,0,0,1,1,1,0,0,1,1,E01002304,2025-12-09 14:00:00,14,,,
200901KD50048,557960,188450,0.277998,51.572739,1,3,2,1,10/02/2009,3,16:30,15,E09000016,3,127,3,70,0,-1,-1,0,0,0,1,1,1,0,0,2,2,E01002252,2025-12-09 16:30:00,16,2009-10-02,Friday,10.0
200901KD50050,556460,192170,0.258027,51.606579,1,3,2,2,10/02/2009,3,16:21,15,E09000016,3,12,3,70,0,-1,-1,0,0,0,1,1,1,0,0,2,1,E01002296,2025-12-09 16:21:00,16,2009-10-02,Friday,10.0
200901KD50051,553940,189320,0.220416,51.581667,1,3,1,1,18/02/2009,4,16:00,15,E09000016,5,0,6,30,0,-1,-1,0,0,0,1,1,1,0,0,1,1,E01002377,2025-12-09 16:00:00,16,,,
200901KD50052,550540,182970,0.168666,51.525529,1,3,2,1,19/02/2009,5,15:45,15,E09000016,3,1306,3,30,3,4,6,0,0,0,1,1,1,0,0,1,1,E01002368,2025-12-09 15:45:00,15,,,
200901KD50055,551660,188510,0.187185,51.575006,1,3,1,1,19/02/2009,5,16:45,15,E09000016,5,0,6,30,6,2,5,0,0,5,4,1,1,0,0,1,1,E01002358,2025-12-09 16:45:00,16,,,
200901KD50057,550370,183020,0.166239,51.526023,1,3,2,1,19/02/2009,5,06:28,15,E09000016,3,1306,3,30,3,2,6,0,0,5,4,2,2,0,0,1,1,E01002368,2025-12-09 06:28:00,6,,,
200901KD50058,558360,188470,0.283774,51.572806,1,3,2,1,09/02/2009,2,07:45,15,E09000016,3,127,1,30,1,4,1,25,0,0,1,2,2,0,0,2,1,E01002252,2025-12-09 07:45:00,7,2009-09-02,Wednesday,9.0
200901KD50060,551230,190400,0.181798,51.592104,1,3,3,1,17/02/2009,3,10:06,15,E09000016,3,12,3,50,6,2,5,0,0,0,1,1,1,0,0,1,1,E01002334,2025-12-09 10:06:00,10,,,
200901KD50061,556650,186700,0.25833,51.557381,1,3,2,1,23/02/2009,2,19:24,15,E09000016,4,187,6,30,3,4,6,0,0,0,4,1,1,0,0,1,1,E01002384,2025-12-09 19:24:00,19,,,
200901KD50063,557920,188120,0.277273,51.569785,1,2,2,1,24/02/2009,3,16:45,15,E09000016,6,0,6,30,3,4,6,0,0,0,1,1,1,0,0,1,1,E01002252,2025-12-09 16:45:00,16,,,
200901KD50064,557860,189550,0.27705,51.582649,1,3,3,5,12/02/2009,5,10:20,15,E09000016,1,25,3,70,0,-1,-1,0,0,0,1,1,1,0,0,2,1,E01002259,2025-12-09 10:20:00,10,2009-12-02,Wednesday,12.0
200901KD50065,553330,190540,0.212152,51.592794,1,3,2,1,23/02/2009,2,18:15,15,E09000016,3,12,1,30,1,4,3,127,0,0,4,1,1,0,0,2,2,E01002311,2025-12-09 18:15:00,18,,,
200901KD50067,553270,189720,0.210928,51.585443,1,3,2,1,26/02/2009,5,13:00,15,E09000016,6,0,6,30,3,4,6,0,0,0,1,1,1,0,0,1,1,E01002383,2025-12-09 13:00:00,13,,,
200901KD50068,551060,192550,0.180272,51.611467,1,3,2,1,20/02/2009,6,19:17,15,E09000016,4,175,6,30,0,-1,-1,0,0,0,4,1,1,0,0,1,1,E01002304,2025-12-09 19:17:00,19,,,
200901KD50069,554010,187130,0.220466,51.561971,1,3,1,1,24/02/2009,3,23:00,15,E09000016,3,124,6,30,0,-1,-1,0,0,4,4,1,1,0,0,1,1,E01002361,2025-12-09 23:00:00,23,,,
200901KD50070,554680,180600,0.227258,51.503117,1,3,2,1,08/02/2009,1,19:35,15,E09000016,6,0,3,30,2,4,3,1306,0,0,4,1,1,0,0,2,2,E01002344,2025-12-09 19:35:00,19,2009-08-02,Sunday,8.0
200901KD50071,554030,186980,0.220689,51.560618,1,3,2,1,03/03/2009,3,07:05,15,E09000016,5,0,6,30,3,2,6,0,0,0,1,1,2,4,0,1,1,E01002361,2025-12-09 07:05:00,7,2009-03-03,Tuesday,3.0
200901KD50073,558540,188440,0.286355,51.572486,1,3,2,1,25/02/2009,4,19:00,15,E09000016,3,127,3,50,1,4,3,127,0,0,4,1,1,4,0,2,2,E01002252,2025-12-09 19:00:00,19,,,
200901KD50074,554300,181530,0.222194,51.511577,1,3,3,5,24/02/2009,3,19:00,15,E09000016,3,1306,6,30,6,4,5,0,0,0,4,1,1,0,0,2,1,E01002344,2025-12-09 19:00:00,19,,,
200901KD50075,557270,190920,0.269155,51.595123,1,3,2,1,26/02/2009,5,15:30,15,E09000016,1,25,3,70,0,-1,-1,0,0,0,1,1,1,0,0,2,1,E01002296,2025-12-09 15:30:00,15,,,
200901KD50076,549830,188410,0.160754,51.574597,1,3,1,1,02/03/2009,2,16:10,15,E09000016,6,0,6,30,3,4,3,118,0,0,1,1,1,0,0,1,1,E01002246,2025-12-09 16:10:00,16,2009-02-03,Tuesday,2.0
200901KD50077,552930,192400,0.207192,51.609615,1,3,2,1,02/03/2009,2,20:00,15,E09000016,5,0,6,30,3,2,5,0,0,0,4,1,1,0,0,2,1,E01002313,2025-12-09 20:00:00,20,2009-02-03,Tuesday,2.0
200901KD50078,554700,191180,0.232196,51.59817,1,3,2,2,05/03/2009,5,23:30,15,E09000016,3,12,3,30,6,2,5,0,0,5,4,1,1,0,0,1,2,E01002299,2025-12-09 23:30:00,23,2009-05-03,Sunday,5.0
200901KD50079,553350,190540,0.21244,51.592789,1,3,2,1,06/03/2009,6,14:25,15,E09000016,3,118,1,30,1,4,3,127,0,0,1,1,1,0,0,1,2,E01002311,2025-12-09 14:25:00,14,2009-06-03,Wednesday,6.0
200901KD50080,550210,189160,0.166554,51.581235,1,3,2,1,04/03/2009,4,07:30,15,E09000016,6,0,6,30,3,4,6,0,0,5,1,1,1,0,0,1,2,E01002245,2025-12-09 07:30:00,7,2009-04-03,Friday,4.0
200901KD50082,552330,184890,0.195279,51.5423,1,3,1,1,02/03/2009,2,01:57,15,E09000016,6,0,6,30,3,4,6,0,0,0,4,1,1,0,0,1,2,E01002264,2025-12-09 01:57:00,1,2009-02-03,Tuesday,2.0
200901KD50083,551450,188150,0.184002,51.571828,1,3,2,2,21/02/2009,7,16:20,15,E09000016,5,0,3,30,6,2,5,0,0,5,1,1,1,0,0,1,1,E01002350,2025-12-09 16:20:00,16,,,
200901KD50085,557180,186690,0.265965,51.557144,1,3,1,1,13/03/2009,6,16:28,15,E09000016,4,187,1,30,2,4,5,0,0,0,1,1,1,0,0,1,1,E01002387,2025-12-09 16:28:00,16,,,
200901KD50086,550540,190030,0.171686,51.588964,1,2,2,1,14/03/2009,7,16:10,15,E09000016,4,174,6,30,3,4,4,174,0,0,1,1,1,0,0,1,2,E01002338,2025-12-09 16:10:00,16,,,
200901KD50087,550870,187910,0.175536,51.569827,1,3,1,1,14/03/2009,7,16:28,15,E09000016,5,0,6,30,0,-1,-1,0,0,0,1,1,1,0,0,1,1,E01002249,2025-12-09 16:28:00,16,,,
200901KD50088,553110,191730,0.209497,51.603546,1,3,2,1,13/03/2009,6,14:30,15,E09000016,5,0,6,30,3,4,6,0,0,0,1,1,1,0,0,1,2,E01002315,2025-12-09 14:30:00,14,,,
200901KD50089,554770,192050,0.233589,51.605968,1,3,2,2,15/03/2009,1,12:25,15,E09000016,5,0,6,30,3,4,6,0,0,0,1,1,1,0,0,1,1,E01002281,2025-12-09 12:25:00,12,,,
200901KD50090,551600,188860,0.186471,51.578167,1,3,1,1,13/03/2009,6,08:40,15,E09000016,6,0,6,30,0,-1,-1,0,0,4,1,1,1,0,0,1,2,E01002357,2025-12-09 08:40:00,8,,,
200901KD50092,555560,191320,0.244665,51.599191,1,3,2,1,07/02/2009,7,13:17,15,E09000016,6,0,6,30,0,-1,-1,0,0,0,1,1,1,0,0,1,2,E01002298,2025-12-09 13:17:00,13,2009-07-02,Thursday,7.0
200901KD50093,553770,191890,0.21909,51.604804,1,3,2,1,09/03/2009,2,09:00,15,E09000016,6,0,6,30,8,4,6,0,0,0,1,1,1,0,0,1,2,E01002282,2025-12-09 09:00:00,9,2009-09-03,Thursday,9.0
200901KD50095,553390,190550,0.213022,51.592868,1,3,2,1,11/03/2009,4,21:44,15,E09000016,3,12,1,30,1,4,5,0,0,0,4,1,1,0,0,1,1,E01002310,2025-12-09 21:44:00,21,2009-11-03,Tuesday,11.0
200901KD50096,557960,189420,0.278434,51.581454,1,3,2,1,10/03/2009,3,14:30,15,E09000016,1,25,3,70,0,-1,-1,0,0,0,1,1,1,0,0,2,2,E01002259,2025-12-09 14:30:00,14,2009-10-03,Saturday,10.0
200901KD50098,550750,190950,0.17511,51.597174,1,3,2,1,16/03/2009,2,20:20,15,E09000016,4,175,6,30,3,4,6,0,0,0,4,1,1,0,0,1,1,E01002333,2025-12-09 20:20:00,20,,,
200901KD50099,549750,191080,0.160739,51.598608,1,3,1,1,10/03/2009,3,15:00,15,E09000016,4,174,6,30,3,4,6,0,0,4,1,1,1,0,0,1,1,E01002326,2025-12-09 15:00:00,15,2009-10-03,Saturday,10.0
200901KD50100,554760,192550,0.233666,51.610463,1,3,2,1,23/03/2009,2,19:08,15,E09000016,6,0,6,30,3,4,6,0,0,0,4,1,1,0,0,1,1,E01002279,2025-12-09 19:08:00,19,,,
200901KD50101,550380,189490,0.169147,51.584155,1,3,1,1,18/03/2009,4,18:19,15,E09000016,3,12,3,50,3,4,6,0,0,0,1,1,1,0,0,1,1,E01002245,2025-12-09 18:19:00,18,,,
200901KD50103,552600,185880,0.199599,51.551123,1,3,1,1,20/03/2009,6,18:21,15,E09000016,5,0,6,30,0,-1,-1,0,0,0,1,1,1,0,0,1,1,E01002365,2025-12-09 18:21:00,18,,,
200901KD50104,551530,189170,0.185595,51.580972,1,3,1,1,22/03/2009,1,18:20,15,E09000016,3,118,6,30,0,-1,-1,0,0,0,4,1,1,0,0,1,1,E01002353,2025-12-09 18:20:00,18,,,
200901KD50105,557200,187270,0.266512,51.562349,1,3,1,1,13/03/2009,6,08:00,15,E09000016,5,0,6,30,3,4,6,0,0,0,1,1,1,0,0,1,2,E01002254,2025-12-09 08:00:00,8,,,
200901KD50106,557680,187680,0.273615,51.565899,1,2,2,2,22/03/2009,1,13:28,15,E09000016,6,0,6,30,6,4,6,0,0,0,1,1,1,0,0,1,1,E01002256,2025-12-09 13:28:00,13,,,
200901KD50107,552200,186850,0.194254,51.559946,1,3,2,1,24/03/2009,3,15:15,15,E09000016,6,0,6,30,0,-1,-1,0,0,0,1,1,1,0,0,1,2,E01002324,2025-12-09 15:15:00,15,,,
200901KD50108,556160,186550,0.251201,51.556169,1,3,2,1,27/03/2009,6,07:55,15,E09000016,4,187,6,30,3,4,6,0,0,0,1,1,1,0,0,1,1,E01002386,2025-12-09 07:55:00,7,,,
200901KD50109,556230,187370,0.252574,51.563517,1,3,2,1,20/03/2009,6,15:00,15,E09000016,5,0,6,30,3,4,6,0,0,0,1,1,1,0,0,1,1,E01002257,2025-12-09 15:00:00,15,,,
200901KD50111,558440,188320,0.28486,51.571436,1,3,2,1,14/03/2009,7,17:40,15,E09000016,1,25,1,30,1,4,3,127,0,0,4,1,1,0,0,2,1,E01002252,2025-12-09 17:40:00,17,,,
200901KD50112,553250,191220,0.211295,51.598926,1,3,2,2,20/03/2009,6,19:45,15,E09000016,5,0,6,30,3,4,6,0,0,0,4,1,1,0,0,1,1,E01002309,2025-12-09 19:45:00,19,,,
200901KD50113,558840,187340,0.290184,51.562519,1,3,2,1,14/03/2009,7,19:57,15,E09000016,1,25,3,70,0,-1,-1,0,0,0,4,1,1,0,0,2,1,E01002391,2025-12-09 19:57:00,19,,,
200901KD50114,553090,191870,0.20927,51.604809,1,3,2,1,28/03/2009,7,11:50,15,E09000016,5,0,1,30,2,4,5,0,0,1,1,1,1,0,0,1,1,E01002311,2025-12-09 11:50:00,11,,,
200901KD50115,550750,189920,0.174668,51.587919,1,3,2,1,18/03/2009,4,15:57,15,E09000016,3,12,3,40,0,-1,-1,0,0,0,1,1,1,0,0,1,1,E01002338,2025-12-09 15:57:00,15,,,
200901KD50117,551570,188030,0.185681,51.570718,1,3,1,1,03/03/2009,3,15:45,15,E09000016,5,0,6,30,0,-1,-1,0,0,0,1,1,1,0,0,1,1,E01002350,2025-12-09 15:45:00,15,2009-03-03,Tuesday,3.0
200901KD50118,554800,191760,0.233894,51.603354,1,3,2,1,12/03/2009,5,16:00,15,E09000016,6,0,6,30,3,4,6,0,0,0,1,1,1,0,0,1,2,E01002299,2025-12-09 16:00:00,16,2009-12-03,Thursday,12.0
200901KD50120,554020,190850,0.222241,51.595391,1,3,2,1,21/03/2009,7,10:29,15,E09000016,3,12,3,40,0,-1,-1,0,0,0,1,1,1,0,0,1,1,E01002293,2025-12-09 10:29:00,10,,,
200901KD50121,551900,186370,0.189722,51.555714,1,2,2,1,18/03/2009,4,11:10,15,E09000016,3,125,6,30,3,4,6,0,0,0,1,1,1,0,0,1,1,E01002322,2025-12-09 11:10:00,11,,,
200901KD50122,551730,185360,0.186836,51.546685,1,3,2,1,31/03/2009,3,19:55,15,E09000016,3,125,6,30,0,-1,-1,0,0,0,1,1,1,0,0,1,1,E01002260,2025-12-09 19:55:00,19,,,
200901KD50123,550920,187420,0.176047,51.565411,1,3,2,1,24/03/2009,3,07:45,15,E09000016,3,124,6,30,3,2,5,0,0,0,1,1,1,0,0,1,1,E01002248,2025-12-09 07:45:00,7,,,
200901KD50124,558550,188190,0.286387,51.570237,1,3,2,3,15/03/2009,1,17:04,15,E09000016,1,25,3,70,0,-1,-1,0,0,0,1,1,1,0,0,2,1,E01002252,2025-12-09 17:04:00,17,,,
200901KD50125,556270,186410,0.252724,51.554881,1,3,2,1,25/03/2009,4,11:15,15,E09000016,6,0,6,30,3,4,6,0,0,0,1,1,1,0,0,1,1,E01002387,2025-12-09 11:15:00,11,,,
200901KD50126,550620,189760,0.172725,51.586516,1,3,3,2,23/03/2009,2,20:30,15,E09000016,3,12,3,30,6,2,3,125,0,5,4,1,1,0,0,1,1,E01002338,2025-12-09 20:30:00,20,,,
200901KD50127,554540,180930,0.225387,51.50612,1,2,3,2,25/03/2009,4,17:12,15,E09000016,3,1306,6,40,3,4,4,1335,0,0,1,1,1,0,0,2,1,E01002344,2025-12-09 17:12:00,17,,,
200901KD50128,551740,189350,0.188702,51.582532,1,3,2,1,18/03/2009,4,15:55,15,E09000016,3,118,6,30,6,4,5,0,0,1,1,1,1,0,0,1,1,E01002354,2025-12-09 15:55:00,15,,,
200901KD50129,551660,188910,0.187358,51.5786,1,3,2,2,26/03/2009,5,14:35,15,E09000016,6,0,6,30,8,2,6,0,0,0,1,1,1,4,0,1,2,E01002357,2025-12-09 14:35:00,14,,,
200901KD50130,551000,189120,0.17793,51.580664,1,3,1,1,22/03/2009,1,21:20,15,E09000016,3,125,6,30,0,-1,-1,0,0,0,4,1,1,0,0,1,2,E01002243,2025-12-09 21:20:00,21,,,
200901KD50131,551690,181460,0.184581,51.511654,1,3,2,2,05/03/2009,5,09:30,15,E09000016,3,13,3,50,0,-1,-1,0,0,0,1,1,1,0,0,2,1,E01002344,2025-12-09 09:30:00,9,2009-05-03,Sunday,5.0
200901KD50132,559190,186270,0.294745,51.552807,1,2,2,2,09/04/2009,5,08:15,15,E09000016,4,186,6,30,0,-1,-1,0,0,0,1,1,1,0,0,2,1,E01002391,2025-12-09 08:15:00,8,2009-09-04,Friday,9.0
200901KD50133,554170,189910,0.223992,51.586905,1,3,1,1,13/04/2009,2,18:28,15,E09000016,3,127,3,30,6,2,5,0,0,5,1,1,1,0,0,1,1,E01002377,2025-12-09 18:28:00,18,,,
200901KD50134,556870,192360,0.264028,51.608172,1,3,2,1,31/03/2009,3,12:50,15,E09000016,3,12,1,30,1,4,1,25,0,0,1,2,2,0,0,2,2,E01002296,2025-12-09 12:50:00,12,,,
200901KD50135,555780,185840,0.24541,51.549895,1,3,1,1,01/04/2009,4,07:00,15,E09000016,6,0,6,30,0,-1,-1,0,0,4,1,1,1,0,0,1,1,E01002389,2025-12-09 07:00:00,7,2009-01-04,Sunday,1.0
200901KD50136,552500,189810,0.199862,51.58646,1,3,1,1,28/03/2009,7,15:50,15,E09000016,3,118,6,30,3,2,5,0,0,5,1,2,2,0,0,1,1,E01002379,2025-12-09 15:50:00,15,,,
200901KD50137,554370,191800,0.227708,51.603831,1,3,2,1,05/04/2009,1,11:12,15,E09000016,5,0,6,30,3,4,5,0,0,0,1,1,2,0,0,1,2,E01002299,2025-12-09 11:12:00,11,2009-05-04,Monday,5.0
200901KD50138,553780,188400,0.217706,51.573444,1,3,2,1,21/03/2009,7,00:15,15,E09000016,5,0,1,30,2,4,5,0,0,0,4,1,1,0,0,1,2,E01002274,2025-12-09 00:15:00,0,,,
200901KD50139,556210,189040,0.253028,51.578527,1,3,1,1,24/03/2009,3,10:20,15,E09000016,6,0,7,30,5,4,3,127,0,0,1,1,1,0,0,2,2,E01002296,2025-12-09 10:20:00,10,,,
200901KD50140,549420,190980,0.155935,51.597798,1,2,2,4,02/04/2009,5,14:55,15,E09000016,4,174,6,30,3,4,6,0,0,0,1,1,1,0,0,1,1,E01002325,2025-12-09 14:55:00,14,2009-02-04,Wednesday,2.0
200901KD50142,554680,180580,0.227249,51.502937,1,3,2,1,01/04/2009,4,17:32,15,E09000016,6,0,3,40,3,4,3,1306,0,0,1,1,1,0,0,2,1,E01002344,2025-12-09 17:32:00,17,2009-01-04,Sunday,1.0
200901KD50143,558690,186290,0.287548,51.553128,1,2,2,1,03/04/2009,6,11:27,15,E09000016,1,25,3,70,0,-1,-1,0,0,0,1,1,1,0,0,2,2,E01002391,2025-12-09 11:27:00,11,2009-03-04,Wednesday,3.0
200901KD50144,553910,189190,0.219927,51.580507,1,2,2,1,02/04/2009,5,13:32,15,E09000016,5,0,1,30,2,4,6,0,0,0,1,1,1,0,0,1,1,E01002377,2025-12-09 13:32:00,13,2009-02-04,Wednesday,2.0
200901KD50146,554040,192800,0.223385,51.612906,1,3,1,1,30/03/2009,2,09:25,15,E09000016,6,0,6,30,3,4,6,0,0,0,1,1,1,0,0,2,1,E01002276,2025-12-09 09:25:00,9,,,
200901KD50148,554080,192140,0.223673,51.606965,1,2,1,2,03/04/2009,6,18:46,15,E09000016,5,0,6,30,0,-1,-1,0,0,1,1,1,1,0,0,1,1,E01002282,2025-12-09 18:46:00,18,2009-03-04,Wednesday,3.0
200901KD50149,553800,185520,0.216736,51.547563,1,3,3,1,10/04/2009,6,16:30,15,E09000016,5,0,6,30,8,4,6,0,0,1,1,1,1,0,0,1,1,E01002285,2025-12-09 16:30:00,16,2009-10-04,Sunday,10.0
200901KD50150,554760,190500,0.232762,51.592044,1,3,1,1,04/04/2009,7,18:00,15,E09000016,5,0,6,30,3,2,6,0,0,5,1,1,1,0,0,1,2,E01002293,2025-12-09 18:00:00,18,2009-04-04,Saturday,4.0
200901KD50151,549380,190970,0.155354,51.597718,1,3,2,1,07/04/2009,3,21:00,15,E09000016,4,174,6,30,8,4,5,0,0,1,1,1,1,0,0,1,1,E01002325,2025-12-09 21:00:00,21,2009-07-04,Saturday,7.0
200901KD50152,558520,188380,0.28604,51.571953,1,3,2,1,03/04/2009,6,10:29,15,E09000016,1,25,1,30,1,4,3,127,0,0,1,1,1,0,0,2,2,E01002252,2025-12-09 10:29:00,10,2009-03-04,Wednesday,3.0
200901KD50153,550620,182950,0.16981,51.525328,1,3,2,2,18/04/2009,7,17:00,15,E09000016,3,1306,3,30,3,2,5,0,0,5,1,1,1,0,0,1,1,E01002368,2025-12-09 17:00:00,17,,,
200901KD50154,553900,185960,0.218369,51.551489,1,3,4,1,21/03/2009,7,14:32,15,E09000016,5,0,6,30,6,4,6,0,0,0,1,1,1,0,0,1,1,E01002285,2025-12-09 14:32:00,14,,,
200901KD50155,550940,188610,0.176846,51.576098,1,3,1,1,11/04/2009,7,11:42,15,E09000016,3,118,6,30,1,4,3,118,0,7,1,1,1,0,0,1,1,E01002247,2025-12-09 11:42:00,11,2009-11-04,Wednesday,11.0
200901KD50156,552000,182600,0.189536,51.521814,1,3,2,2,18/04/2009,7,13:20,15,E09000016,3,1306,3,30,1,4,3,125,0,0,1,1,1,0,0,1,2,E01002370,2025-12-09 13:20:00,13,,,
200901KD50158,552180,182220,0.191965,51.518351,1,3,2,1,17/04/2009,6,23:50,15,E09000016,5,0,6,30,0,-1,-1,0,0,0,4,1,1,0,0,1,2,E01002345,2025-12-09 23:50:00,23,,,
200901KD50159,554470,189680,0.228218,51.584756,1,3,2,3,19/04/2009,1,13:44,15,E09000016,3,127,3,40,3,4,6,0,0,0,1,1,1,0,0,1,1,E01002378,2025-12-09 13:44:00,13,,,
200901KD50160,553200,190340,0.210189,51.591033,1,3,2,1,18/04/2009,7,14:00,15,E09000016,3,118,6,30,3,2,5,0,0,5,1,1,1,0,0,1,2,E01002383,2025-12-09 14:00:00,14,,,
200901KD50161,558530,188530,0.286252,51.573297,1,3,2,1,04/04/2009,7,17:30,15,E09000016,1,25,1,30,1,4,3,127,0,0,1,1,1,0,0,2,2,E01002252,2025-12-09 17:30:00,17,2009-04-04,Saturday,4.0
200901KD50163,550000,189470,0.163658,51.584076,1,3,2,1,20/04/2009,2,14:00,15,E09000016,5,0,6,30,8,4,6,0,0,0,1,1,1,0,0,1,2,E01002329,2025-12-09 14:00:00,14,,,
200901KD50164,553340,190520,0.212287,51.592612,1,2,2,2,14/04/2009,3,17:23,15,E09000016,3,12,1,30,1,4,3,12,0,0,1,1,1,0,0,1,2,E01002337,2025-12-09 17:23:00,17,,,
200901KD50166,550630,189620,0.172809,51.585256,1,3,2,1,15/04/2009,4,21:15,15,E09000016,3,125,6,50,0,-1,-1,0,0,0,4,1,1,0,0,1,1,E01002245,2025-12-09 21:15:00,21,,,
200901KD50167,555880,185720,0.246798,51.548789,1,2,2,1,28/04/2009,3,13:25,15,E09000016,4,1421,6,30,3,4,6,0,0,0,1,1,1,0,0,1,1,E01002389,2025-12-09 13:25:00,13,,,
200901KD50168,551670,188520,0.187334,51.575094,1,3,3,3,14/04/2009,3,11:40,15,E09000016,5,0,6,30,6,2,5,0,0,0,1,1,1,1,0,1,1,E01002358,2025-12-09 11:40:00,11,,,
200901KD50169,551210,188070,0.180507,51.571174,1,3,2,1,02/04/2009,5,11:33,15,E09000016,6,0,1,30,1,4,3,125,0,7,1,1,1,0,0,1,1,E01002249,2025-12-09 11:33:00,11,2009-02-04,Wednesday,2.0
200901KD50170,554410,191740,0.228258,51.603281,1,3,2,1,05/04/2009,1,14:30,15,E09000016,5,0,6,30,3,4,6,0,0,1,1,1,1,0,0,1,2,E01002299,2025-12-09 14:30:00,14,2009-05-04,Monday,5.0
200901KD50171,550620,182910,0.169793,51.524968,1,3,2,2,27/04/2009,2,08:10,15,E09000016,5,0,6,30,3,2,3,1306,0,0,1,1,1,0,0,1,1,E01002368,2025-12-09 08:10:00,8,,,
200901KD50172,550080,189250,0.164718,51.582078,1,3,2,1,16/04/2009,5,13:49,15,E09000016,5,0,6,30,3,4,6,0,0,0,1,5,2,0,0,1,1,E01002330,2025-12-09 13:49:00,13,,,
200901KD50174,552660,185580,0.200333,51.548411,1,3,1,1,18/04/2009,7,15:25,15,E09000016,5,0,6,30,3,4,6,0,0,0,1,1,1,0,0,1,1,E01002287,2025-12-09 15:25:00,15,,,
200901KD50175,550540,183310,0.168811,51.528584,1,3,1,1,20/04/2009,2,12:04,15,E09000016,6,0,6,30,3,4,6,0,0,0,1,1,1,0,0,1,1,E01002368,2025-12-09 12:04:00,12,,,
200901KD50176,551440,188150,0.183858,51.571831,1,3,2,1,26/04/2009,1,13:30,15,E09000016,5,0,3,30,6,2,5,0,0,0,1,1,1,0,0,1,1,E01002350,2025-12-09 13:30:00,13,,,
200901KD50177,554020,186520,0.220344,51.556487,1,3,2,2,09/04/2009,5,14:59,15,E09000016,3,124,6,30,3,4,5,0,0,0,1,8,1,0,0,1,1,E01002291,2025-12-09 14:59:00,14,2009-09-04,Friday,9.0
200901KD50178,549680,192210,0.160211,51.60878,1,3,2,1,23/04/2009,5,20:20,15,E09000016,6,0,6,30,3,4,6,0,0,0,1,1,1,0,0,1,1,E01002305,2025-12-09 20:20:00,20,,,
200901KD50179,551430,188390,0.183817,51.57399,1,3,2,1,01/05/2009,6,22:08,15,E09000016,5,0,6,30,6,4,5,0,0,1,4,1,1,0,0,1,1,E01002356,2025-12-09 22:08:00,22,2009-01-05,Monday,1.0
200901KD50180,551860,189440,0.190471,51.583309,1,3,2,1,03/05/2009,1,10:34,15,E09000016,6,0,6,30,3,4,3,118,0,0,1,1,1,0,0,1,1,E01002353,2025-12-09 10:34:00,10,2009-03-05,Thursday,3.0
200901KD50181,556650,186700,0.25833,51.557381,1,3,2,2,30/04/2009,5,19:10,15,E09000016,4,187,6,30,3,4,6,0,0,1,1,1,1,0,0,1,1,E01002384,2025-12-09 19:10:00,19,,,
200901KD50182,553310,188630,0.21103,51.575639,1,3,3,3,25/04/2009,7,18:48,15,E09000016,5,0,6,30,3,4,6,0,0,0,1,1,1,0,0,1,1,E01002381,2025-12-09 18:48:00,18,,,
200901KD50183,550530,189660,0.171384,51.585642,1,3,4,1,29/04/2009,4,12:36,15,E09000016,3,12,3,60,3,4,6,0,0,0,1,1,1,0,0,1,1,E01002328,2025-12-09 12:36:00,12,,,
200901KD50184,557220,187550,0.266926,51.564859,1,3,2,1,22/04/2009,4,13:35,15,E09000016,5,0,6,30,3,4,6,0,0,0,1,1,1,0,0,1,1,E01002254,2025-12-09 13:35:00,13,,,
200901KD50185,553780,188400,0.217706,51.573444,1,3,2,1,23/04/2009,5,06:25,15,E09000016,5,0,1,30,2,4,5,0,0,0,1,1,1,0,0,1,1,E01002274,2025-12-09 06:25:00,6,,,
200901KD50186,553830,190720,0.219443,51.594275,1,3,2,1,02/05/2009,7,16:50,15,E09000016,3,12,6,30,3,4,6,0,0,0,1,1,1,0,0,1,2,E01002293,2025-12-09 16:50:00,16,2009-02-05,Thursday,2.0
200901KD50187,551330,182710,0.179934,51.522982,1,2,2,1,01/05/2009,6,13:26,15,E09000016,3,1306,3,30,8,4,6,0,0,7,1,1,1,0,0,1,1,E01002370,2025-12-09 13:26:00,13,2009-01-05,Monday,1.0
200901KD50188,554940,186870,0.233758,51.55938,1,3,2,1,06/05/2009,4,15:10,15,E09000016,3,124,6,30,3,4,6,0,0,0,1,1,1,0,0,1,1,E01002362,2025-12-09 15:10:00,15,2009-06-05,Friday,6.0
200901KD50189,551620,181450,0.183569,51.511583,1,3,2,2,05/05/2009,3,21:00,15,E09000016,5,0,1,30,1,4,3,13,0,0,4,1,1,0,0,2,1,E01002344,2025-12-09 21:00:00,21,2009-05-05,Tuesday,5.0
200901KD50190,553390,190550,0.213022,51.592868,1,3,2,1,29/04/2009,4,18:05,15,E09000016,3,12,1,30,1,4,5,0,0,0,1,1,1,0,0,1,1,E01002310,2025-12-09 18:05:00,18,,,
200901KD50192,553770,185460,0.216277,51.547032,1,3,1,1,27/04/2009,2,16:30,15,E09000016,5,0,6,30,3,4,6,0,0,1,1,1,1,0,0,1,1,E01002288,2025-12-09 16:30:00,16,,,
200901KD50193,553210,180840,0.206199,51.505673,1,3,1,1,25/04/2009,7,16:58,15,E09000016,3,13,3,70,0,-1,-1,0,0,0,1,1,1,0,0,2,1,E01002344,2025-12-09 16:58:00,16,,,
200901KD50194,552340,184400,0.195211,51.537895,1,3,2,1,05/05/2009,3,18:09,15,E09000016,6,0,6,30,3,4,6,0,0,0,1,1,1,0,0,1,1,E01002372,2025-12-09 18:09:00,18,2009-05-05,Tuesday,5.0
200901KD50195,555050,186840,0.23533,51.559081,1,3,1,1,27/04/2009,2,20:10,15,E09000016,3,124,6,30,3,4,6,0,0,4,4,1,1,0,0,1,1,E01002362,2025-12-09 20:10:00,20,,,
200901KD50196,553920,192260,0.221417,51.608087,1,3,1,1,05/05/2009,3,09:16,15,E09000016,5,0,6,30,3,4,6,0,0,0,1,1,1,0,0,1,1,E01002280,2025-12-09 09:16:00,9,2009-05-05,Tuesday,5.0
